index,url,valid,domain,title,description,image,published,archive,content,quote,language,keyword
https://www.handelsblatt.com/unternehmen/handel-konsumgueter/energiekrise-lambertz-inhaber-buehlbecker-ohne-erdgas-wuerde-es-nicht-lang-bis-zur-insolvenz-dauern/28857438.html,https://www.handelsblatt.com/unternehmen/handel-konsumgueter/energiekrise-lambertz-inhaber-buehlbecker-ohne-erdgas-wuerde-es-nicht-lang-bis-zur-insolvenz-dauern/28857438.html,0,www.handelsblatt.com,Energiekrise: Lambertz-Inhaber Bühlbecker: Ohne Erdgas würde es nicht lang bis zur Insolvenz dauern,"Alle Werke des Gebäckunternehmers sind ausgelastet – und doch sorgt er sich um das Ergebnis. Hermann Bühlbecker erklärt, warum er Angst vor Gasmangel hat und doch nicht auf Öl umstellt.",https://www.handelsblatt.com/images/hermann-buehlbecker/28857562/4-format2003.jpg,2022-12-11T13:03:25Z,https://web.archive.org/web/20221211150327/https://www.handelsblatt.com/unternehmen/handel-konsumgueter/energiekrise-lambertz-inhaber-buehlbecker-ohne-erdgas-wuerde-es-nicht-lang-bis-zur-insolvenz-dauern/28857438.html,"Hermann BühlbeckerDer Alleininhaber der Lambertz-Gruppe steuert das Traditionsunternehmen von 1688 durch schwierige Zeiten: Uns hat buchstäblich ein Kosten-Tsunami überrollt. 
(Foto:  Lambertz) 
Dü… [+1069 chars]",,de,'Gasmangel'
https://www.tagesspiegel.de/politik/ampel-bessert-nach-union-macht-druck-das-ist-der-stand-bei-den-geplanten-energiepreisbremsen-9012535.html,https://www.tagesspiegel.de/politik/ampel-bessert-nach-union-macht-druck-das-ist-der-stand-bei-den-geplanten-energiepreisbremsen-9012535.html,0,www.tagesspiegel.de,"Ampel bessert nach, Union macht Druck: Das ist der Stand bei den geplanten Energiepreisbremsen","Am Donnerstag stimmt der Bundestag ab, zur Entlastung von den hohen Strom- und Gaspreisen sind aber noch viele Details offen. Die Gespräche laufen.",https://www.tagesspiegel.de/berlin/images/imago0170785244hjpg/alternates/BASE_16_9_W1400/imago0170785244hjpg.jpeg,2022-12-11T13:52:38Z,https://web.archive.org/web/20221211145828/https://www.tagesspiegel.de/politik/ampel-bessert-nach-union-macht-druck-das-ist-der-stand-bei-den-geplanten-energiepreisbremsen-9012535.html,"Vor der Abstimmung über die Energiepreis-Entlastungen am Donnerstag im Bundestag hat die Regierungskoalition am Wochenende über weitreichende Korrekturen am vorliegenden Gesetzentwurf beraten. 
Wir … [+2859 chars]",,de,'Energie'
https://www.tagesspiegel.de/politik/energiepreisbremsen-ampel-bessert-nach-union-macht-druck-9012535.html,https://www.tagesspiegel.de/politik/energiepreisbremsen-ampel-bessert-nach-union-macht-druck-9012535.html,0,www.tagesspiegel.de,"Energiepreisbremsen: Ampel bessert nach, Union macht Druck","Am Donnerstag stimmt der Bundestag ab, zur Entlastung von den hohen Strom- und Gaspreisen sind aber noch viele Details offen – die Gespräche laufen.",https://www.tagesspiegel.de/berlin/images/imago0170785244hjpg/alternates/BASE_16_9_W1400/imago0170785244hjpg.jpeg,2022-12-11T13:52:38Z,https://web.archive.org/web/20221211150240/https://www.tagesspiegel.de/politik/energiepreisbremsen-ampel-bessert-nach-union-macht-druck-9012535.html,Vor der Abstimmung über die Energiepreis-Entlastungen am Donnerstag im Bundestag hat die Regierungskoalition am Wochenende über weitreichende Korrekturen am vorliegenden Gesetzentwurf beraten. Wir ar… [+2857 chars],,de,'Gas'
https://www.n-tv.de/politik/Ukrainer-nehmen-Melitopol-ins-Visier-article23776703.html,https://www.n-tv.de/politik/Ukrainer-nehmen-Melitopol-ins-Visier-article23776703.html,0,www.n-tv.de,"Kiew: Dutzende ""Invasoren"" tot: Ukrainer nehmen Melitopol ins Visier","Die Ukraine verstärkt ihre Angriffe auf Melitopol. Schließlich ist die Stadt strategisch wichtig. ""Wenn Melitopol fällt, bricht die gesamte Verteidigungslinie bis nach Cherson zusammen"", so Präsidentenberater Arestowytsch. ""Die ukrainischen Streitkräfte erhal…",https://bilder4.n-tv.de/img/incoming/crop23776683/0421327791-cImg_16_9-w1200/53ded22c161cfafd2fa0133e1e82651b.jpg,2022-12-11T14:08:37Z,https://web.archive.org/web/20221211151313/https://www.n-tv.de/politik/Ukrainer-nehmen-Melitopol-ins-Visier-article23776703.html,"Die Ukraine verstärkt ihre Angriffe auf Melitopol. Schließlich ist die Stadt strategisch wichtig. ""Wenn Melitopol fällt, bricht die gesamte Verteidigungslinie bis nach Cherson zusammen"", so Präsident… [+2133 chars]",,de,'Ukraine'
https://www.welt.de/kultur/article242624111/35-Europaeischer-Filmpreis-Triangle-of-Sadness-als-grosser-Gewinner.html,https://www.welt.de/kultur/article242624111/35-Europaeischer-Filmpreis-Triangle-of-Sadness-als-grosser-Gewinner.html,0,www.welt.de,Europas Kino braucht einen „Marshall-Plan“,Am Wochenende wurde in Reykjavik der 35. Europäische Filmpreis gefeiert. Doch die Festivitäten hatten einen bitteren Beigeschmack; die hiesige Industrie droht in Hollywoods Übermacht unterzugehen. Welche Institution sie jetzt noch retten kann.,https://img.welt.de/img/kultur/mobile242627095/4651353807-ci16x9-w1200/Swedish-filmmaker-Ruben-Ostlund-4R.jpg,2022-12-11T14:29:52Z,,"Nehmen wir einmal an, Manuel Neuer hätte bei der WM einen Elfmeter von Lionel Messi gehalten. Das ist unwahrscheinlich, Neuer ist kein Elfertöter und Messi kein -versieber, und außerdem ist Neuer vie… [+9763 chars]",,de,'Industrie'
https://www.tagesschau.de/ausland/europa/erdogan-putin-telefonat-101.html,https://www.tagesschau.de/ausland/europa/erdogan-putin-telefonat-101.html,0,www.tagesschau.de,Telefonat mit Putin: Erdogan will Getreideabkommen ausweiten,"Der türkische Präsident Erdogan hat mit Kremlchef Putin darüber gesprochen, das Getreideabkommen zum Export über das Schwarze Meer auch auf andere Waren auszuweiten. Außerdem forderte er einen Sicherheitskorridor an der Grenze seines Landes zu Syrien.",https://www.tagesschau.de/multimedia/bilder/erdogan-1033~_v-original.jpg,2022-12-11T14:45:20Z,https://web.archive.org/web/20221211155646/https://www.tagesschau.de/ausland/europa/erdogan-putin-telefonat-101.html,"Der türkische Präsident Erdogan hat mit Kremlchef Putin darüber gesprochen, das Getreideabkommen zum Export über das Schwarze Meer auch auf andere Waren auszuweiten. Außerdem forderte er einen Sicher… [+1844 chars]",,de,'Wladimir Putin'
https://www.bild.de/bild-plus/geld/wirtschaft/politik-inland/verband-legt-drei-szenarien-vor-bei-diesen-temperaturen-droht-der-gasmangel-82217374.bild.html,https://www.bild.de/bild-plus/geld/wirtschaft/politik-inland/verband-legt-drei-szenarien-vor-bei-diesen-temperaturen-droht-der-gasmangel-82217374.bild.html,0,www.bild.de,*** BILDplus Inhalt *** Verband legt drei Kälte-Szenarien vor - Bei DIESEN Temperaturen droht uns der Gasmangel,Es gibt drei Szenarien für den Winter. In einem kommen wir sehr schlecht weg.Foto: Axel Heimken/dpa,"https://images.bild.de/6395a53882c17278ce2f0d4b/710c56d849a301ee6ff3d17efda0c178,286ec036?w=1280",2022-12-11T16:09:22Z,https://web.archive.org/web/20221211173418/https://www.bild.de/bild-plus/geld/wirtschaft/politik-inland/verband-legt-drei-szenarien-vor-bei-diesen-temperaturen-droht-der-gasmangel-82217374.bild.html,"Seit dem Beginn von Russlands Angriffskrieg gegen die Ukraine zittert Europa und vor allem Deutschland vor dem Winter. Die Angst vor einer Gas-Mangellage ist groß.
Der Gasspeicher-Verband hat jetzt … [+234 chars]",,de,'Gasmangel'
https://www.sueddeutsche.de/muenchen/wolfratshausen/diakonie-oberland-waermewinter-energiekrise-inflation-1.5713292,https://www.sueddeutsche.de/muenchen/wolfratshausen/diakonie-oberland-waermewinter-energiekrise-inflation-1.5713292,0,www.sueddeutsche.de,"Diakonie Oberland: Mit ""Wärmewinter"" gegen Armut und Kälte","Die Diakonie Oberland und die Kirchliche Allgemeine Sozialarbeit rufen mit einer Solidaritätsaktion zu Spenden für Menschen auf, die unter der Energiekrise und der Inflation besonders stark leiden.",https://www.sueddeutsche.de/image/sz.1.5713293/1200x675?v=1670775091,2022-12-11T16:09:55Z,https://web.archive.org/web/20221211201319/https://www.sueddeutsche.de/muenchen/wolfratshausen/diakonie-oberland-waermewinter-energiekrise-inflation-1.5713292,"Die Diakonie Oberland und die Kirchliche Allgemeine Sozialarbeit rufen mit einer Solidaritätsaktion zu Spenden für Menschen auf, die unter der Energiekrise und der Inflation besonders stark leiden.We… [+4832 chars]",,de,'Energie'
https://www.tagesspiegel.de/politik/kanzler-eroffnet-rentendebatte-olaf-scholz-uberlegungen-gehen-in-die-richtige-richtung-9012793.html,https://www.tagesspiegel.de/politik/kanzler-eroffnet-rentendebatte-olaf-scholz-uberlegungen-gehen-in-die-richtige-richtung-9012793.html,0,www.tagesspiegel.de,Kanzler eröffnet Rentendebatte: „Olaf Scholz‘ Überlegungen gehen in die richtige Richtung“,"Der Bundeskanzler erklärt, dass mehr Menschen auch wirklich bis zur Regelaltersgrenze arbeiten sollen. In der Ampel regt sich Widerspruch, die Union fordert Anpassungen.",https://www.tagesspiegel.de/images/scholzjpg13/alternates/BASE_16_9_W1400/scholzjpg.jpeg,2022-12-11T16:36:51Z,https://web.archive.org/web/20221211210629/https://www.tagesspiegel.de/politik/kanzler-eroffnet-rentendebatte-olaf-scholz-uberlegungen-gehen-in-die-richtige-richtung-9012793.html,"In Deutschland sollen weniger Menschen frühzeitig aus dem Arbeitsleben ausscheiden dieses Ziel hat Kanzler Olaf Scholz (SPD) ausgegeben. Es gilt, den Anteil derer zu steigern, die wirklich bis zum Re… [+2968 chars]",,de,'Olaf Scholz'
https://www.tagesschau.de/inland/innenpolitik/waffenlieferungen-ukraine-123.html,https://www.tagesschau.de/inland/innenpolitik/waffenlieferungen-ukraine-123.html,0,www.tagesschau.de,Ukrainischer Außenminister: Keine Zusage zu deutschen Panzern,"Die Ukraine bekommt weitere deutsche Waffen - nur welche? Kampfpanzer seien - zumindest bis jetzt - nicht darunter, sagte der ukrainische Außenminister Kuleba im <em>Bericht aus Berlin. </em>Klare Worte richtete er an die Kritiker der ukrainischen Militärstra…",https://www.tagesschau.de/multimedia/bilder/kuleba-113~_v-original.jpg,2022-12-11T17:26:38Z,https://web.archive.org/web/20221211180910/https://www.tagesschau.de/inland/innenpolitik/waffenlieferungen-ukraine-123.html,"Die Ukraine bekommt weitere deutsche Waffen - nur welche? Kampfpanzer seien - zumindest bis jetzt - nicht darunter, sagte der ukrainische Außenminister Kuleba im Bericht aus Berlin. Klare Worte richt… [+3432 chars]",,de,'Ukraine'
https://www.n-tv.de/politik/13-07-Keine-qualitativen-Neuerungen-bei-deutschen-Waffenlieferungen-an-die-Ukraine--article23143824.html,https://www.n-tv.de/politik/13-07-Keine-qualitativen-Neuerungen-bei-deutschen-Waffenlieferungen-an-die-Ukraine--article23143824.html,0,www.n-tv.de,"Ukraine-Krieg im Liveticker: +++ 13:07 ""Keine qualitativen Neuerungen"" bei deutschen Waffenlieferungen an die Ukraine +++","Berlin, Washington, Br\u00fcssel - \u00fcberall. n-tv berichtet von allen wichtigen Schaupl\u00e4tzen der Innen- und Au\u00dfenpolitik.",https://bilder2.n-tv.de/img/incoming/crop23332537/9041326157-cImg_16_9-w1200/Liveticker1-grau-1-Kopie.jpg,2022-12-11T23:13:00Z,https://web.archive.org/web/20221212135710/https://www.n-tv.de/politik/13-07-Keine-qualitativen-Neuerungen-bei-deutschen-Waffenlieferungen-an-die-Ukraine--article23143824.html,"Deutschland hat der Ukraine weitere Waffenlieferungen zugesagt - allerdings nur im bisherigen Rahmen. Es gebe ""keine qualitativen Neuerungen"", sondern ausschließlich Lieferungen ""entlang dessen, was … [+16807 chars]",,de,'Krieg'
https://www.n-tv.de/politik/11-45-Gerashchenko-Ukrainische-Botschaft-in-Athen-erhaelt-Paket-mit-Blutflecken--article23143824.html,https://www.n-tv.de/politik/11-45-Gerashchenko-Ukrainische-Botschaft-in-Athen-erhaelt-Paket-mit-Blutflecken--article23143824.html,0,www.n-tv.de,Ukraine-Krieg im Liveticker: +++ 11:45 Gerashchenko: Ukrainische Botschaft in Athen erhält Paket mit Blutflecken +++,"Berlin, Washington, Br\u00fcssel - \u00fcberall. n-tv berichtet von allen wichtigen Schaupl\u00e4tzen der Innen- und Au\u00dfenpolitik.",https://bilder2.n-tv.de/img/incoming/crop23332537/9041326157-cImg_16_9-w1200/Liveticker1-grau-1-Kopie.jpg,2022-12-11T23:13:00Z,https://web.archive.org/web/20221212131453/https://www.n-tv.de/politik/11-45-Gerashchenko-Ukrainische-Botschaft-in-Athen-erhaelt-Paket-mit-Blutflecken--article23143824.html,"Die ukrainische Botschaft in Griechenland hat ein mit Blut beschmiertes Paket erhalten. Das berichtet der Berater des ukrainischen Innenministeriums, Anton Gerashchenko, bei Twitter. Demnach gab der … [+14544 chars]",,de,'Saporischschja'
https://www.n-tv.de/politik/19-55-Norwegische-Fluechtlingshilfe-erwartet-Hunderttausende-Ukrainer-in-Europa--article23143824.html,https://www.n-tv.de/politik/19-55-Norwegische-Fluechtlingshilfe-erwartet-Hunderttausende-Ukrainer-in-Europa--article23143824.html,0,www.n-tv.de,Ukraine-Krieg im Liveticker: +++ 19:55 Norwegische Flüchtlingshilfe erwartet Hunderttausende Ukrainer in Europa +++,"Berlin, Washington, Br\u00fcssel - \u00fcberall. n-tv berichtet von allen wichtigen Schaupl\u00e4tzen der Innen- und Au\u00dfenpolitik.",https://bilder2.n-tv.de/img/incoming/crop23332537/9041326157-cImg_16_9-w1200/Liveticker1-grau-1-Kopie.jpg,2022-12-11T23:13:00Z,,"In diesem Winter werden nach Darstellung des Chefs der Norwegischen Flüchtlingshilfe Hunderttausende weitere Menschen aus der Ukraine in Europa Zuflucht suchen. ""Niemand weiß wie viele es sein werden… [+29335 chars]",,de,'Krieg'
https://www.n-tv.de/politik/15-08-EU-stockt-Militaerhilfe-um-zwei-Milliarden-Euro-auf--article23143824.html,https://www.n-tv.de/politik/15-08-EU-stockt-Militaerhilfe-um-zwei-Milliarden-Euro-auf--article23143824.html,0,www.n-tv.de,Ukraine-Krieg im Liveticker: +++ 14:44 Russen verurteilen Mann wegen Bericht über Traum von Selenskyj +++,"Berlin, Washington, Br\u00fcssel - \u00fcberall. n-tv berichtet von allen wichtigen Schaupl\u00e4tzen der Innen- und Au\u00dfenpolitik.",https://bilder2.n-tv.de/img/incoming/crop23332537/9041326157-cImg_16_9-w1200/Liveticker1-grau-1-Kopie.jpg,2022-12-11T23:13:00Z,https://web.archive.org/web/20221212145358/https://www.n-tv.de/politik/15-08-EU-stockt-Militaerhilfe-um-zwei-Milliarden-Euro-auf--article23143824.html,"Die Europäische Union stockt ihre Militärhilfe für die Ukraine weiter auf: Die EU-Außenminister verständigen sich auf zusätzliche zwei Milliarden Euro für das kommende Jahr, wie der Außenbeauftragte … [+20364 chars]",,de,'Ukraine'
https://www.n-tv.de/politik/07-50-London-Russland-wird-Kontrolle-ueber-Donezk-wahrscheinlich-nicht-ausweiten-koennen--article23143824.html,https://www.n-tv.de/politik/07-50-London-Russland-wird-Kontrolle-ueber-Donezk-wahrscheinlich-nicht-ausweiten-koennen--article23143824.html,0,www.n-tv.de,Ukraine-Krieg im Liveticker: +++ 07:50 London: Russland wird Kontrolle über Donezk wahrscheinlich nicht ausweiten können +++,"Berlin, Washington, Br\u00fcssel - \u00fcberall. n-tv berichtet von allen wichtigen Schaupl\u00e4tzen der Innen- und Au\u00dfenpolitik.",https://bilder2.n-tv.de/img/incoming/crop23332537/9041326157-cImg_16_9-w1200/Liveticker1-grau-1-Kopie.jpg,2022-12-11T23:13:00Z,https://web.archive.org/web/20221212115506/https://www.n-tv.de/politik/07-50-London-Russland-wird-Kontrolle-ueber-Donezk-wahrscheinlich-nicht-ausweiten-koennen--article23143824.html,"Russland strebt nach Einschätzung britischer Experten wahrscheinlich immer noch danach, die Kontrolle über die Regionen Donezk, Luhansk, Saporischschja und Cherson auszudehnen. Das geht aus dem tägli… [+9539 chars]",,de,'Krieg'
https://www.n-tv.de/politik/09-25-EU-Aussenbeauftragter-Borrell-Noch-keine-Einigung-bei-neuem-Sanktionspaket--article23143824.html,https://www.n-tv.de/politik/09-25-EU-Aussenbeauftragter-Borrell-Noch-keine-Einigung-bei-neuem-Sanktionspaket--article23143824.html,0,www.n-tv.de,Ukraine-Krieg im Liveticker: +++ 09:25 EU-Außenbeauftragter Borrell: Noch keine Einigung bei neuem Sanktionspaket +++,"Berlin, Washington, Br\u00fcssel - \u00fcberall. n-tv berichtet von allen wichtigen Schaupl\u00e4tzen der Innen- und Au\u00dfenpolitik.",https://bilder2.n-tv.de/img/incoming/crop23332537/9041326157-cImg_16_9-w1200/Liveticker1-grau-1-Kopie.jpg,2022-12-11T23:13:00Z,https://web.archive.org/web/20221212193439/https://www.n-tv.de/politik/09-25-EU-Aussenbeauftragter-Borrell-Noch-keine-Einigung-bei-neuem-Sanktionspaket--article23143824.html,"Die EU-Mitgliedsländer haben sich noch nicht auf ein neuntes Sanktionspaket für Russland geeinigt. Es gebe noch offene Fragen, sagt der EU-Außenbeauftragte Josep Borrell vor einem Treffen der EU-Auße… [+11897 chars]",,de,'Krieg'
https://www.n-tv.de/politik/20-13-Bericht-Russland-attackiert-Ukraine-mit-von-ihr-hergestellten-Flugkoerpern--article23143824.html,https://www.n-tv.de/politik/20-13-Bericht-Russland-attackiert-Ukraine-mit-von-ihr-hergestellten-Flugkoerpern--article23143824.html,0,www.n-tv.de,Ukraine-Krieg im Liveticker: +++ 20:13 Bericht: Russland attackiert Ukraine mit von ihr hergestellten Flugkörpern +++,"Berlin, Washington, Br\u00fcssel - \u00fcberall. n-tv berichtet von allen wichtigen Schaupl\u00e4tzen der Innen- und Au\u00dfenpolitik.",https://bilder2.n-tv.de/img/incoming/crop23332537/9041326157-cImg_16_9-w1200/Liveticker1-grau-1-Kopie.jpg,2022-12-11T23:13:00Z,https://web.archive.org/web/20221212210314/https://www.n-tv.de/politik/20-13-Bericht-Russland-attackiert-Ukraine-mit-von-ihr-hergestellten-Flugkoerpern--article23143824.html,"Die Truppen des Kremls greifen die Ukraine mit von ihr hergestellten Luft-Boden-Marschflugkörpern vom Typ Ch-55 an, berichtet die ""New York Times"". Dabei beruft sie sich auf Angaben von Vadym Skibits… [+30192 chars]",,de,'Krieg'
https://www.n-tv.de/politik/16-09-Russland-will-seine-Nukleardoktrin-nicht-so-schnell-aendern--article23143824.html,https://www.n-tv.de/politik/16-09-Russland-will-seine-Nukleardoktrin-nicht-so-schnell-aendern--article23143824.html,0,www.n-tv.de,Ukraine-Krieg im Liveticker: +++ 16:09 Russland will seine Nukleardoktrin nicht so schnell ändern +++,"Berlin, Washington, Br\u00fcssel - \u00fcberall. n-tv berichtet von allen wichtigen Schaupl\u00e4tzen der Innen- und Au\u00dfenpolitik.",https://bilder2.n-tv.de/img/incoming/crop23332537/9041326157-cImg_16_9-w1200/Liveticker1-grau-1-Kopie.jpg,2022-12-11T23:13:00Z,https://web.archive.org/web/20221212164737/https://www.n-tv.de/politik/16-09-Russland-will-seine-Nukleardoktrin-nicht-so-schnell-aendern--article23143824.html,"Russland beabsichtigt eigenen Angaben zufolge keine rasche Änderung seiner Nukleardoktrin über den Einsatz von Massenvernichtungswaffen. ""Es ist keine Rede von irgendwelchen schnellen Handlungen in d… [+22743 chars]",,de,'Saporischschja'
https://www.n-tv.de/politik/08-28-Ukraine-verhaengt-Strafmassnahmen-gegen-sieben-orthodoxe-Geistliche--article23143824.html,https://www.n-tv.de/politik/08-28-Ukraine-verhaengt-Strafmassnahmen-gegen-sieben-orthodoxe-Geistliche--article23143824.html,0,www.n-tv.de,Ukraine-Krieg im Liveticker: +++ 08:28 Ukraine verhängt Strafmaßnahmen gegen sieben orthodoxe Geistliche +++,"Berlin, Washington, Br\u00fcssel - \u00fcberall. n-tv berichtet von allen wichtigen Schaupl\u00e4tzen der Innen- und Au\u00dfenpolitik.",https://bilder2.n-tv.de/img/incoming/crop23332537/9041326157-cImg_16_9-w1200/Liveticker1-grau-1-Kopie.jpg,2022-12-11T23:13:00Z,https://web.archive.org/web/20221212103241/https://www.n-tv.de/politik/08-28-Ukraine-verhaengt-Strafmassnahmen-gegen-sieben-orthodoxe-Geistliche--article23143824.html,"Die Ukraine ordnet Strafmaßnahmen gegen sieben hochrangige Geistliche an. Wie die britische Zeitung ""Guardian"" berichtet, sind die Maßnahmen nach Angaben von Präsident Wolodymyr Selenskyj Teil eines … [+10921 chars]",,de,'Ukraine'
https://www.n-tv.de/politik/09-06-Hafen-von-Odessa-nimmt-Betrieb-wieder-auf--article23143824.html,https://www.n-tv.de/politik/09-06-Hafen-von-Odessa-nimmt-Betrieb-wieder-auf--article23143824.html,0,www.n-tv.de,"Ukraine-Krieg im Liveticker: +++ 08:54 ntv-Korrespondent: ""Ukraine hofft auf Frost, um schwere Fahrzeuge bewegen zu können"" +++","Berlin, Washington, Br\u00fcssel - \u00fcberall. n-tv berichtet von allen wichtigen Schaupl\u00e4tzen der Innen- und Au\u00dfenpolitik.",https://bilder2.n-tv.de/img/incoming/crop23332537/9041326157-cImg_16_9-w1200/Liveticker1-grau-1-Kopie.jpg,2022-12-11T23:13:00Z,https://web.archive.org/web/20221212130005/https://www.n-tv.de/politik/09-06-Hafen-von-Odessa-nimmt-Betrieb-wieder-auf--article23143824.html,Der Hafen von Odessa nimmt den Betrieb wieder auf. Das gibt ein Sprecher des ukrainischen Infrastrukturministeriums bekannt. Nach einem russischen Angriff auf die Energieversorgung der Region musste … [+11569 chars],,de,'Krieg'
https://www.n-tv.de/politik/21-34-Bout-tritt-ultranationalistischer-Partei-bei--article23143824.html,https://www.n-tv.de/politik/21-34-Bout-tritt-ultranationalistischer-Partei-bei--article23143824.html,0,www.n-tv.de,Ukraine-Krieg im Liveticker: +++ 21:34 Bout tritt ultranationalistischer Partei bei +++,"Berlin, Washington, Br\u00fcssel - \u00fcberall. n-tv berichtet von allen wichtigen Schaupl\u00e4tzen der Innen- und Au\u00dfenpolitik.",https://bilder2.n-tv.de/img/incoming/crop23332537/9041326157-cImg_16_9-w1200/Liveticker1-grau-1-Kopie.jpg,2022-12-11T23:13:00Z,https://web.archive.org/web/20221212203737/https://www.n-tv.de/politik/21-34-Bout-tritt-ultranationalistischer-Partei-bei--article23143824.html,"Der russische Waffenhändler Viktor Bout strebt nach seiner Freilassung durch die USA womöglich eine Karriere in der Politik an. Der auch als ""Händler des Todes"" bekannte 55-Jährige ist der Kreml-nahe… [+32493 chars]",,de,'Ukraine'
https://www.n-tv.de/politik/18-41-Selenskyj-haelt-schnelles-Kriegsende-bei-ploetzlichem-Tod-Putins-fuer-moeglich--article23143824.html,https://www.n-tv.de/politik/18-41-Selenskyj-haelt-schnelles-Kriegsende-bei-ploetzlichem-Tod-Putins-fuer-moeglich--article23143824.html,0,www.n-tv.de,Ukraine-Krieg im Liveticker: +++ 18:41 Selenskyj hält schnelles Kriegsende bei plötzlichem Tod Putins für möglich +++,"Berlin, Washington, Br\u00fcssel - \u00fcberall. n-tv berichtet von allen wichtigen Schaupl\u00e4tzen der Innen- und Au\u00dfenpolitik.",https://bilder2.n-tv.de/img/incoming/crop23332537/9041326157-cImg_16_9-w1200/Liveticker1-grau-1-Kopie.jpg,2022-12-11T23:13:00Z,https://web.archive.org/web/20221212204807/https://www.n-tv.de/politik/18-41-Selenskyj-haelt-schnelles-Kriegsende-bei-ploetzlichem-Tod-Putins-fuer-moeglich--article23143824.html,"Der ukrainische Präsident Wolodymyr Selenskyj hat von seinen Plänen für die Zeit nach dem Krieg mit Russland erzählt. ""Ich will einfach ans Meer und mal ein Bier trinken"", sagt der 44-Jährige gemäß u… [+26729 chars]",,de,'Krieg'
https://www.n-tv.de/politik/11-09-ntv-Korrespondentin-in-Kiew-Wer-im-Hochhaus-lebt-hat-ein-Riesenproblem--article23143824.html,https://www.n-tv.de/politik/11-09-ntv-Korrespondentin-in-Kiew-Wer-im-Hochhaus-lebt-hat-ein-Riesenproblem--article23143824.html,0,www.n-tv.de,"Ukraine-Krieg im Liveticker: +++ 11:09 ntv-Korrespondentin in Kiew: ""Wer im Hochhaus lebt, hat ein Riesenproblem"" +++","Berlin, Washington, Br\u00fcssel - \u00fcberall. n-tv berichtet von allen wichtigen Schaupl\u00e4tzen der Innen- und Au\u00dfenpolitik.",https://bilder2.n-tv.de/img/incoming/crop23332537/9041326157-cImg_16_9-w1200/Liveticker1-grau-1-Kopie.jpg,2022-12-11T23:13:00Z,https://web.archive.org/web/20221212103825/https://www.n-tv.de/politik/11-09-ntv-Korrespondentin-in-Kiew-Wer-im-Hochhaus-lebt-hat-ein-Riesenproblem--article23143824.html,"Der Winter hat gerade erst begonnen, doch für viele Ukrainerinnen und Ukrainer ist die Situation schon jetzt dramatisch. Die Stromversorgung ist immer wieder unterbrochen und das führt in vielen Bere… [+13954 chars]",,de,'Krieg'
https://www.n-tv.de/politik/20-41-US-Militaerkreise-Russland-verwendet-mehr-als-40-Jahre-alte-Munition--article23143824.html,https://www.n-tv.de/politik/20-41-US-Militaerkreise-Russland-verwendet-mehr-als-40-Jahre-alte-Munition--article23143824.html,0,www.n-tv.de,Ukraine-Krieg im Liveticker: +++ 20:41 US-Militärkreise: Russland verwendet mehr als 40 Jahre alte Munition +++,"Berlin, Washington, Br\u00fcssel - \u00fcberall. n-tv berichtet von allen wichtigen Schaupl\u00e4tzen der Innen- und Au\u00dfenpolitik.",https://bilder2.n-tv.de/img/incoming/crop23332537/9041326157-cImg_16_9-w1200/Liveticker1-grau-1-Kopie.jpg,2022-12-11T23:13:00Z,https://web.archive.org/web/20221212215239/https://www.n-tv.de/politik/20-41-US-Militaerkreise-Russland-verwendet-mehr-als-40-Jahre-alte-Munition--article23143824.html,"Russland verwendet nach Angaben aus US-Militärkreisen inzwischen auch minderwertige, jahrzehntealte Munition mit hohen Versagerquoten. ""Sie haben auf ihre alternden Munitionsbestände zurückgegriffen""… [+30817 chars]",,de,'Ukraine'
https://www.n-tv.de/politik/16-57-Slowakei-spricht-mit-NATO-Partnern-ueber-Lieferung-von-MiG-29-Kampfjets--article23143824.html,https://www.n-tv.de/politik/16-57-Slowakei-spricht-mit-NATO-Partnern-ueber-Lieferung-von-MiG-29-Kampfjets--article23143824.html,0,www.n-tv.de,Ukraine-Krieg im Liveticker: +++ 16:57 Slowakei spricht mit NATO-Partnern über Lieferung von MiG-29-Kampfjets +++,"Berlin, Washington, Br\u00fcssel - \u00fcberall. n-tv berichtet von allen wichtigen Schaupl\u00e4tzen der Innen- und Au\u00dfenpolitik.",https://bilder2.n-tv.de/img/incoming/crop23332537/9041326157-cImg_16_9-w1200/Liveticker1-grau-1-Kopie.jpg,2022-12-11T23:13:00Z,,"Die Slowakei sei bereit, der Ukraine die seit langer Zeit versprochenen Kampfjets vom Typ MiG-29 zu liefern, sagt der slowakische Außenminister Rastislav Kaer in einem Interview der ukrainischen Nach… [+24087 chars]",,de,'Krieg'
