index,url,valid,domain,title,description,image,published,archive,content,quote,language,keyword
https://www.n-tv.de/politik/19-57-Scholz-Russland-muss-in-Friedensprozess-einbezogen-werden--article23143824.html,https://www.n-tv.de/politik/19-57-Scholz-Russland-muss-in-Friedensprozess-einbezogen-werden--article23143824.html,0,www.n-tv.de,Ukraine-Krieg im Liveticker: +++ 19:57 Scholz: Russland muss in Friedensprozess einbezogen werden +++,Lesen Sie alle aktuellen Entwicklungen und Nachrichten über den russischen Angriffskrieg auf die Ukraine im Liveticker von ntv.de.,https://bilder2.n-tv.de/img/incoming/crop23332537/9041326157-cImg_16_9-w1200/Liveticker1-grau-1-Kopie.jpg,2024-06-14T22:30:00Z,,"Bundeskanzler Olaf Scholz spricht sich dafür aus, Russland in einem Friedensprozess für die Ukraine zu beteiligen. ""Es ist wahr, dass der Frieden in der Ukraine nicht erreicht werden kann, ohne Russl… [+28067 chars]",,de,'Ukraine'
https://www.n-tv.de/politik/20-16-Ukraine-berichtet-von-neuen-Angriffen-bei-Wowtschansk--article23143824.html,https://www.n-tv.de/politik/20-16-Ukraine-berichtet-von-neuen-Angriffen-bei-Wowtschansk--article23143824.html,0,www.n-tv.de,Ukraine-Krieg im Liveticker: +++ 20:16 Ukraine berichtet von neuen Angriffen bei Wowtschansk +++,Lesen Sie alle aktuellen Entwicklungen und Nachrichten über den russischen Angriffskrieg auf die Ukraine im Liveticker von ntv.de.,https://bilder2.n-tv.de/img/incoming/crop23332537/9041326157-cImg_16_9-w1200/Liveticker1-grau-1-Kopie.jpg,2024-06-14T22:30:00Z,,Ungeachtet der Bemühungen eines großen Teils der Weltgemeinschaft um Frieden in der Ukraine setzen die russischen Truppen ihre Angriffe an diversen Frontabschnitten fort. Unterstützt von ihrer Luftwa… [+28769 chars],,de,'Pipeline'
https://www.n-tv.de/politik/18-56-Kreml-ueber-Friedenskonferenz-Wir-wollen-ihnen-nichts-mitteilen--article23143824.html,https://www.n-tv.de/politik/18-56-Kreml-ueber-Friedenskonferenz-Wir-wollen-ihnen-nichts-mitteilen--article23143824.html,0,www.n-tv.de,"Ukraine-Krieg im Liveticker: +++ 18:56 Kreml über Friedenskonferenz: ""Wir wollen ihnen nichts mitteilen"" +++",Lesen Sie alle aktuellen Entwicklungen und Nachrichten über den russischen Angriffskrieg auf die Ukraine im Liveticker von ntv.de.,https://bilder2.n-tv.de/img/incoming/crop23332537/9041326157-cImg_16_9-w1200/Liveticker1-grau-1-Kopie.jpg,2024-06-14T22:30:00Z,,"Russland werde den Teilnehmern des Schweizer Gipfels zur Ukraine keine Botschaften übermitteln - das teilt Kreml-Sprecher Dmitri Peskow der staatlichen Nachrichtenagentur Tass zufolge mit. ""Wir wolle… [+25879 chars]",,de,'Ukraine'
https://www.n-tv.de/politik/22-12-Ukrainische-Ermittler-Tote-und-Verletzte-durch-Streumunition-im-Osten--article23143824.html,https://www.n-tv.de/politik/22-12-Ukrainische-Ermittler-Tote-und-Verletzte-durch-Streumunition-im-Osten--article23143824.html,0,www.n-tv.de,Ukraine-Krieg im Liveticker: +++ 22:12 Ukrainische Ermittler: Tote und Verletzte durch Streumunition im Osten +++,Lesen Sie alle aktuellen Entwicklungen und Nachrichten über den russischen Angriffskrieg auf die Ukraine im Liveticker von ntv.de.,https://bilder2.n-tv.de/img/incoming/crop23332537/9041326157-cImg_16_9-w1200/Liveticker1-grau-1-Kopie.jpg,2024-06-14T22:30:00Z,,Durch den Einsatz russischer Streumunition sind nach Angaben ukrainischer Ermittler im Osten des Landes mehrere Zivilisten getötet und weitere verletzt worden. Die russische Armee habe das Dorf Ulakl… [+31227 chars],,de,'Pipeline'
https://www.n-tv.de/politik/21-24-Saudi-Arabien-Glaubwuerdige-Verhandlungen-gibt-es-nur-mit-Russland--article23143824.html,https://www.n-tv.de/politik/21-24-Saudi-Arabien-Glaubwuerdige-Verhandlungen-gibt-es-nur-mit-Russland--article23143824.html,0,www.n-tv.de,Ukraine-Krieg im Liveticker: +++ 21:24 Saudi-Arabien: Glaubwürdige Verhandlungen gibt es nur mit Russland +++,Lesen Sie alle aktuellen Entwicklungen und Nachrichten über den russischen Angriffskrieg auf die Ukraine im Liveticker von ntv.de.,https://bilder2.n-tv.de/img/incoming/crop23332537/9041326157-cImg_16_9-w1200/Liveticker1-grau-1-Kopie.jpg,2024-06-14T22:30:00Z,,Glaubwürdige Verhandlungen über einen Frieden werden nach Darstellung von Saudi-Arabien eine Beteiligung Russlands erfordern. Außenminister Prinz Faisal bin Farhan Al-Saud sagt auf der Ukraine-Konfer… [+29798 chars],,de,'Krieg'
https://www.zeit.de/politik/ausland/2024-06/eu-beitrittsgespraeche-ukraine-moldau-grundsatzeinigung,https://www.zeit.de/politik/ausland/2024-06/eu-beitrittsgespraeche-ukraine-moldau-grundsatzeinigung,0,www.zeit.de,EU-Beitrittsgespräche mit der Ukraine und Moldau können beginnen,Die EU-Staaten haben sich im Grundsatz auf Beitrittsgespräche mit der Ukraine und Moldau geeinigt. Einen Termin für die ersten Regierungskonferenzen gibt es bereits.,https://img.zeit.de/politik/ausland/2024-06/ukraine-moldau-eu-beitrittsgespraeche-bild/wide__1300x731,2024-06-14T22:45:24Z,,Die Botschafter der 27 EU-Staaten haben sich grundsätzlich auf den Beginn von Beitrittsgesprächen mit der Ukraine und Moldau Ende Juni geeinigt. Das hat die belgische Ratspräsidentschaft mitgeteilt. … [+3067 chars],,de,'Ukraine'
https://www.tagesschau.de/inland/innenpolitik/spd-buergergeld-schwarzarbeit-100.html,https://www.tagesschau.de/inland/innenpolitik/spd-buergergeld-schwarzarbeit-100.html,0,www.tagesschau.de,Bericht: SPD will Betrug bei Bürgergeld stärker bestrafen,"Die SPD plant, den Druck auf Bezieher von Bürgergeld zu erhöhen, reguläre Arbeit aufzunehmen. So soll bei Schwarzarbeit zwei Monate kein Bürgergeld ausgezahlt werden, wie die Bild-Zeitung berichtet.",https://images.tagesschau.de/image/a2112833-4192-4d78-b7ec-f921ca181cb9/AAABkBlK4e4/AAABjwnlFvA/16x9-1280/jobcenter-158.jpg,2024-06-15T00:27:36Z,,"Stand: 15.06.2024 02:27 Uhr
Die SPD plant, den Druck auf Bezieher von Bürgergeld zu erhöhen, reguläre Arbeit aufzunehmen. So soll bei Schwarzarbeit zwei Monate kein Bürgergeld ausgezahlt werden, wie… [+1616 chars]",,de,'Bürgergeld'
https://www.zeit.de/news/2024-06/15/ex-geisel-ruft-israelis-zu-demo-fuer-entfuehrte-auf,https://www.zeit.de/news/2024-06/15/ex-geisel-ruft-israelis-zu-demo-fuer-entfuehrte-auf,0,www.zeit.de,Naher Osten: Ex-Geisel ruft Israelis zu Demo für Entführte auf,Hier finden Sie Informationen zu dem Thema „Krieg in Nahost“. Lesen Sie jetzt „Ex-Geisel ruft Israelis zu Demo für Entführte auf“.,https://img.zeit.de/news/2024-06/15/ex-geisel-ruft-israelis-zu-demo-fuer-entfuehrte-auf-image-group/wide__1300x731,2024-06-15T03:21:11Z,,Eine Woche nach seiner Befreiung aus dem Gazastreifen hat die ehemalige Hamas-Geisel Andrey Kozlov alle Israelis zu einer Großdemonstration für seine Leidensgenossen in der Gewalt der Hamas aufgerufe… [+4087 chars],,de,'Krieg'
https://www.stern.de/politik/deutschland/haushalt--lindner--bei-buergergeld-nacharbeiten--schuldenbremse-gilt-34800316.html,https://www.stern.de/politik/deutschland/haushalt--lindner--bei-buergergeld-nacharbeiten--schuldenbremse-gilt-34800316.html,0,www.stern.de,"Haushalt: Lindner: Bei Bürgergeld nacharbeiten, Schuldenbremse gilt",Viel Zeit bleibt nicht mehr für die äußerst schwierigen Verhandlungen über den Bundeshaushalt 2025. Finanzminister Lindner bekräftigt seinen Sparkurs. SPD-Politiker wollen keinen Sparhaushalt.,https://image.stern.de/34800318/t/CG/v1/w1440/r1.7778/-/15--urnnewsmldpacom2009010124061599405130v3w800h600l426t410r1265b1283jpeg---5ed52c7d9edc242e.jpg,2024-06-15T05:18:17Z,,"Viel Zeit bleibt nicht mehr für die äußerst schwierigen Verhandlungen über den Bundeshaushalt 2025. Finanzminister Lindner bekräftigt seinen Sparkurs. SPD-Politiker wollen keinen Sparhaushalt.
Bunde… [+4692 chars]",,de,'Bürgergeld'
https://www.n-tv.de/politik/Kanzler-reagiert-auf-Putins-Ukraine-Vorschlaege-article25016810.html,https://www.n-tv.de/politik/Kanzler-reagiert-auf-Putins-Ukraine-Vorschlaege-article25016810.html,0,www.n-tv.de,Kreml verhandlungsbereit?: Kanzler reagiert auf Putins Ukraine-Vorschläge,"Kurz vor dem Friedensgipfel in der Schweiz macht Putin Kiew eine Art Angebot, das manche eher als ""Diktatfrieden"" bezeichnen: Russland sei bereit zu verhandeln - wenn Kiew auf weite Teile des Landes und einen NATO-Beitritt verzichtet. Nun äußert sich auch Kan…",https://bilder3.n-tv.de/img/incoming/crop24980422/5831323907-cImg_16_9-w1200/imago0473884210h.jpg,2024-06-15T09:52:27Z,,"Kurz vor dem Friedensgipfel in der Schweiz macht Putin Kiew eine Art Angebot, das manche eher als ""Diktatfrieden"" bezeichnen: Russland sei bereit zu verhandeln - wenn Kiew auf weite Teile des Landes … [+2536 chars]",,de,'Ukraine'
https://www.faz.net/aktuell/politik/ukraine-liveticker-schweden-russisches-militaerflugzeug-in-luftraum-eingedrungen-faz-19030454.html,https://www.faz.net/aktuell/politik/ukraine-liveticker-schweden-russisches-militaerflugzeug-in-luftraum-eingedrungen-faz-19030454.html,0,www.faz.net,Ukraine-Liveticker: Militärflugzeug in Schwedens Luftraum eingedrungen,Vorfall am Freitag nahe der Insel Gotland +++ Kanzler dämpft Erwartungen an Friedenskonferenz in der Schweiz +++ Berichte über tote Zivilisten in Belgorod und Sumy +++ alle Entwicklungen im Liveblog,https://media1.faz.net/ppmedia/aktuell/1682523591/1.9791351/facebook_teaser/archivbilder-von-norwegens.jpg,2024-06-15T10:11:57Z,,Die russische Armee hat ihre Angriffe in der ostukrainischen Region Donezk nach Angaben der ukrainischen Armee auf die Front in der Nähe der Stadt Pokrowsk konzentriert. Der Feind greift die ukrainis… [+522 chars],,de,'Ukraine'
https://taz.de/SPD-Altvordere-kritisieren-Olaf-Scholz/!6017309/,https://taz.de/SPD-Altvordere-kritisieren-Olaf-Scholz/!6017309/,0,taz.de,SPD-Altvordere kritisieren Olaf Scholz: Beschuss aus den eigenen Reihen,Ein Kreis von SPD-Genoss:innen fordert von Kanzler Olaf Scholz einen „sofortigen Strategiewechsel“. Im Ukraine-Krieg wollen sie „Verhandlungen“.,https://taz.de/picture/7064249/948/31078805-1.jpeg,2024-06-15T10:48:00Z,,"Ein Kreis von SPD-Genoss:innen fordert von Kanzler Olaf Scholz einen sofortigen Strategiewechsel. Im Ukraine-Krieg wollen sie Verhandlungen.
Friedens- und Ökobewegte aus der SPD machen mobil gegen O… [+3852 chars]",,de,'Olaf Scholz'
https://www.tagesschau.de/inland/innenpolitik/ampelkoalition-bundeshaushalt-2025-100.html,https://www.tagesschau.de/inland/innenpolitik/ampelkoalition-bundeshaushalt-2025-100.html,0,www.tagesschau.de,"Vor den Haushaltsberatungen: ""Wir brauchen einen Plan B""","Vor den Beratungen über den Haushalt 2025 scheinen die Positionen innerhalb der Ampel unvereinbar: SPD und Grüne wollen die Schuldenbremse lösen, die FDP will sparen. Und der Kanzler? Der räumt Probleme bei der Entscheidungsfindung ein.",https://images.tagesschau.de/image/5be6f4f9-ae1e-4e4a-8042-f93c4646262c/AAABj4ATVmU/AAABjwnlFvA/16x9-1280/bundeshaushalt-154.jpg,2024-06-15T13:54:49Z,,"Stand: 15.06.2024 15:54 Uhr
Vor den Beratungen über den Haushalt 2025 scheinen die Positionen innerhalb der Ampel unvereinbar: SPD und Grüne wollen die Schuldenbremse lösen, die FDP will sparen. Und… [+3535 chars]",,de,'sparen'
https://www.zeit.de/politik/ausland/2024-06/gaza-krieg-hamas-israel-nahostkonflikt-debatte-geisel-waffenruhe,https://www.zeit.de/politik/ausland/2024-06/gaza-krieg-hamas-israel-nahostkonflikt-debatte-geisel-waffenruhe,0,www.zeit.de,Gaza-Krieg: Über Gaza hängt die Schuldfrage,Die Hamas sieht ihr Kalkül aufgehen: Denn die Kritik an Israel nimmt zu und beeinflusst zunehmend die öffentliche Interpretation des Gaza-Kriegs.,https://img.zeit.de/politik/ausland/2024-06/gaza-krieg-hamas-israel-nahostkonflikt-debatte-geisel-waffenruhe-bild/wide__1300x731,2024-06-15T14:33:47Z,,"Inhalt
Auf einer Seite lesen
 Inhalt
<ol><li>Seite 1Über Gaza hängt die Schuldfrage
</li><li>Seite 2Seite 2</li></ol>
Wer
kann schon glauben, was seit dem 7. Oktober in Israel und Gaza passiert… [+6226 chars]",,de,'Krieg'
https://www.zeit.de/politik/ausland/2024-06/ukraine-frieden-gipfel-konferenz-schweiz,https://www.zeit.de/politik/ausland/2024-06/ukraine-frieden-gipfel-konferenz-schweiz,0,www.zeit.de,Friedensgipfel für die Ukraine: USA kündigen Milliarden-Hilfspaket für Ukraine an,"Der Friedensgipfel für die Ukraine in der Schweiz hat begonnen. Die USA kündigen ein neues Hilfspaket an, während die Gastgeberin die Erwartungen dämpft.",https://img.zeit.de/politik/ausland/2024-06/ukraine-frieden-gipfel-konferenz-schweiz-bild-2/wide__1300x731,2024-06-15T14:44:50Z,,"US-Vizepräsidentin Kamala Harris hat zu Beginn der Ukraine-Friedenskonferenz in der Schweiz ein 
Hilfspaket für die Ukraine in Höhe von 1,5 Milliarden Dollar angekündigt.
 Damit solle der ukrainisc… [+4694 chars]",,de,'Ukraine'
https://www.faz.net/aktuell/politik/ukraine/ukraine-friedenskonferenz-wir-werden-auf-diesem-gipfel-geschichte-schreiben-19791754.html,https://www.faz.net/aktuell/politik/ukraine/ukraine-friedenskonferenz-wir-werden-auf-diesem-gipfel-geschichte-schreiben-19791754.html,0,www.faz.net,Ukraine-Friedenskonferenz: „Wir werden auf diesem Gipfel Geschichte schreiben“,Mit ihrer Teilnahme an der Konferenz in der Schweiz stärken mehr als 90 Staaten der Ukraine den Rücken. Ein Frieden mit Russland ist aber noch in weiter Ferne.,https://media0.faz.net/ppmedia/aktuell/politik/2884880316/1.9791772/facebook_teaser/die-amerikanische.jpg,2024-06-15T16:35:18Z,,Die Schweizer Bundespräsidentin und Verteidigungsministerin Viola Amherd war in ihren Erwartungen an das Treffen deutlich zurückhaltender als Selenskyj: Wir werden auf dem Bürgenstock nicht den Fried… [+8110 chars],,de,'Ukraine'
https://www.n-tv.de/politik/Kreml-droht-Verlust-Hunderter-Soldaten-in-Kesselschlacht-article25017334.html,https://www.n-tv.de/politik/Kreml-droht-Verlust-Hunderter-Soldaten-in-Kesselschlacht-article25017334.html,0,www.n-tv.de,Fehlschlag bei Wowtschansk?: Kreml droht Verlust Hunderter Soldaten in Kesselschlacht,"Die russische Offensive in der Region Charkiw läuft zunächst prächtig an, kommt dann zum Erliegen und könnte nun verheerend ausgehen. Berichte in sozialen Medien legen nahe, dass Hunderte Russen in Wowtschansk eingekesselt sind. Befreiungsversuche schlagen se…",https://bilder1.n-tv.de/img/incoming/crop25017432/960132590-cImg_16_9-w1200/467286325.jpg,2024-06-15T17:13:35Z,,"Die russische Offensive in der Region Charkiw läuft zunächst prächtig an, kommt dann zum Erliegen und könnte nun verheerend ausgehen. Berichte in sozialen Medien legen nahe, dass Hunderte Russen in W… [+3951 chars]",,de,'Ukraine'
https://www.stern.de/panorama/wissen/ukraine--so-sehr-schadet-der-krieg-dem-globalen-klima-34795066.html,https://www.stern.de/panorama/wissen/ukraine--so-sehr-schadet-der-krieg-dem-globalen-klima-34795066.html,0,www.stern.de,Erste Bilanz: So sehr schadet der Krieg in der Ukraine dem globalen Klima,Als erstes Land versucht die Ukraine inmitten eines militärischen Konfliktes eine Klimabilanz des Krieges aufzustellen. Jetzt wurde ein entsprechender Report veröffentlicht. Er könnte auch für andere Kriege wegweisend werden.,https://image.stern.de/34796214/t/9n/v1/w1440/r1.7778/-/explosion-klimaschaden-krieg-ukraine.jpg,2024-06-15T17:27:00Z,,Militärische Konflikte und Streitkräfte gehören zu den größten Umwelt- und Klimasündern. Alle Militärs zusammen mit den Rüstungsindustrien verursachen ungefähr sechs Prozent der globalen Treibhausgas… [+5713 chars],,de,'Krieg'
https://www.morgenpost.de/politik/article242585588/Ukraine-verhandelte-mit-Putin-Woran-der-Frieden-scheiterte.html,https://www.morgenpost.de/politik/article242585588/Ukraine-verhandelte-mit-Putin-Woran-der-Frieden-scheiterte.html,0,www.morgenpost.de,Ukraine verhandelte mit Putin – Woran der Frieden scheiterte,Immer wieder werden Gespräche zwischen Russland und Ukraine gefordert. Neue Dokumente belegen: Es gab sie – und einen Friedensvertrag.,https://img.sparknews.funkemedien.de/242577900/242577900_1718382574_v16_9_1600.jpeg,2024-06-15T17:41:23Z,,"Berlin. Immer wieder werden Gespräche zwischen Russland und Ukraine gefordert. Neue Dokumente belegen: Es gab sie und einen Friedensvertrag.
Ohne Russland soll eine Konferenz in der Schweiz einen We… [+6302 chars]",,de,'Ukraine'
https://www.sueddeutsche.de/politik/ukraine-krieg-newsblog-schweiz-konferenz-russland-harris-von-der-leyen-putin-lux.FkYz6zr21AJcxgomgssjrE,https://www.sueddeutsche.de/politik/ukraine-krieg-newsblog-schweiz-konferenz-russland-harris-von-der-leyen-putin-lux.FkYz6zr21AJcxgomgssjrE,0,www.sueddeutsche.de,Krieg in der Ukraine: Harris und von der Leyen kritisieren Putins Kapitulationspläne,"Der russische Präsident hatte die Ukraine aufgefordert, die besetzten Gebiete abzutreten. Die US-Vizepräsidentin und die EU-Kommissionspräsidentin weisen das auf der Friedenskonferenz in der Schweiz nun zurück.",https://www.sueddeutsche.de/2024/06/15/5fb73202-98d0-40ca-8aa6-ecbe94b051ee.jpeg?q=60&fm=webp&width=1200&rect=0%2C7%2C3500%2C1969,2024-06-15T17:49:19Z,,Viele Angaben über den Kriegsverlauf wie Opferzahlen oder Details zu Kämpfen stammen von ukrainischen oder russischen Behörden und lassen sich oft nicht unabhängig überprüfen. Für unseren Liveblog ve… [+107 chars],,de,'Ukraine'
https://www.stern.de/news/scholz-betont-in-der-schweiz-globale-bedeutung-von-frieden-in-der-ukraine-34801802.html,https://www.stern.de/news/scholz-betont-in-der-schweiz-globale-bedeutung-von-frieden-in-der-ukraine-34801802.html,0,www.stern.de,Scholz betont in der Schweiz globale Bedeutung von Frieden in der Ukraine,"Bei der Ukraine-Friedenskonferenz in der Schweiz hat Bundeskanzler Olaf Scholz (SPD) die globale Bedeutung einer Beendigung des Krieges betont. Zwar gehe es natürlich zuvorderst um Frieden für die Ukraine, aber auch ""unsere globale Sicherheit und die auf Rege…",https://image.stern.de/34801804/t/zf/v1/w1440/r1.7778/-/15--scholz-in-buergenstock---d585f2c3eaf1d16e.jpg,2024-06-15T17:56:51Z,,Bei der Ukraine-Friedenskonferenz in der Schweiz hat Bundeskanzler Olaf Scholz (SPD) die globale Bedeutung einer Beendigung des Krieges betont. Zwar gehe es natürlich zuvorderst um Frieden für die Uk… [+1219 chars],,de,'Sicherheit'
https://www.bild.de/politik/ausland-und-internationales/rheinmetall-repariert-in-der-ukraine-bild-im-geheimen-panzer-werk-666d85463749934428aac76f,https://www.bild.de/politik/ausland-und-internationales/rheinmetall-repariert-in-der-ukraine-bild-im-geheimen-panzer-werk-666d85463749934428aac76f,0,www.bild.de,Rheinmetall in der Ukraine - BILD im geheimen Panzer-Werk,Der deutsche Rüstungskonzern Rheinmetall hat in der Westukraine eine neue Fabrik eröffnet – BILD bekam exklusiv einen Einblick in die geheime Anlage.,"https://images.bild.de/666d85463749934428aac76f/1025dda00eaf03bbec8eb1c90a89b182,cd3b62b8?w=1280",2024-06-15T17:59:52Z,,"Hier machen sie die deutschen Panzer wieder fit, die im Abwehrkampf gegen die russischen Invasoren einen Treffer bekommen haben.
Der deutsche Rüstungskonzern Rheinmetall hat in der Westukraine eine … [+193 chars]",,de,'Ukraine'
https://www.faz.net/aktuell/feuilleton/pop/rod-stewart-bei-konzert-wegen-putin-kritik-ausgebuht-19791833.html,https://www.faz.net/aktuell/feuilleton/pop/rod-stewart-bei-konzert-wegen-putin-kritik-ausgebuht-19791833.html,0,www.faz.net,Bei Konzert ausgebuht: Mit „Fuck Putin“ ist Rod Stewart in Leipzig unerwünscht,"Rod Stewart macht auf seiner Abschiedstournee Station in Leipzig. Beim Konzert läuft alles glatt, bis der Sänger seine Sympathie für die von Putins Armee angegriffene Ukraine bekundet. Das Publikum pfeift und buht. Ein trauriger Abend.",https://media1.faz.net/ppmedia/aktuell/feuilleton/2798258334/1.9791843/facebook_teaser/rod-stewart-ist-auf.jpg,2024-06-15T18:23:13Z,,"Es scheint eine verlässlich gute Veranstaltung zu werden. Der Schotte ist Profi genug, um die Lieder seines aktuellen Albums vor dem Start des Konzerts durch die Lautsprecher dudeln zu lassen. Die Le… [+2599 chars]",,de,'Ukraine'
https://www.n-tv.de/politik/23-23-Menschenrechtler-Russland-aendert-Namen-verschleppter-Kinder--article25017617.html,https://www.n-tv.de/politik/23-23-Menschenrechtler-Russland-aendert-Namen-verschleppter-Kinder--article25017617.html,0,www.n-tv.de,Ukraine-Krieg im Liveticker: +++ 23:23 Menschenrechtler: Russland ändert Namen verschleppter Kinder +++,Lesen Sie alle aktuellen Entwicklungen und Nachrichten über den russischen Angriffskrieg auf die Ukraine im Liveticker von ntv.de.,https://bilder2.n-tv.de/img/incoming/crop23332537/9041326157-cImg_16_9-w1200/Liveticker1-grau-1-Kopie.jpg,2024-06-15T18:30:00Z,,"Ukrainische Menschenrechtsaktivisten werfen Russland vor, aus der Ukraine verschleppte Kinder zu indoktrinieren. Es werde versucht, ihre ukrainische Identität auszulöschen, sagt der Chef der Wohltäti… [+32234 chars]",,de,'Ukraine'
https://www.tagesspiegel.de/internationales/teilnehmer-des-ukraine-friedensgipfels-ringen-um-eine-abschlusserklarung-11837534.html,https://www.tagesspiegel.de/internationales/teilnehmer-des-ukraine-friedensgipfels-ringen-um-eine-abschlusserklarung-11837534.html,0,www.tagesspiegel.de,Probleme bei Formulierungen: Teilnehmer des Ukraine-Friedensgipfels ringen um eine Abschlusserklärung,"Die Abschlusserklärung zum Ukraine-Friedensgipfel in der Schweiz sei vollständig und „ausgewogen“, berichtet Kuleba. Allerdings solle einige Länder Probleme mit Formulierungen haben.",https://www.tagesspiegel.de/images/schweizer-friedenskonferenz6/alternates/BASE_16_9_W1400/schweizer-friedenskonferenz.jpeg,2024-06-15T18:43:32Z,,"Am zweiten Tag des Ukraine-Gipfels in der Schweiz ringt die internationale Staatengemeinschaft um eine Abschlusserklärung.
Das Dokument sei vollständig und ausgewogen, sagte der ukrainische Außenmin… [+7454 chars]",,de,'Ukraine'
https://www.tagesspiegel.de/internationales/teilnehmerstaaten-fordern-schutz-von-besetztem-akw-und-ungehinderte-getreideexporte-11837534.html,https://www.tagesspiegel.de/internationales/teilnehmerstaaten-fordern-schutz-von-besetztem-akw-und-ungehinderte-getreideexporte-11837534.html,0,www.tagesspiegel.de,Uneinigkeit bei Ukraine-Friedensgipfel: Teilnehmerstaaten beschließen Schutz von besetztem AKW und ungehinderte Getreideexporte,"Die Abschlusserklärung zum Ukraine-Friedensgipfel in der Schweiz sei vollständig und „ausgewogen“, berichtet Kuleba. Allerdings haben sie nur 80 von 93 Teilnehmerstaaten gebilligt.",https://www.tagesspiegel.de/images/schweizer-friedenskonferenz6/alternates/BASE_16_9_W1400/schweizer-friedenskonferenz.jpeg,2024-06-15T18:43:32Z,,Die Abschlusserklärung des Friedensgipfels in der Schweiz wird nicht von allen Teilnehmerstaaten mitgetragen. Nach einer am Sonntag veröffentlichten Aufstellung der Schweizer Gastgeber wurde das Doku… [+8351 chars],,de,'Ukraine'
https://www.tagesspiegel.de/internationales/kamala-harris-bei-ukraine-gipfel-in-der-schweiz-putin-ruft-nicht-zu-verhandlungen-auf-er-ruft-zur-kapitulation-auf-11837534.html,https://www.tagesspiegel.de/internationales/kamala-harris-bei-ukraine-gipfel-in-der-schweiz-putin-ruft-nicht-zu-verhandlungen-auf-er-ruft-zur-kapitulation-auf-11837534.html,0,www.tagesspiegel.de,"Kamala Harris bei Ukraine-Gipfel in der Schweiz: „Putin ruft nicht zu Verhandlungen auf, er ruft zur Kapitulation auf“","Die USA sind einer von rund 90 teilnehmenden Staaten bei der Friedenskonferenz. Kanzler Olaf Scholz sprach sich dafür aus, Russland in einem Friedensprozess für die Ukraine zu beteiligen.",https://www.tagesspiegel.de/images/schweizer-friedenskonferenz1/alternates/BASE_16_9_W1400/schweizer-friedenskonferenz.jpeg,2024-06-15T18:43:32Z,,US-Vizepräsidentin Kamala Harris hat die Bedingungen des russischen Präsidenten Wladimir Putin für Friedensverhandlungen mit der Ukraine als abwegig zurückgewiesen. Wir müssen die Wahrheit sagen. Er … [+4121 chars],,de,'Ukraine'
https://www.morgenpost.de/wirtschaft/article242586044/Waermepumpe-statt-Gas-Berechnung-zeigt-das-volle-Potenzial.html,https://www.morgenpost.de/wirtschaft/article242586044/Waermepumpe-statt-Gas-Berechnung-zeigt-das-volle-Potenzial.html,0,www.morgenpost.de,Wärmepumpe statt Gas: Berechnung zeigt das volle Potenzial,"Wer mit Wärmepumpe statt Gas heizt, hat Kostenvorteile – selbst mit wenig effektiven Geräten. Wie viel Verbraucher wirklich sparen.",https://img.sparknews.funkemedien.de/241668442/241668442_1707836946_v16_9_1600.jpeg,2024-06-15T19:00:17Z,,"Berlin. Wer mit Wärmepumpe statt Gas heizt, hat Kostenvorteile selbst mit wenig effektiven Geräten. Wie viel Verbraucher wirklich sparen.
Verbraucher, die mit einer Wärmepumpe statt mit Gas heizen, … [+5555 chars]",,de,'Gas'
https://www.morgenpost.de/politik/ausland/article242586186/Suche-nach-Frieden-in-der-Ukraine-zunaechst-ohne-Russland.html,https://www.morgenpost.de/politik/ausland/article242586186/Suche-nach-Frieden-in-der-Ukraine-zunaechst-ohne-Russland.html,0,www.morgenpost.de,Suche nach Frieden in der Ukraine - zunächst ohne Russland,"Friedensgipfel ist ein Wort, das große Erwartungen weckt. Aber von Frieden ist die Ukraine noch sehr weit entfernt. Kanzler Scholz nennt den Gipfel in der Schweiz deswegen ein „zartes Pflänzchen“.",https://img.sparknews.funkemedien.de/242586184/242586184_1718479060_v16_9_1600.jpeg,2024-06-15T19:15:21Z,,"Obbürgen. Friedensgipfel ist ein Wort, das große Erwartungen weckt. Aber von Frieden ist die Ukraine noch sehr weit entfernt. Kanzler Scholz nennt den Gipfel in der Schweiz deswegen ein zartes Pflänz… [+5423 chars]",,de,'Ukraine'
