index,url,valid,domain,title,description,image,published,archive,content,quote,language,keyword
https://www.sueddeutsche.de/wirtschaft/gas-lng-energie-robert-habeck-1.5762297,https://www.sueddeutsche.de/wirtschaft/gas-lng-energie-robert-habeck-1.5762297,0,www.sueddeutsche.de,Energieversorgung: Kritik an teuren LNG-Terminals wird immer lauter,"Erst zu wenig, bald zu viel? Dank neuer Terminals für Flüssigerdgas könnte 2030 viel mehr Gas angelandet werden, als Deutschland benötigt. In der Koalition sorgt das für Unmut.",https://www.sueddeutsche.de/image/sz.1.5762321/1200x675?v=1677856053,2023-03-03T15:07:45Z,https://web.archive.org/web/20230303154702/https://www.sueddeutsche.de/wirtschaft/gas-lng-energie-robert-habeck-1.5762297,"Erst zu wenig, bald zu viel? Dank neuer Terminals für Flüssigerdgas könnte 2030 viel mehr Gas angelandet werden, als Deutschland benötigt. In der Koalition sorgt das für Unmut. Das Einmaleins der Ter… [+2130 chars]",,de,'Energie'
https://www.bild.de/bild-plus/politik/ausland/politik-ausland/russen-propaganda-schaeumt-vor-wut-putins-groesster-verbuendeter-springt-ab-83074846.bild.html,https://www.bild.de/bild-plus/politik/ausland/politik-ausland/russen-propaganda-schaeumt-vor-wut-putins-groesster-verbuendeter-springt-ab-83074846.bild.html,0,www.bild.de,Russen-Propaganda schäumt vor Wut - Putins größter Verbündeter springt ab!,Rückschlag für Russland: Ausgerechnet ein Militär-Verbündeter lässt den Kreml fallen.Foto: SPUTNIK/via REUTERS,"https://images.bild.de/640041f8834b0a045728f6eb/00f463f1d2eb6b0fdc7870bbc880e8d0,13e14c8f?w=1280",2023-03-03T15:15:39Z,http://archive.md/20230303151948/https://www.bild.de/bild-plus/politik/ausland/politik-ausland/russen-propaganda-schaeumt-vor-wut-putins-groesster-verbuendeter-springt-ab-83074846.bild.html,"Riesen-Wut in Russland!
Ausgerechnet das größte Land, mit dem Russland lange eine enge Partnerschaft pflegte, setzt sich von Putin ab. Mehr noch: Es setzt auf eine Partnerschaft mit den USA.
Es ist… [+189 chars]",,de,'Kreml'
https://www.dw.com/de/ukraine-aktuell-weitere-us-waffenlieferungen/a-64870871,https://www.dw.com/de/ukraine-aktuell-weitere-us-waffenlieferungen/a-64870871,0,www.dw.com,Ukraine aktuell: Weitere Waffenlieferungen der USA,Die USA unterstützen die Ukraine mit einer Militärhilfe von 400 Millionen Dollar. Kanzler Scholz besucht US-Präsident Biden. Die ukrainische Regierung lehnt Gespräche mit dem Kremlchef ab. Ein Überblick.,https://static.dw.com/image/64871325_6.jpg,2023-03-03T15:25:00Z,,"Das Wichtigste in Kürze:
<ul><li>Washington gibt 400 Millionen Dollar an MIlitärhilfe </li><li>Kanzler Scholz besucht Präsident Biden zu Gespräch über Ukraine</li><li>Ukraine lehnt Verhandlungen mit… [+5777 chars]",,de,'Ukraine'
https://www.focus.de/kultur/kino_tv/ard-mann-fragt-ukraine-botschafter-nach-vermittlern-der-antwortet-rabiat_id_187326230.html,https://www.focus.de/kultur/kino_tv/ard-mann-fragt-ukraine-botschafter-nach-vermittlern-der-antwortet-rabiat_id_187326230.html,0,www.focus.de,Im „Morgenmagazin“ der ARD - Vor Rückzug keine Gespräche mit Russland: Ukrainischer Botschafter wählt klare Worte,Der ukrainische Botschafter Oleksij Makejew war zu Gast beim „ARD-Morgenmagazin“ und sprach über mögliche Verhandlungen mit Russland. Seiner Ansicht nach müsse man den Aggressor in die Verhandlungen zwingen - und dafür brauche die Ukraine mehr Waffen.,https://p6.focus.de/img/kultur/kino_tv/id_187326217/vor-rueckzug-keine-gespraeche-mit-russland-ukrainischer-botschafter-waehlt-klare-worte.jpg?im=Crop%3D%280%2C85%2C1360%2C680%29%3BResize%3D%281200%2C627%29&impolicy=perceptual&quality=medium&hash=eb974ea2cf3c1596be00e35fff2392615b995f8062b84a85cb77476d713b345b,2023-03-03T15:39:38Z,https://web.archive.org/web/20230305004955/https://www.focus.de/kultur/kino_tv/ard-mann-fragt-ukraine-botschafter-nach-vermittlern-der-antwortet-rabiat_id_187326230.html,Sollte die Ukraine nun Verhandlungen mit Russland zur Beendigung des Krieges aufnehmen? Und unter welchen Bedingungen kann es überhaupt zu Verhandlungen seitens der Ukraine kommen? Über diese Fragen … [+2416 chars],,de,'Ukraine'
https://www.handelsblatt.com/unternehmen/energie/gasspeicher-in-deutschland-fuellstand-liegt-aktuell-bei-68-prozent/28819652.html,https://www.handelsblatt.com/unternehmen/energie/gasspeicher-in-deutschland-fuellstand-liegt-aktuell-bei-68-prozent/28819652.html,0,www.handelsblatt.com,Gasspeicher in Deutschland: Füllstand liegt aktuell bei 68 Prozent,Ein hoher Gasspeicher-Füllstand ist für Deutschlands Gasversorgung in der Energiekrise essenziell. Wie steht es aktuell um die Gasreserven? Ein Überblick.,https://www.handelsblatt.com/images/gasspeicher-in-sachsen-anhalt/28877480/2-format2003.jpg,2023-03-03T16:04:46Z,,"Gasspeicher in Sachsen-AnhaltDer Gasspeicher-Füllstand in Deutschland ist in der Energiekrise zum wichtigen Faktor geworden.
(Foto: dpa)
Düsseldorf Ein stabiler Füllstand der deutschen Gasspeicher … [+7431 chars]",,de,'Gasmangel'
https://www.focus.de/klima/experten/autor-und-blogger-jan-hegenberg-veganes-deutschland-es-gibt-maechtigere-hebel-um-die-klimakrise-zu-loesen_id_187250342.html,https://www.focus.de/klima/experten/autor-und-blogger-jan-hegenberg-veganes-deutschland-es-gibt-maechtigere-hebel-um-die-klimakrise-zu-loesen_id_187250342.html,0,www.focus.de,"Autor und Blogger Jan Hegenberg - Veganes Deutschland? Es gibt mächtigere Hebel, um die Klimakrise zu lösen","Deutschland muss nicht zu 100 Prozent vegan leben, um die Klimakrise zu lösen. Wir haben viel mächtigere Hebel als den bloßen Verzicht - und wir sollten optimistischer in die Zukunft blicken.Von Gastautor Jan Hegenberg",https://p6.focus.de/img/fotos/id_187252269/vegan-leben.jpg?im=Crop%3D%280%2C225%2C2121%2C1061%29%3BResize%3D%281200%2C627%29&hash=a120f5ed110aa7f1eafb956103e60d59ee781f3c311ce50af20c474de5ee72c9,2023-03-03T16:10:55Z,https://web.archive.org/web/20230303175451/https://www.focus.de/klima/experten/autor-und-blogger-jan-hegenberg-veganes-deutschland-es-gibt-maechtigere-hebel-um-die-klimakrise-zu-loesen_id_187250342.html,"<ul><li>
Kommentare</li><li>
E-Mail</li><li>
Teilen</li><li>
Mehr</li><li>
Twitter</li><li>
Drucken</li><li>
Feedback</li><li>
Fehler meldenSie haben einen Fehler gefunden?
Bitte markieren S… [+8722 chars]",,de,'Gas'
https://www.n-tv.de/politik/Putins-Sicherheitsrat-tagt-wegen-Sabotageakten-article23960094.html,https://www.n-tv.de/politik/Putins-Sicherheitsrat-tagt-wegen-Sabotageakten-article23960094.html,0,www.n-tv.de,"Nur zwei Sätze bisher öffentlich: Putins Sicherheitsrat tagt wegen ""Sabotageakten""","Die ""Sabotageakte"" auf russischem Boden lösen in Russland Unruhe aus. Präsident Putin beruft den Sicherheitsrat ein und sagt dafür offenbar eine Reise in den Nordkaukasus ab. Viel dringt davon bislang nicht nach draußen. Kreml-Sprecher Peskow kündigt ""Maßnahm…",https://bilder1.n-tv.de/img/incoming/crop23960092/4611325514-cImg_16_9-w1200/imago0238277866h.jpg,2023-03-03T16:58:18Z,,"Die ""Sabotageakte"" auf russischem Boden lösen in Russland Unruhe aus. Präsident Putin beruft den Sicherheitsrat ein und sagt dafür offenbar eine Reise in den Nordkaukasus ab. Viel dringt davon bislan… [+1850 chars]",,de,'Kreml'
https://www.tagesspiegel.de/internationales/ukraine-invasion-tag-373-solange-putin-im-kreml-sitzt-wird-der-krieg-nicht-enden-9449372.html,https://www.tagesspiegel.de/internationales/ukraine-invasion-tag-373-solange-putin-im-kreml-sitzt-wird-der-krieg-nicht-enden-9449372.html,0,www.tagesspiegel.de,"Ukraine-Invasion Tag 373: „Solange Putin im Kreml sitzt, wird der Krieg nicht enden“","Wagner-Söldner erklären Bachmut für praktisch eingekesselt, Lula will zwischen Moskau und Kiew vermitteln, russischer Soziologe warnt vor ewigem Krieg. Der Überblick am Abend.",https://www.tagesspiegel.de/images/russlands-prasident-putin10/alternates/BASE_16_9_W1400/russlands-praesident-putin.jpeg,2023-03-03T17:36:21Z,https://web.archive.org/web/20230305010201/https://www.tagesspiegel.de/internationales/ukraine-invasion-tag-373-solange-putin-im-kreml-sitzt-wird-der-krieg-nicht-enden-9449372.html,"Der russische Soziologe Grigory Yudin war einer der wenigen Experten in Russland, der vor dem Krieg gegen die Ukraine warnte - und der sich jetzt immer noch in Russland befindet. Am 22. Februar 2022 … [+5147 chars]",,de,'Ukraine'
https://www.faz.net/aktuell/wirtschaft/strategieentwurf-kein-staatliches-wasserstoffnetz-18721919.html,https://www.faz.net/aktuell/wirtschaft/strategieentwurf-kein-staatliches-wasserstoffnetz-18721919.html,0,www.faz.net,Strategieentwurf: Kein staatliches Wasserstoffnetz,"Der Entwurf zur neuen Bundesstrategie setzt nicht nur auf „grüne“ Gase, sondern lässt auch fossile Energieträger zu. Dagegen ist die Idee einer staatlichen Beteiligung an der Infrastruktur vom Tisch.",https://media1.faz.net/ppmedia/aktuell/wirtschaft/4272499987/1.8586705/facebook_teaser/1bbc7fb0-8bdc-11ed-834b.jpg,2023-03-03T17:40:45Z,https://web.archive.org/web/20230303182304/https://www.faz.net/aktuell/wirtschaft/strategieentwurf-kein-staatliches-wasserstoffnetz-18721919.html,"Anders als ursprünglich beabsichtigt, will sich der Bund vorerst nicht an der geplanten deutschen Wasserstoffnetzgesellschaft beteiligen. Damit sind die Ideen zur Teilverstaatlichung, die auch die Ne… [+3004 chars]",,de,'Gas'
https://www.welt.de/politik/ausland/article244076375/Ukraine-News-Ukraine-meldet-Abwehr-russischer-Angriffe-Bachmut-droht-weiter-Einkreisung.html,https://www.welt.de/politik/ausland/article244076375/Ukraine-News-Ukraine-meldet-Abwehr-russischer-Angriffe-Bachmut-droht-weiter-Einkreisung.html,0,www.welt.de,Ukraine meldet Abwehr russischer Angriffe – Bachmut droht weiter Einkreisung,"Ukrainische Soldaten kämpfen in Bachmut weiter gegen russische Truppen und Söldner. Wagner-Chef Jewgeni Prigoschin verkündete bereits die Einkesselung der Stadt, doch nach ukrainischen Angaben wurde eine Serie von Angriffen zurückgeschlagen. Mehr im Liveticke…",https://img.welt.de/img/politik/ausland/mobile244098439/2691357197-ci16x9-w1200/Ukrainian-servicemen-ride-a-tank-on-a-road-towards-the-frontline.jpg,2023-03-03T18:20:00Z,http://archive.md/20230303193129/https://www.welt.de/politik/ausland/article244076375/Ukraine-News-Ukraine-meldet-Abwehr-russischer-Angriffe-Bachmut-droht-weiter-Einkreisung.html,"Russische Truppen haben ihre Sturmangriffe gegen die ostukrainische Stadt Bachmut auch am Freitag fortgesetzt. Der Feind ist weiterhin bemüht, die Stadt einzukreisen, teilte der ukrainische Generalst… [+14956 chars]",,de,'Kreml'
https://www.zeit.de/politik/ausland/2023-03/brjansk-neonazi-russland-denis-nikitin,https://www.zeit.de/politik/ausland/2023-03/brjansk-neonazi-russland-denis-nikitin,0,www.zeit.de,Brjansk: Ein russischer Neonazi blamiert Wladimir Putin,"In einer Blitzaktion dringt eine fragwürdige Freiwilligentruppe in ein russisches Grenzdorf ein. Ärgerlich für den Kreml, aber auch für die Ukraine ist der Fall heikel.",,2023-03-03T18:21:14Z,http://archive.md/20230303184355/https://www.zeit.de/politik/ausland/2023-03/brjansk-neonazi-russland-denis-nikitin,"When browsing with ads:
We collect personal data and also transmit it to third-party providers
 that help us improve and finance our digital content. Some of the information stored on your device, … [+732 chars]",,de,'Ukraine'
https://www.morgenpost.de/politik/article237806599/olaf-scholz-joe-biden-besuch-usa-einklang.html,https://www.morgenpost.de/politik/article237806599/olaf-scholz-joe-biden-besuch-usa-einklang.html,0,www.morgenpost.de,Besuch: Bundeskanzler in den USA: Biden und Scholz im Gleichklang,Bundeskanzler Scholz redet unter vier Augen vertraulich mit dem US-Präsidenten in Washington über den Krieg in der Ukraine.,https://img.morgenpost.de/img/incoming/crop237806591/3212609806-w820-cv16_9-q85/AFP-33AG78W.jpg,2023-03-03T19:49:45Z,,"Washington. Wer wie Olaf Scholz knapp 18 Stunden Flugzeit auf der Route Berlin - Washington - Berlin in Kauf nimmt, um gut 60 Minuten, die meisten davon unter vier Augen, wegen des Krieges in der Ukr… [+5518 chars]",,de,'Ukraine'
https://www.stern.de/news/scholz-und-biden-ueben-bei-treffen-schulterschluss-bei-ukraine-hilfen-33249898.html,https://www.stern.de/news/scholz-und-biden-ueben-bei-treffen-schulterschluss-bei-ukraine-hilfen-33249898.html,0,www.stern.de,Scholz und Biden üben bei Treffen Schulterschluss bei Ukraine-Hilfen,"Bundeskanzler Olaf Scholz (SPD) und US-Präsident Joe Biden haben bei einem Treffen in Washington demonstrativ Geschlossenheit bei der Unterstützung der Ukraine gezeigt. ""Ich will dir danken, Olaf, für deine starke und beständige Führung"", sagte Biden am Freit…",https://image.stern.de/33250562/t/S4/v1/w1440/r1.7778/-/03--kanzler-scholz-l-und-praesident-biden---ed583f96f663f033.jpg,2023-03-03T20:42:29Z,,"Bundeskanzler Olaf Scholz (SPD) und US-Präsident Joe Biden haben bei einem Treffen in Washington demonstrativ Geschlossenheit bei der Unterstützung der Ukraine gezeigt. ""Ich will dir danken, Olaf, fü… [+3661 chars]",,de,'Kreml'
https://www.n-tv.de/politik/Lawrow-wird-wegen-Ukraine-Luegen-ausgelacht-article23960545.html,https://www.n-tv.de/politik/Lawrow-wird-wegen-Ukraine-Luegen-ausgelacht-article23960545.html,0,www.n-tv.de,Russland als Opfer dargestellt: Lawrow wird wegen Ukraine-Lügen ausgelacht,"Verschwörungstheorien und Lügen der russischen Regierung gehören mittlerweile zur Tagesordnung jeder Konferenz, an der Moskau-Vertreter teilnehmen. Doch in Neu Delhi übertrifft der Kreml sich selbst. Auf der Bühne einer internationalen Konferenz stellt Außenm…",https://bilder4.n-tv.de/img/incoming/crop23960551/499132501-cImg_16_9-w1200/397717003.jpg,2023-03-03T20:53:55Z,https://web.archive.org/web/20230304070852/https://www.n-tv.de/politik/Lawrow-wird-wegen-Ukraine-Luegen-ausgelacht-article23960545.html,"Verschwörungstheorien und Lügen der russischen Regierung gehören mittlerweile zur Tagesordnung jeder Konferenz, an der Moskau-Vertreter teilnehmen. Doch in Neu Delhi übertrifft der Kreml sich selbst.… [+2365 chars]",,de,'Ukraine'
https://www.n-tv.de/politik/19-49-Ukraine-verteidigt-Bachmut-gegen-heftige-Sturmangriffe--article23960654.html,https://www.n-tv.de/politik/19-49-Ukraine-verteidigt-Bachmut-gegen-heftige-Sturmangriffe--article23960654.html,0,www.n-tv.de,Ukraine-Krieg im Liveticker: +++ 19:49 Ukraine verteidigt Bachmut gegen heftige Sturmangriffe +++,"Berlin, Washington, Br\u00fcssel - \u00fcberall. n-tv berichtet von allen wichtigen Schaupl\u00e4tzen der Innen- und Au\u00dfenpolitik.",https://bilder2.n-tv.de/img/incoming/crop23332537/9041326157-cImg_16_9-w1200/Liveticker1-grau-1-Kopie.jpg,2023-03-04T00:22:53Z,,"Russische Truppen setzen ihre Sturmangriffe gegen die ostukrainische Stadt Bachmut fort. ""Der Feind ist weiterhin bemüht, die Stadt einzukreisen"", teilt der ukrainische Generalstab am Abend in seinem… [+32513 chars]",,de,'Kreml'
https://www.n-tv.de/politik/07-12-Angriff-auf-Wohnblock-in-Saporischschja-Zahl-der-Todesopfer-steigt-auf-7--article23143824.html,https://www.n-tv.de/politik/07-12-Angriff-auf-Wohnblock-in-Saporischschja-Zahl-der-Todesopfer-steigt-auf-7--article23143824.html,0,www.n-tv.de,Ukraine-Krieg im Liveticker: +++ 07:12 Angriff auf Wohnblock in Saporischschja: Zahl der Todesopfer steigt auf 7 +++,"Berlin, Washington, Br\u00fcssel - \u00fcberall. n-tv berichtet von allen wichtigen Schaupl\u00e4tzen der Innen- und Au\u00dfenpolitik.",https://bilder2.n-tv.de/img/incoming/crop23332537/9041326157-cImg_16_9-w1200/Liveticker1-grau-1-Kopie.jpg,2023-03-04T00:23:00Z,,"Rettungskräfte haben die Leichen zweier weiterer Zivilisten aus den Trümmern eines Wohnblocks geborgen, der am Donnerstag in Saporischschja von russischen Raketen getroffen wurde. Das berichtet die N… [+8150 chars]",,de,'Ukraine'
https://www.n-tv.de/politik/16-32-Kremlkritiker-Putin-ist-von-Macht-verrueckt-geworden--article23143824.html,https://www.n-tv.de/politik/16-32-Kremlkritiker-Putin-ist-von-Macht-verrueckt-geworden--article23143824.html,0,www.n-tv.de,"Ukraine-Krieg im Liveticker: +++ 16:32 Kremlkritiker: Putin ist ""von Macht verrückt geworden"" +++","Berlin, Washington, Br\u00fcssel - \u00fcberall. n-tv berichtet von allen wichtigen Schaupl\u00e4tzen der Innen- und Au\u00dfenpolitik.",https://bilder2.n-tv.de/img/incoming/crop23332537/9041326157-cImg_16_9-w1200/Liveticker1-grau-1-Kopie.jpg,2023-03-04T00:23:00Z,,"Die Entmachtung des russischen Präsidenten Wladimir Putin sei eine Voraussetzung, um ""die Risiken eines neuen Weltkriegs zu vermeiden"", sagt Ilja Jaschin. Der Kremlkritiker wurde im vergangenen Jahr … [+22992 chars]",,de,'Kreml'
https://www.n-tv.de/politik/08-08-Feldlazarett-in-Bachmut-Versorgen-oft-60-Verwundete-am-Tag--article23143824.html,https://www.n-tv.de/politik/08-08-Feldlazarett-in-Bachmut-Versorgen-oft-60-Verwundete-am-Tag--article23143824.html,0,www.n-tv.de,Ukraine-Krieg im Liveticker: +++ 08:08 Feldlazarett in Bachmut: Versorgen oft 60 Verwundete am Tag +++,"Berlin, Washington, Br\u00fcssel - \u00fcberall. n-tv berichtet von allen wichtigen Schaupl\u00e4tzen der Innen- und Au\u00dfenpolitik.",https://bilder2.n-tv.de/img/incoming/crop23332537/9041326157-cImg_16_9-w1200/Liveticker1-grau-1-Kopie.jpg,2023-03-04T00:23:00Z,,"Mehr als 60 verwundete Soldaten versorgt das Feldlazarett der ukrainischen Truppen nach eigenen Angaben an manchen Tagen. ""Wir arbeiten praktisch pausenlos"", sagte ein Sanitätsoffizier dem unabhängig… [+9548 chars]",,de,'Ukraine'
https://www.n-tv.de/politik/15-38-Medwedew-droht-mit-Beschuss-von-Rheinmetall-Panzerfabrik-in-der-Ukraine--article23143824.html,https://www.n-tv.de/politik/15-38-Medwedew-droht-mit-Beschuss-von-Rheinmetall-Panzerfabrik-in-der-Ukraine--article23143824.html,0,www.n-tv.de,Ukraine-Krieg im Liveticker: +++ 15:38 Medwedew droht mit Beschuss von Rheinmetall-Panzerfabrik in der Ukraine +++,"Berlin, Washington, Br\u00fcssel - \u00fcberall. n-tv berichtet von allen wichtigen Schaupl\u00e4tzen der Innen- und Au\u00dfenpolitik.",https://bilder2.n-tv.de/img/incoming/crop23332537/9041326157-cImg_16_9-w1200/Liveticker1-grau-1-Kopie.jpg,2023-03-04T00:23:00Z,,"Der russische Ex-Präsident Dmitri Medwedew reagiert aggressiv-sarkastisch auf den Vorschlag von Rheinmetall, eine Panzerfabrik in der Ukraine zu bauen. Die Initiative sei wohl eine Art ""primitives Tr… [+21498 chars]",,de,'Krieg'
https://www.n-tv.de/politik/15-13-Wagner-Chef-veroeffentlicht-Video-von-Saergen-mit-Kaempfern-der-ukrainischen-Armee--article23143824.html,https://www.n-tv.de/politik/15-13-Wagner-Chef-veroeffentlicht-Video-von-Saergen-mit-Kaempfern-der-ukrainischen-Armee--article23143824.html,0,www.n-tv.de,"Ukraine-Krieg im Liveticker: +++ 15:13 Wagner-Chef veröffentlicht Video von Särgen mit ""Kämpfern der ukrainischen Armee"" +++","Berlin, Washington, Br\u00fcssel - \u00fcberall. n-tv berichtet von allen wichtigen Schaupl\u00e4tzen der Innen- und Au\u00dfenpolitik.",https://bilder2.n-tv.de/img/incoming/crop23332537/9041326157-cImg_16_9-w1200/Liveticker1-grau-1-Kopie.jpg,2023-03-04T00:23:00Z,,"Der Gründer der russischen Söldnergruppe Wagner hat ein Video veröffentlicht, auf dem angeblich Särge mit den Leichen ukrainischer Soldaten zu sehen sind. Dies berichtet die Nachrichtenagentur Reuter… [+20872 chars]",,de,'Krieg'
https://www.n-tv.de/politik/17-25-Ukrainischer-Militaersprecher-dementiert-Truppenrueckzug-aus-Bachmut--article23143824.html,https://www.n-tv.de/politik/17-25-Ukrainischer-Militaersprecher-dementiert-Truppenrueckzug-aus-Bachmut--article23143824.html,0,www.n-tv.de,Ukraine-Krieg im Liveticker: +++ 17:25 Ukrainischer Militärsprecher dementiert Truppenrückzug aus Bachmut +++,"Berlin, Washington, Br\u00fcssel - \u00fcberall. n-tv berichtet von allen wichtigen Schaupl\u00e4tzen der Innen- und Au\u00dfenpolitik.",https://bilder2.n-tv.de/img/incoming/crop23332537/9041326157-cImg_16_9-w1200/Liveticker1-grau-1-Kopie.jpg,2023-03-04T00:23:00Z,,"Russland hat die Kontrolle über die östliche Stadt Bakhmut nicht übernommen, sagte Serhii Cherevatyi, Sprecher der ukrainischen Streitkräfte im Osten des Landes, gegenüber CNN. Die ukrainischen Trupp… [+24505 chars]",,de,'Ukraine'
https://www.n-tv.de/politik/17-45-Georgiens-Ex-Praesident-Putin-wollte-mich-aufhaengen--article23143824.html,https://www.n-tv.de/politik/17-45-Georgiens-Ex-Praesident-Putin-wollte-mich-aufhaengen--article23143824.html,0,www.n-tv.de,Ukraine-Krieg im Liveticker: +++ 17:45 Georgiens Ex-Präsident: Putin wollte mich aufhängen +++,"Berlin, Washington, Br\u00fcssel - \u00fcberall. n-tv berichtet von allen wichtigen Schaupl\u00e4tzen der Innen- und Au\u00dfenpolitik.",https://bilder2.n-tv.de/img/incoming/crop23332537/9041326157-cImg_16_9-w1200/Liveticker1-grau-1-Kopie.jpg,2023-03-04T00:23:00Z,,"Georgiens Ex-Präsident Micheil Saakaschwili geht davon aus, dass er auf Geheiß des russischen Präsidenten Wladimir Putin inhaftiert wurde. ""Ich bin mir absolut sicher. Putin sagte, er würde mich an d… [+25391 chars]",,de,'Krieg'
https://www.n-tv.de/politik/19-10-Suedukrainisches-Nikopol-steht-unter-Beschuss-Todesopfer-und-zerstoerte-Gasleitungen--article23143824.html,https://www.n-tv.de/politik/19-10-Suedukrainisches-Nikopol-steht-unter-Beschuss-Todesopfer-und-zerstoerte-Gasleitungen--article23143824.html,0,www.n-tv.de,Ukraine-Krieg im Liveticker: +++ 19:10 Südukrainisches Nikopol steht unter Beschuss – Todesopfer und zerstörte Gasleitungen +++,"Berlin, Washington, Br\u00fcssel - \u00fcberall. n-tv berichtet von allen wichtigen Schaupl\u00e4tzen der Innen- und Au\u00dfenpolitik.",https://bilder2.n-tv.de/img/incoming/crop23332537/9041326157-cImg_16_9-w1200/Liveticker1-grau-1-Kopie.jpg,2023-03-04T00:23:00Z,,"Die südukrainische Stadt Nikopol steht unter Beschuss, wie die ukrainische Generalstaatsanwaltschaft mitteilt. In ihrem jüngsten Telegrammpost erklärt die Behörde, dass bei dem russischen Beschuss mi… [+27539 chars]",,de,'Ukraine'
https://www.n-tv.de/politik/13-13-EU-Parlamentschefin-Metsola-trifft-Selenskyj--article23143824.html,https://www.n-tv.de/politik/13-13-EU-Parlamentschefin-Metsola-trifft-Selenskyj--article23143824.html,0,www.n-tv.de,Ukraine-Krieg im Liveticker: +++ 13:13 EU-Parlamentschefin Metsola trifft Selenskyj +++,"Berlin, Washington, Br\u00fcssel - \u00fcberall. n-tv berichtet von allen wichtigen Schaupl\u00e4tzen der Innen- und Au\u00dfenpolitik.",https://bilder2.n-tv.de/img/incoming/crop23332537/9041326157-cImg_16_9-w1200/Liveticker1-grau-1-Kopie.jpg,2023-03-04T00:23:00Z,,EU-Parlamentspräsidentin Roberta Metsola hat heute bei einem Besuch im westukrainischen Lwiw Blumen an einem Denkmal für gefallene Soldaten niedergelegt. Mit der Geste im Namen aller Europäer gedenke… [+17826 chars],,de,'Ukraine'
https://www.n-tv.de/politik/14-20-Von-der-Leyen-kuendigt-Deal-zur-Strafverfolgung-an--article23143824.html,https://www.n-tv.de/politik/14-20-Von-der-Leyen-kuendigt-Deal-zur-Strafverfolgung-an--article23143824.html,0,www.n-tv.de,Ukraine-Krieg im Liveticker: +++ 14:20 Von der Leyen kündigt Deal zur Strafverfolgung an +++,"Berlin, Washington, Br\u00fcssel - \u00fcberall. n-tv berichtet von allen wichtigen Schaupl\u00e4tzen der Innen- und Au\u00dfenpolitik.",https://bilder2.n-tv.de/img/incoming/crop23332537/9041326157-cImg_16_9-w1200/Liveticker1-grau-1-Kopie.jpg,2023-03-04T00:23:00Z,,"Bei einer internationalen Konferenz in Lwiw soll an diesem Wochenende ein erster wichtiger Schritt unternommen werden, um Russland für Kriegsverbrechen zur Verantwortung zu ziehen. Wie EU-Kommissions… [+19557 chars]",,de,'Kreml'
https://www.n-tv.de/politik/18-41-Lettischer-Regierungschef-Kampfjet-Lieferung-nur-noch-Frage-der-Zeit--article23143824.html,https://www.n-tv.de/politik/18-41-Lettischer-Regierungschef-Kampfjet-Lieferung-nur-noch-Frage-der-Zeit--article23143824.html,0,www.n-tv.de,"Ukraine-Krieg im Liveticker: +++ 18:41 Lettischer Regierungschef: Kampfjet-Lieferung ""nur noch Frage der Zeit"" +++","Berlin, Washington, Br\u00fcssel - \u00fcberall. n-tv berichtet von allen wichtigen Schaupl\u00e4tzen der Innen- und Au\u00dfenpolitik.",https://bilder2.n-tv.de/img/incoming/crop23332537/9041326157-cImg_16_9-w1200/Liveticker1-grau-1-Kopie.jpg,2023-03-04T00:23:00Z,,"Der lettische Ministerpräsident Krijnis Kari fordert von Europa, die Rüstungsindustrien hochzufahren. Vor allem Deutschland habe die ""besten Voraussetzungen, um Europas Verteidigung zu stärken"", sagt… [+26916 chars]",,de,'Ukraine'
https://www.n-tv.de/politik/12-22-Russisches-Maedchen-bleibt-wegen-Kriegs-Protest-in-Waisenhaus--article23143824.html,https://www.n-tv.de/politik/12-22-Russisches-Maedchen-bleibt-wegen-Kriegs-Protest-in-Waisenhaus--article23143824.html,0,www.n-tv.de,Ukraine-Krieg im Liveticker: +++ 12:22 Russisches Mädchen bleibt wegen Kriegs-Protest in Waisenhaus +++,"Berlin, Washington, Br\u00fcssel - \u00fcberall. n-tv berichtet von allen wichtigen Schaupl\u00e4tzen der Innen- und Au\u00dfenpolitik.",https://bilder2.n-tv.de/img/incoming/crop23332537/9041326157-cImg_16_9-w1200/Liveticker1-grau-1-Kopie.jpg,2023-03-04T00:23:00Z,,"Das russische Mädchen Mascha, das im April 2022 ein Bild malte mit der Botschaft ""Nein zum Krieg"", muss weiterhin von ihrem Vater getrennt im Waisenhaus leben. Die Zwölfjährige hatte laut dem britisc… [+16329 chars]",,de,'Krieg'
