index,url,valid,domain,title,description,image,published,archive,content,quote,language,keyword
https://www.welt.de/politik/ausland/article69521718f6fc544dba9b60ea/ukraine-krieg-selenskyj-ruft-nach-2000-angriffen-in-der-neujahrswoche-zur-verstaerkten-verteidigungshilfe-auf-liveticker.html,https://www.welt.de/politik/ausland/article69521718f6fc544dba9b60ea/ukraine-krieg-selenskyj-ruft-nach-2000-angriffen-in-der-neujahrswoche-zur-verstaerkten-verteidigungshilfe-auf-liveticker.html,0,www.welt.de,Selenskyj ruft nach 2000 Angriffen in der Neujahrswoche zur verstärkten Verteidigungshilfe auf,"Nach rund 2000 russischen Luftangriffen in der Neujahrswoche hat Präsident Wolodymyr Selenskyj die Verbündeten zur weiteren Unterstützung aufgerufen. Mehr als 1070 Gleitbomben, knapp 1000 Drohnen und sechs Raketen wurden laut Angaben der Ukraine eingesetzt. M…",https://images.welt.de/69521718f6fc544dba9b60ea/5981e89a749681404023f0880dbcc1c5/ci16x9-w1200/dpa-com-20090101-260102-935-1053423-jpg,2026-01-04T10:49:00Z,,"Nach rund 2000 russischen Luftangriffen in der Neujahrswoche hat Präsident Wolodymyr Selenskyj die Verbündeten zur weiteren Unterstützung aufgerufen. Mehr als 1070 Gleitbomben, knapp 1000 Drohnen und… [+25917 chars]",,de,'Unterstützung'
https://www.faz.net/aktuell/politik/ukraine/ukraine-liveticker-selenskyj-2000-russische-angriffe-in-der-neujahrswoche-faz-110683325.html,https://www.faz.net/aktuell/politik/ukraine/ukraine-liveticker-selenskyj-2000-russische-angriffe-in-der-neujahrswoche-faz-110683325.html,0,www.faz.net,Krieg in der Ukraine: Selenskyj: 2000 russische Angriffe in der Neujahrswoche,Internationale Sicherheitsberater setzen Ukraine-Gespräche in Kiew fort +++ Kiesewetter und Strack-Zimmermann: Einsatz der Bundeswehr in Ukraine ist möglich +++ alle Neuigkeiten im Liveblog,https://media0.faz.net/image/w1200h627/5cb1d206e166/w2000h1045x0y144o/202601/43601.0.1631394172/wolodymyr-selenskyj-am-samstag.webp,2026-01-04T11:03:27Z,,"Mit einer ungewöhnlichen Übergabezeremonie sind am Donnerstagabend Russlands Bemühungen, den amerikanischen Präsidenten Donald Trump für eine härtere Gangart gegenüber der Ukraine zu gewinnen, in ein… [+3246 chars]",,de,'Ukraine'
https://www.morgenpost.de/politik/article410837046/ukraine-russland-putin-entfuehrte-kinder-deportationen-adoption-umerziehung-kim-jong-un.html,https://www.morgenpost.de/politik/article410837046/ukraine-russland-putin-entfuehrte-kinder-deportationen-adoption-umerziehung-kim-jong-un.html,0,www.morgenpost.de,Ukraine: Entführte Kinder tauchen in entlegenem Schurkenstaat wieder auf,Russland entführt nach Überzeugung von Ermittlern ukrainische Kinder. Nun findet sich ihre Spur in einem weit entfernten Land wieder.,https://img.sparknews.funkemedien.de/410815672/410815672_1767122436_v16_9_1600.jpeg,2026-01-04T12:04:14Z,,"Die tragischsten Opfer von Kriegen, so wird oft betont, sind die Kinder aus dem jeweiligen Konfliktgebiet. Schließlich trifft sie besonders wenig Schuld daran, dass ein Krieg ausgebrochen ist. Mit de… [+5858 chars]",,de,'Ukraine'
https://www.diepresse.com/20449711/noch-steht-russland-nicht-am-rande-des-abgrunds,https://www.diepresse.com/20449711/noch-steht-russland-nicht-am-rande-des-abgrunds,0,www.diepresse.com,Noch steht Russland nicht am Rande des Abgrunds,"Nichts deutet derzeit darauf hin, dass Kremlchef Wladimir Putin seine Eroberungspläne in der Ukraine aufgegeben hätte.",https://img.diepresse.com/public/incoming/x0nobp-thumbnail_02jan26-russland-europa-peter-kufner-kuf-online.jpg/alternates/DPR_SOCIAL_MEINUNG/thumbnail_02jan26%20russland%20europa%20-%20peter%20kufner%20kuf%20-online.jpg,2026-01-04T14:40:51Z,,"Nichts deutet derzeit darauf hin, dass Kremlchef Wladimir Putin seine Eroberungspläne in der Ukraine aufgegeben hätte.
Mehr als 40 Jahre berichtete John Simpson für die BBC aus 120 Ländern. Seit den… [+7073 chars]",,de,'Wladimir Putin'
https://www.tagesspiegel.de/meinung/leserbriefe/leserbrief-zum-blackout-in-berlin-wo-bleiben-die-katastrophen-leuchtturme-15102924.html,https://www.tagesspiegel.de/meinung/leserbriefe/leserbrief-zum-blackout-in-berlin-wo-bleiben-die-katastrophen-leuchtturme-15102924.html,0,www.tagesspiegel.de,Leserbrief zum Blackout in Berlin: Wo bleiben die Katastrophen-Leuchttürme?,Unser Leser weist auf ein lange verschlepptes Projekt hin und hofft nach dem Stromausfall im Südwesten nun auf Umsetzung. Er plädiert auch für bessere Dämmung. Und was meinen Sie?,https://www.tagesspiegel.de/images/15099743/alternates/BASE_16_9_W1400/1767604450000/stromausfall-berlin.jpeg,2026-01-05T09:24:41Z,,"Seit fast 20 Jahren wird in Berlin auf Initiative des Bezirks Steglitz-Zehlendorf das Vorhaben Katastrophen-Leuchttürme vorbereitet. Dieses sieht vor, dass es in jedem Bezirk drei Standorte gibt, die… [+3831 chars]",,de,'Dämmung'
https://taz.de/Russische-Techplattform-Yandex/Dzen/!6142833/,https://taz.de/Russische-Techplattform-Yandex/Dzen/!6142833/,0,taz.de,Russische Techplattform Yandex/Dzen: Eine Startseite für Kreml-Propaganda,Russische Kriegspropaganda wird in Deutschland trotz EU-Verbot weiterverbreitet. Über Yandex/Dzen erreichen kremlnahe Medien ein großes Publikum.,https://taz.de/picture/8164379/1200/40017284.jpeg,2026-01-05T14:48:00Z,,Russische Kriegspropaganda wird in Deutschland trotz EU-Verbot weiterverbreitet. Über Yandex/Dzen erreichen kremlnahe Medien ein großes Publikum. mehr...,,de,'Kreml'
https://www.faz.net/aktuell/politik/usa-unter-trump/trump-widerspricht-kreml-ich-bin-nicht-begeistert-von-putin-110813902.html,https://www.faz.net/aktuell/politik/usa-unter-trump/trump-widerspricht-kreml-ich-bin-nicht-begeistert-von-putin-110813902.html,0,www.faz.net,Trump widerspricht Kreml: „Ich bin nicht begeistert von Putin“,Der US-Präsident distanziert sich von russischen Behauptungen über Drohnenangriffe auf eine Residenz des Kremlchefs. Der reagiert derweil nur milde auf Washingtons Intervention in Venezuela.,https://media0.faz.net/image/w1200h627/347fc4b360c8/w6000h3135x0y433o/202601/43601.0.1635495520/der-amerikanische-praesident.webp,2026-01-05T15:16:16Z,,Die russischen Bemühungen um die Gunst des amerikanischen Präsidenten Donald Trump haben einen Rückschlag erlitten. An Bord der Air Force One wurde Trump am Sonntag auf dem Rückflug aus Florida nach … [+3111 chars],,de,'Wladimir Putin'
https://www.zeit.de/news/2026-01/06/darum-geht-es-beim-ukraine-treffen-in-paris,https://www.zeit.de/news/2026-01/06/darum-geht-es-beim-ukraine-treffen-in-paris,0,www.zeit.de,Ukraine-Krieg: Darum geht es beim Ukraine-Treffen in Paris,Hier finden Sie Informationen zu dem Thema „Ukraine-Krieg“. Lesen Sie jetzt „Darum geht es beim Ukraine-Treffen in Paris“.,https://img.zeit.de/news/2026-01/06/darum-geht-es-beim-ukraine-treffen-in-paris-image-group/wide__1300x731,2026-01-06T03:00:17Z,,Die westlichen Unterstützer der Ukraine wollen an diesem Dienstag mit Vertretern der USA in Paris über die Absicherung eines möglichen Waffenstillstands oder Friedens für das von Russland angegriffen… [+5473 chars],,de,'Krieg'
https://www.stern.de/kaufkosmos/deals/luftentfeuchter-fuer-kleine-raeume---heute-46-prozent-guenstiger-37013526.html,https://www.stern.de/kaufkosmos/deals/luftentfeuchter-fuer-kleine-raeume---heute-46-prozent-guenstiger-37013526.html,0,www.stern.de,46 % Rabatt: Heute stark reduziert: Luftentfeuchter für kleine Räume,Luftentfeuchter sind nicht nur im Winter ein Segen. Sie reduzieren das Schimmelrisiko und verbessern das Raumklima. Amazon lockt heute mit einem starken Deal.,https://image.stern.de/37013690/t/h_/v2/w1440/r1.7778/-/deal-news-luftentfeuchter-aufmacher-januar-2026.jpg,2026-01-06T08:48:00Z,,"Kopiere den aktuellen Link
Zur Merkliste hinzufügen
Luftentfeuchter sind nicht nur im Winter ein Segen. Sie reduzieren das Schimmelrisiko und verbessern das Raumklima. Amazon lockt heute mit einem … [+1992 chars]",,de,'Winter'
https://www.n-tv.de/politik/Wir-sollten-vermeiden-uns-durch-die-Krise-zu-sparen-id30208163.html,https://www.n-tv.de/politik/Wir-sollten-vermeiden-uns-durch-die-Krise-zu-sparen-id30208163.html,0,www.n-tv.de,"Hoffmann im ntv-Frühstart: ""Wir sollten vermeiden, uns durch die Krise zu sparen""",CSU-Landesgruppenchef Alexander Hoffmann warnt vor einem Sparkurs in der Krise und spricht sich für eine schnellere Entlastung von Unternehmen aus. Die CSU will die Körperschaftsteuer bereits 2026 senken.,https://www.n-tv.de/img/30207066/1767690160/Img_16_9/1200/Unbenannt.jpg,2026-01-06T11:24:13Z,,CSU-Landesgruppenchef Alexander Hoffmann warnt vor einem Sparkurs in der Krise und spricht sich für eine schnellere Entlastung von Unternehmen aus. Die CSU will die Körperschaftsteuer bereits 2026 se… [+2557 chars],,de,'sparen'
https://www.stern.de/wirtschaft/immobilien/waermepumpenstrom-vergleich-36985186.html,https://www.stern.de/wirtschaft/immobilien/waermepumpenstrom-vergleich-36985186.html,0,www.stern.de,Hunderte Euro sparen: Wärmepumpenstrom-Vergleich: Der passende Tarif für Ihre Heizung,"Wärmepumpen heizen zwar effizient, doch die Stromkosten können erheblich sein. Das muss nicht sein. stern erklärt, worauf Sie beim Wärmepumpenstrom-Vergleich achten müssen.",https://image.stern.de/36978168/t/bU/v3/w1440/r1.7778/-/stern-strom-waermepumpenstrom-vergleich.jpg,2026-01-06T13:23:00Z,,"Kopiere den aktuellen Link
Zur Merkliste hinzufügen
Trotz negativer Berichterstattung hält der Siegeszug der Wärmepumpen ungebrochen an und bei Neubauten dominieren sie bereits den Heizmarkt. Techn… [+14601 chars]",,de,'Dämmung'
https://www.stern.de/politik/ausland/ukraine-krieg--koalition-der-willigen-beraet-ueber-sicherheit-fuer-die-ukraine-37013118.html,https://www.stern.de/politik/ausland/ukraine-krieg--koalition-der-willigen-beraet-ueber-sicherheit-fuer-die-ukraine-37013118.html,0,www.stern.de,Ukraine-Krieg: Koalition der Willigen berät über Sicherheit für die Ukraine,"In Paris beraten Vertreter aus 35 Ländern, wie ein Waffenstillstand für die Ukraine überwacht und abgesichert werden könnte. Auch eine multinationale Friedenstruppe ist Thema. Macht Deutschland mit?",https://image.stern.de/37015654/t/Fa/v1/w1440/r1.7778/-/06--3nix3d75f7v4axs2048jpeg---51d1838206b1fd28.jpg,2026-01-06T14:59:11Z,,"Kopiere den aktuellen Link
Zur Merkliste hinzufügen
In Paris beraten Vertreter aus 35 Ländern, wie ein Waffenstillstand für die Ukraine überwacht und abgesichert werden könnte. Auch eine multinatio… [+3883 chars]",,de,'Ukraine'
https://www.faz.net/aktuell/wirtschaft/russlands-autobranche-keiner-will-mehr-lada-fahren-110813818.html,https://www.faz.net/aktuell/wirtschaft/russlands-autobranche-keiner-will-mehr-lada-fahren-110813818.html,0,www.faz.net,Russlands Autobranche: Keiner will mehr Lada fahren,China dominiert den russischen Automarkt. Doch dem Kreml gefällt das nicht: Die heimische Industrie kann mit der Konkurrenz nicht mithalten.,https://media0.faz.net/image/w1200h627/3d6e0524608f/w3000h1567x0y176o/082023/1.10813951/chinesische-autos-fuer.webp,2026-01-06T16:40:09Z,,"Wie China seit 2022 den russischen Automarkt erobert hat, ist im Moskauer Zentrum überall zu sehen: Selbst die Hauptstadtpolizei fährt jetzt Haval. Und auch viele der Zehntausenden Taxis, dem beliebt… [+162 chars]",,de,'Industrie'
https://www.faz.net/aktuell/gesellschaft/blackout-in-berlin-wie-ich-an-tag-vier-wieder-strom-bekam-110814563.html,https://www.faz.net/aktuell/gesellschaft/blackout-in-berlin-wie-ich-an-tag-vier-wieder-strom-bekam-110814563.html,0,www.faz.net,"Blackout in Berlin: Wir haben wieder Strom, aber noch keine Sicherheit","Nach vier Tagen Stromausfall gehen im Berliner Südwesten immer mehr Lichter an. Unsere Autorin spürt den Stromneid in sich aufkommen, als plötzlich das Licht mit ihrer Hausnummer flackert.",https://media0.faz.net/image/w1200h627/9b8f57abd045/w3000h1567x0y216o/012026/1.10814556/fruehstueckspause-und-alle.webp,2026-01-06T17:19:51Z,,"Der vierte Tag des Stromausfalls beginnt mit starken Kopfschmerzen und einem lauten Brummen. Während die Temperaturen weiter sinken, steigt der Lärmpegel. Mal informiert die Polizei über Lautsprecher… [+4264 chars]",,de,'Sicherheit'
https://www.stern.de/politik/ausland/ukraine-krieg--koalition-der-willigen-will-ukraine-sicherheit-garantieren-37013118.html,https://www.stern.de/politik/ausland/ukraine-krieg--koalition-der-willigen-will-ukraine-sicherheit-garantieren-37013118.html,0,www.stern.de,Ukraine-Krieg: Koalition der Willigen will Ukraine Sicherheit garantieren,Paris - Westliche Unterstützer der Ukraine haben in Paris mit Vertretern der USA über die Absicherung eines möglichen Waffenstillstands oder Friedens,https://image.stern.de/37016132/t/_r/v1/w1440/r1.7778/-/06--rf5qz4sgjyv13axs2048jpeg---1959cfcd2dbb59f4.jpg,2026-01-06T18:41:31Z,,"Kopiere den aktuellen Link
Zur Merkliste hinzufügen
Westliche Länder planen, der Ukraine rechtlich verbindliche Sicherheitsgarantien zu geben. Wie die USA und Europa dabei zusammenarbeiten wollen.… [+3974 chars]",,de,'Kreml'
https://www.n-tv.de/politik/Bundeswehr-koennte-Waffenstillstand-in-der-Ukraine-auf-Nato-Gebiet-absichern-id30210379.html,https://www.n-tv.de/politik/Bundeswehr-koennte-Waffenstillstand-in-der-Ukraine-auf-Nato-Gebiet-absichern-id30210379.html,0,www.n-tv.de,"Merz: ""Wir schließen nichts aus"": Bundeswehr könnte Waffenstillstand in der Ukraine auf Nato-Gebiet absichern","Mehrere Staaten erklären im September erstmals, Truppen zur Friedensabsicherung in der Ukraine entsenden zu wollen, wenn es denn so weit ist. Jetzt schließt sich Kanzler Merz an. Er macht jedoch eine Bedingung geltend.",https://www.n-tv.de/img/30210409/1767730803/Img_16_9/1200/567447089.jpg,2026-01-06T19:51:10Z,,"Merz: ""Wir schließen nichts aus""Bundeswehr könnte Waffenstillstand in der Ukraine auf Nato-Gebiet absichern
Mehrere Staaten erklären im September erstmals, Truppen zur Friedensabsicherung in der Ukr… [+6062 chars]",,de,'Kreml'
https://www.n-tv.de/politik/21-14-Witkoff-nennt-Ukraine-Sicherheitsplaene-weitgehend-abgeschlossen-id30211042.html,https://www.n-tv.de/politik/21-14-Witkoff-nennt-Ukraine-Sicherheitsplaene-weitgehend-abgeschlossen-id30211042.html,0,www.n-tv.de,"Ukraine-Krieg im Liveticker: +++ 21:14 Witkoff nennt Ukraine-Sicherheitspläne ""weitgehend abgeschlossen"" +++","Berlin, Washington, Brüssel - überall. ntv berichtet von allen wichtigen Schauplätzen der Innen- und Außenpolitik.",https://www.n-tv.de/img/2339153/1721988811/Img_16_9/1200/Ukraine-Liveticker.jpg,2026-01-06T21:00:00Z,,"Der US-Sondergesandte Steve Witkoff bezeichnet die Planungen für die Sicherheitsgarantien für die Ukraine als ""weitgehend abgeschlossen"". ""Die Menschen in der Ukraine müssen wissen, dass wenn (der Kr… [+27307 chars]",,de,'Sicherheit'
https://www.bild.de/politik/ausland-und-internationales/trump-kuendigt-import-an-venezuela-wird-oel-an-die-usa-liefern-695da63d4d1d5f581eeadd7f,https://www.bild.de/politik/ausland-und-internationales/trump-kuendigt-import-an-venezuela-wird-oel-an-die-usa-liefern-695da63d4d1d5f581eeadd7f,0,www.bild.de,Trump kündigt Import an - Venezuela wird Öl an die USA liefern,Trump kündigt an: USA erhalten bald Millionen Barrel Öl aus Venezuela. Treffen mit großen Ölkonzernen im Weißen Haus geplant.,"https://images.bild.de/695da63d4d1d5f581eeadd7f/290ebbf4f12b4d3bf090ed99368cac54,4ba6f0b3?w=1280",2026-01-07T00:42:25Z,,"Washington/Caracas Donald Trump (79) kündigt an, dass die USA bald große Mengen Öl aus Venezuela bekommen sollen. Verkauft werden soll es zu Marktpreisen von den sogenannten Übergangsbehörden, wie de… [+1651 chars]",,de,'Import'
https://www.faz.net/aktuell/wirtschaft/klima-nachhaltigkeit/deutschland-erreicht-klimaziel-2025-doch-2030-drohen-strafen-accg-200414975.html,https://www.faz.net/aktuell/wirtschaft/klima-nachhaltigkeit/deutschland-erreicht-klimaziel-2025-doch-2030-drohen-strafen-accg-200414975.html,0,www.faz.net,Klimaschutz: Deutschland drohen ab 2030 drastische Strafen,"Im vergangenen Jahr wurde das Klimaziel erreicht – auch, weil die Industrie weniger produziert hat. Doch insgesamt gehen die Emissionen zu langsam zurück. Mittelfristig könnte das teuer werden.",https://media0.faz.net/image/w1200h627/be714b408396/w3000h1567x0y216o/202601/43601.0.1625098694/im-verkehrssektor-sinken-die.webp,2026-01-07T06:45:53Z,,"Das Tempo beim Klimaschutz in Deutschland hat sich im vergangenen Jahr einer Studie zufolge deutlich verlangsamt. Das nationale Klimaziel für 2025 wurde aber erreicht, wie die Denkfabrik Agora Energi… [+6503 chars]",,de,'Industrie'
https://www.welt.de/politik/ausland/article695b502cfb77630dac277a28/ukraine-krieg-heilige-mission-putin-vergleicht-russische-soldaten-mit-jesus-liveticker.html,https://www.welt.de/politik/ausland/article695b502cfb77630dac277a28/ukraine-krieg-heilige-mission-putin-vergleicht-russische-soldaten-mit-jesus-liveticker.html,0,www.welt.de,„Heilige Mission“ – Putin vergleicht russische Soldaten mit Jesus,In Paris hat die „Koalition der Willigen“ eine Erklärung für den Einsatz ausländischer Truppen in der Ukraine unterzeichnet. Gleichzeitig sorgt Putin mit einem Jesus-Vergleich für Aufsehen. Mehr im Liveticker.,https://images.welt.de/695b502cfb77630dac277a28/15d463097c82c6468df2d7b68cc8a4cd/ci16x9-w1200/dpa-com-20090101-260106-99-94609-jpg,2026-01-07T07:45:00Z,,In Paris hat die Koalition der Willigen eine Erklärung für den Einsatz ausländischer Truppen in der Ukraine unterzeichnet. Gleichzeitig sorgt Putin mit einem Jesus-Vergleich für Aufsehen. Mehr im Liv… [+14114 chars],,de,'Ukraine'
https://www.zeit.de/wissen/umwelt/2026-01/deutschland-emissionsrechte-verkauf-co2-gxe,https://www.zeit.de/wissen/umwelt/2026-01/deutschland-emissionsrechte-verkauf-co2-gxe,0,www.zeit.de,CO₂-Ausstoß: Einnahmen aus Verkauf von Emissionsrechten 2025 so hoch wie nie,"Deutschland hat im vergangenen Jahr 21,4 Milliarden Euro mit dem Verkauf von Verschmutzungsrechten eingenommen. Das Geld soll unter anderem die Energiewende finanzieren.",https://img.zeit.de/2026-01/deutschland-emissionsrechte-verkauf-co2-bild/wide__1300x731,2026-01-07T07:48:22Z,,"Deutschland hat im vergangenen Jahr einen Rekord bei den Einnahmen durch den Verkauf von CO-Verschmutzungsrechten erzielt. Der Emissionshandel habe 21,4 Milliarden Euro eingebracht, teilte die Deutsc… [+3341 chars]",,de,'heizen'
https://www.telepolis.de/article/US-Militaereinsatz-in-Venezuela-Krieg-ist-Frieden-11132346.html,https://www.telepolis.de/article/US-Militaereinsatz-in-Venezuela-Krieg-ist-Frieden-11132346.html,0,www.telepolis.de,US-Militäreinsatz in Venezuela: Krieg ist Frieden?,Ein kriegerischer Einsatz ohne klare Begriffe. Wie Leitmedien den US-Einsatz in Venezuela darstellen. Eine Medienkritik.,https://heise.cloudimg.io/bound/1200x1200/q85.png-lossy-85.webp-lossy-85.foil1/_www-heise-de_/imgs/18/5/0/0/5/2/2/3/Master_Voges-a657887660785ec0.jpg,2026-01-07T08:15:00Z,,"KI generierte Grafik
Ein kriegerischer Einsatz ohne klare Begriffe. Wie Leitmedien den US-Einsatz in Venezuela darstellen. Eine Medienkritik.
Vollkommen zu Recht wird in wichtigen Medien hierzuland… [+5565 chars]",,de,'Krieg'
https://www.focus.de/politik/ausland/trump-modi-unzufrieden-wegen-us-zoellen-indien-muss-import-von-russischem-oel-kuerzen_3c1b0c70-d066-4ad1-87df-2df98e5b0ba2.html,https://www.focus.de/politik/ausland/trump-modi-unzufrieden-wegen-us-zoellen-indien-muss-import-von-russischem-oel-kuerzen_3c1b0c70-d066-4ad1-87df-2df98e5b0ba2.html,0,www.focus.de,Trump: Modi unzufrieden wegen US-Zöllen – Indien muss Import von russischem Öl kürzen,"US-Präsident Donald Trump hat erklärt, dass Indiens Premierminister Modi aufgrund der hohen US-Zölle unglücklich sei. Trotz reduzierter Käufe von russischem Öl bleibt Indien ein wichtiger Abnehmer, was Trump zu weiteren Strafzöllen veranlassen könnte.",https://quadro.burda-forward.de/ctf/ffc7b9a5-7803-4cae-a1bf-4ea81e915422.f348d982-bd4b-43cd-ac0c-5654ca5391cc.jpg?im=RegionOfInterestCrop%3D%281200%2C630%29%2CregionOfInterest%3D%28617%2C430%29&hash=9663b6bfc9e32c1a0bdcc2f02fc12bb147a232317a06b9550b6a3f16c394ad0b,2026-01-07T08:20:08Z,,"US-Präsident Donald Trump hat erklärt, dass Indiens Premierminister Narendra Modi unzufrieden mit ihm sei. Grund dafür seien die hohen Zölle, die die USA auf indische Waren erhoben haben, wie Bloombe… [+1710 chars]",,de,'Import'
https://www.bild.de/politik/ausland-und-internationales/usa-jagen-russischen-tanker-durch-den-atlantik-kreml-schickt-u-boot-695e04ffc2e5df973db23ddb,https://www.bild.de/politik/ausland-und-internationales/usa-jagen-russischen-tanker-durch-den-atlantik-kreml-schickt-u-boot-695e04ffc2e5df973db23ddb,0,www.bild.de,Verfolgung auf offenem Meer - USA jagen russischen Tanker – Kreml schickt U-Boot,"Ein rostiger Öltanker wird zum Zankapfel zwischen Washington und Moskau. Die US-Küstenwache will ihn beschlagnahmen, der Kreml reagiert.","https://images.bild.de/695e04ffc2e5df973db23ddb/8f8f6089319883864c229777d30ab7b8,48e5c3f1?w=1280",2026-01-07T08:27:36Z,,Washington Ein rostiger Öltanker wird zum Zankapfel zwischen Washington und Moskau. Der mit Venezuela verbundene Tanker Bella 1 gehört zur berüchtigten Schattenflotte. Seit mehr als zwei Wochen versu… [+3280 chars],,de,'Wladimir Putin'
https://www.focus.de/politik/ausland/europaeer-wollen-bodentruppen-in-die-ukraine-schicken-doch-brisante-details-fehlen_bb8cdf7f-2a38-404a-a412-ca041a4a4279.html,https://www.focus.de/politik/ausland/europaeer-wollen-bodentruppen-in-die-ukraine-schicken-doch-brisante-details-fehlen_bb8cdf7f-2a38-404a-a412-ca041a4a4279.html,0,www.focus.de,Europäer wollen Bodentruppen in die Ukraine schicken – doch brisante Details fehlen,Die Ukraine steht vor einem möglichen Sicherheitsabkommen mit westlichen Staaten. Es fehlen jedoch entscheidende Details für eine echte Garantie.,https://quadro.burda-forward.de/ctf/327fe119-2899-4870-bf5a-a0dce102af0d.e3639029-e9a5-474b-9b73-f6a84a1f5baa.jpg?im=RegionOfInterestCrop%3D%281200%2C630%29%2CregionOfInterest%3D%281494%2C908%29&hash=392ee3d4b9b302b4d044f543617d22d1d88fae8f5787257b9cd674aaf64092e6,2026-01-07T08:39:05Z,,"Die Ukraine, die USA und europäische Staaten arbeiten an einem Sicherheitsabkommen, das einen erneuten Angriff Russlands verhindern soll. Laut dem Außenexperten des Telegraph, Roland Oliphant, sei da… [+1971 chars]",,de,'Wladimir Putin'
https://www.zeit.de/gesellschaft/2026-01/berlin-stromausfall-versorgung-anschlag-gxe,https://www.zeit.de/gesellschaft/2026-01/berlin-stromausfall-versorgung-anschlag-gxe,0,www.zeit.de,Anschlag auf Kabel: Stromausfall in Berlin soll im Laufe des Tages enden,Der Stromausfall in Berlin sollte eigentlich bis Donnerstag anhalten. Laut Bürgermeister Kai Wegner wird die Versorgung jedoch bereits heute ab 11 Uhr wiederhergestellt.,https://img.zeit.de/2026-01/stromausfall-berlin-bild-2/wide__1300x731,2026-01-07T08:47:00Z,,"Der Stromausfall im Südwesten Berlins soll bereits im Laufe des heutigen Mittwochs und somit früher als erwartet wieder vollständig behoben werden. ""Wir fahren heute ab 11.00 Uhr das Stromnetz in den… [+4409 chars]",,de,'Versorgung'
https://www.focus.de/politik/putin-nennt-ukraine-krieg-vor-kindern-eine-heilige-mission_4264b143-13ef-42bf-8c78-235fa056cc19.html,https://www.focus.de/politik/putin-nennt-ukraine-krieg-vor-kindern-eine-heilige-mission_4264b143-13ef-42bf-8c78-235fa056cc19.html,0,www.focus.de,"Putin nennt Ukraine-Krieg vor Kindern ""eine heilige Mission""",Bei einer orthodoxen Weihnachtsfeier am vergangenen Dienstag stellte der russische Präsident Wladimir Putin religiöse Bezüge zum Ukraine-Krieg dar. Vor Militärangehörigen mit Kindern hielt er eine Ansprache in einer Kapelle.,https://quadro.burda-forward.de/ctf/af0ca8f7-8efc-4fb8-af30-2d1a61a372ea.d37da497-b9c6-49e9-a7a1-13b7a272a348.jpg?im=RegionOfInterestCrop%3D%281200%2C630%29%2CregionOfInterest%3D%28856%2C232%29&hash=09f991635968c6aa45b1a702f913712af22ed3204b2e54f8411a77d044ecee2d,2026-01-07T09:29:09Z,,"Eine ""heilige Mission"". So beschrieb Wladimir Putin die Aufgabe der russischen Soldaten. Am vergangenen Dienstag hatte der russische Präsident eine orthodoxe Weihnachtsfeier in einer kleinen Kapelle … [+814 chars]",,de,'Wladimir Putin'
https://www.tagesspiegel.de/internationales/usa-wollen-an-venezuelas-ol-wie-sehr-konnte-trump-putins-wirtschaft-schaden-15106954.html,https://www.tagesspiegel.de/internationales/usa-wollen-an-venezuelas-ol-wie-sehr-konnte-trump-putins-wirtschaft-schaden-15106954.html,0,www.tagesspiegel.de,USA wollen an Venezuelas Öl: Wie sehr könnte Trump Putins Wirtschaft schaden?,Über zwei Jahrzehnte lang versorgte Russland Venezuela mit Geld und Waffen – im Tausch für Öl und Loyalität. Damit könnte nun Schluss sein. Doch wäre das wirklich so schlimm für den Kreml?,https://www.tagesspiegel.de/images/15106960/alternates/BASE_16_9_W1400/1767779143000/file-photo-russian-president-putin-and-venezuelan-president-maduro-meet-in-moscow.jpeg,2026-01-07T09:45:49Z,,Schon wieder hat es einen Verbündeten von Kremlchef Wladimir Putin erwischt. Nach dem Fall des syrischen Diktators Baschar al Assad im Dezember 2024 und nach der Schwächung des iranischen Regimes dur… [+855 chars],,de,'Kreml'
