index,url,valid,domain,title,description,image,published,archive,content,quote,language,keyword
https://wien.orf.at/stories/3192852/,https://wien.orf.at/stories/3192852/,0,wien.orf.at,Neue Energiesparhilfen für Kleinunternehmen,"Viele Wiener Kleinunternehmen spüren die Teuerung und die hohen Energiekosten stark. Um sie zu unterstützen, startet die Stadt Wien heute eine neue Förderung – mit bis zu 20.000 Euro für mehr Energieeffizienz. Zehn Millionen Euro werden dafür ausgeschüttet.",https://ibs.orf.at/wie?image=https%3A%2F%2Foekastatic.orf.at%2Fmims%2F2020%2F10%2F62%2Fcrops%2Fw%3D1200%2Ch%3D627%2Cq%3D75%2F492969_master_166062_vlcsnap-2020-03-04-17h23m20s832.jpg%3Fs%3Dc643888a50f178e2c65b370c1419a6bbf5c8c4e4,2023-02-01T08:44:59Z,,"Das Ziel der neuen Förderung, die durch die Wirtschaftsagentur Wien abgewickelt wird, ist es, Kleinunternehmen auf ihrem Weg zu mehr Nachhaltigkeit und Energieeffizienz zu begleiten. Die förderbaren … [+1749 chars]",,de,'Energie'
https://www.handelsblatt.com/unternehmen/energie/gasspeicher-in-deutschland-fuellstand-auf-79-prozent-gefallen/28819652.html,https://www.handelsblatt.com/unternehmen/energie/gasspeicher-in-deutschland-fuellstand-auf-79-prozent-gefallen/28819652.html,0,www.handelsblatt.com,Gasspeicher in Deutschland: Füllstand auf 79 Prozent gefallen,Ein hoher Gasspeicher-Füllstand ist für Deutschlands Gasversorgung in der Energiekrise essenziell. Wie steht es aktuell um die Gasreserven? Ein Überblick.,https://www.handelsblatt.com/images/gasspeicher-in-sachsen-anhalt/28877480/2-format2003.jpg,2023-02-01T12:22:16Z,https://web.archive.org/web/20230201135212/https://www.handelsblatt.com/unternehmen/energie/gasspeicher-in-deutschland-fuellstand-auf-79-prozent-gefallen/28819652.html,"Gasspeicher in Sachsen-AnhaltDer Gasspeicher-Füllstand in Deutschland ist in der Energiekrise zum wichtigen Faktor geworden.
(Foto: dpa)
Düsseldorf Ein stabiler Füllstand der deutschen Gasspeicher … [+7396 chars]",,de,'Gasmangel'
https://www.zeit.de/wirtschaft/2023-02/ursula-von-der-leyen-industrie-europa-milliarden-kosten,https://www.zeit.de/wirtschaft/2023-02/ursula-von-der-leyen-industrie-europa-milliarden-kosten,0,www.zeit.de,EU-Kommission: Rettung der europäischen Industrie kostet Hunderte Milliarden Euro,China und die USA subventionieren ihre Industrien mit Milliardensummen für grüne Technologien. Die EU-Kommission schlägt nun Alarm: Europa müsse dringend nachziehen.,,2023-02-01T12:52:57Z,,"When browsing with ads:
We collect personal data and also transmit it to third-party providers
 that help us improve and finance our digital content. Some of the information stored on your device, … [+732 chars]",,de,'Industrie'
https://www.golem.de/sonstiges/zustimmung/auswahl.html?from=https://www.golem.de/news/anzeige-t-i-s-p-zertifizierter-security-professional-werden-2302-171545.html&referer=https://t.co/025889297a,https://www.golem.de/sonstiges/zustimmung/auswahl.html?from=https://www.golem.de/news/anzeige-t-i-s-p-zertifizierter-security-professional-werden-2302-171545.html&referer=https://t.co/025889297a,0,www.golem.de,Anzeige: T.I.S.P.-zertifizierter Security Professional werden,"Das Zertifikat TeleTrusT Information Security Professional (T.I.S.P.) bescheinigt fundierte Kenntnisse auf dem Gebiet der IT-Sicherheit. Ein fünftägiger Online-Workshop der Golem Karrierewelt bereitet auf die Prüfung vor. (Golem Karrierewelt, Server-Applikati…",,2023-02-01T15:00:03Z,,"Besuchen Sie Golem.de wie gewohnt mit Werbung und Tracking,
 indem Sie der Nutzung aller Cookies zustimmen.
 Details zum Tracking finden Sie im Privacy Center.
Skript wurde nicht geladen. Informat… [+607 chars]",,de,'Sicherheit'
https://www.welt.de/gesundheit/article243551111/Urbane-Hitzeinseln-Mehr-Stadtbaeume-koennen-Menschenleben-retten.html,https://www.welt.de/gesundheit/article243551111/Urbane-Hitzeinseln-Mehr-Stadtbaeume-koennen-Menschenleben-retten.html,0,www.welt.de,Mehr Stadtbäume können Menschenleben retten,"Im Sommer heizen sich europäische Städte enorm auf, mit gravierenden Folgen für die Gesundheit der Menschen. Nun hat eine Studie berechnet, wie viele Hitzetote sich durch eine höhere Baumdichte im urbanen Raum vermeiden ließen – und in welcher deutschen Stadt…",https://img.welt.de/img/gesundheit/mobile243551105/5671353477-ci16x9-w1200/Cityscape-of-Frankfurt-am-Main-at-sunrise-View-of-the-skyscrapers-from-the-prom.jpg,2023-02-01T15:23:35Z,,"Mehr Bäume in Städten könnten im Sommer die Zahl der Hitzetoten deutlich reduzieren. Das berichtet ein internationales Forschungsteam nach Analysen von 93 europäischen Großstädten, darunter sieben de… [+4786 chars]",,de,'heizen'
https://www.zeit.de/news/2023-02/01/pistorius-ukraine-braucht-jede-unterstuetzung,https://www.zeit.de/news/2023-02/01/pistorius-ukraine-braucht-jede-unterstuetzung,0,www.zeit.de,Truppenbesuch: Pistorius: Ukraine braucht jede Unterstützung,,,2023-02-01T21:43:27Z,,"When browsing with ads:
We collect personal data and also transmit it to third-party providers
 that help us improve and finance our digital content. Some of the information stored on your device, … [+732 chars]",,de,'Unterstützung'
https://www.handelsblatt.com/unternehmen/energie/heizung-entlueften-so-machen-sie-schritt-fuer-schritt-alles-richtig/28843708.html,https://www.handelsblatt.com/unternehmen/energie/heizung-entlueften-so-machen-sie-schritt-fuer-schritt-alles-richtig/28843708.html,0,www.handelsblatt.com,Heizung entlüften: „Unkontrolliertes Entlüften ist ein Problem“ – So sparen Sie bei der Heizung wirklich Energie,"Wenn die Heizung gluckernde Geräusche macht, ist meist Luft drin. Das kann Energie fressen. Was Sie selbst tun können – und wann Sie Hilfe brauchen.",https://www.handelsblatt.com/images/heizung-entlueften/28861666/4-format2003.jpg,2023-02-02T08:59:05Z,,"Heizung entlüftenWenn die Heizung gluckert und nicht richtig warm wird, könnte es Zeit zum Entlüften sein.
(Foto: dpa)
Gluckern, Rauschen, Pfeifen: Geräusche aus dem Heizkörper stören nicht nur. Si… [+9313 chars]",,de,'Dämmung'
https://www.zeit.de/news/2023-02/02/losse-mueller-sieht-chancen-in-industrie-plaenen-der-eu,https://www.zeit.de/news/2023-02/02/losse-mueller-sieht-chancen-in-industrie-plaenen-der-eu,0,www.zeit.de,Investitionen: Losse-Müller sieht Chancen in Industrie-Plänen der EU,,,2023-02-02T09:17:16Z,,"When browsing with ads:
We collect personal data and also transmit it to third-party providers
 that help us improve and finance our digital content. Some of the information stored on your device, … [+732 chars]",,de,'Industrie'
https://www.welt.de/geschichte/article243563677/Stalingrad-Mit-der-Rueckkehr-des-Namens-verfolgt-Putin-ein-symbolisches-Ziel.html,https://www.welt.de/geschichte/article243563677/Stalingrad-Mit-der-Rueckkehr-des-Namens-verfolgt-Putin-ein-symbolisches-Ziel.html,0,www.welt.de,Und auf einmal heißt Wolgograd wieder Stalingrad,"Ein Symbol für russische Zähigkeit: Am 2. Februar 2023 besucht der Kremlherr Wladimir Putin die Stadt an der Wolga, um den Sieg im Zweiten Weltkrieg gegen die deutsche 6. Armee zu feiern. Ob er veranlasst, dass die Namensänderung bleibt?",https://img.welt.de/img/geschichte/mobile243563669/0101350067-ci16x9-w1200/Warnschild-am-Stadtrand-Stalingrads.jpg,2023-02-02T11:28:26Z,https://web.archive.org/web/20230202113740/http://www.welt.de/geschichte/article243563677/Stalingrad-Mit-der-Rueckkehr-des-Namens-verfolgt-Putin-ein-symbolisches-Ziel.html,"Offenbar handelt es sich eine Nacht- und Nebelaktion: Am Morgen des 2. Februar 2023 stehen um Wolgograd wieder Ortsschilder, auf denen Stalingrad steht jener Name, unter dem die Industriestadt am län… [+7587 chars]",,de,'Wladimir Putin'
https://www.focus.de/finanzen/news/auch-fuer-pellets-und-fluessiggas-sie-haben-2022-heizoel-bestellt-dann-winken-ihnen-bis-zu-2000-euro-hilfe_id_184726229.html,https://www.focus.de/finanzen/news/auch-fuer-pellets-und-fluessiggas-sie-haben-2022-heizoel-bestellt-dann-winken-ihnen-bis-zu-2000-euro-hilfe_id_184726229.html,0,www.focus.de,Auch für Pellets und Flüssiggas - Sie haben 2022 Heizöl bestellt? Dann winken Ihnen bis zu 2000 Euro Hilfe,"Gaspreisbremse, Strompreisbremse und Erstattung für Fernwärme. Doch was ist mit Haushalten, die mit Heizöl heizen? Im Kleingedruckten hat die Bundesregierung eine Entlastung geplant. Doch nur wenige können davon profitieren. FOCUS online sagt, was genau gilt.",https://p6.focus.de/img/fotos/id_160188255/heizoel-lieferung-51920714.jpg?im=Crop%3D%280%2C248%2C3533%2C1766%29%3BResize%3D%281200%2C627%29&impolicy=perceptual&quality=medium&hash=c362821a40fc41e398678fce90cf69cd5cdcdc1aa2c5b6225e37d66030ecb725,2023-02-02T11:44:22Z,,"Gaspreisbremse, Strompreisbremse und Erstattung für Fernwärme. Doch was ist mit Haushalten, die mit Heizöl heizen? Im Kleingedruckten hat die Bundesregierung eine Entlastung geplant. Doch nur wenige … [+3711 chars]",,de,'Gas'
https://www.handelsblatt.com/unternehmen/energie/gasspeicher-in-deutschland-fuellstand-von-78-prozent-erreicht/28819652.html,https://www.handelsblatt.com/unternehmen/energie/gasspeicher-in-deutschland-fuellstand-von-78-prozent-erreicht/28819652.html,0,www.handelsblatt.com,Gasspeicher in Deutschland: Füllstand von 78 Prozent erreicht,Ein hoher Gasspeicher-Füllstand ist für Deutschlands Gasversorgung in der Energiekrise essenziell. Wie steht es aktuell um die Gasreserven? Ein Überblick.,https://www.handelsblatt.com/images/gasspeicher-in-sachsen-anhalt/28877480/2-format2003.jpg,2023-02-02T12:49:44Z,https://web.archive.org/web/20230202131204/https://www.handelsblatt.com/unternehmen/energie/gasspeicher-in-deutschland-fuellstand-von-78-prozent-erreicht/28819652.html,"Gasspeicher in Sachsen-AnhaltDer Gasspeicher-Füllstand in Deutschland ist in der Energiekrise zum wichtigen Faktor geworden.
(Foto: dpa)
Düsseldorf Ein stabiler Füllstand der deutschen Gasspeicher … [+7471 chars]",,de,'Energie'
https://www.sueddeutsche.de/muenchen/muenchen-energieberatung-klimaschutz-hausbesitzer-kostenlos-1.5743765,https://www.sueddeutsche.de/muenchen/muenchen-energieberatung-klimaschutz-hausbesitzer-kostenlos-1.5743765,0,www.sueddeutsche.de,"Klimaschutz in München: Pilotprojekt zeigt Hausbesitzern, wie sie Energie sparen können","Am Beispiel des Österreicherviertels will die Stadt erproben, wie man den Klimaschutz in Siedlungen vorantreiben kann. Dafür schickt sie Berater kostenlos von Tür zu Tür. Es zeigt sich: Oft braucht es nur den richtigen Anstoß.",https://www.sueddeutsche.de/image/sz.1.5743767/1200x675?v=1675344430,2023-02-02T13:27:21Z,,"Am Beispiel des Österreicherviertels will die Stadt erproben, wie man den Klimaschutz in Siedlungen vorantreiben kann. Dafür schickt sie Berater kostenlos von Tür zu Tür. Es zeigt sich: Oft braucht e… [+6245 chars]",,de,'Dämmung'
https://www.stern.de/wirtschaft/news/energieversorgung--keine-mangellage--gasspeicher-gut-gefuellt-33159552.html,https://www.stern.de/wirtschaft/news/energieversorgung--keine-mangellage--gasspeicher-gut-gefuellt-33159552.html,0,www.stern.de,Energieversorgung: Keine Mangellage: Gasspeicher gut gefüllt,Einen fiesen Gasmangel mit Verbrauchsbeschränkungen hält mittlerweile sogar die Bundesnetzagentur für unwahrscheinlich. Eine komplette Entwarnung mag Behördenchef Müller aber nicht geben.,https://image.stern.de/33159554/t/8E/v2/w1440/r1.7778/-/02--urnnewsmldpacom2009010123020299447905v3w800h600l924t432r1446b859jpeg---e80b6cabbea0f5fa.jpg,2023-02-02T14:31:43Z,https://web.archive.org/web/20230202165930/https://www.stern.de/wirtschaft/news/energieversorgung--keine-mangellage--gasspeicher-gut-gefuellt-33159552.html,"Einen fiesen Gasmangel mit Verbrauchsbeschränkungen hält mittlerweile sogar die Bundesnetzagentur für unwahrscheinlich. Eine komplette Entwarnung mag Behördenchef Müller aber nicht geben.
Schon seit… [+3597 chars]",,de,'Gasmangel'
https://www.tagesspiegel.de/wirtschaft/energiekrise-abgewendet-deutschland-hat-ziel-fur-gasspeicher-ubererfullt-9284370.html,https://www.tagesspiegel.de/wirtschaft/energiekrise-abgewendet-deutschland-hat-ziel-fur-gasspeicher-ubererfullt-9284370.html,0,www.tagesspiegel.de,Energiekrise abgewendet?: Deutschland hat Ziel für Gasspeicher übererfüllt,"Bis zum 1. Februar sollten alle EU-Staaten die Gasspeicher zu mindestens 40 Prozent gefüllt haben. Deutschland hat das Ziel mit 78,6 Prozent weit übertroffen.",https://www.tagesspiegel.de/images/erdgasspeicher/alternates/BASE_16_9_W1400/erdgasspeicher.jpeg,2023-02-02T15:39:33Z,https://web.archive.org/web/20230202165340/https://www.tagesspiegel.de/wirtschaft/energiekrise-abgewendet-deutschland-hat-ziel-fur-gasspeicher-ubererfullt-9284370.html,"Schon seit Wochen hatte es sich abgezeichnet, jetzt ist es amtlich: Die Gasspeicher in Deutschland haben das Füllstandsziel von 40 Prozent zum 1. Februar mehr als erreicht. Mit 78,6 Prozent waren sie… [+3875 chars]",,de,'Energie'
https://www.morgenpost.de/wirtschaft/article237536663/gaspreis-aktuell-heute-3-februar-2023-energie-preis-gas-kwh.html,https://www.morgenpost.de/wirtschaft/article237536663/gaspreis-aktuell-heute-3-februar-2023-energie-preis-gas-kwh.html,0,www.morgenpost.de,Energiekosten: Gaspreis aktuell: Der Preis pro kWh Gas heute am 3. Februar,Aktuell sinkt der Gaspreis in Deutschland. ○ Profitieren die Verbraucher davon? ○ So hoch ist der Preis pro kWh heute am 3. Februar.,https://img.morgenpost.de/img/wirtschaft/crop237423343/3212605035-w820-cv16_9-q85/0941d004-98d1-11ed-9ffb-5de32a7e457c.jpg,2023-02-03T09:25:48Z,,"Berlin. Auf dem Gasmarkt war die Lage zuletzt lange angespannt: Die Energiepreise in Deutschland schossen in die Höhe, die Versorgungssicherheit schien zeitweise gefährdet. Doch nun scheint sich das … [+4868 chars]",,de,'Gas'
https://www.stern.de/politik/deutschland/ukraine-krieg--deutschland-erteilt-ausfuhrgenehmigung-fuer-leopard-1-panzer-33163548.html,https://www.stern.de/politik/deutschland/ukraine-krieg--deutschland-erteilt-ausfuhrgenehmigung-fuer-leopard-1-panzer-33163548.html,0,www.stern.de,Ukraine-Krieg: Deutschland erteilt Ausfuhrgenehmigung für Leopard-1-Panzer,"Vergangene Woche hatte die Bundesregierung bereits entschieden, 14 Leopard-Kampfpanzer aus Bundeswehr-Beständen an die Ukraine zu liefern. Weitere Panzer sollen folgen.",https://image.stern.de/33163550/t/V-/v3/w1440/r1.7778/-/03--urnnewsmldpacom2009010123020399461028v2w800h600l508t403r2012b1403jpeg---6f508ef4b8d63f4d.jpg,2023-02-03T11:00:05Z,,"Vergangene Woche hatte die Bundesregierung bereits entschieden, 14 Leopard-Kampfpanzer aus Bundeswehr-Beständen an die Ukraine zu liefern. Weitere Panzer sollen folgen.
Die Bundesregierung hat eine … [+2517 chars]",,de,'Olaf Scholz'
https://www.zeit.de/video/2023-02/6319659345112/olaf-scholz-bei-biontech-wir-brauchen-rahmenbedingungen-fuer-schnelle-forschung,https://www.zeit.de/video/2023-02/6319659345112/olaf-scholz-bei-biontech-wir-brauchen-rahmenbedingungen-fuer-schnelle-forschung,0,www.zeit.de,"Olaf Scholz bei BioNTech: ""Wir brauchen Rahmenbedingungen für schnelle Forschung""",Das Pharmaunternehmen BioNTech will rund 40 Millionen Euro in eine neue Anlage zur Herstellung eines mRNA-Bausteins investieren. Kanzler Scholz hat den Standort besucht.,,2023-02-03T11:03:15Z,,"When browsing with ads:
We collect personal data and also transmit it to third-party providers
 that help us improve and finance our digital content. Some of the information stored on your device, … [+732 chars]",,de,'Olaf Scholz'
https://www.tagesspiegel.de/politik/viele-wollen-alles-nach-ihrem-sinn-verdrehen-afd-politiker-schiesst-nach-auftritt-in-russischer-talkshow-gegen-deutsche-medien-9287952.html,https://www.tagesspiegel.de/politik/viele-wollen-alles-nach-ihrem-sinn-verdrehen-afd-politiker-schiesst-nach-auftritt-in-russischer-talkshow-gegen-deutsche-medien-9287952.html,0,www.tagesspiegel.de,„Viele wollen alles nach ihrem Sinn verdrehen“: AfD-Politiker besucht russische Talkshow– und hetzt gegen deutsche Medien,"Steffen Kotré verteidigt seinen TV-Auftritt damit, dass er jedem auf Wunsch Interviews gebe. In Russland soll er wiederum über die Aufhetzung der deutschen Bevölkerung gegen den Kreml gesprochen haben.",https://www.tagesspiegel.de/images/320627645jpg/alternates/BASE_16_9_W1400/320627645jpg.jpeg,2023-02-03T11:04:25Z,,"Der AfD-Bundestagsabgeordnete Steffen Kotré hat einen Auftritt in der Talkshow des russischen TV-Propagandisten Wladimir Solowjow verteidigt. Auf Twitter schrieb er am Freitag, er gebe jedem ein Inte… [+1790 chars]",,de,'Kreml'
https://www.welt.de/politik/ausland/article243578591/Ukraine-News-Scholz-Sprecher-nennt-Putin-Aeusserung-zu-Bedrohung-durch-deutsche-Panzer-abstrusen-Vergleich.html,https://www.welt.de/politik/ausland/article243578591/Ukraine-News-Scholz-Sprecher-nennt-Putin-Aeusserung-zu-Bedrohung-durch-deutsche-Panzer-abstrusen-Vergleich.html,0,www.welt.de,Scholz-Sprecher nennt Putin-Äußerung zu Bedrohung durch deutsche Panzer „abstrusen Vergleich“,"Wladimir Putin wirft Deutschland vor, sich in einen Krieg mit Russland hineinziehen zu lassen – „deutsche Leopard-Panzer bedrohen uns wieder“, sagte der Kremlchef. Regierungssprecher Steffen Hebestreit kontert: „Das sind Hilfslieferungen, keine Kriegsbeteilig…",https://img.welt.de/img/newsticker/dpa_nt/infoline_nt/politik_ausland_nt/mobile243331981/0311356477-ci16x9-w1200/Scholz-und-Hebestreit.jpg,2023-02-03T11:06:00Z,,Die Bundesregierung hat eine Äußerung von Russlands Präsident Wladimir Putin zur angeblichen Bedrohung seines Landes durch an die Ukraine gelieferte deutsche Panzer zurückgewiesen. Die Aussagen reiht… [+12130 chars],,de,'Krieg'
https://www.welt.de/politik/ausland/article243578591/Ukraine-News-Luftalarm-zum-Auftakt-von-EU-Gipfel-in-Kiew.html,https://www.welt.de/politik/ausland/article243578591/Ukraine-News-Luftalarm-zum-Auftakt-von-EU-Gipfel-in-Kiew.html,0,www.welt.de,Luftalarm zum Auftakt von EU-Gipfel in Kiew,"Während des EU-Gipfels in Kiew mit Ursula von der Leyen und Ratspräsident Charles Michel gab es einen landesweiten Luftalarm – russische Kampfjets im Luftraum Belarus die Raketen auf die Ukraine abwarfen, waren der Auslöser. Mehr im Liveticker.",https://img.welt.de/img/kultur/mobile243466469/8681353677-ci16x9-w1200/Bundeswehr-Continues-Exercises-At-Munster.jpg,2023-02-03T11:06:00Z,https://web.archive.org/web/20230203130339/https://www.welt.de/politik/ausland/article243578591/Ukraine-News-Luftalarm-zum-Auftakt-von-EU-Gipfel-in-Kiew.html,Der Beginn des EU-Ukraine-Gipfels in Kiew ist von einem landesweiten Luftalarm überschattet worden. Angaben aus der Hauptstadt zufolge wurde er wegen des Einsatzes russischer Kampflugzeuge im Luftrau… [+10613 chars],,de,'Ukraine'
https://www.focus.de/politik/f-16-kampfjets-weshalb-die-niederlande-so-engagiert-sind-bei-der-verteidigung-der-ukraine_id_184742730.html,https://www.focus.de/politik/f-16-kampfjets-weshalb-die-niederlande-so-engagiert-sind-bei-der-verteidigung-der-ukraine_id_184742730.html,0,www.focus.de,Ukrainekrieg - Weshalb die Niederlande die Lieferung von Kampfjets erwägen,"In den Niederlanden wird die Möglichkeit, F-16-Kampfjets für die Verteidigung der Ukraine zur Verfügung zu stellen, diskutiert. Weshalb ausgerechnet der kleine Benelux-Staat so engagiert ist.Von FOCUS-online-Redakteurin Mirjam Moll",https://p6.focus.de/img/fotos/id_184398359/f-16-kampfjets.jpg?im=Crop%3D%280%2C216%2C3464%2C1732%29%3BResize%3D%281200%2C627%29&hash=9bcf52da13797ae8a5a5553a95e3b327768d5161b315d1ac4d40b1afe50491a6,2023-02-03T11:06:48Z,https://web.archive.org/web/20230203234339/https://www.focus.de/politik/f-16-kampfjets-weshalb-die-niederlande-so-engagiert-sind-bei-der-verteidigung-der-ukraine_id_184742730.html,"In den Niederlanden wird die Möglichkeit, F-16-Kampfjets für die Verteidigung der Ukraine zur Verfügung zu stellen, diskutiert. Weshalb ausgerechnet der kleine Benelux-Staat so engagiert ist.Alle Opt… [+4617 chars]",,de,'Ukraine'
https://www.stern.de/politik/deutschland/ukraine-krieg--bundesregierung-genehmigt-ausfuhr-von-leopard-1-kampfpanzern-33163548.html,https://www.stern.de/politik/deutschland/ukraine-krieg--bundesregierung-genehmigt-ausfuhr-von-leopard-1-kampfpanzern-33163548.html,0,www.stern.de,Ukraine-Krieg: Bundesregierung genehmigt Ausfuhr von Leopard-1-Kampfpanzern,"Vergangene Woche hatte die Bundesregierung bereits entschieden, 14 Leopard-Kampfpanzer aus Bundeswehr-Beständen an die Ukraine zu liefern. Weitere Panzer sollen folgen.",https://image.stern.de/33163550/t/CB/v4/w1440/r1.7778/-/03--urnnewsmldpacom2009010123020399461028v2w800h600l508t403r2012b1403jpeg---6f508ef4b8d63f4d.jpg,2023-02-03T11:13:15Z,,"Vergangene Woche hatte die Bundesregierung bereits entschieden, 14 Leopard-Kampfpanzer aus Bundeswehr-Beständen an die Ukraine zu liefern. Weitere Panzer sollen folgen.
Die Bundesregierung hat eine … [+2755 chars]",,de,'Ukraine'
https://www.wiwo.de/politik/deutschland/ukraine-krieg-deutschland-erteilt-ausfuhrgenehmigung-fuer-leopard-1-panzer/28962284.html,https://www.wiwo.de/politik/deutschland/ukraine-krieg-deutschland-erteilt-ausfuhrgenehmigung-fuer-leopard-1-panzer/28962284.html,0,www.wiwo.de,Ukraine-Krieg: Deutschland erteilt Ausfuhrgenehmigung für Leopard-1-Panzer,"Vergangene Woche hatte die Bundesregierung bereits entschieden, 14 Leopard-Kampfpanzer aus Bundeswehr-Beständen an die Ukraine zu liefern. Weitere Panzer sollen folgen.",https://www.wiwo.de/images/leopard-1/28962282/1-format11240.jpg,2023-02-03T11:18:00Z,https://web.archive.org/web/20230203130541/https://www.wiwo.de/politik/deutschland/ukraine-krieg-deutschland-erteilt-ausfuhrgenehmigung-fuer-leopard-1-panzer/28962284.html,Støre betonte das nahe und gute Verhältnis seines Landes zu Deutschland. Die Bundesrepublik spiele eine immer wichtigere sicherheitspolitische Rolle in Europa. Bundeskanzler Olaf Scholz habe er am Mo… [+474 chars],,de,'Olaf Scholz'
https://www.handelsblatt.com/unternehmen/mittelstand/familienunternehmer/produktion-von-waermepumpen-viessmann-baut-neue-waermepumpenfabrik-in-polen/28956084.html,https://www.handelsblatt.com/unternehmen/mittelstand/familienunternehmer/produktion-von-waermepumpen-viessmann-baut-neue-waermepumpenfabrik-in-polen/28956084.html,0,www.handelsblatt.com,Heizungsbauer: Wärmepumpen-Boom: Viessmann erzielt Rekordumsatz,Das Familienunternehmen profitiert vom Boom strombetriebener Heizungen infolge der Energiepreiskrise. Es hat seinen Umsatz 2022 um 19 Prozent gesteigert.,https://www.handelsblatt.com/images/waermepumpe-von-viessmann/28956242/3-format2003.jpg,2023-02-03T11:45:11Z,https://web.archive.org/web/20230203123714/https://www.handelsblatt.com/unternehmen/mittelstand/familienunternehmer/produktion-von-waermepumpen-viessmann-baut-neue-waermepumpenfabrik-in-polen/28956084.html,"DüsseldorfViessmann schreibt einen Rekordumsatz: Der Heizungs- und Klimatechnikanbieter hat im abgelaufenen Jahr 2022 vier Milliarden Euro erwirtschaftet, wie das Unternehmen am Mittwochmorgen bekann… [+4307 chars]",,de,'Energie'
https://www.n-tv.de/politik/Norwegen-kauft-54-Leopard-2-Panzer-aus-Deutschland-article23891038.html,https://www.n-tv.de/politik/Norwegen-kauft-54-Leopard-2-Panzer-aus-Deutschland-article23891038.html,0,www.n-tv.de,Aber nicht für die Ukraine: Norwegen kauft 54 Leopard-2-Panzer aus Deutschland,Bereits vor dem Krieg genehmigt das norwegische Parlament die Neubeschaffung von Kampfpanzern. Jetzt ist die Entscheidung gefallen: Deutschland liefert 54 moderne Leopard 2 und setzt sich damit wohl gegen einen Konkurrenten durch. Für die derzeit angedachten …,https://bilder1.n-tv.de/img/incoming/crop23891040/2211323253-cImg_16_9-w1200/264230296.jpg,2023-02-03T12:02:02Z,http://archive.md/20230203124830/https://www.n-tv.de/politik/Norwegen-kauft-54-Leopard-2-Panzer-aus-Deutschland-article23891038.html,Bereits vor dem Krieg genehmigt das norwegische Parlament die Neubeschaffung von Kampfpanzern. Jetzt ist die Entscheidung gefallen: Deutschland liefert 54 moderne Leopard 2 und setzt sich damit wohl … [+1857 chars],,de,'Krieg'
https://www.focus.de/politik/ausland/ukraine-krise/warum-die-ukraine-westliche-kampfflugzeuge-will-und-vielleicht-auch-bekommen-wird_id_184822288.html,https://www.focus.de/politik/ausland/ukraine-krise/warum-die-ukraine-westliche-kampfflugzeuge-will-und-vielleicht-auch-bekommen-wird_id_184822288.html,0,www.focus.de,Beitrag unseres Partnerportals „Economist“ - Wegen einer russischen Wunderwaffe will die Ukraine jetzt Kampfjets,Noch hat die russische Luftwaffe nicht die Oberhand gewonnen - das könnte sich aber bald ändern. Die ukrainische Forderung nach Kampfflugzeugen wird entsprechend immer lauter.,https://p6.focus.de/img/panorama/welt/id_184377281/kampfflugzeuge-vom-typ-f-16-der-polnischen-luftwaffe-bei-einer-nato-militaeruebung-in-litauen..jpg?im=Crop%3D%280%2C136%2C2048%2C1024%29%3BResize%3D%281200%2C627%29&hash=252ba8aeb43173088277686db1873961fca1b8ee7fd5c82b3b92b14442abd235,2023-02-03T14:00:23Z,https://web.archive.org/web/20230203152251/https://www.focus.de/politik/ausland/ukraine-krise/warum-die-ukraine-westliche-kampfflugzeuge-will-und-vielleicht-auch-bekommen-wird_id_184822288.html,Noch hat die russische Luftwaffe nicht die Oberhand gewonnen - das könnte sich aber bald ändern. Die ukrainische Forderung nach Kampfflugzeugen wird entsprechend immer lauter.Die Ukraine fordert mehr… [+6137 chars],,de,'Olaf Scholz'
