index,url,valid,domain,title,description,image,published,archive,content,quote,language,keyword
https://www.faz.net/aktuell/politik/ukraine/ukraine-liveticker-macron-einigkeit-ueber-sicherheitsgarantien-fuer-ukraine-faz-110172806.html,https://www.faz.net/aktuell/politik/ukraine/ukraine-liveticker-macron-einigkeit-ueber-sicherheitsgarantien-fuer-ukraine-faz-110172806.html,0,www.faz.net,Krieg in der Ukraine: Staatengemeinschaft einig über Sicherheitsgarantien für Ukraine,Etliche Länder bereit zu Einsatz von Friedenstruppen +++ Deutschland will sich noch nicht auf eine Beteiligung an einem Militäreinsatz festlegen +++ Treffen der „Koalition der Willigen“ in Paris +++ alle Neuigkeiten im Liveblog,https://media0.faz.net/ppmedia/w1200/aktuell/politik/3831350003/1.10670960/facebook_teaser/der-ukrainischer-praesident.jpg.webp,2025-09-04T15:06:22Z,,Für die Ukraine gibt es nach den Worten des ukrainischen Präsidenten Wolodymyr Selenskyj in der sogenannten Koalition der Willigen ein Einvernehmen über den allgemeinen Rahmen von Sicherheitsgarantie… [+2345 chars],,de,'Krieg'
https://www.n-tv.de/politik/10-31-Putin-will-sich-nicht-im-Ausland-mit-Selenskyj-treffen--article23143824.html,https://www.n-tv.de/politik/10-31-Putin-will-sich-nicht-im-Ausland-mit-Selenskyj-treffen--article23143824.html,0,www.n-tv.de,Ukraine-Krieg im Liveticker: +++ 10:31 Putin will sich nicht im Ausland mit Selenskyj treffen +++,Lesen Sie alle aktuellen Entwicklungen und Nachrichten über den russischen Angriffskrieg auf die Ukraine im Liveticker von ntv.de.,https://www.n-tv.de/img/incoming/crop25117070/8311326854-cImg_16_9-w1200/Ukraine-Liveticker.jpg,2025-09-04T22:12:00Z,,Russlands Präsident Wladimir Putin weist die Forderung nach einem Treffen mit seinem ukrainischen Amtskollegen Wolodymyr Selenskyj an einem Verhandlungsort im Ausland zurück. Wenn sich Selenskyj mit … [+16466 chars],,de,'Krieg'
https://www.n-tv.de/politik/05-48-Wadephul-ruft-europaeische-Laender-zur-Abgabe-ihrer-Flugabwehrsysteme-auf--article23143824.html,https://www.n-tv.de/politik/05-48-Wadephul-ruft-europaeische-Laender-zur-Abgabe-ihrer-Flugabwehrsysteme-auf--article23143824.html,0,www.n-tv.de,Ukraine-Krieg im Liveticker: +++ 05:48 Wadephul ruft europäische Länder zur Abgabe ihrer Flugabwehrsysteme auf +++,Lesen Sie alle aktuellen Entwicklungen und Nachrichten über den russischen Angriffskrieg auf die Ukraine im Liveticker von ntv.de.,https://www.n-tv.de/img/incoming/crop25117070/8311326854-cImg_16_9-w1200/Ukraine-Liveticker.jpg,2025-09-04T22:12:00Z,,"Bundesaußenminister Johann Wadephul von der CDU hat europäische Staaten dazu aufgerufen, über die Abgabe von Flugabwehrsystemen nachzudenken. ""Wir müssen über neue Waffensysteme nachdenken, die gelie… [+8461 chars]",,de,'Krieg'
https://www.n-tv.de/politik/07-55-Wadephul-will-ueber-Bundeswehr-in-der-Ukraine-diskutieren--article23143824.html,https://www.n-tv.de/politik/07-55-Wadephul-will-ueber-Bundeswehr-in-der-Ukraine-diskutieren--article23143824.html,0,www.n-tv.de,Ukraine-Krieg im Liveticker: +++ 07:55 Wadephul will über Bundeswehr in der Ukraine diskutieren +++,Lesen Sie alle aktuellen Entwicklungen und Nachrichten über den russischen Angriffskrieg auf die Ukraine im Liveticker von ntv.de.,https://www.n-tv.de/img/incoming/crop25117070/8311326854-cImg_16_9-w1200/Ukraine-Liveticker.jpg,2025-09-04T22:12:00Z,,"Bundesaußenminister Johann Wadephul wehrt sich gegen Kritik, er habe mit seinen Aussagen über eine mögliche Beteiligung der Bundeswehr an Sicherheitsgarantien für die Ukraine einen kommunikativen Feh… [+12365 chars]",,de,'Ukraine'
https://www.n-tv.de/politik/20-55-Kanadas-Premier-Putin-wird-keinen-Frieden-diktieren--article26014454.html,https://www.n-tv.de/politik/20-55-Kanadas-Premier-Putin-wird-keinen-Frieden-diktieren--article26014454.html,0,www.n-tv.de,Ukraine-Krieg im Liveticker: +++ 20:55 Kanadas Premier: Putin wird keinen Frieden diktieren +++,Lesen Sie alle aktuellen Entwicklungen und Nachrichten über den russischen Angriffskrieg auf die Ukraine im Liveticker von ntv.de.,https://www.n-tv.de/img/incoming/crop25117070/8311326854-cImg_16_9-w1200/Ukraine-Liveticker.jpg,2025-09-04T22:25:38Z,,"Der kanadische Ministerpräsident Mark Carney kündigt neue Sanktionen gegen Russland an. Die Verbündeten der Ukraine bereiteten neue Strafmaßnahmen vor, sagt Carney auf einer Pressekonferenz. Damit so… [+30648 chars]",,de,'Ukraine'
https://www.tagesspiegel.de/internationales/bisheriger-pentagon-name-klinge-zu-defensiv-trump-will-us-verteidigungsministerium-in-kriegsministerium-umbennen-14279294.html,https://www.tagesspiegel.de/internationales/bisheriger-pentagon-name-klinge-zu-defensiv-trump-will-us-verteidigungsministerium-in-kriegsministerium-umbennen-14279294.html,0,www.tagesspiegel.de,Bisheriger Pentagon-Name klinge zu „defensiv“: Trump will US-Verteidigungsministerium in „Kriegsministerium“ umbennen,Erstmals seit 1949 sollen die USA ein Kriegsministerium haben. Pentagon-Hausherr Hegseth könnte dann „Kriegsminister“ genannt werden. Die Umbenennung begrüßt er mit einer martialischen Begründung.,https://www.tagesspiegel.de/images/14279471/alternates/BASE_16_9_W1400/1757043508000/u-s-president-donald-trump-makes-announcement-at-the-white-house.jpeg,2025-09-05T00:14:36Z,,"US-Präsident Donald Trump will das Verteidigungsministerium nach Angaben des Weißen Hauses in Kriegsministerium (Department of War) umbenennen. 
Trump werde dazu am Freitag ein entsprechendes Dekret… [+3815 chars]",,de,'Krieg'
https://www.tagesspiegel.de/internationales/trump-unterschreibt-verordnung-us-verteidigungsressort-heisst-jetzt-kriegsministerium-14279294.html,https://www.tagesspiegel.de/internationales/trump-unterschreibt-verordnung-us-verteidigungsressort-heisst-jetzt-kriegsministerium-14279294.html,0,www.tagesspiegel.de,Trump unterschreibt Verordnung: US-Verteidigungsressort heißt jetzt „Kriegsministerium“,Erstmals seit 1949 haben die USA ein Kriegsministerium. Pentagon-Hausherr Hegseth wird jetzt „Kriegsminister“ genannt. Was dahinter steckt.,https://www.tagesspiegel.de/images/14285849/alternates/BASE_16_9_W1400/1757108800000/us-politics-trump.jpeg,2025-09-05T00:14:36Z,,US-Präsident Donald Trump hat das Verteidigungsressort in Kriegsministerium umbenannt. Der Republikaner unterschrieb eine entsprechende Verordnung im Oval Office im Weißen Haus und sprach Ressortleit… [+4579 chars],,de,'Krieg'
https://www.stern.de/news/trump-kuendigt-baldiges-gespraech-mit-putin-an-36029968.html,https://www.stern.de/news/trump-kuendigt-baldiges-gespraech-mit-putin-an-36029968.html,0,www.stern.de,Trump kündigt baldiges Gespräch mit Putin an,"US-Präsident Donald Trump hat ein baldiges Gespräch mit Kreml-Chef Wladimir Putin angekündigt. ""Das werde ich, ja"", sagte Trump am Donnerstag (Ortszeit) auf die Frage einer Reporterin, ob Trump in naher Zukunft mit dem russischen Präsidenten sprechen werde.",https://image.stern.de/36029970/t/uh/v1/w1440/r1.7778/-/05--wladimir-putin-links-und-donald-trump---dcb5a1f5733f94a3.jpg,2025-09-05T00:17:50Z,,"Kopiere den aktuellen Link
Zur Merkliste hinzufügen
US-Präsident Donald Trump hat ein baldiges Gespräch mit Kreml-Chef Wladimir Putin angekündigt. ""Das werde ich, ja"", sagte Trump am Donnerstag (Or… [+654 chars]",,de,'Wladimir Putin'
https://taz.de/Mumia-Abu-Jamal-fordert-Versorgung/!6108088/,https://taz.de/Mumia-Abu-Jamal-fordert-Versorgung/!6108088/,0,taz.de,Mumia Abu Jamal fordert Versorgung: Acht Monate Dunkelheit,Der seit 1981 in den USA inhaftierte Journalist Abu Jamal klagt über massiven Sehverlust. Solidaritätsgruppen fordern seine sofortige Freilassung.,https://taz.de/picture/7911537/1200/39150254-1.jpeg,2025-09-05T07:19:00Z,,Der seit 1981 in den USA inhaftierte Journalist Abu Jamal klagt über massiven Sehverlust. Solidaritätsgruppen fordern seine sofortige Freilassung. mehr...,,de,'Versorgung'
https://www.welt.de/satire/article68ba8e0d6775f2119f5a0aa6/Starkes-Zeichen-gegen-Trump-DFB-Elf-will-WM-in-den-USA-boykottieren.html,https://www.welt.de/satire/article68ba8e0d6775f2119f5a0aa6/Starkes-Zeichen-gegen-Trump-DFB-Elf-will-WM-in-den-USA-boykottieren.html,0,www.welt.de,Starkes Zeichen – DFB-Elf will WM in den USA boykottieren,"Respekt! Das Spiel gegen die Slowakei zeigte eindrucksvoll: Damit es nicht schon wieder zu einem peinlichen Herumgeeiere wie in Katar kommt, will die deutsche Nationalmannschaft anscheinend erst gar nicht zu der WM in den USA fahren.",https://images.welt.de/68ba8e0d6775f2119f5a0aa6/b506b1ec20ce970cf7e7ec4a436bad23-master/ci16x9-w1200/wm-qualifikation-slowakei-ger-2025-26,2025-09-05T07:32:33Z,,"Respekt! Das Spiel gegen die Slowakei zeigte eindrucksvoll: Damit es nicht schon wieder zu einem peinlichen Herumgeeiere wie in Katar kommt, will die deutsche Nationalmannschaft anscheinend erst gar … [+2322 chars]",,de,'Katar'
https://www.welt.de/regionales/hamburg/article68b9790801ad191d1ad5fb8f/kreuzfahrten-bei-den-vergnuegungsschiffen-will-hamburg-europas-vorzeigehafen-sein.html,https://www.welt.de/regionales/hamburg/article68b9790801ad191d1ad5fb8f/kreuzfahrten-bei-den-vergnuegungsschiffen-will-hamburg-europas-vorzeigehafen-sein.html,0,www.welt.de,Bei den Vergnügungsschiffen will Hamburg Europas Vorzeigehafen sein,Das Kreuzfahrtgeschäft wächst seit dem Ende der Pandemie wieder rapide. Deutschlands größter Seehafen baut neben den Terminals auch die Versorgung der Schiffe mit Landstrom und neuartigen Kraftstoffen aus. Umweltschützer haben die Kreuzfahrtbranche dennoch kr…,https://images.welt.de/68b9790801ad191d1ad5fb8f/b8d8f7c36537abaf24f207a92fbd1372-master/ci16x9-w1200/mitreissende-kreuzfahrtmomente-auf-den-hamburg-cruise-days,2025-09-05T08:29:00Z,,Das Kreuzfahrtgeschäft wächst seit dem Ende der Pandemie wieder rapide. Deutschlands größter Seehafen baut neben den Terminals auch die Versorgung der Schiffe mit Landstrom und neuartigen Kraftstoffe… [+6324 chars],,de,'Versorgung'
https://www.stern.de/gesellschaft/regional/rheinland-pfalz-saarland/nach-wasserrohrbruch--gasversorgung-in-koblenz-fast-komplett-wieder-hergestellt-36031628.html,https://www.stern.de/gesellschaft/regional/rheinland-pfalz-saarland/nach-wasserrohrbruch--gasversorgung-in-koblenz-fast-komplett-wieder-hergestellt-36031628.html,0,www.stern.de,Nach Wasserrohrbruch: Gasversorgung in Koblenz fast komplett wieder hergestellt,Am Dienstag sind in Koblenz-Lützel rund 500 Haushalte plötzlich ohne Gas. Jetzt können fast alle wieder heizen und warm duschen - schneller als zunächst gedacht.,https://image.stern.de/36031630/t/FK/v1/w1440/r1.7778/-/05--ysb3ipa7p3v8axs2048jpeg---7a08d7ccdd69b9bf.jpg,2025-09-05T10:24:41Z,,"Kopiere den aktuellen Link
Zur Merkliste hinzufügen
Am Dienstag sind in Koblenz-Lützel rund 500 Haushalte plötzlich ohne Gas. Jetzt können fast alle wieder heizen und warm duschen - schneller als z… [+663 chars]",,de,'heizen'
https://www.tagesspiegel.de/berlin/katastrophenschutz-heulende-warnsirenen-kehren-nach-30-jahren-zuruck-14282387.html,https://www.tagesspiegel.de/berlin/katastrophenschutz-heulende-warnsirenen-kehren-nach-30-jahren-zuruck-14282387.html,0,www.tagesspiegel.de,Katastrophenschutz: Heulende Warnsirenen kehren nach 30 Jahren zurück,"Nach Jahrzehnten heulen in Berlin wieder Warnsirenen als Teil des Katastrophenschutzes. Der Slogan dazu auf einem Plakat: „Sirenen retten Leben, sie sind der Weckruf für deine Sicherheit.“",https://www.tagesspiegel.de/images/14283233/alternates/BASE_16_9_W1400/1757075386000/warnsirene-auf-einem-dach.jpeg,2025-09-05T11:22:00Z,,Beim Katastrophen- und Zivilschutz hinkt Berlin weiterhin hinterher - aber zumindest akustisch soll ein Fortschritt nun laut und deutlich zu hören sein. Zum ersten Mal seit mehr als 30 Jahren werden … [+4852 chars],,de,'Versorgung'
https://www.tagesspiegel.de/berlin/warntag-am-donnerstag-in-berlin-heulende-warnsirenen-kehren-nach-30-jahren-zuruck-14282387.html,https://www.tagesspiegel.de/berlin/warntag-am-donnerstag-in-berlin-heulende-warnsirenen-kehren-nach-30-jahren-zuruck-14282387.html,0,www.tagesspiegel.de,Warntag am Donnerstag in Berlin: Heulende Warnsirenen kehren nach 30 Jahren zurück,"Nach Jahrzehnten heulen in Berlin wieder Warnsirenen als Teil des Katastrophenschutzes. Der Slogan dazu auf einem Plakat: „Sirenen retten Leben, sie sind der Weckruf für deine Sicherheit.“",https://www.tagesspiegel.de/images/14283233/alternates/BASE_16_9_W1400/1757075386000/warnsirene-auf-einem-dach.jpeg,2025-09-05T11:22:00Z,,Beim Katastrophen- und Zivilschutz hinkt Berlin weiterhin hinterher aber zumindest akustisch soll ein Fortschritt nun laut und deutlich zu hören sein. Zum ersten Mal seit mehr als 30 Jahren werden in… [+5325 chars],,de,'Sicherheit'
https://www.focus.de/kultur/stars/heute-wird-geheiratet-yeliz-koc-und-jimi-blue-ochsenknecht-heizen-geruechte-an_b568d386-5abb-469f-99e5-cd89467e3e1e.html,https://www.focus.de/kultur/stars/heute-wird-geheiratet-yeliz-koc-und-jimi-blue-ochsenknecht-heizen-geruechte-an_b568d386-5abb-469f-99e5-cd89467e3e1e.html,0,www.focus.de,"""Heute wird geheiratet"": Yeliz Koc und Jimi Blue Ochsenknecht heizen Gerüchte an",Auf einer Hochzeit ziehen Yeliz Koc und Jimi Blue Ochsenknecht alle Blicke auf sich. In eleganten Looks posieren sie gemeinsam vor der Kamera und sorgen für Spekulationen.,https://quadro.burda-forward.de/ctf/91be0608-8390-42c2-9faa-5b4b119a8f89.386d807c-baa2-4c35-8f2a-00ad4889ac59.jpg?im=RegionOfInterestCrop%3D%281200%2C630%29%2CregionOfInterest%3D%281390%2C637%29&hash=60530a6784b20773fe58eadd287419195328758799366b47797895e536c854c1,2025-09-05T19:09:11Z,,Erneut stehen Yeliz Koc (31) und Jimi Blue Ochsenknecht (33) im Mittelpunkt der Gerüchteküche. Das Ex-Paar zeigte sich überraschenderweise gemeinsam auf einer Hochzeit und die Bilder sorgten sofort f… [+2271 chars],,de,'heizen'
https://www.bild.de/unterhaltung/stars-und-leute/vertraut-foto-von-jimi-blue-und-yeliz-koc-seid-ihr-etwa-wieder-zusammen-68bb1b616b51af41f5e27652,https://www.bild.de/unterhaltung/stars-und-leute/vertraut-foto-von-jimi-blue-und-yeliz-koc-seid-ihr-etwa-wieder-zusammen-68bb1b616b51af41f5e27652,0,www.bild.de,Jimi Blue und Yeliz Koc - Seid ihr etwa wieder zusammen?,"Jimi Blue und Yeliz Koc zeigen sich gemeinsam auf einer Hochzeit und heizen mit diesem Foto neue Liebes-Gerüchte an. Was wirklich dahinter steckt, weiß BILD","https://images.bild.de/68bb1b616b51af41f5e27652/5ccd6f3cac4722ad70dfeec0d3c1245e,de624afd?w=1280",2025-09-05T19:55:45Z,,"Hannover Es ist ein tolles Paar, das hier für ein Foto posiert. Er trägt einen goldenen Anzug, sie ein elegantes Kleid mit Goldschimmer. Das passt, denkt man sich bei diesem Anblick doch wer Jimi Blu… [+2010 chars]",,de,'heizen'
https://www.n-tv.de/politik/20-26-Russischer-LNG-Tanker-legt-in-chinesischem-Hafen-an--article26015611.html,https://www.n-tv.de/politik/20-26-Russischer-LNG-Tanker-legt-in-chinesischem-Hafen-an--article26015611.html,0,www.n-tv.de,Ukraine-Krieg im Liveticker: +++ 20:26 Russischer LNG-Tanker legt in chinesischem Hafen an +++,Lesen Sie alle aktuellen Entwicklungen und Nachrichten über den russischen Angriffskrieg auf die Ukraine im Liveticker von ntv.de.,https://www.n-tv.de/img/incoming/crop25117070/8311326854-cImg_16_9-w1200/Ukraine-Liveticker.jpg,2025-09-05T23:02:00Z,,"Ein weiterer Tanker mit Flüssiggas aus dem von den USA sanktionierten russischen Projekt Arctic LNG 2 hat in einem chinesischen Hafen angelegt, wie die Schiffsverfolgungsdaten verschiedener Webseiten… [+23258 chars]",,de,'Krieg'
https://www.n-tv.de/politik/Soeder-Bundeswehr-Einsatz-in-der-Ukraine-kaum-vorstellbar-article26014458.html,https://www.n-tv.de/politik/Soeder-Bundeswehr-Einsatz-in-der-Ukraine-kaum-vorstellbar-article26014458.html,0,www.n-tv.de,"Würde Russland nicht akzeptieren: Söder: Bundeswehr-Einsatz in der Ukraine ""kaum vorstellbar""","Die westlichen Verbündeten der Ukraine diskutieren, wie mögliche Sicherheitsgarantien für die Ukraine ausgestaltet werden können. Aus Sicht von Markus Söder ist ein Bundeswehreinsatz nahezu ausgeschlossen. Dafür sieht er gleich mehrere Gründe.",https://www.n-tv.de/img/incoming/crop26014459/1031324542-cImg_16_9-w1200/545118716.jpg,2025-09-06T00:59:46Z,,"Die westlichen Verbündeten der Ukraine diskutieren, wie mögliche Sicherheitsgarantien für die Ukraine ausgestaltet werden können. Aus Sicht von Markus Söder ist ein Bundeswehreinsatz nahezu ausgeschl… [+1973 chars]",,de,'Sicherheit'
https://www.nzz.ch/international/ukraine-krieg-putin-will-keine-europaeischen-truppen-zulassen-ld.1901123,https://www.nzz.ch/international/ukraine-krieg-putin-will-keine-europaeischen-truppen-zulassen-ld.1901123,0,www.nzz.ch,Putin lehnt europäische Truppen in der Ukraine vehement ab – Selenski will er nur in Moskau treffen,Russland will den Ukraine-Krieg zu seinen Bedingungen beenden. Für ein Treffen mit dem ukrainischen Präsidenten stellt der Kreml unrealistische Forderungen.,"https://img.nzz.ch/2025/09/05/b97d11df-af83-422b-a3a6-9762dad0c43f.jpg?width=1200&height=675&fit=bounds&quality=75&auto=webp&crop=6620,3724,x0,y131&wmark=nzz",2025-09-06T03:30:00Z,,"Am Östlichen Wirtschaftsforum in der russischen Pazifikstadt Wladiwostok lässt Wladimir Putin keinen Zweifel daran, dass er den Ukraine-Krieg nach seinen Vorstellungen beenden will.
Russland blickt … [+5971 chars]",,de,'Ukraine'
https://www.faz.net/aktuell/politik/ukraine/ukraine-liveticker-csu-chef-soeder-gegen-bundeswehr-einsaetze-in-der-ukraine-faz-110172806.html,https://www.faz.net/aktuell/politik/ukraine/ukraine-liveticker-csu-chef-soeder-gegen-bundeswehr-einsaetze-in-der-ukraine-faz-110172806.html,0,www.faz.net,Krieg in der Ukraine: CSU-Chef Söder gegen Bundeswehr-Einsätze in der Ukraine,Russland lehnt Sicherheitsgarantien abermals ab +++ Selenskyj rechnet mit Stationierung Tausender Soldaten in seinem Land +++ Koalition der Willigen will Trump überzeugen +++ alle Neuigkeiten im Liveblog,https://media0.faz.net/ppmedia/w1200/aktuell/politik/3254981931/1.10673552/facebook_teaser/csu-chef-soeder-sieht.jpg.webp,2025-09-06T05:27:29Z,,"Der Kreml lehnt Sicherheitsgarantien europäischer Staaten und der USA für die Ukraine entschieden ab. Können ausländische, insbesondere europäische und amerikanische Militärkontingente, die Sicherhei… [+398 chars]",,de,'Sicherheit'
https://www.transfermarkt.de/mit-deutlichem-sieg-gegen-niger-marokko-lost-fruhzeitig-ticket-fur-wm-2026/view/news/460034,https://www.transfermarkt.de/mit-deutlichem-sieg-gegen-niger-marokko-lost-fruhzeitig-ticket-fur-wm-2026/view/news/460034,0,www.transfermarkt.de,Marokko löst frühzeitig Ticket für WM 2026,Knapp drei Jahre nach dem sensationellen Halbfinal-Einzug in Katar hat sich Marokko erneut für eine Weltmeisterschaft qualifiziert. Dank eines 5:0 (2:0) gegen Niger steht die Teilnahme an der...,https://tmssl.akamaized.net/images/foto/big/achraf-hakimi-marokko-2024-1757141670-176892.jpg?lm=1757141679,2025-09-06T06:48:40Z,,"2022 bis ins Halbfinale gekommen 
Knapp drei Jahre nach dem sensationellen Halbfinal-Einzug in Katar hat sich Marokko erneut für eine Weltmeisterschaft qualifiziert. Dank eines 5:0 (2:0) gegen Niger… [+866 chars]",,de,'Katar'
https://www.n-tv.de/politik/Soeder-will-wehrfaehige-Ukrainer-in-ihre-Heimat-zurueckschicken-article26014458.html,https://www.n-tv.de/politik/Soeder-will-wehrfaehige-Ukrainer-in-ihre-Heimat-zurueckschicken-article26014458.html,0,www.n-tv.de,"""Selbst für Sicherheit sorgen"": Söder will wehrfähige Ukrainer in ihre Heimat zurückschicken","CSU-Chef Söder sieht keine großen Chancen auf Frieden in der Ukraine. Für ihn ein Grund, den Umgang mit geflüchteten Ukrainern hierzulande zu überdenken. Und eine Idee hat Bayerns Regierungschef dabei auch schon. Unvorstellbar sind hingegen deutsche Soldaten …",https://www.n-tv.de/img/incoming/crop26014459/1031324542-cImg_16_9-w1200/545118716.jpg,2025-09-06T08:05:00Z,,"CSU-Chef Söder sieht keine großen Chancen auf Frieden in der Ukraine. Für ihn ein Grund, den Umgang mit geflüchteten Ukrainern hierzulande zu überdenken. Und eine Idee hat Bayerns Regierungschef dabe… [+2564 chars]",,de,'Sicherheit'
https://www.welt.de/politik/ausland/article68b91d9746b61b4dcb0b8b8f/ukraine-krieg-es-wird-ploetzlich-enden-sagt-trump-russland-bereitet-laut-kiewentscheidungsdurchbruch-vor-liveticker.html,https://www.welt.de/politik/ausland/article68b91d9746b61b4dcb0b8b8f/ukraine-krieg-es-wird-ploetzlich-enden-sagt-trump-russland-bereitet-laut-kiewentscheidungsdurchbruch-vor-liveticker.html,0,www.welt.de,"„Es wird plötzlich enden“, sagt Trump – Russland bereitet laut Kiew „Entscheidungsdurchbruch“ vor",US-Präsident Trump sieht die Gespräche über Sicherheitsgarantien für die Ukraine auf einem guten Weg – und glaubt an ein schnelles Ende des Krieges. Selenskyj äußert sich zu einem möglichen Treffen mit Putin. Unterdessen ändert Russlands Militär in der Region…,https://images.welt.de/68b91d9746b61b4dcb0b8b8f/457ba0299c14191f31ddf4365f935354/ci16x9-w1200/us-president-donald-trump-speaks-to,2025-09-06T08:43:00Z,,Die Bemühungen um ein Ende des Ukraine-Krieges gehen weiter. Die europäischen Staaten diskutieren über Sicherheitsgarantien für Kiew  und die mögliche Entsendung von Truppen zur Absicherung eines Fri… [+7614 chars],,de,'Sicherheit'
https://www.welt.de/politik/ausland/article68b91d9746b61b4dcb0b8b8f/Ukraine-Krieg-Es-wird-ploetzlich-enden-sagt-Trump-Putin-Aussage-sorgt-bei-Selenskyj-fuer-Kopfschuetteln-Liveticker.html,https://www.welt.de/politik/ausland/article68b91d9746b61b4dcb0b8b8f/Ukraine-Krieg-Es-wird-ploetzlich-enden-sagt-Trump-Putin-Aussage-sorgt-bei-Selenskyj-fuer-Kopfschuetteln-Liveticker.html,0,www.welt.de,"„Es wird plötzlich enden“, sagt Trump – Putin-Aussage sorgt bei Selenskyj für Kopfschütteln",US-Präsident Trump sieht die Gespräche über Sicherheitsgarantien für die Ukraine auf einem guten Weg – und er glaubt an ein schnelles Ende des Krieges. In einem TV-Interview äußert sich Selenskyj zu einem möglichen Treffen mit Putin. Mehr im Liveticker.,https://images.welt.de/68b91d9746b61b4dcb0b8b8f/457ba0299c14191f31ddf4365f935354/ci16x9-w1200/us-president-donald-trump-speaks-to,2025-09-06T08:43:00Z,,Die Bemühungen um ein Ende des Ukraine-Krieges gehen weiter. Die europäischen Staaten diskutieren über Sicherheitsgarantien für Kiew  und die mögliche Entsendung von Truppen zur Absicherung eines Fri… [+5147 chars],,de,'Kreml'
https://www.tagesspiegel.de/politik/abschiebungen-nach-afghanistan-dobrindt-will-ruckfuhrungen-intensivieren--ohne-gegenleistung-14286845.html,https://www.tagesspiegel.de/politik/abschiebungen-nach-afghanistan-dobrindt-will-ruckfuhrungen-intensivieren--ohne-gegenleistung-14286845.html,0,www.tagesspiegel.de,Abschiebungen nach Afghanistan: Dobrindt will Rückführungen intensivieren – ohne Gegenleistung,"Mit den islamistischen Taliban will die Bundesregierung keine offiziellen diplomatischen Beziehungen. Um dennoch Straftäter abschieben zu können, war sie deshalb zuletzt auf Unterstützung angewiesen.",https://www.tagesspiegel.de/images/12846938/alternates/BASE_16_9_W1400/1733759163000/17-october-2024-sign-with-the-inscription-deportation-points-the-way-for-the-deportation-of-people-symbolizes-the-ger.jpeg,2025-09-06T11:51:56Z,,"Bundesinnenminister Alexander Dobrindt (CSU) will dafür sorgen, dass Abschiebungen nach Afghanistan häufiger stattfinden. Ob diese dann wie zuletzt wieder mit Unterstützung des Golfstaats Katar organ… [+2647 chars]",,de,'Katar'
https://www.pcgames.de/Warhammer-40000-Space-Marine-2-Spiel-74358/News/Jubilaeums-Update-1481484/,https://www.pcgames.de/Warhammer-40000-Space-Marine-2-Spiel-74358/News/Jubilaeums-Update-1481484/,0,www.pcgames.de,Warhammer 40K: Space Marine 2 feiert größtes Update,"Space Marine 2 feiert seinen ersten Geburtstag mit dem größten Update seit Release. Neue Modi, Waffen, Bosse und DLCs heizen das Spiel auf.",https://www.pcgames.de/screenshots/original/2025/08/Space-Marine-2-feiert-Geburtstag-mit-Mega-Patch-1--pcgh_artwork.jpg,2025-09-06T13:05:00Z,,"Warhammer 40.000: Space Marine 2 wird ein Jahr alt und die Entwickler feiern dieses Jubiläum nicht leise, sondern mit einem Content-Paket, das so groß ist wie noch nie. Das kostenlose Jubiläums-Updat… [+2030 chars]",,de,'heizen'
https://www.stern.de/politik/-njet----putin-belaechelt-wirtschaftsfrage-36033930.html,https://www.stern.de/politik/-njet----putin-belaechelt-wirtschaftsfrage-36033930.html,0,www.stern.de,"""NJET"": Kreml-Chef widerspricht Minister: Putin belächelt Wirtschaftsfrage","Russlands Wirtschaftsminister warnt vor Rezession. Kreml-Chef Putin belächelt die Wirtschaftsfrage beim Forum in Wladiwostok einsilbig mit einem knappen ""Njet“.",https://image.stern.de/36034044/t/Af/v2/w1440/r1.7778/-/njet.jpg,2025-09-06T14:57:00Z,,"Zugang zu stern+statt 11,96 
 nur 1  
<ul><li>Alles von stern+ mit erstklassigen Inhalten von GEO und Capital</li><li>4 Wochen testen, dann 2,99  je Woche</li><li>jederzeit kündbar</li></ul>",,de,'Kreml'
https://www.zeit.de/politik/deutschland/2025-09/abschiebungen-afghanistan-dobrindt-kritik-kosten,https://www.zeit.de/politik/deutschland/2025-09/abschiebungen-afghanistan-dobrindt-kritik-kosten,0,www.zeit.de,Migrationspolitik: Dobrindt will mehr Abschiebungen nach Afghanistan ohne Gegenleistung,Bisher zweimal ließ die Bundesrepublik mit Hilfe aus Katar Afghanen abschieben. Laut Bundesinnenminister Alexander Dobrindt sollen mehr Menschen folgen.,https://img.zeit.de/politik/deutschland/2025-09/abschiebung-afghanistan-gegenleistung/wide__1300x731,2025-09-06T14:57:07Z,,"Bundesinnenminister Alexander Dobrindt (CSU) will dafür sorgen, dass Abschiebungen nach Afghanistan häufiger stattfinden. ""Die Bundesregierung arbeitet intensiv daran, einen dauerhaften Rückführungsm… [+2461 chars]",,de,'Katar'
