index,url,valid,domain,title,description,image,published,archive,content,quote,language,keyword
https://www.n-tv.de/politik/Ukrainer-nutzen-in-der-Region-Kursk-russische-Stellung-zur-Verteidigung-article25262249.html,https://www.n-tv.de/politik/Ukrainer-nutzen-in-der-Region-Kursk-russische-Stellung-zur-Verteidigung-article25262249.html,0,www.n-tv.de,Kreml-Fehlschlag in Region Kursk: Ukrainer wehren Angriff mithilfe russischer Abwehrstellung ab,"In der russischen Region Kursk führen Kreml-Truppen bei dem Dorf Plechowo einen lokalen Gegenangriff durch. Doch die ukrainischen Soldaten profitieren von Verteidigungsanlagen, die Moskau dort vor Monaten errichtet hat. Am Ende bleibt die Attacke im Abwehrfeu…",https://bilder4.n-tv.de/img/incoming/crop25262303/1571329631-cImg_16_9-w1200/kursk.jpg,2024-10-01T00:47:58Z,https://web.archive.org/web/20241001024925/https://www.n-tv.de/politik/Ukrainer-nutzen-in-der-Region-Kursk-russische-Stellung-zur-Verteidigung-article25262249.html,"In der russischen Region Kursk führen Kreml-Truppen bei dem Dorf Plechowo einen lokalen Gegenangriff durch. Doch die ukrainischen Soldaten profitieren von Verteidigungsanlagen, die Moskau dort vor Mo… [+1977 chars]",,de,'Kreml'
https://www.tagesschau.de/ausland/europa/stoltenberg-nato-146.html,https://www.tagesschau.de/ausland/europa/stoltenberg-nato-146.html,0,www.tagesschau.de,Stoltenberg tritt nach zehn Jahren im Amt als NATO-Generalsekretär ab,"Nach zehn Jahren im Amt tritt Jens Stoltenberg als NATO-Generalsekretär heute ab. Er blickt auf eine turbulente Zeit zurück - nicht nur wegen des Ukraine-Kriegs, sondern auch wegen interner Streitigkeiten. Von Helga Schmidt.",https://images.tagesschau.de/image/f9eb81e2-8841-4602-9c00-0cd86b3af521/AAABkkIwkh0/AAABkZLhkrw/16x9-1280/jens-stoltenberg-148.jpg,2024-10-01T02:45:12Z,https://web.archive.org/web/20241001035633/https://www.tagesschau.de/ausland/europa/stoltenberg-nato-146.html,"Stand: 01.10.2024 04:45 Uhr
Nach zehn Jahren im Amt tritt Jens Stoltenberg als NATO-Generalsekretär ab. Er blickt auf eine turbulente Zeit zurück - nicht nur wegen des Ukraine-Kriegs, sondern auch w… [+7432 chars]",,de,'Pipeline'
https://www.zeit.de/news/2024-10/01/56-prozent-des-stroms-stammen-aus-erneuerbaren-energien,https://www.zeit.de/news/2024-10/01/56-prozent-des-stroms-stammen-aus-erneuerbaren-energien,0,www.zeit.de,Energiewende: 56 Prozent des Stroms stammen aus erneuerbaren Energien,Hier finden Sie Informationen zu dem Thema „Energiewende“. Lesen Sie jetzt „56 Prozent des Stroms stammen aus erneuerbaren Energien“.,https://img.zeit.de/news/2024-10/01/56-prozent-des-stroms-stammen-aus-erneuerbaren-energien-image-group/wide__1300x731,2024-10-01T03:00:41Z,,"Erneuerbare Energien geben beim Strom in Deutschland weiter den Ton an: In den ersten drei Quartalen hat Elektrizität vor allem aus Windkraft, Sonnenlicht, Biomasse und Wasserkraft insgesamt rund 56 … [+2181 chars]",,de,'Energie'
https://www.nzz.ch/wirtschaft/gasprojekt-von-total-massaker-an-zivilisten-in-mosambik-ld.1850778,https://www.nzz.ch/wirtschaft/gasprojekt-von-total-massaker-an-zivilisten-in-mosambik-ld.1850778,0,www.nzz.ch,Auf dem Gelände eines milliardenschweren Gasprojekts von Total sollen mehr als 150 Zivilisten gefoltert und exekutiert worden sein,Eine Recherche des Onlinemediums «Politico» wirft neues schlechtes Licht auf ein Gasprojekt des französischen Energieriesen in Moçambique. Mit den Gasfunden in dem armen Land waren einst grosse Hoffnungen verbunden.,"https://img.nzz.ch/2024/09/30/62511bc5-1d80-498d-8123-93e2c2a2bbe4.jpeg?width=1200&height=674&fit=bounds&quality=75&auto=webp&crop=6159,3463,x0,y643&wmark=nzz",2024-10-01T03:30:00Z,https://web.archive.org/web/20241001044654/https://www.nzz.ch/wirtschaft/gasprojekt-von-total-massaker-an-zivilisten-in-mosambik-ld.1850778,"Mosambikanische Soldaten 2021 in den Strassen der Stadt Palma. Die Armee soll verantwortlich sein für ein Massaker an Zivilisten.
Auf dem Gelände eines Milliardenprojekts des französischen Energieko… [+3955 chars]",,de,'Energie'
https://www.nzz.ch/pro/oesterreichs-wende-kickl-fpoe-und-putins-einfluss-ld.1849725,https://www.nzz.ch/pro/oesterreichs-wende-kickl-fpoe-und-putins-einfluss-ld.1849725,0,www.nzz.ch,Wird Österreich zum Sicherheitsrisiko im Alpenraum?,Das Netzwerk um den österreichischen Kanzlerkandidaten Herbert Kickl reicht von der identitären Szene bis zu Wladimir Putin.,"https://img.nzz.ch/2024/09/30/1a169ef6-2bf3-4cd6-add9-856c6c3fb80f.png?width=1200&height=674&fit=bounds&quality=75&auto=webp&crop=1800,1012,x0,y169&wmark=nzz",2024-10-01T03:30:00Z,http://archive.md/20241001054109/https://www.nzz.ch/pro/oesterreichs-wende-kickl-fpoe-und-putins-einfluss-ld.1849725,"Für Herbert Kickl ist Remigration kein Kampfbegriff, sondern ein zentrales politisches Programm seiner möglichen Regierungszeit. Was der Kanzlerkandidat der Freiheitlichen Partei Österreichs (FPÖ) wi… [+12258 chars]",,de,'Kreml'
https://www.focus.de/finanzen/gastbeitrag-von-gabor-steingart-nicht-nur-habeck-ist-das-problem-auch-die-cdu-braucht-wirtschafts-nachhilfe_id_260357031.html,https://www.focus.de/finanzen/gastbeitrag-von-gabor-steingart-nicht-nur-habeck-ist-das-problem-auch-die-cdu-braucht-wirtschafts-nachhilfe_id_260357031.html,0,www.focus.de,Gastbeitrag von Gabor Steingart - Nicht nur Habeck ist das Problem – auch die CDU braucht Wirtschafts-Nachhilfe,Nach Robert Habeck wird es so schnell keinen Wirtschaftsminister der Grünen mehr geben. Doch Grund zur Freude ist das nicht: Auch bei der CDU mangelt es bei einigen an ökonomischem Sachverstand. Es droht eine große Koalition der Reformverweigerer.Von Gastauto…,https://p6.focus.de/img/fotos/id_260357041/bundestag-82560624.jpg?im=Crop%3D%280%2C35%2C3331%2C1665%29%3BResize%3D%281200%2C627%29&impolicy=perceptual&quality=mediumHigh&hash=f677eb2de74d4a86d65dd615258e2808ec190b84644c02dc602fec3a0bc070f3,2024-10-01T06:13:28Z,,Nach Robert Habeck wird es so schnell keinen Wirtschaftsminister der Grünen mehr geben. Doch Grund zur Freude ist das nicht: Auch bei der CDU mangelt es bei einigen an ökonomischem Sachverstand. Es d… [+5666 chars],,de,'Gas'
https://www.focus.de/politik/keine-loesung-in-10-20-oder-30-jahren-serbiens-praesident-sieht-in-absehbarer-zeit-kein-ende-des-ukraine-konflikts_id_260357213.html,https://www.focus.de/politik/keine-loesung-in-10-20-oder-30-jahren-serbiens-praesident-sieht-in-absehbarer-zeit-kein-ende-des-ukraine-konflikts_id_260357213.html,0,www.focus.de,Belgrad hat eine düstere Prognose - Serbiens Präsident sieht in absehbarer Zeit kein Ende des Ukraine-Konflikts,Serbiens Präsident Vučić warnt vor einem langwierigen Konflikt in der Ukraine und zieht Parallelen zum Koreakrieg.,https://p6.focus.de/img/fotos/id_260216197/aleksandar-vucic-2024.jpg?im=Crop%3D%280%2C0%2C3464%2C1732%29%3BResize%3D%281200%2C627%29&impolicy=perceptual&quality=mediumHigh&hash=6f050f6f6a3721505bbc5df94c3b973391f53f5929d226775b444b5f14bc21e8,2024-10-01T07:37:50Z,,Serbiens Präsident Vui warnt vor einem langwierigen Konflikt in der Ukraine und zieht Parallelen zum Koreakrieg.Der serbische Präsident Aleksandar Vui hat eine düstere Prognose für das Ende des Ukrai… [+1352 chars],,de,'Ukraine'
https://www.zeit.de/news/2024-10/01/sieben-tote-in-cherson-bei-russischem-beschuss,https://www.zeit.de/news/2024-10/01/sieben-tote-in-cherson-bei-russischem-beschuss,0,www.zeit.de,Krieg in der Ukraine: Sieben Tote in Cherson bei russischem Beschuss,Hier finden Sie Informationen zu dem Thema „Krieg in der Ukraine“. Lesen Sie jetzt „Sieben Tote in Cherson bei russischem Beschuss“.,https://img.zeit.de/news/2024-10/01/sieben-tote-in-cherson-bei-russischem-beschuss-image-group/wide__1300x731,2024-10-01T08:35:44Z,,In der südukrainischen Großstadt Cherson sind am Morgen nach offiziellen Angaben mindestens sieben Menschen durch russischen Beschuss ums Leben gekommen. Drei weitere Zivilisten wurden verletzt. Das … [+926 chars],,de,'Ukraine'
https://www.tagesschau.de/newsticker/liveblog-ukraine-dienstag-392.html,https://www.tagesschau.de/newsticker/liveblog-ukraine-dienstag-392.html,0,www.tagesschau.de,Ukraine-Liveblog: ++ Mehrere Tote nach Angriff auf Cherson ++,Bei einem russischen Angriff auf einen Markt in Cherson hat es mehrere Tote gegeben. Der ukrainische Präsident Selenskyj forderte seine Landsleute zu einem Kraftakt auf. Die Entwicklungen im Liveblog.,https://images.tagesschau.de/image/5b073b67-29bf-4703-b6b1-71469e4c25bb/AAABjz78AfM/AAABkZLhkrw/16x9-1280/flagge-ukraine-truemmer-101.jpg,2024-10-01T08:47:56Z,https://web.archive.org/web/20241001112604/https://www.tagesschau.de/newsticker/liveblog-ukraine-dienstag-392.html,"Stand: 01.10.2024 10:47 Uhr
Bei einem russischen Angriff auf einen Markt in Cherson hat es mehrere Tote gegeben. Der ukrainische Präsident Selenskyj forderte seine Landsleute zu einem Kraftakt auf. … [+3318 chars]",,de,'Wladimir Putin'
https://www.welt.de/kultur/article249220716/Ukraine-Kriegstagebuch-Als-ich-der-Dylan-der-UdSSR-sein-wollte.html,https://www.welt.de/kultur/article249220716/Ukraine-Kriegstagebuch-Als-ich-der-Dylan-der-UdSSR-sein-wollte.html,0,www.welt.de,Als ich der Dylan der UdSSR sein wollte,Seit dem ersten Kriegsmorgen hält uns der preisgekrönte Übersetzer Juri Durkot aus Lemberg über die Lage in der Ukraine auf dem Laufenden. Heute erinnert er sich an seine kurze Laufbahn als Rockmusiker in der Sowjetunion.,https://img.welt.de/img/vermischtes/bilder-des-tages/mobile247937528/6477938607-ci16x9-w1200/bdt-1110.jpg,2024-10-01T08:50:00Z,,Seit dem ersten Kriegsmorgen hält uns der preisgekrönte Übersetzer Juri Durkot aus Lemberg über die Lage in der Ukraine auf dem Laufenden. Heute erinnert er sich an seine kurze Laufbahn als Rockmusik… [+127838 chars],,de,'frieren'
https://www.faz.net/aktuell/politik/ukraine/ukraine-liveticker-verteidigungsausschuss-vorsitzender-kritisiert-scholz-ukraine-politik-19030454.html,https://www.faz.net/aktuell/politik/ukraine/ukraine-liveticker-verteidigungsausschuss-vorsitzender-kritisiert-scholz-ukraine-politik-19030454.html,0,www.faz.net,Ukraine-Liveblog: Verteidigungsausschuss-Vorsitzender kritisiert Scholz’ Ukraine-Politik scharf,„Kurs der Verweigerung“ +++ Peskow relativiert neue russische Nukleardoktrin +++ Menschenrechtler: 14.000 ukrainische Zivilisten in russischen Gefängnissen +++ Stundenlange russische Drohnenangriffe auf Kiew +++ alle Entwicklungen im Liveblog,https://media0.faz.net/ppmedia/aktuell/politik/577942600/1.10020354/facebook_teaser/marcus-faber-fdp-spricht-in.jpg,2024-10-01T09:09:18Z,https://web.archive.org/web/20241001104307/https://www.faz.net/aktuell/politik/ukraine/ukraine-liveticker-verteidigungsausschuss-vorsitzender-kritisiert-scholz-ukraine-politik-19030454.html,Die stellvertretende Grünen-Fraktionsvorsitzende Agnieszka Brugger warf Scholz schlechte Kommunikation vor. Der Bundeskanzler hätte die Entscheidung zur Stationierung von US-Raketen viel ausführliche… [+618 chars],,de,'Ukraine'
https://www.stern.de/gesellschaft/regional/berlin-brandenburg/letzte-generation--pipeline-sabotage---klimaaktivisten-legen-rechtsmittel-ein-35109466.html,https://www.stern.de/gesellschaft/regional/berlin-brandenburg/letzte-generation--pipeline-sabotage---klimaaktivisten-legen-rechtsmittel-ein-35109466.html,0,www.stern.de,Letzte Generation: Pipeline-Sabotage - Klimaaktivisten legen Rechtsmittel ein,Wegen der Manipulation der Ölleitung von Rostock ins brandenburgische Schwedt sollen zwei Klimaaktivisten in Haft. Nun muss sich ein anderes Gericht mit dem Fall befassen - welches ist noch unklar.,https://image.stern.de/35109468/t/pU/v1/w1440/r1.7778/-/01--eimgmdcjdrv15axw800h600jpeg---9292e810484669eb.jpg,2024-10-01T09:17:40Z,https://web.archive.org/web/20241001112637/https://www.stern.de/gesellschaft/regional/berlin-brandenburg/letzte-generation--pipeline-sabotage---klimaaktivisten-legen-rechtsmittel-ein-35109466.html,"Wegen der Manipulation der Ölleitung von Rostock ins brandenburgische Schwedt sollen zwei Klimaaktivisten in Haft. Nun muss sich ein anderes Gericht mit dem Fall befassen - welches ist noch unklar.
… [+2859 chars]",,de,'Pipeline'
https://www.mdr.de/ratgeber/neu-ab/winterreifen-heizkosten-whatsapp-124.html,https://www.mdr.de/ratgeber/neu-ab/winterreifen-heizkosten-whatsapp-124.html,0,www.mdr.de,Winterreifen und Heizungen: Was sich ab Oktober für Verbraucher ändert,"Autoreifen müssen bei Winterwetter mit dem Alpine-Symbol gekennzeichnet sein, Autos aus der Ukraine in Deutschland zugelassen und neu eingebaute Heizungen nun hydraulisch geprüft werden. Die Änderungen ab Oktober im Überblick.",https://cdn.mdr.de/nachrichten/mdraktuell-ukraine-kennzeichen-106_v-variantBig16x9_wm-true_zc-ecbbafc6.jpg?version=35102,2024-10-01T09:18:11Z,http://archive.md/20241001212027/https://www.mdr.de/ratgeber/neu-ab/winterreifen-heizkosten-whatsapp-124.html,Zum 1. Oktober treten Neuregelungen des Gebäudeenergiegesetzes (GEG) zum verpflichtenden Heizungs-Check und hydraulischen Abgleich in Kraft. Bei Mehrfamilienhäusern mit mindestens sechs Wohnungen müs… [+505 chars],,de,'Winter'
https://www.tagesspiegel.de/berlin/letzte-generation-pipeline-sabotage-klimaaktivisten-legen-rechtsmittel-ein-12466616.html,https://www.tagesspiegel.de/berlin/letzte-generation-pipeline-sabotage-klimaaktivisten-legen-rechtsmittel-ein-12466616.html,0,www.tagesspiegel.de,Letzte Generation: Pipeline-Sabotage - Klimaaktivisten legen Rechtsmittel ein,Wegen der Manipulation der Ölleitung von Rostock ins brandenburgische Schwedt sollen zwei Klimaaktivisten in Haft. Nun muss sich ein anderes Gericht mit dem Fall befassen - welches ist noch unklar.,https://www.tagesspiegel.de/images/12466613/alternates/BASE_16_9_W1400/1727774316000/pumpstation-an-olleitung-der-pck-schwedt.jpeg,2024-10-01T09:18:37Z,,Nach der Verurteilung zu Haftstrafen wegen der Sabotage einer von der Ostsee nach Brandenburg verlaufenden Erdölleitung beziehungsweise des Versuchs haben zwei Klimaaktivisten Rechtsmittel eingelegt.… [+2745 chars],,de,'Pipeline'
https://www.zeit.de/politik/ausland/2024-10/ukraine-krieg-olaf-scholz-wladimir-putin-telefonat-russland,https://www.zeit.de/politik/ausland/2024-10/ukraine-krieg-olaf-scholz-wladimir-putin-telefonat-russland,0,www.zeit.de,Ukraine-Krieg: Olaf Scholz will mit Wladimir Putin telefonieren,Fast zwei Jahre ist das letzte Gespräch zwischen Olaf Scholz und dem russischen Präsidenten her. Nach Informationen der ZEIT plant der Kanzler ein Telefonat mit Putin.,https://img.zeit.de/politik/ausland/2024-10/olaf-scholz-wladimir-putin-direkter-kontakt-bild/wide__1300x731,2024-10-01T09:51:30Z,http://archive.md/20241001102311/https://www.zeit.de/politik/ausland/2024-10/ukraine-krieg-olaf-scholz-wladimir-putin-telefonat-russland,"Bundeskanzler Olaf Scholz (SPD) will nach fast zwei Jahren erstmals wieder direkt mit dem russischen Präsidenten Wladimir Putin in Kontakt treten. Das
 erfuhr DIE ZEIT aus Regierungskreisen. Es sei … [+1266 chars]",,de,'Wladimir Putin'
https://www.welt.de/geschichte/zweiter-weltkrieg/article212169449/Potsdamer-Konferenz-Schrecken-mit-Ansage-als-die-USA-Japan-mit-voelliger-Zerstoerung-drohten.html,https://www.welt.de/geschichte/zweiter-weltkrieg/article212169449/Potsdamer-Konferenz-Schrecken-mit-Ansage-als-die-USA-Japan-mit-voelliger-Zerstoerung-drohten.html,0,www.welt.de,Als die USA Japan mit „völliger Zerstörung“ drohten,Am 26. Juli 1945 veröffentlichten Harry S. Truman und Winston Churchill ihr Ultimatum an den Kriegsgegner Japan. Im Hintergrund stand das Kräftemessen mit Stalin. Entscheidend wurden zwei Wörter der Antwort aus Tokio.,https://img.welt.de/img/geschichte/zweiter-weltkrieg/mobile212169437/3847939007-ci16x9-w1200/Potsdam-Conference-Germany-July-1945-2.jpg,2024-10-01T09:57:00Z,https://web.archive.org/web/20241001101008/https://www.welt.de/geschichte/zweiter-weltkrieg/article212169449/Potsdamer-Konferenz-Schrecken-mit-Ansage-als-die-USA-Japan-mit-voelliger-Zerstoerung-drohten.html,Am 26. Juli 1945 veröffentlichten Harry S. Truman und Winston Churchill ihr Ultimatum an den Kriegsgegner Japan. Im Hintergrund stand das Kräftemessen mit Stalin. Entscheidend wurden zwei Wörter der … [+7323 chars],,de,'Krieg'
https://www.zeit.de/news/2024-10/01/russische-truppen-dringen-ins-zentrum-von-wuhledar-vor,https://www.zeit.de/news/2024-10/01/russische-truppen-dringen-ins-zentrum-von-wuhledar-vor,0,www.zeit.de,Krieg in der Ukraine: Russische Truppen dringen ins Zentrum von Wuhledar vor,Hier finden Sie Informationen zu dem Thema „Krieg in der Ukraine“. Lesen Sie jetzt „Russische Truppen dringen ins Zentrum von Wuhledar vor“.,https://img.zeit.de/news/2024-10/01/russische-truppen-dringen-ins-zentrum-von-wuhledar-vor-image-group/wide__1300x731,2024-10-01T10:47:46Z,,"Russische Truppen sind in die ostukrainische Bergarbeiterstadt Wuhledar vorgedrungen. «Die Kämpfe finden im Stadtgebiet statt. Daher ist es fast nicht mehr möglich, humanitäre Hilfe hinzubringen», sa… [+2477 chars]",,de,'Ukraine'
https://www.zeit.de/news/2024-10/01/un-buero-kiew-kriegsgefangene-werden-gefoltert,https://www.zeit.de/news/2024-10/01/un-buero-kiew-kriegsgefangene-werden-gefoltert,0,www.zeit.de,Krieg gegen Ukraine: UN-Büro Kiew: Kriegsgefangene werden gefoltert,Hier finden Sie Informationen zu dem Thema „Krieg gegen Ukraine“. Lesen Sie jetzt „UN-Büro Kiew: Kriegsgefangene werden gefoltert“.,https://img.zeit.de/news/2024-10/01/un-buero-kiew-kriegsgefangene-werden-gefoltert-image-group/wide__1300x731,2024-10-01T10:48:45Z,,Das UN-Menschenrechtsbüro hat Folter und Misshandlungen von ukrainischen und russischen Kriegsgefangenen dokumentiert. Allerdings waren die Ukrainer nach eigenen Angaben während ihrer ganzen Gefangen… [+2172 chars],,de,'Ukraine'
https://www.tagesschau.de/ausland/europa/ukraine-russland-vormarsch-100.html,https://www.tagesschau.de/ausland/europa/ukraine-russland-vormarsch-100.html,0,www.tagesschau.de,Vormarsch in der Ostukraine: Russische Truppen in Wuhledar,Russische Truppen sind in der Ostukraine weiter auf dem Vormarsch. Wuhledar im Gebiet Donezk steht nach ukrainischen Angaben kurz vor der Einnahme. Auch Cherson und Saporischschja waren erneut Ziel von Angriffen.,https://images.tagesschau.de/image/400fbe00-abc7-4121-b9ea-56da0962a8d0/AAABkkggFuU/AAABkZLhkrw/16x9-1280/ukraine-saporischschja-128.jpg,2024-10-01T13:11:28Z,https://web.archive.org/web/20241001160753/https://www.tagesschau.de/ausland/europa/ukraine-russland-vormarsch-100.html,"Stand: 01.10.2024 15:11 Uhr
Russische Truppen sind in der Ostukraine weiter auf dem Vormarsch. Wuhledar im Gebiet Donezk steht nach ukrainischen Angaben kurz vor der Einnahme. Auch Cherson und Sapor… [+3913 chars]",,de,'Saporischschja'
https://www.zeit.de/video/2024-10/6362710050112/nachfolger-von-stoltenberg-neuer-nato-chef-rutte-stellt-sich-hinter-die-ukraine,https://www.zeit.de/video/2024-10/6362710050112/nachfolger-von-stoltenberg-neuer-nato-chef-rutte-stellt-sich-hinter-die-ukraine,0,www.zeit.de,Nachfolger von Stoltenberg: Neuer Nato-Chef Rutte stellt sich hinter die Ukraine,"Jens Stoltenberg übergibt den Nato-Chefposten an Mark Rutte, Ex-Regierungschef der Niederlande. Dieser erklärt die Unterstützung der Ukraine zu einer seiner Prioritäten.",https://img.zeit.de/video/2024-10/6362710050112-still/wide__1300x731,2024-10-01T13:34:46Z,,"Schließen
Hier können Sie interessante Artikel speichern, um sie später zu lesen und wiederzufinden.
Sie haben bereits ein Konto?
 Hier anmelden.",,de,'Ukraine'
https://www.focus.de/politik/ausland/skepsis-erkennbar-gewachsen-wie-die-zeitenwende-und-die-ukraine-solidaritaet-in-deutschland-ins-wackeln-gerieten_5dc7853a-e316-424f-babe-319e10277122.html,https://www.focus.de/politik/ausland/skepsis-erkennbar-gewachsen-wie-die-zeitenwende-und-die-ukraine-solidaritaet-in-deutschland-ins-wackeln-gerieten_5dc7853a-e316-424f-babe-319e10277122.html,0,www.focus.de,"""Skepsis erkennbar gewachsen"" - Wie Zeitenwende und Ukraine-Solidarität in Deutschland ins Wackeln gerieten",An Versprechen wird es nicht fehlen auf dem Ukraine-Gipfel nächste Woche. Der Zuspruch für AfD und BSW haben die Debatte aber längst verändert – im politischen Handeln finden sich erste Ermüdungserscheinungen.,https://quadro.burda-forward.de/ctf/31608743-f6fc-481a-8d68-39d1216e0342.6bb104f8-3d7e-458e-9dce-f27281ddb946.png?im=RegionOfInterestCrop%3D%281200%2C630%29%2CregionOfInterest%3D%28874%2C463%29&hash=d3da5970fb2dc68f93c91eb390d6a206ebb873e31e89daf0779220dcd3d970a0,2024-10-01T14:12:00Z,,"Blumen liegen hier schon länger keine mehr aber vor allem deshalb, weil der Eingang zur ukrainischen Botschaft in der Berliner Albrechtstraße nicht mehr frei zugänglich ist. Absperrgitter sorgen für … [+12672 chars]",,de,'Kreml'
https://www.sueddeutsche.de/politik/scholz-putin-telefonat-russland-ukraine-lux.696FkodR8Z7yLPpYcGq9EG,https://www.sueddeutsche.de/politik/scholz-putin-telefonat-russland-ukraine-lux.696FkodR8Z7yLPpYcGq9EG,0,www.sueddeutsche.de,Krieg in der Ukraine: Scholz erwägt Telefonat mit Putin,"Im kleinen Kreis hat der Bundeskanzler zuletzt laut darüber nachgedacht, wann der Augenblick für ein Gespräch mit dem russischen Präsidenten gekommen sein könnte. Einen konkreten Termin gibt es aber offenbar nicht.",https://www.sueddeutsche.de/2024/10/01/c0240490-fd82-41cd-8e93-9f2c3dcff1a7.jpeg?q=60&fm=webp&width=1200&rect=0%2C17%2C3500%2C1969,2024-10-01T14:48:55Z,http://archive.md/20241001161214/https://www.sueddeutsche.de/politik/scholz-putin-telefonat-russland-ukraine-lux.696FkodR8Z7yLPpYcGq9EG,"Es ist ein Anruf, den Olaf Scholz schon lange vor sich herschiebt. Er werde irgendwann wieder mit dem russischen Präsidenten Wladimir Putin telefonieren, hat der Bundeskanzler immer wieder klargestel… [+3902 chars]",,de,'Krieg'
https://www.focus.de/politik/ausland/ukraine-krise/ukraine-krieg-im-ticker-russische-truppen-stossen-nach-wuhledar-vor-scholz-will-mit-putin-telefonieren_id_57275780.html,https://www.focus.de/politik/ausland/ukraine-krise/ukraine-krieg-im-ticker-russische-truppen-stossen-nach-wuhledar-vor-scholz-will-mit-putin-telefonieren_id_57275780.html,0,www.focus.de,News zum Ukraine-Krieg - Russische Truppen stoßen nach Wuhledar vor - Scholz will mit Putin telefonieren,Putin hat Moskaus Entschlossenheit bei der Militäroffensive in der Ukraine bekräftigt. Selenskyj fordert einen weiteren Kraftakt vor dem Treffen der Ukraine-Unterstützer in Ramstein. Alle Entwicklungen im Ticker.,https://p6.focus.de/img/fotos/id_260052920/scholz-will-erstmals-seit-zwei-jahren-wieder-mit-putin-telefonieren..jpg?im=Crop%3D%2872%2C0%2C830%2C415%29%3BResize%3D%281200%2C627%29&impolicy=perceptual&quality=mediumHigh&hash=dabe486353075aef762ac9eb55f4b92edc073fb60771cdc810109926002023b0,2024-10-01T18:17:33Z,,Putin hat Moskaus Entschlossenheit bei der Militäroffensive in der Ukraine bekräftigt. Selenskyj fordert einen weiteren Kraftakt vor dem Treffen der Ukraine-Unterstützer in Ramstein. Alle Entwicklung… [+9709 chars],,de,'Kreml'
https://www.faz.net/aktuell/politik/ukraine/ukraine-liveticker-russische-truppen-nehmen-offenbar-wuhledar-ein-19030454.html,https://www.faz.net/aktuell/politik/ukraine/ukraine-liveticker-russische-truppen-nehmen-offenbar-wuhledar-ein-19030454.html,0,www.faz.net,Ukraine-Liveblog: Russische Truppen nehmen offenbar Wuhledar ein,Vorsitzender des Verteidigungsausschusses kritisiert Scholz’ Ukraine-Politik +++ Peskow relativiert neue russische Nukleardoktrin +++ alle Entwicklungen im Liveblog,https://media1.faz.net/ppmedia/aktuell/politik/3799509262/1.10021931/facebook_teaser/ein-teil-einer-rakete-ragt-aus.jpg,2024-10-01T19:09:53Z,https://web.archive.org/web/20241001194245/https://www.faz.net/aktuell/politik/ukraine/ukraine-liveticker-russische-truppen-nehmen-offenbar-wuhledar-ein-19030454.html,Die stellvertretende Grünen-Fraktionsvorsitzende Agnieszka Brugger warf Scholz schlechte Kommunikation vor. Der Bundeskanzler hätte die Entscheidung zur Stationierung von US-Raketen viel ausführliche… [+618 chars],,de,'Ukraine'
https://www.n-tv.de/politik/22-28-Ukraine-vermutet-Mord-an-16-Kriegsgefangenen-Video-soll-Kriegsverbrechen-zeigen--article25265502.html,https://www.n-tv.de/politik/22-28-Ukraine-vermutet-Mord-an-16-Kriegsgefangenen-Video-soll-Kriegsverbrechen-zeigen--article25265502.html,0,www.n-tv.de,Ukraine-Krieg im Liveticker: +++ 22:28 Ukraine vermutet Mord an 16 Kriegsgefangenen - Video soll Kriegsverbrechen zeigen +++,Lesen Sie alle aktuellen Entwicklungen und Nachrichten über den russischen Angriffskrieg auf die Ukraine im Liveticker von ntv.de.,https://bilder3.n-tv.de/img/incoming/crop25117070/4231326595-cImg_16_9-w1200/Ukraine-Liveticker.jpg,2024-10-01T20:28:00Z,,Die ukrainische Justiz vermutet anhand eines Videos die Ermordung von 16 ukrainischen Kriegsgefangenen durch die russische Armee. Die Generalstaatsanwaltschaft in Kiew sprach von einem mutmaßlichen K… [+29732 chars],,de,'Ukraine'
https://www.zeit.de/wissen/2024-09/wladimir-putin-autoritarismus-demokratie-krisenpodcast,https://www.zeit.de/wissen/2024-09/wladimir-putin-autoritarismus-demokratie-krisenpodcast,0,www.zeit.de,Wladimir Putin: Wie der Putinismus weltweit Schule macht,"Weltweit rütteln Autokraten an der Demokratie. Viele von ihnen folgen dabei einem gemeinsamen Muster, erklärt die Anthropologin Shalini Randeria im Krisenpodcast.",https://img.zeit.de/wissen/2024-09/wladimir-putin-autoritarismus-demokratie-krisenpodcast-bild/wide__1300x731,2024-10-02T04:05:06Z,,"Ein Autokrat am Apparat? Ein russischer Rettungsssanitäter telefoniert unter den Augen Wladimir Putins in der russisch kontrollierten Ostukraine. © AFP/Getty Images
Die Freiheit steht unter Druck, D… [+2563 chars]",,de,'Wladimir Putin'
