index,url,valid,domain,title,description,image,published,archive,content,quote,language,keyword
https://www.morgenpost.de/politik/article242470970/Russland-Soldaten-Frauen-nun-als-Staatsfeinde-eingestuft.html,https://www.morgenpost.de/politik/article242470970/Russland-Soldaten-Frauen-nun-als-Staatsfeinde-eingestuft.html,0,www.morgenpost.de,Russland: Soldaten-Frauen nun als Staatsfeinde eingestuft,"Organisation, die sich für die Rückkehr der Soldaten aus der Ukraine einsetzt, wurde auf die Liste der „ausländischen Agenten“ gesetzt",https://img.sparknews.funkemedien.de/242470968/242470968_1717201895_v16_9_1600.jpeg,2024-06-01T00:31:35Z,,"Moskau. Organisation, die sich für die Rückkehr der Soldaten aus der Ukraine einsetzt, wurde auf die Liste der ausländischen Agenten gesetzt
Russland hat die Frauenorganisation Put Domoi, die sich f… [+2935 chars]",,de,'Kreml'
https://www.welt.de/politik/ausland/article251810644/Ukraine-Krieg-Moskau-stuft-Gruppe-von-Soldaten-Frauen-als-auslaendische-Agenten-ein.html,https://www.welt.de/politik/ausland/article251810644/Ukraine-Krieg-Moskau-stuft-Gruppe-von-Soldaten-Frauen-als-auslaendische-Agenten-ein.html,0,www.welt.de,Moskau stuft Gruppe von Soldaten-Frauen als „ausländische Agenten“ ein,"Weil sie vor dem Kreml die Rückkehr ihrer Männer aus dem Krieg in der Ukraine forderten und Blumen niederlegten, hat Moskau eine Organisation russischer Soldaten-Frauen als „ausländische Agenten“ eingestuft. Auch eine Putin-Kontrahentin wurde sanktioniert.",https://img.welt.de/img/politik/ausland/mobile251810654/4311357427-ci16x9-w1200/Grabmal-des-unbekannten-Soldaten-auf-dem-Roten-Platz.jpg,2024-06-01T01:28:19Z,,"Russland hat die Frauenorganisation Put Domoi, die sich für die Rückkehr mobilisierter russischer Soldaten aus der Ukraine einsetzt, als ausländische Agenten eingestuft.
Zu Begründung erklärte das J… [+2327 chars]",,de,'Kreml'
https://www.zeit.de/politik/ausland/2024-06/israel-vorschlag-waffenruhe-reaktionen-annalena-baerbock,https://www.zeit.de/politik/ausland/2024-06/israel-vorschlag-waffenruhe-reaktionen-annalena-baerbock,0,www.zeit.de,"Gaza-Krieg: Annalena Baerbock sieht ""Weg aus Sackgasse des Krieges""","International findet Israels Vorschlag für eine Waffenruhe lobende Worte. Deutschlands Außenministerin spricht von einem ""Hoffnungsschimmer"". Die Hamas ist zurückhaltend.",https://img.zeit.de/politik/ausland/2024-06/israel-vorschlag-waffenruhe-annalena-baerbock-bild/wide__1300x731,2024-06-01T02:36:10Z,,"Außenministerin Annalena Baerbock (Grüne) hat den israelischen Vorschlag für eine Waffenruhe im Gazastreifen begrüßt. ""Das israelische Angebot, das US-Präsident Biden heute erläutert und bekräftigt h… [+4844 chars]",,de,'Krieg'
https://www.zeit.de/news/2024-06/01/krieg-gegen-die-ukraine-so-ist-die-lage,https://www.zeit.de/news/2024-06/01/krieg-gegen-die-ukraine-so-ist-die-lage,0,www.zeit.de,Russische Invasion: Krieg gegen die Ukraine: So ist die Lage,Hier finden Sie Informationen zu dem Thema „Russische Invasion“. Lesen Sie jetzt „Krieg gegen die Ukraine: So ist die Lage“.,https://img.zeit.de/news/2024-06/01/krieg-gegen-die-ukraine-so-ist-die-lage-image-group/wide__1300x731,2024-06-01T03:21:36Z,,Aufgrund der verheerenden russischen Angriffe auf ukrainische Kraftwerke hat das Land die Stromtarife um mehr als 60 Prozent angehoben. Nato-Generalsekretär Jens Stoltenberg forderte derweil die Nato… [+4475 chars],,de,'Ukraine'
https://www.zeit.de/politik/ausland/2024-06/strack-zimmermann-bundeswehr-reservisten-aktivierung,https://www.zeit.de/politik/ausland/2024-06/strack-zimmermann-bundeswehr-reservisten-aktivierung,0,www.zeit.de,Bundeswehr: Strack-Zimmermann fordert Aktivierung von 900.000 Reservisten,"""Putin trimmt sein Volk auf Krieg"", warnt die Vorsitzende des Verteidigungsausschusses. Aus ihrer Sicht sollte Deutschland Reservisten mobilisieren.",https://img.zeit.de/politik/ausland/2024-06/bundeswehr-soldaten-reservisten-strack-zimmermann/wide__1300x731,2024-06-01T03:43:45Z,,"Die FDP-Verteidigungspolitikerin Marie-Agnes Strack-Zimmermann hat Russland als Bedrohung für die Sicherheit Deutschlands bezeichnet und die Aktivierung von 900.000
Reservisten gefordert. ""Putin tri… [+2424 chars]",,de,'Krieg'
https://www.tagesschau.de/newsticker/liveblog-ukraine-samstag-392.html,https://www.tagesschau.de/newsticker/liveblog-ukraine-samstag-392.html,0,www.tagesschau.de,Ukraine-Liveblog: ++ Ukrainische Stromversorgung angegriffen ++,In der Nacht soll es erneut massive russische Angriffe auf das ukrainische Stromnetz gegeben haben. Südkorea hat Beweise für nordkoreanische Waffenlieferungen an Russland. Die Entwicklungen im Liveblog.,https://images.tagesschau.de/image/66808c04-da56-4498-89e9-b90234cff5c6/AAABj9JPmWo/AAABjwnlFvA/16x9-1280/ukraine-kiew-metro-100.jpg,2024-06-01T05:45:51Z,,"Stand: 01.06.2024 07:45 Uhr
In der Nacht soll es erneut massive russische Angriffe auf das ukrainische Stromnetz gegeben haben. Südkorea hat Beweise für nordkoreanische Waffenlieferungen an Russland… [+1868 chars]",,de,'Ukraine'
https://www.morgenpost.de/politik/article242460814/donald-trump-urteil-news-aktuell-reaktionen-stormy-daniels-ivanka.html,https://www.morgenpost.de/politik/article242460814/donald-trump-urteil-news-aktuell-reaktionen-stormy-daniels-ivanka.html,0,www.morgenpost.de,Trump erhält nach Verurteilung gewaltige Spendensummen,"Nach seiner Verurteilung erhält Trump hohe Spendenzahlungen, sein Team spricht von einer „Welle der Unterstützung“. Die News im Blog.",https://img.sparknews.funkemedien.de/242471190/242471190_1717224166_v16_9_1600.jpeg,2024-06-01T06:40:00Z,,"New York. Nach seiner Verurteilung erhält Trump hohe Spendenzahlungen, sein Team spricht von einer Welle der Unterstützung. Die News im Blog.
<ul><li>Trump erhält fast 53 Millionen Dollar an Spenden… [+13694 chars]",,de,'Kreml'
https://www.faz.net/aktuell/politik/ukraine/russlands-angriffskrieg-land-fuer-frieden-in-der-ukraine-19756344.html,https://www.faz.net/aktuell/politik/ukraine/russlands-angriffskrieg-land-fuer-frieden-in-der-ukraine-19756344.html,0,www.faz.net,Russlands Angriffskrieg: Land für Frieden in der Ukraine?,Die meisten NATO-Länder halten einen schnellen Beitritt der Ukraine zum Bündnis für unrealistisch. Deutschland und Amerika gelten als Bremser. Und kaum jemand rechnet noch mit der Rückeroberung aller Gebiete.,https://media0.faz.net/ppmedia/aktuell/3434227454/1.9756858/facebook_teaser/bis-zur-russischen-invasion.jpg,2024-06-01T06:56:54Z,,"Gespräche der F.A.S. mit Regierungsvertretern aus mehreren NATO-Ländern haben ergeben: Im Bündnis glaubt niemand, dass die Ukraine der NATO demnächst beitreten kann. Und in der Regierung eines osteur… [+8317 chars]",,de,'Saporischschja'
https://www.welt.de/politik/ausland/article251811122/Russischer-Angriffskrieg-Erneuter-Raketenangriff-auf-ukrainisches-Stromnetz.html,https://www.welt.de/politik/ausland/article251811122/Russischer-Angriffskrieg-Erneuter-Raketenangriff-auf-ukrainisches-Stromnetz.html,0,www.welt.de,Erneuter Raketenangriff auf ukrainisches Stromnetz,Wegen Mangels an Stromkapazitäten hat die Ukraine jüngst die Energiepreise erhöhen müssen. Nun hat Russland seine systematische Zerstörung der ukrainischen Energieversorgung mit einem weiteren Angriff fortgesetzt. Bei Treffern auf Wohnhäuser gab es zwölf Verl…,https://img.welt.de/img/politik/ausland/mobile251811270/4881358337-ci16x9-w1200/Ukraine-Krieg-Charkiw.jpg,2024-06-01T07:31:19Z,,"Russland hat die benachbarte Ukraine in der Nacht erneut mit schweren vor allem gegen die Energieversorgung gerichteten Raketen- und Drohnenangriffen überzogen.
Es seien Anlagen in den Gebieten Dnip… [+1347 chars]",,de,'Energie'
https://www.zeit.de/politik/ausland/2024-06/ukraine-krieg-russland-angriff-energieversorgung,https://www.zeit.de/politik/ausland/2024-06/ukraine-krieg-russland-angriff-energieversorgung,0,www.zeit.de,Krieg in der Ukraine: Russland greift erneut Energieversorgung in der Ukraine an,"Mehr als 50 Raketen und 40 Drohnen hat Russland in der Nacht auf die Ukraine abgefeuert. Ziel waren Anlagen der Energieversorgung, aber auch Wohnhäuser wurden getroffen.",https://img.zeit.de/politik/ausland/2024-06/russland-ukraine-angriff-raketen-charkiw-bild/wide__1300x731,2024-06-01T07:32:07Z,,"In der Nacht hat Russland die Ukraine erneut mit Raketen und
Drohnen angegriffen. Ziel waren dabei vor allem die Energieversorgung des
Landes. Auch Wohnhäuser wurden getroffen. Nach Angaben des ukr… [+1964 chars]",,de,'Saporischschja'
https://www.telepolis.de/features/Perspektive-des-Ukraine-Krieges-Was-wir-von-1962-lernen-koennen-9744202.html,https://www.telepolis.de/features/Perspektive-des-Ukraine-Krieges-Was-wir-von-1962-lernen-koennen-9744202.html,0,www.telepolis.de,Perspektive des Ukraine-Krieges: Was wir von 1962 lernen können,Falscheinschätzung des Gegners und Fehlentscheidungen stellen ein enormes Risiko dar. Was der Blick in die Geschichte zeigt. (Teil 2 und Schluss),https://heise.cloudimg.io/bound/1200x1200/q85.png-lossy-85.webp-lossy-85.foil1/_www-heise-de_/imgs/18/4/6/0/3/8/0/9/shutterstock_242291932-0bcd92bf303422d1.jpeg,2024-06-01T08:00:00Z,,"Sowjetfrachter Anesow, begleitet von einem Flugzeug der US-Marine und dem Zerstörer USS Barry. Bild: Everett Collection, Shutterstock.com
Falscheinschätzung des Gegners und Fehlentscheidungen stelle… [+9824 chars]",,de,'Ukraine'
https://www.tagesschau.de/ausland/europa/ukraine-energieversorgung-russland-100.html,https://www.tagesschau.de/ausland/europa/ukraine-energieversorgung-russland-100.html,0,www.tagesschau.de,Russland greift erneut massiv ukrainische Stromversorgung an,Erneut hat Russland die zivile ukrainische Energieinfrastruktur massiv mit Raketen und Drohnen angegriffen. Es gab Schäden an zwei Wärmekraftwerken. Für alle Menschen in der Ukraine haben die Angriffe spürbare Folgen.,https://images.tagesschau.de/image/11b57ef8-f107-4227-a3ab-beb7e7a20fcd/AAABj9LF3tw/AAABjwnlFvA/16x9-1280/kiew-metrostation-100.jpg,2024-06-01T08:35:49Z,,"Stand: 01.06.2024 10:35 Uhr
Erneut hat Russland die zivile ukrainische Energieinfrastruktur massiv mit Raketen und Drohnen angegriffen. Es gab Schäden an zwei Wärmekraftwerken. Für alle Menschen in … [+2689 chars]",,de,'Saporischschja'
https://www.dw.com/de/russland-agenten-status-f%C3%BCr-organisation-von-soldatenfrauen/a-69240771,https://www.dw.com/de/russland-agenten-status-f%C3%BCr-organisation-von-soldatenfrauen/a-69240771,0,www.dw.com,Russland: Agenten-Status für Organisation von Soldatenfrauen,"Nach der Präsidentenwahl engen die Behörden in Russland den Spielraum kritischer Kräfte immer weiter ein. Nun trifft es Aktivistinnen, die sich wochenlang an der Kreml-Mauer versammelt hatten.",https://static.dw.com/image/68360859_6.jpg,2024-06-01T11:03:00Z,,"Russland hat die Frauenorganisation Put Domoi, die sich für eine Rückkehr mobilisierter russischer Soldaten aus der Ukraine einsetzt, als ""ausländischen Agenten"" eingestuft. Zu Begründung erklärte da… [+3013 chars]",,de,'Kreml'
https://www.diepresse.com/18521813/russland-fuehrt-massiven-raketenangriff-gegen-stromnetz-in-der-ukraine-durch,https://www.diepresse.com/18521813/russland-fuehrt-massiven-raketenangriff-gegen-stromnetz-in-der-ukraine-durch,0,www.diepresse.com,Russland führt massiven Raketenangriff gegen Stromnetz in der Ukraine durch,Bei den Angriffen in mehreren Gebieten in der Ukraine werden auch Menschen verletzt. Im RAhmen der systematischen Zerstörung des ukrainischen Energienetzes vernichtete das russische Militär bereits Stromkapazitäten von rund 8.000 Megawatt.,https://img.diepresse.com/public/incoming/olgs6i-imago-images-0492754696/alternates/DPR_SOCIAL_NACHRICHTEN/imago%20images%200492754696,2024-06-01T11:20:56Z,,Bei den Angriffen in mehreren Gebieten in der Ukraine werden auch Menschen verletzt. Im RAhmen der systematischen Zerstörung des ukrainischen Energienetzes vernichtete das russische Militär bereits S… [+1684 chars],,de,'Energie'
https://www.stern.de/news/russland-ueberzieht-ukraine-erneut-mit-angriffswelle-34760556.html,https://www.stern.de/news/russland-ueberzieht-ukraine-erneut-mit-angriffswelle-34760556.html,0,www.stern.de,Russland überzieht Ukraine erneut mit Angriffswelle,Russland hat die Ukraine erneut mit massiven Raketen- und Drohnenangriffen überzogen. Nach Angaben der ukrainischen Luftwaffe zielte die russische Armee in der Nacht auf Samstag mit insgesamt 53 Raketen und 47 Kampfdrohnen vor allem auf Kraftwerke und andere …,https://image.stern.de/34760558/t/Zh/v1/w1440/r1.7778/-/01--von-raketenangriff-zerstoertes-wohnhaus-in-charkiw---d2ec7ef93c13a8e2.jpg,2024-06-01T12:47:47Z,,Russland hat die Ukraine erneut mit massiven Raketen- und Drohnenangriffen überzogen. Nach Angaben der ukrainischen Luftwaffe zielte die russische Armee in der Nacht auf Samstag mit insgesamt 53 Rake… [+4214 chars],,de,'Ukraine'
https://www.n-tv.de/politik/21-51-Wasserkraftwerk-am-Dnipro-in-kritischem-Zustand--article24982885.html,https://www.n-tv.de/politik/21-51-Wasserkraftwerk-am-Dnipro-in-kritischem-Zustand--article24982885.html,0,www.n-tv.de,"Ukraine-Krieg im Liveticker: +++ 21:51 Wasserkraftwerk am Dnipro in ""kritischem Zustand"" +++",Lesen Sie alle aktuellen Entwicklungen und Nachrichten über den russischen Angriffskrieg auf die Ukraine im Liveticker von ntv.de.,https://bilder2.n-tv.de/img/incoming/crop23332537/9041326157-cImg_16_9-w1200/Liveticker1-grau-1-Kopie.jpg,2024-06-01T20:00:00Z,,"Das bei einem russischen Raketenangriff beschädigte Wasserkraftwerk an einem Stausee des Dnipro bei Saporischschja ist nach Behördenangaben in ""kritischem Zustand"". Spezialisten müssten die Sicherhei… [+25905 chars]",,de,'Ukraine'
https://www.n-tv.de/politik/20-56-Generalstab-55-Gefechte-an-der-Front-seit-dem-Morgen--article24984282.html,https://www.n-tv.de/politik/20-56-Generalstab-55-Gefechte-an-der-Front-seit-dem-Morgen--article24984282.html,0,www.n-tv.de,Ukraine-Krieg im Liveticker: +++ 20:56 Generalstab: 55 Gefechte an der Front seit dem Morgen +++,Lesen Sie alle aktuellen Entwicklungen und Nachrichten über den russischen Angriffskrieg auf die Ukraine im Liveticker von ntv.de.,https://bilder2.n-tv.de/img/incoming/crop23332537/9041326157-cImg_16_9-w1200/Liveticker1-grau-1-Kopie.jpg,2024-06-01T23:00:00Z,,"Seit Beginn des Tages ist es nach ukrainischen Angaben zu 55 Gefechten an der Front gekommen. Die meisten Kämpfe gebe es in Richtung Pokrowsk, wie aus dem Lagebericht des Generalstabs der Streitkräft… [+27904 chars]",,de,'Saporischschja'
https://www.n-tv.de/politik/11-14-Luftalarm-ueber-Odessa-Explosion-in-Stadt-am-Schwarzen-Meer--article23143824.html,https://www.n-tv.de/politik/11-14-Luftalarm-ueber-Odessa-Explosion-in-Stadt-am-Schwarzen-Meer--article23143824.html,0,www.n-tv.de,Ukraine-Krieg im Liveticker: +++ 11:14 Luftalarm über Odessa: Explosion in Stadt am Schwarzen Meer +++,Lesen Sie alle aktuellen Entwicklungen und Nachrichten über den russischen Angriffskrieg auf die Ukraine im Liveticker von ntv.de.,https://bilder2.n-tv.de/img/incoming/crop23332537/9041326157-cImg_16_9-w1200/Liveticker1-grau-1-Kopie.jpg,2024-06-01T23:11:00Z,,Die Stadtverwaltung von Odessa meldet über ihren Telegram-Kanal Luftalarm. Demnach habe sich ein Ziel mit hoher Geschwindigkeit auf die ukrainische Millionenstadt am Schwarzen Meer zubewegt. Der Bürg… [+13168 chars],,de,'Ukraine'
https://www.n-tv.de/politik/15-31-Diplomatenkreise-Saudi-Arabien-nimmt-nicht-an-Friedensgipfel-fuer-Ukraine-teil--article23143824.html,https://www.n-tv.de/politik/15-31-Diplomatenkreise-Saudi-Arabien-nimmt-nicht-an-Friedensgipfel-fuer-Ukraine-teil--article23143824.html,0,www.n-tv.de,Ukraine-Krieg im Liveticker: +++ 15:31 Diplomatenkreise: Saudi-Arabien nimmt nicht an Friedensgipfel für Ukraine teil +++,Lesen Sie alle aktuellen Entwicklungen und Nachrichten über den russischen Angriffskrieg auf die Ukraine im Liveticker von ntv.de.,https://bilder2.n-tv.de/img/incoming/crop23332537/9041326157-cImg_16_9-w1200/Liveticker1-grau-1-Kopie.jpg,2024-06-01T23:11:00Z,,Saudi-Arabien will nicht am geplanten Ukraine-Friedensgipfel in der Schweiz teilnehmen. Das erfuhr die Deutsche Presse-Agentur aus Diplomatenkreisen in Riad. Grund für die Entscheidung der Regierung … [+19642 chars],,de,'Saporischschja'
https://www.n-tv.de/politik/16-23-Prag-Russischsprachige-Auslaender-greifen-Freiwillige-an-die-Geld-fuer-Ukraine-sammeln--article23143824.html,https://www.n-tv.de/politik/16-23-Prag-Russischsprachige-Auslaender-greifen-Freiwillige-an-die-Geld-fuer-Ukraine-sammeln--article23143824.html,0,www.n-tv.de,"Ukraine-Krieg im Liveticker: +++ 16:23 Prag: Russischsprachige Ausländer greifen Freiwillige an, die Geld für Ukraine sammeln +++",Lesen Sie alle aktuellen Entwicklungen und Nachrichten über den russischen Angriffskrieg auf die Ukraine im Liveticker von ntv.de.,https://bilder2.n-tv.de/img/incoming/crop23332537/9041326157-cImg_16_9-w1200/Liveticker1-grau-1-Kopie.jpg,2024-06-01T23:11:00Z,,"In der tschechischen Hauptstadt Prag sollen russischsprachige Ausländer Freiwillige angegriffen haben, die im Zentrum in der Nähe des Prager Maidan-Standes Spenden für die Ukraine sammelten. Dies mel… [+21374 chars]",,de,'Saporischschja'
https://www.n-tv.de/politik/13-00-Medienbericht-Zwei-Tote-bei-Brand-in-russischer-Olraffinerie--article23143824.html,https://www.n-tv.de/politik/13-00-Medienbericht-Zwei-Tote-bei-Brand-in-russischer-Olraffinerie--article23143824.html,0,www.n-tv.de,Ukraine-Krieg im Liveticker: +++ 13:00 Medienbericht: Zwei Tote bei Brand in russischer Ölraffinerie +++,Lesen Sie alle aktuellen Entwicklungen und Nachrichten über den russischen Angriffskrieg auf die Ukraine im Liveticker von ntv.de.,https://bilder2.n-tv.de/img/incoming/crop23332537/9041326157-cImg_16_9-w1200/Liveticker1-grau-1-Kopie.jpg,2024-06-01T23:11:00Z,,"In der Lukoil-Ölraffinerie in der russischen Stadt Uchta soll ein Feuer ausgebrochen sein. Das berichten Medien wie NEXTA oder RBC-Ukraine. Demnach soll es erst eine Explosion gegeben haben, bevor da… [+15281 chars]",,de,'Ukraine'
https://www.n-tv.de/politik/09-55-Selenskyj-und-US-Verteidigungsminister-Austin-diskutieren-ueber-Sicherheitsabkommen--article23143824.html,https://www.n-tv.de/politik/09-55-Selenskyj-und-US-Verteidigungsminister-Austin-diskutieren-ueber-Sicherheitsabkommen--article23143824.html,0,www.n-tv.de,Ukraine-Krieg im Liveticker: +++ 09:55 Selenskyj und US-Verteidigungsminister Austin diskutieren über Sicherheitsabkommen +++,Lesen Sie alle aktuellen Entwicklungen und Nachrichten über den russischen Angriffskrieg auf die Ukraine im Liveticker von ntv.de.,https://bilder2.n-tv.de/img/incoming/crop23332537/9041326157-cImg_16_9-w1200/Liveticker1-grau-1-Kopie.jpg,2024-06-01T23:11:00Z,,"Der ukrainische Präsident Wolodymyr Selenskyj und der US-Verteidigungsminister Lloyd Austin haben sich am Rande des asiatischen Sicherheitsgipfels ""Shangri-La-Dialog"" in Singapur zu einem Gespräch ge… [+11782 chars]",,de,'Krieg'
https://www.n-tv.de/politik/03-59-Rumaenien-erwaegt-Patriot-Abgabe-an-Kiew--article23143824.html,https://www.n-tv.de/politik/03-59-Rumaenien-erwaegt-Patriot-Abgabe-an-Kiew--article23143824.html,0,www.n-tv.de,Ukraine-Krieg im Liveticker: +++ 03:59 Rumänien erwägt Patriot-Abgabe an Kiew +++,Lesen Sie alle aktuellen Entwicklungen und Nachrichten über den russischen Angriffskrieg auf die Ukraine im Liveticker von ntv.de.,https://bilder2.n-tv.de/img/incoming/crop23332537/9041326157-cImg_16_9-w1200/Liveticker1-grau-1-Kopie.jpg,2024-06-01T23:11:00Z,,"Rumänien erwägt, die Ukraine mit modernen Patriot-Abwehrsystemen auszustatten, um russischen Angriffen entgegenzuwirken. Das berichtet der ""Kyiv Independent"". Präsident Klaus Iohannis stellt jedoch k… [+5116 chars]",,de,'Saporischschja'
https://www.n-tv.de/politik/17-51-Russisches-Militaer-greift-mehrere-Orte-in-der-Oblast-Charkiw-an-Frau-verletzt--article23143824.html,https://www.n-tv.de/politik/17-51-Russisches-Militaer-greift-mehrere-Orte-in-der-Oblast-Charkiw-an-Frau-verletzt--article23143824.html,0,www.n-tv.de,Ukraine-Krieg im Liveticker: +++ 17:33 Störte Russland das GPS-Signal? Finnair nimmt Flüge nach Tartu wieder auf +++,Lesen Sie alle aktuellen Entwicklungen und Nachrichten über den russischen Angriffskrieg auf die Ukraine im Liveticker von ntv.de.,https://bilder2.n-tv.de/img/incoming/crop23332537/9041326157-cImg_16_9-w1200/Liveticker1-grau-1-Kopie.jpg,2024-06-01T23:11:00Z,,"Die russische Armee hat das Dorf Borivska Andriivka und die Stadt Isjum in der Oblast Charkiw mit Raketen und Luftlenkbomben angegriffen. Wie die Regionalstaatsanwaltschaft bei Facebook schreibt, sei… [+24660 chars]",,de,'Saporischschja'
https://www.n-tv.de/politik/19-26-Ukrainische-Elitesoldaten-zerstoeren-russisches-Munitionsdepot-bei-Charkiw--article23143824.html,https://www.n-tv.de/politik/19-26-Ukrainische-Elitesoldaten-zerstoeren-russisches-Munitionsdepot-bei-Charkiw--article23143824.html,0,www.n-tv.de,Ukraine-Krieg im Liveticker: +++ 19:26 Ukrainische Elitesoldaten zerstören russisches Munitionsdepot bei Charkiw +++,Lesen Sie alle aktuellen Entwicklungen und Nachrichten über den russischen Angriffskrieg auf die Ukraine im Liveticker von ntv.de.,https://bilder2.n-tv.de/img/incoming/crop23332537/9041326157-cImg_16_9-w1200/Liveticker1-grau-1-Kopie.jpg,2024-06-01T23:11:00Z,,"Soldaten der Spezialeinheit ""Omega"" der Nationalgarde der Ukraine hätten bei Charkiw ein Munitionsdepot der russischen Truppen zerstört. Das meldet Ukrinform unter Berufung auf die Gruppe. Die Soldat… [+27182 chars]",,de,'Ukraine'
https://www.n-tv.de/politik/11-50-Berater-Drastische-Steigerung-bei-russischen-Kriegsverbrechen--article23143824.html,https://www.n-tv.de/politik/11-50-Berater-Drastische-Steigerung-bei-russischen-Kriegsverbrechen--article23143824.html,0,www.n-tv.de,Ukraine-Krieg im Liveticker: +++ 11:50 Berater: Drastische Steigerung bei russischen Kriegsverbrechen +++,Lesen Sie alle aktuellen Entwicklungen und Nachrichten über den russischen Angriffskrieg auf die Ukraine im Liveticker von ntv.de.,https://bilder2.n-tv.de/img/incoming/crop23332537/9041326157-cImg_16_9-w1200/Liveticker1-grau-1-Kopie.jpg,2024-06-01T23:11:00Z,,"Die Zahl der mutmaßlichen russischen Kriegsverbrechen in der Ukraine hat laut einem Experten drastisch zugenommen. Derzeit seien etwa 133.000 Ermittlungsverfahren registriert. Das sei eine ""enorme St… [+14123 chars]",,de,'Ukraine'
https://www.n-tv.de/politik/12-27-Friedensgipfel-Selenskyj-wirft-China-Stoerversuche-vor--article23143824.html,https://www.n-tv.de/politik/12-27-Friedensgipfel-Selenskyj-wirft-China-Stoerversuche-vor--article23143824.html,0,www.n-tv.de,Ukraine-Krieg im Liveticker: +++ 12:27 Friedensgipfel: Selenskyj wirft China Störversuche vor +++,Lesen Sie alle aktuellen Entwicklungen und Nachrichten über den russischen Angriffskrieg auf die Ukraine im Liveticker von ntv.de.,https://bilder2.n-tv.de/img/incoming/crop23332537/9041326157-cImg_16_9-w1200/Liveticker1-grau-1-Kopie.jpg,2024-06-01T23:11:00Z,,"Der ukrainische Präsident Wolodymyr Selenskyj hat China Störversuche vor dem in der Schweiz geplanten Friedensgipfel vorgeworfen. China arbeite daran, ""dass Staaten nicht an dem Friedensgipfel teilne… [+14724 chars]",,de,'Ukraine'
https://www.n-tv.de/politik/18-14-Saerge-mit-Aufschrift-Franzoesische-Soldaten-in-der-Ukraine-am-Eiffelturm-abgestellt-drei-Festnahmen--article23143824.html,https://www.n-tv.de/politik/18-14-Saerge-mit-Aufschrift-Franzoesische-Soldaten-in-der-Ukraine-am-Eiffelturm-abgestellt-drei-Festnahmen--article23143824.html,0,www.n-tv.de,"Ukraine-Krieg im Liveticker: +++ 18:14 Särge mit Aufschrift ""Französische Soldaten in der Ukraine"" am Eiffelturm abgestellt - drei Festnahmen +++",Lesen Sie alle aktuellen Entwicklungen und Nachrichten über den russischen Angriffskrieg auf die Ukraine im Liveticker von ntv.de.,https://bilder2.n-tv.de/img/incoming/crop23332537/9041326157-cImg_16_9-w1200/Liveticker1-grau-1-Kopie.jpg,2024-06-01T23:11:00Z,,Frankreichs Präsident Emmanuel Macron hatte zuletzt wiederholt die Möglichkeit einer Entsendung westlicher Truppen in die Ukraine ins Spiel gebracht. Auf diese Aussage dürfte sich eine Protestaktion … [+25847 chars],,de,'Ukraine'
https://www.n-tv.de/politik/16-04-Kiew-Mehr-als-1000-russische-Soldaten-innerhalb-eines-Tages-eliminiert--article23143824.html,https://www.n-tv.de/politik/16-04-Kiew-Mehr-als-1000-russische-Soldaten-innerhalb-eines-Tages-eliminiert--article23143824.html,0,www.n-tv.de,"Ukraine-Krieg im Liveticker: +++ 16:04 Kiew: Mehr als 1000 russische Soldaten innerhalb eines Tages ""eliminiert"" +++",Lesen Sie alle aktuellen Entwicklungen und Nachrichten über den russischen Angriffskrieg auf die Ukraine im Liveticker von ntv.de.,https://bilder2.n-tv.de/img/incoming/crop23332537/9041326157-cImg_16_9-w1200/Liveticker1-grau-1-Kopie.jpg,2024-06-01T23:11:00Z,,Die personellen Verluste auf russischer Seite bleiben laut offiziellen Zahlen aus Kiew hoch: Binnen eines Tages sind demnach 1080 russische Soldaten im Krieg ums Leben gekommen oder können nicht mehr… [+20609 chars],,de,'Ukraine'
