index,url,valid,domain,title,description,image,published,archive,content,quote,language,keyword
https://www.stern.de/politik/deutschland/sozialreform--buergergeld-tritt-mit-dem-jahreswechsel-in-kraft-33058032.html,https://www.stern.de/politik/deutschland/sozialreform--buergergeld-tritt-mit-dem-jahreswechsel-in-kraft-33058032.html,0,www.stern.de,Sozialreform: Bürgergeld tritt mit dem Jahreswechsel in Kraft,Das neue Bürgergeld ist nach langer Diskussion endlich da und tritt ab heute in Kraft. Veränderungen zum vorigen Hartz-IV-Modell gibt es einige.,https://image.stern.de/33058034/t/q9/v1/w1440/r1.7778/-/01--urnnewsmldpacom200901012301019968279v3w800h600l638t434r1916b1302jpeg---08c2d0498726217e.jpg,2023-01-01T05:49:00Z,,"Das neue Bürgergeld ist nach langer Diskussion endlich da und tritt ab heute in Kraft. Veränderungen zum vorigen Hartz-IV-Modell gibt es einige.
Am Neujahrstag tritt das neue Bürgergeld in Kraft. Di… [+1567 chars]",,de,'Bürgergeld'
https://www.morgenpost.de/wirtschaft/article237264025/Importstopp-fuer-Rohoel-aus-Russland-in-Kraft.html,https://www.morgenpost.de/wirtschaft/article237264025/Importstopp-fuer-Rohoel-aus-Russland-in-Kraft.html,0,www.morgenpost.de,Öl-Embargo: Importstopp für Rohöl aus Russland in Kraft,"Erst kein Öl mehr per Tanker, jetzt auch nicht mehr per Pipeline: Deutschland importiert den Energieträger nicht mehr aus Russland. Die Regierung versucht, Zuversicht zu stiften.",https://img.morgenpost.de/img/wirtschaft/crop237264023/7662609367-w820-cv16_9-q85/OEl-Embargo-gegen-Russland.jpg,2023-01-01T05:58:23Z,,Berlin. Deutschland hat zum Jahreswechsel alle Importe von Rohöl aus Russland gestoppt. Hintergrund ist der russische Angriffskrieg gegen die Ukraine. Seit 5. Dezember galt bereits ein EU-Einfuhrverb… [+2851 chars],,de,'Import'
https://www.n-tv.de/wirtschaft/Importstopp-fuer-Rohoel-aus-Russland-tritt-in-Kraft-article23815482.html,https://www.n-tv.de/wirtschaft/Importstopp-fuer-Rohoel-aus-Russland-tritt-in-Kraft-article23815482.html,0,www.n-tv.de,"""Abhängigkeiten aufgelöst"": Importstopp für Rohöl aus Russland tritt in Kraft",Jahrzehntelang importiert Deutschland Rohöl aus Russland. Doch jetzt ist damit Schluss.  Nach russischen Tankern ist nun auch die Pipeline Druschba blockiert. Für die ostdeutschen Raffinerien bedeutet das eine enorme Umstellung.,https://bilder1.n-tv.de/img/incoming/crop23815488/806132936-cImg_16_9-w1200/acbd17fef5c22e10747ba5f204c5f75a.jpg,2023-01-01T07:11:18Z,,Jahrzehntelang importiert Deutschland Rohöl aus Russland. Doch jetzt ist damit Schluss. Nach russischen Tankern ist nun auch die Pipeline Druschba blockiert. Für die ostdeutschen Raffinerien bedeutet… [+3002 chars],,de,'Pipeline'
https://www.handelsblatt.com/politik/international/ukraine-die-lage-am-morgen-selenski-wendet-sich-an-das-russische-volk-putin-verbrennt-euer-land-und-eure-zukunft/28144208.html,https://www.handelsblatt.com/politik/international/ukraine-die-lage-am-morgen-selenski-wendet-sich-an-das-russische-volk-putin-verbrennt-euer-land-und-eure-zukunft/28144208.html,0,www.handelsblatt.com,Ukraine – Die Lage am Morgen: Selenski wendet sich an das russische Volk: Putin „verbrennt euer Land und eure Zukunft“,Allen russischen Raketen zum Trotz haben die Ukrainer das neue Jahr bei Licht empfangen. Russland schickt in der Neujahrsnacht Kamikaze-Drohnen. Die aktuellen Entwicklungen.,https://www.handelsblatt.com/images/wolodimir-selenski-archivbild/28898922/2-format2003.jpg,2023-01-01T07:54:30Z,,"Wolodimir Selenski (Archivbild)Er (der Krieg) ist für eine Person, die bis an ihr Lebensende an der Macht bleibt, sagte der ukrainische Präsident in Anspielung auf Kremlchef Wladimir Putin.
(Foto: d… [+6535 chars]",,de,'Pipeline'
https://www.stern.de/news/lindner-rechnet-mit-dauerhaft-hohen-energiepreisen-33058162.html,https://www.stern.de/news/lindner-rechnet-mit-dauerhaft-hohen-energiepreisen-33058162.html,0,www.stern.de,Lindner rechnet mit dauerhaft hohen Energiepreisen,"Bundesfinanzminister Christian Lindner (FDP) rechnet mit dauerhaft hohen Energiepreisen. ""Es wird ein neues Normal sein. Gas über die Flüssiggasterminals ist schon aus logistischen Gründen teurer als das russische Pipeline-Gas"", sagte Lindner der ""Bild am Son…",https://image.stern.de/33058164/t/uh/v1/w1440/r1.7778/-/01--euromuenzen---1d5187b5a415c055.jpg,2023-01-01T08:43:58Z,,"Bundesfinanzminister Christian Lindner (FDP) rechnet mit dauerhaft hohen Energiepreisen. ""Es wird ein neues Normal sein. Gas über die Flüssiggasterminals ist schon aus logistischen Gründen teurer als… [+1359 chars]",,de,'Energie'
https://www.stern.de/gesellschaft/regional/berlin-brandenburg/energie--ostbeauftragter-sieht-oel-importstopp-als-chance-33057964.html,https://www.stern.de/gesellschaft/regional/berlin-brandenburg/energie--ostbeauftragter-sieht-oel-importstopp-als-chance-33057964.html,0,www.stern.de,Energie: Ostbeauftragter sieht Öl-Importstopp als Chance,Der Ostbeauftragte Carsten Schneider sieht den ab 1. Januar geltenden Importstopp für russisches Pipeline-Öl als Chance für Ostdeutschland. Für den Wandel der betroffenen Standorte gebe es zusätzliche öffentliche Investitionen von mehr als einer Milliarde Eur…,https://image.stern.de/33057966/t/r-/v2/w1440/r1.7778/-/01--urnnewsmldpacom200901012212319964807v3w800h600l640t437r1920b1314jpeg---4f90208848198b95.jpg,2023-01-01T09:43:07Z,,Der Ostbeauftragte Carsten Schneider sieht den ab 1. Januar geltenden Importstopp für russisches Pipeline-Öl als Chance für Ostdeutschland. Für den Wandel der betroffenen Standorte gebe es zusätzlich… [+1679 chars],,de,'Import'
https://www.stern.de/gesellschaft/regional/berlin-brandenburg/energie--importstopp-fuer-rohoel-aus-russland-in-kraft-33057964.html,https://www.stern.de/gesellschaft/regional/berlin-brandenburg/energie--importstopp-fuer-rohoel-aus-russland-in-kraft-33057964.html,0,www.stern.de,Energie: Importstopp für Rohöl aus Russland in Kraft,"Erst kein Öl mehr per Tanker, jetzt auch nicht mehr per Pipeline: Deutschland importiert den Energieträger nicht mehr aus Russland. Die Regierung versucht, Zuversicht zu stiften.",https://image.stern.de/33057966/t/dZ/v3/w1440/r1.7778/-/01--urnnewsmldpacom200901012212319964807v3w800h600l640t437r1920b1314jpeg---4f90208848198b95.jpg,2023-01-01T09:55:10Z,,"Erst kein Öl mehr per Tanker, jetzt auch nicht mehr per Pipeline: Deutschland importiert den Energieträger nicht mehr aus Russland. Die Regierung versucht, Zuversicht zu stiften.
Deutschland hat zum… [+2962 chars]",,de,'Pipeline'
https://www.welt.de/politik/deutschland/article242973895/Lindner-rechnet-mit-dauerhaft-hohen-Energiepreisen.html,https://www.welt.de/politik/deutschland/article242973895/Lindner-rechnet-mit-dauerhaft-hohen-Energiepreisen.html,0,www.welt.de,Lindner rechnet mit dauerhaft hohen Energiepreisen,"Für dieses und das nächste Jahr erwartet Finanzminister Christian Lindner (FDP) rückläufige Inflationsraten. Die Energiepreise würden aber nicht sinken: „Das Preisniveau bleibt höher, aber ohne ruinöse Spitzen.“",https://img.welt.de/img/politik/deutschland/mobile242974265/4831351927-ci16x9-w1200/Pressekonferenz-nach-Sitzung-des-Stabilitaetsrates.jpg,2023-01-01T09:58:53Z,,Bundesfinanzminister Christian Lindner (FDP) rechnet mit dauerhaft hohen Energiepreisen. Es wird ein neues Normal sein. Gas über die Flüssiggasterminals ist schon aus logistischen Gründen teurer als … [+2151 chars],,de,'Pipeline'
https://www.faz.net/aktuell/wirtschaft/lindner-ueber-hohe-energiepreise-es-wird-ein-neues-normal-sein-18571402.html,https://www.faz.net/aktuell/wirtschaft/lindner-ueber-hohe-energiepreise-es-wird-ein-neues-normal-sein-18571402.html,0,www.faz.net,Lindner über hohe Energiepreise: „Es wird ein neues Normal sein“,"Die Energiepreise dürften nach Ansicht von Finanzminister Lindner weiterhin hoch bleiben. „Ruinöse Spitzen“ sollten aber ausbleiben, sagt der FDP-Politiker – und fordert abermals Fracking in Deutschland.",https://media0.faz.net/ppmedia/aktuell/politik/3887642562/1.8562468/facebook_teaser/christian-lindner-anfang.jpg,2023-01-01T10:08:41Z,,Bundesfinanzminister Christian Lindner erwartet dauerhaft hohe Energiepreise. Es wird ein neues Normal sein. Gas über die Flüssiggasterminals ist schon aus logistischen Gründen teurer als das russisc… [+1088 chars],,de,'Energie'
https://www.t-online.de/finanzen/unternehmen-verbraucher/id_100104566/oel-embargo-deutschland-stoppt-alle-rohoel-importe-aus-russland.html,https://www.t-online.de/finanzen/unternehmen-verbraucher/id_100104566/oel-embargo-deutschland-stoppt-alle-rohoel-importe-aus-russland.html,0,www.t-online.de,Öl-Embargo: Deutschland stoppt alle Rohöl-Importe aus Russland - t-online,"<ol><li>Öl-Embargo: Deutschland stoppt alle Rohöl-Importe aus Russland  t-online
</li><li>PUTINS KRIEG: Ab sofort stoppt Deutschland alle Importe von Rohöl aus Russland  WELT Nachrichtensender
</li><li>""Abhängigkeiten aufgelöst"": Importstopp für Rohöl aus R…",https://images.t-online.de/2023/01/smpuVpA96Ohy/0x205:2735x1538/fit-in/1800x0/image.jpg,2023-01-01T11:54:16Z,,"Ab Januar will Deutschland mit einem Importverbot für Öl gegen Russland vorgehen. Diese Konsequenzen haben die Sanktionen für die Energieversorgung.
Deutschland hat zum Jahreswechsel alle Importe vo… [+3410 chars]",,de,'Pipeline'
https://www.wiwo.de/politik/deutschland/oel-embargo-importstopp-fuer-rohoel-aus-russland-in-kraft/28898906.html,https://www.wiwo.de/politik/deutschland/oel-embargo-importstopp-fuer-rohoel-aus-russland-in-kraft/28898906.html,0,www.wiwo.de,Öl-Embargo: Importstopp für Rohöl aus Russland in Kraft,"Erst kein Öl mehr per Tanker, jetzt auch nicht mehr per Pipeline: Deutschland importiert den Energieträger nicht mehr aus Russland. Die Regierung versucht, Zuversicht zu verbreiten.",https://www.wiwo.de/images/oel-embargo-gegen-russland/28898904/1-format11240.jpg,2023-01-01T12:44:53Z,https://web.archive.org/web/20230101173204/https://www.wiwo.de/politik/deutschland/oel-embargo-importstopp-fuer-rohoel-aus-russland-in-kraft/28898906.html,Deutschland hat zum Jahreswechsel alle Importe von Rohöl aus Russland gestoppt. Hintergrund ist der russische Angriffskrieg gegen die Ukraine. Seit 5. Dezember galt bereits ein EU-Embargo gegen russi… [+3401 chars],,de,'Energie'
https://www.tagesspiegel.de/politik/trotz-der-ablehnung-des-kanzlers-lindner-fordert-aufhebung-des-fracking-verbots-9111235.html,https://www.tagesspiegel.de/politik/trotz-der-ablehnung-des-kanzlers-lindner-fordert-aufhebung-des-fracking-verbots-9111235.html,0,www.tagesspiegel.de,Trotz der Ablehnung des Kanzlers: Lindner fordert Aufhebung des Fracking-Verbots,"Die Gasversorgung in Deutschland bleibt angespannt. Finanzminister Lindner nimmt das zum Anlass, um die FDP-Forderung zur Schiefergas-Förderung zu erneuern.",https://www.tagesspiegel.de/images/pressekonferenz-nach-sitzung-des-stabilitatsrates/alternates/BASE_16_9_W1400/pressekonferenz-nach-sitzung-des-stabilitaetsrates.jpeg,2023-01-01T13:45:24Z,,"Erst veröffentlichte Finanzminister Christian Lindner (FDP) ein Papier, in dem er eine Zeitenwende in der Wirtschaftspolitik mit niedrigeren Steuern und weniger Regulierung forderte. Nun hat er die h… [+5437 chars]",,de,'Gas'
https://www.stern.de/gesellschaft/regional/berlin-brandenburg/energie--importstopp--deutschland-verzichtet-auf-rohoel-aus-russland-33057964.html,https://www.stern.de/gesellschaft/regional/berlin-brandenburg/energie--importstopp--deutschland-verzichtet-auf-rohoel-aus-russland-33057964.html,0,www.stern.de,Energie: Importstopp: Deutschland verzichtet auf Rohöl aus Russland,"Erst kein Öl mehr per Tanker, jetzt auch nicht mehr per Pipeline: Deutschland importiert wegen des Ukrainekriegs den Energieträger nicht mehr aus Russland. Der Bund versucht, Zuversicht zu stiften.",https://image.stern.de/33057966/t/vO/v4/w1440/r1.7778/-/01--urnnewsmldpacom200901012212319964807v3w800h600l640t437r1920b1314jpeg---4f90208848198b95.jpg,2023-01-01T13:54:10Z,,"Erst kein Öl mehr per Tanker, jetzt auch nicht mehr per Pipeline: Deutschland importiert wegen des Ukrainekriegs den Energieträger nicht mehr aus Russland. Der Bund versucht, Zuversicht zu stiften.
… [+3866 chars]",,de,'Pipeline'
https://www.focus.de/politik/ausland/das-ukraine-update-am-morgen-ukraine-schiesst-in-silvesternacht-russische-kamikaze-drohnen-ab_id_181875245.html,https://www.focus.de/politik/ausland/das-ukraine-update-am-morgen-ukraine-schiesst-in-silvesternacht-russische-kamikaze-drohnen-ab_id_181875245.html,0,www.focus.de,Das Ukraine-Update am Morgen - Ukraine schießt in Silvesternacht russische Kamikaze-Drohnen ab,"Kurz vor Neujahr tauschen Russland und die Ukraine erneut Gefangene aus. Während die Ukraine Luhansk beschießt, feuern Putins Truppen Raketen auf verschiedene Städte ab. Der russische Präsident wirft dem Westen erneut Lügen vor. Das Ukraine-Update am Abend.",https://p6.focus.de/img/politik/ausland/id_181574815/ukrainische-soldaten-feuern-in-bachmut-eine-haubitze-auf-russische-stellungen..jpg?im=Crop%3D%280%2C277%2C2048%2C1024%29%3BResize%3D%281200%2C627%29&hash=d41ce38e07f619c12466c7dde614364f6ce2b68950c830c01be51a320e087eb3,2023-01-01T14:33:46Z,,Allen russischen Raketen zum Trotz haben die Ukrainer das neue Jahr bei Licht empfangen. Präsident Selenskyj veranlasst das zu einer Silvesterbotschaft mit Ironie. Russland schickt in der Neujahrsnac… [+19077 chars],,de,'Pipeline'
https://www.wiwo.de/my/politik/europa/anschlag-auf-ostsee-pipeline-erst-bombardieren-dann-reparieren/28898404.html,https://www.wiwo.de/my/politik/europa/anschlag-auf-ostsee-pipeline-erst-bombardieren-dann-reparieren/28898404.html,0,www.wiwo.de,"Anschlag auf Ostsee-Pipeline: Erst bombardieren, dann reparieren?","Bislang wurde Russland als Drahtzieher der Sabotage vermutet. Aber es gibt neue Zweifel, denn Gazprom plant Nord Stream 1 zu reparieren. Schweden will die Ermittlungen geheim halten und sorgt für weitere Spekulationen.",https://www.wiwo.de/images/100-pro-imago-life-2/28898438/2-format11240.jpg,2023-01-01T15:22:30Z,http://archive.md/20230101164238/https://www.wiwo.de/my/politik/europa/anschlag-auf-ostsee-pipeline-erst-bombardieren-dann-reparieren/28898404.html,Für Nachrichtenseiten wie WirtschaftsWoche Online sind Anzeigen eine wichtige Einnahmequelle. Mit den Werbeerlösen können wir die Arbeit unserer Redaktion bezahlen und Qualitätsartikel kostenfrei ver… [+173 chars],,de,'Pipeline'
https://www.jungewelt.de/artikel/441892.erdölembargo-moskau-rettet-schwedt.html,https://www.jungewelt.de/artikel/441892.erdölembargo-moskau-rettet-schwedt.html,0,www.jungewelt.de,Erdölembargo: Moskau rettet Schwedt,Russische Regierung gestattet Durchleitung kasachischen Erdöls durch »Druschba«-Pipeline. Berlin will Ausstieg aus ostdeutscher Braunkohle vorziehen • Foto: IMAGO/PEMAX,https://www.jungewelt.de/img/1100/175693.jpg,2023-01-01T18:40:47Z,,Die Bundesrepublik hat zum Jahreswechsel alle Importe von russischem Rohöl gestoppt. Das Embargo ist eine weitere Stufe im EU-Wirtschaftskrieg gegen Russland. Es war am 5. Dezember 2022 in Kraft getr… [+3169 chars],,de,'Pipeline'
https://www.merkur.de/verbraucher/kindergeld-2023-aenderungen-buergergeld-rente-buerger-verbraucher-neu-uebersicht-aktuell-91996318.html,https://www.merkur.de/verbraucher/kindergeld-2023-aenderungen-buergergeld-rente-buerger-verbraucher-neu-uebersicht-aktuell-91996318.html,0,www.merkur.de,"Rente, Bürgergeld, Kindergeld: Was ist neu bei den Änderungen ab Januar 2023 - Merkur.de","<ol><li>Rente, Bürgergeld, Kindergeld: Was ist neu bei den Änderungen ab Januar 2023  Merkur.de
</li><li>BÜRGERGELD, RENTE, KINDERGELD: Neues Jahr! Das ändert sich 2023  WELT Nachrichtensender
</li><li>Ab heute: Rente, Steuern, Energie – Das ändert sich ab …",https://www.merkur.de/bilder/2022/12/26/91996318/30549713-geld-aenderungen-2023-28fe.jpg,2023-01-01T18:46:59Z,,"<ol><li>Startseite</li><li>Verbraucher</li></ol>Erstellt: 01.01.2023, 13:42 Uhr
Von: Maximilian Kettenbach
KommentareTeilen
2023 gibt es einige finanzielle Änderungen. Entlastungen für Privathaush… [+8605 chars]",,de,'Bürgergeld'
https://www.faz.net/aktuell/politik/inland/kirchen-in-der-energiekrise-einmal-heizen-kostet-180-euro-18569199.html,https://www.faz.net/aktuell/politik/inland/kirchen-in-der-energiekrise-einmal-heizen-kostet-180-euro-18569199.html,0,www.faz.net,Kirchen in der Energiekrise: Einmal Heizen kostet 180 Euro,Das Heizen alter Kirchenräume ist teuer geworden – und auf unglückliche Weise mit der allgemeinen Kirchenkrise verbunden.,https://media0.faz.net/ppmedia/aktuell/1623980120/1.8569190/facebook_teaser/innenraum-der-immanuelkirche.jpg,2023-01-01T19:03:54Z,https://web.archive.org/web/20230102003511/https://www.faz.net/aktuell/politik/inland/kirchen-in-der-energiekrise-einmal-heizen-kostet-180-euro-18569199.html,"Am Abend dreht Hagen Günter seit einiger Zeit eine Runde durch die Gebäude seiner Kirchengemeinde in Alt-Laatzen in der Region Hannover. Der Pastor fahndet nach Heizkörpern, die noch nicht tief genug… [+3697 chars]",,de,'Energie'
https://www.sueddeutsche.de/muenchen/ebersberg/landkreis-ebersberg-buergergeld-hartz-iv-jobcenter-benedikt-hoigt-1.5724926,https://www.sueddeutsche.de/muenchen/ebersberg/landkreis-ebersberg-buergergeld-hartz-iv-jobcenter-benedikt-hoigt-1.5724926,0,www.sueddeutsche.de,Neues Bürgergeld: Verbesserungen auch fürs Amt,Zum Januar startet die größte sozialpolitische Reform seit zwei Jahrzehnten. Im Jobcenter Ebersberg ist man froh darüber.,https://www.sueddeutsche.de/image/sz.1.4692211/1200x675?v=1672569753,2023-01-01T20:49:34Z,,Zum Januar startet die größte sozialpolitische Reform seit zwei Jahrzehnten. Im Jobcenter Ebersberg ist man froh darüber.Behörden sagt man gelegentlich ja eine gewisse Abneigung gegen Neuerungen und … [+4994 chars],,de,'Bürgergeld'
https://www.focus.de/finanzen/news/arbeitslosengeld/focus-online-rechnet-8-szenarien-vor-buergergeld-analyse-zeigt-ob-sich-arbeiten-in-deutschland-noch-lohnt_id_147801738.html,https://www.focus.de/finanzen/news/arbeitslosengeld/focus-online-rechnet-8-szenarien-vor-buergergeld-analyse-zeigt-ob-sich-arbeiten-in-deutschland-noch-lohnt_id_147801738.html,0,www.focus.de,"FOCUS online rechnet 8 Szenarien vor - Die Bürgergeld-Analyse zeigt, ob sich Arbeiten in Deutschland noch lohnt","Die Ampel ersetzt Hartz IV ab 2023 durch das Bürgergeld. Mit viel höheren Regelsätzen. Kritiker bemängeln, dass sich damit Arbeiten nicht mehr lohne. FOCUS online hat deshalb nachgerechnet - schauen Sie sich unsere Beispiele an und teilen Sie uns Ihre eigenen…",https://p6.focus.de/img/fotos/id_147741269/buergergeld.png?im=Crop%3D%2872%2C0%2C830%2C415%29%3BResize%3D%281200%2C627%29&impolicy=perceptual&quality=medium&hash=860c578950ff9f6009444fde12b4b8e14caa2b0a497e5efac639c7003a039c5c,2023-01-02T09:07:44Z,,"Die Bundesregierung ersetzt Hartz IV durch das Bürgergeld und hebt die Regelsätze kräftig an. Kritiker bemängeln, dass sich damit Arbeiten nicht mehr lohne. FOCUS online hat deshalb nachgerechnet - s… [+9413 chars]",,de,'Bürgergeld'
https://www.focus.de/finanzen/news/einfach-erklaert-strom-so-teuer-wie-nie-so-laeuft-das-jetzt-mit-der-strompreisbremse-ab_id_181945399.html,https://www.focus.de/finanzen/news/einfach-erklaert-strom-so-teuer-wie-nie-so-laeuft-das-jetzt-mit-der-strompreisbremse-ab_id_181945399.html,0,www.focus.de,Einfach erklärt - Strom so teuer wie nie! So läuft das jetzt mit der Strompreisbremse ab,"Hunderte Energieversorger haben die Preise beim Strom angehoben. Die Strompreisbremse soll entlasten, kommt aber erst in wenigen Wochen. FOCUS online sagt, was Sie im Januar für Strom bezahlen müssen und zeigt mit Beispielen, wie viel Geld Sie sparen können.",https://p6.focus.de/img/regional/baden-wuerttemberg/id_38592771/ein-drehstromzaehler-aufgenommen-in-einem-haushalt..jpg?im=Crop%3D%280%2C219%2C2048%2C1024%29%3BResize%3D%281200%2C627%29&impolicy=perceptual&quality=medium&hash=bf36fef9c9d04f2058f5c0cbf16aa0349a568432b7b174ab9d325556a101e003,2023-01-02T09:46:41Z,,"Hunderte Energieversorger haben die Preise beim Strom angehoben. Die Strompreisbremse soll entlasten, kommt aber erst in wenigen Wochen. FOCUS online sagt, was Sie im Januar für Strom bezahlen müssen… [+9715 chars]",,de,'Energie'
https://www.wiwo.de/erfolg/management/aenderungen-in-2023-buergergeld-rentenerhoehung-49-euro-ticket-das-bringt-das-neue-jahr/28879962.html,https://www.wiwo.de/erfolg/management/aenderungen-in-2023-buergergeld-rentenerhoehung-49-euro-ticket-das-bringt-das-neue-jahr/28879962.html,0,www.wiwo.de,"Änderungen in 2023: Bürgergeld, Rentenerhöhung, 49-Euro-Ticket: Das bringt das neue Jahr","In ihrem ersten Jahr hat die Ampel-Koalition einige Reformen auf den Weg gebracht, die 2023 greifen. Was wird teurer, was wird billiger, und was ändert sich komplett?",https://www.wiwo.de/images/imago0194279798h/28891060/2-format11240.jpg,2023-01-03T11:24:23Z,,Für Nachrichtenseiten wie WirtschaftsWoche Online sind Anzeigen eine wichtige Einnahmequelle. Mit den Werbeerlösen können wir die Arbeit unserer Redaktion bezahlen und Qualitätsartikel kostenfrei ver… [+173 chars],,de,'Bürgergeld'
