index,url,valid,domain,title,description,image,published,archive,content,quote,language,keyword
https://www.n-tv.de/politik/Iran-richtet-18-Jaehrigen-hin-id30680335.html,https://www.n-tv.de/politik/Iran-richtet-18-Jaehrigen-hin-id30680335.html,0,www.n-tv.de,"""Nationale Sicherheit gefährdet"": Iran richtet 18-Jährigen hin","Das iranische Regime bezeichnet die Proteste der Iranerinnen und Iraner zu Jahresbeginn als ""Terrorakt"" im Auftrags Israels und der USA. Zahlreiche Demonstranten werden verurteilt - einige auch zum Tode. Das Urteil gegen einen Teenager wird nun vollstreckt. E…",https://www.n-tv.de/img/30677302/1775132302/Img_16_9/1200/Im-Iran-ist-ein-weiteres-Todesurteil-im-Zusammenhang-mit-den-juengsten-Massenprotesten-vollstreckt-worden.jpg,2026-04-03T11:10:49Z,,"Die Massenproteste im Iran wurden vom Regime brutal niedergeschlagen. Tausende Menschen wurden getötet. (Foto: Uncredited/UGC/AP/dpa)
Das iranische Regime bezeichnet die Proteste der Iranerinnen und… [+3512 chars]",,de,'Sicherheit'
https://www.welt.de/politik/ausland/article69cf05f2cdf80d124bb0cc45/krieg-in-nahost-erster-europaeischer-frachter-passiert-ueber-neue-route-strasse-von-hormus-liveticker.html,https://www.welt.de/politik/ausland/article69cf05f2cdf80d124bb0cc45/krieg-in-nahost-erster-europaeischer-frachter-passiert-ueber-neue-route-strasse-von-hormus-liveticker.html,0,www.welt.de,Erster europäischer Frachter passiert über neue Route Straße von Hormus,Ein französischer Konzern hat ein Containerschiff durch die Straße von Hormus fahren lassen. Dutzende Staaten erhöhen derweil den Druck auf den Iran: Die strategisch zentrale Meerenge solle „sofort und bedingungslos“ geöffnet werden. Mehr im Liveticker.,https://images.welt.de/69cf05f2cdf80d124bb0cc45/aa03f740930fdaf45b09442b8567c832/ci16x9-w1200/dpa-com-20090101-260403-935-1258559-jpg,2026-04-03T13:02:00Z,,Ein französischer Konzern hat ein Containerschiff durch die Straße von Hormus fahren lassen. Dutzende Staaten erhöhen derweil den Druck auf den Iran: Die strategisch zentrale Meerenge solle sofort un… [+12400 chars],,de,'Iran'
https://www.stern.de/politik/ausland/iran-krieg--trump-droht-teheran---verhandlungsloesung-nicht-in-sicht-37280046.html,https://www.stern.de/politik/ausland/iran-krieg--trump-droht-teheran---verhandlungsloesung-nicht-in-sicht-37280046.html,0,www.stern.de,Iran-Krieg: Trump droht Teheran – Verhandlungslösung nicht in Sicht,"Raketenangriffe, blockierte Schifffahrtswege und diplomatischer Stillstand: Im Iran-Krieg bleibt eine schnelle Lösung auch nach fünf Wochen in weiter Ferne.",https://image.stern.de/37281188/t/-O/v2/w1440/r1.7778/-/03--fvf4bsuoxhv3axs2048jpeg---536469e28cbf1403.jpg,2026-04-03T13:10:54Z,,"Kopiere den aktuellen Link
Zur Merkliste hinzufügen
Raketenangriffe, blockierte Schifffahrtswege und diplomatischer Stillstand: Im Iran-Krieg bleibt eine schnelle Lösung auch nach fünf Wochen in we… [+5689 chars]",,de,'Krieg'
https://www.zeit.de/news/2026-04/03/energiekrise-pakistan-reagiert-mit-kostenlosem-nahverkehr,https://www.zeit.de/news/2026-04/03/energiekrise-pakistan-reagiert-mit-kostenlosem-nahverkehr,0,www.zeit.de,Iran-Krieg: Energiekrise: Pakistan reagiert mit kostenlosem Nahverkehr,Hier finden Sie Informationen zu dem Thema „Iran-Krieg“. Lesen Sie jetzt „Energiekrise: Pakistan reagiert mit kostenlosem Nahverkehr“.,https://img.zeit.de/news/2026-04/03/energiekrise-pakistan-reagiert-mit-kostenlosem-nahverkehr-image-group/wide__1300x731,2026-04-03T13:56:20Z,,Wegen drastisch steigender Spritpreise stellt die Regierung in Pakistan kostenlosen Nahverkehr als Entlastung in Aussicht. In Städten der bevölkerungsreichsten Provinz Punjab sowie in der Hauptstadt … [+1205 chars],,de,'Energie'
https://www.welt.de/politik/ausland/article69cf05f2cdf80d124bb0cc45/krieg-in-nahost-us-kampfjet-ueber-iran-abgeschossen-pilot-soll-schleudersitz-ausgeloest-haben-liveticker.html,https://www.welt.de/politik/ausland/article69cf05f2cdf80d124bb0cc45/krieg-in-nahost-us-kampfjet-ueber-iran-abgeschossen-pilot-soll-schleudersitz-ausgeloest-haben-liveticker.html,0,www.welt.de,US-Kampfjet über Iran abgeschossen – Pilot soll Schleudersitz ausgelöst haben,"Im Südwesten des Iran ist ein amerikanischer Kampfjet abgestürzt. Nun soll der Pilot vor einer Gefangennahme gerettet werden. Dutzende Staaten erhöhen derweil den Druck auf den Iran, die Straße von Hormus „sofort und bedingungslos“ zu öffnen. Mehr im Livetick…",https://images.welt.de/69cf05f2cdf80d124bb0cc45/8d60044207b79d22850cfb12bf006e09/ci16x9-w1200/dpa-com-20090101-251104-99-527563-jpg,2026-04-03T14:20:00Z,,"Im Südwesten des Iran ist ein amerikanischer Kampfjet abgestürzt. Nun soll der Pilot vor einer Gefangennahme gerettet werden. Dutzende Staaten erhöhen derweil den Druck auf den Iran, die Straße von H… [+13659 chars]",,de,'Iran'
https://www.stern.de/politik/ausland/iran-krieg--us-kampfjet-abgeschossen---verhandlungsloesung-nicht-in-sicht-37280046.html,https://www.stern.de/politik/ausland/iran-krieg--us-kampfjet-abgeschossen---verhandlungsloesung-nicht-in-sicht-37280046.html,0,www.stern.de,Iran-Krieg: US-Kampfjet abgeschossen - Verhandlungslösung nicht in Sicht,Washington - Fünf Wochen nach Start des Iran-Kriegs dauern die gegenseitigen Angriffe unvermindert an. Die US-Regierung bestätigte nach,https://image.stern.de/37281382/t/Bh/v1/w1440/r1.7778/-/03--ki7zutqfk3v1axs2048jpeg---3e76c6500b984919.jpg,2026-04-03T15:50:00Z,,"Kopiere den aktuellen Link
Zur Merkliste hinzufügen
Neue Angriffe, keine Annäherung: Während die USA nach vermissten Piloten suchen, bleibt die Hoffnung auf Frieden im Iran-Krieg vage.
Fünf Wochen… [+5356 chars]",,de,'Chamenei'
https://www.welt.de/politik/ausland/article69cf05f2cdf80d124bb0cc45/krieg-in-nahost-us-kampfjet-ueber-iran-abgeschossen-ein-besatzungsmitglied-von-us-soldaten-gerettet-liveticker.html,https://www.welt.de/politik/ausland/article69cf05f2cdf80d124bb0cc45/krieg-in-nahost-us-kampfjet-ueber-iran-abgeschossen-ein-besatzungsmitglied-von-us-soldaten-gerettet-liveticker.html,0,www.welt.de,US-Kampfjet über Iran abgeschossen – ein Besatzungsmitglied von US-Soldaten gerettet,"Im Südwesten des Iran ist ein amerikanischer Kampfjet abgeschossen worden. Ein Besatzungsmitglied konnte gerettet werden, die Suche nach dem zweiten dauert an. Dutzende Staaten erhöhen derweil den Druck auf den Iran wegen der Straße von Hormus. Mehr im Liveti…",https://images.welt.de/69cf05f2cdf80d124bb0cc45/1f1ef519ba3ef98b87142854d8a63971/ci16x9-w1200/1775237035524-afp-a6pv867-jpg,2026-04-03T17:25:00Z,,"Im Südwesten des Iran ist ein amerikanischer Kampfjet abgeschossen worden. Ein Besatzungsmitglied konnte gerettet werden, die Suche nach dem zweiten dauert an. Dutzende Staaten erhöhen derweil den Dr… [+16601 chars]",,de,'Iran'
https://www.tagesspiegel.de/sport/fussball-sicherheitsrat-entscheidet-uber-irans-wm-teilnahme-15434388.html,https://www.tagesspiegel.de/sport/fussball-sicherheitsrat-entscheidet-uber-irans-wm-teilnahme-15434388.html,0,www.tagesspiegel.de,Fußball: Sicherheitsrat entscheidet über Irans WM-Teilnahme,"Ob der Iran zur Fußball-WM in die USA reist, ist angesichts des derzeitigen Kriegs weiter offen. Nun wird bekannt, wie der Prozess für eine Entscheidung laufen soll.",https://www.tagesspiegel.de/images/15434387/alternates/BASE_16_9_W1400/1775245043000/iranische-nationalspieler.jpeg,2026-04-03T19:37:23Z,,Die Entscheidung über eine Teilnahme Irans an der Weltmeisterschaft soll vom Nationalen Sicherheitsrat des Landes in Abstimmung mit der Regierung getroffen werden. Der Fußballverband und das Sportmin… [+1526 chars],,de,'Iran'
https://sport.orf.at/stories/3154391/,https://sport.orf.at/stories/3154391/,0,sport.orf.at,Sicherheitsrat entscheidet über WM-Teilnahme des Iran,,https://sport.orf.at/mojo/1_4_1/storyserver//news/common/images/og-fallback-sport.png,2026-04-03T19:41:09Z,,Die Entscheidung über eine Teilnahme des Iran an der Weltmeisterschaft soll vom Nationalen Sicherheitsrat des Landes in Abstimmung mit der Regierung getroffen werden. Der Fußballverband und das Sport… [+1477 chars],,de,'Iran'
https://www.welt.de/politik/ausland/article69cf05f2cdf80d124bb0cc45/krieg-in-nahost-zweites-us-kampfflugzeug-im-nahen-osten-abgestuerzt-liveticker.html,https://www.welt.de/politik/ausland/article69cf05f2cdf80d124bb0cc45/krieg-in-nahost-zweites-us-kampfflugzeug-im-nahen-osten-abgestuerzt-liveticker.html,0,www.welt.de,Zweites US-Kampfflugzeug im Nahen Osten abgestürzt – Sprecher des iranischen Parlaments spottet,"Im Südwesten des Iran ist ein amerikanischer Kampfjet abgeschossen worden. Ein Besatzungsmitglied konnte gerettet werden, die Suche nach dem zweiten dauert an. Dutzende Staaten erhöhen derweil den Druck auf den Iran wegen der Straße von Hormus. Mehr im Liveti…",https://images.welt.de/69cf05f2cdf80d124bb0cc45/1f1ef519ba3ef98b87142854d8a63971/ci16x9-w1200/1775237035524-afp-a6pv867-jpg,2026-04-03T20:21:00Z,,"Nach dem Abschuss eines US-Kampfjets konnte ein Besatzungsmitglied gerettet werden, die Suche nach dem zweiten dauert an. Kurze Zeit später wurde ein zweiter Absturz gemeldet mit bislang unklaren Hin… [+17870 chars]",,de,'Iran'
https://www.welt.de/politik/ausland/article69cf05f2cdf80d124bb0cc45/krieg-in-nahost-hoffen-dass-das-nicht-passieren-wird-trump-aeussert-sich-zu-vermisstem-besatzungsmitglied-liveticker.html,https://www.welt.de/politik/ausland/article69cf05f2cdf80d124bb0cc45/krieg-in-nahost-hoffen-dass-das-nicht-passieren-wird-trump-aeussert-sich-zu-vermisstem-besatzungsmitglied-liveticker.html,0,www.welt.de,"„Hoffen, dass das nicht passieren wird“ – Trump äußert sich zu vermisstem Besatzungsmitglied","Der Verlust zweier US-Kampfjets über iranischem Gebiet wirkt sich nach Angaben von US-Präsident Trump nicht auf Verhandlungen mit der Führung in Teheran aus. „Es ist eben Krieg“, sagt er. Israel meldet derweil erneuten Raketenbeschuss aus dem Iran. Mehr im Li…",https://images.welt.de/69cf05f2cdf80d124bb0cc45/afb109ecb7bd5aa50c1bc5ae60c67573/ci16x9-w1200/2026-04-03t182024z-1294253638-rc2shkabx4bc-rtrmadp-3-iran-crisis-usa-shootdown-jpg,2026-04-03T23:32:00Z,,"Der Verlust zweier US-Kampfjets über iranischem Gebiet wirkt sich nach Angaben von US-Präsident Trump nicht auf Verhandlungen mit der Führung in Teheran aus. Er hoffe, dass das vermisste Crew-Mitglie… [+12045 chars]",,de,'Iran'
https://www.welt.de/politik/ausland/article69cf05f2cdf80d124bb0cc45/krieg-in-nahost-abschuss-von-us-kampfjets-hat-laut-trump-keinen-einfluss-auf-verhandlungen-liveticker.html,https://www.welt.de/politik/ausland/article69cf05f2cdf80d124bb0cc45/krieg-in-nahost-abschuss-von-us-kampfjets-hat-laut-trump-keinen-einfluss-auf-verhandlungen-liveticker.html,0,www.welt.de,Abschuss von US-Kampfjets hat laut Trump keinen Einfluss auf Verhandlungen,"Der Verlust zweier US-Kampfjets über iranischem Gebiet wirkt sich nach Angaben von US-Präsident Trump nicht auf Verhandlungen mit der Führung in Teheran aus. „Es ist eben Krieg“, sagt er. Israel meldet derweil erneuten Raketenbeschuss aus dem Iran. Mehr im Li…",https://images.welt.de/69cf05f2cdf80d124bb0cc45/1f1ef519ba3ef98b87142854d8a63971/ci16x9-w1200/1775237035524-afp-a6pv867-jpg,2026-04-03T23:32:00Z,,"Der Verlust zweier US-Kampfjets über iranischem Gebiet wirkt sich nach Angaben von US-Präsident Trump nicht auf Verhandlungen mit der Führung in Teheran aus. Es ist eben Krieg, sagt er. Israel meldet… [+9707 chars]",,de,'Iran'
https://www.welt.de/politik/deutschland/video69d0b0318ba297d4b122ea61/debatte-um-migration-aussenminister-wadephul-unterstuetzt-merz-vorstoss-zur-rueckkehr-vieler-syrer.html,https://www.welt.de/politik/deutschland/video69d0b0318ba297d4b122ea61/debatte-um-migration-aussenminister-wadephul-unterstuetzt-merz-vorstoss-zur-rueckkehr-vieler-syrer.html,0,www.welt.de,Außenminister Wadephul unterstützt Merz-Vorstoß zur Rückkehr vieler Syrer,"Bundeskanzler Friedrich Merz möchte, dass ein Großteil der Syrer in Deutschland wieder in ihr Heimatland zurückkehrt. Außenminister Wadephul hat das politische Ziel der Rückkehr bekräftigt.",https://images.welt.de/69d0b0318ba297d4b122ea61/c22d4268dc77587262a4bc909e61824c/ci16x9-w1200/dpa-com-20090101-260122-935-1098971-jpg,2026-04-04T06:36:58Z,,Die WELT als ePaper: Die vollständige Ausgabe steht Ihnen bereits am Vorabend zur Verfügung so sind Sie immer hochaktuell informiert. Weitere Informationen https://epaper.welt.de,,de,'Friedrich Merz'
https://www.welt.de/politik/deutschland/article69d0addbcdf80d124bb0daf4/dgb-chefin-fahimi-mehrwertsteuer-auf-lebensmittel-streichen-waere-starkes-signal-insbesondere-fuer-geringverdiener.html,https://www.welt.de/politik/deutschland/article69d0addbcdf80d124bb0daf4/dgb-chefin-fahimi-mehrwertsteuer-auf-lebensmittel-streichen-waere-starkes-signal-insbesondere-fuer-geringverdiener.html,0,www.welt.de,"Mehrwertsteuer auf Lebensmittel streichen – „Wäre starkes Signal, insbesondere für Geringverdiener“",Angesichts steigender Verbraucherpreise hat sich DBG-Vorsitzende Fahimi für die Streichung der ermäßigten Mehrwertsteuer auf Lebensmittel und Energie ausgesprochen. Im Gegenzug will sie „Mega-Reiche“ stärker belasten.,https://images.welt.de/69d0addbcdf80d124bb0daf4/f6fd932f2af8c02b17cf48dd6cc5d1a2/ci16x9-w1200/dpa-com-20090101-260206-935-1133820-jpg,2026-04-04T06:41:02Z,,"Die Chefin des Deutschen Gewerkschaftsbundes, Yasmin Fahimi, hat sich dafür ausgesprochen, die ermäßigte Mehrwertsteuer für bestimmte Waren ganz zu streichen. Die ermäßigte Mehrwertsteuer von sieben … [+1345 chars]",,de,'Friedrich Merz'
https://www.welt.de/politik/deutschland/article69d0addbcdf80d124bb0daf4/steigende-lebensmittelpreise-ermaessigte-mehrwertsteuer-auf-null-prozent-senken-waere-ein-starkes-signal-sagt-dgb-chefin-fahimi.html,https://www.welt.de/politik/deutschland/article69d0addbcdf80d124bb0daf4/steigende-lebensmittelpreise-ermaessigte-mehrwertsteuer-auf-null-prozent-senken-waere-ein-starkes-signal-sagt-dgb-chefin-fahimi.html,0,www.welt.de,"„Ermäßigte Mehrwertsteuer auf null Prozent senken, wäre ein starkes Signal“, sagt DGB-Chefin Fahimi",Angesichts steigender Verbraucherpreise hat sich DBG-Vorsitzende Fahimi für die Streichung der ermäßigten Mehrwertsteuer auf Lebensmittel und Energie ausgesprochen. Im Gegenzug will sie „Mega-Reiche“ stärker belasten.,https://images.welt.de/69d0addbcdf80d124bb0daf4/9d852840d15915f9abb21fc9753f7b3f-master/ci16x9-w1200/dpa-com-20090101-260206-935-1133820-jpg,2026-04-04T06:41:02Z,,"Die Chefin des Deutschen Gewerkschaftsbundes, Yasmin Fahimi, hat sich dafür ausgesprochen, die ermäßigte Mehrwertsteuer für bestimmte Waren ganz zu streichen. Die ermäßigte Mehrwertsteuer von sieben … [+1346 chars]",,de,'Friedrich Merz'
https://www.faz.net/aktuell/wirtschaft/mehr-wirtschaft/anhaltend-hohe-spritpreise-klingbeil-fordert-pruefung-von-uebergewinnsteuer-auf-eu-ebene-accg-200701529.html,https://www.faz.net/aktuell/wirtschaft/mehr-wirtschaft/anhaltend-hohe-spritpreise-klingbeil-fordert-pruefung-von-uebergewinnsteuer-auf-eu-ebene-accg-200701529.html,0,www.faz.net,Hohe Spritpreise: Klingbeil fordert Prüfung von Übergewinnsteuer auf EU-Ebene,"Gemeinsam mit Österreich, Italien, Portugal und Spanien wendet sich der Bundesfinanzminister in einem Brief an die EU-Kommission. Wer vom Krieg profitiere, solle einen Beitrag leisten, heißt es darin.",https://media0.faz.net/image/w1200h627/53c580ee4108/w6000h3135x0y527o/202604/43601.0.1944419689/lars-klingbeil-spd.webp,2026-04-04T11:03:23Z,,Angesichts anhaltend hoher Spritpreise fordern Bundesfinanzminister Lars Klingbeil und vier seiner EU-Kollegen die Brüsseler Kommission in einem Brief zur Prüfung einer Übergewinnsteuer auf europäisc… [+3841 chars],,de,'Friedrich Merz'
https://www.zeit.de/news/2026-04/04/woidke-will-heimische-energie-auch-in-brandenburg-nutzen,https://www.zeit.de/news/2026-04/04/woidke-will-heimische-energie-auch-in-brandenburg-nutzen,0,www.zeit.de,Erneuerbare Energien: Woidke will heimische Energie auch in Brandenburg nutzen,Hier finden Sie Informationen zu dem Thema „Erneuerbare Energien“. Lesen Sie jetzt „Woidke will heimische Energie auch in Brandenburg nutzen“.,https://img.zeit.de/news/2026-04/04/woidke-will-heimische-energie-auch-in-brandenburg-nutzen-image-group/wide__1300x731,2026-04-04T12:20:32Z,,Brandenburgs Ministerpräsident Dietmar Woidke (SPD) will den in Brandenburg produzierten grünen Strom auch vor allem in Brandenburg einsetzen. «Ich will nicht all unseren Strom an Herrn Söder nach Ba… [+933 chars],,de,'Energie'
https://www.zeit.de/politik/ausland/2026-04/iran-krieg-us-kampfjet-f-15-abgeschossen-besatzung-suche,https://www.zeit.de/politik/ausland/2026-04/iran-krieg-us-kampfjet-f-15-abgeschossen-besatzung-suche,0,www.zeit.de,Abgestürzte US-Kampfjets: Experten warnen vor möglicher Gefangennahme von US-Luftwaffensoldat,"Die USA und der Iran suchen nach einem Besatzungsmitglied des abgeschossenen US-Kampfjets. Findet der Iran ihn zuerst, wäre dies laut Beobachtern ein starkes Druckmittel.",https://img.zeit.de/politik/ausland/2026-04/iran-krieg-us-kampfjet-f-15-abgeschossen-besatzung-suche-bild/wide__1300x731,2026-04-04T12:40:24Z,,Nach dem Abschuss eines F-15-Kampfjets der US-Streitkräfte im Iran und der Rettung eines Crewmitglieds suchen jeweils die USA und der Iran nach dem zweiten Besatzungsmitglied. Nach Einschätzung von B… [+2883 chars],,de,'Iran'
https://www.zeit.de/news/2026-04/04/tausende-fordern-frieden-bei-ostermaerschen-im-suedwesten,https://www.zeit.de/news/2026-04/04/tausende-fordern-frieden-bei-ostermaerschen-im-suedwesten,0,www.zeit.de,Demos gegen Krieg: Tausende fordern Frieden bei Ostermärschen im Südwesten,Hier finden Sie Informationen zu dem Thema „Demos gegen Krieg“. Lesen Sie jetzt „Tausende fordern Frieden bei Ostermärschen im Südwesten“.,https://img.zeit.de/news/2026-04/04/tausende-fordern-frieden-bei-ostermaerschen-im-suedwesten-image-group/wide__1300x731,2026-04-04T13:38:27Z,,Bei traditionellen Ostermärschen der Friedensbewegung sind in Baden-Württemberg Tausende Menschen auf die Straßen gegangen. Sie demonstrierten unter anderem gegen die militärische Aufrüstung in Deuts… [+967 chars],,de,'Krieg'
https://www.zeit.de/news/2026-04/04/energie-cottbus-meldet-sich-zurueck-im-aufstiegskampf,https://www.zeit.de/news/2026-04/04/energie-cottbus-meldet-sich-zurueck-im-aufstiegskampf,0,www.zeit.de,3. Fußball-Liga: Energie Cottbus meldet sich zurück im Aufstiegskampf,Hier finden Sie Informationen zu dem Thema „3. Fußball-Liga“. Lesen Sie jetzt „Energie Cottbus meldet sich zurück im Aufstiegskampf“.,https://img.zeit.de/news/2026-04/04/energie-cottbus-meldet-sich-zurueck-im-aufstiegskampf-image-group/wide__1300x731,2026-04-04T13:56:57Z,,Der FC Energie Cottbus schöpft neue Hoffnung im Rennen um den Aufstieg in die 2. Fußball-Bundesliga. Nach zuvor drei sieglosen Spielen in der 3. Liga gewann die Mannschaft von Trainer Claus-Dieter Wo… [+1375 chars],,de,'Energie'
https://www.dw.com/de/der-iran-krieg-und-europas-energiekrise/a-76655842,https://www.dw.com/de/der-iran-krieg-und-europas-energiekrise/a-76655842,0,www.dw.com,Der Iran-Krieg und Europas Energiekrise,"Der Iran-Krieg hat in der EU eine Energiekrise ausgelöst. Brüssel befürchtet Engpässe und ruft dazu auf, den persönlichen Energieverbrauch zu senken. Analysten fordern mehr Investitionen in erneuerbare Energien. Der Iran-Krieg geht in den zweiten Monat und di…",https://static.dw.com/image/76617344_6.jpg,2026-04-04T17:51:00Z,,"Der Iran-Krieg geht in den zweiten Monat und die Europäische Kommission hat die mehr als 400 Millionen Bürger und Bürgerinnen der EU aufgerufen, weniger zu fliegen, das Auto öfter stehen zu lassen, v… [+8040 chars]",,de,'Iran'
https://taz.de/Digitale-Gewalt/!6164589/,https://taz.de/Digitale-Gewalt/!6164589/,0,taz.de,Digitale Gewalt: Die Scham wechselt zu Friedrich Merz,"Unsere Kolumnistin forderte, dass übergriffige Männer geächtet werden sollten. Bei Deepfakes wird das jedoch anders gelingen als vielleicht erwartet.",https://taz.de/picture/8354607/1200/40852988.jpeg,2026-04-04T17:59:00Z,,"Unsere Kolumnistin forderte, dass übergriffige Männer geächtet werden sollten. Bei Deepfakes wird das jedoch anders gelingen als vielleicht erwartet. mehr...",,de,'Friedrich Merz'
https://www.zeit.de/news/2026-04/05/trump-us-soldat-gerettet-und-in-sicherheit,https://www.zeit.de/news/2026-04/05/trump-us-soldat-gerettet-und-in-sicherheit,0,www.zeit.de,Krieg: Trump: US-Soldat gerettet und in Sicherheit,Hier finden Sie Informationen zu dem Thema „Krieg“. Lesen Sie jetzt „Trump: US-Soldat gerettet und in Sicherheit“.,https://img.zeit.de/administratives/sharing/fallback-image-die-zeit/wide__1300x731,2026-04-05T04:24:41Z,,"Das zweite Besatzungsmitglied des über dem Iran abgeschossenen Kampfjets ist laut US-Präsident Donald Trump gerettet und in Sicherheit. «Wir haben ihn», schrieb er auf seiner Plattform Truth Social i… [+54 chars]",,de,'Sicherheit'
https://www.faz.net/aktuell/feuilleton/medien-und-film/kino/wie-authentisch-ist-der-film-der-magier-im-kreml-ueber-putin-accg-200691475.html,https://www.faz.net/aktuell/feuilleton/medien-und-film/kino/wie-authentisch-ist-der-film-der-magier-im-kreml-ueber-putin-accg-200691475.html,0,www.faz.net,Neuer Film über den Kreml: Basierend auf einer halbwahren Geschichte,"Der Film „Der Magier im Kreml“ wirkt auf den ersten Blick wie ein schonungsloses Porträt des russischen Machtapparats. Treffende Details und überzeugende Darstellungen verdecken aber das Wesentliche und könnten dem Kreml damit mehr nutzen, als ihm zu schaden.",https://media0.faz.net/image/w1200h627/5a8cef89c20f/w2999h1566x0y60o/202603/6c416402-2c4f-11f1-9f69-66210c0a8bb7/jude-law-mitte-als-putin-paul.webp,2026-04-05T08:02:43Z,,In der kommenden Woche läuft in deutschen Kinos Der Magier im Kreml an. Seine zentralen Figuren sind Wladimir Putin und ein an seinen einstigen Berater und Chefideologen Wladislaw Surkow angelehnter … [+11144 chars],,de,'Kreml'
https://www.tagesspiegel.de/wirtschaft/wegen-folgen-des-iran-kriegs-chef-der-eisenbahngewerkschaft-fordert-rabatte-auf-zugtickets-15436643.html,https://www.tagesspiegel.de/wirtschaft/wegen-folgen-des-iran-kriegs-chef-der-eisenbahngewerkschaft-fordert-rabatte-auf-zugtickets-15436643.html,0,www.tagesspiegel.de,Wegen Folgen des Iran-Kriegs: Chef der Eisenbahngewerkschaft fordert Rabatte auf Zugtickets,Das Deutschlandticket kostet 63 Euro im Monat. Der EVG-Vorsitzende Burkert bringt angesichts hoher Spritpreise Vergünstigungen ins Spiel – auch für den Fernverkehr.,https://www.tagesspiegel.de/images/15436758/alternates/BASE_16_9_W1400/1775382026000/neue-bahn-strategie-wird-vorgestellt.jpeg,2026-04-05T08:45:29Z,,Besonders Autofahrer spüren auch in Deutschland die Auswirkungen des Krieges der USA und Israels gegen den Iran bereits deutlich. Wegen der massiv gestiegenen Preise für Rohöl an den internationalen … [+4433 chars],,de,'Iran'
https://www.der-postillon.com/2026/04/sonntagsfrage-merz-al-schaara.html,https://www.der-postillon.com/2026/04/sonntagsfrage-merz-al-schaara.html,0,www.der-postillon.com,Sonntagsfrage: Was sagt Merz hier zu Syriens Präsident al-Schaara?,"Wenn man sich bei Friedrich Merz auf eines verlassen kann, dann darauf, dass er immer die richtigen Worte findet. So auch beim Staatsbesuch des syrischen Präsident Ahmed al-Schaara. Was genau der Kanzler hier sagte, müssen Sie uns verraten – diesmal will näml…",https://blogger.googleusercontent.com/img/b/R29vZ2xl/AVvXsEhNBmbbSQSFuSmpAFOG93Au_Cfi1TQFOYImhWOmrbX8Q0zjaCkjfiDcaTbRBPwiwzvmh62dVDh017e5uazcQPvDpOVoL9whxNl-Ngla9Js9E5rW8LQjz-WlCJeLvlPtx4rnZdMme06ac1AmtiTpuOrpHRugf0oSd2VunAfe4jiECTrRCUtdgGBntCJTy-Q/w1600/Sonntagsfrage-Merz-al-Schaara.jpg,2026-04-05T08:46:19Z,,"Wenn man sich bei Friedrich Merz auf eines verlassen kann, dann darauf, dass er immer die richtigen Worte findet. So auch beim Staatsbesuch des syrischen Präsident Ahmed al-Schaara. Was genau der Kan… [+861 chars]",,de,'Friedrich Merz'
https://www.welt.de/politik/deutschland/article69d21a7680914f7611253224/energiekrise-lang-will-mehrwertsteuer-auf-grundnahrungsmittel-abschaffen-cdu-politiker-nennt-es-bedenkenswert.html,https://www.welt.de/politik/deutschland/article69d21a7680914f7611253224/energiekrise-lang-will-mehrwertsteuer-auf-grundnahrungsmittel-abschaffen-cdu-politiker-nennt-es-bedenkenswert.html,0,www.welt.de,Lang will Mehrwertsteuer auf Grundnahrungsmittel abschaffen – CDU-Politiker nennt es „bedenkenswert“,"Die Rufe nach Entlastungen im Zuge der Energiekrise werden lauter: Ricarda Lang fordert die Absenkung der Mehrwertsteuer auf Grundnahrungsmittel auf null Prozent. Auch Gewerkschaften, der Städtebund und Unionspolitiker machen Vorschläge.",https://images.welt.de/69d21a7680914f7611253224/f7f58d4cc82642943f054b44adb5b9c2/ci16x9-w1200/dpa-com-20090101-260403-935-1258198-jpg,2026-04-05T11:35:00Z,,"Die Rufe nach Entlastungen im Zuge der Energiekrise werden lauter: Ricarda Lang fordert die Absenkung der Mehrwertsteuer auf Grundnahrungsmittel auf null Prozent. Auch Gewerkschaften, der Städtebund … [+3756 chars]",,de,'Energie'
