index,url,valid,domain,title,description,image,published,archive,content,quote,language,keyword
https://www.tagesspiegel.de/internationales/lage-im-uberblick-massenprotest-in-jerusalem-geisel-angehorige-fordern-deal-14288054.html,https://www.tagesspiegel.de/internationales/lage-im-uberblick-massenprotest-in-jerusalem-geisel-angehorige-fordern-deal-14288054.html,0,www.tagesspiegel.de,Lage im Überblick: Massenprotest in Jerusalem - Geisel-Angehörige fordern Deal,Israels Armee bereitet die Einnahme der Stadt Gaza vor. Angehörige der Geiseln in der Gewalt der Hamas fürchten das Schlimmste. Der Druck auf Premier Netanjahu zur Beendigung des Kriegs wächst.,https://www.tagesspiegel.de/images/14288096/alternates/BASE_16_9_W1400/1757211332000/nahostkonflikt-proteste-in-jerusalem.jpeg,2025-09-06T22:12:27Z,,Angesichts einer drohenden Großoffensive der israelischen Armee in der Stadt Gaza laufen die diplomatischen Bemühungen um ein Ende des Krieges auf Hochtouren. Nach Informationen des israelischen Send… [+5243 chars],,de,'Krieg'
https://www.stern.de/politik/ausland/lage-im-ueberblick--massenprotest-in-jerusalem---geisel-angehoerige-fordern-deal-36034596.html,https://www.stern.de/politik/ausland/lage-im-ueberblick--massenprotest-in-jerusalem---geisel-angehoerige-fordern-deal-36034596.html,0,www.stern.de,Lage im Überblick: Massenprotest in Jerusalem - Geisel-Angehörige fordern Deal,Israels Armee bereitet die Einnahme der Stadt Gaza vor. Angehörige der Geiseln in der Gewalt der Hamas fürchten das Schlimmste. Der Druck auf Premier Netanjahu zur Beendigung des Kriegs wächst.,https://image.stern.de/36034724/t/Rg/v1/w1440/r1.7778/-/07--2w4rf5v5v5v1axs2048jpeg---ea9df3fa7e5bc56b.jpg,2025-09-07T02:13:32Z,,"Kopiere den aktuellen Link
Zur Merkliste hinzufügen
Israels Armee bereitet die Einnahme der Stadt Gaza vor. Angehörige der Geiseln in der Gewalt der Hamas fürchten das Schlimmste. Der Druck auf Pre… [+5404 chars]",,de,'Krieg'
https://www.dw.com/de/gaza-krieg-diplomatie-und-demonstranten-dr%C3%A4ngen-auf-deal/a-73909518,https://www.dw.com/de/gaza-krieg-diplomatie-und-demonstranten-dr%C3%A4ngen-auf-deal/a-73909518,0,www.dw.com,Gaza-Krieg: Diplomatie und Demonstranten drängen auf Deal,"Israel zeigt sich fest entschlossen, mit einer Großoffensive die Stadt Gaza vollständig einzunehmen. Doch der Druck auf Premier Benjamin Netanjahu zur Beendigung des Kriegs wächst. Angesichts der geplanten Großoffensive der israelischen Armee in der Stadt Gaz…",https://static.dw.com/image/73906293_6.jpg,2025-09-07T11:34:00Z,,Angesichts der geplanten Großoffensive der israelischen Armee in der Stadt Gaza laufen die diplomatischen Bemühungen um ein Ende des Kriegs im Gazastreifen auf Hochtouren. Laut Medienberichten wollen… [+4578 chars],,de,'Katar'
https://www.bild.de/politik/inland/spd-ministerin-gegen-cdu-general-buergergeld-streichen-bas-dagegen-68bd899372019652f128d126,https://www.bild.de/politik/inland/spd-ministerin-gegen-cdu-general-buergergeld-streichen-bas-dagegen-68bd899372019652f128d126,0,www.bild.de,SPD-Ministerin gegen CDU-General - Bürgergeld streichen? Bas dagegen!,Bärbel Bas widerspricht Carsten Linnemanns Vorschlag zur Streichung des Bürgergeldes für Job-Verweigerer und verweist auf das Grundgesetz.,"https://images.bild.de/68bd899372019652f128d126/a031b5230d0ca5acfd07dd342d59ae27,644f7a31?w=1280",2025-09-07T14:54:05Z,,"Berlin Der Bürgergeld-Zoff bei Schwarz-Rot geht in die nächste Runde: Jetzt knallt Bärbel Bas zurück!
Grund: CDU-General Carsten Linnemann will Bürgergeld-Verweigerern alles streichen. Im BILD-Inter… [+1251 chars]",,de,'Bürgergeld'
https://www.n-tv.de/politik/Bas-nennt-Buergergeld-Kuerzung-nicht-so-einfach-article26016479.html,https://www.n-tv.de/politik/Bas-nennt-Buergergeld-Kuerzung-nicht-so-einfach-article26016479.html,0,www.n-tv.de,"SPD-Chefin zu Linnemann-Kritik: Bas nennt Bürgergeld-Kürzung ""nicht so einfach""","Anders als im Streit mit Kanzler Merz wischt die SPD-Chefin Kürzungen beim Bürgergeld nicht mehr mit Kraftausdrücken vom Tisch. Während CDU-Generalsekretär Linnemann eine Komplettstreichung für Verweigerer fordert, verweist Bas auf Gerichtsurteile zum Existen…",https://www.n-tv.de/img/incoming/crop26016493/0481329102-cImg_16_9-w1200/545663384.jpg,2025-09-07T15:09:46Z,,Anders als im Streit mit Kanzler Merz wischt die SPD-Chefin Kürzungen beim Bürgergeld nicht mehr mit Kraftausdrücken vom Tisch. Während CDU-Generalsekretär Linnemann eine Komplettstreichung für Verwe… [+2281 chars],,de,'Bürgergeld'
https://www.welt.de/politik/ausland/article68b91d9746b61b4dcb0b8b8f/Ukraine-Krieg-Dann-wird-die-russische-Wirtschaft-zusammenbrechen-US-Finanzminister-fordert-mehr-Druck-von-EU-Liveticker.html,https://www.welt.de/politik/ausland/article68b91d9746b61b4dcb0b8b8f/Ukraine-Krieg-Dann-wird-die-russische-Wirtschaft-zusammenbrechen-US-Finanzminister-fordert-mehr-Druck-von-EU-Liveticker.html,0,www.welt.de,„Dann wird die russische Wirtschaft zusammenbrechen“ – US-Finanzminister fordert mehr Druck von EU,Mit hunderten Kampfdrohnen hat Russland die Ukraine landesweit unter Beschuss genommen. Im Hauptgebäude der Regierung ist ein Feuer ausgebrochen. Laut US-Finanzminister Bessent könnte gemeinsamer Druck aus den USA und der EU Russland zu Verhandlungen zwingen.…,https://images.welt.de/68b91d9746b61b4dcb0b8b8f/99428556d16aba9b546fa6ac05c706e0/ci16x9-w1200/us-secretary-of-the-treasury-scott,2025-09-07T16:06:00Z,,Mit hunderten Kampfdrohnen hat Russland die Ukraine landesweit unter Beschuss genommen. Im Hauptgebäude der Regierung ist ein Feuer ausgebrochen. Laut US-Finanzminister Bessent könnte gemeinsamer Dru… [+16243 chars],,de,'Ukraine'
https://www.tagesschau.de/inland/innenpolitik/bab-buergergeld-bas-100.html,https://www.tagesschau.de/inland/innenpolitik/bab-buergergeld-bas-100.html,0,www.tagesschau.de,"Bas zu Sozialreformen: ""Zumutungen gerecht verteilen""",Arbeitsministerin Bas sieht dringenden Bedarf für Sozialreformen. Im <em>Bericht aus Berlin</em> betonte sie aber: Dabei müsse es gerecht zugehen. Beim Bürgergeld sprach sich Bas für härtere Sanktionen aus - genauso wie CDU-Generalsekretär Linnemann.,https://images.tagesschau.de/image/e431b408-c7f6-404f-9d27-08727a259321/AAABmSUJ9V0/AAABmKJZ-0g/16x9-big/sendungsbild-1606928.jpg?width=1280,2025-09-07T17:26:24Z,,"Stand: 07.09.2025 19:26 Uhr
Arbeitsministerin Bas sieht dringenden Bedarf für Sozialreformen. Im Bericht aus Berlin betonte sie aber: Dabei müsse es gerecht zugehen. Beim Bürgergeld sprach sich Bas … [+3405 chars]",,de,'Bürgergeld'
https://www.zeit.de/news/2025-09/07/trump-sieht-sich-bereit-fuer-weitere-russland-sanktionen,https://www.zeit.de/news/2025-09/07/trump-sieht-sich-bereit-fuer-weitere-russland-sanktionen,0,www.zeit.de,Ukraine-Krieg: Trump sieht sich bereit für weitere Russland-Sanktionen,Hier finden Sie Informationen zu dem Thema „Ukraine-Krieg“. Lesen Sie jetzt „Trump sieht sich bereit für weitere Russland-Sanktionen“.,https://img.zeit.de/news/2025-09/07/trump-sieht-sich-bereit-fuer-weitere-russland-sanktionen-image-group/wide__1300x731,2025-09-07T17:32:06Z,,"US-Präsident Donald Trump sieht sich nach eigenen Angaben in der Lage, weitere Russland-Sanktionen verhängen zu können. Auf eine Frage eines Journalisten am Weißen Haus, ob er bereit sei, in die zwei… [+1323 chars]",,de,'Ukraine'
https://www.welt.de/politik/ausland/article68b91d9746b61b4dcb0b8b8f/Ukraine-Krieg-Ja-das-bin-ich-Trump-nach-eigener-Aussage-bereit-fuer-Verschaerfung-von-Russland-Sanktionen-Liveticker.html,https://www.welt.de/politik/ausland/article68b91d9746b61b4dcb0b8b8f/Ukraine-Krieg-Ja-das-bin-ich-Trump-nach-eigener-Aussage-bereit-fuer-Verschaerfung-von-Russland-Sanktionen-Liveticker.html,0,www.welt.de,Trump nach eigener Aussage bereit für Verschärfung von Sanktionen gegen Russland,"CSU-Chef Markus Söder erteilt Überlegungen, die Bundeswehr im Rahmen von Sicherheitsgarantien für die Ukraine in dem Land einzusetzen, eine Absage. Vielmehr regte er eine Diskussion über den Umgang mit ukrainischen Flüchtlingen an. Mehr im Liveticker.",https://images.welt.de/68b91d9746b61b4dcb0b8b8f/1ca2db62d21bd387d46681158ba3ba8d/ci16x9-w1200/president-trump-travels-to-new-york-to-attend-u-s-open-finals,2025-09-07T17:38:00Z,,"Mit hunderten Kampfdrohnen hat Russland die Ukraine landesweit unter Beschuss genommen. Im Hauptgebäude der Regierung ist ein Feuer ausgebrochen. Donald Trump deutet an, die Gangart gegenüber Wladimi… [+18185 chars]",,de,'Bürgergeld'
https://www.faz.net/aktuell/politik/bundestagswahl/liveticker-bundespolitik-spahn-in-der-koalition-das-miteinander-moegliche-umsetzen-faz-110093143.html,https://www.faz.net/aktuell/politik/bundestagswahl/liveticker-bundespolitik-spahn-in-der-koalition-das-miteinander-moegliche-umsetzen-faz-110093143.html,0,www.faz.net,Liveblog Bundespolitik: Spahn: In der Koalition das miteinander Mögliche umsetzen,Unionsfraktionschef warnt vor unrealistischen Erwartungen +++ Arbeitsministerin Bas: Bürgergeld-Entzug „nicht so einfach“ +++ CSU-Vorsitzender Söder will das EU-Verbrennerverbot kippen +++ alle Entwicklungen im Liveblog,https://media1.faz.net/ppmedia/w1200/aktuell/3114778455/1.10675271/facebook_teaser/jens-spahn.jpg.webp,2025-09-07T18:44:53Z,,"Der frühere SPD-Vorsitzende Sigmar Gabriel schlägt vor, die Renten nur noch im Rahmen eines Inflationsausgleichs anzuheben. Dies würde bedeuten, dass kein Rentner weniger hat, aber auch nicht mehr. E… [+826 chars]",,de,'Bürgergeld'
