index,url,valid,domain,title,description,image,published,archive,content,quote,language,keyword
https://www.welt.de/politik/ausland/article699bef01ee35d0f0647c4345/ukraine-krieg-belgien-kapert-tanker-der-russischen-schattenflotte-liveticker.html,https://www.welt.de/politik/ausland/article699bef01ee35d0f0647c4345/ukraine-krieg-belgien-kapert-tanker-der-russischen-schattenflotte-liveticker.html,0,www.welt.de,Belgien kapert Tanker der russischen Schattenflotte,"Bundeskanzler Friedrich Merz steht Gesprächen mit dem Kreml grundsätzlich offen gegenüber, sagt er. Derzeit seien solche Formate angesichts der russischen Kriegsführung aber sinnlos. Und: Rund um das Atomkraftwerk Saporischschja soll eine Waffenruhe gelten. M…",https://images.welt.de/699bef01ee35d0f0647c4345/f70f4d7d153cd291194ca0718cd66a2d/ci16x9-w1200/260301-belgium-schattenflotte-jpeg,2026-03-01T05:12:00Z,,Belgien hat einen Tanker der russischen Schattenflotte gekapert. Das Schiff soll in den Hafen von Seebrügge geschleppt werden. Frankreich unterstützte die Operation. Mehr im Liveticker.Die Ukraine se… [+19007 chars],,de,'Pipeline'
https://www.zeit.de/news/2026-03/01/demonstrationen-und-appelle-zum-iran-krieg-in-hessen,https://www.zeit.de/news/2026-03/01/demonstrationen-und-appelle-zum-iran-krieg-in-hessen,0,www.zeit.de,Krieg: Demonstrationen und Appelle zum Iran-Krieg in Hessen,Hier finden Sie Informationen zu dem Thema „Krieg“. Lesen Sie jetzt „Demonstrationen und Appelle zum Iran-Krieg in Hessen“.,https://img.zeit.de/news/2026-03/01/demonstrationen-und-appelle-zum-iran-krieg-in-hessen-image-group/wide__1300x731,2026-03-01T14:02:04Z,,Der Beginn des neuen Iran-Krieges hat auch bei den Menschen in Hessen Emotionen und Reaktionen ausgelöst. In Frankfurt versammelten sich am Samstag laut Polizei rund 2.000 Menschen zu einer Demonstra… [+3308 chars],,de,'Krieg'
https://www.faz.net/aktuell/politik/ukraine/ukraine-liveticker-selenskyj-haben-schwierigen-winter-ueberstanden-faz-110683325.html,https://www.faz.net/aktuell/politik/ukraine/ukraine-liveticker-selenskyj-haben-schwierigen-winter-ueberstanden-faz-110683325.html,0,www.faz.net,Krieg in der Ukraine: Selenskyj: Haben schwierigen Winter überstanden,Selenskyj: „Kein Volk hat solche Prüfungen durchgemacht“ +++ Ukraine: Russland würde US-Sicherheitsgarantien akzeptieren +++ Vier Tote nach russischen Angriffen in der Nordostukraine +++ alle Neuigkeiten im Liveblog,https://media0.faz.net/image/w1200h627/4b05ebe13643/w4852h2535x0y417o/202602/43601.0.1826357063/wolodymyr-selenskyj-in.webp,2026-03-01T19:32:58Z,,Im Konflikt um Energielieferungen hat der ukrainische Präsident Wolodymyr Selenskyj am Freitag mit dem slowakischen Regierungschef Robert Fico telefoniert. Der Präsident der Ukraine lade Fico in die … [+846 chars],,de,'Ukraine'
https://www.n-tv.de/politik/Ministerin-Reiche-erwartet-trotz-Nahost-Konflikt-keine-Gasknappheit-id30419258.html,https://www.n-tv.de/politik/Ministerin-Reiche-erwartet-trotz-Nahost-Konflikt-keine-Gasknappheit-id30419258.html,0,www.n-tv.de,Höhere Energiepreise drohen: Ministerin Reiche erwartet trotz Nahost-Konflikt keine Gasknappheit,"Nach den amerikanisch-israelischen Angriffen auf den Iran sorgt die Lage an der Straße von Hormus für Unruhe. Das Bundeswirtschaftsministerium rechnet zwar mit höheren Energiepreisen, aber nicht mit Engpässen.",https://www.n-tv.de/img/30419269/1772394718/Img_16_9/1200/Katherina-Reiche-CDU-Bundesministerin-fuer-Wirtschaft-und-Energie-stellt-in-der-Bundespressekonferenz-den-Jahreswirtschaftsbericht-2026-vor-Berlin-28-01-2026.jpg,2026-03-01T19:37:47Z,,"Katherina Reiche sieht Deutschland bei Gas- und Öl-Lieferanten breit aufgestellt. (Foto: picture alliance / photothek.de)
Nach den amerikanisch-israelischen Angriffen auf den Iran sorgt die Lage an … [+1304 chars]",,de,'Energie'
https://www.dwdl.de/zahlenzentrale/105706/ardbrennpunkt_mit_hoechster_reichweite_seit_vier_jahren/,https://www.dwdl.de/zahlenzentrale/105706/ardbrennpunkt_mit_hoechster_reichweite_seit_vier_jahren/,0,www.dwdl.de,"ARD-""Brennpunkt"" mit höchster Reichweite seit vier Jahren","Mit weit über acht Millionen Zuschauerinnen und Zuschauern hat der ARD-""Brennpunkt"" zum Krieg im Nahen Osten am Sonntag so viele Menschen erreicht wie zuletzt beim Ausbruch des Ukraine-Kriegs. Auch ""Caren Miosga"" verbuchte steigende Quoten.",https://www.dwdl.de/images/1772438071_brennpunkt-iran---krieg-im-nahen-o.jpg,2026-03-02T07:55:00Z,,"Der ARD-""Brennpunkt"" war am Sonntag die meistgesehene Sendung des Tages. Durchschnittlich 8,62 Millionen Menschen sahen um 20:15 Uhr die knapp 20-minütige Sondersendung im Ersten zum Iran-Krieg - deu… [+2369 chars]",,de,'Ukraine'
https://www.focus.de/politik/ausland/lange-iran-wird-versuchen-moeglichst-viele-hineinziehen_c9683289-333c-4d49-bddc-9652fa2aa68f.html,https://www.focus.de/politik/ausland/lange-iran-wird-versuchen-moeglichst-viele-hineinziehen_c9683289-333c-4d49-bddc-9652fa2aa68f.html,0,www.focus.de,"Lange: ""Iran wird versuchen, möglichst viele hineinziehen""","Der Sicherheitsexperte Nico Lange hat im ZDF-""Morgenmagazin"" am Montag über die strategischen Ziele des Iran gesprochen.",https://quadro.burda-forward.de/ctf/4d7aa365-f830-4369-9be2-6593707eb65c.46a71c1d-406d-4370-99b7-e0648fc09268.jpg?im=RegionOfInterestCrop%3D%281200%2C630%29%2CregionOfInterest%3D%28878%2C410%29&hash=ac4e48d1d45684018217e1f55fb1831060744377c36a886d177faf73866b185e,2026-03-02T08:08:00Z,,"Er äußerte sich auch zu den Gefahren für Europa. Moderator Philip Wortmann fragte den Experten, ob auch europäische Soldaten in den Krieg hineingezogen werden könnten. 
Dessen Antwort: ""Jetzt sieht … [+1562 chars]",,de,'Ukraine'
https://www.sueddeutsche.de/politik/ukraine-krieg-newsblog-selenskij-winter-li.3388192,https://www.sueddeutsche.de/politik/ukraine-krieg-newsblog-selenskij-winter-li.3388192,0,www.sueddeutsche.de,Krieg in der Ukraine: Selenskij: „Wir haben den Winter überstanden“,"Der vierte Winter seit der russischen Invasion sei der schwierigste gewesen, sagt der ukrainische Präsident in einer Videoansprache. Russland habe die Ukraine vernichten wollen, doch sein Land habe nicht nachgegeben.",https://www.sueddeutsche.de/2026/03/02/35e589fd-6d8a-4cad-b0a5-ffb1d7bd8301.jpg?q=60&fm=webp&width=1200&rect=0%2C409%2C4000%2C2250,2026-03-02T08:16:00Z,,Die russische Armee hat sehr lange und verlustreich um die Stadt Pokrowsk im Osten der Ukraine gekämpft nun hat sie ihr Ziel offenbar erreicht. In der jüngsten Analyse des Institute for the Study of … [+1855 chars],,de,'Krieg'
https://www.tagesspiegel.de/wirtschaft/energie-iran-krieg-lasst-erdgas-preis-nach-oben-schnellen-15306580.html,https://www.tagesspiegel.de/wirtschaft/energie-iran-krieg-lasst-erdgas-preis-nach-oben-schnellen-15306580.html,0,www.tagesspiegel.de,Energie: Iran-Krieg lässt Erdgas-Preis nach oben schnellen,"Nach dem Angriff auf den Iran steigt der Erdgaspreis so stark wie lange nicht. Analysten warnen vor weiteren Preissprüngen, sollte der Konflikt andauern.",https://www.tagesspiegel.de/images/15306692/alternates/BASE_16_9_W1400/1772443754000/gasspeicher.jpeg,2026-03-02T08:28:21Z,,Der Großhandelspreis für Erdgas ist nach dem Angriff Israels und der USA auf den Iran kräftig gestiegen. Zum Handelsauftakt am Montag sprang die Notierung für den richtungweisenden Terminkontrakt TTF… [+2170 chars],,de,'Krieg'
https://www.bild.de/politik/ausland-und-internationales/iran-krieg-wadephul-schliesst-bundeswehr-beteiligung-aus-69a546564b8f567f12fcf0cf,https://www.bild.de/politik/ausland-und-internationales/iran-krieg-wadephul-schliesst-bundeswehr-beteiligung-aus-69a546564b8f567f12fcf0cf,0,www.bild.de,Trotz Beschuss von Bundeswehrsoldaten - Wadephul: Werden uns nicht am Iran-Krieg beteiligen,Iranische Angriffe gefährden Bundeswehrsoldaten in Jordanien und Irak. Johann Wadephul sieht Europa in Gefahr.,"https://images.bild.de/69a546564b8f567f12fcf0cf/2dce8864370c6149fda5c233d79878f3,59de46ca?w=1280",2026-03-02T08:47:34Z,,"TTS-Player überspringenArtikel weiterlesenBerlin  Deutliche Sätze von Johann Wadephul (CDU): Deutschland werde nicht an militärischen Aktionen gegen den Iran beteiligen, erklärt der Außenminister im … [+2177 chars]",,de,'Ukraine'
https://www.focus.de/politik/ausland/ploetzlicher-optimismus-aus-finnland-russland-gewinnt-diesen-krieg-nicht_2352cc05-4c65-4b69-af3d-a2c6c769f427.html,https://www.focus.de/politik/ausland/ploetzlicher-optimismus-aus-finnland-russland-gewinnt-diesen-krieg-nicht_2352cc05-4c65-4b69-af3d-a2c6c769f427.html,0,www.focus.de,"Plötzlicher Optimismus aus Finnland: ""Russland gewinnt diesen Krieg nicht""","Finnlands Präsident Stubb fordert Europa auf, das US-Narrativ über den Ukraine-Krieg zu korrigieren. Damit vollzieht er einen auffälligen Schwenk in seiner eigenen Rhetorik.",https://quadro.burda-forward.de/ctf/f7ee8a37-11e6-4f39-9a84-e0c25f760dee.9d3164e0-0f73-44ec-b323-d15ea4f48772.jpg?im=RegionOfInterestCrop%3D%281200%2C630%29%2CregionOfInterest%3D%282407%2C1172%29&hash=c904f55cd107b3bc9d97f162b6e21b43bb4bba4057d3e0a4e445474759d38d73,2026-03-02T09:15:00Z,,"Finnlands Präsident Alexander Stubb hat Europa aufgefordert, aktiv gegen die von der Trump-Regierung verbreitete Erzählung vorzugehen, die Ukraine könne den Krieg gegen Russland nicht gewinnen.  
In… [+1588 chars]",,de,'Ukraine'
https://www.stern.de/news/energie--iran-krieg-laesst-erdgas-preis-nach-oben-schnellen-37182588.html,https://www.stern.de/news/energie--iran-krieg-laesst-erdgas-preis-nach-oben-schnellen-37182588.html,0,www.stern.de,Energie: Iran-Krieg lässt Erdgas-Preis nach oben schnellen,"Nach dem Angriff auf den Iran steigt der Erdgaspreis so stark wie lange nicht. Analysten warnen vor weiteren Preissprüngen, sollte der Konflikt andauern.",https://image.stern.de/37182864/t/mZ/v1/w1440/r1.7778/-/02--zxcojjl6jov2axs2048jpeg---e622a9cf1f4362f3.jpg,2026-03-02T09:28:04Z,,"Kopiere den aktuellen Link
Zur Merkliste hinzufügen
Nach dem Angriff auf den Iran steigt der Erdgaspreis so stark wie lange nicht. Analysten warnen vor weiteren Preissprüngen, sollte der Konflikt a… [+2281 chars]",,de,'Energie'
https://www.n-tv.de/politik/Trump-provoziert-seinen-America-First-Fluegel-id30420123.html,https://www.n-tv.de/politik/Trump-provoziert-seinen-America-First-Fluegel-id30420123.html,0,www.n-tv.de,"Frieden zugesagt, Krieg gebracht: Trump provoziert seinen ""America First""-Flügel",Im Präsidentschaftswahlkampf verspricht Donald Trump den US-Amerikanern ein Ende von Kriegen. Doch allein seit Jahresbeginn sind die USA bereits in mehreren Ländern militärisch vorgegangen. Wie kommt das an?,https://www.n-tv.de/img/30420276/1772442951/Img_16_9/1200/A-protester-holds-placards-reading-No-Iran-war-during-a-demonstration-against-the-war-in-Iran-in-Chicago-Illinois-on-February-28-2026-The-US-and-Israel-launch-an-attack-of-unprecedented-scale-against-Iran-on-February-28-reportedly-killing-more-than-200-people-with-Tehran-launching-a-retaliatory-missile-barrage-that-sends-people-running-for-cover-across-the-Middle-East-Donald-Trump-announces-on-Truth-Social-that-Iran-s-supreme-leader-Ayatollah-Ali-Khamenei-is-killed-today.jpg,2026-03-02T09:45:29Z,,"Frieden zugesagt, Krieg gebrachtTrump provoziert seinen ""America First""-Flügel
Viele US-Demokraten wollen keinen Krieg gegen den Iran. Viele Wählerinnen und Wähler von Donald Trump auch nicht. (Foto… [+5851 chars]",,de,'Ukraine'
https://www.stern.de/news/spd-aussenpolitiker-zu-iran-krieg--regierung-muss-voelkerrechtsbruch-benennen-37182904.html,https://www.stern.de/news/spd-aussenpolitiker-zu-iran-krieg--regierung-muss-voelkerrechtsbruch-benennen-37182904.html,0,www.stern.de,SPD-Außenpolitiker zu Iran-Krieg: Regierung muss Völkerrechtsbruch benennen,"Nach den Angriffen Israels und der USA auf den Iran hat der SPD-Außenpolitiker Adis Ahmetovic die Bundesregierung zu einer klaren Haltung zum Völkerrecht gedrängt. ""Wenn man Völkerrechtsbrüche nicht benennt, führt man Völkerrecht ad absurdum und man sieht der…",https://image.stern.de/37182906/t/8f/v1/w1440/r1.7778/-/02--trauer-in-teheran---a2a880ec6b317ed7.jpg,2026-03-02T09:46:14Z,,"Kopiere den aktuellen Link
Zur Merkliste hinzufügen
Nach den Angriffen Israels und der USA auf den Iran hat der SPD-Außenpolitiker Adis Ahmetovic die Bundesregierung zu einer klaren Haltung zum Völ… [+2261 chars]",,de,'Ukraine'
https://www.focus.de/politik/ausland/ukraine-verfuegt-ueber-know-how-gegen-iranische-drohnen-und-will-es-mit-westen-teilen_76bbe0cd-087c-4c26-8dd6-06ffd137ba77.html,https://www.focus.de/politik/ausland/ukraine-verfuegt-ueber-know-how-gegen-iranische-drohnen-und-will-es-mit-westen-teilen_76bbe0cd-087c-4c26-8dd6-06ffd137ba77.html,0,www.focus.de,Ukraine verfügt über Know-How gegen iranische Drohnen - und will es mit Westen teilen,"Die Ukraine will ihre Luftabwehr-Erfahrung mit Verbündeten teilen, um gegen iranische Drohnen vorzugehen. Angesichts des eskalierenden Nahost-Konflikts verstärken auch europäische Länder ihre Verteidigung.",https://quadro.burda-forward.de/ctf/7e49c8c8-6c59-4227-b4e3-096d2b2665a6.1794610a-7309-49fc-b58d-6e97df65a063.jpg?im=RegionOfInterestCrop%3D%281200%2C630%29%2CregionOfInterest%3D%283160%2C1420%29&hash=85de2d88bfc1e6425da59ac4b8669bdb0c7c7239b14c17f2b105337ce58a1544,2026-03-02T10:54:00Z,,Der ukrainische Präsident Wolodymyr Selenskyj hat die Bedeutung der ukrainischen Luftabwehr hervorgehoben. Angesichts des eskalierenden Konflikts im Nahen Osten sei die Erfahrung seines Landes im Umg… [+1791 chars],,de,'Ukraine'
