index,url,valid,domain,title,description,image,published,archive,content,quote,language,keyword
https://www.tagesschau.de/newsticker/liveblog-ukraine-donnerstag-396.html,https://www.tagesschau.de/newsticker/liveblog-ukraine-donnerstag-396.html,0,www.tagesschau.de,Ukraine-Liveblog: ++ Mehrere Verletzte nach Angriff auf Charkiw ++,"Bei einem russischen Angriff auf Charkiw wurde ukrainischen Angaben zufolge ein mehrstöckiges Wohnhaus getroffen. In Russland sollen Angeklagte künftig der Strafverfolgung entgehen, wenn sie dem Militär beitreten. Die Entwicklungen im Liveblog.",https://images.tagesschau.de/image/5b073b67-29bf-4703-b6b1-71469e4c25bb/AAABjz78AfM/AAABkZLhkrw/16x9-1280/flagge-ukraine-truemmer-101.jpg,2024-10-03T00:15:55Z,https://web.archive.org/web/20241003010754/https://www.tagesschau.de/newsticker/liveblog-ukraine-donnerstag-396.html,"Stand: 03.10.2024 02:15 Uhr
Bei einem russischen Angriff auf Charkiw wurde ukrainischen Angaben zufolge ein mehrstöckiges Wohnhaus getroffen. In Russland sollen Angeklagte künftig der Strafverfolgun… [+1216 chars]",,de,'Wladimir Putin'
https://www.bild.de/politik/buergergeld-skandal-diese-sozialunterkunft-kostet-den-staat-25-mio-euro-pro-jahr-66fc0b7331ae523822215cca,https://www.bild.de/politik/buergergeld-skandal-diese-sozialunterkunft-kostet-den-staat-25-mio-euro-pro-jahr-66fc0b7331ae523822215cca,0,www.bild.de,Bürgergeld-Skandal - Diese Sozialunterkunft kostet im Jahr 25 Mio. Euro,Die Bereitstellung von Unterkünften für Flüchtlinge und Obdachlose ist ein einträgliches Geschäft! Bei den Recherchen zum Bürgergeld stieß BILD auf eine ...,"https://images.bild.de/66fc0b7331ae523822215cca/40d4722f2529e7f19a4baba28cffdb49,c75d2d7b?w=1280",2024-10-03T03:18:36Z,,"Die Bereitstellung von Unterkünften für Flüchtlinge und Obdachlose ist ein einträgliches Geschäft!
Bei den Recherchen zum Bürgergeld stieß BILD auf eine Gemeinschaftsunterkunft in Berlin-Spandau. 
… [+3080 chars]",,de,'Bürgergeld'
https://www.faz.net/aktuell/politik/ukraine/ukraine-liveticker-selenskyj-fordert-koalition-fuer-ukraine-wie-fuer-israel-faz-19030454.html,https://www.faz.net/aktuell/politik/ukraine/ukraine-liveticker-selenskyj-fordert-koalition-fuer-ukraine-wie-fuer-israel-faz-19030454.html,0,www.faz.net,Ukraine-Liveblog: Selenskyj fordert Koalition für Ukraine wie für Israel,Ukrainische Armee bestätigt Verlust von Wuhledar +++ Scholz an Putin: Ukraine-Unterstützung wird nicht nachlassen +++ Kreml reagiert kühl auf bevorstehendes Telefonat mit Scholz +++ alle Entwicklungen im Liveblog,https://media1.faz.net/ppmedia/aktuell/politik/886921886/1.10023921/facebook_teaser/wolodymyr-selenskyj-vergangene.jpg,2024-10-03T06:04:11Z,https://web.archive.org/web/20241003174509/https://www.faz.net/aktuell/politik/ukraine/ukraine-liveticker-selenskyj-fordert-koalition-fuer-ukraine-wie-fuer-israel-faz-19030454.html,Der ukrainische Verteidigungsminister Rustem Umjerow hat laut dpa drei seiner acht Stellvertreter und eine Staatssekretärin entlassen. Alle inneren Prozesse müssen klar und kontrolliert sein. Jeglich… [+613 chars],,de,'Ukraine'
https://t3n.de/news/alternativen-zu-klimaanlagen-wie-es-im-office-und-zuhause-energiesparender-kuehl-bleibt-1649399/,https://t3n.de/news/alternativen-zu-klimaanlagen-wie-es-im-office-und-zuhause-energiesparender-kuehl-bleibt-1649399/,0,t3n.de,Alternativen zu Klimaanlagen: Wie es im Office und Zuhause energiesparender kühl bleibt,"Die Sommer werden immer heißer. Der Energieverbrauch durch Klimaanlagen steigt. Dabei gibt es sparsame Alternativen, die sogar ohne Strom auskommen.weiterlesen auf t3n.de",https://t3n.de/news/wp-content/uploads/2024/10/015_paneele_vor_lueftungssystem_digital.jpg,2024-10-03T09:30:42Z,https://web.archive.org/web/20241003101840/https://t3n.de/news/alternativen-zu-klimaanlagen-wie-es-im-office-und-zuhause-energiesparender-kuehl-bleibt-1649399/,"2023 war das weltweit wärmste Jahr seit 1850. In Deutschland lagen die Temperaturen 2,4 Grad über dem Mittelwert von 1961 bis 1990. Der 21. Juli 2024 setzte einen weiteren Rekord mit der höchsten glo… [+6433 chars]",,de,'heizen'
https://www.bild.de/regional/frankfurt/frankfurt-verbietet-palaestinenser-demo-am-jahrestag-des-hamas-massakers-66fe6402d334b272aafaf2a6,https://www.bild.de/regional/frankfurt/frankfurt-verbietet-palaestinenser-demo-am-jahrestag-des-hamas-massakers-66fe6402d334b272aafaf2a6,0,www.bild.de,Hamas-Massaker am 7. Oktober - Frankfurt verbietet Hass-Demo gegen Israel,"Frankfurt untersagt eine Groß-Demo von Palästina-Aktivisten in der Innenstadt, um Juden-Hass und öffentliche Sicherheitsgefährdung zu verhindern.","https://images.bild.de/66fe6402d334b272aafaf2a6/0f87024be0a42634dad0c3a340a3c0f5,fac57aba?w=1280",2024-10-03T10:06:33Z,,Frankfurt/ Main In Berlin schreien Palästinenser Allahu Akbar (übersetzt: Gott ist groß) und jubeln über die Bomben des Iran auf Israel. Frankfurt aber will keinen Juden-Hass auf den Straßen dulden n… [+1503 chars],,de,'Sicherheit'
https://www.tagesspiegel.de/politik/um-sie-zu-stoppen-sind-wir-heute-hier-wagenknecht-bezeichnet-bei-demo-baerbock-als-sicherheitsrisiko-12477701.html,https://www.tagesspiegel.de/politik/um-sie-zu-stoppen-sind-wir-heute-hier-wagenknecht-bezeichnet-bei-demo-baerbock-als-sicherheitsrisiko-12477701.html,0,www.tagesspiegel.de,"„Um sie zu stoppen, sind wir heute hier“: Wagenknecht bezeichnet bei Demo Baerbock als „Sicherheitsrisiko“",Am Tag der Deutschen Einheit wird gegen den Krieg in der Ukraine und im Nahen Osten demonstriert. Alle aktuellen Entwicklungen zu diesem und weiteren Protesten finden Sie hier.,https://www.tagesspiegel.de/images/12479951/alternates/BASE_16_9_W1400/1727964569000/peace-demonstration.jpeg,2024-10-03T10:19:30Z,https://web.archive.org/web/20241003151021/https://www.tagesspiegel.de/politik/um-sie-zu-stoppen-sind-wir-heute-hier-wagenknecht-bezeichnet-bei-demo-baerbock-als-sicherheitsrisiko-12477701.html,"Das Bündnis Nie wieder Krieg hat bundesweit zu einer Demonstration am Tag der Einheit in Berlin aufgerufen. Die Teilnehmer wollen gegen die Stationierung von US-Raketen in Deutschland, gegen den Krie… [+18041 chars]",,de,'Krieg'
https://www.zeit.de/news/2024-10/03/ukraine-greift-russischen-militaerflugplatz-mit-drohnen-an,https://www.zeit.de/news/2024-10/03/ukraine-greift-russischen-militaerflugplatz-mit-drohnen-an,0,www.zeit.de,Drohnenkrieg: Ukraine greift russischen Militärflugplatz mit Drohnen an,Hier finden Sie Informationen zu dem Thema „Drohnenkrieg“. Lesen Sie jetzt „Ukraine greift russischen Militärflugplatz mit Drohnen an“.,https://img.zeit.de/news/2024-10/03/ukraine-greift-russischen-militaerflugplatz-mit-drohnen-an-image-group/wide__1300x731,2024-10-03T10:33:57Z,https://web.archive.org/web/20241004051232/https://www.zeit.de/news/2024-10/03/ukraine-greift-russischen-militaerflugplatz-mit-drohnen-an,"Ukrainische Kampfdrohnen haben in der Nacht zum Donnerstag den russischen Militärflughafen Borissoglebsk im Gebiet Woronesch angegriffen. Ziel seien dabei Arsenale mit Gleitbomben, Kampfjets des Typs… [+800 chars]",,de,'Ukraine'
https://taz.de/Krieg-in-der-Ukraine/!6040605/,https://taz.de/Krieg-in-der-Ukraine/!6040605/,0,taz.de,"Krieg in der Ukraine: „Wuhledar, das ist es gewesen“",Russische Truppen nehmen die Bergarbeiterstadt Wuhledar in der Ostukraine ein. Damit sichern sie sich auch eine wichtige Eisenbahnlinie.,https://taz.de/picture/7276296/948/0700-1.jpeg,2024-10-03T11:16:00Z,https://web.archive.org/web/20241003143632/https://taz.de/Krieg-in-der-Ukraine/!6040605/,"Russische Truppen nehmen die Bergarbeiterstadt Wuhledar in der Ostukraine ein. Damit sichern sie sich auch eine wichtige Eisenbahnlinie.
Ein zerstörtes Auto steht vor einem Wohnhaus in Wuhledar, das… [+3026 chars]",,de,'Saporischschja'
https://www.faz.net/aktuell/politik/ukraine/ukraine-liveticker-nato-chef-rutte-in-kiew-faz-19030454.html,https://www.faz.net/aktuell/politik/ukraine/ukraine-liveticker-nato-chef-rutte-in-kiew-faz-19030454.html,0,www.faz.net,Ukraine-Liveblog: Zwei Tage nach Amtsantritt – NATO-Chef Rutte in Kiew,Selenskyj fordert Koalition für Ukraine wie für Israel +++ Ukrainische Armee bestätigt Verlust von Wuhledar +++ Scholz an Putin: Ukraine-Unterstützung wird nicht nachlassen +++ alle Entwicklungen im Liveblog,https://media1.faz.net/ppmedia/aktuell/2296164778/1.10024323/facebook_teaser/rutte-und-selenskyj-schuetteln.jpg,2024-10-03T11:40:45Z,http://archive.md/20241003182157/https://www.faz.net/aktuell/politik/ukraine/ukraine-liveticker-nato-chef-rutte-in-kiew-faz-19030454.html,Zwei Tage nach seinem Amtsantritt ist der neue NATO-Generalsekretär Mark Rutte nach Kiew gereist. In der ukrainischen Hauptstadt bespricht Präsident Wolodymyr Selenskyj mit Rutte seinen angekündigten… [+481 chars],,de,'Unterstützung'
https://www.zeit.de/politik/ausland/2024-10/ukraine-mark-rutte-besuch-kiew-wolodymyr-selenskyj,https://www.zeit.de/politik/ausland/2024-10/ukraine-mark-rutte-besuch-kiew-wolodymyr-selenskyj,0,www.zeit.de,Ukraine: Neuer Nato-Generalsekretär Mark Rutte trifft Selenskyj in Kiew,"In Kiew sagte Mark Rutte, die Ukraine rücke immer näher an die Nato ran. Der ukrainische Präsident nannte die volle Mitgliedschaft im Bündnis sein wichtigstes Ziel.",https://img.zeit.de/politik/ausland/2024-10/mark-rutte-kiew-besuch-bild/wide__1300x731,2024-10-03T12:21:13Z,https://web.archive.org/web/20241003125528/https://www.zeit.de/politik/ausland/2024-10/ukraine-mark-rutte-besuch-kiew-wolodymyr-selenskyj,Der neue Nato-Generalsekretär Mark Rutte ist nur zwei Tage nach seinem Amtsantritt zu einem Besuch in der Ukraine eingetroffen. Die Menschen im Land müssten weiter in ihrem Krieg gegen Russland unter… [+2440 chars],,de,'Ukraine'
https://www.diepresse.com/18928425/ein-kalter-winter-und-schon-wird-das-gas-wieder-knapp,https://www.diepresse.com/18928425/ein-kalter-winter-und-schon-wird-das-gas-wieder-knapp,0,www.diepresse.com,Ein kalter Winter – und schon wird das Gas wieder knapp? [premium],"Energie. Die Temperaturen fallen, Asien kauft Europa das Flüssiggas weg und erste Warnungen vor einer neuen Gaskrise im Winter kursieren. Was ist da dran?",https://img.diepresse.com/public/incoming/7odagc-GAS-CONFERENCEPREVIEW/alternates/DPR_SOCIAL_NACHRICHTEN/GAS-CONFERENCEPREVIEW,2024-10-03T13:14:30Z,https://web.archive.org/web/20241003145519/https://www.diepresse.com/18928425/ein-kalter-winter-und-schon-wird-das-gas-wieder-knapp,"Energie. Die Temperaturen fallen, Asien kauft Europa das Flüssiggas weg und erste Warnungen vor einer neuen Gaskrise im Winter kursieren. Was ist da dran? 
Wien. Der rekordheiße Sommer in Europa end… [+786 chars]",,de,'Winter'
https://www.focus.de/politik/ausland/die-not-der-ukraine-ist-gross-wie-nie-und-zwar-in-allen-denkbaren-bereichen_7886b657-fd79-490d-83a1-068427a9e816.html,https://www.focus.de/politik/ausland/die-not-der-ukraine-ist-gross-wie-nie-und-zwar-in-allen-denkbaren-bereichen_7886b657-fd79-490d-83a1-068427a9e816.html,0,www.focus.de,Sorgen durch Krieg mit Russland - Die Not der Ukraine ist groß wie nie - und zwar in allen denkbaren Bereichen,"Die Ukraine hat enorme Probleme mit dem Krieg: Die Fortschritte der russischen Angreifer, die Müdigkeit seiner westlichen Verbündeten und die politischen Spaltungen im eigenen Land bringen das Land in heftige Schwierigkeiten.",https://quadro.burda-forward.de/ctf/23d779de-c851-4484-a86d-1d5e881e441f.480dc8c1-a970-462d-9a19-a334414a8113.png?im=RegionOfInterestCrop%3D%281200%2C630%29%2CregionOfInterest%3D%281010%2C516%29&hash=80b21ed18c9d00c80a8231b3bf324618c97dddeb17563d15f4ff270b3fcdb4da,2024-10-03T14:19:00Z,https://web.archive.org/web/20241003145617/https://www.focus.de/politik/ausland/die-not-der-ukraine-ist-gross-wie-nie-und-zwar-in-allen-denkbaren-bereichen_7886b657-fd79-490d-83a1-068427a9e816.html,"Russland kann nur zum Frieden gezwungen werden, sagte der ukrainische Präsident Wolodymyr Selenskyj diese Woche vor dem UN-Sicherheitsrat. Selenskyj hat auf seiner USA-Tournee die Großen und Mächtige… [+19364 chars]",,de,'Saporischschja'
https://www.zeit.de/news/2024-10/03/energieagentur-sieht-risiken-bei-gasversorgung-im-winter,https://www.zeit.de/news/2024-10/03/energieagentur-sieht-risiken-bei-gasversorgung-im-winter,0,www.zeit.de,Geopolitische Spannungen: Energieagentur sieht Risiken bei Gasversorgung im Winter,Hier finden Sie Informationen zu dem Thema „Geopolitische Spannungen“. Lesen Sie jetzt „Energieagentur sieht Risiken bei Gasversorgung im Winter“.,https://img.zeit.de/news/2024-10/03/energieagentur-sieht-risiken-bei-gasversorgung-im-winter-image-group/wide__1300x731,2024-10-03T14:57:35Z,,Der weltweit weiter steigende Gasverbrauch und geopolitische Spannungen könnten die Versorgung im anstehenden Winter nach Einschätzung der Internationalen Energieagentur (IEA) erschweren. Angetrieben… [+2872 chars],,de,'Versorgung'
https://www.zeit.de/news/2024-10/03/ukrainische-ruestungsschau-zu-kriegszeiten,https://www.zeit.de/news/2024-10/03/ukrainische-ruestungsschau-zu-kriegszeiten,0,www.zeit.de,Krieg in der Ukraine: Ukrainische Rüstungsschau zu Kriegszeiten,Hier finden Sie Informationen zu dem Thema „Krieg in der Ukraine“. Lesen Sie jetzt „Ukrainische Rüstungsschau zu Kriegszeiten“.,https://img.zeit.de/news/2024-10/03/ukrainische-ruestungsschau-zu-kriegszeiten-image-group/wide__1300x731,2024-10-03T16:26:21Z,https://web.archive.org/web/20241004050603/https://www.zeit.de/news/2024-10/03/ukrainische-ruestungsschau-zu-kriegszeiten,Das ukrainische Verteidigungsministerium sucht ausländische Investoren für die Rüstungsindustrie des Landes. Dazu wurde an einem nicht genannten Ort der Ukraine eine spezielle Rüstungsschau für Inter… [+2115 chars],,de,'Krieg'
https://www.faz.net/aktuell/politik/ukraine/ukraine-liveticker-neuer-nato-chef-rutte-bestaetigt-unterstuetzung-fuer-ukraine-faz-19030454.html,https://www.faz.net/aktuell/politik/ukraine/ukraine-liveticker-neuer-nato-chef-rutte-bestaetigt-unterstuetzung-fuer-ukraine-faz-19030454.html,0,www.faz.net,Ukraine-Liveblog: Neuer NATO-Chef Rutte bestätigt Unterstützung für Ukraine,Zwei Tage nach Amtsantritt – NATO-Chef Rutte in Kiew +++ Selenskyj fordert Koalition für Ukraine wie für Israel +++ Ukrainische Armee bestätigt Verlust von Wuhledar +++ alle Entwicklungen im Liveblog,https://media0.faz.net/ppmedia/aktuell/politik/3662990652/1.10025312/facebook_teaser/nato-generalsekretaer-mark.jpg,2024-10-03T18:23:42Z,https://web.archive.org/web/20241003182531/https://www.faz.net/aktuell/politik/ukraine/ukraine-liveticker-neuer-nato-chef-rutte-bestaetigt-unterstuetzung-fuer-ukraine-faz-19030454.html,Zwei Tage nach seinem Amtsantritt ist der neue NATO-Generalsekretär Mark Rutte nach Kiew gereist. In der ukrainischen Hauptstadt bespricht Präsident Wolodymyr Selenskyj mit Rutte seinen angekündigten… [+481 chars],,de,'Ukraine'
https://www.n-tv.de/politik/17-26-Krim-Bewohner-wegen-Verrats-zu-langer-Haftstrafe-verurteilt--article23143824.html,https://www.n-tv.de/politik/17-26-Krim-Bewohner-wegen-Verrats-zu-langer-Haftstrafe-verurteilt--article23143824.html,0,www.n-tv.de,"Ukraine-Krieg im Liveticker: +++ 17:26 Krim-Bewohner wegen ""Verrats"" zu langer Haftstrafe verurteilt +++",Lesen Sie alle aktuellen Entwicklungen und Nachrichten über den russischen Angriffskrieg auf die Ukraine im Liveticker von ntv.de.,https://bilder3.n-tv.de/img/incoming/crop25117070/4231326595-cImg_16_9-w1200/Ukraine-Liveticker.jpg,2024-10-03T22:30:00Z,https://web.archive.org/web/20241004154311/https://www.n-tv.de/politik/17-26-Krim-Bewohner-wegen-Verrats-zu-langer-Haftstrafe-verurteilt--article23143824.html,"Ein Gericht in Sewastopol auf der Krim hat einen Bewohner der von Russland annektierten ukrainischen Halbinsel wegen ""Verrats"" zu 14 Jahren ""Straflager unter schweren Bedingungen"" verurteilt. Dem 47-… [+24366 chars]",,de,'Ukraine'
https://www.n-tv.de/politik/21-10-Johnson-Wenn-Trump-Praesident-waere-haette-Putin-Krieg-nicht-gestartet--article23143824.html,https://www.n-tv.de/politik/21-10-Johnson-Wenn-Trump-Praesident-waere-haette-Putin-Krieg-nicht-gestartet--article23143824.html,0,www.n-tv.de,"Ukraine-Krieg im Liveticker: +++ 21:10 Johnson: Wenn Trump Präsident wäre, hätte Putin Krieg nicht gestartet +++",Lesen Sie alle aktuellen Entwicklungen und Nachrichten über den russischen Angriffskrieg auf die Ukraine im Liveticker von ntv.de.,https://bilder3.n-tv.de/img/incoming/crop25117070/4231326595-cImg_16_9-w1200/Ukraine-Liveticker.jpg,2024-10-03T22:30:00Z,https://web.archive.org/web/20241004192947/https://www.n-tv.de/politik/21-10-Johnson-Wenn-Trump-Praesident-waere-haette-Putin-Krieg-nicht-gestartet--article23143824.html,"Aus Sicht des früheren britischen Regierungschefs Boris Johnson ist es kein Zufall, dass Russland nicht in die Ukraine einmarschierte, während Donald Trump US-Präsident war. ""Einer der Vorzüge von Tr… [+29814 chars]",,de,'Ukraine'
https://www.n-tv.de/politik/15-49-Wagenknecht-und-Wadephul-loben-Woidke-Voigt-und-Kretschmer-fuer-Ukraine-Initiative--article23143824.html,https://www.n-tv.de/politik/15-49-Wagenknecht-und-Wadephul-loben-Woidke-Voigt-und-Kretschmer-fuer-Ukraine-Initiative--article23143824.html,0,www.n-tv.de,"Ukraine-Krieg im Liveticker: +++ 15:49 Wagenknecht und Wadephul loben Woidke, Voigt und Kretschmer für Ukraine-Initiative +++",Lesen Sie alle aktuellen Entwicklungen und Nachrichten über den russischen Angriffskrieg auf die Ukraine im Liveticker von ntv.de.,https://bilder3.n-tv.de/img/incoming/crop25117070/4231326595-cImg_16_9-w1200/Ukraine-Liveticker.jpg,2024-10-03T22:30:00Z,,"Während der gemeinsame Ukraine-Appell der Ministerpräsidenten von Sachsen und Brandenburg, Michael Kretschmer und Dietmar Woidke sowie des Thüringer CDU-Vorsitzenden Mario Voigt zur Ukraine-Politik ü… [+21633 chars]",,de,'Krieg'
https://www.n-tv.de/politik/16-00-Chersons-Gouverneur-Seniorin-von-russischer-Drohne-getoetet--article23143824.html,https://www.n-tv.de/politik/16-00-Chersons-Gouverneur-Seniorin-von-russischer-Drohne-getoetet--article23143824.html,0,www.n-tv.de,Ukraine-Krieg im Liveticker: +++ 16:00 Chersons Gouverneur: Seniorin von russischer Drohne getötet +++,Lesen Sie alle aktuellen Entwicklungen und Nachrichten über den russischen Angriffskrieg auf die Ukraine im Liveticker von ntv.de.,https://bilder3.n-tv.de/img/incoming/crop25117070/4231326595-cImg_16_9-w1200/Ukraine-Liveticker.jpg,2024-10-03T22:30:00Z,https://web.archive.org/web/20241004141040/https://www.n-tv.de/politik/16-00-Chersons-Gouverneur-Seniorin-von-russischer-Drohne-getoetet--article23143824.html,"Der Gouverneur der Region Cherson berichtet von einem zivilen Todesopfer. Eine 75-Jährige sei tödlich verletzt worden, als die russische Armee am frühen Nachmittag Cherson mit einer Drohne angegriffe… [+22006 chars]",,de,'Saporischschja'
https://www.n-tv.de/politik/20-03-Buergermeister-Russen-stehen-sieben-Kilometer-vor-Pokrowsk--article23143824.html,https://www.n-tv.de/politik/20-03-Buergermeister-Russen-stehen-sieben-Kilometer-vor-Pokrowsk--article23143824.html,0,www.n-tv.de,Ukraine-Krieg im Liveticker: +++ 20:03 Bürgermeister: Russen stehen sieben Kilometer vor Pokrowsk +++,Lesen Sie alle aktuellen Entwicklungen und Nachrichten über den russischen Angriffskrieg auf die Ukraine im Liveticker von ntv.de.,https://bilder3.n-tv.de/img/incoming/crop25117070/4231326595-cImg_16_9-w1200/Ukraine-Liveticker.jpg,2024-10-03T22:30:00Z,https://web.archive.org/web/20241004181712/https://www.n-tv.de/politik/20-03-Buergermeister-Russen-stehen-sieben-Kilometer-vor-Pokrowsk--article23143824.html,"Russische Truppen nähern sich, so wie es aussieht, weiter Pokrowsk. Diese seien sieben Kilometer vom Stadtrand entfernt, erklärt Bürgermeister Serhii Dobriak im ukrainischen Fernsehen. In den Wochen … [+28945 chars]",,de,'Krieg'
https://www.n-tv.de/politik/19-30-Selenskyj-zeichnet-in-Kursk-kaempfende-Soldaten-aus--article23143824.html,https://www.n-tv.de/politik/19-30-Selenskyj-zeichnet-in-Kursk-kaempfende-Soldaten-aus--article23143824.html,0,www.n-tv.de,Ukraine-Krieg im Liveticker: +++ 19:30 Selenskyj zeichnet in Kursk kämpfende Soldaten aus +++,Lesen Sie alle aktuellen Entwicklungen und Nachrichten über den russischen Angriffskrieg auf die Ukraine im Liveticker von ntv.de.,https://bilder3.n-tv.de/img/incoming/crop25117070/4231326595-cImg_16_9-w1200/Ukraine-Liveticker.jpg,2024-10-03T22:30:00Z,,"Der ukrainische Präsident Selenskyj besucht in der Grenzregion Sumy Soldaten, die an der Offensive in der russischen Region Kursk beteiligt sind. Ein Video zeigt, wie er in Begleitung des Oberbefehls… [+28107 chars]",,de,'Ukraine'
https://www.n-tv.de/politik/14-04-Kreml-Kiew-spielt-weiterhin-mit-dem-Feuer--article23143824.html,https://www.n-tv.de/politik/14-04-Kreml-Kiew-spielt-weiterhin-mit-dem-Feuer--article23143824.html,0,www.n-tv.de,"Ukraine-Krieg im Liveticker: +++ 14:04 Kreml: ""Kiew spielt weiterhin mit dem Feuer"" +++",Lesen Sie alle aktuellen Entwicklungen und Nachrichten über den russischen Angriffskrieg auf die Ukraine im Liveticker von ntv.de.,https://bilder3.n-tv.de/img/incoming/crop25117070/4231326595-cImg_16_9-w1200/Ukraine-Liveticker.jpg,2024-10-03T22:30:00Z,,"""Kiew spielt weiterhin mit dem Feuer, und wir werden die Vertreter der IAEO natürlich darauf aufmerksam machen"", sagt Kreml-Sprecher Dmitri Peskow so Reuters. Dabei bezieht er auf die Internationale … [+16831 chars]",,de,'Ukraine'
https://www.n-tv.de/politik/16-12-Ukraine-reklamiert-Brand-in-russischem-Ollager-fuer-sich--article23143824.html,https://www.n-tv.de/politik/16-12-Ukraine-reklamiert-Brand-in-russischem-Ollager-fuer-sich--article23143824.html,0,www.n-tv.de,Ukraine-Krieg im Liveticker: +++ 16:12 Ukraine reklamiert Brand in russischem Öllager für sich +++,Lesen Sie alle aktuellen Entwicklungen und Nachrichten über den russischen Angriffskrieg auf die Ukraine im Liveticker von ntv.de.,https://bilder3.n-tv.de/img/incoming/crop25117070/4231326595-cImg_16_9-w1200/Ukraine-Liveticker.jpg,2024-10-03T22:30:00Z,https://web.archive.org/web/20241004144028/https://www.n-tv.de/politik/16-12-Ukraine-reklamiert-Brand-in-russischem-Ollager-fuer-sich--article23143824.html,"Die Ukraine hat eigenen Angaben zufolge ein Öldepot in der russischen Region Woronesch mit Drohnen attackiert. ""Die gegnerische Luftabwehr war aktiv, aber erfolglos"", heißt es aus Kreisen des ukraini… [+22779 chars]",,de,'Krieg'
https://www.n-tv.de/politik/13-11-Ukraine-Anschlag-zerstoert-FSB-Zentrale-in-Nowosibirsk--article23143824.html,https://www.n-tv.de/politik/13-11-Ukraine-Anschlag-zerstoert-FSB-Zentrale-in-Nowosibirsk--article23143824.html,0,www.n-tv.de,Ukraine-Krieg im Liveticker: +++ 13:11 Ukraine: Anschlag zerstört FSB-Zentrale in Nowosibirsk +++,Lesen Sie alle aktuellen Entwicklungen und Nachrichten über den russischen Angriffskrieg auf die Ukraine im Liveticker von ntv.de.,https://bilder3.n-tv.de/img/incoming/crop25117070/4231326595-cImg_16_9-w1200/Ukraine-Liveticker.jpg,2024-10-03T22:30:00Z,https://web.archive.org/web/20241004112512/https://www.n-tv.de/politik/13-11-Ukraine-Anschlag-zerstoert-FSB-Zentrale-in-Nowosibirsk--article23143824.html,"Auf die Zentrale des russischen Inlandsgeheimdienstes FSB in Nowosibirsk wird am 3. Oktober ein Brandanschlag verübt. Ein Video des ukrainischen Militärgeheimdienstes soll nun zeigen, wie ein Mann da… [+15260 chars]",,de,'Ukraine'
https://www.n-tv.de/politik/15-30-Ukraine-Appell-von-Ost-Politikern-stoesst-auf-Kritik-Werte-werden-fuer-Machterhalt-auf-Ramschtisch-verscherbelt--article23143824.html,https://www.n-tv.de/politik/15-30-Ukraine-Appell-von-Ost-Politikern-stoesst-auf-Kritik-Werte-werden-fuer-Machterhalt-auf-Ramschtisch-verscherbelt--article23143824.html,0,www.n-tv.de,"Ukraine-Krieg im Liveticker: +++ 15:30 Ukraine-Appell von Ost-Politikern stößt auf Kritik: ""Werte werden für Machterhalt auf Ramschtisch verscherbelt"" +++",Lesen Sie alle aktuellen Entwicklungen und Nachrichten über den russischen Angriffskrieg auf die Ukraine im Liveticker von ntv.de.,https://bilder3.n-tv.de/img/incoming/crop25117070/4231326595-cImg_16_9-w1200/Ukraine-Liveticker.jpg,2024-10-03T22:30:00Z,,"CDU-Chef Friedrich Merz kritisiert die Forderung führender Politiker aus dem Osten nach stärkeren Bemühungen um eine diplomatische Lösung im Krieg zwischen Russland und der Ukraine. ""Die Ukraine kämp… [+20442 chars]",,de,'Saporischschja'
https://www.n-tv.de/politik/23-55-Oppositionelle-in-Belarus-wegen-Sabotageangriff-verurteilt-teilweise-25-Jahre-Haft--article23143824.html,https://www.n-tv.de/politik/23-55-Oppositionelle-in-Belarus-wegen-Sabotageangriff-verurteilt-teilweise-25-Jahre-Haft--article23143824.html,0,www.n-tv.de,Ukraine-Krieg im Liveticker: +++ 23:55 Oppositionelle in Belarus wegen Sabotageangriff verurteilt - teilweise 25 Jahre Haft +++,Lesen Sie alle aktuellen Entwicklungen und Nachrichten über den russischen Angriffskrieg auf die Ukraine im Liveticker von ntv.de.,https://bilder3.n-tv.de/img/incoming/crop25117070/4231326595-cImg_16_9-w1200/Ukraine-Liveticker.jpg,2024-10-03T22:30:00Z,,"Ein Gericht in Belarus hat zwölf Oppositionelle verurteilt, die für einen Sabotageangriff auf ein russisches Militärflugzeug im Februar 2023 verantwortlich sein sollen. Wegen ihrer Beteiligung an dem… [+32035 chars]",,de,'Krieg'
