index,url,valid,domain,title,description,image,published,archive,content,quote,language,keyword
https://www.faz.net/aktuell/politik/ukraine-liveticker-spd-politiker-rufen-scholz-zu-friedensinitiative-auf-faz-18495964.html,https://www.faz.net/aktuell/politik/ukraine-liveticker-spd-politiker-rufen-scholz-zu-friedensinitiative-auf-faz-18495964.html,0,www.faz.net,Ukraine-Liveblog: SPD-Politiker rufen Scholz zu Friedensinitiative auf,Selenskyj erinnert zum Jahrestag an die Opfer in Butscha +++ Russland erklärt Westen zu „existenzieller Bedrohung“ +++ Moskau verabschiedet neue außenpolitische Strategie +++ alle Entwicklungen im Liveblog,https://media1.faz.net/ppmedia/aktuell/345610297/1.8793381/facebook_teaser/ukrainische-soldaten-bei.jpg,2023-04-01T03:10:53Z,,Der frühere Chef des Deutschen Gewerkschaftsbunds (DGB) Reiner Hoffmann und weitere SPD-Politiker haben in einem von der Frankfurter Rundschau veröffentlichten Aufruf zu einer Friedensinitiative für … [+1105 chars],,de,'Olaf Scholz'
https://www.stern.de/wirtschaft/news/ampel-plaene--kritik-an-einbauverbot-neuer-gas--und-oelheizungen--33338732.html,https://www.stern.de/wirtschaft/news/ampel-plaene--kritik-an-einbauverbot-neuer-gas--und-oelheizungen--33338732.html,0,www.stern.de,Ampel-Pläne: Kritik an Einbauverbot neuer Gas- und Ölheizungen,Die schlimmsten Befürchtungen von Hausbesitzern für das künftige Heizen treten nun doch nicht ein. Die Ampel-Koalition hat ihre Pläne für ein Verbot des Einbaus neuer Gas- und Ölheizungen modifiziert.,https://image.stern.de/33338734/t/p4/v1/w1440/r1.7778/-/01--urnnewsmldpacom2009010123040199169091v3w800h600l768t66r2475b1388jpeg---cb5cd4b5dd5db8c0.jpg,2023-04-01T03:38:23Z,https://web.archive.org/web/20230401044536/https://www.stern.de/wirtschaft/news/ampel-plaene--kritik-an-einbauverbot-neuer-gas--und-oelheizungen--33338732.html,Die schlimmsten Befürchtungen von Hausbesitzern für das künftige Heizen treten nun doch nicht ein. Die Ampel-Koalition hat ihre Pläne für ein Verbot des Einbaus neuer Gas- und Ölheizungen modifiziert… [+3964 chars],,de,'Gas'
https://www.morgenpost.de/wirtschaft/article238047209/Kritik-an-Einbauverbot-neuer-Gas-und-Oelheizungen.html,https://www.morgenpost.de/wirtschaft/article238047209/Kritik-an-Einbauverbot-neuer-Gas-und-Oelheizungen.html,0,www.morgenpost.de,Ampel-Pläne: Kritik an Einbauverbot neuer Gas- und Ölheizungen,Die schlimmsten Befürchtungen von Hausbesitzern für das künftige Heizen treten nun doch nicht ein. Die Ampel-Koalition hat ihre Pläne für ein Verbot des Einbaus neuer Gas- und Ölheizungen modifiziert.,https://img.morgenpost.de/img/wirtschaft/crop238047207/6122603456-w820-cv16_9-q85/Gasheizung.jpg,2023-04-01T03:38:23Z,https://web.archive.org/web/20230401101403/https://www.morgenpost.de/wirtschaft/article238047209/Kritik-an-Einbauverbot-neuer-Gas-und-Oelheizungen.html,Berlin. Trotz der geplanten Ausnahme- und Übergangsregelungen für das Einbauverbot neuer Gas- und Ölheizungen ab Anfang 2024 kommt von der Opposition weiter Kritik am Vorhaben der Ampel-Koalition. De… [+3751 chars],,de,'frieren'
https://www.tagesschau.de/newsticker/liveblog-ukraine-samstag-261.html,https://www.tagesschau.de/newsticker/liveblog-ukraine-samstag-261.html,0,www.tagesschau.de,Liveblog: + Pistorius: Ausrüstungslücken bleiben noch +,Laut Verteidigungsminister Pistorius sind die Lücken bei der Versorgung der Bundeswehr nicht schnell zu schließen. Mehrere SPD-Politiker haben Kanzler Scholz zu einer Ukraine-Friedensinitiative aufgerufen. Alle Entwicklungen im Liveblog.,https://www.tagesschau.de/multimedia/bilder/boris-pistorius-stellungnahme-101~_v-original.jpg,2023-04-01T05:31:34Z,,Laut Verteidigungsminister Pistorius sind die Lücken bei der Versorgung der Bundeswehr nicht schnell zu schließen. Mehrere SPD-Politiker haben Kanzler Scholz zu einer Ukraine-Friedensinitiative aufge… [+1877 chars],,de,'Olaf Scholz'
https://www.tagesschau.de/ausland/europa/usa-russland-atomwaffen-103.html,https://www.tagesschau.de/ausland/europa/usa-russland-atomwaffen-103.html,0,www.tagesschau.de,UN-Sicherheitsrat: Putins Atompläne sorgen für Streit,"Russlands Präsident Putin hatte kürzlich angekündigt, Atomwaffen in Belarus stationieren zu wollen. Darüber gibt es im UN-Sicherheitsrat jetzt Streit mit den USA. Selbst China sieht Moskaus Pläne offenbar kritisch.",https://www.tagesschau.de/multimedia/bilder/un-sicherheitsrat-283~_v-original.jpg,2023-04-01T06:41:28Z,,"Russlands Präsident Putin hatte kürzlich angekündigt, Atomwaffen in Belarus stationieren zu wollen. Darüber gibt es im UN-Sicherheitsrat jetzt Streit mit den USA. Selbst China sieht Moskaus Pläne off… [+2497 chars]",,de,'Wladimir Putin'
https://www.zeit.de/news/2023-04/01/pauschale-bislang-fuer-etwa-24-000-studierende-bewilligt,https://www.zeit.de/news/2023-04/01/pauschale-bislang-fuer-etwa-24-000-studierende-bewilligt,0,www.zeit.de,Energie: Pauschale bislang für etwa 24.000 Studierende bewilligt,,,2023-04-01T07:33:52Z,,"When browsing with ads:
We collect personal data and also transmit it to third-party providers
 that help us improve and finance our digital content. Some of the information stored on your device, … [+732 chars]",,de,'Energie'
https://www.faz.net/aktuell/faz-kongress-zwischen-den-zeilen/f-a-z-kongress-2023-harald-schmidt-als-pausenclown-18793559.html,https://www.faz.net/aktuell/faz-kongress-zwischen-den-zeilen/f-a-z-kongress-2023-harald-schmidt-als-pausenclown-18793559.html,0,www.faz.net,Harald Schmidt als „Pausenclown“ auf dem F.A.Z.-Kongress 2023 über das aktuelle Politgeschehen,"Weil Bundeskanzler Olaf Scholz erst mit Verspätung eintraf, sprang Harald Schmidt auf dem F.A.Z.-Kongress kurzerhand als „Pausenclown“ ein. Mit Reinhard Müller sprach er launig über das aktuelle Politgeschehen.",https://media1.faz.net/ppmedia/aktuell/1598212744/1.8793575/article_multimedia_overview/4a9ad120-cfce-11ed-adfd.jpg,2023-04-01T07:44:59Z,,"Harald Schmidt als Pausenclown auf dem F.A.Z.-Kongress 2023 über das aktuelle Politgeschehen
Schmidt auf F.A.Z.-Kongress
Ein glühender Royalist
Von Weil Bundeskanzler Olaf Scholz erst mit Verspätu… [+225 chars]",,de,'Olaf Scholz'
https://www.wiwo.de/politik/deutschland/ampel-plaene-opposition-kritisiert-einbauverbot-neuer-gas-und-oelheizungen/29073438.html,https://www.wiwo.de/politik/deutschland/ampel-plaene-opposition-kritisiert-einbauverbot-neuer-gas-und-oelheizungen/29073438.html,0,www.wiwo.de,Ampel-Pläne: Opposition kritisiert Einbauverbot neuer Gas- und Ölheizungen,Die schlimmsten Befürchtungen von Hausbesitzern für das künftige Heizen treten nun doch nicht ein. Die Ampel-Koalition hat ihre Pläne für ein Verbot des Einbaus neuer Gas- und Ölheizungen modifiziert.,https://www.wiwo.de/images/gasheizung/29073436/2-format11240.jpg,2023-04-01T08:10:57Z,https://web.archive.org/web/20230401202207/https://www.wiwo.de/politik/deutschland/ampel-plaene-opposition-kritisiert-einbauverbot-neuer-gas-und-oelheizungen/29073438.html,Trotz der geplanten Ausnahme- und Übergangsregelungen für das Einbauverbot neuer Gas- und Ölheizungen ab Anfang 2024 kommt von der Opposition weiter Kritik am Vorhaben der Ampel-Koalition. Der klimas… [+4447 chars],,de,'frieren'
https://www.welt.de/politik/deutschland/article244607432/Ampel-Plan-CDU-sieht-viele-offene-Fragen-beim-Heizungseinbau-Verbot.html,https://www.welt.de/politik/deutschland/article244607432/Ampel-Plan-CDU-sieht-viele-offene-Fragen-beim-Heizungseinbau-Verbot.html,0,www.welt.de,CDU sieht viele offene Fragen beim Heizungseinbau-Verbot,"Vieles am Kompromiss der Ampel zum Einbauverbot neuer Gas- und Ölheizungen sei weiter unklar, kritisiert nicht nur CDU-Vize Andreas Jung. Zum Beispiel welche Unterstützung es speziell für finanzschwache Haushalte gebe.",https://img.welt.de/img/regionales/thueringen/mobile243619707/5151355817-ci16x9-w1200/Bundestag.jpg,2023-04-01T08:45:09Z,https://web.archive.org/web/20230401095640/https://www.welt.de/politik/deutschland/article244607432/Ampel-Plan-CDU-sieht-viele-offene-Fragen-beim-Heizungseinbau-Verbot.html,Trotz der geplanten Ausnahme- und Übergangsregelungen für das Einbauverbot neuer Gas- und Ölheizungen ab Anfang 2024 kommt von der Opposition weiter Kritik am Vorhaben der Ampel-Koalition. Der klimas… [+4438 chars],,de,'frieren'
https://www.faz.net/aktuell/politik/ukraine-liveticker-london-russische-winteroffensive-ist-gescheitert-faz-18495964.html,https://www.faz.net/aktuell/politik/ukraine-liveticker-london-russische-winteroffensive-ist-gescheitert-faz-18495964.html,0,www.faz.net,Ukraine-Liveblog: London: Russische Winteroffensive ist gescheitert,Streit um Höhlenkloster – Haus von Klostervorsteher durchsucht +++ SPD-Politiker rufen Scholz zu Friedensinitiative auf +++ Russland erklärt Westen zu „existenzieller Bedrohung“ +++ alle Entwicklungen im Liveblog,https://media1.faz.net/ppmedia/aktuell/politik/591983595/1.8790191/facebook_teaser/ukrainischer-soldat-in-der.jpg,2023-04-01T10:26:07Z,,Der frühere Chef des Deutschen Gewerkschaftsbunds (DGB) Reiner Hoffmann und weitere SPD-Politiker haben in einem von der Frankfurter Rundschau veröffentlichten Aufruf zu einer Friedensinitiative für … [+1105 chars],,de,'Winter'
https://www.tagesschau.de/inland/friedensinitiative-ukraine-101.html,https://www.tagesschau.de/inland/friedensinitiative-ukraine-101.html,0,www.tagesschau.de,SPD-Politiker rufen Scholz zu Ukraine-Friedensinitiative auf,"Zahlreiche Sozialdemokraten und Gewerkschafter haben Kanzler Scholz aufgerufen, sich für Friedensverhandlungen in der Ukraine einzusetzen. Initiator des Aufrufs ist der Historiker Peter Brandt, Sohn des früheren Kanzlers Willy Brandt.",https://www.tagesschau.de/multimedia/bilder/peter-brandt-101~_v-original.jpg,2023-04-01T11:24:32Z,,"Zahlreiche Sozialdemokraten und Gewerkschafter haben Kanzler Scholz aufgerufen, sich für Friedensverhandlungen in der Ukraine einzusetzen. Initiator des Aufrufs ist der Historiker Peter Brandt, Sohn … [+1889 chars]",,de,'Olaf Scholz'
https://www.sueddeutsche.de/wirtschaft/gasheizung-oelheizung-alternativen-ausnahmen-1.5779848,https://www.sueddeutsche.de/wirtschaft/gasheizung-oelheizung-alternativen-ausnahmen-1.5779848,0,www.sueddeutsche.de,Heizung mit erneuerbarer Energie: Was Hausbesitzer jetzt wissen müssen,Der Heizungsstreit ist beigelegt: Nächstes Jahr dürfen keine reinen Gas- und Ölheizungen mehr eingebaut werden. Kommt jetzt die Wärmepumpe für alle? Welche Ausnahmen gelten? Fragen und Antworten zum Ampel-Kompromiss.,https://www.sueddeutsche.de/image/sz.1.5779849/1200x675?v=1680350794,2023-04-01T12:02:15Z,http://archive.md/20230401124613/https://www.sueddeutsche.de/wirtschaft/gasheizung-oelheizung-alternativen-ausnahmen-1.5779848,Der Heizungsstreit ist beigelegt: Nächstes Jahr dürfen keine reinen Gas- und Ölheizungen mehr eingebaut werden. Kommt jetzt die Wärmepumpe für alle? Welche Ausnahmen gelten? Fragen und Antworten zum … [+5277 chars],,de,'Gas'
https://www.tagesschau.de/inland/heizung-einigung-opposition-kritik-101.html,https://www.tagesschau.de/inland/heizung-einigung-opposition-kritik-101.html,0,www.tagesschau.de,Opposition kritisiert Pläne zu Öl- und Gasheizungen,"Die Ampel-Regierung will Hausbesitzer beim Umrüsten auf klimafreundliche Heizungen unterstützen. Doch die Opposition sieht die Pläne skeptisch. Unklar sei, wie der Umbau bezahlt werden soll - von einem ""Verarmungsprogramm"" ist gar die Rede.",https://www.tagesschau.de/multimedia/bilder/gasheizung-107~_v-original.jpg,2023-04-01T12:04:22Z,https://web.archive.org/web/20230401122527/https://www.tagesschau.de/inland/heizung-einigung-opposition-kritik-101.html,"Die Ampel-Regierung will Hausbesitzer beim Umrüsten auf klimafreundliche Heizungen unterstützen. Doch die Opposition sieht die Pläne skeptisch. Unklar sei, wie der Umbau bezahlt werden soll - von ein… [+5816 chars]",,de,'frieren'
https://www.zeit.de/news/2023-04/02/heizungsfoerderung-koennte-sich-an-altgeraet-zustand-ausrichten,https://www.zeit.de/news/2023-04/02/heizungsfoerderung-koennte-sich-an-altgeraet-zustand-ausrichten,0,www.zeit.de,Energie: Heizungsförderung könnte sich an Altgerät-Zustand ausrichten,,,2023-04-01T22:50:31Z,,"When browsing with ads:
We collect personal data and also transmit it to third-party providers
 that help us improve and finance our digital content. Some of the information stored on your device, … [+732 chars]",,de,'Energie'
https://www.faz.net/aktuell/politik/ukraine-liveticker-ukrainischer-botschafter-nennt-friedensappell-zynisch-faz-18495964.html,https://www.faz.net/aktuell/politik/ukraine-liveticker-ukrainischer-botschafter-nennt-friedensappell-zynisch-faz-18495964.html,0,www.faz.net,Ukraine-Liveblog: Ukrainischer Botschafter nennt Friedensappell zynisch,60 Tage Hausarrest für Abt des Kiewer Höhlenklosters +++ London: Russische Winteroffensive ist gescheitert +++ Ukraine bestellt in Polen 100 neue Radschützenpanzer +++ alle Entwicklungen im Liveblog,https://media1.faz.net/ppmedia/aktuell/politik/3801325337/1.8794541/facebook_teaser/oleksii-makeiev-botschafter.jpg,2023-04-02T03:10:52Z,https://web.archive.org/web/20230402052832/https://www.faz.net/aktuell/politik/ukraine-liveticker-ukrainischer-botschafter-nennt-friedensappell-zynisch-faz-18495964.html,"Er habe nur eins zum Ziel: Die Verbrechen Russlands und dementsprechend die Verantwortung des russischen Regimes zu verschleiern, sagte Makeiev der Deutschen Presse-Agentur. Angesichts des brutalen r… [+1027 chars]",,de,'Winter'
https://www.n-tv.de/politik/Lindner-erteilt-Kindergrundsicherung-Absage-article24028850.html,https://www.n-tv.de/politik/Lindner-erteilt-Kindergrundsicherung-Absage-article24028850.html,0,www.n-tv.de,Grüne widersprechen: Lindner erteilt Kindergrundsicherung Absage,Mit der Kindergrundsicherung soll die Unterstützung von Familien einfacher und wirkungsvoller werden. Finanzminister Lindner hält die Kosten aber für zu hoch und will andere Prioritäten setzen. Die Grünen widersprechen vehement.,https://bilder4.n-tv.de/img/incoming/crop23871255/1641323119-cImg_16_9-w1200/Knapp-2-9-Millionen-Kinder-und-Jugendliche-waren-laut-Bertelsmann-Stiftung-2021-bundesweit-von-Armut-bedroht-das-entspricht-einem-Anteil-von-20-8-Prozent.jpg,2023-04-02T11:20:51Z,,Mit der Kindergrundsicherung soll die Unterstützung von Familien einfacher und wirkungsvoller werden. Finanzminister Lindner hält die Kosten aber für zu hoch und will andere Prioritäten setzen. Die G… [+2483 chars],,de,'Unterstützung'
https://taz.de/Voelkermord-im-Bosnien-Krieg/!5921516/,https://taz.de/Voelkermord-im-Bosnien-Krieg/!5921516/,0,taz.de,Völkermord im Bosnien-Krieg: Genozid bleibt Genozid,"Auf dem Balkan gibt es eine Unkultur, Kriegsverbrechen zu verherrlichen. Der deutsche Hohe Repräsentant für Bosnien enttäuscht in seiner Amtsführung.",https://taz.de/picture/6182867/948/32505473-1.jpeg,2023-04-02T11:33:00Z,,"Auf dem Balkan gibt es eine Unkultur, Kriegsverbrechen zu verherrlichen. Der deutsche Hohe Repräsentant für Bosnien enttäuscht in seiner Amtsführung.
Christian Schmidt, der Hoher Repräsentant für Bo… [+5867 chars]",,de,'Unterstützung'
https://www.morgenpost.de/politik/ausland/article238054525/Kritik-der-Ukraine-an-Friedensappell-senile-Idee.html,https://www.morgenpost.de/politik/ausland/article238054525/Kritik-der-Ukraine-an-Friedensappell-senile-Idee.html,0,www.morgenpost.de,Empörung: Kritik der Ukraine an Friedensappell - „senile Idee“,Einen schnellen Waffenstillstand in der Ukraine und Friedenssondierungen mit Russland - das fordern viele ehemalige SPD-Politiker und Gewerkschaftsbosse. Auf ukrainischer Seite sorgt das für Empörung.,https://img.morgenpost.de/img/ausland/crop238054521/3272607466-w820-cv16_9-q85/Andrij-Melnyk.jpg,2023-04-02T11:39:14Z,,Berlin. Die Ukraine hat einen Friedensappell namhafter deutscher Sozialdemokraten und Gewerkschafter zur raschen Beendigung des russischen Angriffskrieges scharf zurückgewiesen. Schert euch zum Teufe… [+2848 chars],,de,'Ukraine'
https://www.n-tv.de/politik/Melnyk-wuenscht-Friedensappell-Unterzeichner-zum-Teufel-article24029003.html,https://www.n-tv.de/politik/Melnyk-wuenscht-Friedensappell-Unterzeichner-zum-Teufel-article24029003.html,0,www.n-tv.de,"""Senile Idee"": Melnyk wünscht Friedensappell-Unterzeichner zum Teufel",Einst führende Sozialdemokraten und Gewerkschafter bekräftigen ihre Forderung nach Friedensverhandlungen für die Ukraine. Scholz solle gemeinsam mit anderen Ländern einen schnellen Waffenstillstand erreichen. Der ukrainische Botschafter und sein Vorgänger hal…,https://bilder3.n-tv.de/img/incoming/crop24029018/5671324054-cImg_16_9-w1200/294706241.jpg,2023-04-02T12:59:33Z,,Einst führende Sozialdemokraten und Gewerkschafter bekräftigen ihre Forderung nach Friedensverhandlungen für die Ukraine. Scholz solle gemeinsam mit anderen Ländern einen schnellen Waffenstillstand e… [+2913 chars],,de,'Unterstützung'
https://www.tagesschau.de/ausland/europa/tschechien-spenden-waffen-101.html,https://www.tagesschau.de/ausland/europa/tschechien-spenden-waffen-101.html,0,www.tagesschau.de,Tschechen spenden für Ukraine-Waffenhilfe,"Ein tschechisches Crowdfunding-Projekt sammelt Geld für Waffenlieferungen an die Ukraine. Damit wurden bereits Panzer, Raketenwerfer und Drohnen gekauft. Als Nächstes wollen die Tschechen einen Hubschrauber spenden. <em>Von Danko Handrick.</em>",https://www.tagesschau.de/multimedia/bilder/dedek-101~_v-original.jpg,2023-04-02T13:22:45Z,,"Ein tschechisches Crowdfunding-Projekt sammelt Geld für Waffenlieferungen an die Ukraine. Damit wurden bereits Panzer, Raketenwerfer und Drohnen gekauft. Als Nächstes wollen die Tschechen einen Hubsc… [+4129 chars]",,de,'Unterstützung'
https://www.nzz.ch/wirtschaft/gehen-in-der-schweizer-stahl-und-aluminiumindustrie-bald-die-oefen-aus-ld.1732879,https://www.nzz.ch/wirtschaft/gehen-in-der-schweizer-stahl-und-aluminiumindustrie-bald-die-oefen-aus-ld.1732879,0,www.nzz.ch,Gehen in der Schweizer Stahl- und Aluminiumindustrie bald die Öfen aus?,"Betriebe, die besonders viel Energie benötigen, bangen um ihre Existenz. Die Belastung ist wegen der noch immer stark gestiegenen Kosten für Strom und Erdgas derart gross, dass Unternehmen wie der Aluminiumkonzern Novelis nach staatlicher Unterstützung rufen.","https://img.nzz.ch/2023/04/02/32690585-a715-424f-879f-90705ada6cc8.jpeg?width=1200&height=675&fit=bound&quality=75&auto=webp&crop=3500,1969,x0,y147&wmark=nzz",2023-04-02T14:00:40Z,,"Novelis produziert in Siders Bänder aus Aluminium vorab für die britische Autoindustrie. Dieser Prozess ist energieintensiv.
Die Fabrik von Stahl Gerlafingen ist eines von zwei verbliebenen Stahlwer… [+7157 chars]",,de,'Unterstützung'
https://www.stern.de/politik/ausland/empoerung--kritik-der-ukraine-an-friedensappell---senile-idee--33341436.html,https://www.stern.de/politik/ausland/empoerung--kritik-der-ukraine-an-friedensappell---senile-idee--33341436.html,0,www.stern.de,"Empörung: Kritik der Ukraine an Friedensappell: ""Senile Idee""",Einen schnellen Waffenstillstand in der Ukraine und Friedenssondierungen mit Russland - das fordern viele ehemalige SPD-Politiker und Gewerkschaftsbosse. Auf ukrainischer Seite sorgt das für Empörung.,https://image.stern.de/33342128/t/hW/v1/w1440/r1.7778/-/03--urnnewsmldpacom2009010123040299182458v4w800h600l665t184r1768b1037jpeg---f5283c862bed453f.jpg,2023-04-02T14:02:32Z,,Einen schnellen Waffenstillstand in der Ukraine und Friedenssondierungen mit Russland - das fordern viele ehemalige SPD-Politiker und Gewerkschaftsbosse. Auf ukrainischer Seite sorgt das für Empörung… [+2988 chars],,de,'Ukraine'
https://www.welt.de/politik/ausland/plus244567524/Sicherheitspolitik-So-gut-wie-jetzt-werden-wir-es-in-diesem-neuen-Kalten-Krieg-nicht-mehr-haben.html,https://www.welt.de/politik/ausland/plus244567524/Sicherheitspolitik-So-gut-wie-jetzt-werden-wir-es-in-diesem-neuen-Kalten-Krieg-nicht-mehr-haben.html,0,www.welt.de,„So gut wie jetzt werden wir es in diesem neuen Kalten Krieg nicht mehr haben“,"China und Russland zeigen sich im Ukraine-Krieg als Partner. Noch liefert Peking jedoch keine Waffen. Das hat einen Grund, sagt China-Experte Thorsten Benner. Im Interview erklärt er, wann sich das ändern könnte und in welchem Feld sich Deutschland schon wied…",https://img.welt.de/img/politik/ausland/mobile244568480/2421357077-ci16x9-w1200-fnov-fpotl-fpi157750653/Russian-President-Vladimir-Putin-an.jpg,2023-04-02T14:17:41Z,,"WELT: Noch scheint China bei der Lieferung von Waffen an Russland zu zögern. Warum?
Benner: Peking zögert, weil die Kosten für diesen Schritt enorm hoch wären. Umfassende Waffenlieferungen an Russla… [+642 chars]",,de,'Ukraine'
https://www.welt.de/politik/ausland/article244576178/Waffenlieferungen-Der-Ukraine-laeuft-die-Zeit-fuer-eine-Gegenoffensive-davon.html,https://www.welt.de/politik/ausland/article244576178/Waffenlieferungen-Der-Ukraine-laeuft-die-Zeit-fuer-eine-Gegenoffensive-davon.html,0,www.welt.de,Der Ukraine läuft die Zeit für eine Gegenoffensive davon,"Die Leopard-Panzer sind in der Ukraine angekommen. Experten spekulieren bereits, wo die Gegenoffensive starten könnte – und wann. Doch dafür braucht Kiew weitere Waffenlieferungen, die auch bereits zugesagt sind. Doch lange kann das Land nicht mehr warten. Mo…",https://img.welt.de/img/politik/ausland/mobile244617126/8421353487-ci16x9-w1200/Ukrainian-Air-Defense-Teams-Receive-Donated-Pickups.jpg,2023-04-02T14:50:38Z,,Auf der Ramstein-Konferenz im Januar waren sich Minister und Militärs einig: Die nächsten Monate sind für den Erfolg einer ukrainischen Gegenoffensive von entscheidender Bedeutung. Der US-Verteidigun… [+7978 chars],,de,'Unterstützung'
https://www.tagesschau.de/ausland/europa/ukraine-habeck-101.html,https://www.tagesschau.de/ausland/europa/ukraine-habeck-101.html,0,www.tagesschau.de,Habeck besucht überraschend Ukraine,"Vizekanzler Habeck ist in die Ukraine gereist. Der Grünen-Politiker kam am Morgen mit dem Zug in der Hauptstadt Kiew an. Eine Delegation deutscher Wirtschaftsvertreter begleitet ihn. Er komme nicht mit leeren Händen, versicherte er.",https://www.tagesschau.de/multimedia/bilder/habeck-kiew-101~_v-original.jpg,2023-04-03T04:55:43Z,http://archive.md/20230403113919/https://www.tagesschau.de/ausland/europa/ukraine-habeck-101.html,Vizekanzler Habeck ist in die Ukraine gereist. Der Grünen-Politiker kam am Morgen mit dem Zug in der Hauptstadt Kiew an. Eine Delegation deutscher Wirtschaftsvertreter begleitet ihn. Er komme nicht m… [+1973 chars],,de,'Ukraine'
https://www.welt.de/politik/ausland/article244626618/Ukraine-News-Klitschko-Lieber-leben-wir-ohne-Wasser-und-ohne-Strom-als-mit-russischen-Soldaten.html,https://www.welt.de/politik/ausland/article244626618/Ukraine-News-Klitschko-Lieber-leben-wir-ohne-Wasser-und-ohne-Strom-als-mit-russischen-Soldaten.html,0,www.welt.de,„Lieber leben wir ohne Wasser und ohne Strom als mit russischen Soldaten“,"Bei einem Besuch in Hamburg weist Vitali Klitschko darauf hin, wie wichtig eine Verteidigung der Ukraine gegen Russland auch für Deutschland ist. „Wir kämpfen für unsere europäische Zukunft“, sagte Klitschko. Derweil zeigen sich Widersprüche bei den Aussagen …",https://img.welt.de/img/regionales/hamburg/mobile244628910/8821357507-ci16x9-w1200/Vitali-Klitschko.jpg,2023-04-03T10:46:00Z,https://web.archive.org/web/20230403143008/https://www.welt.de/politik/ausland/article244626618/Ukraine-News-Klitschko-Lieber-leben-wir-ohne-Wasser-und-ohne-Strom-als-mit-russischen-Soldaten.html,Der russische Angriff auf die Ukraine betrifft nach Ansicht von Kiews Bürgermeister Vitali Klitschko Deutschland direkt. Russlands Präsident Wladimir Putin wolle die ehemalige Sowjetunion wiederherst… [+12814 chars],,de,'Ukraine'
https://www.stern.de/gesellschaft/regional/hamburg-schleswig-holstein/ukraine-krieg--klitschko--russlands-krieg-betrifft-deutschland-direkt-33343048.html,https://www.stern.de/gesellschaft/regional/hamburg-schleswig-holstein/ukraine-krieg--klitschko--russlands-krieg-betrifft-deutschland-direkt-33343048.html,0,www.stern.de,Ukraine-Krieg: Klitschko: Russlands Krieg betrifft Deutschland direkt,"Kiews Bürgermeister Klitschko warnt Deutschland, der russische Angriff auf sein Land betreffe die Bundesrepublik direkt. Hamburgs Bürgermeister Tschentscher sichert der Ukraine weiter Hilfe zu, will auch nach Kiew reisen.",https://image.stern.de/33343050/t/C_/v2/w1440/r1.7778/-/03--urnnewsmldpacom2009010123040399191897v2w800h600l1548t954r4548b2954jpeg---648a5dd05204f8d4.jpg,2023-04-03T12:15:00Z,https://web.archive.org/web/20230403153819/https://www.stern.de/gesellschaft/regional/hamburg-schleswig-holstein/ukraine-krieg--klitschko--russlands-krieg-betrifft-deutschland-direkt-33343048.html,"Kiews Bürgermeister Klitschko warnt Deutschland, der russische Angriff auf sein Land betreffe die Bundesrepublik direkt. Hamburgs Bürgermeister Tschentscher sichert der Ukraine weiter Hilfe zu, will … [+3376 chars]",,de,'Krieg'
