index,url,valid,domain,title,description,image,published,archive,content,quote,language,keyword
https://www.spiegel.de/ausland/news-zum-russland-ukraine-krieg-das-geschah-in-der-nacht-zu-donnerstag-1-dezember-a-37d0dfd2-70a8-4138-bd82-d22f511f4fcc,https://www.spiegel.de/ausland/news-zum-russland-ukraine-krieg-das-geschah-in-der-nacht-zu-donnerstag-1-dezember-a-37d0dfd2-70a8-4138-bd82-d22f511f4fcc,0,www.spiegel.de,News zum Russland-Ukraine-Krieg: Das geschah in der Nacht zu Donnerstag (1. Dezember),Kiew bedankt sich bei Deutschland für die Anerkennung des Holodomor als Völkermord. Russland hat einen militärischen Satelliten in die Umlaufbahn gebracht. Und: Aufregung im Vatikan. Die wichtigsten Entwicklungen.,https://cdn.prod.www.spiegel.de/images/6b78fb11-b204-4874-bf6d-78341e73753d_w1280_r1.77_fpx48.66_fpy54.99.jpg,2022-12-01T03:53:09Z,,"Mit großer Mehrheit hatten die Abgeordneten in Berlin einen gemeinsamen Antrag von Ampel-Koalition und Unionsfraktion, in dem von einem »menschenverachtenden Verbrechen« die Rede ist, gebilligt.
Das… [+1460 chars]",,de,'Unterstützung'
https://www.nzz.ch/feuilleton/alice-schwarzer-alice-schwarzer-das-schlachtfeld-ist-wieder-der-koerper-ld.1714473,https://www.nzz.ch/feuilleton/alice-schwarzer-alice-schwarzer-das-schlachtfeld-ist-wieder-der-koerper-ld.1714473,0,www.nzz.ch,"INTERVIEW - Alice Schwarzer: «Das Schlachtfeld ist wieder der Körper: Die Frauen müssen dünn sein, perfekt, Botox spritzen. Immer ist unser Körper falsch und muss verändert werden»","Alice Schwarzer, kämpferisch wie eh und je, wird achtzig. Das Selbstbestimmungsgesetz, sagt sie, gefährde vor allem die Mädchen. Die Vereinbarkeit von Kindern und Karriere sei ein Märchen. Und die Waffenlieferungen an die Ukraine würde sie gerne ganz verbiete…","https://img.nzz.ch/2022/11/29/a9440826-1877-4f5b-8909-d2d124491136.jpeg?width=1200&height=675&fit=bound&quality=75&auto=webp&crop=4951,2785,x0,y529&wmark=nzz",2022-12-01T04:30:00Z,,"«Ich meine, die Menschen sollen endlich befreit werden von diesen Geschlechterrollen»: Alice Schwarzer.
Alice Schwarzer, die «Bild» titelte einmal über Sie: «Die Hexe mit dem stechenden Blick durch … [+20992 chars]",,de,'Ukraine'
https://www.zeit.de/news/2022-12/01/oekonom-bei-buergergeld-weiterbildungs-regelung-schwachpunkt,https://www.zeit.de/news/2022-12/01/oekonom-bei-buergergeld-weiterbildungs-regelung-schwachpunkt,0,www.zeit.de,Arbeitsmarkt: Ökonom: Bei Bürgergeld Weiterbildungs-Regelung Schwachpunkt,,,2022-12-01T04:33:17Z,https://web.archive.org/web/20221202021155/https://www.zeit.de/news/2022-12/01/oekonom-bei-buergergeld-weiterbildungs-regelung-schwachpunkt,"When browsing with ads:
We collect personal data and also transmit it to third-party providers
 that help us improve and finance our digital content. Some of the information stored on your device, … [+732 chars]",,de,'Bürgergeld'
https://www.stern.de/politik/deutschland/jahresrueckblick-mit-robert-habeck---es-ist-kein-froehliches-regieren--32961438.html,https://www.stern.de/politik/deutschland/jahresrueckblick-mit-robert-habeck---es-ist-kein-froehliches-regieren--32961438.html,0,www.stern.de,"Wirtschaftsminister: ""Es ist kein fröhliches Regieren"" – wie Robert Habeck auf das Jahr 2022 zurückblickt","Krieg, Inflation, Gasmangel. Wirtschaftsminister Robert Habeck über sein schwieriges erstes Jahr im Amt und seinen trotz allem optimistischen Blick in die Zukunft.",https://image.stern.de/32963084/t/8a/v4/w1440/r1.7778/-/robert-habeck-portra-t.jpg,2022-12-01T05:05:00Z,https://web.archive.org/web/20221201052038/https://www.stern.de/politik/deutschland/jahresrueckblick-mit-robert-habeck---es-ist-kein-froehliches-regieren--32961438.html,"Krieg, Inflation, Gasmangel. Wirtschaftsminister Robert Habeck über sein schwieriges erstes Jahr im Amt und seinen trotz allem optimistischen Blick in die Zukunft.
Neulich in Singapur wurde Robert H… [+682 chars]",,de,'Gas'
https://www.zeit.de/news/2022-12/01/umfrage-unterstuetzung-fuer-ukraine-leicht-zurueckgegangen,https://www.zeit.de/news/2022-12/01/umfrage-unterstuetzung-fuer-ukraine-leicht-zurueckgegangen,0,www.zeit.de,Krieg: Umfrage: Unterstützung für Ukraine leicht zurückgegangen,,,2022-12-01T05:05:07Z,https://web.archive.org/web/20221201052048/https://www.zeit.de/news/2022-12/01/umfrage-unterstuetzung-fuer-ukraine-leicht-zurueckgegangen,"When browsing with ads:
We collect personal data and also transmit it to third-party providers
 that help us improve and finance our digital content. Some of the information stored on your device, … [+732 chars]",,de,'Krieg'
https://www.stern.de/gesellschaft/regional/niedersachsen-bremen/energie--lng-terminal--alle-pipeline-rohre-in-wilhelmshaven-im-boden-32966176.html,https://www.stern.de/gesellschaft/regional/niedersachsen-bremen/energie--lng-terminal--alle-pipeline-rohre-in-wilhelmshaven-im-boden-32966176.html,0,www.stern.de,Energie: LNG-Terminal: Alle Pipeline-Rohre in Wilhelmshaven im Boden,"Mit einem schwimmenden Importterminal soll bis Ende des Jahres in Wilhelmshaven Flüssigerdgas angelandet werden. Um das Gas weiter zu transportieren, ist eine neue Pipeline nötig. Die Bauarbeiten nähern sich dem Abschluss.",https://image.stern.de/32966178/t/KV/v1/w1440/r1.7778/-/01--urnnewsmldpacom2009010122120199733543v2w800h600l1397t866r3780b2686jpeg---8634e0eef761b96f.jpg,2022-12-01T05:38:19Z,https://web.archive.org/web/20221201062314/https://www.stern.de/gesellschaft/regional/niedersachsen-bremen/energie--lng-terminal--alle-pipeline-rohre-in-wilhelmshaven-im-boden-32966176.html,"Mit einem schwimmenden Importterminal soll bis Ende des Jahres in Wilhelmshaven Flüssigerdgas angelandet werden. Um das Gas weiter zu transportieren, ist eine neue Pipeline nötig. Die Bauarbeiten näh… [+2215 chars]",,de,'Import'
https://www.zeit.de/news/2022-12/01/lng-terminal-alle-pipeline-rohre-in-wilhelmshaven-im-boden,https://www.zeit.de/news/2022-12/01/lng-terminal-alle-pipeline-rohre-in-wilhelmshaven-im-boden,0,www.zeit.de,Energie: LNG-Terminal: Alle Pipeline-Rohre in Wilhelmshaven im Boden,,,2022-12-01T05:38:19Z,https://web.archive.org/web/20221201062209/https://www.zeit.de/news/2022-12/01/lng-terminal-alle-pipeline-rohre-in-wilhelmshaven-im-boden,"When browsing with ads:
We collect personal data and also transmit it to third-party providers
 that help us improve and finance our digital content. Some of the information stored on your device, … [+732 chars]",,de,'Energie'
https://www.spiegel.de/ausland/china-xi-jinping-bekraeftigt-politische-loesung-fuer-ende-des-kriegs-in-der-ukraine-a-e0857aa8-b621-47f7-8058-4dc700ee9519,https://www.spiegel.de/ausland/china-xi-jinping-bekraeftigt-politische-loesung-fuer-ende-des-kriegs-in-der-ukraine-a-e0857aa8-b621-47f7-8058-4dc700ee9519,0,www.spiegel.de,China: Xi Jinping bekräftigt politische Lösung für Ende des Kriegs in der Ukraine,Chinas Staatspräsident hat erneut vor einer weiteren Eskalation des Ukrainekriegs gewarnt. Klare Kritik an Moskau äußerte Xi jedoch nicht. EU-Ratspräsident Michel wurde dagegen deutlicher.,https://cdn.prod.www.spiegel.de/images/ac8ec487-fe33-48a4-ada0-ac12a31894d9_w1280_r1.77_fpx47_fpy51.jpg,2022-12-01T09:59:21Z,https://web.archive.org/web/20221201101538/https://www.spiegel.de/ausland/china-xi-jinping-bekraeftigt-politische-loesung-fuer-ende-des-kriegs-in-der-ukraine-a-e0857aa8-b621-47f7-8058-4dc700ee9519,Chinas Staats- und Parteichef Xi Jinping drängt auf eine Lösung des Kriegs in der Ukraine mit »politischen Mitteln«. Bei einem Besuch von EU-Ratspräsident Charles Michel in Peking sagte Xi laut dem c… [+2346 chars],,de,'Kreml'
https://www.spiegel.de/wirtschaft/wirtschaft-veraergert-ueber-china-papier-aus-habecks-ministerium-a-a5284bec-83e4-4224-b098-cbf9582061a7,https://www.spiegel.de/wirtschaft/wirtschaft-veraergert-ueber-china-papier-aus-habecks-ministerium-a-a5284bec-83e4-4224-b098-cbf9582061a7,0,www.spiegel.de,Wirtschaft verärgert über China-Papier aus Habecks Ministerium,Wirtschaftsminister Robert Habeck will die Abhängigkeit deutscher Unternehmen von China verringern. Die Industrie- und Handelskammern finden seine Sicht allerdings als allzu einseitig – zudem komme die Debatte zur Unzeit.,https://cdn.prod.www.spiegel.de/images/8880cbc6-4541-4730-aeed-aafcac84b072_w1280_r1.77_fpx32.77_fpy49.98.jpg,2022-12-01T13:17:20Z,https://web.archive.org/web/20221201135400/https://www.spiegel.de/wirtschaft/wirtschaft-veraergert-ueber-china-papier-aus-habecks-ministerium-a-a5284bec-83e4-4224-b098-cbf9582061a7,"Auslöser ist ein Bericht des Nachrichtenportals »Pioneer« über ein China-Papier des Wirtschaftsministeriums, in dem von neuen Auflagen für Unternehmen im China-Geschäft die Rede ist. »Gerüchte über e… [+343 chars]",,de,'Industrie'
https://www.welt.de/regionales/nrw/article242433079/Kliniken-am-Limit-Versorgung-von-Kindern-ist-nicht-mehr-gesichert.html,https://www.welt.de/regionales/nrw/article242433079/Kliniken-am-Limit-Versorgung-von-Kindern-ist-nicht-mehr-gesichert.html,0,www.welt.de,„Die ambulante und stationäre Versorgung ist für Kinder nicht mehr gesichert“,Die Kinderkrankenhäuser in Nordrhein-Westfalen schlagen Alarm: Zwei heftige Krankheitswellen sorgen für volle Betten und überlastetes Personal. In Düsseldorf sei man zum Teil „maximal ausgelastet“ und die Situation „maximal angespannt.“,https://img.welt.de/img/regionales/nrw/mobile242433977/7431350127-ci16x9-w1200/RS-Virus-Patienten-in-der-Kinderklinik.jpg,2022-12-01T13:22:13Z,https://web.archive.org/web/20221202010410/http://www.welt.de/regionales/nrw/article242433079/Kliniken-am-Limit-Versorgung-von-Kindern-ist-nicht-mehr-gesichert.html,"Viele Kinderkliniken in Nordrhein-Westfalen klagen über eine starke Belastung aufgrund vermehrter Lungen-Erkrankungen bei Kindern. Derzeit seien zwei Erkrankungswellen feststellbar, sagte der Spreche… [+3639 chars]",,de,'Versorgung'
https://www.faz.net/aktuell/wirtschaft/der-unerschuetterliche-18420231.html,https://www.faz.net/aktuell/wirtschaft/der-unerschuetterliche-18420231.html,0,www.faz.net,"Valerij Garmasch, Unternehmer im Krieg","Valerij Garmasch betrieb vor dem Kriegsausbruch in der Ost-Ukraine ein Webportal. Hier erzählt er, wie er seine Firma in den sicheren Westen des Landes brachte.",https://media0.faz.net/ppmedia/aktuell/1339920796/1.8420230/facebook_teaser/wir-fliehen-nicht-wir-fahren.jpg,2022-12-01T13:22:14Z,https://web.archive.org/web/20221201133940/https://www.faz.net/aktuell/wirtschaft/der-unerschuetterliche-18420231.html,Wie der Krieg für mich begonnen hat? Am 23. Februar blieben wir noch lange wach. Erst um zwei oder drei Uhr nachts legte ich mich schlafen. Am frühen Morgen wurden wir von Explosionen geweckt. Wir ha… [+3140 chars],,de,'Krieg'
https://www.zeit.de/news/2022-12/01/pipeline-bau-bei-mittelbrunn-und-klingenmuenster-genehmigt,https://www.zeit.de/news/2022-12/01/pipeline-bau-bei-mittelbrunn-und-klingenmuenster-genehmigt,0,www.zeit.de,Energie: Pipeline-Bau bei Mittelbrunn und Klingenmünster genehmigt,,,2022-12-01T13:45:25Z,https://web.archive.org/web/20221201140508/https://www.zeit.de/news/2022-12/01/pipeline-bau-bei-mittelbrunn-und-klingenmuenster-genehmigt,"When browsing with ads:
We collect personal data and also transmit it to third-party providers
 that help us improve and finance our digital content. Some of the information stored on your device, … [+732 chars]",,de,'Energie'
https://www.tagesschau.de/inland/gesellschaft/energiekosten-dezemberhilfe-101.html,https://www.tagesschau.de/inland/gesellschaft/energiekosten-dezemberhilfe-101.html,0,www.tagesschau.de,Dezemberhilfen werden ab sofort an Energieversorger gezahlt,Im Dezember übernimmt der Bund die Abschlagszahlungen für  Gas- und Fernwärmekunden. Sie müssen dafür nichts tun. Unternehmen müssen Anträge stellen - 75 Prozent der Energieversorger haben das bisher getan.,https://www.tagesschau.de/multimedia/bilder/bilderstrecke-winter-113~_v-original.jpg,2022-12-01T14:02:44Z,https://web.archive.org/web/20221201143722/https://www.tagesschau.de/inland/gesellschaft/energiekosten-dezemberhilfe-101.html,Im Dezember übernimmt der Bund die Abschlagszahlungen für Gas- und Fernwärmekunden. Sie müssen dafür nichts tun. Unternehmen müssen Anträge stellen - 75 Prozent der Energieversorger haben das bisher … [+1167 chars],,de,'Energie'
https://www.welt.de/wirtschaft/article242434167/Kampf-mit-hoher-Inflation-Russische-Behoerden-erhoehen-Preise-fuer-Gas-und-Strom.html,https://www.welt.de/wirtschaft/article242434167/Kampf-mit-hoher-Inflation-Russische-Behoerden-erhoehen-Preise-fuer-Gas-und-Strom.html,0,www.welt.de,Russische Behörden erhöhen Preise für Gas und Strom,"In Russland werden die Energiepreise für die Bürger erhöht. Die Hoffnung, dass Gas durch weniger Exporte auf dem Binnenmarkt billiger wird, hat sich nicht erfüllt. Die russischen Bürger kämpfen seit Kriegsbeginn mit einer zweistelligen Inflationsrate. Bei 43 …",https://img.welt.de/img/newsticker/dpa_nt/infoline_nt/wirtschaft_nt/mobile242426997/0651353337-ci16x9-w1200/Moskau.jpg,2022-12-01T14:14:04Z,https://web.archive.org/web/20221201174526/https://www.welt.de/wirtschaft/article242434167/Kampf-mit-hoher-Inflation-Russische-Behoerden-erhoehen-Preise-fuer-Gas-und-Strom.html,Die russischen Behörden heizen die Inflation im eigenen Land durch die Anhebung der staatlich regulierten Nebenkostentarife deutlich an. Die Preise für Gas steigen nach Medienangaben vom Donnerstag u… [+1303 chars],,de,'Krieg'
https://www.tagesschau.de/wirtschaft/verbraucher/stromausfall-brownout-energiekrise-netz-101.html,https://www.tagesschau.de/wirtschaft/verbraucher/stromausfall-brownout-energiekrise-netz-101.html,0,www.tagesschau.de,"Gezielte Stromabschaltungen: Was passiert beim ""Brownout""?","Netzbetreiber schließen nicht aus, dass sie bei Engpässen im Winter stundenweise einzelne Stadtviertel vom Stromnetz nehmen müssen. Für diesen Fall gibt es konkrete Szenarien. <em>Von Michael Heussen</em>.",https://www.tagesschau.de/multimedia/bilder/stromausfall-121~_v-original.jpg,2022-12-01T14:44:48Z,https://web.archive.org/web/20221201153851/https://www.tagesschau.de/wirtschaft/verbraucher/stromausfall-brownout-energiekrise-netz-101.html,"Netzbetreiber schließen nicht aus, dass sie bei Engpässen im Winter stundenweise einzelne Stadtviertel vom Stromnetz nehmen müssen. Für diesen Fall gibt es konkrete Szenarien.
Von außen sieht der St… [+4486 chars]",,de,'heizen'
https://www.spiegel.de/wirtschaft/f35-kampfjets-sollen-bundesregierung-knapp-zehn-milliarden-euro-kosten-a-f2db3cf3-3bfa-4b7b-a9af-25579ee80ab3,https://www.spiegel.de/wirtschaft/f35-kampfjets-sollen-bundesregierung-knapp-zehn-milliarden-euro-kosten-a-f2db3cf3-3bfa-4b7b-a9af-25579ee80ab3,0,www.spiegel.de,F35-Kampfjets sollen Bundesregierung knapp zehn Milliarden Euro kosten,"Noch in diesem Jahr will Olaf Scholz den Auftrag für US-Kampfflugzeuge vom Typ F35A vergeben. Nach SPIEGEL-Informationen soll der Deal rund 9,99 Milliarden Euro kosten – und ist mit erheblichen Risiken verbunden.",https://cdn.prod.www.spiegel.de/images/57fef019-a895-4363-9d28-4832ea720047_w1280_r1.77_fpx54.66_fpy50.jpg,2022-12-01T15:02:02Z,https://web.archive.org/web/20221201153949/https://www.spiegel.de/wirtschaft/f35-kampfjets-sollen-bundesregierung-knapp-zehn-milliarden-euro-kosten-a-f2db3cf3-3bfa-4b7b-a9af-25579ee80ab3,"Mehr Perspektiven, mehr verstehen.
Freier Zugang zu allen Artikeln, Videos, Audioinhalten und Podcasts
<ul><li>
Alle Artikel auf SPIEGEL.de frei zugänglich
</li><li>
DER SPIEGEL als E-Paper und … [+743 chars]",,de,'Olaf Scholz'
https://www.spiegel.de/wirtschaft/unternehmen/credit-suisse-muss-wohl-noch-schneller-sparen-a-14ae8cb4-aa41-4ffe-b61e-4d7c27d0a619,https://www.spiegel.de/wirtschaft/unternehmen/credit-suisse-muss-wohl-noch-schneller-sparen-a-14ae8cb4-aa41-4ffe-b61e-4d7c27d0a619,0,www.spiegel.de,Credit Suisse muss wohl noch schneller sparen,Die Credit Suisse lotet offenbar eine Beschleunigung ihres Sparprogramms aus. Das berichtet die Nachrichtenagentur Reuters unter Berufung auf Insider.,https://cdn.prod.www.spiegel.de/images/3962c5fd-dfc8-44ab-ae14-8fc8df619ffe_w1280_r1.77_fpx70_fpy54.99.jpg,2022-12-01T15:50:01Z,,"Abflüsse von Kundengeldern und die branchenweite Abkühlung des Geschäfts dämpften die Ertragsaussichten für das Geschäft, hieß es. Entsprechend seien Manager der Schweizer Großbank angehalten worden,… [+1878 chars]",,de,'sparen'
https://www.zeit.de/politik/ausland/2022-12/olaf-scholz-treffen-jens-stoltenberg-pk,https://www.zeit.de/politik/ausland/2022-12/olaf-scholz-treffen-jens-stoltenberg-pk,0,www.zeit.de,Ukraine-Krieg: Olaf Scholz will Fehler bei Munitionsversorgung beheben,"Bundeskanzler Scholz hat bei einem Treffen mit dem Nato-Generalsekretär Fehler bei der Munitionsversorgung eingeräumt. Deutschland sei dabei, Missstände zu beseitigen.",,2022-12-01T16:38:50Z,https://web.archive.org/web/20221201170829/https://www.zeit.de/politik/ausland/2022-12/olaf-scholz-treffen-jens-stoltenberg-pk,"When browsing with ads:
We collect personal data and also transmit it to third-party providers
 that help us improve and finance our digital content. Some of the information stored on your device, … [+732 chars]",,de,'Ukraine'
https://www.spiegel.de/wirtschaft/soziales/schwedt-deutschland-und-polen-sichern-versorgung-von-raffinerie-a-22293f98-1015-4b66-820e-5f09d30c4cc3,https://www.spiegel.de/wirtschaft/soziales/schwedt-deutschland-und-polen-sichern-versorgung-von-raffinerie-a-22293f98-1015-4b66-820e-5f09d30c4cc3,0,www.spiegel.de,Schwedt: Deutschland und Polen sichern Versorgung von Raffinerie,Polen hat erstmals Rohöl-Lieferungen über Danzig in die Raffinerie im brandenburgischen Schwedt zugesagt. Die Versorgung soll so auch ohne Öl aus der russischen Druschba-Pipeline sicher bleiben.,https://cdn.prod.www.spiegel.de/images/babf63b2-3cc8-4a91-b432-b32fd6449d5d_w1280_r1.77_fpx68.15_fpy45.jpg,2022-12-01T17:13:48Z,https://web.archive.org/web/20221201173117/https://www.spiegel.de/wirtschaft/soziales/schwedt-deutschland-und-polen-sichern-versorgung-von-raffinerie-a-22293f98-1015-4b66-820e-5f09d30c4cc3,"Deutschland will ab Ende des Jahres kein russisches Öl mehr verarbeiten und benötigt daher Ersatz für das Öl aus der Druschba-Pipeline. Schwedt ist derzeit unter deutscher Treuhandverwaltung, gehört … [+352 chars]",,de,'Pipeline'
https://www.zeit.de/wirtschaft/2022-12/energieversorgung-polen-rohoel-lieferungen-deutschland,https://www.zeit.de/wirtschaft/2022-12/energieversorgung-polen-rohoel-lieferungen-deutschland,0,www.zeit.de,Energieversorgung: Polen sagt Öllieferungen über Danzig nach Deutschland zu,Bisher wurde die PCK-Raffinerie im brandenburgischen Schwedt mit russischem Öl aus der Druschba-Pipeline versorgt. Künftig soll Polen den Standort beliefern.,,2022-12-01T17:32:27Z,https://web.archive.org/web/20221201180652/https://www.zeit.de/wirtschaft/2022-12/energieversorgung-polen-rohoel-lieferungen-deutschland,"When browsing with ads:
We collect personal data and also transmit it to third-party providers
 that help us improve and finance our digital content. Some of the information stored on your device, … [+732 chars]",,de,'Pipeline'
https://www.manager-magazin.de/politik/europa/raffinerie-schwedt-deutschland-und-polen-wollen-die-oelversorgung-sichern-a-6e331250-1df6-4d68-86c1-2d3ed104e858,https://www.manager-magazin.de/politik/europa/raffinerie-schwedt-deutschland-und-polen-wollen-die-oelversorgung-sichern-a-6e331250-1df6-4d68-86c1-2d3ed104e858,0,www.manager-magazin.de,Raffinerie Schwedt: Deutschland und Polen wollen die Ölversorgung sichern,Die weitere Versorgung der Raffinerie Schwedt soll durch eine Kooperation deutscher und polnischer Ölunternehmen gewährleistet werden. Polen hat zu diesem Zweck erstmals Rohöllieferungen über Danzig nach Schwedt zugesagt.,https://cdn.prod.www.manager-magazin.de/images/def9a6c1-5b92-4ff4-9a58-0c083269e0c5_w1280_r1.77_fpx66.11_fpy50.jpg,2022-12-01T18:05:20Z,https://web.archive.org/web/20221201185303/https://www.manager-magazin.de/politik/europa/raffinerie-schwedt-deutschland-und-polen-wollen-die-oelversorgung-sichern-a-6e331250-1df6-4d68-86c1-2d3ed104e858,Polen hat Deutschland dabei nach Angaben von Insidern aus beiden Ländern unter Druck gesetzt und auch eine Enteignung des russischen Eigentümers Rosneft nahegelegt. In der gemeinsamen Erklärung heißt… [+768 chars],,de,'Versorgung'
"https://winfuture.de/news,133326.html","https://winfuture.de/news,133326.html",0,winfuture.de,Greenpeace findet Auffälligkeiten rund um die Nord Stream 1-Explosion,Regierungen und Behörden liefern bisher nur wenige Details zum Sabotageakt auf die Nord Stream-Pipelines. Jetzt hat die Umweltschutzorganisation Greenpeace eine eigene Expedition gestartet und rund um die Explosionsstelle Auffälligkeiten beobachtet.(Weiter le…,https://i.wfcdn.de/teaser/1920/60400.jpg,2022-12-01T19:01:00Z,"https://web.archive.org/web/20221201192436/https://winfuture.de/news,133326.html",Regierungen und Behörden liefern bisher nur wenige Details zum Sabotageakt auf die Nord Stream-Pipelines. Jetzt hat die Umweltschutzorganisation Greenpeace eine eigene Expedition gestartet und rund u… [+2156 chars],,de,'Pipeline'
https://www.sueddeutsche.de/politik/energiekrise-liveblog-rohoel-polen-raffinerie-1.5704622,https://www.sueddeutsche.de/politik/energiekrise-liveblog-rohoel-polen-raffinerie-1.5704622,0,www.sueddeutsche.de,Liveblog zur Energiekrise: Raffinerie in Schwedt soll Rohöl aus Polen bekommen,Deutschland und Polen wollen nach dem Verzicht auf russisches Pipeline-Öl die Versorgung der ostdeutschen Raffinerie Schwedt gewährleisten. Eine entsprechende Absichtserklärung ist unterschrieben.,https://www.sueddeutsche.de/image/sz.1.5707896/1200x675?v=1669921999,2022-12-01T19:16:12Z,https://web.archive.org/web/20221202001855/https://www.sueddeutsche.de/politik/energiekrise-liveblog-rohoel-polen-raffinerie-1.5704622,"Der Krieg Russlands gegen die Ukraine hat auch massive Folgen für die Energieversorgung in Europa und Deutschland. Die Politik versucht, diese sicherzustellen und die Menschen wegen der stark steigen… [+131 chars]",,de,'Versorgung'
https://www.tagesschau.de/wirtschaft/pck-raffinierie-schwedt-danzig-101.html,https://www.tagesschau.de/wirtschaft/pck-raffinierie-schwedt-danzig-101.html,0,www.tagesschau.de,Raffinerie in Schwedt: Polen sagt Öllieferungen via Danzig zu,"Wenn Anfang 2023 die Ölimporte aus Russland gestoppt werden, könnte die Versorgung mit Rohöl in Schwedt knapp werden. Um darauf vorbereitet zu sein, haben Deutschland und Polen eine gemeinsame Absichtserklärung unterzeichnet.",https://www.tagesschau.de/multimedia/bilder/pck-raffinerie-107~_v-original.jpg,2022-12-01T20:10:20Z,https://web.archive.org/web/20221201213953/https://www.tagesschau.de/wirtschaft/pck-raffinierie-schwedt-danzig-101.html,"Wenn Anfang 2023 die Ölimporte aus Russland gestoppt werden, könnte die Versorgung mit Rohöl in Schwedt knapp werden. Um darauf vorbereitet zu sein, haben Deutschland und Polen eine gemeinsame Absich… [+2448 chars]",,de,'Import'
https://www.spiegel.de/wirtschaft/usa-joe-biden-verteidigt-subventionsgesetz-gegen-kritik-von-emmanuel-macron-a-aa2f8003-6938-440f-b410-6ede964bb74b,https://www.spiegel.de/wirtschaft/usa-joe-biden-verteidigt-subventionsgesetz-gegen-kritik-von-emmanuel-macron-a-aa2f8003-6938-440f-b410-6ede964bb74b,0,www.spiegel.de,USA: Joe Biden verteidigt Subventionsgesetz gegen Kritik von Emmanuel Macron,Die USA wollen die heimische Industrie künftig bevorzugen – Europa fürchtet deshalb Nachteile. Beim Besuch des französischen Präsidenten in Washington stellt der US-Präsident aber nur geringe Zugeständnisse in Aussicht.,https://cdn.prod.www.spiegel.de/images/6df84cca-bd5b-4a0f-a8ab-597b8cd053ea_w1280_r1.77_fpx43_fpy24.jpg,2022-12-01T20:50:58Z,https://web.archive.org/web/20221201212436/https://www.spiegel.de/wirtschaft/usa-joe-biden-verteidigt-subventionsgesetz-gegen-kritik-von-emmanuel-macron-a-aa2f8003-6938-440f-b410-6ede964bb74b,"Biden sagte, es gebe Einzelheiten, die optimiert werden könnten. Macron und er hätten ihre Teams beauftragt, Probleme zu lösen. Es gebe keine Absicht, andere Länder auszuschließen. »Wir werden weiter… [+698 chars]",,de,'Industrie'
https://www.spiegel.de/sport/fussball/fussball-wm-2022-deutschland-und-seine-groessten-enttaeuschungen-der-wm-geschichte-a-57e333a7-23b5-4cb9-b114-8bb4accd360b,https://www.spiegel.de/sport/fussball/fussball-wm-2022-deutschland-und-seine-groessten-enttaeuschungen-der-wm-geschichte-a-57e333a7-23b5-4cb9-b114-8bb4accd360b,0,www.spiegel.de,Fußball-WM 2022: Deutschland und seine größten Enttäuschungen der WM-Geschichte,Das überraschende Vorrunden-Aus der DFB-Elf beim Turnier in Katar ist ein Tiefpunkt der deutschen WM-Historie. Allerdings nicht der erste. Die größten Fußball-Debakel aus 84 Jahren in Bildern.,https://cdn.prod.www.spiegel.de/images/5daf59c9-37ce-401a-ac52-de666458c562_w1280_r1.77_fpx48_fpy54.jpg,2022-12-01T21:51:39Z,,"8 / 11Doch der Paukenschlag sollte erst noch folgen, die »Schmach von Córdoba«, das 2:3 gegen Österreich. Damals waren die Niederlagen der deutschen Mannschaft so selten, dass sich um jede eine Gesch… [+286 chars]",,de,'Katar'
