index,url,valid,domain,title,description,image,published,archive,content,quote,language,keyword
https://www.tagesschau.de/ausland/europa/polen-praesidentenwahl-106.html,https://www.tagesschau.de/ausland/europa/polen-praesidentenwahl-106.html,0,www.tagesschau.de,Präsidentenwahl in Polen: Pro-europäisch oder nationalpopulistisch?,"Polen wählt heute einen neuen Präsidenten. Sollte sich der nationalpopulistische Kandidat in der Stichwahl durchsetzen, könnte er Vorhaben der pro-europäischen Regierung blockieren. Im Wahlkampf bekam er Unterstützung aus den USA. Von M. Adam.",https://images.tagesschau.de/image/65ed0697-d773-430a-ad14-24e17c60a689/AAABlyGJ9rM/AAABkZLhkrw/16x9-1280/polen-wahlplakate-100.jpg,2025-06-01T03:48:08Z,,"Stand: 01.06.2025 05:48 Uhr
Polen wählt heute einen neuen Präsidenten. Sollte sich der nationalpopulistische Kandidat in der Stichwahl durchsetzen, könnte er Vorhaben der pro-europäischen Regierung … [+5174 chars]",,de,'Unterstützung'
https://www.zeit.de/news/2025-06/01/hamas-dutzende-opfer-bei-israelischem-angriff-in-gaza,https://www.zeit.de/news/2025-06/01/hamas-dutzende-opfer-bei-israelischem-angriff-in-gaza,0,www.zeit.de,Gaza-Krieg: Hamas: Dutzende Opfer bei israelischem Angriff in Gaza,Hier finden Sie Informationen zu dem Thema „Gaza-Krieg“. Lesen Sie jetzt „Hamas: Dutzende Opfer bei israelischem Angriff in Gaza“.,https://img.zeit.de/news/2025-06/01/hamas-dutzende-opfer-bei-israelischem-angriff-in-gaza-image-group/wide__1300x731,2025-06-01T04:39:17Z,,Bei einem israelischen Angriff im Süden des Gazastreifens sollen nach Angaben des Medienbüros der islamistischen Hamas am frühen Morgen mindestens 22 Palästinenser getötet worden sein. Mehr als 115 w… [+1034 chars],,de,'Krieg'
https://taz.de/Finale-der-Champions-League/!6091082/,https://taz.de/Finale-der-Champions-League/!6091082/,0,taz.de,Finale der Champions League: Triumph für Katar,Paris Saint Germain gewinnt nach einem furiosen Auftritt den wichtigsten Titel im Klubfußball. Es war ein Horrorabend für Fußballromantiker.,https://taz.de/picture/7727622/1200/38524209-1.jpeg,2025-06-01T08:46:00Z,,Paris Saint Germain gewinnt nach einem furiosen Auftritt den wichtigsten Titel im Klubfußball. Es war ein Horrorabend für Fußballromantiker. mehr...,,de,'Katar'
https://stadt-bremerhaven.de/energiepreise-in-deutschland-sorge-ist-weiterhin-gross/,https://stadt-bremerhaven.de/energiepreise-in-deutschland-sorge-ist-weiterhin-gross/,0,stadt-bremerhaven.de,Energiepreise in Deutschland: Sorge ist weiterhin groß,"Die Energiepreise kennen im Grunde in Deutschland nur einen Weg: den nach oben. Ich selbst habe etwa erst diesen Monat wieder eine Strompreiserhöhung ins Haus flattern sehen. Und diese Preisentwicklung bereitet dann auch immer noch vielen Menschen Sorgen, wie…",https://stadt-bremerhaven.de/wp-content/uploads/2025/05/Solar-Deutschland.jpg,2025-06-01T09:00:47Z,,Die Energiepreise kennen im Grunde in Deutschland nur einen Weg: den nach oben. Ich selbst habe etwa erst diesen Monat wieder eine Strompreiserhöhung ins Haus flattern sehen. Und diese Preisentwicklu… [+3086 chars],,de,'Energie'
https://www.transfermarkt.de/ziyech-verlasst-al-duhail-nach-halbem-jahr-vertrag-wie-zuvor-bei-galatasaray-aufgelost/view/news/454764,https://www.transfermarkt.de/ziyech-verlasst-al-duhail-nach-halbem-jahr-vertrag-wie-zuvor-bei-galatasaray-aufgelost/view/news/454764,0,www.transfermarkt.de,Hakim Ziyech verlässt Al-Duhail SC in Katar nach halbem Jahr,Hakim Ziyech beendet sein Abenteuer beim Al-Duhail SC nach nur einem halben Jahr wieder. Der 32 Jahre alte Offensivspieler und der achtmalige katarische Meister haben den ursprünglich bis 2027...,https://tmssl.akamaized.net/images/foto/big/hakim-ziyech-al-duhail-sc-1748773149-169055.jpg?lm=1748773161,2025-06-01T10:15:16Z,,"Ex-Chelsea-Profi auf Vereinssuche 
Hakim Ziyech beendet sein Abenteuer beim Al-Duhail SC nach nur einem halben Jahr wieder. Der 32 Jahre alte Offensivspieler und der achtmalige katarische Meister ha… [+456 chars]",,de,'Katar'
https://www.sueddeutsche.de/wirtschaft/nord-stream-gaspipeline-grund-ostsee-merz-li.3261473,https://www.sueddeutsche.de/wirtschaft/nord-stream-gaspipeline-grund-ostsee-merz-li.3261473,0,www.sueddeutsche.de,Russisches Gas: Lasst Nord Stream 2 auf dem Grund der Ostsee verrosten,"Die Pipeline lässt Deutschland nicht los. In Wirtschaft und CDU träumen manche von ihrer Wiederauferstehung, sie spekulieren auf billiges Gas. Doch der Preis dafür wäre viel zu hoch.",https://www.sueddeutsche.de/2025/06/01/9157aa17-e9a8-4a8c-87f0-082a4c1a656a.jpeg?q=60&fm=webp&width=1200&rect=0%2C209%2C4000%2C2250,2025-06-01T11:13:50Z,https://web.archive.org/web/20250601113103/https://www.sueddeutsche.de/wirtschaft/nord-stream-gaspipeline-grund-ostsee-merz-li.3261473,"1. Juni 2025, 13:13 Uhr|Lesezeit: 2 Min.
|
Die Pipeline lässt Deutschland nicht los. In Wirtschaft und CDU träumen manche von ihrer Wiederauferstehung, sie spekulieren auf billiges Gas. Doch der Pr… [+563 chars]",,de,'Pipeline'
https://www.zeit.de/news/2025-06/01/ukraine-bestaetigt-teilnahme-an-verhandlungen-in-istanbul,https://www.zeit.de/news/2025-06/01/ukraine-bestaetigt-teilnahme-an-verhandlungen-in-istanbul,0,www.zeit.de,Ukraine-Krieg: Ukraine bestätigt Teilnahme an Verhandlungen in Istanbul,Hier finden Sie Informationen zu dem Thema „Ukraine-Krieg“. Lesen Sie jetzt „Ukraine bestätigt Teilnahme an Verhandlungen in Istanbul“.,https://img.zeit.de/news/2025-06/01/ukraine-bestaetigt-teilnahme-an-verhandlungen-in-istanbul-image-group/wide__1300x731,2025-06-01T12:16:34Z,,Der ukrainische Präsident Wolodymyr Selenskyj hat die Teilnahme seines Landes an direkten Verhandlungen mit Russland in Istanbul bestätigt. Die ukrainische Delegation werde am Montag von Verteidigung… [+112 chars],,de,'Krieg'
https://www.zeit.de/news/2025-06/01/ukrainische-drohnen-greifen-russischen-militaerflugplaetze-an,https://www.zeit.de/news/2025-06/01/ukrainische-drohnen-greifen-russischen-militaerflugplaetze-an,0,www.zeit.de,Krieg Ukraine-Russland: Ukrainische Drohnen greifen russischen Militärflugplätze an,Hier finden Sie Informationen zu dem Thema „Krieg Ukraine-Russland“. Lesen Sie jetzt „Ukrainische Drohnen greifen russischen Militärflugplätze an“.,https://img.zeit.de/news/2025-06/01/ukrainische-drohnen-greifen-russischen-militaerflugplaetze-an-image-group/wide__1300x731,2025-06-01T13:32:02Z,https://web.archive.org/web/20250601215202/https://www.zeit.de/news/2025-06/01/ukrainische-drohnen-greifen-russischen-militaerflugplaetze-an,Der ukrainische Geheimdienst SBU hat in einer koordinierten Aktion gleich vier russische Militärflughäfen attackiert und dabei nach eigener Darstellung über 40 Kampf- und Aufklärungsflugzeuge zerstör… [+1110 chars],,de,'Krieg'
https://www.zeit.de/politik/ausland/2025-06/ukrainekrieg-drohnen-angriff-luftwaffenstuetzpunkte-sibirien-russland-flugzeuge,https://www.zeit.de/politik/ausland/2025-06/ukrainekrieg-drohnen-angriff-luftwaffenstuetzpunkte-sibirien-russland-flugzeuge,0,www.zeit.de,Drohnenangriffe: Ukraine greift laut Berichten russische Luftwaffenstützpunkte an,"40 zerstörte Flugzeuge, vier attackierte Stützpunkte: Der Ukraine ist laut Berichten ein wichtiger Angriff gelungen. Sie soll tief in Russlands Kernland getroffen haben.",https://img.zeit.de/administratives/sharing/fallback-image/wide__1300x731,2025-06-01T13:39:45Z,http://archive.md/20250601135352/https://www.zeit.de/politik/ausland/2025-06/ukrainekrieg-drohnen-angriff-luftwaffenstuetzpunkte-sibirien-russland-flugzeuge,Der ukrainische Geheimdienst SBU hat nach Angaben eines ukrainischen Geheimdienstmitarbeiters einen Großangriff auf Militärflugzeuge weit im russischen Kernland ausgeführt. Das berichten mehrere Medi… [+1437 chars],,de,'Ukraine'
https://www.zeit.de/news/2025-06/01/klitschko-hofft-auf-kriegsende-noch-2025,https://www.zeit.de/news/2025-06/01/klitschko-hofft-auf-kriegsende-noch-2025,0,www.zeit.de,Krieg in der Ukraine: Klitschko hofft auf Kriegsende noch 2025,Hier finden Sie Informationen zu dem Thema „Krieg in der Ukraine“. Lesen Sie jetzt „Klitschko hofft auf Kriegsende noch 2025“.,https://img.zeit.de/news/2025-06/01/klitschko-hofft-auf-kriegsende-noch-2025-image-group/wide__1300x731,2025-06-01T13:40:51Z,https://web.archive.org/web/20250602072952/https://www.zeit.de/news/2025-06/01/klitschko-hofft-auf-kriegsende-noch-2025,"Der Bürgermeister von Kiew, Vitali Klitschko, hofft auf einen Frieden in der Ukraine noch in diesem Jahr. «Wir drücken den Daumen und wir hoffen», dass 2025 endlich eine diplomatische Lösung gefunden… [+850 chars]",,de,'Krieg'
https://www.tagesschau.de/ausland/europa/grossbritannien-verteidigung-munitionsfabriken-100.html,https://www.tagesschau.de/ausland/europa/grossbritannien-verteidigung-munitionsfabriken-100.html,0,www.tagesschau.de,Britische Regierung plant neue Munitionsfabriken,Mit einer neuen Verteidigungsstrategie will Großbritannien seine Rüstungsindustrie stärken und die Munitionsproduktion ankurbeln. Russlands Krieg gegen die Ukraine zeige: Ein Militär sei nur so stark wie die dahinterstehende Industrie.,https://images.tagesschau.de/image/189d0d45-00ee-4c70-a91c-e5e1d13de54c/AAABlyuwOxc/AAABkZLhkrw/16x9-1280/healey-starmer-100.jpg,2025-06-01T13:52:33Z,,"Stand: 01.06.2025 15:52 Uhr
Mit einer neuen Verteidigungsstrategie will Großbritannien seine Rüstungsindustrie stärken und die Munitionsproduktion ankurbeln. Russlands Krieg gegen die Ukraine zeige:… [+2204 chars]",,de,'Ukraine'
https://www.sueddeutsche.de/wirtschaft/stahl-trump-zoelle-lange-eu-kommission-li.3262221,https://www.sueddeutsche.de/wirtschaft/stahl-trump-zoelle-lange-eu-kommission-li.3262221,0,www.sueddeutsche.de,Handelskonflikt: Was bedeuten Trumps Stahlzölle für Deutschland?,"Der US-Präsident will Einfuhren deutlich verteuern. Die EU-Kommission ist sauer, schließlich laufen gerade Verhandlungen mit Washington. Für die Industrie wäre das ein harter Schlag – wieder einmal.",https://www.sueddeutsche.de/2023/09/21/c303b54c-35e7-4be0-87b2-14c75c563539.jpeg?q=60&fm=webp&width=1200&rect=0%2C71%2C1349%2C759,2025-06-01T14:36:22Z,,"1. Juni 2025, 16:36 Uhr|Lesezeit: 3 Min.
|
Der US-Präsident will Einfuhren deutlich verteuern. Die EU-Kommission ist sauer, schließlich laufen gerade Verhandlungen mit Washington. Für die Industrie… [+858 chars]",,de,'Import'
https://taz.de/Diplomatische-Kontakte-mit-Afghanistan/!6088279/,https://taz.de/Diplomatische-Kontakte-mit-Afghanistan/!6088279/,0,taz.de,Diplomatische Kontakte mit Afghanistan: Die Taliban sprechen in Katar mit Deutschland,Das Taliban-Regime meldet erstmals einen diplomatischen Kontakt mit der Bundesregierung. Die möchte gerne nach Afghanistan abschieben.,https://taz.de/picture/7728623/1200/38123754-1.jpeg,2025-06-01T14:58:00Z,,Das Taliban-Regime meldet erstmals einen diplomatischen Kontakt mit der Bundesregierung. Die möchte gerne nach Afghanistan abschieben. mehr...,,de,'Katar'
https://www.tagesschau.de/ausland/europa/ukraine-angriff-militaerflugplaetze-100.html,https://www.tagesschau.de/ausland/europa/ukraine-angriff-militaerflugplaetze-100.html,0,www.tagesschau.de,Ukraine zerstört offenbar Dutzende russische Flugzeuge,Die Ukraine hat der russischen Luftwaffe mit Drohnenangriffen offenbar einen empfindlichen Schlag versetzt. Zahlreiche Langstreckenbomber sollen zerstört worden sein - teils auf Militärbasen Tausende Kilometer von der ukrainischen Grenze entfernt.,https://images.tagesschau.de/image/ce8fb271-a8ad-4a0d-ae46-57f0ec4dba0b/AAABlywc4KA/AAABkZLhkrw/16x9-1280/angriff-russland-flugzeug-100.jpg,2025-06-01T15:37:36Z,,"Stand: 01.06.2025 17:37 Uhr
Die Ukraine hat der russischen Luftwaffe mit Drohnenangriffen offenbar einen empfindlichen Schlag versetzt. Zahlreiche Langstreckenbomber sollen zerstört worden sein - te… [+4269 chars]",,de,'Ukraine'
https://www.zeit.de/sport/2025-06/katar-fussball-erfolg-anpassung-europa,https://www.zeit.de/sport/2025-06/katar-fussball-erfolg-anpassung-europa,0,www.zeit.de,"Katar im Fußball: Es war die Abkehr vom Prinzip Katar, die PSG den Erfolg brachte",Die Lehre aus dem Champions-League-Titel für Paris: Katar musste sich an den Fußball und die Regeln dieses europäischen Volkssports anpassen. Nicht umgekehrt,https://img.zeit.de/sport/2025-06/katar-fussball-erfolg-anpassung-europa-bild/wide__1300x731,2025-06-01T19:44:49Z,,"Als Katar 2011 Paris Saint-Germain kaufte, war die Sorge groß. Die Autokratie aus dem Mittleren Osten würde den Fußball missbrauchen und sein Wesen verfremden, fürchteten viele. Sie werde mit ihren M… [+571 chars]",,de,'Katar'
https://www.nzz.ch/international/nord-stream-2-merz-plan-fuer-ein-ende-der-gaspipeline-birgt-konfliktpotenzial-ld.1886854,https://www.nzz.ch/international/nord-stream-2-merz-plan-fuer-ein-ende-der-gaspipeline-birgt-konfliktpotenzial-ld.1886854,0,www.nzz.ch,Friedrich Merz will Nord Stream 2 endgültig begraben. Die Entscheidung birgt Konfliktpotenzial,Der deutsche Kanzler lehnt eine Inbetriebnahme der Gaspipeline in der Ostsee ab – und stellt sich damit gegen die USA und Teile seiner eigenen Koalition. Einen Ausweg aus dem Dilemma könnte ihm die EU öffnen.,"https://img.nzz.ch/2022/07/22/ea99b7c4-18d5-4b50-87bf-1e465b1d2f48.jpeg?width=1200&height=675&fit=bounds&quality=75&auto=webp&crop=6798,3824,x0,y0&wmark=nzz",2025-06-02T03:30:00Z,http://archive.md/20250602044046/https://www.nzz.ch/international/nord-stream-2-merz-plan-fuer-ein-ende-der-gaspipeline-birgt-konfliktpotenzial-ld.1886854,"Rohre an den Anlagen der Gaspipeline Nord Stream 1 in Lubmin im ostdeutschen Bundesland Mecklenburg-Vorpommern.
Für den deutschen Kanzler Friedrich Merz ist klar, was mit der Gaspipeline Nord Stream… [+6845 chars]",,de,'Gas'
https://www.zeit.de/news/2025-06/02/vor-gespraechen-zerstoert-die-ukraine-russische-flugzeuge,https://www.zeit.de/news/2025-06/02/vor-gespraechen-zerstoert-die-ukraine-russische-flugzeuge,0,www.zeit.de,Krieg in der Ukraine: Vor Gesprächen zerstört die Ukraine russische Flugzeuge,Hier finden Sie Informationen zu dem Thema „Krieg in der Ukraine“. Lesen Sie jetzt „Vor Gesprächen zerstört die Ukraine russische Flugzeuge“.,https://img.zeit.de/news/2025-06/02/vor-gespraechen-zerstoert-die-ukraine-russische-flugzeuge-image-group/wide__1300x731,2025-06-02T04:07:42Z,,Ein spektakulärer Schlag der Ukraine gegen Russlands strategische Bomberflotte hat die Karten für eine Verhandlungsrunde der Kriegsparteien in Istanbul heute neu gemischt. Die Moskauer Reaktion auf d… [+6586 chars],,de,'Ukraine'
https://www.zeit.de/news/2025-06/02/medien-thyssenkrupp-steel-will-sozialplan-fuer-stellenabbau,https://www.zeit.de/news/2025-06/02/medien-thyssenkrupp-steel-will-sozialplan-fuer-stellenabbau,0,www.zeit.de,Industrie: Medien: Thyssenkrupp Steel will Sozialplan für Stellenabbau,Hier finden Sie Informationen zu dem Thema „Industrie“. Lesen Sie jetzt „Medien: Thyssenkrupp Steel will Sozialplan für Stellenabbau“.,https://img.zeit.de/news/2025-06/02/medien-thyssenkrupp-steel-will-sozialplan-fuer-stellenabbau-image-group/wide__1300x731,2025-06-02T05:00:41Z,,Deutschlands größte Stahlfirma Thyssenkrupp Steel Europe will nach einem Medienbericht an dem Ende November angekündigten Abbau von 11.000 Stellen festhalten und strebt dazu einen Sozialplan an. «In … [+1347 chars],,de,'Industrie'
https://www.diepresse.com/19750604/netanjahu-im-deutschen-exil-irritierende-theater-vision-bei-den-festwochen,https://www.diepresse.com/19750604/netanjahu-im-deutschen-exil-irritierende-theater-vision-bei-den-festwochen,0,www.diepresse.com,Netanjahu im deutschen Exil: Irritierende Theater-Vision bei den Festwochen,"Israel als Perser, Palästinenser als Griechen: „Perzen“, ein Import aus dem NT Gent, der ehemaligen Wirkungsstätte von Festwochen-Intendant Milo Rau, spielt mit der Geschichte. Und läuft auf Empörendes hinaus: auf die Vision von der Vernichtung Israels und au…",https://img.diepresse.com/public/incoming/sf6ph4-Persians.-Triumph-of-Empathy-c-Kurt-van-der-Elst-10.jpg/alternates/DPR_SOCIAL_MAGAZIN/Persians.-Triumph-of-Empathy-c-Kurt-van-der-Elst-10.jpg,2025-06-02T06:52:29Z,,"Israel als Perser, Palästinenser als Griechen: Perzen, ein Import aus dem NT Gent, der ehemaligen Wirkungsstätte von Festwochen-Intendant Milo Rau, spielt mit der Geschichte. Und läuft auf Empörendes… [+4447 chars]",,de,'Import'
https://www.tagesspiegel.de/wirtschaft/lebensmittelpreise-in-deutschland-kosten-fur-kaffee-sind-am-starksten-gestiegen-13788046.html,https://www.tagesspiegel.de/wirtschaft/lebensmittelpreise-in-deutschland-kosten-fur-kaffee-sind-am-starksten-gestiegen-13788046.html,0,www.tagesspiegel.de,Lebensmittelpreise in Deutschland: Kosten für Kaffee sind am stärksten gestiegen,"Die Kaffeepreise für deutsche Verbraucher sind um rund zwölf Prozent im Vergleich zum Vorjahr gestiegen, deutlich mehr als andere Lebensmittel. Hauptgründe sind höhere Importpreise und Ernteausfälle.",https://www.tagesspiegel.de/images/13788094/alternates/BASE_16_9_W1400/1748851936000/kaffeepreise-steigen.jpeg,2025-06-02T10:10:36Z,,"Die Kaffeepreise für Verbraucher in Deutschland sind deutlich stärker gestiegen als die durchschnittlichen Lebensmittelpreise. Wie das Statistische Bundesamt am Montag in Wiesbaden mitteilte, erhöhte… [+2119 chars]",,de,'Import'
https://www.tagesspiegel.de/wirtschaft/anstieg-von-kaffeepreisen-deutsche-verbraucher-zahlen-fur-kaffee-am-meisten-13788046.html,https://www.tagesspiegel.de/wirtschaft/anstieg-von-kaffeepreisen-deutsche-verbraucher-zahlen-fur-kaffee-am-meisten-13788046.html,0,www.tagesspiegel.de,Anstieg von Kaffeepreisen: Deutsche Verbraucher zahlen für Kaffee am meisten,"Die Kaffeepreise für deutsche Verbraucher sind um rund 12 Prozent im Vergleich zum Vorjahr gestiegen, deutlich mehr als andere Lebensmittel. Hauptgründe sind höhere Importpreise und Ernteausfälle.",https://www.tagesspiegel.de/images/13788094/alternates/BASE_16_9_W1400/1748851936000/kaffeepreise-steigen.jpeg,2025-06-02T10:10:36Z,,"Die Kaffeepreise für Verbraucher in Deutschland sind deutlich stärker gestiegen als die durchschnittlichen Lebensmittelpreise. Wie das Statistische Bundesamt am Montag in Wiesbaden mitteilte, erhöhte… [+2119 chars]",,de,'Import'
https://www.zeit.de/news/2025-06/02/automatisierung-und-robotik-im-krisenjahr,https://www.zeit.de/news/2025-06/02/automatisierung-und-robotik-im-krisenjahr,0,www.zeit.de,Industrie: Automatisierung und Robotik im Krisenjahr,Hier finden Sie Informationen zu dem Thema „Industrie“. Lesen Sie jetzt „Automatisierung und Robotik im Krisenjahr“.,https://img.zeit.de/news/2025-06/02/automatisierung-und-robotik-im-krisenjahr-image-group/wide__1300x731,2025-06-02T10:51:15Z,,"Die deutsche Robotik- und Automatisierungsbranche ist in der Krise. Für das laufende Jahr erwartet die Branche einen Einbruch ihres Umsatzes um 10 Prozent auf 14,5 Milliarden Euro, wie der Verband VD… [+1970 chars]",,de,'Industrie'
https://www.zeit.de/news/2025-06/02/kriegsbereitschaft-grossbritannien-investiert-milliarden,https://www.zeit.de/news/2025-06/02/kriegsbereitschaft-grossbritannien-investiert-milliarden,0,www.zeit.de,"Verteidigung: ""Kriegsbereitschaft"": Großbritannien investiert Milliarden","Hier finden Sie Informationen zu dem Thema „Verteidigung“. Lesen Sie jetzt „""Kriegsbereitschaft"": Großbritannien investiert Milliarden“.",https://img.zeit.de/news/2025-06/02/kriegsbereitschaft-grossbritannien-investiert-milliarden-image-group/wide__1300x731,2025-06-02T11:07:37Z,,"Auf dem Weg zur «Kriegsbereitschaft» hat Großbritannien Milliardeninvestitionen in Militär und Verteidigung angekündigt. Die Streitkräfte für den Kriegsfall einsatzbereit zu machen, sei die zentrale … [+1642 chars]",,de,'Ukraine'
https://www.zeit.de/news/2025-06/02/reiche-setzt-auf-neue-gasproduktion-im-sueden-deutschlands,https://www.zeit.de/news/2025-06/02/reiche-setzt-auf-neue-gasproduktion-im-sueden-deutschlands,0,www.zeit.de,Energie: Reiche setzt auf neue Gasproduktion im Süden Deutschlands,Hier finden Sie Informationen zu dem Thema „Energie“. Lesen Sie jetzt „Reiche setzt auf neue Gasproduktion im Süden Deutschlands“.,https://img.zeit.de/news/2025-06/02/reiche-setzt-auf-neue-gasproduktion-im-sueden-deutschlands-image-group/wide__1300x731,2025-06-02T11:12:54Z,https://web.archive.org/web/20250603064831/https://www.zeit.de/news/2025-06/02/reiche-setzt-auf-neue-gasproduktion-im-sueden-deutschlands,"Ein Schwerpunkt der neuen Gasproduktion in Deutschland soll laut Bundeswirtschaftsministerin Katherina Reiche in Süddeutschland entstehen. «Wir planen einen Südbonus, der mit zwei Dritteln der insges… [+1612 chars]",,de,'Energie'
https://www.stern.de/news/macrons-wachsfigur-gestohlen--greenpeace-protestiert-gegen-russlandgeschaefte-35774824.html,https://www.stern.de/news/macrons-wachsfigur-gestohlen--greenpeace-protestiert-gegen-russlandgeschaefte-35774824.html,0,www.stern.de,Macrons Wachsfigur gestohlen: Greenpeace protestiert gegen Russlandgeschäfte,"Die Umweltorganisation Greenpeace hat mit einer im Pariser Wachsfigurenkabinett gestohlenen Figur des französischen Präsidenten Emmanuel Macron gegen den Import von Gas und Dünger aus Russland protestiert. ""Die Ukraine brennt und die Geschäfte laufen weiter"",…",https://image.stern.de/35774826/t/k3/v1/w1440/r1.7778/-/02--greenpeaceaktion---959e94c0e253bcc3.jpg,2025-06-02T13:37:16Z,,"Kopiere den aktuellen Link
Zur Merkliste hinzufügen
Die Umweltorganisation Greenpeace hat mit einer im Pariser Wachsfigurenkabinett gestohlenen Figur des französischen Präsidenten Emmanuel Macron g… [+917 chars]",,de,'Gas'
https://www.n-tv.de/politik/Friedensforscher-geben-Nato-keine-Chance-mehr-article25807667.html,https://www.n-tv.de/politik/Friedensforscher-geben-Nato-keine-Chance-mehr-article25807667.html,0,www.n-tv.de,"""Autoritäres Regime"" in USA: Friedensforscher geben Nato keine Chance mehr","Die Analyse ist düster: ""Um den Frieden ist es gegenwärtig schlecht bestellt"", schreiben führende Friedens- und Konfliktforscher. Dabei stellt aus ihrer Sicht nicht nur der Kreml ein Problem dar.",https://www.n-tv.de/img/incoming/crop25807718/3931325555-cImg_16_9-w1200/8e974f304a5d64ca66e161f196096925.jpg,2025-06-02T13:43:54Z,https://web.archive.org/web/20250602140001/https://www.n-tv.de/politik/Friedensforscher-geben-Nato-keine-Chance-mehr-article25807667.html,"Die Analyse ist düster: ""Um den Frieden ist es gegenwärtig schlecht bestellt"", schreiben führende Friedens- und Konfliktforscher. Dabei stellt aus ihrer Sicht nicht nur der Kreml ein Problem dar. 
F… [+4016 chars]",,de,'Kreml'
https://www.tagesspiegel.de/internationales/aus-notausgang-geschmuggelt-greenpeace-protestiert-mit-gestohlener-macron-wachsfigur-gegen-russlandgeschafte-13790863.html,https://www.tagesspiegel.de/internationales/aus-notausgang-geschmuggelt-greenpeace-protestiert-mit-gestohlener-macron-wachsfigur-gegen-russlandgeschafte-13790863.html,0,www.tagesspiegel.de,Aus Notausgang geschmuggelt: Greenpeace protestiert mit gestohlener Macron-Wachsfigur gegen Russlandgeschäfte,"In eine Decke gehüllt schmuggelten drei Greenpeace-Aktivisten die Figur Macrons aus dem Wachsfigurenkabinett. „Die Ukraine brennt und die Geschäfte laufen weiter“, kritisieren die Umweltschützer.",https://www.tagesspiegel.de/images/13790911/alternates/BASE_16_9_W1400/1748872463000/france-greenpeace-russia-energy-politics-demo.jpeg,2025-06-02T14:00:19Z,,Die Umweltorganisation Greenpeace hat mit einer im Pariser Wachsfigurenkabinett gestohlenen Figur des französischen Präsidenten Emmanuel Macron gegen den Import von Gas und Dünger aus Russland protes… [+2227 chars],,de,'Import'
https://www.faz.net/aktuell/politik/operation-spinnennetz-ukraine-duepiert-mit-drohnen-putins-diktatur-110513415.html,https://www.faz.net/aktuell/politik/operation-spinnennetz-ukraine-duepiert-mit-drohnen-putins-diktatur-110513415.html,0,www.faz.net,Kommentar zur Operation „Spinnennetz“: Eine Schmach für den russischen Goliath,Der ukrainische Schlag gegen die russischen Bomberbasen zeigt: Existenz und Einsatz der Drohne ändern vieles im Krieg. Berlin muss verlorene Zeit aufholen.,https://media0.faz.net/ppmedia/aktuell/3782330342/1.10513412/facebook_teaser/diese-vom-ukrainischen.jpg,2025-06-02T14:29:28Z,http://archive.md/20250602144432/https://www.faz.net/aktuell/politik/operation-spinnennetz-ukraine-duepiert-mit-drohnen-putins-diktatur-110513415.html,"Unter Stalin, so meinte eine Moskauer Boulevardzeitung, wären dafür einige Kommandeure an die Wand gestellt worden. Aber auch in den humanen Zeiten, in denen das Blatt Russland wähnt, wird es ranghoh… [+1806 chars]",,de,'Kreml'
https://www.stern.de/news/macrons-wachsfigur-entwendet--protest-gegen-russlandgeschaefte-35774824.html,https://www.stern.de/news/macrons-wachsfigur-entwendet--protest-gegen-russlandgeschaefte-35774824.html,0,www.stern.de,Macrons Wachsfigur entwendet: Protest gegen Russlandgeschäfte,"Die Umweltorganisation Greenpeace hat mit einer im Pariser Wachsfigurenkabinett entwendeten Figur des französischen Präsidenten Emmanuel Macron gegen den Import von Gas und Dünger aus Russland protestiert. ""Die Ukraine brennt und die Geschäfte laufen weiter"",…",https://image.stern.de/35775422/t/g_/v1/w1440/r1.7778/-/02--greenpeaceaktion---98c6a1cec860fec0.jpg,2025-06-02T16:08:06Z,,"Kopiere den aktuellen Link
Zur Merkliste hinzufügen
Die Umweltorganisation Greenpeace hat mit einer im Pariser Wachsfigurenkabinett entwendeten Figur des französischen Präsidenten Emmanuel Macron g… [+1801 chars]",,de,'Import'
