index,url,valid,domain,title,description,image,published,archive,content,quote,language,keyword
https://www.faz.net/aktuell/wirtschaft/konjunkturbericht-viele-risiken-bleiben-18651944.html,https://www.faz.net/aktuell/wirtschaft/konjunkturbericht-viele-risiken-bleiben-18651944.html,0,www.faz.net,Konjunkturbericht: „Deutschland hat keine Teflon-Wirtschaft“,"Hohe Energiepreise, Rekordinflation und überall fehlende Fachkräfte: Deutschland steht nicht am Abgrund – aber an Gefahren mangelt es nicht.",https://media1.faz.net/ppmedia/aktuell/367289805/1.8651147/facebook_teaser/hier-schweisst-ein-arbeiter.jpg,2023-02-03T14:13:53Z,https://web.archive.org/web/20230203143755/https://www.faz.net/aktuell/wirtschaft/konjunkturbericht-viele-risiken-bleiben-18651944.html,Die Aussicht auf eine wachsende Wirtschaft hat einen neuen Dämpfer bekommen. Dabei haben sich sowohl Bundeskanzler Olaf Scholz (SPD) als auch Bundeswirtschaftsminister Robert Habeck (Grüne) in diesem… [+3782 chars],,de,'Olaf Scholz'
https://www.stern.de/politik/deutschland/und-was--wenn-sie-gewinnt--nancy-faeser-nimmt-riskante-doppelrolle-ein-33163144.html,https://www.stern.de/politik/deutschland/und-was--wenn-sie-gewinnt--nancy-faeser-nimmt-riskante-doppelrolle-ein-33163144.html,0,www.stern.de,"Ministerin und Wahlkämpferin: Und was, wenn sie gewinnt? Faeser nimmt riskante Doppelrolle ein","Bundesministerin und SPD-Spitzenkandidatin: Das geht, meint Nancy Faeser, und bekommt dafür Rückendeckung vom Kanzler. Der Schritt ist umstritten und nicht frei von Risiko. Auch nicht für Olaf Scholz.",https://image.stern.de/33163974/t/D0/v1/w1440/r1.7778/-/und-was--wenn-sie-gewinnt--nancy-faeser-nimmt-riskante-doppelrolle-ein.jpg,2023-02-03T14:32:00Z,https://web.archive.org/web/20230203151206/https://www.stern.de/politik/deutschland/und-was--wenn-sie-gewinnt--nancy-faeser-nimmt-riskante-doppelrolle-ein-33163144.html,"Nun ist offiziell, was seit Tagen für Spekulationen gesorgt hatte: Nancy Faeser will SPD-Spitzenkandidaten für die hessische Landtagswahl am 8. Oktober werden, gleichzeitig aber Bundesinnenministerin… [+5333 chars]",,de,'Olaf Scholz'
https://www.freitag.de/autoren/hans-georg-ehrhart/je-laenger-der-ukraine-krieg-dauert-desto-weniger-ist-das-in-deutschem-interesse,https://www.freitag.de/autoren/hans-georg-ehrhart/je-laenger-der-ukraine-krieg-dauert-desto-weniger-ist-das-in-deutschem-interesse,0,www.freitag.de,"RAND-Studie | Je länger der Ukraine-Krieg dauert, desto weniger ist das in deutschem Interesse","Die Vermeidung eines langwierigen bewaffneten, womöglich nuklearen Konflikts hat für die USA und Deutschland einen höheren Stellenwert als der Umfang der territorialen Kontrolle Kiews Der Kanzler schwört mit dem Amtseid, seine Kraft dem Wohle des deutschen Vo…",https://www.freitag.de/autoren/hans-georg-ehrhart/je-laenger-der-ukraine-krieg-dauert-desto-weniger-ist-das-in-deutschem-interesse/@@images/social_image,2023-02-03T15:00:00Z,,"Der Kanzler schwört mit dem Amtseid, seine Kraft dem Wohle des deutschen Volkes zu widmen, Schaden von ihm zu wenden und das Grundgesetz zu wahren, das ein striktes Friedensgebot enthält. Insofern is… [+4801 chars]",,de,'Ukraine'
https://www.faz.net/aktuell/finanzen/energiekrise-heleba-und-kfw-verteilen-waermedecken-an-mitarbeiter-18652380.html,https://www.faz.net/aktuell/finanzen/energiekrise-heleba-und-kfw-verteilen-waermedecken-an-mitarbeiter-18652380.html,0,www.faz.net,Wärmedecken für Bankmitarbeiter,"Wegen der Energiekrise heizen viele Institute nur noch auf 19 Grad. Damit die Mitarbeiter sich dennoch wohlfühlen, greifen die Landesbank Hessen-Thüringen  (Helaba) und die KfW zu ungewöhnlichen Mitteln.",https://media1.faz.net/ppmedia/aktuell/gesellschaft/1513128336/1.8632789/facebook_teaser/frankfurter-skyline.jpg,2023-02-03T15:32:20Z,,"Es ist kühl in Frankfurts Bankentürmen. Wegen der Energiekrise heizen viele Institute nur noch auf 19 Grad. Damit die Mitarbeiter sich dennoch wohlfühlen, greifen die Landesbank Hessen-Thüringen (Hel… [+1484 chars]",,de,'Energie'
https://www.dw.com/de/ukraine-kiew-plant-schon-mit-westlichen-kampfjets/a-64605295,https://www.dw.com/de/ukraine-kiew-plant-schon-mit-westlichen-kampfjets/a-64605295,0,www.dw.com,Ukraine: Kiew plant schon mit westlichen Kampfjets,"Die Entscheidung für westliche Kampfflugzeuge ist längst getroffen, sagen Analysten. Im Moment gehe es nur noch darum, welcher Flugzeug-Typ das sein soll. In der Ukraine sind Militäranalysten überzeugt, dass das Land schon in wenigen Monaten über westliche Ma…",https://static.dw.com/image/61058605_6.jpg,2023-02-03T16:08:00Z,,"In der Ukraine sind Militäranalysten überzeugt, dass das Land schon in wenigen Monaten über westliche Maschinen verfügen wird. Und es deutet viel darauf hin, dass diese Einschätzung weit mehr als Wun… [+7006 chars]",,de,'Ukraine'
https://www.focus.de/politik/ausland/migration-und-ukraine-krieg-jetzt-sprechen-scholz-und-italiens-regierungschefin-meloni-in-berlin_id_184833009.html,https://www.focus.de/politik/ausland/migration-und-ukraine-krieg-jetzt-sprechen-scholz-und-italiens-regierungschefin-meloni-in-berlin_id_184833009.html,0,www.focus.de,Migration und Ukraine-Krieg - Jetzt sprechen Scholz und Italiens Regierungschefin Meloni in Berlin,"Drei Monate nach ihrem Amtsantritt kommt die rechtsradikale Regierungschefin nach Berlin. Es dürfte sowohl um den Ukraine-Krieg als auch um die bilateralen Beziehungen gehen. Meloni hatte noch zu Oppositionszeiten gesagt, sie sei „allergisch“ gegen Deutschlan…",https://p6.focus.de/img/fotos/id_184832386/5fac8600987182f0.jpg?im=Crop%3D%280%2C0%2C3423%2C1710%29%3BResize%3D%281200%2C627%29&hash=52a0b0bad8f89346356493541808bc0a12173d5010c9abd4fd88283995a22ec9,2023-02-03T16:08:16Z,https://web.archive.org/web/20230203165941/https://www.focus.de/politik/ausland/migration-und-ukraine-krieg-jetzt-sprechen-scholz-und-italiens-regierungschefin-meloni-in-berlin_id_184833009.html,Drei Monate nach ihrem Amtsantritt kommt die rechtsradikale Regierungschefin nach Berlin. Es dürfte sowohl um den Ukraine-Krieg als auch um die bilateralen Beziehungen gehen. Meloni hatte noch zu Opp… [+4842 chars],,de,'Ukraine'
https://www.stern.de/politik/deutschland/staatsbesuch--meloni-zu-besuch-in-berlin---migration-oben-auf-ihrer-agenda-33162488.html,https://www.stern.de/politik/deutschland/staatsbesuch--meloni-zu-besuch-in-berlin---migration-oben-auf-ihrer-agenda-33162488.html,0,www.stern.de,Staatsbesuch: Meloni zu Besuch in Berlin - Migration oben auf ihrer Agenda,Um Giorgia Meloni ist es seit ihrem Wahlsieg im Ausland ruhig geworden. Ihr Besuch bei Kanzler Olaf Scholz rückt die rechtsradikale Regierungschefin Italiens wieder ins Rampenlicht.,https://image.stern.de/33165376/t/R2/v1/w1440/r1.7778/-/03--urnnewsmldpacom2009010123020399465487v3w800h600l343t87r1623b940jpeg---538950e5a813fb6b.jpg,2023-02-03T16:08:17Z,,"Um Giorgia Meloni ist es seit ihrem Wahlsieg im Ausland ruhig geworden. Ihr Besuch bei Kanzler Olaf Scholz rückt die rechtsradikale Regierungschefin Italiens wieder ins Rampenlicht.
Am Tag ihres Ber… [+4399 chars]",,de,'Olaf Scholz'
https://www.tagesschau.de/ausland/mittelmeer-migranten-111.html,https://www.tagesschau.de/ausland/mittelmeer-migranten-111.html,0,www.tagesschau.de,Flucht über das Mittelmeer: Seenotretter bergen tote Migranten,Die italienische Küstenwache und private Seenotretter haben auf dem Mittelmeer mehr als 140 Geflüchtete in Sicherheit gebracht. Für mindestens zehn Menschen kam die Hilfe jedoch zu spät. Überlebende berichteten von zwei weiteren Toten.,https://www.tagesschau.de/multimedia/bilder/sea-eye-4-105~_v-original.jpg,2023-02-03T17:38:24Z,,Die italienische Küstenwache und private Seenotretter haben auf dem Mittelmeer mehr als 140 Geflüchtete in Sicherheit gebracht. Für mindestens zehn Menschen kam die Hilfe jedoch zu spät. Überlebende … [+2595 chars],,de,'Sicherheit'
https://www.focus.de/wissen/natur/meteorologie/schneelage-am-wochenende-winter-bleibt-ueber-deutschland-hier-schlaegt-die-schneewalze-besonders-zu_id_184820356.html,https://www.focus.de/wissen/natur/meteorologie/schneelage-am-wochenende-winter-bleibt-ueber-deutschland-hier-schlaegt-die-schneewalze-besonders-zu_id_184820356.html,0,www.focus.de,Der Winter schlägt wieder zu - Bis zu 20 Zentimeter! Neuer Schnee-Hammer am Wochenende,"Am Wochenende erwarten uns nochmal kräftige Schneefälle in Deutschland. In den Alpen kommt erneut bis zu ein Meter Neuschnee zusammen. Aber auch im Tiefland wird es weiß. Im Wettertalk erklärt Meteorologe Jan Schenk, mit wie viel Schnee wir jetzt rechnen müss…",https://p6.focus.de/img/fotos/id_184820032/de-schneedecke-februar.jpg?im=Crop%3D%280%2C47%2C1508%2C754%29%3BResize%3D%281200%2C627%29&impolicy=perceptual&quality=medium&hash=22b94987902200c050975663f9e45cb00374aee21644509dad3602ce572fc475,2023-02-04T14:52:01Z,https://web.archive.org/web/20230204154428/https://www.focus.de/wissen/natur/meteorologie/schneelage-am-wochenende-winter-bleibt-ueber-deutschland-hier-schlaegt-die-schneewalze-besonders-zu_id_184820356.html,Am Wochenende erwarten uns nochmal kräftige Schneefälle in Deutschland. In den Alpen kommt erneut bis zu ein Meter Neuschnee zusammen. Doch auch im Tiefland wird es weiß. Im Wettertalk erklärt Meteor… [+2124 chars],,de,'Winter'
https://www.brigitte.de/gesund/gesundheit/eisbaden--der-neue-eiskalte-trend-13467960.html,https://www.brigitte.de/gesund/gesundheit/eisbaden--der-neue-eiskalte-trend-13467960.html,0,www.brigitte.de,Eisbaden: Winterschwimmen als eiskalter Trend,"Eisbaden ist ein eiskalter Trend, den Autorin Sonja Niemann auch ausprobieren möchte. Aber wie gesund ist es und braucht man dafür einen See oder das Meer?",https://image.brigitte.de/13468096/t/bJ/v2/w1440/r1.7778/-/eisbaden.jpg,2023-02-04T15:00:00Z,,"04.02.2023, 16:00
 4 Min.
Winterbaden im See oder im Meer liegt gerade total im Trend. Aber wie gesund ist es wirklich?
Da wirklich reingehen? Nackt in ein Eisloch im See bei einem Wetter, wo sons… [+6627 chars]",,de,'Winter'
https://www.focus.de/reisen/urlaubs-check/baden-im-februar-das-sind-die-schoensten-strandziele-um-dem-winter-adieu-zu-sagen_id_183911972.html,https://www.focus.de/reisen/urlaubs-check/baden-im-februar-das-sind-die-schoensten-strandziele-um-dem-winter-adieu-zu-sagen_id_183911972.html,0,www.focus.de,"Baden im Februar - Die fünf besten Reiseziele, um dem Winter zu entfliehen","Keine Lust mehr auf Schnee, Eis und Kälte? Dann ganz schnell ab in wärmere Gefilde! Wir stellen fünf Urlaubsziele vor, an denen das Thermometer mindestens 30 Grad anzeigt und Sie Sonne, Strand und Meer in vollen Zügen genießen können. So können Sie dem Winter…",https://p6.focus.de/img/fotos/id_183913289/gettyimages-83629122.jpg?im=Crop%3D%280%2C0%2C2148%2C1073%29%3BResize%3D%281200%2C627%29&impolicy=perceptual&quality=medium&hash=2c0321c47261e4e41b9686cc034d178ada5179f1b893de086cb4519eba7ad96f,2023-02-04T15:00:37Z,https://web.archive.org/web/20230204160047/https://www.focus.de/reisen/urlaubs-check/baden-im-februar-das-sind-die-schoensten-strandziele-um-dem-winter-adieu-zu-sagen_id_183911972.html,"Keine Lust mehr auf Schnee, Eis und Kälte? Dann ganz schnell ab in wärmere Gefilde! Wir stellen fünf Urlaubsziele vor, an denen das Thermometer mindestens 30 Grad anzeigt und Sie Sonne, Strand und Me… [+7270 chars]",,de,'Winter'
https://www.stern.de/sport/wintersport--biathletin-hinz-beendet-karriere-33167092.html,https://www.stern.de/sport/wintersport--biathletin-hinz-beendet-karriere-33167092.html,0,www.stern.de,Wintersport: Biathletin Hinz beendet Karriere,Vanessa Hinz macht Schluss mit Biathlon. In diesem Winter schaffte sie es auch wegen Verletzungen nicht zur WM.,https://image.stern.de/33167094/t/aN/v1/w1440/r1.7778/-/04--urnnewsmldpacom2009010123020499474436v3w800h600l368t102r1648b955jpeg---998add5d17abf07a.jpg,2023-02-04T15:27:11Z,,"Vanessa Hinz macht Schluss mit Biathlon. In diesem Winter schaffte sie es auch wegen Verletzungen nicht zur WM.
Die dreimalige Staffel-Weltmeisterin Vanessa Hinz beendet ihre Biathlon-Karriere.
Die… [+1539 chars]",,de,'Winter'
https://www.handelsblatt.com/technik/forschung-innovation/insight-innovation-frankreichs-neue-atomkraftwerke-zukunftsmodell-oder-sicherheitsrisiko/28962310.html,https://www.handelsblatt.com/technik/forschung-innovation/insight-innovation-frankreichs-neue-atomkraftwerke-zukunftsmodell-oder-sicherheitsrisiko/28962310.html,0,www.handelsblatt.com,Insight Innovation: Frankreichs neue Atomkraftwerke: Zukunftsmodell oder Sicherheitsrisiko?,"Weniger Schweißnähte, einfache Bauweise: Die neuen Reaktoren Frankreichs sollen preiswert Strom produzieren. Kritiker sorgen sich um die Sicherheit.",https://www.handelsblatt.com/images/frankreichs-atom-offensive/28962982/3-format2003.png,2023-02-04T16:30:00Z,https://web.archive.org/web/20230204192855/https://www.handelsblatt.com/technik/forschung-innovation/insight-innovation-frankreichs-neue-atomkraftwerke-zukunftsmodell-oder-sicherheitsrisiko/28962310.html,"Frankreichs Atom-OffensiveBis Mitte des kommenden Jahrzehnts sollen sechs Reaktoren eines neuen Typs entstehen.
(Foto: Getty Images, Reuters [M]) 
Paris, Penly Im Dezember 2022 steht Bruno Le Maire… [+1300 chars]",,de,'Winter'
https://www.kicker.de/dreimalige-weltmeisterin-vanessa-hinz-beendet-karriere-936026/artikel,https://www.kicker.de/dreimalige-weltmeisterin-vanessa-hinz-beendet-karriere-936026/artikel,0,www.kicker.de,Dreimalige Weltmeisterin Vanessa Hinz beendet Karriere,Vanessa Hinz macht Schluss mit Biathlon. In diesem Winter schaffte sie es auch wegen Verletzungen nicht zur WM.,"https://derivates.kicker.de/image/upload/w_4000,h_2250,c_fill,g_auto:subject/w_1200,q_auto/v1/2023/02/04/141935e5-2b4c-4c3f-aa38-acb2b4417f4d.jpeg",2023-02-04T17:24:55Z,,"Vanessa Hinz macht Schluss mit Biathlon. In diesem Winter schaffte sie es auch wegen Verletzungen nicht zur WM. 
 Die dreimalige Staffel-Weltmeisterin Vanessa Hinz beendet ihre Biathlon-Karriere. Di… [+1579 chars]",,de,'Winter'
https://www.welt.de/politik/ausland/article243595721/Ukraine-News-Rund-eine-halbe-Million-Haushalte-in-Odessa-ohne-Strom.html,https://www.welt.de/politik/ausland/article243595721/Ukraine-News-Rund-eine-halbe-Million-Haushalte-in-Odessa-ohne-Strom.html,0,www.welt.de,„Ausmaß ist beträchtlich“ – Rund eine halbe Million Haushalte in Odessa ohne Strom,Infolge der russischen Angriffe kam es in der Südukraine zu einer Havarie in einem Umspannwerk. Eine schnelle Wiederherstellung der Stromversorgung sei nicht möglich. Dmitri Medwedjew droht derweil nach den Waffenlieferungen an die Ukraine mit Vergeltungsschl…,https://img.welt.de/img/politik/ausland/mobile243603153/7701353177-ci16x9-w1200/UKRAINE-RUSSIA-CONFILCT-WAR.jpg,2023-02-04T18:20:00Z,https://web.archive.org/web/20230204192151/https://www.welt.de/politik/ausland/article243595721/Ukraine-News-Rund-eine-halbe-Million-Haushalte-in-Odessa-ohne-Strom.html,"In der südukrainischen Hafenstadt Odessa sind nach einer Havarie in einem Umspannwerk rund 500.000 Haushalte ohne Strom. Die Situation ist komplex, das Ausmaß des Unfalls ist beträchtlich, schrieb Mi… [+20864 chars]",,de,'Winter'
https://www.stern.de/gesellschaft/regional/nordrhein-westfalen/bundesliga--koelns-selke-wohl-nicht-schwer-verletzt-33167340.html,https://www.stern.de/gesellschaft/regional/nordrhein-westfalen/bundesliga--koelns-selke-wohl-nicht-schwer-verletzt-33167340.html,0,www.stern.de,Bundesliga: Kölns Selke wohl nicht schwer verletzt,"Winter-Zugang Davie Selke vom 1. FC Köln muss trotz seiner zweiten verletzungsbedingten Auswechslung innerhalb einer Woche wohl keine längere Pause einlegen. ""Stand jetzt sieht danach aus, dass es nicht richtig schlimm ist"", sagte Kölns Sportchef Christian Ke…",https://image.stern.de/33167342/t/YA/v1/w1440/r1.7778/-/04--urnnewsmldpacom2009010123020499476220v2w800h600l1093t706r2436b1600jpeg---415a5f9b1d32443c.jpg,2023-02-04T18:29:19Z,,"Winter-Zugang Davie Selke vom 1. FC Köln muss trotz seiner zweiten verletzungsbedingten Auswechslung innerhalb einer Woche wohl keine längere Pause einlegen. ""Stand jetzt sieht danach aus, dass es ni… [+1370 chars]",,de,'Winter'
https://www.transfermarkt.de/bemuhungen-bleiben-unbelohnt-gladbach-und-schalke-spielen-unentschieden/view/news/417810,https://www.transfermarkt.de/bemuhungen-bleiben-unbelohnt-gladbach-und-schalke-spielen-unentschieden/view/news/417810,0,www.transfermarkt.de,Bemühungen bleiben unbelohnt: Gladbach und Schalke spielen unentschieden,Der FC Schalke 04 bleibt 2023 sieglos und taumelt dem zweiten Bundesliga-Abstieg binnen zwei Jahren entgegen. Auch mit zahlreichen Winter-Zugängen kam der harmlose Tabellenletzte am...,https://tmssl.akamaized.net/images/foto/big/eder-balanta-schalke-2023-1675538887-101444.jpg?lm=1675538920,2023-02-04T19:26:25Z,,Der FC Schalke 04 bleibt 2023 sieglos und taumelt dem zweiten Bundesliga-Abstieg binnen zwei Jahren entgegen. Auch mit zahlreichen Winter-Zugängen kam der harmlose Tabellenletzte am Samstagabend im e… [+3454 chars],,de,'Winter'
https://www.welt.de/sport/article243603083/Enttaeuschender-West-Schlager-Schalke-erkaempft-sich-einen-Punkt-in-Moenchengladbach.html,https://www.welt.de/sport/article243603083/Enttaeuschender-West-Schlager-Schalke-erkaempft-sich-einen-Punkt-in-Moenchengladbach.html,0,www.welt.de,Schalke erkämpft sich einen Punkt in Mönchengladbach,Die gute Nachricht für Schalke: Das Team ist seit zwei Spielen ungeschlagen und ohne Gegentor. Die schlechte: Der mühsam erkämpfte Punkt bei Borussia Mönchengladbach ist für das Schlusslicht der Bundesliga eigentlich zu wenig. Die Gastgeber enttäuschen.,https://img.welt.de/img/sport/mobile243603257/5951353657-ci16x9-w1200/Borussia-Moenchengladbach-v-FC-Schalke-04-Bundesliga.jpg,2023-02-04T19:38:34Z,,Der FC Schalke 04 bleibt 2023 sieglos und taumelt dem zweiten Bundesliga-Abstieg binnen zwei Jahren entgegen. Auch mit zahlreichen Winter-Zugängen kam der Tabellenletzte im enttäuschenden West-Schlag… [+2626 chars],,de,'Gas'
