index,url,valid,domain,title,description,image,published,archive,content,quote,language,keyword
https://www.zeit.de/politik/ausland/2026-04/trump-iran-kriegsende-rubio-rede-gxe,https://www.zeit.de/politik/ausland/2026-04/trump-iran-kriegsende-rubio-rede-gxe,0,www.zeit.de,Iran: US-Angriffe im Iran nähern sich laut Trump dem Ende,"In ""vielleicht zwei Wochen"" könnte der Krieg beendet sein, sagt Trump. Rubio äußert sich ähnlich. Am Mittwochabend will Trump sich mit einer Rede ans Volk wenden.",https://img.zeit.de/politik/ausland/2026-04/trump-iran-kriegsende-rubio-rede-bild/wide__1300x731,2026-04-01T02:29:09Z,,US-Präsident Donald Trump hat ein baldiges Ende der Einsätze der US-Armee im Iran in Aussicht gestellt. Auf eine Journalistenfrage im Oval Office zu den erhöhten Spritpreisen im Zuge des Irankriegs a… [+3307 chars],,de,'Chamenei'
https://www.stern.de/news/rubio--usa-werden-beziehung-zur-nato-nach-iran-krieg--neu-bewerten-muessen--37273492.html,https://www.stern.de/news/rubio--usa-werden-beziehung-zur-nato-nach-iran-krieg--neu-bewerten-muessen--37273492.html,0,www.stern.de,"Rubio: USA werden Beziehung zur Nato nach Iran-Krieg ""neu bewerten müssen""","US-Außenminister Marco Rubio hat für die Zeit nach dem Iran-Krieg eine Veränderung des Verhältnisses der USA zur Nato angedeutet. ""Es besteht leider kein Zweifel daran, dass wir, nachdem dieser Konflikt beendet ist, diese Beziehung neu bewerten müssen"", sagte…",https://image.stern.de/37273494/t/P2/v1/w1440/r1.7778/-/01--rubio-vergangene-woche-nahe-paris---09bc01f29fc6ca95.jpg,2026-04-01T02:59:00Z,,"Kopiere den aktuellen Link
Zur Merkliste hinzufügen
US-Außenminister Marco Rubio hat für die Zeit nach dem Iran-Krieg eine Veränderung des Verhältnisses der USA zur Nato angedeutet. ""Es besteht lei… [+2195 chars]",,de,'Iran'
https://www.zeit.de/politik/2026-04/syrer-deutschland-gefluechtete-rueckkehr-friedrich-merz-al-scharaa,https://www.zeit.de/politik/2026-04/syrer-deutschland-gefluechtete-rueckkehr-friedrich-merz-al-scharaa,0,www.zeit.de,Syrer in Deutschland: Al-Scharaa dementiert angestrebte Rückkehrquote von 80 Prozent,Bundeskanzler Friedrich Merz hatte seine viel diskutierte Äußerung über die Ausreise von Syrern dem syrischen Übergangspräsidenten zugeschrieben. Dieser weist das zurück.,https://img.zeit.de/administratives/sharing/fallback-image-die-zeit/wide__1300x731,2026-04-01T03:54:25Z,,"Bundeskanzler Friedrich Merz (CDU) hat nach seiner umstrittenen Äußerung, dass 80 Prozent der in Deutschland lebenden Syrer binnen drei Jahren in ihr Heimatland zurückkehren sollten, diese dem syrisc… [+643 chars]",,de,'Friedrich Merz'
https://www.welt.de/politik/ausland/article69c61eccaf187d606b8148a0/iran-krieg-trump-will-us-truppen-sehr-bald-abziehen-und-kuendigt-wichtige-rede-an-die-us-buerger-an-liveticker.html,https://www.welt.de/politik/ausland/article69c61eccaf187d606b8148a0/iran-krieg-trump-will-us-truppen-sehr-bald-abziehen-und-kuendigt-wichtige-rede-an-die-us-buerger-an-liveticker.html,0,www.welt.de,Trump will US-Truppen „sehr bald“ abziehen – und kündigt „wichtige“ Rede an die US-Bürger an,"Eine iranische Drohne trifft einen voll beladenen Supertanker in Dubai, die Ölpreise gehen nach oben. US-Präsident Trump soll gegenüber Mitarbeitern angedeutet haben, dass die Öffnung der Straße von Hormus nicht zu seinen zentralen Kriegszielen zählt.",https://images.welt.de/69c61eccaf187d606b8148a0/4f173993fc8021a9b3607fd16d3ecc9f/ci16x9-w1200/2026-03-31t221323z-930562294-rc2yfkaa86oi-rtrmadp-3-usa-trump-jpg,2026-04-01T04:56:00Z,,US-Präsident Trump stellt ein Ende der Angriffe der USA auf den Iran innerhalb von zwei bis drei Wochen in Aussicht. Am Mittwoch will er sich mit einem wichtigen Update an die Bürger wenden. Mehr im … [+12559 chars],,de,'Krieg'
https://www.stern.de/news/trump-stellt-ende-der-us-angriffe-auf-den-iran-in-aussicht---ansprache-an-die-nation-am-mittwoch-37273220.html,https://www.stern.de/news/trump-stellt-ende-der-us-angriffe-auf-den-iran-in-aussicht---ansprache-an-die-nation-am-mittwoch-37273220.html,0,www.stern.de,Trump stellt Ende der US-Angriffe auf den Iran in Aussicht - Ansprache an die Nation am Mittwoch,Gut einen Monat nach Beginn des Iran-Krieges hat US-Präsident Donald Trump ein baldiges Ende des Militäreinsatzes im Iran in Aussicht gestellt. Auf eine Journalistenfrage zu den erhöhten Spritpreisen im Zuge des Iran-Kriegs antwortete Trump am Dienstag (Ortsz…,https://image.stern.de/37273626/t/Ca/v1/w1440/r1.7778/-/01--trump-im-oval-office---026fc3ba4c190339.jpg,2026-04-01T04:57:35Z,,"Kopiere den aktuellen Link
Zur Merkliste hinzufügen
Gut einen Monat nach Beginn des Iran-Krieges hat US-Präsident Donald Trump ein baldiges Ende des Militäreinsatzes im Iran in Aussicht gestellt. A… [+3502 chars]",,de,'Chamenei'
https://www.zeit.de/2026/15/oelknappheit-asien-nahost-strasse-von-hormus-treibstoff,https://www.zeit.de/2026/15/oelknappheit-asien-nahost-strasse-von-hormus-treibstoff,0,www.zeit.de,"Ölknappheit: Kurz duschen, bitte","In Asien beginnt es, Europa könnte folgen: Wegen des Irankriegs muss vielleicht bald Energie rationiert werden. Der Kanzler sollte solche Szenarien offen ansprechen.",https://img.zeit.de/2026/15/kurz-duschen-bitte-bild-2/wide__1300x731,2026-04-01T05:40:17Z,,"Das ist die Lage in Woche fünf dieses Krieges im Nahen Osten: Auf den Philippinen wurde wegen Treibstoffmangels der nationale Notstand ausgerufen, in Sri Lanka hat die Regierung aus demselben Grund d… [+809 chars]",,de,'Energie'
https://www.faz.net/aktuell/sport/fussball-wm/fussball-wm-letzte-chance-auf-tickets-accg-200692275.html,https://www.faz.net/aktuell/sport/fussball-wm/fussball-wm-letzte-chance-auf-tickets-accg-200692275.html,0,www.faz.net,Nach play-off-finals: Letzte Chance auf WM-Tickets: Was Fans wissen müssen,"Wer bei der Fußball-WM live dabei sein will, muss schnell sein. Heute startet die FIFA die letzte Verkaufsphase. Fragen und Antworten zum Thema Kosten, Visum und Sicherheit.",https://media0.faz.net/image/w1200h627/1a45fb5a6388/w2340h1222x0y178o/202603/43601.0.1916348777/im-sommer-geht-es-in-den-usa.webp,2026-04-01T06:34:19Z,,"Zweieinhalb Monate vor Anpfiff der Fußball-WM bringt der Weltverband FIFA zum wohl letzten Mal Tickets auf den Markt. Für Fans gibt es noch einmal die Chance, das XXL-Turnier in den USA, Mexiko und K… [+4926 chars]",,de,'Katar'
https://www.welt.de/politik/ausland/article69c61eccaf187d606b8148a0/iran-krieg-emirate-wollen-blockade-der-strasse-von-hormus-laut-bericht-gewaltsam-beenden-dax-macht-kurssprung-liveticker.html,https://www.welt.de/politik/ausland/article69c61eccaf187d606b8148a0/iran-krieg-emirate-wollen-blockade-der-strasse-von-hormus-laut-bericht-gewaltsam-beenden-dax-macht-kurssprung-liveticker.html,0,www.welt.de,Emirate wollen Blockade der Straße von Hormus laut Bericht gewaltsam beenden – Dax macht Kurssprung,"Eine iranische Drohne trifft einen voll beladenen Supertanker in Dubai, die Ölpreise gehen nach oben. US-Präsident Trump soll gegenüber Mitarbeitern angedeutet haben, dass die Öffnung der Straße von Hormus nicht zu seinen zentralen Kriegszielen zählt.",https://images.welt.de/69c61eccaf187d606b8148a0/926bc457f8bd885e57909ddb24d5511e/ci16x9-w1200/apdpa-32b90200620ee76b-jpg,2026-04-01T07:50:00Z,,"Die Vereinigten Arabischen Emirate sind laut dem Wall Street Journal bereit, im Iran-Krieg militärisch einzugreifen. Der deutsche Aktienmarkt startet dank Hoffnung auf ein Kriegsende mit kräftigen Ge… [+15273 chars]",,de,'Chamenei'
https://www.zeit.de/news/2026-04/01/iran-krieg-truebt-stimmung-in-chinas-industrie,https://www.zeit.de/news/2026-04/01/iran-krieg-truebt-stimmung-in-chinas-industrie,0,www.zeit.de,Gestörte Lieferketten: Iran-Krieg trübt Stimmung in Chinas Industrie,Hier finden Sie Informationen zu dem Thema „Gestörte Lieferketten“. Lesen Sie jetzt „Iran-Krieg trübt Stimmung in Chinas Industrie“.,https://img.zeit.de/news/2026-04/01/iran-krieg-truebt-stimmung-in-chinas-industrie-image-group/wide__1300x731,2026-04-01T07:53:39Z,,"Vor dem Hintergrund des Iran-Kriegs hat sich die Stimmung in Chinas Industrie im März laut einer Umfrage leicht eingetrübt. Der Einkaufsmanagerindex des Anbieters RatingDog fiel auf 50,8 Punkte nach … [+1492 chars]",,de,'Iran'
https://www.zeit.de/news/2026-04/01/institute-halbieren-wegen-iran-kriegs-wachstumsprognose,https://www.zeit.de/news/2026-04/01/institute-halbieren-wegen-iran-kriegs-wachstumsprognose,0,www.zeit.de,Konjunktur: Institute halbieren wegen Iran-Kriegs Wachstumsprognose,Hier finden Sie Informationen zu dem Thema „Konjunktur“. Lesen Sie jetzt „Institute: Iran-Krieg bremst Wachstum und treibt Inflation“.,https://img.zeit.de/news/2026-04/01/institute-halbieren-wegen-iran-kriegs-wachstumsprognose-image-group/wide__1300x731,2026-04-01T08:00:04Z,,"Die Folgen des Iran-Kriegs bremsen das Wirtschaftswachstum in Deutschland aus. Führende Forschungsinstitute rechnen damit, dass das Bruttoinlandsprodukt 2026 nur noch um 0,6 Prozent zulegt, wie die I… [+4602 chars]",,de,'Iran'
https://www.morgenpost.de/wirtschaft/article411592586/heizoelpreise-aktuell-heute-1-april-iran-krieg-nahost-heizoel-kaufen-heizung.html,https://www.morgenpost.de/wirtschaft/article411592586/heizoelpreise-aktuell-heute-1-april-iran-krieg-nahost-heizoel-kaufen-heizung.html,0,www.morgenpost.de,"Heizölpreise heute (Mittwoch, 1. April): Der Preis pro Liter aktuell",Der Iran-Krieg treibt die Heizölpreise in die Höhe und stellt Verbraucher vor neue Herausforderungen. Lohnt sich jetzt eine Bestellung?,https://img.sparknews.funkemedien.de/406858449/406858449_1728458201_v16_9_1600.jpeg,2026-04-01T08:18:16Z,,Die Sommerzeit ist da - die sommerlichen Temperaturen lassen allerdings noch auf sich warten. Bei Höchsttemperaturen von 12 Grad und Regen dürften in einigen deutschen Haushalten die Heizugen noch la… [+8507 chars],,de,'Iran'
https://www.zeit.de/wirtschaft/2026-04/strom-erneuerbare-energie-wind-sonne,https://www.zeit.de/wirtschaft/2026-04/strom-erneuerbare-energie-wind-sonne,0,www.zeit.de,Energie: Mehr als die Hälfte des Stroms in Deutschland aus erneuerbaren Quellen,Konventionelle Energieträger sorgten im ersten Quartal für weniger als die Hälfte des verbrauchten Stroms. Mehr als die Hälfte kam aus regenerativen Quellen.,https://img.zeit.de/wirtschaft/2026-04/abdeckung-deutschland-stromversorgung-regenerative-energie-bild/wide__1300x731,2026-04-01T09:08:52Z,,"Mehr als die Hälfte des deutschen Stromverbrauchs ist im ersten Quartal aus Sonne, Wind und anderen regenerativen Quellen gedeckt worden. Dem Bundesverband der Energie- und Wasserwirtschaft (BDEW) zu… [+2478 chars]",,de,'Energie'
https://www.zeit.de/news/2026-04/01/trump-spricht-von-nato-austritt-papiertiger,https://www.zeit.de/news/2026-04/01/trump-spricht-von-nato-austritt-papiertiger,0,www.zeit.de,"Iran-Krieg: Trump spricht von Nato-Austritt: ""Papiertiger""","Hier finden Sie Informationen zu dem Thema „Iran-Krieg“. Lesen Sie jetzt „Trump spricht von Nato-Austritt: ""Papiertiger""“.",https://img.zeit.de/news/2026-04/01/trump-spricht-von-nato-austritt-papiertiger-image-group/wide__1300x731,2026-04-01T09:41:07Z,,US-Präsident Donald Trump und sein Außenminister Marco Rubio haben erneut den Austritt der Vereinigten Staaten aus der Nato angedroht. Trump bezeichnete die Allianz im Gespräch der britischen Zeitung… [+1286 chars],,de,'Krieg'
https://www.zeit.de/news/2026-04/01/thueringer-energie-ag-neuvertraege-bei-gas-deutlich-teurer,https://www.zeit.de/news/2026-04/01/thueringer-energie-ag-neuvertraege-bei-gas-deutlich-teurer,0,www.zeit.de,Energiekrise: Thüringer Energie AG: Neuverträge bei Gas deutlich teurer,Hier finden Sie Informationen zu dem Thema „Energiekrise“. Lesen Sie jetzt „Thüringer Energie AG: Neuverträge bei Gas deutlich teurer“.,https://img.zeit.de/news/2026-04/01/thueringer-energie-ag-neuvertraege-bei-gas-deutlich-teurer-image-group/wide__1300x731,2026-04-01T11:33:16Z,,"Neu abgeschlossene Lieferverträge für Gas werden für Kunden der Thüringer Energie AG (TEAG) in den kommenden Wochen deutlich teurer. In der ersten Zeit nach Beginn des Iran-Kriegs, der weltweit die G… [+1021 chars]",,de,'Gas'
https://www.welt.de/politik/ausland/article69c61eccaf187d606b8148a0/iran-krieg-trump-irans-neuer-regime-praesident-hat-die-usa-um-eine-waffenruhe-gebeten-liveticker.html,https://www.welt.de/politik/ausland/article69c61eccaf187d606b8148a0/iran-krieg-trump-irans-neuer-regime-praesident-hat-die-usa-um-eine-waffenruhe-gebeten-liveticker.html,0,www.welt.de,"„Irans neuer Regime-Präsident hat die USA um eine Waffenruhe gebeten“, sagt Trump","Eine iranische Drohne trifft einen voll beladenen Supertanker in Dubai, die Ölpreise gehen nach oben. US-Präsident Trump soll gegenüber Mitarbeitern angedeutet haben, dass die Öffnung der Straße von Hormus nicht zu seinen zentralen Kriegszielen zählt.",https://images.welt.de/69c61eccaf187d606b8148a0/c2ba3821cd08779860e911c841522c89/ci16x9-w1200/apdpa-32b90200fe97295b-jpg,2026-04-01T12:57:00Z,,"US-Präsident Trump wird sich mit einer Rede an die Bürger seines Landes wenden. Zuvor teilt er mit, dass der Iran eine Waffenruhe wolle. Zugleich verbindet er seine Botschaft mit einer martialischen … [+17450 chars]",,de,'Iran'
https://www.stern.de/news/trump-stellt-ende-des-iran-kriegs-in-aussicht---teheran-soll-waffenruhe-angeboten-haben-37273220.html,https://www.stern.de/news/trump-stellt-ende-des-iran-kriegs-in-aussicht---teheran-soll-waffenruhe-angeboten-haben-37273220.html,0,www.stern.de,Trump stellt Ende des Iran-Kriegs in Aussicht - Teheran soll Waffenruhe angeboten haben,"Rund einen Monat nach dem Beginn des Kriegs Israels und der USA gegen den Iran hat US-Präsident Donald Trump ein baldiges Ende der Angriffe in Aussicht gestellt. Trump sagte im Weißen Haus vor Journalisten, die USA würden ""sehr bald"" den Iran verlassen, am Mi…",https://image.stern.de/37275784/t/Jh/v1/w1440/r1.7778/-/01--trump-im-oval-office---6c414e6184e58ae0.jpg,2026-04-01T13:46:42Z,,"Kopiere den aktuellen Link
Zur Merkliste hinzufügen
Rund einen Monat nach dem Beginn des Kriegs Israels und der USA gegen den Iran hat US-Präsident Donald Trump ein baldiges Ende der Angriffe in Au… [+4193 chars]",,de,'Krieg'
https://www.n-tv.de/wirtschaft/Hohe-Energiepreise-Sehr-gut-id30674517.html,https://www.n-tv.de/wirtschaft/Hohe-Energiepreise-Sehr-gut-id30674517.html,0,www.n-tv.de,Hört die Signale: Hohe Energiepreise? Sehr gut!,"Die Energiekrise trifft Deutschland. Doch es wäre ein Fehler, jetzt mit Subventionen gegenzusteuern. Denn die hohen Preise haben uns etwas zu sagen.",https://www.n-tv.de/img/30674873/1775061192/Img_16_9/1200/Bamberg-Deutschland-01-04.jpg,2026-04-01T14:33:30Z,,"Sprit ist teuer. (Foto: picture alliance / Fotostand)
Die Energiekrise trifft Deutschland. Doch es wäre ein Fehler, jetzt mit Subventionen gegenzusteuern. Denn die hohen Preise haben uns etwas zu sa… [+2492 chars]",,de,'frieren'
https://www.zeit.de/digital/games/2026-03/super-mario-galaxy-film-kino-nintendo-gxe,https://www.zeit.de/digital/games/2026-03/super-mario-galaxy-film-kino-nintendo-gxe,0,www.zeit.de,"""Der Super Mario Galaxy Film"": Gas, Wasser, Sterne","Verdammter zweiter Teil? Der ""Super Mario Galaxy Film"" bringt den berühmtesten Klempner der Welt zurück auf die Leinwand. Funktioniert das so gut wie beim ersten Mal?",https://img.zeit.de/digital/2026-03/super-mario-galaxy-film-kino-nintendo-bild/wide__1300x731,2026-04-01T14:55:23Z,,"Sollte sich
noch jemand fragen, welche übermenschlichen Ansprüche heute oft an Mütter gestellt
werden, sei ein Blick auf Rosalina empfohlen. Lidstrich, Frisur und
schulterfreies Satinkleid sitzen … [+719 chars]",,de,'Gas'
https://www.welt.de/politik/ausland/plus69ccd76527bf87e811dd851c/enthuellungen-und-misstrauen-jeder-achtet-darauf-was-er-sagt-wie-ungarns-direktleitung-nach-moskau-die-eu-laehmt.html,https://www.welt.de/politik/ausland/plus69ccd76527bf87e811dd851c/enthuellungen-und-misstrauen-jeder-achtet-darauf-was-er-sagt-wie-ungarns-direktleitung-nach-moskau-die-eu-laehmt.html,0,www.welt.de,"„Jeder achtet darauf, was er sagt“ – Wie Ungarns „Direktleitung“ nach Moskau die EU lähmt","Die Regierung in Budapest soll den Kreml über vertrauliche EU-Gespräche informiert haben. Einigen europäischen Partnern gilt die Affäre als weiterer Beleg dafür, dass Ungarn die Zusammenarbeit zunehmend torpediert. Doch auch andere Länder geraten in den Fokus.",https://images.welt.de/69ccd76527bf87e811dd851c/cd958b03d1982d655bcd2329f5a92383-master/ci16x9-w1200/2026-03-27t070059z-1040166420-rc2viiaztj54-rtrmadp-3-hungary-election-eu-jpg,2026-04-01T15:01:20Z,,"Die Regierung in Budapest soll den Kreml über vertrauliche EU-Gespräche informiert haben. Einigen europäischen Partnern gilt die Affäre als weiterer Beleg dafür, dass Ungarn die Zusammenarbeit zunehm… [+60 chars]",,de,'Kreml'
https://www.n-tv.de/politik/Finnland-Russischer-Oelexport-ueber-Ostsee-nach-Angriffen-fast-ausgesetzt-id30674128.html,https://www.n-tv.de/politik/Finnland-Russischer-Oelexport-ueber-Ostsee-nach-Angriffen-fast-ausgesetzt-id30674128.html,0,www.n-tv.de,Seit rund einer Woche: Finnland: Russischer Ölexport über Ostsee nach Angriffen fast ausgesetzt,"Russland will von den durch den Iran-Krieg gestiegenen Ölpreisen profitieren. Um die Pläne des Kreml zu durchkreuzen, verstärkt die Ukraine zuletzt ihre Angriffe auf die russische Ölinfrastruktur. Auch zwei Exporthäfen an der Ostsee werden beschossen - mit Fo…",https://www.n-tv.de/img/30674198/1775054183/Img_16_9/1200/A-satellite-near-infrared-image-shows-smoke-rising-from-oil-storage-tanks-at-Russia-s-Baltic-Sea-port-of-Ust-Luga-which-was-struck-multiple-times-in-Ukrainian-attacks-in-Ust-Luga-Russia-March-29-2026-Vantor-Handout-via-REUTERS-THIS-IMAGE-HAS-BEEN-SUPPLIED-BY-A-THIRD-PARTY-NO-RESALES-NO-ARCHIVES-MANDATORY-CREDIT-DO-NOT-OBSCURE-LOGO.jpg,2026-04-01T15:25:36Z,,"Rauch steigt nach ukrainischen Drohnenangriffen am 29. März aus Öltanks im russischen Hafen Ust-Luga auf. Der Hafen wurde binnen kürzester Zeit fünfmal getroffen. (Foto: via REUTERS)
Russland will v… [+2715 chars]",,de,'Kreml'
https://www.n-tv.de/politik/Holt-sich-Trump-das-iranische-Uran-um-den-Krieg-zu-beenden-id30674345.html,https://www.n-tv.de/politik/Holt-sich-Trump-das-iranische-Uran-um-den-Krieg-zu-beenden-id30674345.html,0,www.n-tv.de,"Ende des Atomprogramms als Ziel: Holt sich Trump das iranische Uran, um den Krieg zu beenden?","In wenigen Wochen will US-Präsident Trump den Iran-Krieg beenden. Dabei stellt sich die Frage nach seinen Kriegszielen. Oft wird das Ende des iranischen Atomprogramms genannt. Zum Beispiel, indem die USA das angereicherte Uran aus dem Land holen. Es wäre eine…",https://www.n-tv.de/img/30674451/1775056712/Img_16_9/1200/A-satellite-image-shows-un.jpg,2026-04-01T15:28:07Z,,"Das Satellitenbild zeigt Eingänge in die iranische Atomanlage in Isfahan. Laut IAEA befindet sich dort ein Teil des angereicherten Urans. (Foto: via REUTERS, Vantor)
In wenigen Wochen will US-Präsid… [+7015 chars]",,de,'Krieg'
https://www.stern.de/news/trump-stellt-ende-des-iran-kriegs-in-aussicht---teheran-dementiert-waffenruhe-angebot-37273220.html,https://www.stern.de/news/trump-stellt-ende-des-iran-kriegs-in-aussicht---teheran-dementiert-waffenruhe-angebot-37273220.html,0,www.stern.de,Trump stellt Ende des Iran-Kriegs in Aussicht - Teheran dementiert Waffenruhe-Angebot,"Rund einen Monat nach dem Beginn des Iran-Kriegs hat US-Präsident Donald Trump ein baldiges Ende der Angriffe in Aussicht gestellt. Trump sagte im Weißen Haus vor Journalisten, die USA würden ""sehr bald"" den Iran verlassen. Am Mittwochmorgen schrieb er vom An…",https://image.stern.de/37276240/t/Z3/v1/w1440/r1.7778/-/01--trump-im-oval-office---fa5fbd393ae726ca.jpg,2026-04-01T16:43:16Z,,"Kopiere den aktuellen Link
Zur Merkliste hinzufügen
Rund einen Monat nach dem Beginn des Iran-Kriegs hat US-Präsident Donald Trump ein baldiges Ende der Angriffe in Aussicht gestellt. Trump sagte i… [+4320 chars]",,de,'Krieg'
https://www.welt.de/politik/ausland/article69c61eccaf187d606b8148a0/iran-krieg-offenbar-groesster-raketenangriff-auf-israel-seit-kriegsbeginn-liveticker.html,https://www.welt.de/politik/ausland/article69c61eccaf187d606b8148a0/iran-krieg-offenbar-groesster-raketenangriff-auf-israel-seit-kriegsbeginn-liveticker.html,0,www.welt.de,Offenbar größter Raketenangriff auf Israel seit Kriegsbeginn,Israel hat einem Medienbericht zufolge den größten Raketenangriff sei Kriegsbeginn erlebt. Die USA sichern iranischen Spitzenpolitikern Schutz vor Angriffen zu. Mehr im Liveticker.,https://images.welt.de/69c61eccaf187d606b8148a0/f6344284327a2a469be8351011514dd1/ci16x9-w1200/1775027774555-afp-a6e73ra-jpg,2026-04-01T17:30:00Z,,Israel hat einem Medienbericht zufolge den größten Raketenangriff sei Kriegsbeginn erlebt. Die USA sichern iranischen Spitzenpolitikern Schutz vor Angriffen zu. Mehr im Liveticker.Seit Ende Februar g… [+20238 chars],,de,'Krieg'
https://www.zeit.de/politik/deutschland/2026-04/friedrich-merz-aeusserung-syrien-regierung,https://www.zeit.de/politik/deutschland/2026-04/friedrich-merz-aeusserung-syrien-regierung,0,www.zeit.de,Friedrich Merz: Mal wieder verstolpert,Mit seiner Aussage zur Rückkehr von Syrern richtet Friedrich Merz ein Deutungschaos an. Nicht zum ersten Mal. Wann lernt der Bundeskanzler dazu?,https://img.zeit.de/politik/deutschland/2026-04/friedrich-merz-aeusserung-syrien-regierung-bild/wide__1300x731,2026-04-01T18:16:28Z,,"Einer muss gelogen haben. Der deutsche Bundeskanzler Friedrich Merz oder der syrische Präsident Ahmed al-Scharaa. Bevor wir uns aber fragen, wer denn nun die Zielmarke in die Welt setzte, dass 80 Pro… [+353 chars]",,de,'Friedrich Merz'
https://www.welt.de/politik/ausland/article69cdbacd54836f652f88bbc2/rede-an-die-nation-trump-kuendigt-an-den-iran-in-den-naechsten-wochen-extrem-hart-zu-treffen.html,https://www.welt.de/politik/ausland/article69cdbacd54836f652f88bbc2/rede-an-die-nation-trump-kuendigt-an-den-iran-in-den-naechsten-wochen-extrem-hart-zu-treffen.html,0,www.welt.de,"Trump kündigt an, den Iran in den nächsten Wochen „extrem hart zu treffen“","US-Präsident Trump erklärt den Einsatz gegen Iran für nahezu abgeschlossen: Die wichtigsten Ziele seien erreicht, Militär und Führung des Landes schwer getroffen. Jedoch wolle man in den nächsten zwei bis drei Wochen „extrem hart“ zuschlagen.",https://images.welt.de/69cdbacd54836f652f88bbc2/82559b0373d01f76fc6dba5d1e1081fe-master/ci16x9-w1200/dpa-com-20090101-260402-99-15397-jpg,2026-04-02T01:32:16Z,,"US-Präsident Trump erklärt den Einsatz gegen Iran für nahezu abgeschlossen: Die wichtigsten Ziele seien erreicht, Militär und Führung des Landes schwer getroffen. Jedoch wolle man in den nächsten zwe… [+1814 chars]",,de,'Chamenei'
https://www.zeit.de/news/2026-04/02/trump-hauptziele-im-iran-nahezu-erreicht,https://www.zeit.de/news/2026-04/02/trump-hauptziele-im-iran-nahezu-erreicht,0,www.zeit.de,Iran-Krieg: Trump: Hauptziele im Iran nahezu erreicht,Hier finden Sie Informationen zu dem Thema „Iran-Krieg“. Lesen Sie jetzt „Trump: Hauptziele im Iran nahezu erreicht“.,https://img.zeit.de/news/2026-04/02/trump-hauptziele-im-iran-nahezu-erreicht-image-group/wide__1300x731,2026-04-02T01:33:09Z,,Die USA haben nach Darstellung von US-Präsident Donald Trump ihre Hauptziele im Iran-Krieg nahezu erreicht. Die iranische Marine und Luftwaffe seien zerstört und die Raketen des Landes so gut wie auf… [+1216 chars],,de,'Iran'
https://www.zeit.de/news/2026-04/02/trump-zu-energieengpaessen-kauft-us-amerikanisches-oel,https://www.zeit.de/news/2026-04/02/trump-zu-energieengpaessen-kauft-us-amerikanisches-oel,0,www.zeit.de,Iran-Krieg: Trump zu Energieengpässen: Kauft US-amerikanisches Öl,Hier finden Sie Informationen zu dem Thema „Iran-Krieg“. Lesen Sie jetzt „Trump zu Energieengpässen: Kauft US-amerikanisches Öl“.,https://img.zeit.de/news/2026-04/02/trump-zu-energieengpaessen-kauft-us-amerikanisches-oel-image-group/wide__1300x731,2026-04-02T01:45:41Z,,Von den aktuellen Öl-Engpässen betroffene Länder sollten nach Meinung von US-Präsident Donald Trump ihr Öl nun aus den USA beziehen. «Kauft Öl von den Vereinigten Staaten. Wir haben reichlich. Wir ha… [+739 chars],,de,'Iran'
https://www.stern.de/news/trump--us-ziele-im-iran-krieg-stehen--kurz-vor-der-vollendung--37276596.html,https://www.stern.de/news/trump--us-ziele-im-iran-krieg-stehen--kurz-vor-der-vollendung--37276596.html,0,www.stern.de,"Trump: US-Ziele im Iran-Krieg stehen ""kurz vor der Vollendung""","Die USA stehen nach den Worten von US-Präsident Donald Trump ""kurz vor der Vollendung"" ihrer Ziele im Iran-Krieg. ""Heute Abend freue ich mich, sagen zu können, dass diese zentralen strategischen Ziele kurz vor der Vollendung stehen"", sagte Trump am Mittwochab…",https://image.stern.de/37276598/t/bN/v1/w1440/r1.7778/-/02--trump-bei-seiner-ansprache-an-die-nation---a2985a0ee766edb1.jpg,2026-04-02T01:55:50Z,,"Kopiere den aktuellen Link
Zur Merkliste hinzufügen
Die USA stehen nach den Worten von US-Präsident Donald Trump ""kurz vor der Vollendung"" ihrer Ziele im Iran-Krieg. ""Heute Abend freue ich mich, sa… [+1555 chars]",,de,'Chamenei'
