index,url,valid,domain,title,description,image,published,archive,content,quote,language,keyword
https://www.welt.de/politik/ausland/article69cf05f2cdf80d124bb0cc45/krieg-in-nahost-trump-will-verschuettetes-uran-bergen-und-droht-irans-waffenlieferanten-mit-strafzoellen-liveticker.html,https://www.welt.de/politik/ausland/article69cf05f2cdf80d124bb0cc45/krieg-in-nahost-trump-will-verschuettetes-uran-bergen-und-droht-irans-waffenlieferanten-mit-strafzoellen-liveticker.html,0,www.welt.de,Trump will verschüttetes Uran bergen – und droht Irans Waffenlieferanten mit Strafzöllen,Die werden Donald Trump zufolge mit dem Iran zusammenarbeiten. Trotz Waffenruhe gibt es offenbar erneut Explosionen im Iran. Auch die Vereinigten Arabischen Emirate und Kuwait berichten von weiteren Angriffen. Mehr im Liveticker.,https://images.welt.de/69cf05f2cdf80d124bb0cc45/adbd071c909596907012b1f8c8754318/ci16x9-w1200/2026-04-07t211037z-1241134980-rc2vjkadvxzj-rtrmadp-3-usa-trump-iran-civilization-jpg,2026-04-08T12:10:00Z,,"Die USA werden Donald Trump zufolge mit dem Iran zusammenarbeiten, um bei Angriffen verschüttetes Uran zu bergen. Außerdem droht der US-Präsident den Waffenlieferanten Teherans. Mehr im Liveticker.Am… [+16977 chars]",,de,'Kreml'
https://www.bild.de/leben-wissen/wohnen-living/wichtig-fuer-eigentuemer-das-aendert-sich-ab-mai-beim-energieausweis-69d60d598b52f2de5d6b88c4,https://www.bild.de/leben-wissen/wohnen-living/wichtig-fuer-eigentuemer-das-aendert-sich-ab-mai-beim-energieausweis-69d60d598b52f2de5d6b88c4,0,www.bild.de,"Neue Skala, neue Pflichten - So wird der Energieausweis für Eigentümer umgekrempelt","Wer seine Immobilie verkaufen oder neu vermieten will, braucht einen Energieausweis – sonst droht ein Bußgeld.","https://images.bild.de/69d60d598b52f2de5d6b88c4/fcad5f7e128bd2d76ac0607aa2dce242,741fdd57?w=1280",2026-04-08T14:42:41Z,,"TTS-Player überspringenArtikel weiterlesenOhne Energieausweis geht bei Verkauf oder Vermietung nichts und wer ihn nicht vorlegt, riskiert bis zu 10.000 Euro Bußgeld. Seit 2020 regelt das Gebäudeenerg… [+2485 chars]",,de,'Dämmung'
https://www.welt.de/politik/ausland/article69cf05f2cdf80d124bb0cc45/krieg-in-nahost-iran-erwaegt-ausstieg-aus-waffenruhe-treffen-mit-usa-fuer-freitag-geplant-liveticker.html,https://www.welt.de/politik/ausland/article69cf05f2cdf80d124bb0cc45/krieg-in-nahost-iran-erwaegt-ausstieg-aus-waffenruhe-treffen-mit-usa-fuer-freitag-geplant-liveticker.html,0,www.welt.de,Iran erwägt Ausstieg aus Waffenruhe – Treffen mit USA für Freitag geplant,"Nach nicht einmal 24 Stunden erwägt der Iran bereits, aus der vereinbarten Waffenruhe mit den USA auszusteigen. US-Republikaner Graham äußert Zweifel an einer diplomatischen Lösung des Iran-Kriegs. Mehr im Liveticker.",https://images.welt.de/69cf05f2cdf80d124bb0cc45/53e55904e31eb5a68c31220dc710bde1/ci16x9-w1200/dpa-com-20090101-260408-99-62088-jpg,2026-04-08T15:03:00Z,,"Nach nicht einmal 24 Stunden erwägt der Iran bereits, aus der vereinbarten Waffenruhe mit den USA auszusteigen. US-Republikaner Graham äußert Zweifel an einer diplomatischen Lösung des Iran-Kriegs. M… [+22056 chars]",,de,'Iran'
https://www.zeit.de/politik/2026-04/usa-iran-strasse-von-hormus-nachrichtenpodcast,https://www.zeit.de/politik/2026-04/usa-iran-strasse-von-hormus-nachrichtenpodcast,0,www.zeit.de,"USA und Iran: Ein Waffenstillstand, viele Deutungen","Donald Trump feiert den Waffenstillstand mit Iran als Triumph, doch auch die Regierung in Teheran sieht sich als Sieger. Und: Wie geht es weiter in der Straße von Hormus?",https://img.zeit.de/politik/ausland/2026-04/usa-iran-strasse-von-hormus/wide__1300x731,2026-04-08T15:08:45Z,,"Die zweiwöchige Waffenruhe der USA mit dem Iran sorgt international für Erleichterung. Bundeskanzler Friedrich Merz dankte Pakistan für die Vermittlung zwischen den Konfliktparteien. ""Ziel muss nun s… [+2783 chars]",,de,'Iran'
https://www.stern.de/news/experten-rechnen-trotz-iran-waffenruhe-noch-monatelang-mit-wirtschaftlichen-folgen-37291792.html,https://www.stern.de/news/experten-rechnen-trotz-iran-waffenruhe-noch-monatelang-mit-wirtschaftlichen-folgen-37291792.html,0,www.stern.de,Experten rechnen trotz Iran-Waffenruhe noch monatelang mit wirtschaftlichen Folgen,"Die wirtschaftlichen Folgen des Krieges gegen den Iran werden voraussichtlich noch monatelang zu spüren sein. Der Chef der Internationalen Energie-Agentur, Fatih Birol, sprach von ""vielen Monaten, wenn nicht Jahren"", die eine Normalisierung dauern werde. Ener…",https://image.stern.de/37291794/t/qn/v1/w1440/r1.7778/-/08--lngtanker---39ed1fd134adf730.jpg,2026-04-08T15:52:01Z,,"Kopiere den aktuellen Link
Zur Merkliste hinzufügen
Die wirtschaftlichen Folgen des Krieges gegen den Iran werden voraussichtlich noch monatelang zu spüren sein. Der Chef der Internationalen Energi… [+2497 chars]",,de,'heizen'
https://www.tagesschau.de/newsticker/liveblog-iran-mittwoch-106.html,https://www.tagesschau.de/newsticker/liveblog-iran-mittwoch-106.html,0,www.tagesschau.de,Iran-Liveblog: ++ Vance warnt Iran vor Bruch der Waffenruhe ++,"US-Vizepräsident Vance hat Iran mit Konsequenzen gedroht, sollte Teheran die Waffenruhe brechen. Die Mullahs wiederum werfen Washington vor, gegen mehrere Punkte der Einigung zu verstoßen.",https://images.tagesschau.de/image/155653fb-6459-4415-b608-0e9a3b747a56/AAABnW68Cjk/AAABnSSvrFg/16x9-big/vance-156.jpg?width=1280,2026-04-08T20:18:40Z,,"Stand: 08.04.2026 22:18 Uhr
US-Vizepräsident Vance hat Iran mit Konsequenzen gedroht, sollte Teheran die Waffenruhe brechen. Die Mullahs wiederum werfen Washington vor, gegen mehrere Punkte der Eini… [+41522 chars]",,de,'Iran'
https://www.tagesschau.de/newsticker/liveblog-iran-donnerstag-106.html,https://www.tagesschau.de/newsticker/liveblog-iran-donnerstag-106.html,0,www.tagesschau.de,Iran-Liveblog: ++ Macron verurteilt Israels Angriffe im Libanon ++,"Frankreichs Präsident Macron zufolge stellen die anhaltenden israelischen Angriffe im Libanon eine ""direkte Bedrohung"" für die Waffenruhe zwischen den USA und Iran dar. Bahrain hat seinen Luftraum wieder geöffnet.",https://images.tagesschau.de/image/dbd029e8-68bf-4165-9db0-7e07156b8930/AAABnW9NBfs/AAABnSSvrFg/16x9-big/macron-986.jpg?width=1280,2026-04-08T22:48:36Z,,"Stand: 09.04.2026 00:48 Uhr
Frankreichs Präsident Macron zufolge stellen die anhaltenden israelischen Angriffe im Libanon eine ""direkte Bedrohung"" für die Waffenruhe zwischen den USA und Iran dar. B… [+2179 chars]",,de,'Iran'
https://www.zeit.de/news/2026-04/09/griechenlands-premier-hormus-gebuehr-voellig-inakzeptabel,https://www.zeit.de/news/2026-04/09/griechenlands-premier-hormus-gebuehr-voellig-inakzeptabel,0,www.zeit.de,"Iran-Krieg: Griechenlands Premier: Hormus-Gebühr ""völlig inakzeptabel""","Hier finden Sie Informationen zu dem Thema „Iran-Krieg“. Lesen Sie jetzt „Griechenlands Premier: Hormus-Gebühr ""völlig inakzeptabel""“.",https://img.zeit.de/news/2026-04/09/griechenlands-premier-hormus-gebuehr-voellig-inakzeptabel-image-group/wide__1300x731,2026-04-09T00:46:41Z,,"Der griechische Regierungschef Kyriakos Mitsotakis fordert nach Ende des Iran-Krieges einen gebührenfreien und sicheren Schiffsverkehr durch die Straße von Hormus. «Ich glaube nicht, dass die interna… [+1727 chars]",,de,'Krieg'
https://www.morgenpost.de/wirtschaft/article411650264/heizoelpreise-aktuell-heute-9-april-iran-krieg-nahost-heizoel-kaufen-heizung.html,https://www.morgenpost.de/wirtschaft/article411650264/heizoelpreise-aktuell-heute-9-april-iran-krieg-nahost-heizoel-kaufen-heizung.html,0,www.morgenpost.de,"Heizölpreise heute (Donnerstag, 9. April): Der aktuelle Preis pro Liter",Angesichts des Iran-Kriegs sind die Heizölpreise spürbar angestiegen. Nun herrscht eine Waffenruhe. Was bedeutet das für Hausbesitzer?,https://img.sparknews.funkemedien.de/406858452/406858452_1736921631_v16_9_1600.jpeg,2026-04-09T07:52:37Z,,"Langsam, aber sicher, dürften die Heizungen in deutschen Haushalten eine Pause einlegen: Bis zu 18 Grad werden diese Woche in der Hauptstadt erwartet. Zudem herrscht seit gestern Abend eine Waffenruh… [+8269 chars]",,de,'Krieg'
https://www.welt.de/politik/ausland/article69d78583f3d559be4f0b4707/moskau-oberstes-gericht-russlands-stuft-menschenrechtsgruppe-memorial-als-extremistisch-ein.html,https://www.welt.de/politik/ausland/article69d78583f3d559be4f0b4707/moskau-oberstes-gericht-russlands-stuft-menschenrechtsgruppe-memorial-als-extremistisch-ein.html,0,www.welt.de,Russisches Gericht stuft Menschenrechtsgruppe Memorial als extremistisch ein,Memorial gilt als eine der wichtigsten russischen Menschenrechtsorganisationen. Der Kreml geht hart gegen die Gruppe vor. Das Oberste Gericht in Moskau erlässt nun ein endgültiges Verbot.,https://images.welt.de/69d78583f3d559be4f0b4707/8c81e44308d952a39edd38cbb90ac6a6-master/ci16x9-w1200/2026-04-09t085525z-515115608-rc2jlka96ihc-rtrmadp-3-russia-memorial-court-jpg,2026-04-09T10:59:27Z,,"Das Oberste Gericht Russlands hat die renommierte Menschenrechtsgruppe Memorial für extremistisch erklärt. Jegliche Arbeit der Bewegung sei damit in Russland ab sofort verboten, meldete die staatlich… [+775 chars]",,de,'Kreml'
https://www.golem.de/sonstiges/zustimmung/auswahl.html?from=https://www.golem.de/news/anzeige-insektenstichheiler-fuers-smartphone-fuer-19-euro-bei-amazon-2604-207382.html&referer=https://t.co/e7e41af084,https://www.golem.de/sonstiges/zustimmung/auswahl.html?from=https://www.golem.de/news/anzeige-insektenstichheiler-fuers-smartphone-fuer-19-euro-bei-amazon-2604-207382.html&referer=https://t.co/e7e41af084,0,www.golem.de,Anzeige: Insektenstichheiler fürs Smartphone für 19 Euro bei Amazon,"Amazon hat einen Insektenstichheiler im Angebot, der den Juckreiz mit Wärme behandelt und über das Smartphone mit Energie versorgt wird. (Technik/Hardware)",,2026-04-09T11:58:01Z,,"Besuchen Sie Golem.de wie gewohnt mit Werbung und Tracking,
 indem Sie der Nutzung aller Cookies zustimmen.
 Details zum Tracking finden Sie im Privacy Center.
Skript wurde nicht geladen. Informat… [+607 chars]",,de,'Energie'
https://www.zeit.de/2026/16/der-magier-im-kreml-film-olivier-assayas-wladislaw-surkow-wladimir-putin,https://www.zeit.de/2026/16/der-magier-im-kreml-film-olivier-assayas-wladislaw-surkow-wladimir-putin,0,www.zeit.de,"""Der Magier im Kreml"": Jude Law spielt Putin","Jude Law spielt in Olivier Assayas' Film ""Der Magier im Kreml"" Wladimir Putin. Das ist spannende Realfiction: Die Eckdaten stimmen, nur die Dialoge sind frei erfunden.",https://img.zeit.de/2026/16/jude-law-spielt-putin-bild-1/wide__1300x731,2026-04-09T16:51:10Z,,"Schließen
Artikelzusammenfassung
Die Verfilmung von Giuliano da Empolis Roman ""Der Magier im Kreml"" durch Olivier Assayas wirft ein neues Licht auf die autoritäre Entwicklung Russlands unter Putin.… [+849 chars]",,de,'Kreml'
https://www.zeit.de/politik/ausland/2026-04/wahl-ungarn-viktor-orban-europa-zukunft,https://www.zeit.de/politik/ausland/2026-04/wahl-ungarn-viktor-orban-europa-zukunft,0,www.zeit.de,Wahl in Ungarn: In Ungarn kämpfen wir um die Zukunft Europas,Die Wahl in Ungarn verspricht einen Machtwechsel. Aber das Orbán-Regime und seine Unterstützer im Kreml werden nicht einfach aufgeben. Die EU darf nicht tatenlos zusehen.,https://img.zeit.de/politik/ausland/2026-04/wahl-ungarn-viktor-orban-europa-zukunft-bild/wide__1300x731,2026-04-09T17:33:12Z,,"Garri Kasparow war von 1985 bis 2000 Schachweltmeister, beendete seine Profikarriere 2005 als Weltranglistenerster. Seither ist er vor allem als einer der härtesten Kritiker des russischen Präsidente… [+7373 chars]",,de,'Wladimir Putin'
https://www.zeit.de/news/2026-04/09/kreml-putin-verkuendet-oster-waffenruhe,https://www.zeit.de/news/2026-04/09/kreml-putin-verkuendet-oster-waffenruhe,0,www.zeit.de,Krieg: Kreml: Putin verkündet Oster-Waffenruhe,Hier finden Sie Informationen zu dem Thema „Krieg“. Lesen Sie jetzt „Kreml: Putin verkündet Oster-Waffenruhe“.,https://img.zeit.de/administratives/sharing/fallback-image-die-zeit/wide__1300x731,2026-04-09T19:33:25Z,,Der russische Präsident Wladimir Putin hat nach Kremlangaben anlässlich des orthodoxen Osterfests eine Waffenruhe im Krieg gegen die Ukraine verkündet. Sie soll demnach am Samstag um 16.00 Uhr (15.00… [+211 chars],,de,'Krieg'
https://www.focus.de/politik/ukraine-krieg-im-live-ticker-aktuelle-news-zu-russlands-angriffskrieg_42fe0b6d-daeb-4934-801b-33134fb7f475.html,https://www.focus.de/politik/ukraine-krieg-im-live-ticker-aktuelle-news-zu-russlands-angriffskrieg_42fe0b6d-daeb-4934-801b-33134fb7f475.html,0,www.focus.de,Ukraine-Krieg im Live-Ticker: Aktuelle News zu Russlands Angriffskrieg,"News zum Ukraine-Krieg: Alle aktuellen Entwicklungen, Hintergründe und Berichte zu Russlands Angriffskrieg – laufend aktualisiert und von FOCUS online zusammengefasst.","https://quadro.burda-forward.de/ctf/8452fa9c-506c-4ae9-9d5b-f6cea527c1e1.217d50e5-736f-4206-a5e5-a522e574a186.jpg?im=RegionOfInterestCrop=(1200,630),regionOfInterest=(1908,1212)&hash=28170966bbf4e4d68dbec4aad9eabf338f2bca0a9bd557686765483b8ad8951f",2026-04-09T19:45:00Z,,"Kreml: Putin verkündet Oster-Waffenruhe
Donnerstag, 9. April, 21.39 Uhr: Der russische Präsident Wladimir Putin hat nach Kremlangaben anlässlich des orthodoxen Osterfests eine Waffenruhe im Krieg ge… [+46643 chars]",,de,'Krieg'
https://orf.at/stories/3426426/,https://orf.at/stories/3426426/,0,orf.at,London warnt Putin wegen U-Booten,Die britischen Streitkräfte haben der Regierung in London zufolge gemeinsam mit Verbündeten russische U-Boote von möglichen Angriffen auf Unterseekabel und Pipelines abgehalten. London warnte am Donnerstag direkt den russischen Präsidenten Wladimir Putin. Der…,https://ibs.orf.at/news?image=https%3A%2F%2Fassets.orf.at%2Fmims%2F2026%2F15%2F28%2Fcrops%2Fw%3D1200%2Ch%3D630%2Cq%3D75%2F2998177_master_1159528_uk_russland_unterseekabel_u_boote_r.jpg%3Fs%3D2982d8186de686ccc01374d7ecc2b59db59b7644,2026-04-09T19:46:23Z,,"Die russischen Schiffe hätten sich Anfang des Jahres rund einen Monat lang in britischen Gewässern aufgehalten, sagte Verteidigungsminister John Healey am Donnerstag. Die russische Botschaft in Londo… [+2631 chars]",,de,'Kreml'
https://www.welt.de/politik/ausland/article69d802dc94756c37af5a58ef/russische-invasion-putin-kuendigt-feuerpause-in-der-ukraine-waehrend-orthodoxer-ostertage-an.html,https://www.welt.de/politik/ausland/article69d802dc94756c37af5a58ef/russische-invasion-putin-kuendigt-feuerpause-in-der-ukraine-waehrend-orthodoxer-ostertage-an.html,0,www.welt.de,Putin kündigt Feuerpause in der Ukraine während orthodoxer Ostertage an,"Russlands Präsident Putin schließt sich dem Vorschlag der Ukraine an, über die Feiertage des orthodoxen Osterfestes, die Waffen schweigen zu lassen. Die russischen Truppen blieben jedoch bereit, „allen möglichen Provokationen des Feindes entgegenzuwirken“.",https://images.welt.de/69d802dc94756c37af5a58ef/ff199b8f7de66c2f923b48cea5cccb3c-master/ci16x9-w1200/dpa-com-20090101-260409-99-80132-jpg,2026-04-09T19:57:05Z,,"Russlands Präsident Putin schließt sich dem Vorschlag der Ukraine an, über die Feiertage des orthodoxen Osterfestes, die Waffen schweigen zu lassen. Die russischen Truppen blieben jedoch bereit, alle… [+1272 chars]",,de,'Kreml'
https://www.welt.de/politik/ausland/article69d802dc94756c37af5a58ef/russische-invasion-putin-erklaert-feuerpause-in-der-ukraine-waehrend-orthodoxer-ostertage-kiew-signalisiert-zustimmung.html,https://www.welt.de/politik/ausland/article69d802dc94756c37af5a58ef/russische-invasion-putin-erklaert-feuerpause-in-der-ukraine-waehrend-orthodoxer-ostertage-kiew-signalisiert-zustimmung.html,0,www.welt.de,Putin erklärt Feuerpause in der Ukraine während orthodoxer Ostertage – Kiew signalisiert Zustimmung,Russlands Präsident Wladimir Putin kündigt eine Waffenruhe zu den orthodoxen Ostertagen in der Ukraine an. Selenskyj signalisiert Zustimmung. Die Feuerpause soll vorübergehend die Kampfhandlungen stoppen.,https://images.welt.de/69d802dc94756c37af5a58ef/ff199b8f7de66c2f923b48cea5cccb3c-master/ci16x9-w1200/dpa-com-20090101-260409-99-80132-jpg,2026-04-09T19:57:05Z,,Russlands Präsident Wladimir Putin kündigt eine Waffenruhe zu den orthodoxen Ostertagen in der Ukraine an. Selenskyj signalisiert Zustimmung. Die Feuerpause soll vorübergehend die Kampfhandlungen sto… [+1677 chars],,de,'Ukraine'
https://www.stern.de/politik/ausland/ukraine-krieg--kreml--putin-verkuendet-oster-waffenruhe-37295344.html,https://www.stern.de/politik/ausland/ukraine-krieg--kreml--putin-verkuendet-oster-waffenruhe-37295344.html,0,www.stern.de,Ukraine-Krieg: Kreml: Putin verkündet Oster-Waffenruhe,Der Kremlchef ordnet zum orthodoxen Osterfest eine Feuerpause im Ukraine-Krieg an. In der Vergangenheit waren solch begrenzte Waffenruhen allerdings nicht sonderlich stabil.,https://image.stern.de/37295368/t/MM/v1/w1440/r1.7778/-/09--lorhs4g4tlv1axs2048jpeg---4ef03124753bde70.jpg,2026-04-09T20:04:01Z,,"Kopiere den aktuellen Link
Zur Merkliste hinzufügen
Der Kremlchef ordnet zum orthodoxen Osterfest eine Feuerpause im Ukraine-Krieg an. In der Vergangenheit waren solch begrenzte Waffenruhen allerdi… [+1628 chars]",,de,'Kreml'
https://www.zeit.de/news/2026-04/10/was-autofahrer-zur-blitzerwoche-im-suedwesten-wissen-muessen,https://www.zeit.de/news/2026-04/10/was-autofahrer-zur-blitzerwoche-im-suedwesten-wissen-muessen,0,www.zeit.de,Runter vom Gas: Was Autofahrer zur Blitzerwoche im Südwesten wissen müssen,Hier finden Sie Informationen zu dem Thema „Runter vom Gas“. Lesen Sie jetzt „Was Autofahrer zur Blitzerwoche im Südwesten wissen müssen“.,https://img.zeit.de/news/2026-04/10/was-autofahrer-zur-blitzerwoche-im-suedwesten-wissen-muessen-image-group/wide__1300x731,2026-04-10T02:00:48Z,,"Das kennt doch jeder: Da hat man kurz nicht aufgepasst, fährt viel zu schnell in den Ort rein und plötzlich sieht man diesen Lichtblitz. Mist, stand da etwa gerade ein Blitzer? Das könnten sich nächs… [+3340 chars]",,de,'Gas'
https://www.zeit.de/news/2026-04/10/oster-waffenruhe-kurzes-durchatmen-im-ukraine-krieg,https://www.zeit.de/news/2026-04/10/oster-waffenruhe-kurzes-durchatmen-im-ukraine-krieg,0,www.zeit.de,Die Lage im Überblick: Oster-Waffenruhe: Kurzes Durchatmen im Ukraine-Krieg?,Hier finden Sie Informationen zu dem Thema „Die Lage im Überblick“. Lesen Sie jetzt „Oster-Waffenruhe: Kurzes Durchatmen im Ukraine-Krieg?“.,https://img.zeit.de/news/2026-04/10/oster-waffenruhe-kurzes-durchatmen-im-ukraine-krieg-image-group/wide__1300x731,2026-04-10T03:00:05Z,,Anlässlich des orthodoxen Osterfests am Wochenende sollen im russischen Angriffskrieg gegen die Ukraine für einen Moment die Waffen ruhen. Kremlchef Wladimir Putin kündigte eine Feuerpause von Samsta… [+4228 chars],,de,'Krieg'
https://www.zeit.de/news/2026-04/10/gas-und-oel-auf-dem-rueckzug-beim-heizen-in-neuen-wohngebaeuden,https://www.zeit.de/news/2026-04/10/gas-und-oel-auf-dem-rueckzug-beim-heizen-in-neuen-wohngebaeuden,0,www.zeit.de,Statistik: Gas und Öl auf dem Rückzug beim Heizen in neuen Wohngebäuden,Hier finden Sie Informationen zu dem Thema „Statistik“. Lesen Sie jetzt „Gas und Öl auf dem Rückzug beim Heizen in neuen Wohngebäuden“.,https://img.zeit.de/news/2026-04/10/gas-und-oel-auf-dem-rueckzug-beim-heizen-in-neuen-wohngebaeuden-image-group/wide__1300x731,2026-04-10T09:41:46Z,,Bauherren setzen bei Wohnungsneubauten in Thüringen vor allem auf die Nutzung erneuerbarer Energien zum Heizen. Bei den 780 im vergangenen Jahr neu geplanten Wohngebäuden werden nach Daten des Landes… [+1020 chars],,de,'Gas'
https://www.stern.de/gesellschaft/regional/thueringen/statistik--gas-und-oel-auf-dem-rueckzug-beim-heizen-in-neuen-wohngebaeuden-37296836.html,https://www.stern.de/gesellschaft/regional/thueringen/statistik--gas-und-oel-auf-dem-rueckzug-beim-heizen-in-neuen-wohngebaeuden-37296836.html,0,www.stern.de,Statistik: Gas und Öl auf dem Rückzug beim Heizen in neuen Wohngebäuden,Erfurt (th) - Bauherren setzen bei Wohnungsneubauten in Thüringen vor allem auf die Nutzung erneuerbarer Energien zum Heizen. Bei den 780 im vergangenen,https://image.stern.de/37296838/t/Wf/v1/w1440/r1.7778/-/10--4pr4ncfkmfv9axs2048jpeg---f55de923c34571c5.jpg,2026-04-10T09:41:46Z,,"Kopiere den aktuellen Link
Zur Merkliste hinzufügen
Wärmepumpen dominieren beim Heizen neuer Wohngebäude in Thüringen. Nur noch bei wenigen Neubauten werden Gas oder Öl als Hauptenergiequelle gewäh… [+1184 chars]",,de,'Energie'
https://www.stern.de/gesellschaft/regional/hamburg-schleswig-holstein/gebaeudeenergie--haus---grund-setzt-fuer-gebaeudeheizung-auf-waermepumpe-37297114.html,https://www.stern.de/gesellschaft/regional/hamburg-schleswig-holstein/gebaeudeenergie--haus---grund-setzt-fuer-gebaeudeheizung-auf-waermepumpe-37297114.html,0,www.stern.de,Gebäudeenergie: Haus & Grund setzt für Gebäudeheizung auf Wärmepumpe,Auf welche Energieform für Gebäudeheizungen sollen Immobilieneigentümer setzen? Der Vorstandschef von Haus & und Grund hat eine deutliche Überzeugung.,https://image.stern.de/37297116/t/0j/v1/w1440/r1.7778/-/10--wnk4ofevywv17axs2048jpeg---2cf11cd4ff0fe0e4.jpg,2026-04-10T10:35:23Z,,"Kopiere den aktuellen Link
Zur Merkliste hinzufügen
Auf welche Energieform für Gebäudeheizungen sollen Immobilieneigentümer setzen? Der Vorstandschef von Haus &amp; und Grund hat eine deutliche Übe… [+2092 chars]",,de,'Energie'
https://www.zeit.de/news/2026-04/10/energie-trainer-wollitz-will-bestes-saisonspiel-sehen,https://www.zeit.de/news/2026-04/10/energie-trainer-wollitz-will-bestes-saisonspiel-sehen,0,www.zeit.de,"Dritte Fußball-Liga: Energie-Trainer Wollitz will ""bestes Saisonspiel"" sehen","Hier finden Sie Informationen zu dem Thema „Dritte Fußball-Liga“. Lesen Sie jetzt „Energie-Trainer Wollitz will ""bestes Saisonspiel"" sehen“.",https://img.zeit.de/news/2026-04/10/energie-trainer-wollitz-will-bestes-saisonspiel-sehen-image-group/wide__1300x731,2026-04-10T12:33:00Z,,Wiedersehensfreude bei der Rückkehr nach Osnabrück entwickelt Trainer Claus-Dieter Wollitz schon lange nicht mehr. Ein besonderes Spiel ist die kommende Auswärtspartie bezüglich des engen Aufstiegsre… [+1795 chars],,de,'Energie'
https://www.zeit.de/news/2026-04/10/kirmesliga-rundumschlag-von-energie-trainer-wollitz,https://www.zeit.de/news/2026-04/10/kirmesliga-rundumschlag-von-energie-trainer-wollitz,0,www.zeit.de,"3. Fußball-Liga: ""Kirmesliga"": Rundumschlag von Energie-Trainer Wollitz","Hier finden Sie Informationen zu dem Thema „3. Fußball-Liga“. Lesen Sie jetzt „""Kirmesliga"": Rundumschlag von Energie-Trainer Wollitz“.",https://img.zeit.de/news/2026-04/10/kirmesliga-rundumschlag-von-energie-trainer-wollitz-image-group/wide__1300x731,2026-04-10T13:59:44Z,,"Trainer Claus-Dieter Wollitz hat mitten im Aufstiegsrennen die Beschaffenheiten der dritten Fußball-Liga heftig angeprangert. «Es gibt viele Kollegen, die sagen, es sei eine Kirmesliga, da es keine e… [+2011 chars]",,de,'Energie'
https://www.faz.net/aktuell/politik/ukraine/osterruhe-im-ukrainekrieg-putin-will-keine-schwaeche-zeigen-200719494.html,https://www.faz.net/aktuell/politik/ukraine/osterruhe-im-ukrainekrieg-putin-will-keine-schwaeche-zeigen-200719494.html,0,www.faz.net,Ukrainekrieg: Russland will keine Schwäche bei der Drohnenabwehr zeigen,Über Schäden an russischen Häfen und Raffinerien schweigt der Kreml. Moskau schlägt aber eine Feuerpause über Ostern vor – die Selenskyj schon vorher ins Spiel gebracht hatte.,https://media0.faz.net/image/w1200h627/200ee176b8f2/w4564h2384x0y251o/202604/4547a6c6-34d4-11f1-bb17-0096ce342f8e/an-der-front-ein-ukrainischer.webp,2026-04-10T14:51:35Z,,Im Abwehrkampf gegen Russland steht die Ukraine derzeit wieder besser da. Fortschritte in der Drohnenentwicklung haben das ohnedies langsame Vorrücken der Invasoren im Donbass weiter gebremst und es … [+4216 chars],,de,'Kreml'
https://www.zeit.de/news/2026-04/10/tschentscher-fordert-bund-laender-konferenz-zu-energiepreisen,https://www.zeit.de/news/2026-04/10/tschentscher-fordert-bund-laender-konferenz-zu-energiepreisen,0,www.zeit.de,Energie: Tschentscher fordert Bund-Länder-Konferenz zu Energiepreisen,Hier finden Sie Informationen zu dem Thema „Energie“. Lesen Sie jetzt „Tschentscher fordert Bund-Länder-Konferenz zu Energiepreisen“.,https://img.zeit.de/news/2026-04/10/tschentscher-fordert-bund-laender-konferenz-zu-energiepreisen-image-group/wide__1300x731,2026-04-10T15:13:19Z,,Hamburgs Erster Bürgermeister Peter Tschentscher (SPD) spricht sich anlässlich der gestiegenen Energiepreise für eine Sonderkonferenz des Bundes und der Länder aus. Das sagte Tschentscher dem «Tagess… [+956 chars],,de,'Energie'
https://www.faz.net/aktuell/politik/ukraine/putin-koennte-jederzeit-die-waffen-ruhen-lassen-200719190.html,https://www.faz.net/aktuell/politik/ukraine/putin-koennte-jederzeit-die-waffen-ruhen-lassen-200719190.html,0,www.faz.net,Österliche Waffenruhe: Putin könnte jederzeit die Waffen ruhen lassen,"Wenn der Kremlherrscher mit großer Geste eine österliche Waffenruhe verkündet, ist das zynisch. Er hat den Krieg begonnen, er könnte ihn jederzeit beenden.",https://media0.faz.net/image/w1200h627/f5d4ed0c6c96/w3000h1567x0y372o/202604/482e1044-34d6-11f1-bb17-0096ce342f8e/ein-orthodoxer-priester-segnet.webp,2026-04-10T17:52:29Z,,"Mit sozusagen weihrauchschwenkender Geste hat Wladimir Putin eine österliche Waffenruhe verkündet. So hat es der russische Machthaber auch vor einem Jahr vor dem orthodoxen Osterfest getan.
Der ukra… [+1157 chars]",,de,'Kreml'
