index,url,valid,domain,title,description,image,published,archive,content,quote,language,keyword
https://www.n-tv.de/wissen/Welche-Rolle-spielen-Batterien-fuer-den-Strom-der-Zukunft-article24527845.html,https://www.n-tv.de/wissen/Welche-Rolle-spielen-Batterien-fuer-den-Strom-der-Zukunft-article24527845.html,0,www.n-tv.de,Erneuerbare Energie speichern: Welche Rolle spielen Batterien für den Strom der Zukunft?,"Das fossile Zeitalter soll bald enden. Um die Energiewende zu schaffen, braucht es erneuerbare Energien. Nur stehen diese nicht immer so zur Verfügung, wie sie benötigt werden. Wie die Zukunft der Stromversorgung aussieht und welchen Beitrag dabei Batterien l…",https://bilder1.n-tv.de/img/incoming/crop24528080/8131327204-cImg_16_9-w1200/295358978.jpg,2023-11-13T14:40:29Z,https://web.archive.org/web/20231113152620/https://www.n-tv.de/wissen/Welche-Rolle-spielen-Batterien-fuer-den-Strom-der-Zukunft-article24527845.html,"Das fossile Zeitalter soll bald enden. Um die Energiewende zu schaffen, braucht es erneuerbare Energien. Nur stehen diese nicht immer so zur Verfügung, wie sie benötigt werden. Wie die Zukunft der St… [+6906 chars]",,de,'Gas'
https://www.focus.de/finanzen/news/nachfolger-von-hartz-iv-bis-zu-3333-euro-in-muenchen-so-viel-buergergeld-gibt-es-pro-monat_id_244933349.html,https://www.focus.de/finanzen/news/nachfolger-von-hartz-iv-bis-zu-3333-euro-in-muenchen-so-viel-buergergeld-gibt-es-pro-monat_id_244933349.html,0,www.focus.de,Nachfolger von Hartz IV - Bis 3333 Euro in München: So viel Bürgergeld bekommt eine Muster-Familie pro Monat,Deutschland hat seit Jahresbeginn das Bürgergeld. Es löste das vorherige Hartz IV ab. Die Reform führte zu steigenden Sätzen für Hilfeempfänger.,https://p6.focus.de/img/fotos/id_244931690/buergergeld.jpg?im=Crop%3D%280%2C288%2C3464%2C1732%29%3BResize%3D%281200%2C627%29&impolicy=perceptual&quality=mediumHigh&hash=66da416906aeceb703079df8f5e914698463815799896e7f2a5ebdb30bf22444,2023-11-13T14:47:01Z,,Deutschland hat seit Jahresbeginn das Bürgergeld. Es löste das vorherige Hartz IV ab. Die Reform führte zu steigenden Sätzen für Hilfeempfänger.Als Grund für die Einführung des Bürgergelds nannte das… [+5057 chars],,de,'Bürgergeld'
https://www.tagesschau.de/ausland/europa/eu-israel-gaza-feuerpause-100.html,https://www.tagesschau.de/ausland/europa/eu-israel-gaza-feuerpause-100.html,0,www.tagesschau.de,"Nahost-Krieg: EU fordert ""sofortige Feuerpause""","In einer gemeinsamen Erklärung fordern die Außenminister der EU ""sofortige Feuerpausen"" für humanitäre Hilfe. EU-Chefdiplomat Borrell will zudem noch diese Woche in die Region reisen. Von Helga Schmidt.",https://images.tagesschau.de/image/76a81759-e0c7-4b22-a14d-dfd391715135/AAABi8ifVCY/AAABibBxqrQ/16x9-1280/borrell-160.jpg,2023-11-13T15:04:14Z,https://web.archive.org/web/20231113152519/https://www.tagesschau.de/ausland/europa/eu-israel-gaza-feuerpause-100.html,"Stand: 13.11.2023 16:04 Uhr
In einer gemeinsamen Erklärung fordern die Außenminister der EU ""sofortige Feuerpausen"" für humanitäre Hilfe. EU-Chefdiplomat Borrell will zudem noch diese Woche in die R… [+3455 chars]",,de,'Katar'
https://taz.de/Angehobene-Mehrwertsteuer-auf-Gas/!5969586/,https://taz.de/Angehobene-Mehrwertsteuer-auf-Gas/!5969586/,0,taz.de,Angehobene Mehrwertsteuer auf Gas: Höhere Steuern zulasten Armer,Die Wiederanhebung der Mehrwertsteuer auf Gas trifft Einkommensschwache besonders. Sie geben einen besonders großen Teil ihres Geldes dafür aus.,https://taz.de/picture/6646418/948/33822773-1.jpeg,2023-11-13T15:10:00Z,https://web.archive.org/web/20231114020026/https://taz.de/Angehobene-Mehrwertsteuer-auf-Gas/!5969586/,"Die Wiederanhebung der Mehrwertsteuer auf Gas trifft Einkommensschwache besonders. Sie geben einen besonders großen Teil ihres Geldes dafür aus.
Durch die Erhöhung der Mehrwertsteuer auf Gas öffnet … [+2627 chars]",,de,'Gas'
https://www.rostock-heute.de/stadtwerke-rostock-strompreis-gaspreis-erhoehung-2024/120606,https://www.rostock-heute.de/stadtwerke-rostock-strompreis-gaspreis-erhoehung-2024/120606,0,www.rostock-heute.de,In den Flex-Tarifen der Stadtwerke Rostock steigen die Preise pro Kilowattstunde Strom und Erdgas ab dem 1. Januar 2024 um rund 15 bzw. 30 Prozent – die Fix-Tarife werden etwas günstiger.,"Nachdem die Stadtwerke Rostock erst im Juli den Strom- und Gaspreis für Bestandskunden um rund 24 bzw. 34 Prozent gesenkt haben, wird es ab dem 1. Januar 2024 für viele Kunden wieder deutlich teurer, wie der Energieversorger heute mitgeteilt hat. Begründet wi…",https://www.rostock-heute.de/wp-content/uploads/2023/11/Stadtwerke_Rostock_Strompreis_Gaspreis_Erhoehung_2024-1200x800.jpg,2023-11-13T15:19:43Z,,"13. November 2023, von OlafStadtwerke Rostock erhöhen Flex-Preis für Strom und Erdgas (Foto: Archiv)
Nachdem die Stadtwerke Rostock erst im Juli den Strom- und Gaspreis für Bestandskunden um rund 24… [+3095 chars]",,de,'Energie'
https://www.focus.de/finanzen/news/analyse-von-hugo-mueller-vogg-das-buergergeld-wird-immer-teurer-und-unsozialer_id_244977201.html,https://www.focus.de/finanzen/news/analyse-von-hugo-mueller-vogg-das-buergergeld-wird-immer-teurer-und-unsozialer_id_244977201.html,0,www.focus.de,Kommentar von Hugo Müller-Vogg - SPD-Minister völlig überfordert: Bürgergeld-Plan fällt wie ein Kartenhaus zusammen,Die Kosten für das Bürgergeld steigen und steigen. Zudem fällen Wissenschaftler ein vernichtendes Urteil über das Neben- und Durcheinander verschiedener Sozialleistungen. Die große Reform von Arbeitsminister Heil gerät zum teuren Flop.Von FOCUS-online-Autor H…,https://p6.focus.de/img/fotos/id_244981440/heil-scholz.png?im=Crop%3D%280%2C66%2C797%2C398%29%3BResize%3D%281200%2C627%29&impolicy=perceptual&quality=mediumHigh&hash=9af3af8659eaf1f00be3f1fb8c53fc5db0be60436f0db8792c9d7eb1dbfc0158,2023-11-13T15:30:44Z,,Die Kosten für das Bürgergeld steigen und steigen. Zudem fällen Wissenschaftler ein vernichtendes Urteil über das Neben- und Durcheinander verschiedener Sozialleistungen. Die große Reform von Arbeits… [+5222 chars],,de,'Bürgergeld'
https://www.sueddeutsche.de/politik/buergergeld-cdu-carsten-linnemann-grundsatzprogramm-1.6302864,https://www.sueddeutsche.de/politik/buergergeld-cdu-carsten-linnemann-grundsatzprogramm-1.6302864,0,www.sueddeutsche.de,"Bürgergeld: ""In seiner jetzigen Form abschaffen""","Die CDU fordert einen Systemwechsel beim Bürgergeld. Jeder Empfänger, der arbeiten könne, solle spätestens nach einem halben Jahr einen Job annehmen oder gemeinnützig arbeiten.",https://www.sueddeutsche.de/image/sz.1.6302865/1200x675?v=1699889467,2023-11-13T15:31:24Z,,"Die CDU verlangt - auch wegen der gestiegenen Kosten - einen ""Systemwechsel"" beim Bürgergeld. Am Sonntag war bekannt geworden, dass Bundesarbeitsminister Hubertus Heil (SPD) für die Sozialleistung in… [+2024 chars]",,de,'Bürgergeld'
https://www.sueddeutsche.de/politik/buergergeld-mehrkosten-fluechtlinge-1.6302856,https://www.sueddeutsche.de/politik/buergergeld-mehrkosten-fluechtlinge-1.6302856,0,www.sueddeutsche.de,Bundeshaushalt: Alles wird teurer - auch das Bürgergeld,Mehr als drei Milliarden Euro muss der Bund zusätzlich für die Sozialleistung einplanen. Das war nicht einkalkuliert. Woher die Mehrkosten kommen und was Flüchtlinge aus der Ukraine damit zu tun haben.,https://www.sueddeutsche.de/image/sz.1.6302857/1200x675?v=1699890996,2023-11-13T15:56:41Z,,"Das Bürgergeld wird deutlich teurer als bisher erwartet. Arbeitsminister Hubertus Heil hat für dieses Jahr zusätzliche 3,25 Milliarden Euro angemeldet - und das, während die Haushaltspolitiker gerade… [+4666 chars]",,de,'Ukraine'
https://www.zeit.de/news/2023-11/13/hannover-96-bezieht-winter-trainingslager-in-spanien,https://www.zeit.de/news/2023-11/13/hannover-96-bezieht-winter-trainingslager-in-spanien,0,www.zeit.de,Fußball: Hannover 96 bezieht Winter-Trainingslager in Spanien,Hier finden Sie Informationen zu dem Thema „Fußball“. Lesen Sie jetzt „Hannover 96 bezieht Winter-Trainingslager in Spanien“.,https://img.zeit.de/news/2023-11/13/hannover-96-bezieht-winter-trainingslager-in-spanien-image-group/wide__1300x731,2023-11-13T16:01:24Z,https://web.archive.org/web/20231114043041/https://www.zeit.de/news/2023-11/13/hannover-96-bezieht-winter-trainingslager-in-spanien,Hannover 96 wird sein Winter-Trainingslager im spanischen Jerez de la Frontera bestreiten. Das teilte der Fußball-Zweitligist am Montagnachmittag mit. «In Jerez finden wir hervorragende Bedingungen v… [+612 chars],,de,'Winter'
https://www.morgenpost.de/lifestyle/wohnen/article240576004/Check-Ist-Ihr-Haus-winterfest.html,https://www.morgenpost.de/lifestyle/wohnen/article240576004/Check-Ist-Ihr-Haus-winterfest.html,0,www.morgenpost.de,Von oben bis unten: Check: Ist Ihr Haus winterfest?,"Ist das Dach dicht? Funktioniert die Heizanlage effizient? Und ist die Fassade noch frostfest? Worauf Sie jetzt achten und wie Sie rechtzeitig handeln können, um sicher durch den Winter zu kommen.",https://img.morgenpost.de/img/wohnen/crop240575992/0302609317-w820-cv16_9-q85/Verschneites-Haus.jpg,2023-11-13T16:06:29Z,https://web.archive.org/web/20231114161520/https://www.morgenpost.de/lifestyle/wohnen/article240576004/Check-Ist-Ihr-Haus-winterfest.html,"Berlin (dpa/tmn). Spätestens wenn alle Blätter von den Laubbäumen gefallen sind, ist es höchste Zeit, das Haus winterfest zu machen. Denn Frost, Regen, Sturm und Schnee können einer Immobilie ganz sc… [+5263 chars]",,de,'Winter'
https://netzpolitik.org/2023/gefahr-fuer-nationale-sicherheit-datenhaendler-verscherbeln-daten-von-us-soldaten/,https://netzpolitik.org/2023/gefahr-fuer-nationale-sicherheit-datenhaendler-verscherbeln-daten-von-us-soldaten/,0,netzpolitik.org,„Gefahr für nationale Sicherheit“: Datenhändler verscherbeln Daten von US-Soldaten,"Auch von US-Soldaten gibt es Daten im Internet zu kaufen. – Alle Rechte vorbehalten IMAGO / Pond5 Images
Data Broker kontrollieren kaum, wer ihre Daten kauft. Das betrifft auch sensible Daten von Angehörigen des US-Militärs, die jede:r für wenige Cent im Int…",https://cdn.netzpolitik.org/wp-upload/2023/11/imago298771113-1200x675.jpg,2023-11-13T16:44:00Z,https://web.archive.org/web/20231113173609/https://netzpolitik.org/2023/gefahr-fuer-nationale-sicherheit-datenhaendler-verscherbeln-daten-von-us-soldaten/,Für nur wenige Cent veräußern Data Broker im Internet Tausende Datensätze über US-Militärangehörige. Das zeigt eine aktuelle Studie der Duke University in North Carolina. Dies stelle nicht nur einen … [+3696 chars],,de,'Sicherheit'
https://www.stern.de/news/arbeitspflicht-fuer-buergergeld-bezieher---cdu-fordert--systemwechsel--34195506.html,https://www.stern.de/news/arbeitspflicht-fuer-buergergeld-bezieher---cdu-fordert--systemwechsel--34195506.html,0,www.stern.de,"Arbeitspflicht für Bürgergeld-Bezieher - CDU fordert ""Systemwechsel""","Die CDU will arbeitsfähige Bezieherinnen und Bezieher von Bürgergeld nach spätestens sechs Monaten zur Arbeit verpflichten. Der Sozialstaat müsse ""für die wirklich Bedürftigen da sein, die nicht arbeiten können"", sagte CDU-Generalsekretär Carsten Linnemann de…",https://image.stern.de/34195508/t/TN/v1/w1440/r1.7778/-/13--carsten-linnemann---036bcfa188158354.jpg,2023-11-13T17:56:09Z,,"Die CDU will arbeitsfähige Bezieherinnen und Bezieher von Bürgergeld nach spätestens sechs Monaten zur Arbeit verpflichten. Der Sozialstaat müsse ""für die wirklich Bedürftigen da sein, die nicht arbe… [+1388 chars]",,de,'Bürgergeld'
https://www.zeit.de/news/2023-11/13/eu-will-versorgung-mit-kritischen-rohstoffen-sicherstellen,https://www.zeit.de/news/2023-11/13/eu-will-versorgung-mit-kritischen-rohstoffen-sicherstellen,0,www.zeit.de,Rohstoffe: EU will Versorgung mit kritischen Rohstoffen sicherstellen,Hier finden Sie Informationen zu dem Thema „Rohstoffe“. Lesen Sie jetzt „EU will Versorgung mit kritischen Rohstoffen sicherstellen“.,https://img.zeit.de/news/2023-11/13/eu-will-versorgung-mit-kritischen-rohstoffen-sicherstellen-image-group/wide__1300x731,2023-11-13T18:56:53Z,,Die EU will mit einem neuen Regelwerk eine zuverlässige und nachhaltige Versorgung mit kritischen Rohstoffen wie Lithium sicherstellen. Vertreter der Regierungen der Mitgliedstaaten und des Europapar… [+3136 chars],,de,'Versorgung'
https://www.n-tv.de/wirtschaft/Gastronomie-will-reduzierte-Mehrwertsteuer-beibehalten-article24528926.html,https://www.n-tv.de/wirtschaft/Gastronomie-will-reduzierte-Mehrwertsteuer-beibehalten-article24528926.html,0,www.n-tv.de,Preisschock für Gäste verhindern: Gastronomie will reduzierte Mehrwertsteuer beibehalten,"Die Mehrwertsteuer auf Speisen in der Gastronomie liegt seit Juli 2020 wegen der Corona-Krise und der Folgen des Ukraine-Kriegs momentan bei sieben statt bei 19 Prozent. Damit Essengehen nicht zum Luxus wird, pocht die Gastronomie auf eine Verlängerung der Re…",https://bilder2.n-tv.de/img/Bilder_dpa_Import/crop24459657/6911322528-cImg_16_9-w1200/Gaste-sitzen-im-Auenbereich-eines-Restaurants.jpg,2023-11-13T19:06:25Z,,Die Mehrwertsteuer auf Speisen in der Gastronomie liegt seit Juli 2020 wegen der Corona-Krise und der Folgen des Ukraine-Kriegs momentan bei sieben statt bei 19 Prozent. Damit Essengehen nicht zum Lu… [+3153 chars],,de,'Gas'
https://www.focus.de/politik/deutschland/cdu-will-buergergeld-in-jetziger-form-abschaffen_id_245089909.html,https://www.focus.de/politik/deutschland/cdu-will-buergergeld-in-jetziger-form-abschaffen_id_245089909.html,0,www.focus.de,„Spätestens nach sechs Monaten Job annehmen“ - CDU will Bürgergeld in jetziger Form abschaffen,Die CDU will das erst am 1. Januar eingeführte Bürgergeld in der jetzigen Form abschaffen. Das sagte Generalsekretär Carsten Linnemann der „Bild“-Zeitung vom Montag und der „Süddeutschen Zeitung“.,https://p6.focus.de/img/fotos/id_242225692/cdu-generalsekretaer-carsten-linnemann.jpg?im=Crop%3D%280%2C0%2C3464%2C1732%29%3BResize%3D%281200%2C627%29&impolicy=perceptual&quality=mediumHigh&hash=c3e0192fc49cf886d952b186ed90f1e092bd348e183fd93be2b7582f3a057140,2023-11-13T19:09:23Z,,Die CDU will das erst am 1. Januar eingeführte Bürgergeld in der jetzigen Form abschaffen. Das sagte Generalsekretär Carsten Linnemann der Bild-Zeitung vom Montag und der Süddeutschen Zeitung.Die Par… [+1360 chars],,de,'Bürgergeld'
https://www.zeit.de/news/2023-11/13/cdu-will-buergergeld-in-jetziger-form-abschaffen,https://www.zeit.de/news/2023-11/13/cdu-will-buergergeld-in-jetziger-form-abschaffen,0,www.zeit.de,Soziales: CDU will Bürgergeld in jetziger Form abschaffen,Hier finden Sie Informationen zu dem Thema „Soziales“. Lesen Sie jetzt „CDU will Bürgergeld in jetziger Form abschaffen“.,https://img.zeit.de/news/2023-11/13/cdu-will-buergergeld-in-jetziger-form-abschaffen-image-group/wide__1300x731,2023-11-13T19:10:24Z,,Die CDU will das erst am 1. Januar eingeführte Bürgergeld in der jetzigen Form abschaffen. Das sagte Generalsekretär Carsten Linnemann der «Bild»-Zeitung vom Montag und der «Süddeutschen Zeitung». Di… [+2135 chars],,de,'Bürgergeld'
https://www.morgenpost.de/politik/inland/article240575582/CDU-will-Buergergeld-in-jetziger-Form-abschaffen.html,https://www.morgenpost.de/politik/inland/article240575582/CDU-will-Buergergeld-in-jetziger-Form-abschaffen.html,0,www.morgenpost.de,Soziales: CDU will Bürgergeld in jetziger Form abschaffen,Der Nachfolger von Hartz IV ist noch nicht einmal ein Jahr alt. Um eine Erhöhung der Beträge wurde lange gerungen. Die CDU hält das Bürgergeld aber für verzichtbar und will es komplett streichen.,https://img.morgenpost.de/img/inland/crop240575580/0562601328-w820-cv16_9-q85/Carsten-Linnemann.jpg,2023-11-13T19:10:24Z,,Berlin. Die CDU will das erst am 1. Januar eingeführte Bürgergeld in der jetzigen Form abschaffen. Das sagte Generalsekretär Carsten Linnemann der Bild-Zeitung vom Montag und der Süddeutschen Zeitung… [+1424 chars],,de,'Bürgergeld'
https://www.n-tv.de/politik/Linnemann-will-Arbeitspflicht-fuer-Buergergeld-Bezieher-article24529039.html,https://www.n-tv.de/politik/Linnemann-will-Arbeitspflicht-fuer-Buergergeld-Bezieher-article24529039.html,0,www.n-tv.de,"CDU fordert ""Systemwechsel"": Linnemann will Arbeitspflicht für Bürgergeld-Bezieher","Von Beginn an hadert die Union mit dem Hartz-IV-Nachfolger Bürgergeld. Generalsekretär Linnemann will nun den Druck auf die Bezieher erhöhen. So soll jeder, der arbeiten könne, nach spätestens einem halben Jahr einen Job annehmen oder gemeinnützig arbeiten mü…",https://bilder3.n-tv.de/img/incoming/crop24529038/969132749-cImg_16_9-w1200/426377398.jpg,2023-11-13T19:32:21Z,https://web.archive.org/web/20231113194521/https://www.n-tv.de/politik/Linnemann-will-Arbeitspflicht-fuer-Buergergeld-Bezieher-article24529039.html,"Von Beginn an hadert die Union mit dem Hartz-IV-Nachfolger Bürgergeld. Generalsekretär Linnemann will nun den Druck auf die Bezieher erhöhen. So soll jeder, der arbeiten könne, nach spätestens einem … [+1698 chars]",,de,'Bürgergeld'
https://www.zeit.de/wirtschaft/2023-11/energiepreisbremse-gas-strom-sondertopf-billiger-als-erwartet,https://www.zeit.de/wirtschaft/2023-11/energiepreisbremse-gas-strom-sondertopf-billiger-als-erwartet,0,www.zeit.de,Gas- und Strompreise: Sondertopf für Energiepreisbremse benötigt weniger Geld als gedacht,Für die Gas- und Strompreisbremse werden etwa 70 Milliarden Euro mehr in das kommende Jahr übertragen als erwartet. FDP und Grüne sind sich uneinig über die Verwendung.,https://img.zeit.de/wirtschaft/2023-11/energiepreisbremse-gas-strom-sondertopf-billiger-als-erwartet-bild/wide__1300x731,2023-11-13T22:35:36Z,,"Der von der Bundesregierung
mit 200 Milliarden Euro an Krediten ausgestattete Sondertopf
etwa für die Gas- und Strompreisbremse benötigt weitaus weniger
Geld als gedacht. Das geht aus der Vorlage … [+1627 chars]",,de,'Gas'
https://www.n-tv.de/politik/15-37-Ferrari-Lamborghini-und-Co-Hunderte-Luxus-Autos-trotz-Sanktionen-nach-Russland-importiert--article23143824.html,https://www.n-tv.de/politik/15-37-Ferrari-Lamborghini-und-Co-Hunderte-Luxus-Autos-trotz-Sanktionen-nach-Russland-importiert--article23143824.html,0,www.n-tv.de,"Ukraine-Krieg im Liveticker: +++ 15:37 Ferrari, Lamborghini und Co.: Hunderte Luxus-Autos trotz Sanktionen nach Russland importiert +++",Lesen Sie alle aktuellen Entwicklungen und Nachrichten über den russischen Angriffskrieg auf die Ukraine im Liveticker von ntv.de.,https://bilder2.n-tv.de/img/incoming/crop23332537/9041326157-cImg_16_9-w1200/Liveticker1-grau-1-Kopie.jpg,2023-11-13T23:16:00Z,https://web.archive.org/web/20231114144246/https://www.n-tv.de/politik/15-37-Ferrari-Lamborghini-und-Co-Hunderte-Luxus-Autos-trotz-Sanktionen-nach-Russland-importiert--article23143824.html,"Seit dem 15. März 2022, als die EU und die USA den Export teurer Autos nach Russland verboten haben, sind laut einem Bericht des unabhängigen russischen Online-Magazins ""Verstka"" mindestens 1.319 Lux… [+19447 chars]",,de,'Krieg'
https://www.n-tv.de/politik/19-35-Kreml-sieht-prorussische-Kraefte-in-Moldau-auf-dem-Vormarsch--article23143824.html,https://www.n-tv.de/politik/19-35-Kreml-sieht-prorussische-Kraefte-in-Moldau-auf-dem-Vormarsch--article23143824.html,0,www.n-tv.de,Ukraine-Krieg im Liveticker: +++ 19:35 Kreml sieht prorussische Kräfte in Moldau auf dem Vormarsch +++,Lesen Sie alle aktuellen Entwicklungen und Nachrichten über den russischen Angriffskrieg auf die Ukraine im Liveticker von ntv.de.,https://bilder2.n-tv.de/img/incoming/crop23332537/9041326157-cImg_16_9-w1200/Liveticker1-grau-1-Kopie.jpg,2023-11-13T23:16:00Z,https://web.archive.org/web/20231114184424/https://www.n-tv.de/politik/19-35-Kreml-sieht-prorussische-Kraefte-in-Moldau-auf-dem-Vormarsch--article23143824.html,Der Kreml sieht in der in die EU strebenden Republik Moldau nach massiven Stimmeneinbußen für die prowestliche Partei PAS bei den Kommunalwahlen prorussische Kräfte auf dem Vormarsch. Das Wahlergebni… [+24263 chars],,de,'Kreml'
https://www.n-tv.de/politik/17-36-Besuch-an-der-Front-Ukrainische-Moerser-Einheit-kaempft-gegen-Russen-und-Maeuse--article23143824.html,https://www.n-tv.de/politik/17-36-Besuch-an-der-Front-Ukrainische-Moerser-Einheit-kaempft-gegen-Russen-und-Maeuse--article23143824.html,0,www.n-tv.de,Ukraine-Krieg im Liveticker: +++ 17:36 Besuch an der Front: Ukrainische Mörser-Einheit kämpft gegen Russen und Mäuse +++,Lesen Sie alle aktuellen Entwicklungen und Nachrichten über den russischen Angriffskrieg auf die Ukraine im Liveticker von ntv.de.,https://bilder2.n-tv.de/img/incoming/crop23332537/9041326157-cImg_16_9-w1200/Liveticker1-grau-1-Kopie.jpg,2023-11-13T23:16:00Z,https://web.archive.org/web/20231114164448/https://www.n-tv.de/politik/17-36-Besuch-an-der-Front-Ukrainische-Moerser-Einheit-kaempft-gegen-Russen-und-Maeuse--article23143824.html,Die freiwilligen Kämpfer der ukrainischen Mörsereinheit bei Kurdjumiwka sind in einem kritischen Frontabschnitt im Einsatz. Ihr Kommandant Wladislaw ist 21 und bereits seit vier Jahren Soldat. Noch i… [+21469 chars],,de,'Saporischschja'
https://www.n-tv.de/politik/16-22-Ukraine-will-einen-Zivilflughafen-wieder-in-Betrieb-nehmen--article23143824.html,https://www.n-tv.de/politik/16-22-Ukraine-will-einen-Zivilflughafen-wieder-in-Betrieb-nehmen--article23143824.html,0,www.n-tv.de,Ukraine-Krieg im Liveticker: +++ 16:22 Ukraine will einen Zivilflughafen wieder in Betrieb nehmen +++,Lesen Sie alle aktuellen Entwicklungen und Nachrichten über den russischen Angriffskrieg auf die Ukraine im Liveticker von ntv.de.,https://bilder2.n-tv.de/img/incoming/crop23332537/9041326157-cImg_16_9-w1200/Liveticker1-grau-1-Kopie.jpg,2023-11-13T23:16:00Z,https://web.archive.org/web/20231114153134/https://www.n-tv.de/politik/16-22-Ukraine-will-einen-Zivilflughafen-wieder-in-Betrieb-nehmen--article23143824.html,"Der Chef des ukrainischen Präsidentenbüros äußert bei einem USA-Besuch die Hoffnung auf einen Wendepunkt im Abwehrkampf seines Landes gegen Russlands Invasion. ""Das nächste Jahr wird für uns entschei… [+20538 chars]",,de,'Saporischschja'
https://www.n-tv.de/politik/12-06-Stimmabgabe-fuer-Kreml-Kandidaten-erzwungen-Mutmassliche-Kollaborateurin-festgenommen--article23143824.html,https://www.n-tv.de/politik/12-06-Stimmabgabe-fuer-Kreml-Kandidaten-erzwungen-Mutmassliche-Kollaborateurin-festgenommen--article23143824.html,0,www.n-tv.de,"Ukraine-Krieg im Liveticker: +++ 12:06 Stimmabgabe für Kreml-""Kandidaten"" erzwungen? Geheimdienst nimmt mutmaßliche Kollaborateurin fest +++",Lesen Sie alle aktuellen Entwicklungen und Nachrichten über den russischen Angriffskrieg auf die Ukraine im Liveticker von ntv.de.,https://bilder2.n-tv.de/img/incoming/crop23332537/9041326157-cImg_16_9-w1200/Liveticker1-grau-1-Kopie.jpg,2023-11-13T23:16:00Z,,"Der ukrainische Geheimdienst SBU hat laut eigenen Angaben eine Frau festgenommen, die an den illegalen russischen Wahlen in den vorübergehend besetzten Gebieten im Süden der Ukraine im September dies… [+14298 chars]",,de,'Ukraine'
https://www.n-tv.de/politik/12-40-Ungarn-erhaelt-Hilfe-fuer-Atomkraftwerk-von-Russland-und-hohen-Milliarden-Kredit--article23143824.html,https://www.n-tv.de/politik/12-40-Ungarn-erhaelt-Hilfe-fuer-Atomkraftwerk-von-Russland-und-hohen-Milliarden-Kredit--article23143824.html,0,www.n-tv.de,Ukraine-Krieg im Liveticker: +++ 12:40 Ungarn erhält Hilfe für Atomkraftwerk von Russland - und hohen Milliarden-Kredit +++,Lesen Sie alle aktuellen Entwicklungen und Nachrichten über den russischen Angriffskrieg auf die Ukraine im Liveticker von ntv.de.,https://bilder2.n-tv.de/img/incoming/crop23332537/9041326157-cImg_16_9-w1200/Liveticker1-grau-1-Kopie.jpg,2023-11-13T23:16:00Z,https://web.archive.org/web/20231114121736/https://www.n-tv.de/politik/12-40-Ungarn-erhaelt-Hilfe-fuer-Atomkraftwerk-von-Russland-und-hohen-Milliarden-Kredit--article23143824.html,"Ungarn und der russische Atomkonzern Rosatom vereinbaren einen Fahrplan für den lange geplanten Ausbau des ungarischen Atomkraftwerks Paks. ""Es kann nun mit Sicherheit festgestellt werden, dass die b… [+15364 chars]",,de,'Krieg'
https://www.zeit.de/news/2023-11/14/strom-und-gas-grundversorgung-portal-sinkende-preise,https://www.zeit.de/news/2023-11/14/strom-und-gas-grundversorgung-portal-sinkende-preise,0,www.zeit.de,Verbraucher: Strom- und Gas-Grundversorgung - Portal: sinkende Preise,Hier finden Sie Informationen zu dem Thema „Verbraucher“. Lesen Sie jetzt „Strom- und Gas-Grundversorgung - Portal: sinkende Preise“.,https://img.zeit.de/news/2023-11/14/strom-und-gas-grundversorgung-portal-sinkende-preise-image-group/wide__1300x731,2023-11-14T03:10:06Z,https://web.archive.org/web/20231114034557/https://www.zeit.de/news/2023-11/14/strom-und-gas-grundversorgung-portal-sinkende-preise,Für zahlreiche Haushalte in der Grundversorgung sinken im Dezember und Januar die Strom- und Gaspreise. Für die beiden Monate seien bisher 83 Strompreissenkungen um durchschnittlich 12 Prozent angekü… [+2982 chars],,de,'Gas'
https://www.zeit.de/news/2023-11/14/israels-militaer-meldet-waffenfund-in-gaza-klinik,https://www.zeit.de/news/2023-11/14/israels-militaer-meldet-waffenfund-in-gaza-klinik,0,www.zeit.de,Krieg in Nahost: Israels Militär meldet Waffenfund in Gaza-Klinik,Hier finden Sie Informationen zu dem Thema „Krieg in Nahost“. Lesen Sie jetzt „Israels Militär meldet Waffenfund in Gaza-Klinik“.,https://img.zeit.de/news/2023-11/14/israels-militaer-meldet-waffenfund-in-gaza-klinik-image-group/wide__1300x731,2023-11-14T03:57:14Z,,"Im Keller einer Kinderklinik in der Stadt Gaza haben israelische Soldaten eigenen Angaben zufolge zahlreiche Waffen palästinensischer Extremisten gefunden. Es gebe auch Anzeichen dafür, dass im Kelle… [+4695 chars]",,de,'Krieg'
