index,url,valid,domain,title,description,image,published,archive,content,quote,language,keyword
https://www.tagesschau.de/inland/krankenhaus-reform-101.html,https://www.tagesschau.de/inland/krankenhaus-reform-101.html,0,www.tagesschau.de,"Lauterbach verspricht ""Revolution"" mit Krankenhausreform","Viele Kliniken sind aktuell überlastet. Die Regierungskommission zur Krankenhausversorgung hat nun erste Vorschläge vorgestellt, um das zu ändern. Gesundheitsminister Lauterbach spricht von einer ""Revolution im System"".",https://www.tagesschau.de/multimedia/bilder/krankenhaus-reform-103~_v-original.jpg,2022-12-06T12:51:09Z,https://web.archive.org/web/20221206140447/https://www.tagesschau.de/inland/krankenhaus-reform-101.html,"Viele Kliniken sind aktuell überlastet. Die Regierungskommission zur Krankenhausversorgung hat nun erste Vorschläge vorgestellt, um das zu ändern. Gesundheitsminister Lauterbach spricht von einer ""Re… [+4440 chars]",,de,'Versorgung'
https://www.welt.de/politik/ausland/article242510757/Ukraine-News-Ukraine-Russland-hat-noch-genug-Raketen-fuer-mehrere-Angriffswellen.html,https://www.welt.de/politik/ausland/article242510757/Ukraine-News-Ukraine-Russland-hat-noch-genug-Raketen-fuer-mehrere-Angriffswellen.html,0,www.welt.de,Russland ist laut Kiew gut gerüstet für mehrere Angriffswellen,Laut dem ukrainischen Geheimdienstchef Budanow verfügt Russland derzeit noch über eine ausreichende Menge an Präzisionsraketen. Die Vorräte neigten sich jedoch dem Ende zu. Am Tag der Streitkräfte ist Präsident Wolodymyr Selenskyj derweil in die Ostukraine ge…,https://img.welt.de/img/politik/ausland/mobile242523645/4301351787-ci16x9-w1200/Ukraine-Krieg-Charkiw.jpg,2022-12-06T14:00:00Z,https://web.archive.org/web/20221206172002/https://www.welt.de/politik/ausland/article242510757/Ukraine-News-Ukraine-Russland-hat-noch-genug-Raketen-fuer-mehrere-Angriffswellen.html,"Russland verfügt nach ukrainischer Einschätzung noch über genügend Präzisionsraketen für mehrere große Luftangriffe. Allerdings neigten sich die Vorräte dem Ende zu, sagt der Chef des Militärgeheimdi… [+26819 chars]",,de,'Saporischschja'
https://www.n-tv.de/politik/EU-verbietet-Importe-aus-Abholzungsgebieten-article23766033.html,https://www.n-tv.de/politik/EU-verbietet-Importe-aus-Abholzungsgebieten-article23766033.html,0,www.n-tv.de,Von Kaffee bis Rindfleisch: EU verbietet Importe aus Abholzungsgebieten,"Es sei ein ""Teilerfolg"", heißt es von Umweltschützern: Um die Zerstörung des Regenwaldes einzudämmen, sollen künftig weniger Erzeugnisse aus Abholzungsgebieten nach Europa gelangen. Das Verbot reicht über Kakao bis hin zu Fleisch- und Lederwaren. Ideen für we…",https://bilder3.n-tv.de/img/incoming/crop23766086/0821323859-cImg_16_9-w1200/127649555.jpg,2022-12-06T15:29:45Z,https://web.archive.org/web/20221206195758/https://www.n-tv.de/politik/EU-verbietet-Importe-aus-Abholzungsgebieten-article23766033.html,"Es sei ein ""Teilerfolg"", heißt es von Umweltschützern: Um die Zerstörung des Regenwaldes einzudämmen, sollen künftig weniger Erzeugnisse aus Abholzungsgebieten nach Europa gelangen. Das Verbot reicht… [+3667 chars]",,de,'Import'
https://taz.de/EU-Einigung-zu-Lieferkettengesetz/!5896841/,https://taz.de/EU-Einigung-zu-Lieferkettengesetz/!5896841/,0,taz.de,EU-Einigung zu Lieferkettengesetz: Import ohne Abholzung,Die EU hat sich auf ein Gesetz für rodungsfreie Lieferketten geeinigt – gerade rechtzeitig vor Beginn der Weltnaturkonferenz COP 15 in Montreal.,https://taz.de/picture/5961529/948/31698911-1.jpeg,2022-12-06T16:41:00Z,https://web.archive.org/web/20221206174840/https://taz.de/EU-Einigung-zu-Lieferkettengesetz/!5896841/,"Die EU hat sich auf ein Gesetz für rodungsfreie Lieferketten geeinigt gerade rechtzeitig vor Beginn der Weltnaturkonferenz COP 15 in Montreal.
Das sollte es bald nicht mehr geben: Gerodeter Regenwal… [+2185 chars]",,de,'Import'
https://www.faz.net/aktuell/politik/ukraine-liveticker-ukrainische-krankenhaeuser-sollen-planbare-operationen-aussetzen-18495964.html,https://www.faz.net/aktuell/politik/ukraine-liveticker-ukrainische-krankenhaeuser-sollen-planbare-operationen-aussetzen-18495964.html,0,www.faz.net,Ukraine-Liveticker: Ukrainische Krankenhäuser sollen planbare Operationen aussetzen,Ungarn blockiert EU-Finanzhilfen für Ukraine +++ Selenskyj besucht Stadt im Donbass nahe der Front +++ Video soll Raketenabschuss durch deutschen Gepard zeigen +++ alle Entwicklungen im Liveblog.,https://media0.faz.net/ppmedia/aktuell/politik/1289229851/1.8515534/facebook_teaser/stromausfall-waehrend-einer.jpg,2022-12-06T18:00:40Z,https://web.archive.org/web/20221206182211/https://www.faz.net/aktuell/politik/ukraine-liveticker-ukrainische-krankenhaeuser-sollen-planbare-operationen-aussetzen-18495964.html,Der russische Präsident Wladimir Putin hat wegen mutmaßlich ukrainischer Drohnenangriffe auf Militärstützpunkte in Russland am Dienstag den Sicherheitsrat seines Landes einberufen. Ranghohe Vertreter… [+496 chars],,de,'Ukraine'
https://www.focus.de/politik/ausland/ukraine-krise/experte-mangott-faellt-hartes-urteil-beim-ukrainischen-drohnen-coup-hat-russland-katastrophal-versagt_id_180434657.html,https://www.focus.de/politik/ausland/ukraine-krise/experte-mangott-faellt-hartes-urteil-beim-ukrainischen-drohnen-coup-hat-russland-katastrophal-versagt_id_180434657.html,0,www.focus.de,Experte Mangott fällt hartes Urteil - Beim ukrainischen Drohnen-Coup hat Russland „katastrophal versagt“,Drei Angriffe auf russische Militärflughäfen sorgen derzeit für Wirbel im Ukraine-Krieg. Der österreichische Politikwissenschaftler Gerhard Mangott wirft der russischen Luftabwehr Totalversagen vor. Der Kreml könnte sich nun zu einer weiteren Eskalation gezwu…,https://p6.focus.de/img/fotos/id_180434671/ukraine-drohne-angriff-russland-kursk-saratow-rjasan.jpg?im=Crop%3D%280%2C325%2C3464%2C1732%29%3BResize%3D%281200%2C627%29&hash=986ff3974a4840e8578dd95098197e6099583a86d7b76da0d3fbff9bbb24322d,2022-12-06T18:56:44Z,https://web.archive.org/web/20221206202136/https://www.focus.de/politik/ausland/ukraine-krise/experte-mangott-faellt-hartes-urteil-beim-ukrainischen-drohnen-coup-hat-russland-katastrophal-versagt_id_180434657.html,"Die Ukraine hat mit Luftschlägen auf drei russische Militärflughäfen offenbar eine Schlagkraft bewiesen, die bis vor kurzem noch unvorstellbar war. Am Montagmorgen wurden zwei russische Militärstützp… [+3906 chars]",,de,'Kreml'
https://www.zeit.de/news/2022-12/06/neuer-beauftragter-fuer-mv-verfassungsschutz,https://www.zeit.de/news/2022-12/06/neuer-beauftragter-fuer-mv-verfassungsschutz,0,www.zeit.de,Innere Sicherheit: Neuer Beauftragter für MV-Verfassungsschutz,,,2022-12-06T19:24:14Z,https://web.archive.org/web/20221206195119/https://www.zeit.de/news/2022-12/06/neuer-beauftragter-fuer-mv-verfassungsschutz,"When browsing with ads:
We collect personal data and also transmit it to third-party providers
 that help us improve and finance our digital content. Some of the information stored on your device, … [+732 chars]",,de,'Sicherheit'
https://www.stern.de/politik/ausland/russische-invasion--krieg-gegen-die-ukraine--so-ist-die-lage-32983414.html,https://www.stern.de/politik/ausland/russische-invasion--krieg-gegen-die-ukraine--so-ist-die-lage-32983414.html,0,www.stern.de,Russische Invasion: Krieg gegen die Ukraine: So ist die Lage,Um das Angebot des deutschen Flugabwehrsystems Patriot für Polen gab es einige Verstimmung. Nun will die Regierung in Warschau es doch annehmen - doch der Teufel steckt im Detail. Die News im Überblick.,https://image.stern.de/32983416/t/h6/v1/w1440/r1.7778/-/07--urnnewsmldpacom2009010122120799809831v3w800h600l225t20r1505b871jpeg---6be90fda4e31fe0b.jpg,2022-12-07T04:18:40Z,,Um das Angebot des deutschen Flugabwehrsystems Patriot für Polen gab es einige Verstimmung. Nun will die Regierung in Warschau es doch annehmen - doch der Teufel steckt im Detail. Die News im Überbli… [+4964 chars],,de,'Sicherheit'
https://www.morgenpost.de/politik/ausland/article237090589/Krieg-gegen-die-Ukraine-So-ist-die-Lage.html,https://www.morgenpost.de/politik/ausland/article237090589/Krieg-gegen-die-Ukraine-So-ist-die-Lage.html,0,www.morgenpost.de,Russische Invasion: Krieg gegen die Ukraine: So ist die Lage,Um das Angebot des deutschen Flugabwehrsystems Patriot für Polen gab es einige Verstimmung. Nun will die Regierung in Warschau es doch annehmen - doch der Teufel steckt im Detail. Die News im Überblick.,https://img.morgenpost.de/img/ausland/crop237090583/3612608308-w820-cv16_9-q85/Patriot-Systeme.jpg,2022-12-07T04:18:40Z,,"Warschau/Berlin/Kiew. Polen will die von Deutschland zur Verteidigung seines Luftraums angebotenen Patriot-Flugabwehrsysteme nun doch annehmen. Man arbeite daran, die Patriots auf polnischem Gebiet z… [+4891 chars]",,de,'Krieg'
https://www.nzz.ch/meinung/das-elektronische-patientendossier-ein-erfolgsmodell-aus-der-westschweiz-ld.1708803,https://www.nzz.ch/meinung/das-elektronische-patientendossier-ein-erfolgsmodell-aus-der-westschweiz-ld.1708803,0,www.nzz.ch,GASTKOMMENTAR - Das elektronische Patientendossier ist in der Westschweiz ein Erfolgsmodell,"In der Westschweiz ist das elektronische Patientendossier (EPD) seit Frühjahr 2021 in Betrieb. Wie lässt sich erklären, dass mehr als 80 Prozent der in der Schweiz eröffneten EPD in der Westschweiz angelegt wurden?","https://img.nzz.ch/2022/12/06/35b273b9-2795-4f53-9d2b-c4f408ba52fa.jpeg?width=1200&height=675&fit=bound&quality=75&auto=webp&crop=5475,3080,x0,y570&wmark=nzz",2022-12-07T04:30:00Z,,"Auch beim elektronischen Patientendossier muss gelten: Zugang nur für Berechtigte!
Das schweizerische Gesundheitssystem muss effizienter werden. Dieses Anliegen ist unbestritten. Dem elektronischen … [+3927 chars]",,de,'Gas'
https://www.morgenpost.de/wirtschaft/article237090611/Hohe-Gaspreise-belasten-BASF.html,https://www.morgenpost.de/wirtschaft/article237090611/Hohe-Gaspreise-belasten-BASF.html,0,www.morgenpost.de,Energiekrise: Hohe Gaspreise belasten BASF,"Die Kriegsfolgen machen sich zunehmend bei deutschen Unternehmen bemerkbar. BASF-Finanzchef Hans-Ulrich Engel teilt mit, der Konzern habe den Gasverbrauch in den vergangenen drei Monaten zurückgefahren.",https://img.morgenpost.de/img/wirtschaft/crop237090609/4442602269-w820-cv16_9-q85/Chemiekonzern-BASF.jpg,2022-12-07T04:30:57Z,https://web.archive.org/web/20221207050644/https://www.morgenpost.de/wirtschaft/article237090611/Hohe-Gaspreise-belasten-BASF.html,"Ludwigshafen. Dem Chemiekonzern BASF machen die steigenden Gaspreise zunehmend zu schaffen. Wir müssen wirtschaftliche Entscheidungen treffen, ob wir bestimmte Anlagen bei diesen Preisen laufen lasse… [+2539 chars]",,de,'Krieg'
https://www.stern.de/wirtschaft/news/energiekrise--hohe-gaspreise-belasten-basf-32983634.html,https://www.stern.de/wirtschaft/news/energiekrise--hohe-gaspreise-belasten-basf-32983634.html,0,www.stern.de,Energiekrise: Hohe Gaspreise belasten BASF,"Die Kriegsfolgen machen sich zunehmend bei deutschen Unternehmen bemerkbar. BASF-Finanzchef Hans-Ulrich Engel teilt mit, der Konzern habe den Gasverbrauch in den vergangenen drei Monaten zurückgefahren.",https://image.stern.de/32983636/t/nz/v1/w1440/r1.7778/-/07--urnnewsmldpacom2009010122120799809749v3w800h600l271t171r1551b1024jpeg---c5f129c38359934c.jpg,2022-12-07T04:30:57Z,https://web.archive.org/web/20221207093031/https://www.stern.de/wirtschaft/news/energiekrise--hohe-gaspreise-belasten-basf-32983634.html,"Die Kriegsfolgen machen sich zunehmend bei deutschen Unternehmen bemerkbar. BASF-Finanzchef Hans-Ulrich Engel teilt mit, der Konzern habe den Gasverbrauch in den vergangenen drei Monaten zurückgefahr… [+2759 chars]",,de,'Energie'
https://www.tagesschau.de/ausland/asien/japan-atomkraft-101.html,https://www.tagesschau.de/ausland/asien/japan-atomkraft-101.html,0,www.tagesschau.de,Japan reaktiviert veraltete Atomkraftwerke,Ausgerechnet Japan könnte in einigen Jahren das Land mit den ältesten Atomkraftwerken der Welt sein. In der Energiekrise will die Regierung alte Meiler zurück ans Netz holen. Nach der Katastrophe von Fukushima waren sie abgeschaltet worden. <em>Von Ulrich Men…,https://www.tagesschau.de/multimedia/bilder/akw-mihama-101~_v-original.jpg,2022-12-07T04:32:34Z,,Ausgerechnet Japan könnte in einigen Jahren das Land mit den ältesten Atomkraftwerken der Welt sein. In der Energiekrise will die Regierung alte Meiler zurück ans Netz holen. Nach der Katastrophe von… [+3751 chars],,de,'Energie'
https://www.stern.de/gesellschaft/regional/rheinland-pfalz-saarland/unternehmen--hohe-gaspreise-belasten-basf--verbrauch-zurueckgefahren-32983484.html,https://www.stern.de/gesellschaft/regional/rheinland-pfalz-saarland/unternehmen--hohe-gaspreise-belasten-basf--verbrauch-zurueckgefahren-32983484.html,0,www.stern.de,Unternehmen: Hohe Gaspreise belasten BASF: Verbrauch zurückgefahren,"Dem Chemiekonzern BASF machen die steigenden Gaspreise zunehmend zu schaffen. ""Wir müssen wirtschaftliche Entscheidungen treffen, ob wir bestimmte Anlagen bei diesen Preisen laufen lassen können oder nicht"", sagte BASF-Finanzchef Hans-Ulrich Engel im Gespräch…",https://image.stern.de/32983486/t/_y/v1/w1440/r1.7778/-/07--urnnewsmldpacom2009010122120799810109v3w800h600l522t107r1602b960jpeg---31064e81f217a1c5.jpg,2022-12-07T04:50:06Z,https://web.archive.org/web/20221207052207/https://www.stern.de/gesellschaft/regional/rheinland-pfalz-saarland/unternehmen--hohe-gaspreise-belasten-basf--verbrauch-zurueckgefahren-32983484.html,"Dem Chemiekonzern BASF machen die steigenden Gaspreise zunehmend zu schaffen. ""Wir müssen wirtschaftliche Entscheidungen treffen, ob wir bestimmte Anlagen bei diesen Preisen laufen lassen können oder… [+3014 chars]",,de,'Gas'
https://www.stern.de/gesellschaft/regional/baden-wuerttemberg/ludwigsburg--brand-im-klinikum-ludwigsburg--patienten-in-sicherheit-32983496.html,https://www.stern.de/gesellschaft/regional/baden-wuerttemberg/ludwigsburg--brand-im-klinikum-ludwigsburg--patienten-in-sicherheit-32983496.html,0,www.stern.de,Ludwigsburg: Brand im Klinikum Ludwigsburg: Patienten in Sicherheit,"Bei einem kleineren Brand in der Psychiatrie des Klinikums Ludwigsburg sind fünf Menschen leicht verletzt worden. Zwei Patienten, zwei Pflegekräfte und eine Ärztin hätten Rauchgase eingeatmet, sagte ein Polizeisprecher am frühen Mittwochmorgen.",https://image.stern.de/32983498/t/k4/v1/w1440/r1.7778/-/07--urnnewsmldpacom2009010122120799810182v3w800h600l640t425r1920b1275jpeg---bbf0f72b653f8e88.jpg,2022-12-07T04:59:11Z,,"Bei einem kleineren Brand in der Psychiatrie des Klinikums Ludwigsburg sind fünf Menschen leicht verletzt worden. Zwei Patienten, zwei Pflegekräfte und eine Ärztin hätten Rauchgase eingeatmet, sagte … [+881 chars]",,de,'Sicherheit'
https://www.zeit.de/news/2022-12/07/brand-im-klinikum-ludwigsburg-patienten-in-sicherheit,https://www.zeit.de/news/2022-12/07/brand-im-klinikum-ludwigsburg-patienten-in-sicherheit,0,www.zeit.de,Ludwigsburg: Brand im Klinikum Ludwigsburg: Patienten in Sicherheit,,,2022-12-07T04:59:11Z,,"When browsing with ads:
We collect personal data and also transmit it to third-party providers
 that help us improve and finance our digital content. Some of the information stored on your device, … [+732 chars]",,de,'Sicherheit'
https://www.focus.de/politik/ausland/ukraine-update-am-7-dezember-ploetzlich-gehen-auf-getroffenem-militaerflughafen-die-sirenen-los_id_72885571.html,https://www.focus.de/politik/ausland/ukraine-update-am-7-dezember-ploetzlich-gehen-auf-getroffenem-militaerflughafen-die-sirenen-los_id_72885571.html,0,www.focus.de,Das Ukraine-Update am Morgen - Plötzlich gehen auf getroffenem Militärflughafen die Sirenen los,Die ukrainische Armee hat mit ihren Angriffen auf russische Militärbasen offenbar Angst ausgelöst. Am späten Dienstagabend gingen auf dem getroffenen Stützpunkt Engels-2 plötzlich die Sirenen los. Polen schwenkt derweil um und will nun doch das deutsche Fluga…,https://p6.focus.de/img/fotos/id_180432101/russischerjet.jpg?im=Crop%3D%280%2C346%2C1080%2C540%29%3BResize%3D%281200%2C627%29&hash=6f32fbc04375225ae572f7659ee5b066ab2cb49c1ff835797c9a13093c191e6f,2022-12-07T05:00:00Z,https://web.archive.org/web/20221207053425/https://www.focus.de/politik/ausland/ukraine-update-am-7-dezember-ploetzlich-gehen-auf-getroffenem-militaerflughafen-die-sirenen-los_id_72885571.html,"Russen in Angst: Plötzlich gehen auf getroffenem Militärflughafen die Sirenen los
Am Montag wurden zwei russische Luftwaffenstützpunkte von ukrainischen Raketen getroffen. Auf der Basis Engels-2 wur… [+4836 chars]",,de,'Ukraine'
https://www.businessinsider.de/gruenderszene/business/ostrom-energie-startup-neue-finanzierungsrunde/,https://www.businessinsider.de/gruenderszene/business/ostrom-energie-startup-neue-finanzierungsrunde/,0,www.businessinsider.de,Twitter-Investor steigt bei Berliner Grünstrom-Startup ein,Steigende Energiepreise zwingen Verbraucher zum Sparen. Dabei hilft das Grünstrom-Startup Ostrom – das nun neues Geld von Investoren bekommt.,https://cdn.businessinsider.de/wp-content/uploads/2022/12/Ostrom_Founders_4-scaled.jpeg?ver=1670251627,2022-12-07T05:00:00Z,https://web.archive.org/web/20221207063333/https://www.businessinsider.de/gruenderszene/business/ostrom-energie-startup-neue-finanzierungsrunde/,"Twitter-Investor steigt bei Berliner Grünstrom-Startup ein
Steigende Energiepreise zwingen Verbraucher zum Umdenken. Wer Strom etwa zu bestimmten Uhrzeiten nutzt, kann viel Geld sparen. Dabei hilft … [+4268 chars]",,de,'Energie'
https://www.stern.de/lifestyle/leute/google-jahresrueckblick-2022--nach-putin-wurde-besonders-haeufig-gesucht-32983502.html,https://www.stern.de/lifestyle/leute/google-jahresrueckblick-2022--nach-putin-wurde-besonders-haeufig-gesucht-32983502.html,0,www.stern.de,Google Jahresrückblick 2022: Nach Putin wurde besonders häufig gesucht,2022 wurde wegen des russischen Angriffskriegs auf die Ukraine besonders häufig nach Wladimir Putin gegoogelt.,https://image.stern.de/32983506/t/z4/v1/w1440/r1.7778/-/07--nach-putin-wurde-besonders-haeufig-gesucht---16-9---spoton-article-1034702.jpg,2022-12-07T05:03:00Z,https://web.archive.org/web/20221207052158/https://www.stern.de/lifestyle/leute/google-jahresrueckblick-2022--nach-putin-wurde-besonders-haeufig-gesucht-32983502.html,"2022 wurde wegen des russischen Angriffskriegs auf die Ukraine besonders häufig nach Wladimir Putin gegoogelt.
Google blickt im Dezember abermals auf das vergangene Jahr zurück. Die veröffentlichten… [+3618 chars]",,de,'Krieg'
https://www.zeit.de/2022/49/deutschland-unmut-inflation-energiekrise-sozialpolitik,https://www.zeit.de/2022/49/deutschland-unmut-inflation-energiekrise-sozialpolitik,0,www.zeit.de,"Unmut in Deutschland: War das der ""heiße Herbst""?",Wochenlang wurde vor einem Herbst der Wutproteste gewarnt. Doch trotz Krieg und Inflation bleiben die Deutschen gelassen.,,2022-12-07T05:04:19Z,https://web.archive.org/web/20221207052159/https://www.zeit.de/2022/49/deutschland-unmut-inflation-energiekrise-sozialpolitik,"When browsing with ads:
We collect personal data and also transmit it to third-party providers
 that help us improve and finance our digital content. Some of the information stored on your device, … [+732 chars]",,de,'Krieg'
https://www.stern.de/news/polen-will-patriot-luftabwehrsysteme-aus-deutschland-doch-annehmen-32983590.html,https://www.stern.de/news/polen-will-patriot-luftabwehrsysteme-aus-deutschland-doch-annehmen-32983590.html,0,www.stern.de,Polen will Patriot-Luftabwehrsysteme aus Deutschland doch annehmen,Nach Diskussionen um eine mögliche Weitergabe von deutschen Patriot-Luftabwehrsystemen an die Ukraine will Polen die Waffen nun doch für seine eigenen Streitkräfte nutzen. Dies gab Verteidigungsminister Mariusz Blaszczak in Warschau bekannt. Er äußerte zuglei…,https://image.stern.de/32983592/t/zr/v1/w1440/r1.7778/-/07--bundesverteidigungsministerin-christine-lambrecht---ce4088fe0496443c.jpg,2022-12-07T05:16:23Z,,Nach Diskussionen um eine mögliche Weitergabe von deutschen Patriot-Luftabwehrsystemen an die Ukraine will Polen die Waffen nun doch für seine eigenen Streitkräfte nutzen. Dies gab Verteidigungsminis… [+2847 chars],,de,'Ukraine'
https://www.focus.de/politik/ausland/stimmen-zum-ukraine-krieg-usa-sollen-an-die-ukraine-gelieferte-himars-manipuliert-haben_id_57275780.html,https://www.focus.de/politik/ausland/stimmen-zum-ukraine-krieg-usa-sollen-an-die-ukraine-gelieferte-himars-manipuliert-haben_id_57275780.html,0,www.focus.de,Ukraine-Krieg - Stimmen und Entwicklungen - USA sollen an die Ukraine gelieferte Himars manipuliert haben,Am Montag starben nach Explosionen auf russischen Militärflugplätzen mindestens drei Soldaten. Putin ruft deshalb ein Krisentreffen seines Sicherheitsrates ein. Alle aktuellen Stimmen und Entwicklungen zum Ukraine-Krieg finden Sie im Ticker.,https://p6.focus.de/img/politik/deutschland/id_107935611/ein-mehrfachraketenwerfer-von-typ-himars-high-mobility-artillery-rocket-system-faehrt-waehrend-eines-kampftrainings-in-der-hochwueste-des-yakima-training-center-in-washington..jpg?im=Crop%3D%280%2C196%2C2048%2C1023%29%3BResize%3D%281200%2C627%29&hash=67be91907e9ba322bae629010e56fc84ef3efd566989bd4e4788240951b360f6,2022-12-07T05:25:41Z,,Am Montag starben nach Explosionen auf russischen Militärflugplätzen mindestens drei Soldaten. Putin ruft deshalb ein Krisentreffen seines Sicherheitsrates ein. Alle aktuellen Stimmen und Entwicklung… [+9946 chars],,de,'Krieg'
https://www.faz.net/aktuell/politik/inland/islamkonferenz-islamistische-ideologie-als-unterschaetzte-gefahr-18514987.html,https://www.faz.net/aktuell/politik/inland/islamkonferenz-islamistische-ideologie-als-unterschaetzte-gefahr-18514987.html,0,www.faz.net,Islam-Konferenz: Islamistische Ideologie als unterschätzte Gefahr,Die Islam-Konferenz will Muslimfeindlichkeit thematisieren und „direkte Impulse für ein besseres Miteinander von Muslimen und Nichtmuslimen“ setzen – sehr gut. Aber warum fällt kein Wort zum Thema Islamismus? Ein Gastbeitrag.,https://media0.faz.net/ppmedia/aktuell/1112326580/1.8514984/facebook_teaser_fplus/umstritten-in-der.jpg,2022-12-07T06:00:00Z,,Heute treffen sich wieder Vertreter des Staates mit Vertretern islamischer Organisationen und Einzelpersonen zur Deutschen Islamkonferenz (DIK). Damit jährt sich dieses Dialogformat 2006 gegründet vo… [+667 chars],,de,'Gas'
https://www.faz.net/aktuell/politik/ukraine-liveticker-briten-wollen-massiv-lng-aus-den-usa-importieren-18495964.html,https://www.faz.net/aktuell/politik/ukraine-liveticker-briten-wollen-massiv-lng-aus-den-usa-importieren-18495964.html,0,www.faz.net,Ukraine-Liveticker: Briten wollen massiv LNG aus den USA importieren,Ukrainische Krankenhäuser sollen planbare Operationen aussetzen +++ Ungarn blockiert EU-Finanzhilfen für Ukraine +++ Selenskyj besucht Stadt im Donbass nahe der Front +++ alle Entwicklungen im Liveblog.,https://media0.faz.net/ppmedia/aktuell/502730861/1.8516144/facebook_teaser/auf-einem-schiff-wird-lng.jpg,2022-12-07T06:03:23Z,https://web.archive.org/web/20221207104039/https://www.faz.net/aktuell/politik/ukraine-liveticker-briten-wollen-massiv-lng-aus-den-usa-importieren-18495964.html,Der russische Präsident Wladimir Putin hat wegen mutmaßlich ukrainischer Drohnenangriffe auf Militärstützpunkte in Russland am Dienstag den Sicherheitsrat seines Landes einberufen. Ranghohe Vertreter… [+496 chars],,de,'Sicherheit'
https://www.tagesspiegel.de/internationales/raketeneinschlag-im-nato-land-deutsche-patriot-luftabwehrsysteme-werden-nun-doch-in-polen-stationiert-8985676.html,https://www.tagesspiegel.de/internationales/raketeneinschlag-im-nato-land-deutsche-patriot-luftabwehrsysteme-werden-nun-doch-in-polen-stationiert-8985676.html,0,www.tagesspiegel.de,Raketeneinschlag im Nato-Land: Deutsche Patriot-Luftabwehrsysteme werden nun doch in Polen stationiert,Berlin hatte Warschau die Verteidigungssysteme nach einem Raketeneinschlag in Ostpolen angeboten. Dort regte man eine Weitergabe an die Ukraine an.,https://www.tagesspiegel.de/politik/images/patriot-systeme-der-bundeswehr1/alternates/BASE_16_9_W1400/patriot-systeme-der-bundeswehr.jpeg,2022-12-07T06:05:45Z,,Polen will die von Deutschland angebotenen Patriot-Luftabwehrsysteme nun doch annehmen. Bundesverteidigungsministerin Christine Lambrecht (SPD) und ihr polnischer Kollege hätten sich im Grundsatz gee… [+1653 chars],,de,'Sicherheit'
https://www.appgefahren.de/?p=328911,https://www.appgefahren.de/?p=328911,0,www.appgefahren.de,"Google Jahresrückblick 2022: Ukraine, WM 2022 und Olympia 2022","Auch in diesem Jahr präsentiert Google wieder einen Jahresrückblick und zeigt auf, welche Themen besonders oft gesucht wurden. Auf dieser Sonderseite könnt ihr euch durch alle Trends klicken und Ländercharts aufrufen. Ukraine, Sport, 9-Euro-Ticket und Affenpo…",https://www.appgefahren.de/wp-content/uploads/2018/10/Google-Icon.jpg,2022-12-07T08:55:30Z,,"Auch in diesem Jahr präsentiert Google wieder einen Jahresrückblick und zeigt auf, welche Themen besonders oft gesucht wurden. Auf dieser Sonderseite könnt ihr euch durch alle Trends klicken und Länd… [+3560 chars]",,de,'Ukraine'
