index,url,valid,domain,title,description,image,published,archive,content,quote,language,keyword
https://www.zeit.de/2023/28/ukraine-krieg-soldaten-front,https://www.zeit.de/2023/28/ukraine-krieg-soldaten-front,0,www.zeit.de,Soldaten im Ukraine-Krieg: Grabenkampf,"Ein Wald in der Ukraine. Soldaten beschießen einander mit Mörsern, Panzern und Maschinengewehren, verschanzen sich in Erdlöchern. Eine Reportage von der Front",,2023-07-01T16:30:29Z,https://web.archive.org/web/20230629210316/https://www.zeit.de/2023/28/ukraine-krieg-soldaten-front,"When browsing with ads:
We collect personal data and also transmit it to third-party providers
 that help us improve and finance our digital content. Some of the information stored on your device, … [+821 chars]",,de,'Ukraine'
https://www.n-tv.de/politik/15-12-Russische-Medien-Kreml-zahlte-Milliarden-Euro-an-Prigoschins-Wagner-und-Concord-Gruppe--article23143824.html,https://www.n-tv.de/politik/15-12-Russische-Medien-Kreml-zahlte-Milliarden-Euro-an-Prigoschins-Wagner-und-Concord-Gruppe--article23143824.html,0,www.n-tv.de,Ukraine-Krieg im Liveticker: +++ 15:12 Russische Medien: Kreml zahlte Milliarden Euro an Prigoschins Wagner- und Concord-Gruppe +++,"Berlin, Washington, Br\u00fcssel - \u00fcberall. n-tv berichtet von allen wichtigen Schaupl\u00e4tzen der Innen- und Au\u00dfenpolitik.",https://bilder2.n-tv.de/img/incoming/crop23332537/9041326157-cImg_16_9-w1200/Liveticker1-grau-1-Kopie.jpg,2023-07-01T22:10:00Z,,Es werden weitere Details über die Beziehung zwischen der russischen Regierung und den Unternehmen von Wagner-Chef Jewegeni Prigoschin bekannt. Für alle Aufträge soll der Kreml seit 2013 etwa 9 Milli… [+16307 chars],,de,'Kreml'
https://www.faz.net/aktuell/politik/inland/ard-sommerinterview-so-will-olaf-scholz-den-afd-hoehenflug-stoppen-19005984.html,https://www.faz.net/aktuell/politik/inland/ard-sommerinterview-so-will-olaf-scholz-den-afd-hoehenflug-stoppen-19005984.html,0,www.faz.net,Scholz will Höhenflug der AfD mit Sachentscheidungen stoppen,Olaf Scholz will dem Umfragehoch der AfD mit Entscheidungen zu Alltagsproblemen der Bürger entgegentreten. Über die anhaltenden Krawalle in Frankreich zeigt sich der Kanzler besorgt.,https://media1.faz.net/ppmedia/aktuell/politik/3181286299/1.9006083/facebook_teaser/kanzler-scholz-vor-dem-ard.jpg,2023-07-02T16:01:59Z,https://web.archive.org/web/20230703125652/https://www.faz.net/aktuell/politik/inland/ard-sommerinterview-so-will-olaf-scholz-den-afd-hoehenflug-stoppen-19005984.html,"Kanzler Olaf Scholz (SPD) will den Höhenflug der rechtspopulistischen AfD in den Umfragen mit Entscheidungen zu Alltagsproblemen der Bürger stoppen. Es sei nötig, den Menschen eine positive Zukunftsp… [+2513 chars]",,de,'Olaf Scholz'
https://www.n-tv.de/politik/Russischer-TV-Moderator-Prigoschin-ist-uebergeschnappt-article24233054.html,https://www.n-tv.de/politik/Russischer-TV-Moderator-Prigoschin-ist-uebergeschnappt-article24233054.html,0,www.n-tv.de,Wegen Zahlung hoher Geldsummen: Russischer TV-Moderator: Prigoschin ist übergeschnappt,"Der Kreml-nahe Journalist Kissiljow behauptet im russischen Staatsfernsehen: Die Wagner-Gruppe hat staatliche Mittel in Höhe von 858 Milliarden Rubel erhalten. Der Chef der Söldnertruppe Wagner soll daraufhin die Bodenhaftung verloren haben. Das Gefühl, ""sich…",https://bilder1.n-tv.de/img/incoming/crop24219464/8541327094-cImg_16_9-w1200/414412894.jpg,2023-07-02T23:21:04Z,https://web.archive.org/web/20230703062632/https://www.n-tv.de/politik/Russischer-TV-Moderator-Prigoschin-ist-uebergeschnappt-article24233054.html,Der Kreml-nahe Journalist Kissiljow behauptet im russischen Staatsfernsehen: Die Wagner-Gruppe hat staatliche Mittel in Höhe von 858 Milliarden Rubel erhalten. Der Chef der Söldnertruppe Wagner soll … [+4062 chars],,de,'Kreml'
