index,url,valid,domain,title,description,image,published,archive,content,quote,language,keyword
https://www.focus.de/politik/deutschland/reaktionen-bei-focus-online-schlag-ins-gesicht-user-empoert-auf-geplante-1000-euro-praemie-fuer-job-aufnahme_id_260369081.html,https://www.focus.de/politik/deutschland/reaktionen-bei-focus-online-schlag-ins-gesicht-user-empoert-auf-geplante-1000-euro-praemie-fuer-job-aufnahme_id_260369081.html,0,www.focus.de,"Reaktionen bei FOCUS online - ""Unfassbar“: User empört über geplante 1000-Euro-Prämie für Bürgergeld-Empfänger","Das Bundeswirtschaftsministerium plant eine Prämie für Bürgergeld-Empfänger, die es schaffen, ein Jahr lang zu arbeiten. 1000 Euro soll es dafür geben. Doch dafür hagelt es Kritik - auch aus der Bevölkerung.",https://p6.focus.de/img/fotos/id_260369146/von-links-finanzminister-christian-lindner-fdp-neben-wirtschaftsminister-robert-habeck-gruene-und-bundeskanzler-olaf-scholz-spd-.jpg?im=Crop%3D%280%2C142%2C3792%2C1896%29%3BResize%3D%281200%2C627%29&impolicy=perceptual&quality=mediumHigh&hash=19336173165d3d1ec3fd8a7935501375ebc30d0c2da1fe03321cf4c18e5856e1,2024-10-05T17:02:49Z,https://web.archive.org/web/20241005173734/https://www.focus.de/politik/deutschland/reaktionen-bei-focus-online-schlag-ins-gesicht-user-empoert-auf-geplante-1000-euro-praemie-fuer-job-aufnahme_id_260369081.html,"Das Bundeswirtschaftsministerium plant eine Prämie für Bürgergeld-Empfänger, die es schaffen, ein Jahr lang zu arbeiten. 1000 Euro soll es dafür geben. Doch dafür hagelt es Kritik - auch aus der Bevö… [+4302 chars]",,de,'Bürgergeld'
https://www.zeit.de/politik/deutschland/2024-10/wachstumsintitiative-praemie-langzeitarbeitslose-jobsuche-kritik,https://www.zeit.de/politik/deutschland/2024-10/wachstumsintitiative-praemie-langzeitarbeitslose-jobsuche-kritik,0,www.zeit.de,"Wachstumsintitiative: Regierung plant Prämie für Langzeitarbeitslose, die wieder arbeiten","Bürgergeldempfänger, die für mindestens ein Jahr einen Job antreten, sollen mit 1.000 Euro belohnt werden. Mehrere Politiker kritisieren die Prämie als unnötig und teuer.",https://img.zeit.de/politik/deutschland/2024-10/wachstumsintitiative-praemie-langzeitarbeitslose-jobsuche-kritik-bild/wide__1300x731,2024-10-05T19:38:55Z,http://archive.md/20241006014406/https://www.zeit.de/politik/deutschland/2024-10/wachstumsintitiative-praemie-langzeitarbeitslose-jobsuche-kritik,"Die Bundesregierung plant eine ""Anschubfinanzierung"" von 1.000 Euro für Langzeitarbeitslose, die einen 
sozialversicherungspflichtigen Job antreten und diesen mindestens ein 
Jahr lang behalten. Ei… [+3651 chars]",,de,'Bürgergeld'
https://www.zeit.de/politik/ausland/2024-10/praesidentschaft-donald-trump-juli-2018,https://www.zeit.de/politik/ausland/2024-10/praesidentschaft-donald-trump-juli-2018,0,www.zeit.de,Folge 19: Juli 2018: Trump glaubt Putin,Donald Trump kritisiert Nato-Mitglieder. Auf einer Pressekonferenz mit Wladimir Putin kommt es zu einem interessanten Versprecher. Der Juli 2018,https://img.zeit.de/politik/ausland/2024-09/praesidentschaft-donald-trump-juli/wide__1300x731,2024-10-06T04:00:06Z,,"Alle Folgen von ""Vier Jahre Trump""
Pfeil nach rechts
Diese Audiofolge ist Teil unseres Projekts ""Vier Jahre Trump"". Darin erzählen wir die Präsidentschaft von Donald Trump nach, 48 Monate in 48 Epi… [+4841 chars]",,de,'Wladimir Putin'
https://www.faz.net/aktuell/politik/krieg-in-nahost/lage-in-der-ukraine-selenskyj-rechnet-mit-historischer-woche-110029020.html,https://www.faz.net/aktuell/politik/krieg-in-nahost/lage-in-der-ukraine-selenskyj-rechnet-mit-historischer-woche-110029020.html,0,www.faz.net,Lage in der Ukraine: Selenskyj rechnet mit historischer Woche,Mit viel Optimismus blickt der ukrainische Präsident auf das Treffen der Unterstützer seines Landes in Ramstein. Seine Militärs sehen die Lage an der Front weniger optimistisch. Russische Drohnenschwärme überziehen die Ukraine. Der Überblick.,https://media0.faz.net/ppmedia/aktuell/politik/113625160/1.10029056/facebook_teaser/mit-blick-auf-das.jpg,2024-10-06T04:39:42Z,,"Er gehe davon aus, dass die Zusammenkunft auf Einladung von US-Präsident Joe Biden auf dem amerikanischen Stützpunkt in Rheinland-Pfalz in vielerlei Hinsicht historisch sein werde, sagte Selenskyj. Z… [+4377 chars]",,de,'Wladimir Putin'
https://www.golem.de/sonstiges/zustimmung/auswahl.html?from=https://www.golem.de/news/the-walls-have-eyes-hightech-dystopie-an-der-grenze-2410-188209.html&referer=https://t.co/8a886fafbd,https://www.golem.de/sonstiges/zustimmung/auswahl.html?from=https://www.golem.de/news/the-walls-have-eyes-hightech-dystopie-an-der-grenze-2410-188209.html&referer=https://t.co/8a886fafbd,0,www.golem.de,The Walls Have Eyes: Hightech-Dystopie an der Grenze,"Grenzen sind zum Testlabor für die Hightech-Industrie geworden, Verletzungen der Menschenrechte an der Tagesordnung, wie das Buch The Walls Have Eyes zeigt. Ein Bericht von Thomas Hafen (Überwachung, Kameras)",,2024-10-06T07:00:02Z,,"Besuchen Sie Golem.de wie gewohnt mit Werbung und Tracking,
 indem Sie der Nutzung aller Cookies zustimmen.
 Details zum Tracking finden Sie im Privacy Center.
Skript wurde nicht geladen. Informat… [+607 chars]",,de,'Industrie'
https://www.zeit.de/news/2024-10/06/orafol-chef-kritisiert-gruene-wirtschaftspolitik,https://www.zeit.de/news/2024-10/06/orafol-chef-kritisiert-gruene-wirtschaftspolitik,0,www.zeit.de,Industrie: Orafol-Chef kritisiert grüne Wirtschaftspolitik,Hier finden Sie Informationen zu dem Thema „Industrie“. Lesen Sie jetzt „Orafol-Chef kritisiert grüne Wirtschaftspolitik“.,https://img.zeit.de/news/2024-10/06/orafol-chef-kritisiert-gruene-wirtschaftspolitik-image-group/wide__1300x731,2024-10-06T09:49:53Z,,"Der Chef des Folienherstellers Orafol, Holger Loclair, kritisiert die Wirtschaftspolitik der Grünen und sieht bessere Bedingungen für Unternehmer in den USA. «Als energieintensives Industrieunternehm… [+2691 chars]",,de,'Industrie'
https://www.n-tv.de/politik/Kreml-Kritiker-soll-in-Region-Charkiw-gefallen-sein-article25272560.html,https://www.n-tv.de/politik/Kreml-Kritiker-soll-in-Region-Charkiw-gefallen-sein-article25272560.html,0,www.n-tv.de,Russe kämpfte für die Ukraine: Kreml-Kritiker soll in Region Charkiw gefallen sein,"In russischer Haft wird der Aktivist Ildar Dadin nach eigenen Angaben beinahe täglich gefoltert - und erlangt Bekanntheit, indem der die systematische Misshandlung von Gefangenen öffentlich anprangert. Seit 2023 kämpft er für die Ukraine. Jetzt soll Dadin gef…",https://bilder3.n-tv.de/img/incoming/crop25272582/4901327150-cImg_16_9-w1200/818286fdda843d5db0289388214b2266.jpg,2024-10-06T11:50:46Z,https://web.archive.org/web/20241006123904/https://www.n-tv.de/politik/Kreml-Kritiker-soll-in-Region-Charkiw-gefallen-sein-article25272560.html,"In russischer Haft wird der Aktivist Ildar Dadin nach eigenen Angaben beinahe täglich gefoltert - und erlangt Bekanntheit, indem der die systematische Misshandlung von Gefangenen öffentlich anpranger… [+1252 chars]",,de,'Ukraine'
https://www.bild.de/politik/inland/buergergeld-ploetzlich-wackelt-die-arsch-hoch-praemie-67026bb6f1446f30f9dd9ad3,https://www.bild.de/politik/inland/buergergeld-ploetzlich-wackelt-die-arsch-hoch-praemie-67026bb6f1446f30f9dd9ad3,0,www.bild.de,Doch keine 1000 Euro extra? - Bürgergeld! Plötzlich wackelt die „Arsch-hoch-Prämie“,"Bürgergeld-Empfänger, die einen Job annehmen, sollen 1000 Euro Prämie kriegen. Doch es gibt harten Widerstand, der Plan soll im Bundestag gestoppt werden.","https://images.bild.de/67026bb6f1446f30f9dd9ad3/2f04d1b8ff39efd51f25dd1cbf562b5f,7dc23e98?w=1280",2024-10-06T12:08:49Z,https://web.archive.org/web/20241006133843/https://www.bild.de/politik/inland/buergergeld-ploetzlich-wackelt-die-arsch-hoch-praemie-67026bb6f1446f30f9dd9ad3,"Die Riesen-Kritik an der Arsch-hoch-Prämie für Bürgergeld-Empfänger, die einen Job annehmen, zeigt offenbar Wirkung!
Auch aus der SPD-Fraktion gibt es jetzt eine gewichtige Stimme gegen die Einführu… [+1628 chars]",,de,'Bürgergeld'
https://www.welt.de/politik/deutschland/article253858376/Ausdruecklicher-Wunsch-von-Habeck-SPD-Fraktion-will-Praemie-fuer-Buergergeld-Empfaenger-stoppen.html,https://www.welt.de/politik/deutschland/article253858376/Ausdruecklicher-Wunsch-von-Habeck-SPD-Fraktion-will-Praemie-fuer-Buergergeld-Empfaenger-stoppen.html,0,www.welt.de,„Wunsch von Habeck“ – SPD-Fraktion will Prämie für Bürgergeld-Empfänger stoppen,"Verspottet als sogenannte „Arsch-Hoch-Prämie“ wendet sich nun auch die SPD im Bundestag gegen das Bürgergeld-Reformpaket mit einer 1000-Euro-Prämie für Langzeitarbeitslose. Zuvor hatten sich bereits Vertreter von Union, FDP und Grünen unzufrieden gezeigt.",https://img.welt.de/img/newsticker/dpa_nt/infoline_nt/wirtschaft_nt/mobile251956294/6947932747-ci16x9-w1200/Heil-und-Habeck.jpg,2024-10-06T12:30:00Z,https://web.archive.org/web/20241006132037/https://www.welt.de/politik/deutschland/article253858376/Ausdruecklicher-Wunsch-von-Habeck-SPD-Fraktion-will-Praemie-fuer-Buergergeld-Empfaenger-stoppen.html,Verspottet als sogenannte Arsch-Hoch-Prämie wendet sich nun auch die SPD im Bundestag gegen das Bürgergeld-Reformpaket mit einer 1000-Euro-Prämie für Langzeitarbeitslose. Zuvor hatten sich bereits Ve… [+3975 chars],,de,'Bürgergeld'
https://www.golem.de/sonstiges/zustimmung/auswahl.html?from=https://www.golem.de/news/kostjantyniwka-russische-stealth-drohne-s-70-ueber-ukraine-abgeschossen-2410-189548.html&referer=https://t.co/ad83a9e451,https://www.golem.de/sonstiges/zustimmung/auswahl.html?from=https://www.golem.de/news/kostjantyniwka-russische-stealth-drohne-s-70-ueber-ukraine-abgeschossen-2410-189548.html&referer=https://t.co/ad83a9e451,0,www.golem.de,Kostjantyniwka: Russische Stealth-Drohne S-70 über Ukraine abgeschossen,"Über der Ukraine ist eine russische Stealth-Drohne vermutlich von einem russischen Flugzeug abgeschossen worden. (Drohne, Politik)",,2024-10-06T13:00:01Z,,"Besuchen Sie Golem.de wie gewohnt mit Werbung und Tracking,
 indem Sie der Nutzung aller Cookies zustimmen.
 Details zum Tracking finden Sie im Privacy Center.
Skript wurde nicht geladen. Informat… [+607 chars]",,de,'Ukraine'
https://www.n-tv.de/politik/SPD-zweifelt-1000-Euro-Praemie-wackelt-schon-wieder-article25272810.html,https://www.n-tv.de/politik/SPD-zweifelt-1000-Euro-Praemie-wackelt-schon-wieder-article25272810.html,0,www.n-tv.de,Geld für Langzeitarbeitslose?: SPD zweifelt: 1000-Euro-Prämie wackelt schon wieder,"Wie sollen Langzeitarbeitslose dazu motiviert werden, wieder ins Berufsleben zurückzukehren? Im Kabinett beschließt die Ampel einen Plan: Demnach sollen Bürgergeldempfänger, die ein Jahr lang wieder einem Job nachgehen, 1000 Euro erhalten. Doch nach heftiger …",https://bilder3.n-tv.de/img/incoming/crop25272806/3381328163-cImg_16_9-w1200/486630413.jpg,2024-10-06T13:30:08Z,https://web.archive.org/web/20241006145113/https://www.n-tv.de/politik/SPD-zweifelt-1000-Euro-Praemie-wackelt-schon-wieder-article25272810.html,"Wie sollen Langzeitarbeitslose dazu motiviert werden, wieder ins Berufsleben zurückzukehren? Im Kabinett beschließt die Ampel einen Plan: Demnach sollen Bürgergeldempfänger, die ein Jahr lang wieder … [+2515 chars]",,de,'Bürgergeld'
https://www.focus.de/politik/ausland/ukraine-krise/ukraine-krieg-im-ticker-russischer-oppositioneller-soll-bei-kaempfen-um-charkiw-gefallen-sein_id_57275780.html,https://www.focus.de/politik/ausland/ukraine-krise/ukraine-krieg-im-ticker-russischer-oppositioneller-soll-bei-kaempfen-um-charkiw-gefallen-sein_id_57275780.html,0,www.focus.de,News zum Ukraine-Krieg - Tod von Ildar Dadin: Russischer Oppositioneller soll bei Kämpfen um Charkiw gefallen sein,Der ukrainische Präsident Selenskyj erwartet von dem bevorstehenden Treffen der Ukraine-Partner in Ramstein bedeutende Entscheidungen. Ein russischer Oppositioneller ist in der Ukraine gefallen. Das und mehr im Ukraine-Ticker.,https://p6.focus.de/img/politik/ausland/ukraine-krise/id_260370174/ildar-dadin.jpg?im=Crop%3D%280%2C0%2C2301%2C1150%29%3BResize%3D%281200%2C627%29&impolicy=perceptual&quality=mediumHigh&hash=00bd905f0573544540b373ac78c848125bb1ba4eb7bc5e932e63c6f826f01d15,2024-10-06T15:03:41Z,https://web.archive.org/web/20241006155022/https://www.focus.de/politik/ausland/ukraine-krise/ukraine-krieg-im-ticker-russischer-oppositioneller-soll-bei-kaempfen-um-charkiw-gefallen-sein_id_57275780.html,Der ukrainische Präsident Selenskyj erwartet von dem bevorstehenden Treffen der Ukraine-Partner in Ramstein bedeutende Entscheidungen. Ein russischer Oppositioneller ist in der Ukraine gefallen. Das … [+6642 chars],,de,'Krieg'
https://www.faz.net/aktuell/wirtschaft/mehr-wirtschaft/die-eu-kommission-plant-einen-radikalen-umbau-des-haushalts-110029301.html,https://www.faz.net/aktuell/wirtschaft/mehr-wirtschaft/die-eu-kommission-plant-einen-radikalen-umbau-des-haushalts-110029301.html,0,www.faz.net,F.A.Z. Exklusiv: EU plant radikalen Umbau des Haushalts,"Hilfen für Flüchtlinge, sozialer Wohnungsbau oder Biolandwirtschaft: Die EU möchte unter anderem finanzielle Unterstützung an Reformen und Ziele knüpfen. Davon sind aber längst nicht alle begeistert.",https://media0.faz.net/ppmedia/aktuell/politik/3328124665/1.10029332/facebook_teaser/die-praesidentin-der.jpg,2024-10-06T15:09:49Z,http://archive.md/20241006151729/https://www.faz.net/aktuell/wirtschaft/mehr-wirtschaft/die-eu-kommission-plant-einen-radikalen-umbau-des-haushalts-110029301.html,"Dafür sollen die beiden bisher größten Budgetposten, die Subventionen für die Landwirte sowie die Förderung strukturschwacher Regionen, in der nächsten Finanzperiode 2028 bis 2034 wegfallen. Sie mach… [+5887 chars]",,de,'Unterstützung'
https://www.tagesschau.de/ausland/asien/israel-gaza-ein-jahr-krieg-im-gazastreifen-100.html,https://www.tagesschau.de/ausland/asien/israel-gaza-ein-jahr-krieg-im-gazastreifen-100.html,0,www.tagesschau.de,Krieg in Nahost: Niemand in Gaza fühlt sich sicher,"Nach einem Jahr Krieg liegt der Gazastreifen größtenteils in Trümmern. Viele Menschen sind tot, die Bevölkerung leidet enorm. Und Experten glauben, dass die Zerstörung langfristige Folgen haben wird. Von Jan-Christoph Kitzler.",https://images.tagesschau.de/image/03ad6ac3-10f1-4fc2-a1ab-559e151a33c8/AAABkl4fdY8/AAABkZLhkrw/16x9-1280/gaza-zerstoerung-ein-jahr-krieg-100.jpg,2024-10-06T15:18:03Z,https://web.archive.org/web/20241006152722/https://www.tagesschau.de/ausland/asien/israel-gaza-ein-jahr-krieg-im-gazastreifen-100.html,"Stand: 06.10.2024 17:18 Uhr
Nach einem Jahr Krieg liegt der Gazastreifen größtenteils in Trümmern. Viele Menschen sind tot, die Bevölkerung leidet enorm. Und Experten glauben, dass die Zerstörung la… [+4339 chars]",,de,'Sicherheit'
https://www.faz.net/aktuell/rhein-main/region-und-hessen/neues-polizeigesetz-was-darf-die-hessische-polizei-110030011.html,https://www.faz.net/aktuell/rhein-main/region-und-hessen/neues-polizeigesetz-was-darf-die-hessische-polizei-110030011.html,0,www.faz.net,Neues Sicherheitsgesetz: Mehr Kontrollen und mehr Kameras,Die Landesregierung in Wiesbaden hat das hessische Polizeigesetz überarbeitet. Demnach sollen die Sicherheitsbehörden künftig mehr Befugnisse erhalten.,https://media0.faz.net/ppmedia/aktuell/gesellschaft/2389772298/1.10030010/facebook_teaser/klimaprotest-mitglieder-der.jpg,2024-10-06T15:23:40Z,https://web.archive.org/web/20241006172414/https://www.faz.net/aktuell/rhein-main/region-und-hessen/neues-polizeigesetz-was-darf-die-hessische-polizei-110030011.html,"Aber auch den Präventivgewahrsam will die Landesregierung ausweiten was bedeutet, dass Gewalttäter mittels richterlichem Beschluss in Haft genommen werden können, wenn es konkrete Hinweise darauf gib… [+4051 chars]",,de,'Sicherheit'
https://www.zeit.de/news/2024-10/06/niederlaendischer-verteidigungsminister-in-charkiw,https://www.zeit.de/news/2024-10/06/niederlaendischer-verteidigungsminister-in-charkiw,0,www.zeit.de,Krieg in der Ukraine: Niederländischer Verteidigungsminister in Charkiw,Hier finden Sie Informationen zu dem Thema „Krieg in der Ukraine“. Lesen Sie jetzt „Niederländischer Verteidigungsminister in Charkiw“.,https://img.zeit.de/news/2024-10/06/niederlaendischer-verteidigungsminister-in-charkiw-image-group/wide__1300x731,2024-10-06T15:58:46Z,https://web.archive.org/web/20241008024225/https://www.zeit.de/news/2024-10/06/niederlaendischer-verteidigungsminister-in-charkiw,"Der niederländische Verteidigungsminister Ruben Brekelmans hat überraschend die ostukrainische Großstadt Charkiw besucht. Dort machte er sich ein Bild von den schweren Zerstörungen, die russische Ang… [+1438 chars]",,de,'Krieg'
https://www.googlewatchblog.de/2024/10/roblox-kostenloses-neues-google-spiel-soll-teenagern-die-sicherheit-und-privatsphaere-im-internet-vermitteln/,https://www.googlewatchblog.de/2024/10/roblox-kostenloses-neues-google-spiel-soll-teenagern-die-sicherheit-und-privatsphaere-im-internet-vermitteln/,0,www.googlewatchblog.de,Roblox: Kostenloses neues Google-Spiel soll Teenagern die Sicherheit und Privatsphäre im Internet vermitteln,"Google setzt sich seit vielen Jahren für die Sicherheit im Internet ein und stärkt diese nicht nur mit den eigenen Produkten, sondern bietet auch viel kostenloses Material und Lernmöglichkeiten für alle Nutzer. Jetzt erweitert man das Portfolio um ein an Kind…",https://www.googlewatchblog.de/wp-content/uploads/be-internet-awesome.jpg,2024-10-06T16:00:43Z,,"Google setzt sich seit vielen Jahren für die Sicherheit im Internet ein und stärkt diese nicht nur mit den eigenen Produkten, sondern bietet auch viel kostenloses Material und Lernmöglichkeiten für a… [+1674 chars]",,de,'Sicherheit'
https://www.n-tv.de/politik/Fuer-Russland-geht-es-im-Sudan-um-viel-Gold-article25270221.html,https://www.n-tv.de/politik/Fuer-Russland-geht-es-im-Sudan-um-viel-Gold-article25270221.html,0,www.n-tv.de,Kreml handelt mit Miliz: Für Russland geht es im Sudan um viel Gold,"Milizenführer Hemeti und Armeechef al Burhan stehen sich im Sudan feindlich gegenüber. Obwohl sie grausamste Kriegsverbrechen begehen, sind die meisten Hilfsorganisationen aus dem Land abgezogen. Auch Deutschland ignoriert den Krieg weitgehend - dabei ist er …",https://bilder3.n-tv.de/img/incoming/crop25270346/1571325658-cImg_16_9-w1200/452592532.jpg,2024-10-06T16:04:59Z,https://web.archive.org/web/20241006162434/https://www.n-tv.de/politik/Fuer-Russland-geht-es-im-Sudan-um-viel-Gold-article25270221.html,"Milizenführer Hemeti und Armeechef al Burhan stehen sich im Sudan feindlich gegenüber. Obwohl sie grausamste Kriegsverbrechen begehen, sind die meisten Hilfsorganisationen aus dem Land abgezogen. Auc… [+6154 chars]",,de,'Kreml'
https://www.faz.net/aktuell/rhein-main/newsletter-hauptwache/heute-in-rhein-main-fuer-mehr-sicherheit-in-freiheit-110030171.html,https://www.faz.net/aktuell/rhein-main/newsletter-hauptwache/heute-in-rhein-main-fuer-mehr-sicherheit-in-freiheit-110030171.html,0,www.faz.net,Heute in Rhein-Main: Für mehr Sicherheit in Freiheit,"Hessen hat ein neues Polizeigesetz, Frankfurt befindet sich im Oktoberfest-Fieber und was lässt sich aus dem Frankfurter Auschwitzprozess lernen? Die F.A.Z.-Hauptwache blickt auf die Themen des Tages.",https://media1.faz.net/ppmedia/aktuell/gesellschaft/3504665634/1.10030209/facebook_teaser/mit-dem-neuen-hessischen.jpg,2024-10-06T16:12:41Z,http://archive.md/20241006165638/https://www.faz.net/aktuell/rhein-main/newsletter-hauptwache/heute-in-rhein-main-fuer-mehr-sicherheit-in-freiheit-110030171.html,"Guten Abend,man könnte sagen, das neue Polizeigesetz in Hessen komme gerade zur rechten Zeit. An diesem Montag jährt sich das von der Terrororganisation Hamas in Israel verübte Massaker, das zur Folg… [+4023 chars]",,de,'Sicherheit'
https://www.stern.de/news/kreml-kritiker-ildar-dadin-bei-kaempfen-in-ostukraine-getoetet-35121696.html,https://www.stern.de/news/kreml-kritiker-ildar-dadin-bei-kaempfen-in-ostukraine-getoetet-35121696.html,0,www.stern.de,Kreml-Kritiker Ildar Dadin bei Kämpfen in Ostukraine getötet,Bei den Kämpfen in der Ostukraine ist der Kreml-Kritiker Ildar Dadin getötet worden. Dies berichteten am Sonntag ein Freund Dadins wie auch mehrere russische Medien. Der 42-jährige hatte an der Seite der ukrainischen Streitkräfte gegen die russischen Invasion…,https://image.stern.de/35121698/t/Si/v1/w1440/r1.7778/-/06--ildar-dadin---3b30361158a3fecf.jpg,2024-10-06T17:00:21Z,,Bei den Kämpfen in der Ostukraine ist der Kreml-Kritiker Ildar Dadin getötet worden. Dies berichteten am Sonntag ein Freund Dadins wie auch mehrere russische Medien. Der 42-jährige hatte an der Seite… [+1255 chars],,de,'Kreml'
https://www.focus.de/politik/ausland/nahost/eskalation-in-berlin-pro-palaestina-demo-abgebrochen-oeffentliche-sicherheit-ist-gefaehrdet_id_260370924.html,https://www.focus.de/politik/ausland/nahost/eskalation-in-berlin-pro-palaestina-demo-abgebrochen-oeffentliche-sicherheit-ist-gefaehrdet_id_260370924.html,0,www.focus.de,Eskalation in Berlin - Pro-Palästina-Demo abgebrochen: „Öffentliche Sicherheit ist gefährdet“,In Berlin ist am Sonntag eine propalästinensische Demonstration eskaliert. Demonstranten warfen mit Steinen und Flaschen auf Polizisten und zündeten Böller. Daraufhin wurde die Veranstaltung aufgrund der Gefährdung der öffentlichen Sicherheit abgebrochen.,https://p6.focus.de/img/fotos/id_260370925/polizisten-bei-einer-pro-palaestina-demo-in-berlin.-die-veranstaltung-wurde-abgebrochen..jpg?im=Crop%3D%280%2C0%2C3464%2C1731%29%3BResize%3D%281200%2C627%29&impolicy=perceptual&quality=mediumHigh&hash=68d8b911e34c95639dc0e3bad5c502dd62dca7b2df27de811c7ee96f4a20824e,2024-10-06T17:23:28Z,https://web.archive.org/web/20241006190257/https://www.focus.de/politik/ausland/nahost/eskalation-in-berlin-pro-palaestina-demo-abgebrochen-oeffentliche-sicherheit-ist-gefaehrdet_id_260370924.html,In Berlin ist am Sonntag eine propalästinensische Demonstration eskaliert. Demonstranten warfen mit Steinen und Flaschen auf Polizisten und zündeten Böller. Daraufhin wurde die Veranstaltung aufgrund… [+938 chars],,de,'Sicherheit'
https://www.n-tv.de/ratgeber/Das-hilft-gegen-Einsamkeit-nach-einem-Umzug-article25270022.html,https://www.n-tv.de/ratgeber/Das-hilft-gegen-Einsamkeit-nach-einem-Umzug-article25270022.html,0,www.n-tv.de,Neues Semester startet: Das hilft gegen Einsamkeit nach einem Umzug,"Das Wintersemester beginnt und viele Studierende ziehen weg von ihren Freunden und Familien. Das Leben in einer neuen Stadt kann mit Einsamkeit einhergehen. Diese Tipps helfen Erstsemestern, dem entgegenzuwirken und neue Kontakte zu knüpfen.",https://bilder3.n-tv.de/img/incoming/crop25270042/1921327693-cImg_16_9-w1200/imago0092002420h.jpg,2024-10-06T17:26:38Z,https://web.archive.org/web/20241006180525/https://www.n-tv.de/ratgeber/Das-hilft-gegen-Einsamkeit-nach-einem-Umzug-article25270022.html,"Das Wintersemester beginnt und viele Studierende ziehen weg von ihren Freunden und Familien. Das Leben in einer neuen Stadt kann mit Einsamkeit einhergehen. Diese Tipps helfen Erstsemestern, dem entg… [+3751 chars]",,de,'Sicherheit'
https://orf.at/stories/3372033/,https://orf.at/stories/3372033/,0,orf.at,Appelle und Proteste zum 7. Oktober,"Vor dem Jahrestag des beispiellosen Terrorangriffs der radikalislamischen Hamas auf Israel am 7. Oktober 2023 hat es international Gedenkveranstaltungen, Appelle zur Beendigung des durch die Tat ausgelösten Gaza-Krieges und Proteste gegeben. Die Angehörigen d…",https://ibs.orf.at/news?image=https%3A%2F%2Fassets.orf.at%2Fmims%2F2024%2F41%2F88%2Fcrops%2Fw%3D1200%2Ch%3D630%2Cq%3D75%2F2378072_master_908188_israel_hamas_jahrestag_ap.jpg%3Fs%3D97da0033f8b93bc67a30852387d085562627e12c,2024-10-06T18:10:38Z,https://web.archive.org/web/20241006210619/https://orf.at/stories/3372033/,"UNO-Generalsekretär Antonio Guterres verurteilte die Hamas und rief zu einem unverzüglichen Ende der Gewalt und des Blutvergießens auf. Dies ist ein Tag, an dem die Weltgemeinschaft mit lautester Sti… [+6300 chars]",,de,'Krieg'
https://www.tagesspiegel.de/internationales/ein-jahr-nach-dem-7-oktober-der-krieg-ist-nicht-der-weg-zum-frieden-12489344.html,https://www.tagesspiegel.de/internationales/ein-jahr-nach-dem-7-oktober-der-krieg-ist-nicht-der-weg-zum-frieden-12489344.html,0,www.tagesspiegel.de,Ein Jahr nach dem 7. Oktober: Der Krieg ist nicht der Weg zum Frieden,"Der Nahostkonflikt kann nur über einen Friedensvertrag beendet werden, der die Zukunft der Palästinenser ein für alle Mal regelt.",https://www.tagesspiegel.de/images/10717063/alternates/BASE_16_9_W1400/1698854742000/08-05-2023-jerusalem-israel-nahen-osten-klagemauer-und-felsendom-tempelberg-jerusalem-heilige-stadt-klagemauer-te.jpeg,2024-10-06T18:21:08Z,https://web.archive.org/web/20241006185408/https://www.tagesspiegel.de/internationales/ein-jahr-nach-dem-7-oktober-der-krieg-ist-nicht-der-weg-zum-frieden-12489344.html,"Nie wieder, hatten wir gesagt. Nie wieder sollten Jüdinnen und Juden in Angst vor Gewalt und Verfolgung leben. Der grausame Terroranschlag der Hamas am 7. Oktober 2023 war eine tiefe Zäsur. Kein Erei… [+408 chars]",,de,'Krieg'
