index,url,valid,domain,title,description,image,published,archive,content,quote,language,keyword
https://www.stern.de/politik/ausland/gefangenen-deal--usa-und-russland-bleiben-nach-austausch-auf-konfrontation-34942906.html,https://www.stern.de/politik/ausland/gefangenen-deal--usa-und-russland-bleiben-nach-austausch-auf-konfrontation-34942906.html,0,www.stern.de,Gefangenen-Deal: USA und Russland bleiben nach Austausch auf Konfrontation,Der Gefangenaustausch zwischen den USA und Russland wirft neue Fragen auf. Was bedeutet der Deal für die US-Wahl und den Krieg in der Ukraine? Folgen weitere Verhandlungen?,https://image.stern.de/34942908/t/0B/v1/w1440/r1.7778/-/02--b6vmka6fujv19axw800h600jpeg---589c84a315003b41.jpg,2024-08-02T14:41:13Z,,"Der Gefangenaustausch zwischen den USA und Russland wirft neue Fragen auf. Was bedeutet der Deal für die US-Wahl und den Krieg in der Ukraine? Folgen weitere Verhandlungen?
Es sind ähnliche Bilder a… [+5998 chars]",,de,'Krieg'
https://www.tagesspiegel.de/internationales/gefangenen-deal-usa-und-russland-bleiben-nach-austausch-auf-konfrontation-12136124.html,https://www.tagesspiegel.de/internationales/gefangenen-deal-usa-und-russland-bleiben-nach-austausch-auf-konfrontation-12136124.html,0,www.tagesspiegel.de,Gefangenen-Deal: USA und Russland bleiben nach Austausch auf Konfrontation,Der Gefangenaustausch zwischen den USA und Russland wirft neue Fragen auf. Was bedeutet der Deal für die US-Wahl und den Krieg in der Ukraine? Folgen weitere Verhandlungen?,https://www.tagesspiegel.de/images/12136121/alternates/BASE_16_9_W1400/1722609733000/gefangenenaustausch-russische-gefangene-kommen-in-moskau-an.jpeg,2024-08-02T14:42:13Z,,"Es sind ähnliche Bilder auf den Flughäfen in Köln, Washington und Moskau, aber die Vorzeichen sind andere: Mehr als 20 Inhaftierte, darunter fünf Deutsche, sind nach dem größten Gefangenenaustausch s… [+5897 chars]",,de,'Krieg'
https://www.welt.de/politik/ausland/article252818302/Taiwan-Deutschlands-besondere-Rolle-bei-einem-chinesischen-Angriff.html,https://www.welt.de/politik/ausland/article252818302/Taiwan-Deutschlands-besondere-Rolle-bei-einem-chinesischen-Angriff.html,0,www.welt.de,Deutschlands besondere Rolle bei einem chinesischen Angriff,"Verteidigungsminister Pistorius bereist den Indopazifik und versichert Verbündeten seine Unterstützung gegen das immer aggressiver auftretende China. Dabei geht es weniger um militärische Hilfe – sondern um eine Strategie, die letztlich auch die Sicherheit in…",https://img.welt.de/img/politik/ausland/mobile252818864/9541351607-ci16x9-w1200/Verteidigungsminister-Pistorius-besucht-Hawaii-2.jpg,2024-08-02T14:51:37Z,,Im bundeswehrgrünen Hemd mit hochgekrempelten Ärmeln steht Boris Pistorius an Bord der Fregatte Baden-Württemberg und beobachtet den Überflug eines Eurofighters. Den ganzen Tag und die Nacht verbring… [+6862 chars],,de,'Ukraine'
https://www.faz.net/aktuell/politik/ukraine/was-sie-zum-gefangenenaustausch-mit-russland-wissen-muessen-19895120.html,https://www.faz.net/aktuell/politik/ukraine/was-sie-zum-gefangenenaustausch-mit-russland-wissen-muessen-19895120.html,0,www.faz.net,Was Sie zum Gefangenenaustausch mit Russland wissen müssen,"Wie lief der größte Gefangenenaustausch mit Russland seit dem Kalten Krieg ab? Warum spielte Deutschland eine Schlüsselrolle, und was tat die Türkei? Ein Überblick.",https://media1.faz.net/ppmedia/aktuell/1116681729/1.9896109/facebook_teaser/evan-gershkovich-und-paul.jpg,2024-08-02T15:06:49Z,,"Wie lief der Austausch ab?
Die Operation wurde über die türkische Hauptstadt Ankara abgewickelt, und der türkische Geheimdienst MIT teilte am Donnerstag als erster die Namen der Freigekommenen mit. … [+13483 chars]",,de,'Krieg'
https://www.bild.de/regional/sachsen/abschiebung-droht-familienvater-43-will-nicht-fuer-putin-kaempfen-66a87f018dc3c87f8e016b8a,https://www.bild.de/regional/sachsen/abschiebung-droht-familienvater-43-will-nicht-fuer-putin-kaempfen-66a87f018dc3c87f8e016b8a,0,www.bild.de,Abschiebung zur Russen-Armee? - Familienvater (43) will nicht für Putin kämpfen,"Dresden/Leipzig – Sorgen Dresdner Verwaltungsrichter dafür, dass Kriegsverbrecher Wladimir Putin Soldaten-Nachschub aus Deutschland bekommt?","https://images.bild.de/66a87f018dc3c87f8e016b8a/42c3c3158e55f1c4e88914ae7e14bf33,5487b2d9?w=1280",2024-08-02T15:08:16Z,,"Dresden/Leipzig  Sorgen Dresdner Verwaltungsrichter dafür, dass Kriegsverbrecher Wladimir Putin Soldaten-Nachschub aus Deutschland bekommt? Einem Familienvater aus Görlitz droht das Schicksal, abgesc… [+2255 chars]",,de,'Ukraine'
https://www.tagesspiegel.de/internationales/ukraine-invasion-tag-891-warum-der-gefangenendeal-nicht-als-vorbild-fur-frieden-taugt-12136616.html,https://www.tagesspiegel.de/internationales/ukraine-invasion-tag-891-warum-der-gefangenendeal-nicht-als-vorbild-fur-frieden-taugt-12136616.html,0,www.tagesspiegel.de,"Ukraine-Invasion, Tag 891: Warum der Gefangenendeal nicht als Vorbild für Frieden taugt","US-Berater dämpft Hoffnungen für Friedensverhandlungen, schwere Kämpfe in der Ostukraine dauern an, der „Tiergartenmörder“ ist ein FSB-Agent. Der Überblick am Abend.",https://www.tagesspiegel.de/images/12136583/alternates/BASE_16_9_W1400/1722612865000/ukrainian-servicemen-attend-a-military-exercise-in-kherson-region.jpeg,2024-08-02T15:48:06Z,,"Dass westliche Staaten mit Russland, in beiderseitigem Interesse und trotz völlig unterschiedlicher Voraussetzungen, eine Verhandlungslösung finden können, zeigt der Gefangenenaustausch eindrucksvoll… [+4717 chars]",,de,'Ukraine'
https://www.bild.de/politik/ausland-und-internationales/erdogan-vermittler-beim-gefangenen-austausch-von-putin-und-dem-westen-66aca714c2f9937ed7027501,https://www.bild.de/politik/ausland-und-internationales/erdogan-vermittler-beim-gefangenen-austausch-von-putin-und-dem-westen-66aca714c2f9937ed7027501,0,www.bild.de,Gefangenenaustausch - Ist Erdogan der geheime Deal-Maker?,Beim historischen Deal zwischen dem Westen und Kreml-Despot Putin hat der türkische Präsident Erdogan die Rolle des mysteriösen Vermittlers eingenommen.,"https://images.bild.de/66aca714c2f9937ed7027501/c3836d38b1ab5e397e578b9c7c7a26b6,cb2b3efa?w=1280",2024-08-02T15:56:11Z,,"Vieles spricht dafür, dass er bei dem historischen Deal zwischen dem Westen und Kreml-Despot Wladimir Putin (71) die Rolle des geheimen Vermittlers eingenommen hat: 
Recep Tayyip Erdogan (70). Hat d… [+2447 chars]",,de,'Kreml'
https://www.stern.de/news/trump--gefangenenaustausch-zwischen-russland-und-dem-westen--sieg-fuer-putin--34943160.html,https://www.stern.de/news/trump--gefangenenaustausch-zwischen-russland-und-dem-westen--sieg-fuer-putin--34943160.html,0,www.stern.de,"Trump: Gefangenenaustausch zwischen Russland und dem Westen ""Sieg für Putin""","Der frühere US-Präsident Donald Trump hat den Gefangenenaustausch zwischen Russland und dem Westen scharf kritisiert und ihn als ""Sieg"" für Kreml-Chef Wladimir Putin bezeichnet. ""Die Russen haben ein großartiges Geschäft gemacht"", sagte der republikanische Pr…",https://image.stern.de/34943162/t/O1/v1/w1440/r1.7778/-/02--donald-trump---26cbb57b45ada2ec.jpg,2024-08-02T16:01:18Z,,"Der frühere US-Präsident Donald Trump hat den Gefangenenaustausch zwischen Russland und dem Westen scharf kritisiert und ihn als ""Sieg"" für Kreml-Chef Wladimir Putin bezeichnet. ""Die Russen haben ein… [+2314 chars]",,de,'Kreml'
https://www.stern.de/news/gefangenenaustausch-mit-russland--freigelassener--tiergarten-moerder--ist-fsb-agent-34942390.html,https://www.stern.de/news/gefangenenaustausch-mit-russland--freigelassener--tiergarten-moerder--ist-fsb-agent-34942390.html,0,www.stern.de,"Gefangenenaustausch mit Russland: Freigelassener ""Tiergarten-Mörder"" ist FSB-Agent",Nach dem größten Gefangenenaustausch zwischen Russland und dem Westen seit dem Kalten Krieg hat Moskau die Tätigkeit des freigelassenen Tiergarten-Mörders Vadim Krasikow für den russischen Geheimdienst FSB enthüllt. Auch bei zwei weiteren Freigelassenen hande…,https://image.stern.de/34943250/t/O7/v1/w1440/r1.7778/-/02--putin-begruesst-krasikow-in-moskau-bild-der-russischen-staatlichen-nachrichtenagentur-sputnik---a219b0de91abc56f.jpg,2024-08-02T16:21:48Z,,Nach dem größten Gefangenenaustausch zwischen Russland und dem Westen seit dem Kalten Krieg hat Moskau die Tätigkeit des freigelassenen Tiergarten-Mörders Vadim Krasikow für den russischen Geheimdien… [+4738 chars],,de,'Krieg'
https://www.zeit.de/news/2024-08/02/pro-palaestina-demonstration-mit-autokorso-im-westen-berlins,https://www.zeit.de/news/2024-08/02/pro-palaestina-demonstration-mit-autokorso-im-westen-berlins,0,www.zeit.de,Gaza-Krieg: Pro-Palästina-Demonstration mit Autokorso im Westen Berlins,Hier finden Sie Informationen zu dem Thema „Gaza-Krieg“. Lesen Sie jetzt „Pro-Palästina-Demonstration mit Autokorso im Westen Berlins“.,https://img.zeit.de/news/2024-08/02/pro-palaestina-demonstration-mit-autokorso-im-westen-berlins-image-group/wide__1300x731,2024-08-02T17:57:42Z,,Zu einer propalästinensischen Demonstration und einem Fahrzeugkorso haben sich einige Hundert Menschen im Berliner Westen versammelt. Viele Demonstranten schwenkten Palästina-Flaggen. Nach ersten Ang… [+734 chars],,de,'Krieg'
https://www.zeit.de/politik/ausland/2024-08/ukraine-russland-krieg-militaerflugplatz-morosowsk-angriff,https://www.zeit.de/politik/ausland/2024-08/ukraine-russland-krieg-militaerflugplatz-morosowsk-angriff,0,www.zeit.de,Ukraine-Krieg: Ukraine meldet Angriff auf russischen Militärflugplatz,Die Ukraine weitet den Einsatz von Drohnen gegen Russland aus. Nun sollen Streitkräfte ein russisches Munitionslager getroffen und dort gelagerte Bomben zerstört haben.,https://img.zeit.de/politik/ausland/2024-08/ukraine-russland-krieg-militaerflugplatz-morosowsk-angriff-bild/wide__1300x731,2024-08-03T13:24:13Z,,Die Ukraine hat nach eigenen Angaben den Militärflugplatz Morosowsk in der südrussischen Region Rostow angegriffen. Dabei seien Munitions- und Bombenlager getroffen worden und dort gelagerte Gleit- u… [+2376 chars],,de,'Ukraine'
https://www.faz.net/aktuell/politik/ukraine/ukraine-liveticker-ukraine-will-russisches-u-boot-versenkt-haben-faz-19030454.html,https://www.faz.net/aktuell/politik/ukraine/ukraine-liveticker-ukraine-will-russisches-u-boot-versenkt-haben-faz-19030454.html,0,www.faz.net,Ukraine-Liveblog: Ukraine will russisches U-Boot versenkt haben,Selenskyj verspricht Militär weniger „Papierkram“ +++ Drohnenangriffe auf Treibstofflager im Süden Russlands +++ Ukrainisches Kriegsschiff in der Türkei zu Wasser gelassen +++ alle wichtigen Entwicklungen im Liveblog,https://media1.faz.net/ppmedia/aktuell/politik/1964457518/1.9898051/facebook_teaser/ein-u-boot-der-russischen.jpg,2024-08-03T15:48:24Z,,"Erhalten Sie täglich den F.A.Z.-Newsletter zum Krieg in der Ukraine (hier kostenlos anmelden). Alle Texte, Hintergründe und Kommentare finden Sie auf unserer Sonderseite.",,de,'Ukraine'
https://www.n-tv.de/politik/04-25-Baerbock-Putin-hat-sich-selbst-entlarvt--article25135340.html,https://www.n-tv.de/politik/04-25-Baerbock-Putin-hat-sich-selbst-entlarvt--article25135340.html,0,www.n-tv.de,Ukraine-Krieg im Liveticker: +++ 04:25 Baerbock: Putin hat sich selbst entlarvt +++,Lesen Sie alle aktuellen Entwicklungen und Nachrichten über den russischen Angriffskrieg auf die Ukraine im Liveticker von ntv.de.,https://bilder2.n-tv.de/img/incoming/crop23332537/9041326157-cImg_16_9-w1200/Liveticker1-grau-1-Kopie.jpg,2024-08-04T02:26:14Z,,"Außenministerin Baerbock wirft dem russischen Präsidenten Putin in ihrem Gastbeitrag für ""Bild am Sonntag"" vor, jede Friedensinitiative seit Jahren mit Eskalation zu beantworten. Mit der Absage an ei… [+34457 chars]",,de,'Krieg'
https://www.zeit.de/news/2024-08/04/selenskyj-krieg-soll-nach-russland-zurueckkehren,https://www.zeit.de/news/2024-08/04/selenskyj-krieg-soll-nach-russland-zurueckkehren,0,www.zeit.de,Lage im Überblick: Selenskyj: Krieg soll nach Russland zurückkehren,Hier finden Sie Informationen zu dem Thema „Lage im Überblick“. Lesen Sie jetzt „Selenskyj: Krieg soll nach Russland zurückkehren“.,https://img.zeit.de/news/2024-08/04/selenskyj-krieg-soll-nach-russland-zurueckkehren-image-group/wide__1300x731,2024-08-04T03:00:40Z,,"Die Ukraine muss nach den Worten von Präsident Wolodymyr Selenskyj ihre weitreichenden Schläge gegen Russland fortsetzen. «Die Ukraine muss zuschlagen, wirklich weitreichende Schläge gegen den russis… [+4345 chars]",,de,'Krieg'
https://www.stern.de/politik/ausland/lage-im-ueberblick--selenskyj--krieg-soll-nach-russland-zurueckkehren-34946462.html,https://www.stern.de/politik/ausland/lage-im-ueberblick--selenskyj--krieg-soll-nach-russland-zurueckkehren-34946462.html,0,www.stern.de,Lage im Überblick: Selenskyj: Krieg soll nach Russland zurückkehren,"Der ukrainische Präsident Selenskyj sieht Angriffe auf Ziele in Russland als sinnvoll, damit ""die Folgen des russischen Krieges nach Hause kommen"". Dafür fehlt aber noch etwas aus seiner Sicht.",https://image.stern.de/34946464/t/p4/v1/w1440/r1.7778/-/04--apwpdnoxv5v5axw800h600jpeg---811d513dbfc5f6a5.jpg,2024-08-04T03:00:40Z,,"Der ukrainische Präsident Selenskyj sieht Angriffe auf Ziele in Russland als sinnvoll, damit ""die Folgen des russischen Krieges nach Hause kommen"". Dafür fehlt aber noch etwas aus seiner Sicht.
Die … [+3881 chars]",,de,'Krieg'
https://www.tagesspiegel.de/internationales/lage-im-uberblick-selenskyj-krieg-soll-nach-russland-zuruckkehren-12140432.html,https://www.tagesspiegel.de/internationales/lage-im-uberblick-selenskyj-krieg-soll-nach-russland-zuruckkehren-12140432.html,0,www.tagesspiegel.de,Lage im Überblick: Selenskyj: Krieg soll nach Russland zurückkehren,"Der ukrainische Präsident Selenskyj sieht Angriffe auf Ziele in Russland als sinnvoll, damit „die Folgen des russischen Krieges nach Hause kommen“. Dafür fehlt aber noch etwas aus seiner Sicht.",https://www.tagesspiegel.de/images/12140429/alternates/BASE_16_9_W1400/1722740549000/prasident-wolodymyr-selenskyj.jpeg,2024-08-04T03:02:29Z,,"Die Ukraine muss nach den Worten von Präsident Wolodymyr Selenskyj ihre weitreichenden Schläge gegen Russland fortsetzen. Die Ukraine muss zuschlagen, wirklich weitreichende Schläge gegen den russisc… [+3759 chars]",,de,'Krieg'
https://www.nzz.ch/international/jared-kushner-tritt-mit-hotelprojekten-in-die-fussstapfen-seines-schwiegervaters-donald-trump-ld.1841885,https://www.nzz.ch/international/jared-kushner-tritt-mit-hotelprojekten-in-die-fussstapfen-seines-schwiegervaters-donald-trump-ld.1841885,0,www.nzz.ch,Jared Kushner tritt mit Hotelprojekten in die Fussstapfen seines Schwiegervaters Donald Trump,"In Belgrad will der amerikanische Geschäftsmann ein Luxushotel auf den Ruinen des früheren Hauptquartiers der jugoslawischen Streitkräfte bauen. Es geht nicht nur um Geld, sondern auch um Unterstützung für das russlandfreundliche Serbien.","https://img.nzz.ch/2024/07/31/9e8bd8fb-7108-4d82-817b-3f743eb861c2.jpeg?width=1200&height=675&fit=bounds&quality=75&auto=webp&crop=4853,2730,x0,y156&wmark=nzz",2024-08-04T03:30:00Z,,"Jared Kushner nutzte seine Jahre als Berater von Präsident Donald Trump für die Gründung eines Investmentfonds.
Hinter der braunen Fassade schiessen Türme aus Stahl und Glas aus der Erde, die viel w… [+4325 chars]",,de,'Ukraine'
https://www.zeit.de/politik/ausland/2024-08/nordkorea-ueberschwemmungen-wladimir-putin-angebot-kim-jong-un,https://www.zeit.de/politik/ausland/2024-08/nordkorea-ueberschwemmungen-wladimir-putin-angebot-kim-jong-un,0,www.zeit.de,Nordkorea: Putin bietet Nordkorea nach Überschwemmungen Unterstützung an,Russland hat Nordkorea Hilfe zum Wiederaufbau angeboten. Diktator Kim Jong Un lehnte das Angebot ab – und ignorierte ein weiteres aus Südkorea.,https://img.zeit.de/gesellschaft/zeitgeschehen/2024-08/nordkorea-ueberschwemmungen-wladimir-putin-angebot-kim-jong-un-bild/wide__1300x731,2024-08-04T05:12:16Z,,"Der russische Präsident Wladimir Putin hat dem nordkoreanischen Diktator Kim Jong Un nach schweren Überschwemmungen Hilfe angeboten. ""Sie können immer auf unsere Unterstützung zählen"", sagte Putin na… [+1318 chars]",,de,'Ukraine'
https://www.welt.de/politik/deutschland/article252821390/Streit-um-Versicherung-Wie-Moskau-mit-Nord-Stream-noch-mal-Kasse-machen-will.html,https://www.welt.de/politik/deutschland/article252821390/Streit-um-Versicherung-Wie-Moskau-mit-Nord-Stream-noch-mal-Kasse-machen-will.html,0,www.welt.de,Wie Moskau mit Nord Stream noch mal Kasse machen will,"Nach der Explosion der Pipelines versucht Gazprom, die Versicherungssumme einzustreichen und finanzielle Forderungen westlicher Konzerne abzuwehren. Der Versicherungsfall könnte eine Theorie zu der Sprengung der Pipeline untermauern.",https://img.welt.de/img/politik/deutschland/mobile252822038/9451351517-ci16x9-w1200/Aerial-View-of-the-Gas-Leak-at-Nord-Stream-2-in-the-Baltic-Sea.jpg,2024-08-04T05:15:00Z,,"Es ist ein Satz, der den russischen Gazprom-Konzern und damit Putins Russland 400 Millionen Euro kosten könnte. Abgedeckt seien keine Verluste oder Schäden, die direkt oder indirekt durch Krieg (ob K… [+5874 chars]",,de,'Ukraine'
https://www.welt.de/politik/deutschland/plus252822774/Aerzte-aus-der-Ukraine-Warum-ein-erfahrener-Chirurg-in-Deutschland-als-Pizzabote-arbeiten-muss.html,https://www.welt.de/politik/deutschland/plus252822774/Aerzte-aus-der-Ukraine-Warum-ein-erfahrener-Chirurg-in-Deutschland-als-Pizzabote-arbeiten-muss.html,0,www.welt.de,Warum ein erfahrener Chirurg in Deutschland als Pizzabote arbeiten muss,In der Ukraine rettete Arzt Andrii Severyn im Krankenhaus Leben. Nach seiner Flucht wegen des russischen Angriffskriegs liefert er als Minijobber hierzulande Essen aus – denn sein Antrag auf Berufszulassung hängt in der Bürokratie fest. Dabei würde er nichts …,https://img.welt.de/img/politik/deutschland/mobile252822812/3841357907-ci16x9-w1200-fnov-fpotl-fpi157750653/Andrii-Severyn-Chirurg-aus-der-Ukraine-6.jpg,2024-08-04T05:43:35Z,,"Die WELT als ePaper: Die vollständige Ausgabe steht Ihnen bereits am Vorabend zur Verfügung so sind Sie immer hochaktuell informiert. Weitere Informationen: http://epaper.welt.de 
 Der Kurz-Link die… [+49 chars]",,de,'Ukraine'
https://www.faz.net/aktuell/politik/ukraine/ukraine-will-tief-in-russland-zuschlagen-koennen-19898350.html,https://www.faz.net/aktuell/politik/ukraine/ukraine-will-tief-in-russland-zuschlagen-koennen-19898350.html,0,www.faz.net,Ukraine will „wirklich weitreichende Schläge“ gegen Russland führen können,"Nur mit eigenen Drohnen kann die Ukraine tief im Land der Angreifer zuschlagen. Präsident Selenskyj betont, dies müsse auch mit westlichen Marschflugkörpern und Raketen möglich sein.",https://media0.faz.net/ppmedia/aktuell/politik/430128472/1.9898362/facebook_teaser/wolodymyr-selenskyj-praesident.jpg,2024-08-04T05:47:57Z,,"Das ukrainische Militär griff zuletzt mehrfach Ziele auf russischem Staatsgebiet an. Drohnenangriffe setzten Treibstofflager in Brand. Der russische Telegramkanal Mash verbreitete Videos, die solche … [+3052 chars]",,de,'Ukraine'
https://www.telepolis.de/features/Erdoel-Boykott-der-Ukraine-Ungarn-sieht-sich-von-der-EU-im-Stich-gelassen-9821891.html,https://www.telepolis.de/features/Erdoel-Boykott-der-Ukraine-Ungarn-sieht-sich-von-der-EU-im-Stich-gelassen-9821891.html,0,www.telepolis.de,Erdöl-Boykott der Ukraine: Ungarn sieht sich von der EU im Stich gelassen,Orbáns Außenminister bezichtigt Kiew der Erpressung. EU trage für Belange von Mitgliedsstaaten nicht genug Sorge. Worum es bei dem Streit geht.,https://heise.cloudimg.io/bound/1200x1200/q85.png-lossy-85.webp-lossy-85.foil1/_www-heise-de_/imgs/18/4/6/4/4/6/5/7/ceb8f5cfed4b3bc5.jpg,2024-08-04T06:00:00Z,,"Orbáns Außenminister bezichtigt Kiew der Erpressung. EU trage für Belange von Mitgliedsstaaten nicht genug Sorge. Worum es bei dem Streit geht.
Ungarns Außenminister Péter Szijjártó hat die Ukraine … [+5459 chars]",,de,'Ukraine'
https://orf.at/stories/3365583/,https://orf.at/stories/3365583/,0,orf.at,Ukraine: Russisches U-Boot versenkt,,https://orf.at/mojo/1_4_1/storyserver//news/common/images/og-fallback-news.png,2024-08-04T06:06:29Z,,"Die Ukraine reklamiert für sich, ein russischens U-Boot versenkt zu haben. Durch einen kombinierten Angriff mit Raketen und Sprengbooten seien im Kriegshafen von Sewastopol auf der besetzten Halbinse… [+1870 chars]",,de,'Ukraine'
https://www.faz.net/aktuell/wirtschaft/mprest-das-techunternehmen-hinter-israels-iron-dome-19895812.html,https://www.faz.net/aktuell/wirtschaft/mprest-das-techunternehmen-hinter-israels-iron-dome-19895812.html,0,www.faz.net,Im Gehirn des Iron Dome,Israels Luftabwehr hat ­schon viele Leben gerettet. Möglich macht das die Software eines kleinen Unternehmens. Ein Krieg mit der Hizbullah könnte das System an seine Grenzen bringen.,https://media0.faz.net/ppmedia/aktuell/53682128/1.9895808/facebook_teaser/der-iron-dome-im-einsatz.jpg,2024-08-04T06:19:38Z,,"Denn Mprest entwickelt hier nicht irgendwelche Software. Auf der Leinwand im klimatisierten Konferenzraum in Petach Tikwa flackern Bilder vom Nachthimmel über Israel auf, durchbrochen von den orange … [+9130 chars]",,de,'Ukraine'
https://www.n-tv.de/politik/Selenskyj-Krieg-soll-nach-Russland-zurueckkehren-article25135445.html,https://www.n-tv.de/politik/Selenskyj-Krieg-soll-nach-Russland-zurueckkehren-article25135445.html,0,www.n-tv.de,Schläge gegen Besatzer: Selenskyj: Krieg soll nach Russland zurückkehren,"Die Ukraine geht in den vergangenen Tagen mit einer Serie von Angriffen auf russische Flugplätze und Raffinerien in die Offensive. Präsident Selenskyj fordert, dass der Westen die Erlaubnis für den Einsatz schwerer Waffen gibt.",https://bilder1.n-tv.de/img/incoming/crop25135456/6721325915-cImg_16_9-w1200/a5367b90a2fb276b82651403023a233f.jpg,2024-08-04T06:35:31Z,,"Die Ukraine geht in den vergangenen Tagen mit einer Serie von Angriffen auf russische Flugplätze und Raffinerien in die Offensive. Präsident Selenskyj fordert, dass der Westen die Erlaubnis für den E… [+3892 chars]",,de,'Ukraine'
https://www.tagesschau.de/ausland/asien/israel-nahost-102.html,https://www.tagesschau.de/ausland/asien/israel-nahost-102.html,0,www.tagesschau.de,Israel rüstet sich für Krieg an allen Fronten,"In Israel wächst die Sorge vor Gegenangriffen aus dem Iran und dem Libanon. Diese könnten über mehrere Fronten erfolgen, berichten Medien. In der Nacht kam es erneut zu massivem Raketenbeschuss von Seiten der Hisbollah.",https://images.tagesschau.de/image/ae291d68-a996-4fcc-a881-01eaaa5ed488/AAABkRwn38w/AAABjwnlFvA/16x9-1280/israel-1078.jpg,2024-08-04T06:51:01Z,,"Stand: 04.08.2024 08:51 Uhr
In Israel wächst die Sorge vor Gegenangriffen aus dem Iran und dem Libanon. Diese könnten über mehrere Fronten erfolgen, berichten Medien. In der Nacht kam es erneut zu m… [+4448 chars]",,de,'Katar'
https://www.faz.net/aktuell/politik/inland/olaf-scholz-im-sinkflug-der-kanzler-kokmmt-bei-den-waehlern-nicht-an-19886879.html,https://www.faz.net/aktuell/politik/inland/olaf-scholz-im-sinkflug-der-kanzler-kokmmt-bei-den-waehlern-nicht-an-19886879.html,0,www.faz.net,"Scholz im Sinkflug: Der Kanzler, der bei den Wählern nicht ankommt",Der Lebenslauf von Olaf Scholz kann sich sehen lassen. Er hat viel Regierungserfahrung. Beliebt ist er trotzdem nicht. Und Kult zu werden wie Kohl als „Birne“ oder Merkel als „Mutti“ ist ihm noch nicht gelungen.,https://media1.faz.net/ppmedia/aktuell/politik/4277785914/1.9886869/facebook_teaser/bundeskanzler-olaf-scholz-spd.jpg,2024-08-04T08:03:03Z,,"Man kann dem Mann also schlecht vorwerfen, er verstehe nichts vom Regierungsgeschäft. Sonst wäre er wohl nicht so weit gekommen. Angela Merkel hat sich als Kanzlerin über lange Strecken auf ihn verla… [+4109 chars]",,de,'Ukraine'
https://www.stern.de/politik/deutschland/bodo-ramelow-fordert-nichtangriffspakt-mit-russland-34946236.html,https://www.stern.de/politik/deutschland/bodo-ramelow-fordert-nichtangriffspakt-mit-russland-34946236.html,0,www.stern.de,Ukraine-Krieg: Ramelow fordert Nichtangriffspakt mit Russland,Bodo Ramelow denkt schon an die Zeit nach dem Krieg: Am 1. September wird in Thüringen ein neuer Landtag gewählt. Der Ukraine-Krieg ist ein großes Thema im Wahlkampf.,https://image.stern.de/34946238/t/pb/v1/w1440/r1.7778/-/04--olffacctavv6axw800h600jpeg---8da77a7b18cbec9c.jpg,2024-08-04T08:23:00Z,,"Bodo Ramelow denkt schon an die Zeit nach dem Krieg: Am 1. September wird in Thüringen ein neuer Landtag gewählt. Der Ukraine-Krieg ist ein großes Thema im Wahlkampf.
Thüringens Ministerpräsident Bo… [+2186 chars]",,de,'Ukraine'
https://www.tagesspiegel.de/wissen/wiarda-wills-wissen-it-sicherheit-an-unis-fehlanzeige-12133409.html,https://www.tagesspiegel.de/wissen/wiarda-wills-wissen-it-sicherheit-an-unis-fehlanzeige-12133409.html,0,www.tagesspiegel.de,Wiarda will’s wissen: IT-Sicherheit an Unis? Fehlanzeige!,Am Schutz sensibler Daten an Deutschlands Hochschulen hat die Bundesregierung offenbar kein Interesse. Sie kennt noch nicht einmal die Zahl der Cyberangriffe auf Unis und Institute.,https://www.tagesspiegel.de/images/8905171/alternates/BASE_16_9_W1400/1681488952000/wiarda-wills-wissen-online.png,2024-08-04T08:52:34Z,,"Wer Cyberangriff zusammen mit Hochschule oder Universität googelt, erzielt eine deprimierende Auswahl an Treffern. Von gestohlenen Studierendenkonten in Düsseldorf über gesperrte Aufzüge in Frankfurt… [+4034 chars]",,de,'Ukraine'
