index,url,valid,domain,title,description,image,published,archive,content,quote,language,keyword
https://www.focus.de/themen/buergergeld/uebersicht-buergergeld-so-hoch-sind-die-regelsaetze_id_260418607.html,https://www.focus.de/themen/buergergeld/uebersicht-buergergeld-so-hoch-sind-die-regelsaetze_id_260418607.html,0,www.focus.de,Übersicht - Bürgergeld: So hoch sind die Regelsätze,Das Bürgergeld löst seit Januar 2023 das Arbeitslosengeld II (Hartz IV) ab. Beim Bürgergeld hängt die Höhe von unterschiedlichen Kriterien ab.,https://p6.focus.de/img/fotos/id_260418604/imago168079720.jpg?im=Crop%3D%280%2C344%2C3000%2C1502%29%3BResize%3D%281200%2C627%29&impolicy=perceptual&quality=mediumHigh&hash=e25aaeda7a187f46d3dfbfc4b4e2caedb5537d3d67dfa91919db7a5e5a79b09a,2024-10-23T12:24:23Z,,Das Bürgergeld löst seit Januar 2023 das Arbeitslosengeld II (Hartz IV) ab. Beim Bürgergeld hängt die Höhe von unterschiedlichen Kriterien ab.Bürgergeld Höhe: Das müssen Sie zu den Regelsätzen wissen… [+2963 chars],,de,'Bürgergeld'
https://www.welt.de/politik/deutschland/video254151208/Lindner-Vorschlag-Ukrainische-Fluechtlinge-direkt-ins-Buergergeld-Entscheidung-wieder-rueckgaengig-machen.html,https://www.welt.de/politik/deutschland/video254151208/Lindner-Vorschlag-Ukrainische-Fluechtlinge-direkt-ins-Buergergeld-Entscheidung-wieder-rueckgaengig-machen.html,0,www.welt.de,Ukrainische Flüchtlinge direkt ins Bürgergeld – „Entscheidung wieder rückgängig machen“,"Bundesfinanzminister Lindner schlägt einen neuen Rechtsstatus für Geflüchtete aus der Ukraine vor. So sollen die Kosten für das Bürgergeld sinken. Die „Grenzkontrolle verstetigen“ will Achim Brötel (CDU), der Präsident des Deutschen Landkreistages.",https://img.welt.de/img/out-of-home/politik/mobile254142924/2097930477-ci16x9-w1200/Session-of-the-lower-house-of-parliament-Bundestag-in-Berlin.jpg,2024-10-23T12:40:01Z,,Bundesfinanzminister Lindner schlägt einen neuen Rechtsstatus für Geflüchtete aus der Ukraine vor. So sollen die Kosten für das Bürgergeld sinken. Die Grenzkontrolle verstetigen will Achim Brötel (CD… [+92 chars],,de,'Ukraine'
https://www.zeit.de/kultur/film/2024-10/rundfunkbeitrag-markus-soeder-stephan-weil-oeffentlich-rechtliche-medien,https://www.zeit.de/kultur/film/2024-10/rundfunkbeitrag-markus-soeder-stephan-weil-oeffentlich-rechtliche-medien,0,www.zeit.de,Öffentlich-rechtlicher Rundfunk: Söder und Weil wollen keine weitere Erhöhung des Rundfunkbeitrags,"Laut Markus Söder und Stephan Weil sollen die öffentlich-rechtlichen Sender sparen, bevor Abgaben erhöht werden. So könnten beispielsweise Spitzengehälter gekürzt werden.",https://img.zeit.de/politik/deutschland/2024-10/rundfunkbeitrag-markus-soeder-stephan-weil-oeffentlich-rechtliche-medien-bild/wide__1300x731,2024-10-23T12:51:16Z,http://archive.md/20241023155305/https://www.zeit.de/kultur/film/2024-10/rundfunkbeitrag-markus-soeder-stephan-weil-oeffentlich-rechtliche-medien,"Die Ministerpräsidenten Stephan Weil und Markus Söder haben sich gegen eine weitere Erhöhung der Rundfunkbeiträge ausgesprochen und stattdessen Reformen gefordert. Wenn alle sparen müssten, dann könn… [+3789 chars]",,de,'sparen'
https://www.diepresse.com/18998366/4-bei-welchen-kritischen-rohstoffen-kann-putin-europa-kuenftig-erpressen,https://www.diepresse.com/18998366/4-bei-welchen-kritischen-rohstoffen-kann-putin-europa-kuenftig-erpressen,0,www.diepresse.com,#4: Bei welchen kritischen Rohstoffen kann Putin Europa künftig erpressen?,"Dass der Wegfall russischer Rohstoffe den Westen erschüttern kann, hat sich schon vor dem Ukraine-Krieg etwa bei Gas gezeigt. Seither wurde der Import von Gas und anderen Rohstoffen aus Russland weiter reduziert. Wirtschaftlich verloren haben dadurch beide Se…",https://img.diepresse.com/public/incoming/355qlr-Russia2.jpeg/alternates/DPR_SOCIAL_NACHRICHTEN/Russia2.jpeg,2024-10-23T13:00:00Z,,"Ringt der Westen mit Sanktionen Russland nieder? Oder braucht Russlands Wirtschaft Europa gar nicht mehr? Was spielt sich da wirklich ab hinter dem neuen Eisernen Vorhang, seit Wladimir Putin den Kri… [+427 chars]",,de,'Import'
https://www.welt.de/politik/ausland/article254142992/Brics-Gipfel-in-Kasan-EU-wirft-Putin-Missbrauch-vor.html,https://www.welt.de/politik/ausland/article254142992/Brics-Gipfel-in-Kasan-EU-wirft-Putin-Missbrauch-vor.html,0,www.welt.de,EU wirft Putin „Missbrauch“ des Brics-Gipfels vor – Appelle an Guterres und Erdogan,Im russischen Kasan treffen sich die Brics-Staaten. UN-Generalsekretär António Guterres will dort ebenfalls mit den Teilnehmern des Gipfels sprechen. Auch ein Treffen mit Kremlchef Wladimir Putin ist geplant. Die EU ist unglücklich mit dieser Konstellation.,https://img.welt.de/img/politik/ausland/mobile254152742/3387938787-ci16x9-w1200/16-Brics-Gipfel-in-Kasan.jpg,2024-10-23T13:12:00Z,,Im russischen Kasan treffen sich die Brics-Staaten. UN-Generalsekretär António Guterres will dort ebenfalls mit den Teilnehmern des Gipfels sprechen. Auch ein Treffen mit Kremlchef Wladimir Putin ist… [+3102 chars],,de,'Wladimir Putin'
https://www.zeit.de/politik/ausland/2024-10/krieg-nahost-aussenministerin-annalena-baerbock-libanon-humanitaere-hilfe,https://www.zeit.de/politik/ausland/2024-10/krieg-nahost-aussenministerin-annalena-baerbock-libanon-humanitaere-hilfe,0,www.zeit.de,Krieg in Nahost: Annalena Baerbock fordert von Israel mehr humanitäre Hilfe für Gaza,"Der Libanon stehe ""am Rande des Kollaps"", mahnt Außenministerin Baerbock bei ihrem Besuch in Beirut. Sie forderte mehr Hilfen und eine ""tragfähige diplomatische Lösung"".",https://img.zeit.de/politik/ausland/2024-10/annalena-baerbock-besuch-libanon-humanitaere-hilfe-bild/wide__1300x731,2024-10-23T13:20:29Z,,"Außenministerin Annalena Baerbock hat die israelische Regierung mit Nachdruck aufgerufen, mehr humanitäre Hilfe für die Not leidende Zivilbevölkerung im Gazastreifen
 zuzulassen. Insbesondere im Nor… [+3738 chars]",,de,'Krieg'
https://www.tagesschau.de/ausland/europa/nordkorea-russland-soldaten-faq-100.html,https://www.tagesschau.de/ausland/europa/nordkorea-russland-soldaten-faq-100.html,0,www.tagesschau.de,Krieg in der Ukraine: Schickt Nordkorea Soldaten nach Russland?,"Seit Tagen kursieren Meldungen, dass Russland seine Truppen mit Nordkoreanern aufstockt. Südkoreas Geheimdienst berichtete bereits vergangene Woche davon, jetzt sehen auch die USA Beweise. Russland schweigt zu den Vorwürfen.",https://images.tagesschau.de/image/73831929-774d-4a86-97b3-c7d850d6406e/AAABkrlCq58/AAABkZLhkrw/16x9-1280/soldaten-nordkorea-104.jpg,2024-10-23T13:25:00Z,,"Stand: 23.10.2024 15:25 Uhr
Seit Tagen kursieren Meldungen, dass Russland seine Truppen mit Nordkoreanern aufstockt. Südkoreas Geheimdienst berichtete bereits vergangene Woche davon, jetzt sehen auc… [+7731 chars]",,de,'Krieg'
https://www.tagesspiegel.de/potsdam/brandenburg/olaf-scholz-zu-besuch-in-brandenburg-heizen-mit-eis-in-caputh--ein-vorbild-fur-deutschland-12580949.html,https://www.tagesspiegel.de/potsdam/brandenburg/olaf-scholz-zu-besuch-in-brandenburg-heizen-mit-eis-in-caputh--ein-vorbild-fur-deutschland-12580949.html,0,www.tagesspiegel.de,Olaf Scholz zu Besuch in Brandenburg: Heizen mit Eis in Caputh – ein Vorbild für Deutschland?,"Das Quartier Blütenviertel erzeugt mit Eisspeicher, Wärmepumpe und Solar seine Energie großteils selbst. Kanzler Scholz nennt es „sehr innovativ“ und sieht Genehmigungsverfahren als Herausforderung.",https://www.tagesspiegel.de/images/12582725/alternates/BASE_16_9_W1400/1729687185000/energiekonzept-im-blutenviertel-in-caputh.jpeg,2024-10-23T13:30:42Z,,"Es ist ein Novum in der deutschen Wohnungswirtschaft. Seit diesem Herbst werden die ersten Wohnungen im Neubauquartier Blütenviertel in Caputh, einer Ortschaft bei Potsdam, 50 Kilometer südlich von B… [+164 chars]",,de,'Olaf Scholz'
https://www.zeit.de/news/2024-10/23/washington-g7-einig-ueber-50-milliarden-kredit-fuer-ukraine,https://www.zeit.de/news/2024-10/23/washington-g7-einig-ueber-50-milliarden-kredit-fuer-ukraine,0,www.zeit.de,Eingefrorenes russisches Geld: Washington: G7 einig über 50-Milliarden-Kredit für Ukraine,Hier finden Sie Informationen zu dem Thema „Eingefrorenes russisches Geld“. Lesen Sie jetzt „Washington: G7 einig über 50-Milliarden-Kredit für Ukraine“.,https://img.zeit.de/news/2024-10/23/washington-g7-einig-ueber-50-milliarden-kredit-fuer-ukraine-image-group/wide__1300x731,2024-10-23T13:56:28Z,,Die Gruppe der sieben großen westlichen Industriestaaten gewährt der Ukraine nach Angaben der USA einen Kredit in Höhe von 50 Milliarden US-Dollar (rund 46 Milliarden Euro) - für den indirekt Russlan… [+4501 chars],,de,'Ukraine'
https://www.n-tv.de/politik/Ukraine-Krieg-Kiew-erhaelt-wohl-vorerst-nur-wenige-Mirage-Kampfjets-article25309836.html,https://www.n-tv.de/politik/Ukraine-Krieg-Kiew-erhaelt-wohl-vorerst-nur-wenige-Mirage-Kampfjets-article25309836.html,0,www.n-tv.de,Bericht über erste Lieferung: Ernüchternde Mirage-Kampfjet-Nachrichten für die Ukraine,Mit der Mirage 2000-5 wird die Ukraine im nächsten Jahr den zweiten westlichen Kampfjet in ihrem Verteidigungskampf einsetzen. Einem Bericht zufolge fällt die erste Lieferung jedoch gering aus. In Großbritannien haben derweil weitere F-16-Piloten ihre Grundau…,https://bilder4.n-tv.de/img/incoming/crop25310011/003132832-cImg_16_9-w1200/AP04071404278.jpg,2024-10-23T14:05:51Z,,Mit der Mirage 2000-5 wird die Ukraine im nächsten Jahr den zweiten westlichen Kampfjet in ihrem Verteidigungskampf einsetzen. Einem Bericht zufolge fällt die erste Lieferung jedoch gering aus. In Gr… [+2999 chars],,de,'Katar'
https://www.tagesschau.de/inland/innenpolitik/buergergeld-plaene-lindner-100.html,https://www.tagesschau.de/inland/innenpolitik/buergergeld-plaene-lindner-100.html,0,www.tagesschau.de,Was steckt hinter Lindners Bürgergeldplänen?,Finanzminister Lindner will die Sozialleistungen neu ausrichten. Dabei geht es um Unterkunftskosten für Bürgergeldempfänger und um die Leistungen für ukrainische Geflüchtete. Was schlägt er vor - und wie ist die Rechtslage?,https://images.tagesschau.de/image/979b4e45-e883-47f3-99ee-1dd27387f4f6/AAABkiRgQbg/AAABkZLhkrw/16x9-1280/christian-lindner-238.jpg,2024-10-23T15:27:55Z,,"Stand: 23.10.2024 17:27 Uhr
Finanzminister Lindner will die Sozialleistungen neu ausrichten. Dabei geht es um Unterkunftskosten für Bürgergeldempfänger und um die Leistungen für ukrainische Geflücht… [+8449 chars]",,de,'Bürgergeld'
https://www.zeit.de/news/2024-10/23/sachsen-holt-auf-beim-ausbau-im-bereich-erneuerbare-energie,https://www.zeit.de/news/2024-10/23/sachsen-holt-auf-beim-ausbau-im-bereich-erneuerbare-energie,0,www.zeit.de,Energiewende: Sachsen holt auf beim Ausbau im Bereich erneuerbare Energie,Hier finden Sie Informationen zu dem Thema „Energiewende“. Lesen Sie jetzt „Sachsen holt auf beim Ausbau im Bereich erneuerbare Energie“.,https://img.zeit.de/news/2024-10/23/sachsen-holt-auf-beim-ausbau-im-bereich-erneuerbare-energie-image-group/wide__1300x731,2024-10-23T15:33:07Z,,Der Ausbau der erneuerbaren Energien in Sachsen hat nach Einschätzung des Umweltministeriums «deutlich Fahrt» aufgenommen. Das gehe aus dem Bund-Länder-Bericht 2024 zum aktuellen Stand in Deutschland… [+2245 chars],,de,'Industrie'
https://www.faz.net/aktuell/politik/ukraine/brics-gipfel-kritik-an-guterres-reise-nach-russland-110065396.html,https://www.faz.net/aktuell/politik/ukraine/brics-gipfel-kritik-an-guterres-reise-nach-russland-110065396.html,0,www.faz.net,BRICS-Gipfel: Kritik an Reise von UN-Generalsekretär Guterres nach Russland,"Die Ukraine wirft dem UN-Generalsekretär vor, dem Ruf der Vereinten Nationen zu schaden, indem er „die Ein­ladung des Kriegsverbrechers Putin“ angenommen habe. Ein Sprecher der UN weist die Kritik zurück.",https://media1.faz.net/ppmedia/aktuell/1462970536/1.10065395/facebook_teaser/un-generalsekretaer-antionio.jpg,2024-10-23T15:59:25Z,,"Ein UN-Sprecher wies die Kritik an der Reise zurück: Der Generalsekretär nehme an dem Gipfeltreffen in Kasan an der Wolga ebenso teil, wie er das beim BRICS-Gipfel in Johannesburg im vergangenen Jahr… [+3024 chars]",,de,'Kreml'
https://www.faz.net/podcasts/f-a-z-podcast-fuer-deutschland/putins-hybrider-krieg-deutsche-naivitaet-ist-bedrohlich-110065840.html,https://www.faz.net/podcasts/f-a-z-podcast-fuer-deutschland/putins-hybrider-krieg-deutsche-naivitaet-ist-bedrohlich-110065840.html,0,www.faz.net,Putins hybrider Krieg: „Deutsche Naivität ist bedrohlich“,"Russland soll bei der Wahl in Moldau 300.000 Stimmen gekauft und Millionen Euro für Lügen und Desinformation ausgegeben haben. Über Putins immer aggressiveren hybriden Krieg sprechen wir mit Oberst Dr. Johann Schmid, Offizier der Bundeswehr.",https://media0.faz.net/ppmedia/aktuell/2344721678/1.10055040/facebook_teaser_fplus/14e801d0-8d3a-11ef-a147.jpg,2024-10-23T16:41:23Z,http://archive.md/20241023174201/https://www.faz.net/podcasts/f-a-z-podcast-fuer-deutschland/putins-hybrider-krieg-deutsche-naivitaet-ist-bedrohlich-110065840.html,"Ihr Host am Mittwoch: Kati Schneider
Mitarbeit: Michael Götz, Emma Feuerbacher und Carlotta Roch
Schreiben Sie uns bitte Ihre Fragen, Anmerkungen und Meinungen an: podcast@faz.de. Oder senden Sie u… [+241 chars]",,de,'Krieg'
https://www.welt.de/politik/video254158848/Sparidee-des-Finanzministers-Was-Lindner-ausblendet-ist-die-aussenpolitische-Wirkung-des-Buergergeldtransfers.html,https://www.welt.de/politik/video254158848/Sparidee-des-Finanzministers-Was-Lindner-ausblendet-ist-die-aussenpolitische-Wirkung-des-Buergergeldtransfers.html,0,www.welt.de,"""Was Lindner ausblendet, ist die außenpolitische Wirkung des Bürgergeldtransfers""",Der Staat soll nach einem neuen Vorstoß von FDP-Chef Christian Lindner bei den Wohnkosten für Menschen im Bürgergeld sowie bei den geflüchteten Ukrainern Milliarden einsparen. WELT-Politik-Redakteur Nikolaus Doll erklärt die Hintergründe.,https://img.welt.de/img/videos/mobile254158858/8297935137-ci16x9-w1200/Image-66828b1bceb9ad1d783e1c72.jpg,2024-10-23T17:43:54Z,http://archive.md/20241024195204/https://www.welt.de/politik/video254158848/Sparidee-des-Finanzministers-Was-Lindner-ausblendet-ist-die-aussenpolitische-Wirkung-des-Buergergeldtransfers.html,Der Staat soll nach einem neuen Vorstoß von FDP-Chef Christian Lindner bei den Wohnkosten für Menschen im Bürgergeld sowie bei den geflüchteten Ukrainern Milliarden einsparen. WELT-Politik-Redakteur … [+84 chars],,de,'Ukraine'
https://www.jungewelt.de/artikel/486365.unblock-cuba-die-energieanlagen-sind-marode.html,https://www.jungewelt.de/artikel/486365.unblock-cuba-die-energieanlagen-sind-marode.html,0,www.jungewelt.de,Unblock Cuba!: »Die Energieanlagen sind marode«,"Stromabschaltungen und Tropensturm treffen Kuba. US-Blockade verhindert Import von Kraftstoff und Ersatzteilen. Ein Gespräch mit Jutta Kausch, Vorsitzende der Freundschaftsgesellschaft Berlin–Kuba e. V.",https://www.jungewelt.de/img/1100/201233.jpg,2024-10-23T17:47:16Z,,"Am Freitag vormittag fiel auf Kuba das Stromnetz aus, seitdem kämpft die Karibikinsel gegen den Blackout. Was ist passiert?
Das wichtigste Wärmekaftwerk ist zusammengebrochen. Die Energieanlagen sin… [+3800 chars]",,de,'Energie'
https://www.focus.de/unterhaltung/kino-tv/jasmin-nahm-schwangerschaft-wegen-ueppigem-buergergeld-locker-dann-folgt-das-drama_727f29b7-cd0a-48a8-be73-143e4a612d85.html,https://www.focus.de/unterhaltung/kino-tv/jasmin-nahm-schwangerschaft-wegen-ueppigem-buergergeld-locker-dann-folgt-das-drama_727f29b7-cd0a-48a8-be73-143e4a612d85.html,0,www.focus.de,In RTL2-Sozialdoku - Jasmin nahm Schwangerschaft wegen üppigem Bürgergeld locker - dann folgt das Drama,„Hartz und herzlich“ ist mit neuen Folgen aus Rostock zurück. In der RTL2-Doku sind auch wieder Jasmin und Maik zu sehen. Das Paar hat auch diesmal wieder mit einigen Problemen zu kämpfen.,https://quadro.burda-forward.de/ctf/81f675da-8a28-4fd0-9f24-a2951e382f60.67868b9a-d535-4c8a-b2cb-e369efc9f051.jpeg?im=RegionOfInterestCrop%3D%281200%2C630%29%2CregionOfInterest%3D%28800%2C450%29&hash=daeb7a965efa26fd470bf164fd72a4ede7e3d4685fc0342d54b9198955579fae,2024-10-23T18:05:00Z,,"Die Dreharbeiten der neuen Folgen von Hartz und herzlich liegen einige Monate zurück. In der RTL2-Sozialdoku ist Protagonistin Jasmin schwanger mittlerweile ist jedoch bekannt geworden, dass die 19-J… [+2095 chars]",,de,'Bürgergeld'
https://www.n-tv.de/politik/23-57-Finnischer-Praesident-interpretiert-nordkoreanische-Hilfe-als-russische-Verzweiflung--article25310922.html,https://www.n-tv.de/politik/23-57-Finnischer-Praesident-interpretiert-nordkoreanische-Hilfe-als-russische-Verzweiflung--article25310922.html,0,www.n-tv.de,Ukraine-Krieg im Liveticker: +++ 23:57 Finnischer Präsident interpretiert nordkoreanische Hilfe als russische Verzweiflung +++,Lesen Sie alle aktuellen Entwicklungen und Nachrichten über den russischen Angriffskrieg auf die Ukraine im Liveticker von ntv.de.,https://bilder3.n-tv.de/img/incoming/crop25117070/4231326595-cImg_16_9-w1200/Ukraine-Liveticker.jpg,2024-10-23T18:15:00Z,,"Der finnische Präsident Alexander Stubb sieht Berichte über die Hilfe Nordkoreas für Russland im Ukraine-Krieg als Zeichen für eine Schwäche Moskaus. ""Ich denke, wir sehen, wie verzweifelt Russland i… [+41596 chars]",,de,'Krieg'
https://www.zeit.de/politik/deutschland/2024-10/buergergeld-wohnungskosten-pauschalierung-christian-lindner-kritik-sozialverband-deutschland,https://www.zeit.de/politik/deutschland/2024-10/buergergeld-wohnungskosten-pauschalierung-christian-lindner-kritik-sozialverband-deutschland,0,www.zeit.de,Bürgergeld: Kritik an Christian Lindners Bürgergeld-Vorstoß zu Wohnkosten,"Der Finanzminister und FDP-Chef hatte angeregt, Miet- und Nebenkosten für Bürgergeldempfänger zu deckeln. Der Sozialverband Deutschland warnt vor ""dramatischen Folgen"".",https://img.zeit.de/politik/deutschland/2024-10/buergergeld-wohnungskosten-pauschalierung-christian-lindner-kritik-sozialverband-deutschland-bild/wide__1300x731,2024-10-23T23:01:16Z,http://archive.md/20241024010829/https://www.zeit.de/politik/deutschland/2024-10/buergergeld-wohnungskosten-pauschalierung-christian-lindner-kritik-sozialverband-deutschland,"Der Vorschlag von Bundesfinanzminister Christian Lindner, die Wohnungskosten für Bürgergeldempfänger zu pauschalieren, stößt auf Kritik. Die Vorstandsvorsitzende des Sozialverbands Deutschland, Micha… [+2292 chars]",,de,'Bürgergeld'
https://www.zeit.de/news/2024-10/24/rotes-kreuz-buero-in-donezk-bei-russischem-angriff-zerstoert,https://www.zeit.de/news/2024-10/24/rotes-kreuz-buero-in-donezk-bei-russischem-angriff-zerstoert,0,www.zeit.de,Krieg in der Ukraine: Rotes Kreuz: Büro in Donezk bei russischem Angriff zerstört,Hier finden Sie Informationen zu dem Thema „Krieg in der Ukraine“. Lesen Sie jetzt „Rotes Kreuz: Büro in Donezk bei russischem Angriff zerstört“.,https://img.zeit.de/news/2024-10/24/rotes-kreuz-buero-in-donezk-bei-russischem-angriff-zerstoert-image-group/wide__1300x731,2024-10-24T01:30:43Z,,Bei einem russischen Angriff in der Ostukraine ist nach Angaben des ukrainischen Roten Kreuzes ein Büro der Hilfsorganisation zerstört worden. Es habe sich in einem Kulturzentrum in der Stadt Kuracho… [+265 chars],,de,'Ukraine'
https://www.faz.net/aktuell/politik/krieg-in-nahost/liveticker-zum-krieg-in-nahost-libanon-meldet-heftigste-angriffe-seit-beginn-des-krieges-19972506.html,https://www.faz.net/aktuell/politik/krieg-in-nahost/liveticker-zum-krieg-in-nahost-libanon-meldet-heftigste-angriffe-seit-beginn-des-krieges-19972506.html,0,www.faz.net,Liveblog zum Krieg in Nahost: Libanon meldet „heftigste Angriffe seit Beginn des Krieges“,Hizbullah bestätigt Tod von möglichem Nasrallah-Nachfolger +++ Baerbock in Beirut eingetroffen +++ Außenministerin: „Libanon steht am Rande des Kollaps“ +++ Israels Armee fordert Evakuierung des südlibanesischen Tyros +++ alle Entwicklungen im Liveblog,https://media0.faz.net/ppmedia/aktuell/politik/1976640976/1.10066206/facebook_teaser/flammen-und-rauch-steigen-aus.jpg,2024-10-24T01:54:29Z,,Deutschland stellt dem vom Nahost-Konflikt erschütterten Libanon für humanitäre Hilfe weitere 60 Millionen Euro zu Verfügung. Das kündigte Bundeskanzler Olaf Scholz (SPD) in einem Telefonat mit dem g… [+534 chars],,de,'Olaf Scholz'
https://www.zeit.de/politik/ausland/2024-10/usa-bestaetigung-entsendung-3-000-soldaten-nordkorea-russland-ukraine,https://www.zeit.de/politik/ausland/2024-10/usa-bestaetigung-entsendung-3-000-soldaten-nordkorea-russland-ukraine,0,www.zeit.de,Ukraine-Krieg: USA bestätigen Entsendung von 3.000 Soldaten aus Nordkorea,Nach US-Erkenntnissen hat Nordkorea Tausende Soldaten nach Russland geschickt. Gegenwärtig werden diese demnach in Ausbildungsstätten im Osten des Landes geschult.,https://img.zeit.de/politik/ausland/2024-10/usa-bestaetigung-entsendung-3-000-soldaten-nordkorea-russland-ukraine-bild/wide__1300x731,2024-10-24T02:22:14Z,,"Das US-Präsidialamt geht davon aus, dass Nordkorea mindestens 3.000 Soldaten für einen möglichen späteren Kriegseinsatz gegen die Ukraine nach Russland entsendet hat. Sie seien Anfang und Mitte Oktob… [+2771 chars]",,de,'Krieg'
https://www.zeit.de/news/2024-10/24/genexco-plant-zweite-gasbohrung-unweit-des-ammersees,https://www.zeit.de/news/2024-10/24/genexco-plant-zweite-gasbohrung-unweit-des-ammersees,0,www.zeit.de,Energie: Genexco plant zweite Gasbohrung unweit des Ammersees,Hier finden Sie Informationen zu dem Thema „Energie“. Lesen Sie jetzt „Genexco plant zweite Gasbohrung unweit des Ammersees“.,https://img.zeit.de/news/2024-10/24/genexco-plant-zweite-gasbohrung-unweit-des-ammersees-image-group/wide__1300x731,2024-10-24T03:00:39Z,,Die Firma Genexco plant nach eigener Aussage bereits im zweiten Quartal 2025 eine weitere Gas-Probebohrung unweit des Ammersees. «Der Umweltverträglichkeitsbericht wurde eingereicht und die Bohrplanu… [+2872 chars],,de,'Gas'
https://www.zeit.de/news/2024-10/24/krieg-in-nahost-tobt-weiter-hilfskonferenz-fuer-libanon,https://www.zeit.de/news/2024-10/24/krieg-in-nahost-tobt-weiter-hilfskonferenz-fuer-libanon,0,www.zeit.de,Lage im Überblick: Krieg in Nahost tobt weiter - Hilfskonferenz für Libanon,Hier finden Sie Informationen zu dem Thema „Lage im Überblick“. Lesen Sie jetzt „Krieg in Nahost tobt weiter - Hilfskonferenz für Libanon“.,https://img.zeit.de/news/2024-10/24/krieg-in-nahost-tobt-weiter-hilfskonferenz-fuer-libanon-image-group/wide__1300x731,2024-10-24T03:12:00Z,,Wenige Stunden vor Beginn einer internationalen Hilfskonferenz für den Libanon in Paris sind die südlichen Vororte der Hauptstadt Beirut erneut von schweren israelischen Luftangriffen erschüttert wor… [+7988 chars],,de,'Krieg'
https://www.zeit.de/news/2024-10/24/schwesig-will-ueber-sicherheitspaket-reden,https://www.zeit.de/news/2024-10/24/schwesig-will-ueber-sicherheitspaket-reden,0,www.zeit.de,Innere Sicherheit: Schwesig will über Sicherheitspaket reden,Hier finden Sie Informationen zu dem Thema „Innere Sicherheit“. Lesen Sie jetzt „Schwesig will über Sicherheitspaket reden“.,https://img.zeit.de/news/2024-10/24/schwesig-will-ueber-sicherheitspaket-reden-image-group/wide__1300x731,2024-10-24T04:00:36Z,,"Wenn die Ministerpräsidenten der Länder in Leipzig zu ihrer Jahreskonferenz zusammenkommen, will Mecklenburg-Vorpommerns Regierungschefin Manuela Schwesig das umstrittene Sicherheitspaket erneut zum … [+2021 chars]",,de,'Sicherheit'
https://www.focus.de/finanzen/news/wachstum-um-jeden-preis-weniger-rente-buergergeld-und-klimaschutz-wie-der-arbeitgeberpraesident-deutschland-reformieren-wuerde_id_260418268.html,https://www.focus.de/finanzen/news/wachstum-um-jeden-preis-weniger-rente-buergergeld-und-klimaschutz-wie-der-arbeitgeberpraesident-deutschland-reformieren-wuerde_id_260418268.html,0,www.focus.de,Arbeitgeberpräsident Rainer Dulger im Interview - Rentenpaket II ist das „das teuerste Sozialgesetz des Jahrhunderts“,"Renten kürzen, Bürgergeld kürzen, Mindestlohn nicht erhöhen, Klimaschutz lockern: Rainer Dulger, Chef der Bundesvereinigung der Deutschen Arbeitgeberverbände, hat der FAZ ein bemerkenswertes Interview gegeben. Das steckt hinter seinen Thesen.Von FOCUS-online-…",https://p6.focus.de/img/fotos/id_260415244/gettyimages-2180191663.jpg?im=Crop%3D%280%2C64%2C3421%2C1711%29%3BResize%3D%281200%2C627%29&impolicy=perceptual&quality=mediumHigh&hash=97cab43ad25ef2bfee8ba0240d3ee1e0e46b9aaf270bf8aa2173ce35ef677433,2024-10-24T04:52:37Z,,"Renten kürzen, Bürgergeld kürzen, Mindestlohn nicht erhöhen, Klimaschutz lockern: Rainer Dulger, Chef der Bundesvereinigung der Deutschen Arbeitgeberverbände, hat der FAZ ein bemerkenswertes Intervie… [+5462 chars]",,de,'Bürgergeld'
https://www.golem.de/sonstiges/zustimmung/auswahl.html?from=https://www.golem.de/news/anzeige-sicherheit-in-azure-umgebungen-effektiv-umsetzen-2410-189868.html&referer=https://t.co/a27169f6e4,https://www.golem.de/sonstiges/zustimmung/auswahl.html?from=https://www.golem.de/news/anzeige-sicherheit-in-azure-umgebungen-effektiv-umsetzen-2410-189868.html&referer=https://t.co/a27169f6e4,0,www.golem.de,Anzeige: Sicherheit in Azure-Umgebungen effektiv umsetzen,"Im AZ-500-Vorbereitungskurs der Golem Karrierewelt lernen angehende Microsoft Azure Security Engineers, wie sie Sicherheitsmaßnahmen in Azure-Umgebungen umsetzen und verwalten. (Golem Karrierewelt, Microsoft)",,2024-10-24T05:00:01Z,,"Besuchen Sie Golem.de wie gewohnt mit Werbung und Tracking,
 indem Sie der Nutzung aller Cookies zustimmen.
 Details zum Tracking finden Sie im Privacy Center.
Skript wurde nicht geladen. Informat… [+607 chars]",,de,'Sicherheit'
