index,url,valid,domain,title,description,image,published,archive,content,quote,language,keyword
https://www.welt.de/politik/ausland/video252838816/Krieg-in-der-Ukraine-Was-den-Friedensprozess-betrifft-sind-wir-noch-nicht-weitergekommen.html,https://www.welt.de/politik/ausland/video252838816/Krieg-in-der-Ukraine-Was-den-Friedensprozess-betrifft-sind-wir-noch-nicht-weitergekommen.html,0,www.welt.de,"„Was den Friedensprozess betrifft, sind wir noch nicht weitergekommen“","Während die Ukraine militärisch weiter unter Druck gerät, hat Präsident Selenskyj angedeutet, Moskau zu einer Friedenskonferenz im November einzuladen. „Der eigentliche Friedensprozess muss erst noch beginnen“, so Oberst a.D. Wolfgang Richter.",https://img.welt.de/img/politik/ausland/mobile252838896/0521351017-ci16x9-w1200/475154347-jpg.jpg,2024-08-04T09:02:24Z,,"Die WELT als ePaper: Die vollständige Ausgabe steht Ihnen bereits am Vorabend zur Verfügung so sind Sie immer hochaktuell informiert. Weitere Informationen: http://epaper.welt.de 
 Der Kurz-Link die… [+49 chars]",,de,'Ukraine'
https://www.telepolis.de/features/Zeitenwende-und-Hiroshima-9822288.html,https://www.telepolis.de/features/Zeitenwende-und-Hiroshima-9822288.html,0,www.telepolis.de,Zeitenwende und Hiroshima,Atombombe über Hiroshima markierte neue Ära. Menschen können alles Leben auslöschen. Was das mit Olaf Scholz’ Zeitenwende zu tun hat. Ein Gastbeitrag.,https://heise.cloudimg.io/bound/1200x1200/q85.png-lossy-85.webp-lossy-85.foil1/_www-heise-de_/imgs/18/4/6/4/4/8/6/6/b47c258e1aa754a4.jpg,2024-08-04T10:00:00Z,,"""Castle Bravo"", mit 15 Megatonnen Sprengkraft die bis heute stärkste thermonukleare Explosion des USA. Bild: US Federal Government
Atombombe über Hiroshima markierte neue Ära. Menschen können alles … [+10709 chars]",,de,'Gas'
https://www.sueddeutsche.de/politik/ukraine-krieg-newsblog-russland-tschassiv-jar-u-boot-versenkt-krim-rostow-am-don-lux.6iggGEC6CzSsH3yHrMFAWV,https://www.sueddeutsche.de/politik/ukraine-krieg-newsblog-russland-tschassiv-jar-u-boot-versenkt-krim-rostow-am-don-lux.6iggGEC6CzSsH3yHrMFAWV,0,www.sueddeutsche.de,Krieg in der Ukraine: Russische Armee rückt im strategisch wichtigen Tschassiw Jar vor,Einheiten der angreifenden Streitkräfte haben einen für die Ukraine zur Verteidigung wichtigen Kanal überquert. Die ukrainische Armee hat nach eigenen Angaben ein russisches U-Boot versenkt.,https://www.sueddeutsche.de/2024/08/04/8bd8134d-1961-4b56-8de1-4820d1f0b327.jpeg?q=60&fm=webp&width=1200&rect=0%2C0%2C3000%2C1688,2024-08-04T10:10:04Z,,Der ukrainische Präsident Wolodimir Selenskij hat in einem Interview über ein mögliches Ende des Krieges gesprochen und dabei andere Töne angeschlagen als sonst. Der Zeitung Le Monde und anderen fran… [+1517 chars],,de,'Ukraine'
https://www.bild.de/politik/ausland-und-internationales/trump-biden-putin-juli-2024-ein-monat-den-wir-nicht-vergessen-werden-66aceb2442fee92393b7c091,https://www.bild.de/politik/ausland-und-internationales/trump-biden-putin-juli-2024-ein-monat-den-wir-nicht-vergessen-werden-66aceb2442fee92393b7c091,0,www.bild.de,"So viele historische Momente - Ein Monat, den wir nicht vergessen werden!","Was für ein Monat! Trump-Attentat, Biden-Rückzug, Geisel-Deal, Ukraine-Krieg, Harris-Aufholjagd, … es war ein historischer Juli.","https://images.bild.de/66aceb2442fee92393b7c091/1fb7312796398cca86eff9befba84753,7249e0e8?w=1280",2024-08-04T10:10:12Z,,"Was für ein Monat!
Ältere, die in den vergangenen 30 Tagen die Welt-Schlagzeilen verfolgt haben, dürfen sich zurückversetzt fühlen in die Sechziger-, Siebziger- und Achtzigerjahre des letzten Jahrhu… [+4544 chars]",,de,'Ukraine'
https://www.zeit.de/news/2024-08/04/selenskyj-stellt-erste-f-16-der-ukraine-vor,https://www.zeit.de/news/2024-08/04/selenskyj-stellt-erste-f-16-der-ukraine-vor,0,www.zeit.de,F-16 in der Ukraine: Selenskyj stellt erste F-16 der Ukraine vor,Hier finden Sie Informationen zu dem Thema „F-16 in der Ukraine“. Lesen Sie jetzt „Selenskyj stellt erste F-16 der Ukraine vor“.,https://img.zeit.de/news/2024-08/04/selenskyj-stellt-erste-f-16-der-ukraine-vor-image-group/wide__1300x731,2024-08-04T14:12:16Z,,Der ukrainische Präsident Wolodymyr Selenskyj hat die ersten Kampfflugzeuge F-16 aus amerikanischer Produktion in den Diensten seiner Luftwaffe vorgestellt. Zum Tag der Luftwaffe zeigte sich Selensky… [+2154 chars],,de,'Ukraine'
https://www.zeit.de/news/2024-08/05/ukraine-feiert-ankunft-der-ersten-f-16-kampfjets,https://www.zeit.de/news/2024-08/05/ukraine-feiert-ankunft-der-ersten-f-16-kampfjets,0,www.zeit.de,Lage im Überblick: Ukraine feiert Ankunft der ersten F-16-Kampfjets,Hier finden Sie Informationen zu dem Thema „Lage im Überblick“. Lesen Sie jetzt „Ukraine feiert Ankunft der ersten F-16-Kampfjets“.,https://img.zeit.de/news/2024-08/05/ukraine-feiert-ankunft-der-ersten-f-16-kampfjets-image-group/wide__1300x731,2024-08-05T03:00:39Z,,Die Ukraine erhofft sich von der gefeierten Ankunft der ersten Kampfflugzeuge vom amerikanischen Typ F-16 einen entscheidenden Beitrag zur Verteidigung gegen die russischen Angreifer. «Dies ist ein w… [+6773 chars],,de,'Ukraine'
https://www.tagesschau.de/ausland/asien/nahost-gazakrieg-aktuelle-lage-100.html,https://www.tagesschau.de/ausland/asien/nahost-gazakrieg-aktuelle-lage-100.html,0,www.tagesschau.de,Kriegsangst in Nahost - was bekannt ist,"Seit den Tötungen von Anführern der Hamas und der Hisbollah wächst die Kriegsangst im Nahen Osten. Erwartet wird, dass der Iran und seine Verbündeten Israel angreifen. Was über die Lage in der Region bekannt ist.",https://images.tagesschau.de/image/a6370085-bba6-4cd1-b94e-cdb586e791da/AAABjtohxsY/AAABjwnlFvA/16x9-1280/golan-122.jpg,2024-08-05T09:33:50Z,,"Stand: 05.08.2024 11:33 Uhr
Seit den Tötungen von Anführern der Hamas und der Hisbollah wächst die Anspannung im Nahen Osten. Erwartet wird, dass der Iran und seine Verbündeten Israel angreifen. Was… [+12459 chars]",,de,'Katar'
https://www.gameswelt.de/half-life-3/news/endlich-confirmed-neue-leaks-heizen-die-community-auf-327137,https://www.gameswelt.de/half-life-3/news/endlich-confirmed-neue-leaks-heizen-die-community-auf-327137,0,www.gameswelt.de,Half-Life 3 - Endlich confirmed? Neue Leaks heizen die Community auf,Half-Wahrheiten.,https://img.gameswelt.de/public/images/201405/f4cd23cd6fa40e0c2528e2fd5b2a94cc.jpg,2024-08-05T12:34:00Z,,"Es ist der älteste Treppenwitz der Videospiel-Branche: Half-Life 3. Zahlreiche Mysterien und Gerüchte ranken sich um den nächsten Teil von Valves Shooter-Reihe, offiziell ist das Spiel aber noch nich… [+1695 chars]",,de,'heizen'
https://www.faz.net/aktuell/rhein-main/region-und-hessen/waermebilder-mit-drohne-wie-stark-gras-und-baeume-die-stadt-kuehlen-19896542.html,https://www.faz.net/aktuell/rhein-main/region-und-hessen/waermebilder-mit-drohne-wie-stark-gras-und-baeume-die-stadt-kuehlen-19896542.html,0,www.faz.net,Wärmebilder mit Drohne: Wie stark Gras und Bäume die Stadt kühlen,"Eine Drohne misst in Darmstadt mit einer Wärmebildkamera aus 90 Meter Höhe, wie stark sich Plätze der Innenstadt aufheizen – und was gegen die Sommerwärme hilft.",https://media0.faz.net/ppmedia/aktuell/580727251/1.9896536/facebook_teaser/aus-90-metern-hoehe-misst-die.jpg,2024-08-05T14:38:24Z,,"Dass ein Park mit Bäumen an einem Sommertag kühler ist als ein Platz ohne Schatten, wird niemanden wundern. Die Stadt Darmstadt will es genauer wissen und lässt untersuchen, wie groß der Unterschied … [+3559 chars]",,de,'heizen'
https://www.tagesspiegel.de/politik/wahlkampfen-vo-di-5-uhr-deutschlands-osten-und-der-krieg-12144251.html,https://www.tagesspiegel.de/politik/wahlkampfen-vo-di-5-uhr-deutschlands-osten-und-der-krieg-12144251.html,0,www.tagesspiegel.de,AfD und BSW heizen an: Die Anti-Ukraine-Stimmung im Osten wächst,Knapp vier Wochen vor den Ost-Wahlen wendet sich die Stimmung dort kräftig gegen die Ukraine. AfD und BSW wollten den Krieg schon immer einfrieren. Nun argumentieren auch CDU und SPD in diese Richtung.,https://www.tagesspiegel.de/images/12148241/alternates/BASE_16_9_W1400/1722867030000/proteste-am-rande-einer-wahlkampfveranstaltung-der-spd-zur-landtagswahl-in-sachsen-mit-boris-pistorius-und-petra-kopping.jpeg,2024-08-05T14:57:35Z,,"Wie ernst es dem Bündnis Sahra Wagenknecht (BSW) mit einem Kurswechsel im Umgang mit der von Russland angegriffenen Ukraine ist, lässt sich an ihren Wahlprogrammen ablesen. Frieden lautet die Übersch… [+320 chars]",,de,'heizen'
https://www.zeit.de/news/2024-08/05/moskau-adenauer-stiftung-ist-unerwuenschte-organisation,https://www.zeit.de/news/2024-08/05/moskau-adenauer-stiftung-ist-unerwuenschte-organisation,0,www.zeit.de,Krieg: Moskau: Adenauer-Stiftung ist unerwünschte Organisation,Hier finden Sie Informationen zu dem Thema „Krieg“. Lesen Sie jetzt „Moskau: Adenauer-Stiftung ist unerwünschte Organisation“.,https://img.zeit.de/news/2024-08/05/moskau-adenauer-stiftung-ist-unerwuenschte-organisation-image-group/wide__1300x731,2024-08-05T16:07:26Z,,Die CDU-nahe Konrad-Adenauer-Stiftung ist in Russland zur unerwünschten Organisation erklärt worden. Das kommt einem Verbot gleich. Die Stiftung habe sich zwar etwa die Unterstützung der europäischen… [+2343 chars],,de,'Krieg'
https://www.zeit.de/politik/ausland/2024-08/venezuela-opposition-aufforderung-befehlsverweigerung-nicolas-maduro,https://www.zeit.de/politik/ausland/2024-08/venezuela-opposition-aufforderung-befehlsverweigerung-nicolas-maduro,0,www.zeit.de,Venezuela: Opposition fordert Militär zu Befehlsverweigerung auf,"Venezuelas Regierung geht hart gegen Demonstranten vor. Die Opposition wirft Maduro Wahlbetrug vor und ruft Militär und Polizei auf, ihm die Unterstützung zu entziehen.",https://img.zeit.de/politik/ausland/2024-08/venezuela-polizei-traenengas-demonstranten-bild/wide__1300x731,2024-08-05T21:56:19Z,,"Nach der umstrittenen Präsidentenwahl in Venezuela und den darauffolgenden Protesten hat die Opposition die Sicherheitskräfte dazu aufgerufen, den Anweisungen der Regierung nicht mehr Folge zu leiste… [+3165 chars]",,de,'Unterstützung'
https://www.zeit.de/news/2024-08/06/sonderausstellung-wuerdigt-geschichte-des-bundesgrenzschutzes,https://www.zeit.de/news/2024-08/06/sonderausstellung-wuerdigt-geschichte-des-bundesgrenzschutzes,0,www.zeit.de,Kalter Krieg: Sonderausstellung würdigt Geschichte des Bundesgrenzschutzes,Hier finden Sie Informationen zu dem Thema „Kalter Krieg“. Lesen Sie jetzt „Sonderausstellung würdigt Geschichte des Bundesgrenzschutzes“.,https://img.zeit.de/news/2024-08/06/sonderausstellung-wuerdigt-geschichte-des-bundesgrenzschutzes-image-group/wide__1300x731,2024-08-06T02:00:42Z,,"Eiserner Vorhang und Kalter Krieg: Die Geschichte des Bundesgrenzschutzes ist eng mit der Teilung Deutschlands nach dem Zweiten Weltkrieg verbunden. Genauso eng damit verbunden ist auch Point Alpha, … [+6069 chars]",,de,'Krieg'
https://www.zeit.de/news/2024-08/06/pck-schwedt-geringer-ausgelastet-als-vor-ukraine-krise,https://www.zeit.de/news/2024-08/06/pck-schwedt-geringer-ausgelastet-als-vor-ukraine-krise,0,www.zeit.de,"Benzin, Diesel und Co: PCK Schwedt geringer ausgelastet als vor Ukraine-Krise","Hier finden Sie Informationen zu dem Thema „Benzin, Diesel und Co“. Lesen Sie jetzt „PCK Schwedt geringer ausgelastet als vor Ukraine-Krise“.",https://img.zeit.de/news/2024-08/06/pck-schwedt-geringer-ausgelastet-als-vor-ukraine-krise-image-group/wide__1300x731,2024-08-06T03:00:38Z,,Eineinhalb Jahre nach der Abkehr von russischem Öl ist die wichtige ostdeutsche Raffinerie PCK im brandenburgischen Schwedt deutlich schwächer ausgelastet als vorher. Lag die Auslastung der Anlage 20… [+2647 chars],,de,'Ukraine'
https://www.stern.de/gesellschaft/regional/berlin-brandenburg/benzin--diesel-und-co--pck-schwedt-geringer-ausgelastet-als-vor-ukraine-krise-34953118.html,https://www.stern.de/gesellschaft/regional/berlin-brandenburg/benzin--diesel-und-co--pck-schwedt-geringer-ausgelastet-als-vor-ukraine-krise-34953118.html,0,www.stern.de,"Benzin, Diesel und Co: PCK Schwedt geringer ausgelastet als vor Ukraine-Krise",Seit Anfang 2023 verzichtet Deutschland auf den Import von Pipeline-Öl aus Russland. Für die wichtige Raffinerie in Nordbrandenburg war das ein tiefer Einschnitt - und er wirkt nach.,https://image.stern.de/34953120/t/l8/v1/w1440/r1.7778/-/06--iirdkh3hjcv22axw800h600jpeg---881cb48afd05603d.jpg,2024-08-06T03:00:38Z,,"Seit Anfang 2023 verzichtet Deutschland auf den Import von Pipeline-Öl aus Russland. Für die wichtige Raffinerie in Nordbrandenburg war das ein tiefer Einschnitt - und er wirkt nach.
Eineinhalb Jahr… [+1872 chars]",,de,'Import'
https://www.zeit.de/news/2024-08/06/woidke-deutschland-sollte-im-ukraine-krieg-vermitteln,https://www.zeit.de/news/2024-08/06/woidke-deutschland-sollte-im-ukraine-krieg-vermitteln,0,www.zeit.de,Diplomatie: Woidke: Deutschland sollte im Ukraine-Krieg vermitteln,Hier finden Sie Informationen zu dem Thema „Diplomatie“. Lesen Sie jetzt „Woidke: Deutschland sollte im Ukraine-Krieg vermitteln“.,https://img.zeit.de/news/2024-08/06/woidke-deutschland-sollte-im-ukraine-krieg-vermitteln-image-group/wide__1300x731,2024-08-06T07:22:12Z,,"Brandenburgs Ministerpräsident Dietmar Woidke (SPD) fordert die Bundesregierung auf, sich stärker für Frieden zwischen Russland und der Ukraine einzusetzen. «Die Bundesregierung muss deutlich machen,… [+2258 chars]",,de,'Krieg'
https://www.nzz.ch/pro-global/krieg-im-sudan-hunger-als-waffe-und-friedensgespraeche-in-der-schweiz-ld.1842292,https://www.nzz.ch/pro-global/krieg-im-sudan-hunger-als-waffe-und-friedensgespraeche-in-der-schweiz-ld.1842292,0,www.nzz.ch,Hunger dient den Kriegsparteien im Sudan als Waffe: Jetzt herrscht dort die wohl grösste Hungersnot seit Jahrzehnten,"Millionen Menschen könnten im Sudan in den nächsten Monaten verhungern. Die Hoffnungen, das zu verhindern, liegen auf Gesprächen in der Schweiz. Doch die Menschen brauchen mehr.","https://img.nzz.ch/2024/08/05/64bbb0da-d0b9-4eee-a2d5-8adbb5fbef46.jpeg?width=1200&height=675&fit=bounds&quality=75&auto=webp&crop=3500,1969,x0,y182&wmark=nzz",2024-08-06T09:00:00Z,,"Helfer in der Stadt Omdurman verteilen Essen. Laut der Uno haben mehr als 25 Millionen Menschen im Sudan nicht mehr genug zu essen.
Vergangene Woche war es so weit. Internationale Experten veröffent… [+8255 chars]",,de,'Versorgung'
https://www.zeit.de/news/2024-08/06/berliner-pflegeeltern-brauchen-mehr-unterstuetzung,https://www.zeit.de/news/2024-08/06/berliner-pflegeeltern-brauchen-mehr-unterstuetzung,0,www.zeit.de,Pflegekinder: Berliner Pflegeeltern: Brauchen mehr Unterstützung,Hier finden Sie Informationen zu dem Thema „Pflegekinder“. Lesen Sie jetzt „Berliner Pflegeeltern: Brauchen mehr Unterstützung“.,https://img.zeit.de/news/2024-08/06/berliner-pflegeeltern-brauchen-mehr-unterstuetzung-image-group/wide__1300x731,2024-08-06T09:26:25Z,,"Pflegeeltern in Berlin fordern mehr Unterstützung durch Politik und Gesellschaft. «Pflegeeltern leisten einen wertvollen Beitrag, indem sie Kindern in schwierigen Lebenssituationen ein fürsorgliches … [+3098 chars]",,de,'Unterstützung'
https://www.morgenpost.de/berlin/article406958221/warum-umweltschuetzer-gegen-das-heizen-mit-wasserstoff-sind.html,https://www.morgenpost.de/berlin/article406958221/warum-umweltschuetzer-gegen-das-heizen-mit-wasserstoff-sind.html,0,www.morgenpost.de,Warum Umweltschützer gegen das Heizen mit Wasserstoff sind,Energiemanager halten auch das grün erzeugte Gas für einen Schlüssel der sauberen Fernwärme. BUND-Experten widersprechen.,https://img.sparknews.funkemedien.de/405707769/405707769_1715784728_v16_9_1600.jpeg,2024-08-06T10:30:00Z,,Berlin. Energiemanager halten auch das grün erzeugte Gas für einen Schlüssel der sauberen Fernwärme. BUND-Experten widersprechen.,,de,'Gas'
https://www.tagesspiegel.de/wissen/lohnenswert-fur-landwirte-und-natur-baume-auf-dem-acker-bremsen-den-klimawandel-12127646.html,https://www.tagesspiegel.de/wissen/lohnenswert-fur-landwirte-und-natur-baume-auf-dem-acker-bremsen-den-klimawandel-12127646.html,0,www.tagesspiegel.de,Lohnenswert für Landwirte und Natur: Bäume auf dem Acker bremsen den Klimawandel,In Deutschland galt lange: Aufs Feld gehört kein Baum gepflanzt! Ein Irrweg. Denn mit schnell wachsenden Hölzern lässt sich kohlenstoffneutral heizen und sie verbessern die Böden.,https://www.tagesspiegel.de/images/12151940/alternates/BASE_16_9_W1400/1722938316000/kurzumtriebsplantage-ralf-pecenka-entwickelt-am-atb-potsdam-ideen-wie-schnell-nachwachsende-holzer-auf-dem-acker-fur-nachhaltige-heizwarme-sorgen-konnten-bild-atb.jpeg,2024-08-06T11:48:47Z,,"Deutschland trennt gern: Papier- von Plastikmüll, Blumenbeete von Feinrasen, Rechnungen im Restaurant. Die Dinge sauber auseinanderzuhalten, kann hilfreich sein beim Sortieren und Verwalten und Bewer… [+83 chars]",,de,'heizen'
https://www.diepresse.com/18738937/unguenstige-witterung-drueckt-heuer-auf-getreideernte,https://www.diepresse.com/18738937/unguenstige-witterung-drueckt-heuer-auf-getreideernte,0,www.diepresse.com,Ungünstige Witterung drückt heuer auf Getreideernte,"Die heimische Gesamtproduktion dürfte AMA-Angaben zufolgen heuer um vier Prozent auf fünf Millionen Tonnen sinken. Ohne Mais ist die Ernte um fast zehn Prozent rückläufig und erreicht drei Millionen Tonnen. Die Versorgung ist aber „komfortabel gesichert“, sag…",https://img.diepresse.com/public/incoming/yrgpw1-THEMENBILD-LANDWIRTSCHAFT-ERNTE-GETREIDEERNTE/alternates/DPR_SOCIAL_NACHRICHTEN/%20THEMENBILD%20%20LANDWIRTSCHAFT%20%20ERNTE%20%20GETREIDEERNTE,2024-08-06T11:54:39Z,,Die heimische Gesamtproduktion dürfte AMA-Angaben zufolgen heuer um vier Prozent auf fünf Millionen Tonnen sinken. Ohne Mais ist die Ernte um fast zehn Prozent rückläufig und erreicht drei Millionen … [+5283 chars],,de,'Versorgung'
https://www.diepresse.com/18738937/landwirte-ernten-weniger-getreide,https://www.diepresse.com/18738937/landwirte-ernten-weniger-getreide,0,www.diepresse.com,Landwirte ernten weniger Getreide,"Die ungünstige Witterung ließ die Getreideernte heuer um zehn Prozent einbrechen. 
Die Versorgung sei aber gesichert, und auch die Märkte könne man „komfortabel“ bedienen.",https://img.diepresse.com/public/incoming/q008a6-THEMENBILD-LANDWIRTSCHAFT-ERNTE-GETREIDEERNTE/alternates/DPR_SOCIAL_NACHRICHTEN/%20THEMENBILD%20%20LANDWIRTSCHAFT%20%20ERNTE%20%20GETREIDEERNTE,2024-08-06T11:54:39Z,,"Die ungünstige Witterung ließ die Getreideernte heuer um zehn Prozent einbrechen. Die Versorgung sei aber gesichert, und auch die Märkte könne man komfortabel bedienen.
So früh wie in diesem Sommer … [+4375 chars]",,de,'Versorgung'
https://www.telepolis.de/features/Ukraine-Krieg-Russischer-Vormarsch-ukrainische-Verteidigung-unter-Druck-9825122.html,https://www.telepolis.de/features/Ukraine-Krieg-Russischer-Vormarsch-ukrainische-Verteidigung-unter-Druck-9825122.html,0,www.telepolis.de,"Ukraine-Krieg: Russischer Vormarsch, ukrainische Verteidigung unter Druck","Russische Streitkräfte erzielen strategische Siege, während die Ukraine um ihre Verteidigungsstellungen kämpft. Kommt eine neue ukrainische Offensive? Einschätzung.",https://heise.cloudimg.io/bound/1200x1200/q85.png-lossy-85.webp-lossy-85.foil1/_www-heise-de_/imgs/18/4/6/4/6/3/5/7/Master_Lange-24dd0a1ef906cf5c.jpeg,2024-08-06T12:00:00Z,,"Artillerie der ukrainischen Streitkräfte. Foto: Drop of Light / shutterstock.com
Russische Streitkräfte erzielen strategische Siege, während die Ukraine um ihre Verteidigungsstellungen kämpft. Kommt… [+13527 chars]",,de,'Krieg'
https://www.bild.de/sport/olympia/olympia-2024-briten-schwimmer-berichtet-von-wuermern-im-essen-66b223909f81451d63e0e22f,https://www.bild.de/sport/olympia/olympia-2024-briten-schwimmer-berichtet-von-wuermern-im-essen-66b223909f81451d63e0e22f,0,www.bild.de,Im Olympischen Dorf - Briten-Schwimmer findet Würmer im Essen,Silbermedaillen-Gewinner Adam Peaty ist nicht glücklich über die Versorgung der Athleten im Olympischen Dorf. Seine Kritik macht er nun öffentlich.,"https://images.bild.de/66b223909f81451d63e0e22f/023dbd8b89bfb28ef2db38d95967a881,c1785a1a?w=1280",2024-08-06T14:09:40Z,,"Die Athleten und das Essen im 
Olympischen Dorf in Paris es wird zur unendlichen Geschichte.
Neuestes Kapitel: eine weitere Beschwerde der Briten-Sportler.
Schwimmer Adam Peaty (29) beklagt sich i… [+1830 chars]",,de,'Versorgung'
https://www.nzz.ch/meinung/soziale-netzwerken-heizen-proteste-in-england-an-das-ist-stossend-aber-leichtglaeubige-nutzer-sind-teil-des-problems-ld.1842532,https://www.nzz.ch/meinung/soziale-netzwerken-heizen-proteste-in-england-an-das-ist-stossend-aber-leichtglaeubige-nutzer-sind-teil-des-problems-ld.1842532,0,www.nzz.ch,KOMMENTAR - Soziale Netzwerke heizen die Proteste in England an. Das ist stossend. Aber leichtgläubige Nutzer sind Teil des Problems,"Was nach der Tötung der drei Mädchen in Southport im Internet geschah, ist ein Lehrstück über die Auswirkung von Fake News in Zeiten eines Informationsvakuums. Daraus lernen müssen sowohl Firmen wie auch Nutzer.","https://img.nzz.ch/2024/08/06/8bacf26d-dd8f-4c83-a84f-c5992def6848.jpeg?width=1200&height=675&fit=bounds&quality=75&auto=webp&crop=5808,3267,x0,y0&wmark=nzz",2024-08-06T14:46:00Z,,"Menschen gedenken der drei getöteten Mädchen in Southport, Grossbritannien, 5. August 2024.
Ein grauenhafter Gewaltakt versetzte Grossbritannien vergangene Woche in Schockstarre. Warum sticht ein Ju… [+4794 chars]",,de,'heizen'
https://www.freitag.de/autoren/michael-lueders/nahost-westliche-entscheider-nehmen-eine-katastrophe-achselzuckend-zur-kenntnis,https://www.freitag.de/autoren/michael-lueders/nahost-westliche-entscheider-nehmen-eine-katastrophe-achselzuckend-zur-kenntnis,0,www.freitag.de,Meinung | Iran/Israel: In Deutschland macht man sich keinen Begriff von der Brisanz der Lage,"Russland, China und andere Staaten im Nahen Osten werden nicht tatenlos zusehen, wenn mit dem Iran ein Partner bzw. Energielieferant angegriffen wird. Und doch wird in Deutschland darüber schwadroniert, ob man militärisch eingreifen müsse Jeden Tag konnte der…",https://www.freitag.de/autoren/michael-lueders/nahost-westliche-entscheider-nehmen-eine-katastrophe-achselzuckend-zur-kenntnis/@@images/social_image,2024-08-06T15:26:00Z,,"Jeden Tag konnte der Nahe Osten explodieren. Auslöser einer hochbrisanten Situation waren die gezielte Tötung des ranghohen Hisbollah-Kommandeurs Fuad Schukr am 30. Juli in Beirut, wenige Stunden spä… [+8472 chars]",,de,'Versorgung'
https://www.tagesspiegel.de/berlin/eine-frage-der-gerechtigkeit-berlins-sozialsenatorin-will-ausgaben-fur-fluchtlinge-uber-notkredite-finanzieren-12154958.html,https://www.tagesspiegel.de/berlin/eine-frage-der-gerechtigkeit-berlins-sozialsenatorin-will-ausgaben-fur-fluchtlinge-uber-notkredite-finanzieren-12154958.html,0,www.tagesspiegel.de,„Eine Frage der Gerechtigkeit“: Berlins Sozialsenatorin will Ausgaben für Flüchtlinge über Notkredite finanzieren,Die Finanzverwaltung prüft die Nutzung von Notkrediten für die Ausgaben zur Versorgung geflüchteter Menschen. Senatorin Cansel Kiziltepe (SPD) würde das begrüßen.,https://www.tagesspiegel.de/images/12155489/alternates/BASE_16_9_W1400/1722958102000/berlins-sozialsenatorin-cansel-kiziltepe.jpeg,2024-08-06T15:51:18Z,,Sozialsenatorin Cansel Kiziltepe (SPD) will die Ausgaben zur Versorgung geflüchteter Menschen über Notkredite finanzieren. Durch die Erklärung einer Notlage und die Möglichkeit einer Kreditfinanzieru… [+265 chars],,de,'Versorgung'
https://www.tagesspiegel.de/internationales/ukraine-invasion-tag-895-f-16-kampfjets-jetzt-offiziell-im-einsatz--doch-es-sollen-noch-hunderte-fehlen-12156002.html,https://www.tagesspiegel.de/internationales/ukraine-invasion-tag-895-f-16-kampfjets-jetzt-offiziell-im-einsatz--doch-es-sollen-noch-hunderte-fehlen-12156002.html,0,www.tagesspiegel.de,"Ukraine-Invasion, Tag 895: F-16-Kampfjets jetzt offiziell im Einsatz – doch es sollen noch hunderte fehlen","Russland will ukrainische Soldaten an der Grenze gestoppt haben, Ukraine stellt Russland mit „Baba Yaga“-Drohnen vor Probleme. Der Überblick am Abend.",https://www.tagesspiegel.de/images/12156047/alternates/BASE_16_9_W1400/1722961082000/ukraine-krieg-selenskyj-stellt-erste-f-16-der-ukraine-vor.jpeg,2024-08-06T16:19:46Z,,"Zwei Tage nach der Präsentation der ersten F-16-Kampfjets hat das ukrainische Militär auf X das erste offizielle Foto veröffentlicht. Das Bild zeigt das Flugzeug bei einem Manöver, überschrieben ist … [+5312 chars]",,de,'Ukraine'
https://www.tagesspiegel.de/berlin/kein-winterproblem-obdachlosigkeit-laut-berliner-stadtmission-ganzjahrige-herausforderung-12156695.html,https://www.tagesspiegel.de/berlin/kein-winterproblem-obdachlosigkeit-laut-berliner-stadtmission-ganzjahrige-herausforderung-12156695.html,0,www.tagesspiegel.de,„Kein Winterproblem“: Obdachlosigkeit laut Berliner Stadtmission ganzjährige Herausforderung,"Wenn die Temperaturen Richtung 30 Grad gehen, brauchen Menschen auf der Straße besonderen Schutz. Verschiedene Initiativen bieten Obdachlosen nicht nur Schutz vor der Mittagshitze.",https://www.tagesspiegel.de/images/12156689/alternates/BASE_16_9_W1400/1722996126000/obdachlosigkeit-in-berlin.jpeg,2024-08-07T02:02:06Z,,"Hüte, Wasser, Sonnencreme auch an heißen Tagen sind viele obdachlose Menschen bedürftig. Obdachlosigkeit ist kein Winterproblem, sagt Barbara Breuer, Pressesprecherin der Berliner Stadtmission, die d… [+1447 chars]",,de,'Winter'
