index,url,valid,domain,title,description,image,published,archive,content,quote,language,keyword
https://www.focus.de/politik/deutschland/die-rede-des-kanzlers-im-video-wir-wollen-deutschland-wieder-flott-kriegen_ebb353fb-08db-4cdc-9559-1ce069e173bc.html,https://www.focus.de/politik/deutschland/die-rede-des-kanzlers-im-video-wir-wollen-deutschland-wieder-flott-kriegen_ebb353fb-08db-4cdc-9559-1ce069e173bc.html,0,www.focus.de,Die Rede des Kanzlers im Video: „Wir wollen Deutschland wieder flott kriegen”,Bundeskanzler Friedrich Merz hat die Ergebnisse des Koalitionsausschusses vorgestellt. Geplant sind massive Entlastungen und ein radikaler Bürokratieabbau.,"https://quadro.burda-forward.de/ctf/8b4483bd-7140-43df-b420-6dc90b141ed4.c9c9e6e6-90ce-45dc-9306-338bc5d2e5dc.jpg?im=RegionOfInterestCrop=(1200,630),regionOfInterest=(1742,854)&hash=dcb7f36d116734b49faeae0c0b9209f9213517ebaf33984ba49ee75d7d3ed4e8",2026-07-02T08:57:00Z,,"Die Regierungskoalition aus CDU, CSU und SPD hat sich auf ein umfassendes Reformpaket geeinigt. Bundeskanzler Friedrich Merz betonte am Donnerstagmorgen vor der Presse den entschlossenen Erneuerungsw… [+2372 chars]",,de,'Friedrich Merz'
https://www.bild.de/unterhaltung/tv-fernsehformate/heute-maybrit-illner-spezial-dieser-gast-erhaelt-eine-sonderausgabe-6a460b5cae0977c5aff18c94,https://www.bild.de/unterhaltung/tv-fernsehformate/heute-maybrit-illner-spezial-dieser-gast-erhaelt-eine-sonderausgabe-6a460b5cae0977c5aff18c94,0,www.bild.de,Gäste und Themen am 2.7.2026 - Wer ist zu Gast bei „Maybrit Illner spezial“?,"Jede Woche lädt Maybrit Illner Gäste ein, um über politische, wirtschaftliche oder gesellschaftliche Themen zu diskutieren. Alle Infos zur heutigen Folge.","https://images.bild.de/6a460b5cae0977c5aff18c94/f6e63f034b2c32ce058d922f0c325bba,70198b92?w=1280",2026-07-02T09:00:06Z,,"TTS-Player überspringenArtikel weiterlesenSeit 1999 ist diese Show ein fester Bestandteil des ZDFProgramms. Maybrit Illner (61) diskutiert jeden Donnerstagabend im ZDF mit Gästen aus Politik, Wirtsch… [+1483 chars]",,de,'Friedrich Merz'
https://www.dw.com/de/deutschland-bundesanwaltschaft-nord-stream-ukraine-krieg-russland-serhii-k-daenemark-polen-italien/a-77798118,https://www.dw.com/de/deutschland-bundesanwaltschaft-nord-stream-ukraine-krieg-russland-serhii-k-daenemark-polen-italien/a-77798118,0,www.dw.com,Nord-Stream-Anschläge: Bundesanwaltschaft erhebt Anklage,Im September 2022 zerfetzten Sprengsätze die Nord-Stream-Pipelines am Grund der Ostsee. Einer der mutmaßlichen Täter soll nun in Deutschland vor Gericht kommen. Die Anschläge auf die Nord-Stream-Gasleitungen in der Ostsee sorgten im Jahr 2022 weltweit für Sch…,https://static.dw.com/image/77798401_6.jpg,2026-07-02T09:50:00Z,,Die Anschläge auf die Nord-Stream-Gasleitungen in der Ostsee sorgten im Jahr 2022 weltweit für Schlagzeilen. Eindrücklich waren die Luftaufnahmen des in der Nähe der dänischen Insel Bornholm vom Meer… [+4632 chars],,de,'Pipeline'
https://www.bild.de/politik/ausland-und-internationales/zwei-millionen-opfer-im-ukraine-krieg-putins-armee-unter-druck-6a4613b8ae0977c5aff1983f,https://www.bild.de/politik/ausland-und-internationales/zwei-millionen-opfer-im-ukraine-krieg-putins-armee-unter-druck-6a4613b8ae0977c5aff1983f,0,www.bild.de,"Schock-Studie zum Ukraine-Krieg - Putin verliert 1,4 Millionen seiner Soldaten",Eine Studie der US-Denkfabrik CSIS zeigt: Die militärischen Verluste von Russland und der Ukraine sollen die Marke von zwei Millionen überschritten haben.,"https://images.bild.de/6a4613b8ae0977c5aff1983f/b19a2cbf8825aefc235eb0af24224ae4,944b5ec1?w=1280",2026-07-02T09:57:00Z,,"TTS-Player überspringenArtikel weiterlesenKiew/Moskau Mehr als zwei Millionen russische und ukrainische Soldaten wurden seit Beginn der russischen Großinvasion im Februar 2022 getötet, verwundet oder… [+2219 chars]",,de,'Ukraine'
https://www.focus.de/politik/ausland/fischer-ueber-russland-putin-gibt-indirekt-zu-das-ganze-laeuft-nicht-nach-plan_343fa348-7b1a-4ff9-8fee-d297d8c87b02.html,https://www.focus.de/politik/ausland/fischer-ueber-russland-putin-gibt-indirekt-zu-das-ganze-laeuft-nicht-nach-plan_343fa348-7b1a-4ff9-8fee-d297d8c87b02.html,0,www.focus.de,Fischer über Russland - „Putin gibt indirekt zu: Das Ganze läuft nicht nach Plan”,"Putin hat den Westen zum Hauptfeind erklärt. Fischer erklärt: Wer das Feindbild ausweitet, gibt indirekt zu, dass die ursprünglichen Kriegsziele nicht erreichbar sind.","https://quadro.burda-forward.de/ctf/c6dcce84-739e-46a9-b4de-4e57855f5fff.91c95b92-f229-4f7f-b8ee-0a7896993cad.jpg?im=RegionOfInterestCrop=(1200,630),regionOfInterest=(1733,1050)&hash=fc3c1eabe4419503d29c3e82552a97d688e12ba2d6221b5448d4cf6b9633986c",2026-07-02T10:08:00Z,,"Putin habe nicht mehr nur die Ukraine als Gegner beschrieben, sondern den gesamten Westen ins Visier genommen, sagt Fischer gegenüber FOCUS online. Das sei kein rhetorisches Zufallsprodukt. Das Narra… [+2627 chars]",,de,'Krieg'
https://www.faz.net/aktuell/politik/ukraine/ukraine-liveticker-zahl-der-todesopfer-in-kiew-steigt-weiter-faz-110683325.html,https://www.faz.net/aktuell/politik/ukraine/ukraine-liveticker-zahl-der-todesopfer-in-kiew-steigt-weiter-faz-110683325.html,0,www.faz.net,Liveblog Ukrainekrieg: Zahl der Todesopfer in Kiew steigt weiter,Klitschko: Schwerster russischer Angriff seit Kriegsbeginn +++ Rettungshelfer suchen weiter nach Opfern unter Trümmern +++ Mehr als zwei Millionen Soldaten Opfer im Krieg  +++ alle Neuigkeiten im Liveblog,https://media0.faz.net/image/w1200h627/157a25490a96/w6144h3210x0y456o/202607/43601.0.2288122262/anwohner-betrachten-die-stelle.webp,2026-07-02T10:09:36Z,,Nach heftigen russischen Angriffen in der Nacht steigen die Opferzahlen in der Ukraine am Morgen weiter. Nach offiziellen Angaben von Dienstagmittag wurden allein in Kiew mindestens 18 Zivilisten get… [+1264 chars],,de,'Ukraine'
https://www.welt.de/politik/ausland/plus6a451068f9d50e353198882f/ukraine-krieg-dann-ist-alles-moeglich-das-kurze-zeitfenster-das-die-ukraine-jetzt-nutzen-will.html,https://www.welt.de/politik/ausland/plus6a451068f9d50e353198882f/ukraine-krieg-dann-ist-alles-moeglich-das-kurze-zeitfenster-das-die-ukraine-jetzt-nutzen-will.html,0,www.welt.de,"„Dann ist alles möglich“ – Das kurze Zeitfenster, das die Ukraine jetzt nutzen will","Die Ukraine sieht die einmalige Chance, den Krieg zu ihren Gunsten zu drehen. Verteidigungsminister Mychajlo Fedorow wirbt dafür bei den Verbündeten um die nächste Stufe der Unterstützung – und erklärt, warum es jetzt auf jeden Tag ankommt.",https://images.welt.de/6a451068f9d50e353198882f/630401059c402706b15e25309dc3bb91/ci16x9-w1200/1781769417677-afp-b7gy7zq-jpg,2026-07-02T10:12:16Z,,"Die Ukraine sieht die einmalige Chance, den Krieg zu ihren Gunsten zu drehen. Verteidigungsminister Mychajlo Fedorow wirbt dafür bei den Verbündeten um die nächste Stufe der Unterstützung und erklärt… [+38 chars]",,de,'Unterstützung'
https://www.teltarif.de/buergergeld-grundsicherung-staat-sozialstaat/news/104471.html,https://www.teltarif.de/buergergeld-grundsicherung-staat-sozialstaat/news/104471.html,0,www.teltarif.de,Bürgergeld wird zur Grundsicherung: Das ändert sich jetzt,"Ab Juli gilt die neue Grundsicherung: Das Bürgergeld wird umgebaut, Regeln und Sanktionen werden deutlich verschärft.",https://www.teltarif.de/img/arch/2026/kw27/buergergeld-grundsicherung-staat-sozialstaat-1og.jpg,2026-07-02T10:30:00Z,,"Seit 1. Juli 2026 wird das Bürgergeld schritt­weise durch die neue Grund­siche­rung für Arbeit­suchende ersetzt. Mit der Reform will die Bundes­regie­rung den Vermitt­lungs­vorrang stärken, Mitwir­ku… [+3944 chars]",,de,'Bürgergeld'
https://www.sueddeutsche.de/politik/kiew-luftangriffe-raketen-drohnen-li.3509148,https://www.sueddeutsche.de/politik/kiew-luftangriffe-raketen-drohnen-li.3509148,0,www.sueddeutsche.de,Ukraine: Außergewöhnlich heftige russische Luftangriffe auf Kiew,Russland tötet bei einem der massivsten Luftschläge seit Langem mindestens dreizehn Menschen. In der ukrainischen Hauptstadt stehen ganze Häuser und ein Hotel in Flammen.,https://www.sueddeutsche.de/2026/07/02/821c98e7-213e-464f-be64-03357b581544.jpg?q=60&fm=webp&width=1200&rect=193%2C45%2C1653%2C930,2026-07-02T11:29:53Z,,74 Raketen und 496 Drohnen hat die russische Armee bei ihrem Großangriff in der Nacht nach Angaben der Ukraine eingesetzt. Es war einer der schwersten seit längerer Zeit. Die Luftabwehr habe davon zw… [+1940 chars],,de,'Krieg'
https://www.nzz.ch/international/die-mehrheit-will-dass-der-albtraum-zu-ende-geht-eine-oppositionspolitikerin-wirbt-um-verstaendnis-fuer-die-russische-gesellschaft-ld.10006093,https://www.nzz.ch/international/die-mehrheit-will-dass-der-albtraum-zu-ende-geht-eine-oppositionspolitikerin-wirbt-um-verstaendnis-fuer-die-russische-gesellschaft-ld.10006093,0,www.nzz.ch,"«Die Mehrheit will, dass der Albtraum zu Ende geht»: Eine Oppositionspolitikerin wirbt um Verständnis für die russische Gesellschaft","In Russland wird der Unmut über die Folgen des Ukraine-Kriegs grösser. Offene Kritik daran wagen aber nur wenige. Die Politikerin Julia Galjamina gehört zu ihnen. Sie erhebt aber auch Vorwürfe gegen die Exil-Opposition, der sie Radikalität und Realitätsferne …","https://img-msp-prod.nzz.ch/2026/06/25/90fd2f0c-2bab-4a5e-82ea-48165b7313e3.jpg?width=1200&height=674&fit=bounds&quality=75&auto=webp&crop=6264,3523,x0,y134&wmark=nzz",2026-07-02T11:36:14Z,,In Russland wird der Unmut über die Folgen des Ukraine-Kriegs grösser. Offene Kritik daran wagen aber nur wenige. Die Politikerin Julia Galjamina gehört zu ihnen. Sie erhebt aber auch Vorwürfe gegen … [+13308 chars],,de,'Krieg'
https://www.morgenpost.de/politik/article412459736/nach-trump-attacke-pistorius-sieht-keine-ehekrise-mit-den-usa.html,https://www.morgenpost.de/politik/article412459736/nach-trump-attacke-pistorius-sieht-keine-ehekrise-mit-den-usa.html,0,www.morgenpost.de,Nach Trump-Attacke: Pistorius sieht „keine Ehekrise“ mit den USA,Donald Trump vermisst Unterstützung aus Deutschland im Iran-Krieg. Verteidigungsminister Boris Pistorius reagiert gelassen.,https://img.sparknews.funkemedien.de/412126039/412126039_1780038729_v16_9_1600.jpeg,2026-07-02T11:41:45Z,,"Nach scharfen Tönen aus Washington gibt sich Verteidigungsminister Boris Pistorius (SPD) demonstrativ gelassen. Donald Trumps Vorwurf, Deutschland habe den USA im Zusammenhang mit dem Iran-Krieg ein … [+1583 chars]",,de,'Krieg'
https://www.sueddeutsche.de/politik/ukraine-krieg-russland-kiew-angriffe-auswaertiges-amt-li.3500126,https://www.sueddeutsche.de/politik/ukraine-krieg-russland-kiew-angriffe-auswaertiges-amt-li.3500126,0,www.sueddeutsche.de,Krieg in der Ukraine: Auswärtiges Amt verurteilt russischen Angriff auf Kiew,Die Bilder aus der Nacht seien „erschütternd“. Die Angriffswelle trifft erneut zahlreiche Wohnhäuser und andere zivile Objekte. Medien berichten von einer der heftigsten Angriffswellen seit Kriegsbeginn.,https://www.sueddeutsche.de/2026/07/02/0f5bcb5c-2e3b-470d-a919-b257bba426ab.jpg?q=60&fm=webp&width=1200&rect=0%2C209%2C4000%2C2250,2026-07-02T11:47:28Z,,"Das Auswärtige Amt hat seine Reisewarnung für Russland angesichts der verstärkten ukrainischen Drohnenangriffe massiv ausgeweitet. Gewarnt wird jetzt vor Reisen im ganzen Land, bisher galt dies nur f… [+1898 chars]",,de,'Krieg'
https://www.morgenpost.de/bezirke/neukoelln/article410484747/lost-place-weltkriegsbunker-ortolanweg-berlin-neukoelln.html,https://www.morgenpost.de/bezirke/neukoelln/article410484747/lost-place-weltkriegsbunker-ortolanweg-berlin-neukoelln.html,0,www.morgenpost.de,Bunker aus der NS-Zeit: Wie das unheimliche Kriegserbe Buckow prägte,Fünf Jahrzehnte lang dämmerte ein gruseliges Relikt aus der Nazizeit am Ortolanweg vor sich hin – bis es zum Problem wurde. Alle Infos.,https://img.sparknews.funkemedien.de/407867778/407867778_1733831436_v16_9_1600.jpeg,2026-07-02T11:50:54Z,,"Meterdicke Stahlbetonwände, gefilterte Luft und kein Tageslicht: Seit Beginn des Krieges in der Ukraine sind sie wieder zum Thema geworden, Zivilschutzbauten, Schutzräume oder einfach Bunker genannt.… [+14034 chars]",,de,'Krieg'
https://www.zeit.de/politik/ausland/2026-07/russland-luftangriff-kyjiw-ukraine-raketen-drohnen-gxe,https://www.zeit.de/politik/ausland/2026-07/russland-luftangriff-kyjiw-ukraine-raketen-drohnen-gxe,0,www.zeit.de,Russischer Großangriff auf Kyjiw: Mindestens 18 Tote nach großflächigem russischen Angriff auf Kyjiw,Nach russischen Angriffen auf Kyjiw in der Nacht auf Donnerstag forderte die Ukraine weitere Luftverteidigung. Die EU kündigte neue Sanktionen gegen Moskau an.,https://img.zeit.de/politik/ausland/2026-07/russland-luftangriff-kyjiw-ukraine-raketen-drohnen-foto-1/wide__1300x731,2026-07-02T11:57:22Z,,Russland hat Kyjiw in der Nacht zum Donnerstag elf Stunden lang mit Raketen und Drohnen angegriffen. Bei den Attacken sind laut Kyjiws Bürgermeister Vitali Klitschko mindestens 18 Menschen getötet un… [+4428 chars],,de,'Ukraine'
https://www.welt.de/sicherheitsgipfel/video6a464c7693e0921d609d38f4/welt-sicherheitsgipfel-airbus-defence-space-kooperiert-mit-bravo1-der-ukraine.html,https://www.welt.de/sicherheitsgipfel/video6a464c7693e0921d609d38f4/welt-sicherheitsgipfel-airbus-defence-space-kooperiert-mit-bravo1-der-ukraine.html,0,www.welt.de,Airbus Defence & Space kooperiert mit Bravo1 der Ukraine,"Airbus Defence & Space, kooperiert als erstes westliches Unternehmen mit der ukrainischen Initiative Brave1. Ziel ist die gemeinsame Entwicklung innovativer Drohnen- und KI-Technologien. „Wir müssen jetzt Gas geben“, sagt Dr. Michael Schöllhorn, CEO, bei WELT…",https://images.welt.de/6a464c7693e0921d609d38f4/213b12c2cc757cea54453335bf9ae9da-master/ci16x9-w1200/michael-schoellhorn-airbus-welt-sicherheitsgipfel-jpg,2026-07-02T12:49:29Z,,"Airbus Defence &amp; Space, kooperiert als erstes westliches Unternehmen mit der ukrainischen Initiative Brave1. Ziel ist die gemeinsame Entwicklung innovativer Drohnen- und KI-Technologien. Wir müss… [+125 chars]",,de,'Gas'
https://www.zeit.de/politik/ausland/2026-07/paketbomben-monaco-wadym-jermolajew-oligarch,https://www.zeit.de/politik/ausland/2026-07/paketbomben-monaco-wadym-jermolajew-oligarch,0,www.zeit.de,Paketbombenanschlag in Monaco: Ermittler identifizieren verdächtige Person nach Explosion in Monaco,Eine Paketbombe verletzte in Monaco drei Menschen – darunter offenbar einen Geschäftsmann aus der Ukraine. Nun wird eine verdächtige Person zur Fahndung ausgeschrieben.,https://img.zeit.de/politik/ausland/2026-07/paketbomben-monaco-wadym-jermolajew-oligarch-foto-1/wide__1300x731,2026-07-02T22:52:42Z,,Die Staatsanwaltschaft von Monaco hat nach der Explosion einer Paketbombe eine verdächtige Person identifiziert. Bei dem Vorfall war ein aus der Ukraine stammender Geschäftsmann schwer verletzt worde… [+1700 chars],,de,'Ukraine'
https://www.zeit.de/politik/ausland/2026-07/angriffe-russland-benzinkrise-ukraine-5vor8,https://www.zeit.de/politik/ausland/2026-07/angriffe-russland-benzinkrise-ukraine-5vor8,0,www.zeit.de,Angriffe auf russisches Gebiet: Wann merken sie es endlich?,"Schlangen an den Tankstellen, steigende Preise, brennende Raffinerien: Der Krieg ist längst in Russland angekommen. Warum die Bevölkerung dennoch nicht aufbegehrt",https://img.zeit.de/politik/ausland/2026-07/angriffe-russland-benzinkrise-ukraine-5vor8-bild/wide__1300x731,2026-07-03T05:49:25Z,,"Schließen
Artikelzusammenfassung
Die Ukraine-Krise spitzt sich zu: Ukrainische Drohnen dringen immer tiefer in russisches Gebiet vor, lösen Chaos und Zerstörung aus. Die russische Bevölkerung leide… [+799 chars]",,de,'Krieg'
https://rivva.de/336737953,https://rivva.de/336737953,0,rivva.de,Wissenschaft trifft Praxis: Was kommt nach dem Bürgergeld? – IAB-Forum,,,2026-07-03T06:10:01Z,,"rivva.de ist ein Aggregator für deutschsprachige Blogs.Ein unabhängiges Projekt von Frank Westphal.
Rivva ist zu 100 % auf Unterstützung durch freiwillige Mitgliedschaften und Spenden angewiesen.Dam… [+225 chars]",,de,'Bürgergeld'
https://www.n-tv.de/politik/Totenzahl-nach-russischen-Angriffen-auf-Kiew-steigt-auf-30-id31042749.html,https://www.n-tv.de/politik/Totenzahl-nach-russischen-Angriffen-auf-Kiew-steigt-auf-30-id31042749.html,0,www.n-tv.de,Kreml setzt auf Kriegsverbrechen: Totenzahl nach russischen Angriffen auf Kiew steigt auf 30,"Russlands wirtschaftliche Probleme werden durch ukrainische Angriffe größer, gleichzeitig gibt es kaum noch Erfolge auf dem Schlachtfeld. Die Kreml-Streitkräfte attackieren derweil weiter die ukrainische Zivilbevölkerung. In Kiew werden weitere Leichen gefund…",https://www.n-tv.de/img/31042758/1783062924/Img_16_9/1200/260702-KIEV-July-2-2026-Municipal-workers-work-at-the-site-of-a-missile-strike-in-Kiev-Ukraine-on-July-2-2026-At-least-27-people-were-killed-in-a-Russian-attack-on-the-Ukrainian-capital-on-Thursday-Tymur-Tkachenko-head-of-the-Kiev-City-Military-Administration-said.jpg,2026-07-03T07:40:42Z,,"Russlands wirtschaftliche Probleme werden durch ukrainische Angriffe größer, gleichzeitig gibt es kaum noch Erfolge auf dem Schlachtfeld. Die Kreml-Streitkräfte attackieren derweil weiter die ukraini… [+1833 chars]",,de,'Kreml'
https://www.sueddeutsche.de/meinung/reformen-bundesregierung-wirtschaft-deutschland-kommentar-li.3509435,https://www.sueddeutsche.de/meinung/reformen-bundesregierung-wirtschaft-deutschland-kommentar-li.3509435,0,www.sueddeutsche.de,Reformen: So wird die Industrie nicht wieder auferstehen,"Die Koalition versäumt es, ein Konzept zu erarbeiten, das der deutschen Wirtschaft den Weg aus der Sackgasse weist.",https://www.sueddeutsche.de/2026/07/03/570c8156-416d-4256-9397-6d014e908d66.jpg?q=60&fm=webp&width=1200&rect=200%2C395%2C3182%2C1790,2026-07-03T08:57:15Z,,"Man sollte die Beschlüsse nicht kleinreden, die der Koalitionsausschuss von CDU, CSU und SPD in dieser Woche vereinbart hat. Die Abschaffung vieler Berichtspflichten, die Ausweitung befristeter Besch… [+346 chars]",,de,'Industrie'
https://www.welt.de/politik/deutschland/article6a4779e6ad32e994f8759c42/zdfchef-himmler-verteidigt-buergergelddoku-nach-zahlreichen-beschwerden.html,https://www.welt.de/politik/deutschland/article6a4779e6ad32e994f8759c42/zdfchef-himmler-verteidigt-buergergelddoku-nach-zahlreichen-beschwerden.html,0,www.welt.de,ZDF‑Chef Himmler verteidigt Bürgergeld‑Doku nach zahlreichen Beschwerden,Zahlreiche Beschwerden zur Bürgergeld‑Doku haben das ZDF zu einer öffentlichen Stellungnahme veranlasst. Intendant Norbert Himmler weist die Vorwürfe zurück.,https://images.welt.de/6a4779e6ad32e994f8759c42/8d10426a09e5d5df42386c80e554fee1-master/ci16x9-w1200/dpa-com-20090101-260312-935-1212676-jpg,2026-07-03T09:23:43Z,,"ZDF-Intendant Norbert Himmler hat Vorwürfe gegen die Dokumentation Am Puls mit Sarah Tacke System Bürgergeld: Leben ohne Leistung? zurückgewiesen. Ziel des Films war es nicht, Menschen im Bürgergeldb… [+1855 chars]",,de,'Bürgergeld'
https://www.zeit.de/news/2026-07/03/ukraine-soll-bei-nato-gipfel-milliardenversprechen-erhalten,https://www.zeit.de/news/2026-07/03/ukraine-soll-bei-nato-gipfel-milliardenversprechen-erhalten,0,www.zeit.de,Spitzentreffen in Ankara: Ukraine soll bei Nato-Gipfel Milliardenversprechen erhalten,Hier finden Sie Informationen zu dem Thema „Spitzentreffen in Ankara“. Lesen Sie jetzt „Ukraine soll bei Nato-Gipfel Milliardenversprechen erhalten“.,https://img.zeit.de/news/2026-07/03/ukraine-soll-bei-nato-gipfel-milliardenversprechen-erhalten-image-group/wide__1300x731,2026-07-03T12:32:27Z,,Die von Russland angegriffene Ukraine soll beim Nato-Gipfel in Ankara ein neues Versprechen für milliardenschwere Militärhilfen bekommen. Darauf verständigten sich Vertreter der 32 Bündnisstaaten wen… [+4846 chars],,de,'Ukraine'
https://www.zeit.de/politik/deutschland/2026-07/gesundheitsreform-pharmaindustrie-lobby-koalition,https://www.zeit.de/politik/deutschland/2026-07/gesundheitsreform-pharmaindustrie-lobby-koalition,0,www.zeit.de,"Gesundheitsreform: Alle sollen sparen, nur die Pharmabranche kommt glimpflich davon",Die Bundesregierung wollte mit der Gesundheitsreform auch bei Pharmafirmen sparen. Doch nach Druck aus der Industrie schwächt die Koalition die Pläne ab. Zurecht?,https://img.zeit.de/politik/deutschland/2026-07/gesundheitsreform-pharmaindustrie-lobby-koalition-bild/wide__1300x731,2026-07-03T12:38:44Z,,"Es waren intensive Wochen für die Lobbyisten der Pharmaindustrie. Sie schrieben unzählige E-Mails an Bundestagsabgeordnete, vereinbarten Treffen in Ministerien, präsentierten ihre Argumente. In zahlr… [+771 chars]",,de,'Industrie'
https://www.n-tv.de/politik/Darum-koennte-die-Krim-den-Ukraine-Krieg-entscheiden-id31043092.html,https://www.n-tv.de/politik/Darum-koennte-die-Krim-den-Ukraine-Krieg-entscheiden-id31043092.html,0,www.n-tv.de,Plant der Kreml die Evakuierung?: Darum könnte die Krim den Ukraine-Krieg entscheiden,"Die Ukraine attackiert Russland an seiner Achillesferse: Die Krim ist das logistische und militärische Drehkreuz. Kiew ist auf dem besten Weg, die Halbinsel komplett zu isolieren und vom Nachschub abzuschneiden. Das hat Auswirkungen auf die Front in der Süduk…",https://www.n-tv.de/img/31041879/1783021279/Img_16_9/1200/A-satellite-image-shows-smoke-rising-from-Crimea-Bridge-amid-Russia-Ukraine-conflict-Crimea-June-22-2026-Vantor-Handout-via-REUTERS-THIS-IMAGE-HAS-BEEN-SUPPLIED-BY-A-THIRD-PARTY-NO-RESALES-NO-ARCHIVES-MANDATORY-CREDIT-DO-NOT-OBSCURE-LOGO.jpg,2026-07-03T13:18:27Z,,"Rauch steigt von der Krim-Brücke auf, sie verbindet die Halbinsel mit dem russischen Festland. (Foto: via REUTERS)
Die Ukraine attackiert Russland an seiner Achillesferse: Die Krim ist das logistisc… [+8035 chars]",,de,'Ukraine'
https://www.sueddeutsche.de/projekte/artikel/wirtschaft/roboter-industrie-wirtschaft-robotik-e486836/,https://www.sueddeutsche.de/projekte/artikel/wirtschaft/roboter-industrie-wirtschaft-robotik-e486836/,0,www.sueddeutsche.de,"Industrie: Mensch, Roboter!",Ist das nur ein Hype – oder die Zukunft der Fabrik? Milliarden fließen in die Entwicklung humanoider Maschinen.  Zu Besuch bei lernenden Robotern und Entwicklern.,"https://www.sueddeutsche.de/projekte/artikel/wirtschaft/roboter-industrie-wirtschaft-robotik-e486836/f07ad01b7b5d8adf27e83c221d0d93933b2ccc92e0db41f5b5f697f996c7be02_w2400_h1256_r567,0,5000,2617_q70.jpg",2026-07-03T13:37:00Z,,"Nummer 28 lernt noch. Seine Aufgabe: Er muss Ober- und Unterteil eines Heckspoilers aus der Kunststoff-Spritzgussmaschine holen, beides einige Meter hinübertragen zu einem Automaten, der alles mitein… [+106 chars]",,de,'Industrie'
https://www.zeit.de/news/2026-07/03/aurubis-190-millionen-euro-in-recyclinganlage-investiert,https://www.zeit.de/news/2026-07/03/aurubis-190-millionen-euro-in-recyclinganlage-investiert,0,www.zeit.de,Industrie: Aurubis: 190 Millionen Euro in Recyclinganlage investiert,Hier finden Sie Informationen zu dem Thema „Industrie“. Lesen Sie jetzt „Aurubis: 190 Millionen Euro in Recyclinganlage investiert“.,https://img.zeit.de/news/2026-07/03/aurubis-190-millionen-euro-in-recyclinganlage-investiert-image-group/wide__1300x731,2026-07-03T13:57:52Z,,"Der Kupferproduzent Aurubis hat in Hamburg eine Recyclinganlage in Betrieb genommen, in die das Unternehmen nach eigenen Angaben 190 Millionen Euro investiert hat. Das teilte Aurubis mit. Die Besonde… [+587 chars]",,de,'Industrie'
https://www.zeit.de/news/2026-07/03/woidke-strompreiszone-mit-polnischen-regionen-pruefen,https://www.zeit.de/news/2026-07/03/woidke-strompreiszone-mit-polnischen-regionen-pruefen,0,www.zeit.de,Energiepreise: Woidke: Strompreiszone mit polnischen Regionen prüfen,Hier finden Sie Informationen zu dem Thema „Energiepreise“. Lesen Sie jetzt „Woidke: Strompreiszone mit polnischen Regionen prüfen“.,https://img.zeit.de/news/2026-07/03/woidke-strompreiszone-mit-polnischen-regionen-pruefen-image-group/wide__1300x731,2026-07-03T14:01:29Z,,"Brandenburg lotet nach Angaben von Ministerpräsident Dietmar Woidke die Möglichkeit einer gemeinsamen Strompreiszone mit Regionen im Nachbarland Polen aus. «Schleswig-Holstein, Hamburg, Teile von Nie… [+2106 chars]",,de,'Industrie'
https://www.tagesspiegel.de/berlin/energiepreise-woidke-strompreiszone-mit-polnischen-regionen-prufen-15795131.html,https://www.tagesspiegel.de/berlin/energiepreise-woidke-strompreiszone-mit-polnischen-regionen-prufen-15795131.html,0,www.tagesspiegel.de,Energiepreise: Woidke: Strompreiszone mit polnischen Regionen prüfen,Hohe Strompreise gelten als Hemmnis für die Wirtschaft und sind ein Ärgernis für die Verbraucher. Brandenburgs Regierungschef Woidke will sich einen Vorschlag aus Schleswig-Holstein näher anschauen.,https://www.tagesspiegel.de/images/15795130/alternates/BASE_16_9_W1400/1783087345000/brandenburgs-ministerprasident-dietmar-woidke.jpeg,2026-07-03T14:02:25Z,,"Brandenburg lotet nach Angaben von Ministerpräsident Dietmar Woidke die Möglichkeit einer gemeinsamen Strompreiszone mit Regionen im Nachbarland Polen aus. Schleswig-Holstein, Hamburg, Teile von Nied… [+2159 chars]",,de,'Energie'
