index,url,valid,domain,title,description,image,published,archive,content,quote,language,keyword
https://excitingcommerce.de/2023/07/01/auch-gopuff-gibt-in-der-werbevermarktung-gas/,https://excitingcommerce.de/2023/07/01/auch-gopuff-gibt-in-der-werbevermarktung-gas/,0,excitingcommerce.de,Auch Gopuff gibt in der Werbevermarktung Gas,"Alles spricht im Quick Commerce über Gorillas sowie über Flink & Co. Doch was macht eigentlich das Original? Gopuff, das dieses Jahr 10 wird, baut sein Werbegeschäft aus und will damit jetzt auch Streaming- und Entertainmentanbieter sowie Banken und Versicher…",https://i0.wp.com/excitingcommerce.de/wp-content/uploads/2023/07/gopuffads.jpg?fit=778%2C508&ssl=1,2023-07-01T07:35:53Z,https://web.archive.org/web/20230701073557/https://excitingcommerce.de/2023/07/01/auch-gopuff-gibt-in-der-werbevermarktung-gas/,"Alles spricht im Quick Commerce über Gorillas sowie über Flink & Co. Doch was macht eigentlich das Original? Gopuff, das dieses Jahr 10 wird, baut sein Werbegeschäft aus und will damit jetzt auch Str… [+2125 chars]",,de,'Gas'
https://stadt-bremerhaven.de/erneuerbare-energien-decken-ca-50-des-stromverbrauchs-in-deutschland/,https://stadt-bremerhaven.de/erneuerbare-energien-decken-ca-50-des-stromverbrauchs-in-deutschland/,0,stadt-bremerhaven.de,Erneuerbare Energien decken ca. 50 % des Stromverbrauchs in Deutschland,Bis 2030 sollen in Deutschland nach aktuellem Stand der Pläne der Bundesregierung 80 % des Stroms aus erneuerbaren Energien stammen. In der ersten Jahreshälfte 2023 stand man laut vorläufigen Zahlen bei ca. 52 %. Zumindest besagen dies erste Daten des...Zum B…,https://stadt-bremerhaven.de/wp-content/uploads/2022/09/Energie-Strom.jpg,2023-07-01T12:00:04Z,https://web.archive.org/web/20230701120817/https://stadt-bremerhaven.de/erneuerbare-energien-decken-ca-50-des-stromverbrauchs-in-deutschland/,Bis 2030 sollen in Deutschland nach aktuellem Stand der Pläne der Bundesregierung 80 % des Stroms aus erneuerbaren Energien stammen. In der ersten Jahreshälfte 2023 stand man laut vorläufigen Zahlen … [+2070 chars],,de,'Gas'
https://www.zeit.de/politik/deutschland/2023-07/olaf-scholz-respekt-toleranz-rente,https://www.zeit.de/politik/deutschland/2023-07/olaf-scholz-respekt-toleranz-rente,0,www.zeit.de,Bundeskanzler: Scholz ruft zu mehr Toleranz auf,Bundeskanzler Olaf Scholz hat sich für mehr Respekt und gegenseitige Akzeptanz in der Gesellschaft ausgesprochen. Er verwies auf die Erhöhungen bei Rente und Mindestlohn.,,2023-07-01T12:42:29Z,http://archive.md/20230705011557/https://www.zeit.de/politik/deutschland/2023-07/olaf-scholz-respekt-toleranz-rente,"When browsing with ads:
We collect personal data and also transmit it to third-party providers
 that help us improve and finance our digital content. Some of the information stored on your device, … [+821 chars]",,de,'Olaf Scholz'
https://taz.de/-Nachrichten-im-Ukraine-Krieg-/!5944462/,https://taz.de/-Nachrichten-im-Ukraine-Krieg-/!5944462/,0,taz.de,+++ Nachrichten im Ukraine-Krieg +++: Sánchez unterstützt Ukraine,Spaniens Ministerpräsident Pedro Sánchez macht der Ukraine Hoffnung auf einen Beitritt zur EU. Selenski bezeichnet das AKW Saporischschja als „bedroht“.,https://taz.de/picture/6363531/948/imago0262192053h-1.jpeg,2023-07-01T16:00:00Z,https://web.archive.org/web/20230701175406/https://taz.de/-Nachrichten-im-Ukraine-Krieg-/!5944462/,"Spaniens Ministerpräsident Pedro Sánchez macht der Ukraine Hoffnung auf einen Beitritt zur EU. Selenski bezeichnet das AKW Saporischschja als bedroht.
Spaniens Ministerpräsident Pedro Sánchez verspr… [+6649 chars]",,de,'Krieg'
https://www.zeit.de/2023/28/ukraine-krieg-soldaten-front,https://www.zeit.de/2023/28/ukraine-krieg-soldaten-front,0,www.zeit.de,Soldaten im Ukraine-Krieg: Grabenkampf,"Ein Wald in der Ukraine. Soldaten beschießen einander mit Mörsern, Panzern und Maschinengewehren, verschanzen sich in Erdlöchern. Eine Reportage von der Front",,2023-07-01T16:30:29Z,https://web.archive.org/web/20230629210316/https://www.zeit.de/2023/28/ukraine-krieg-soldaten-front,"When browsing with ads:
We collect personal data and also transmit it to third-party providers
 that help us improve and finance our digital content. Some of the information stored on your device, … [+821 chars]",,de,'Ukraine'
https://www.n-tv.de/politik/15-12-Russische-Medien-Kreml-zahlte-Milliarden-Euro-an-Prigoschins-Wagner-und-Concord-Gruppe--article23143824.html,https://www.n-tv.de/politik/15-12-Russische-Medien-Kreml-zahlte-Milliarden-Euro-an-Prigoschins-Wagner-und-Concord-Gruppe--article23143824.html,0,www.n-tv.de,Ukraine-Krieg im Liveticker: +++ 15:12 Russische Medien: Kreml zahlte Milliarden Euro an Prigoschins Wagner- und Concord-Gruppe +++,"Berlin, Washington, Br\u00fcssel - \u00fcberall. n-tv berichtet von allen wichtigen Schaupl\u00e4tzen der Innen- und Au\u00dfenpolitik.",https://bilder2.n-tv.de/img/incoming/crop23332537/9041326157-cImg_16_9-w1200/Liveticker1-grau-1-Kopie.jpg,2023-07-01T22:10:00Z,,Es werden weitere Details über die Beziehung zwischen der russischen Regierung und den Unternehmen von Wagner-Chef Jewegeni Prigoschin bekannt. Für alle Aufträge soll der Kreml seit 2013 etwa 9 Milli… [+16307 chars],,de,'Kreml'
https://www.n-tv.de/politik/08-01-Kretschmer-Weg-zu-russischem-Gas-nicht-versperren--article23143824.html,https://www.n-tv.de/politik/08-01-Kretschmer-Weg-zu-russischem-Gas-nicht-versperren--article23143824.html,0,www.n-tv.de,Ukraine-Krieg im Liveticker: +++ 08:01 Kretschmer: Weg zu russischem Gas nicht versperren +++,"Berlin, Washington, Br\u00fcssel - \u00fcberall. n-tv berichtet von allen wichtigen Schaupl\u00e4tzen der Innen- und Au\u00dfenpolitik.",https://bilder2.n-tv.de/img/incoming/crop23332537/9041326157-cImg_16_9-w1200/Liveticker1-grau-1-Kopie.jpg,2023-07-01T22:10:00Z,,"Der sächsische Ministerpräsident Michael Kretschmer dringt auf eine diplomatische Lösung für die Ukraine und will den Weg zu russischem Gas nicht auf Dauer versperrt sehen. ""Wir müssen viel stärker a… [+9096 chars]",,de,'Krieg'
https://www.faz.net/aktuell/politik/inland/ard-sommerinterview-so-will-olaf-scholz-den-afd-hoehenflug-stoppen-19005984.html,https://www.faz.net/aktuell/politik/inland/ard-sommerinterview-so-will-olaf-scholz-den-afd-hoehenflug-stoppen-19005984.html,0,www.faz.net,Scholz will Höhenflug der AfD mit Sachentscheidungen stoppen,Olaf Scholz will dem Umfragehoch der AfD mit Entscheidungen zu Alltagsproblemen der Bürger entgegentreten. Über die anhaltenden Krawalle in Frankreich zeigt sich der Kanzler besorgt.,https://media1.faz.net/ppmedia/aktuell/politik/3181286299/1.9006083/facebook_teaser/kanzler-scholz-vor-dem-ard.jpg,2023-07-02T16:01:59Z,https://web.archive.org/web/20230703125652/https://www.faz.net/aktuell/politik/inland/ard-sommerinterview-so-will-olaf-scholz-den-afd-hoehenflug-stoppen-19005984.html,"Kanzler Olaf Scholz (SPD) will den Höhenflug der rechtspopulistischen AfD in den Umfragen mit Entscheidungen zu Alltagsproblemen der Bürger stoppen. Es sei nötig, den Menschen eine positive Zukunftsp… [+2513 chars]",,de,'Olaf Scholz'
https://www.n-tv.de/politik/Russischer-TV-Moderator-Prigoschin-ist-uebergeschnappt-article24233054.html,https://www.n-tv.de/politik/Russischer-TV-Moderator-Prigoschin-ist-uebergeschnappt-article24233054.html,0,www.n-tv.de,Wegen Zahlung hoher Geldsummen: Russischer TV-Moderator: Prigoschin ist übergeschnappt,"Der Kreml-nahe Journalist Kissiljow behauptet im russischen Staatsfernsehen: Die Wagner-Gruppe hat staatliche Mittel in Höhe von 858 Milliarden Rubel erhalten. Der Chef der Söldnertruppe Wagner soll daraufhin die Bodenhaftung verloren haben. Das Gefühl, ""sich…",https://bilder1.n-tv.de/img/incoming/crop24219464/8541327094-cImg_16_9-w1200/414412894.jpg,2023-07-02T23:21:04Z,https://web.archive.org/web/20230703062632/https://www.n-tv.de/politik/Russischer-TV-Moderator-Prigoschin-ist-uebergeschnappt-article24233054.html,Der Kreml-nahe Journalist Kissiljow behauptet im russischen Staatsfernsehen: Die Wagner-Gruppe hat staatliche Mittel in Höhe von 858 Milliarden Rubel erhalten. Der Chef der Söldnertruppe Wagner soll … [+4062 chars],,de,'Kreml'
https://www.zeit.de/politik/deutschland/2023-07/cum-ex-geschaefte-warburg-bank-olaf-scholz-untersuchungsausschuss,https://www.zeit.de/politik/deutschland/2023-07/cum-ex-geschaefte-warburg-bank-olaf-scholz-untersuchungsausschuss,0,www.zeit.de,Cum-Ex-Geschäfte: Ampel-Koalition lehnt Untersuchungsausschuss zu Warburg-Skandal ab,Welche Rolle spielte Olaf Scholz in der Cum-Ex-Affäre? Die Union will das mit einem Untersuchungsausschuss klären. Die Ampel lehnt ab – und nennt dafür formale Gründe.,,2023-07-03T14:20:23Z,http://archive.md/20230704214744/https://www.zeit.de/politik/deutschland/2023-07/cum-ex-geschaefte-warburg-bank-olaf-scholz-untersuchungsausschuss,"When browsing with ads:
We collect personal data and also transmit it to third-party providers
 that help us improve and finance our digital content. Some of the information stored on your device, … [+821 chars]",,de,'Olaf Scholz'
https://www.stern.de/gesellschaft/regional/berlin-brandenburg/leute--scholz--verschiedenheit-des-landes-als-grosse-bereicherung-sehen-33619918.html,https://www.stern.de/gesellschaft/regional/berlin-brandenburg/leute--scholz--verschiedenheit-des-landes-als-grosse-bereicherung-sehen-33619918.html,0,www.stern.de,Leute: Scholz: Verschiedenheit des Landes als große Bereicherung sehen,"Bundeskanzler Olaf Scholz hat die Bedeutung von Diversität in Deutschland betont. ""Das ist etwas, was zur Kultur unseres Landes unmittelbar dazugehört"", sagte der SPD-Politiker am Dienstagabend beim Produzentenfest 2023 in Berlin. Bei dem Empfang der Film- un…",https://image.stern.de/33619920/t/K8/v1/w1440/r1.7778/-/04--urnnewsmldpacom2009010123070499285875v2w800h600l1680t445r4180b2086jpeg---6f2403ca9f432792.jpg,2023-07-04T19:23:22Z,,"Bundeskanzler Olaf Scholz hat die Bedeutung von Diversität in Deutschland betont. ""Das ist etwas, was zur Kultur unseres Landes unmittelbar dazugehört"", sagte der SPD-Politiker am Dienstagabend beim … [+1690 chars]",,de,'Olaf Scholz'
https://www.morgenpost.de/berlin/article238863231/Scholz-Verschiedenheit-des-Landes-als-grosse-Bereicherung-sehen.html,https://www.morgenpost.de/berlin/article238863231/Scholz-Verschiedenheit-des-Landes-als-grosse-Bereicherung-sehen.html,0,www.morgenpost.de,Leute: Scholz: Verschiedenheit des Landes als große Bereicherung sehen,"Bundeskanzler Olaf Scholz hat die Bedeutung von Diversität in Deutschland betont. „Das ist etwas, was zur Kultur unseres Landes unmittelbar dazugehört“, sagte der SPD-Politiker am Dienstagabend beim Produzentenfest 2023 in Berlin. Bei dem Empfang der Film- un…",https://img.morgenpost.de/img/berlin/crop238863229/7282609326-w820-cv16_9-q85/Produzentenfest-2023.jpg,2023-07-04T19:23:22Z,https://web.archive.org/web/20230706054042/https://www.morgenpost.de/berlin/article238863231/Scholz-Verschiedenheit-des-Landes-als-grosse-Bereicherung-sehen.html,"Berlin. Bundeskanzler Olaf Scholz hat die Bedeutung von Diversität in Deutschland betont. Das ist etwas, was zur Kultur unseres Landes unmittelbar dazugehört, sagte der SPD-Politiker am Dienstagabend… [+1292 chars]",,de,'Olaf Scholz'
https://www.n-tv.de/politik/Rumaenien-dringt-bei-Scholz-auf-Schengen-Beitritt-article24237739.html,https://www.n-tv.de/politik/Rumaenien-dringt-bei-Scholz-auf-Schengen-Beitritt-article24237739.html,0,www.n-tv.de,Kanzler sagt Unterstützung zu: Rumänien dringt bei Scholz auf Schengen-Beitritt,Der Beitritt Rumäniens zum Schengenraum scheitert im Dezember an einem Veto Österreichs. Bei einem Besuch des rumänischen Premiers in Berlin verspricht ihm Scholz eine positive Wende bis zum Jahresende. Auch um den Ukraine-Krieg drehen sich die Gespräche im K…,https://bilder2.n-tv.de/img/incoming/crop24237749/819132112-cImg_16_9-w1200/415643872.jpg,2023-07-04T19:49:08Z,https://web.archive.org/web/20230706053931/https://www.n-tv.de/politik/Rumaenien-dringt-bei-Scholz-auf-Schengen-Beitritt-article24237739.html,Der Beitritt Rumäniens zum Schengenraum scheitert im Dezember an einem Veto Österreichs. Bei einem Besuch des rumänischen Premiers in Berlin verspricht ihm Scholz eine positive Wende bis zum Jahresen… [+2569 chars],,de,'Ukraine'
https://www.dw.com/de/ukraine-aktuell-drohen-am-akw-saporischschja-provokationen/a-66115401,https://www.dw.com/de/ukraine-aktuell-drohen-am-akw-saporischschja-provokationen/a-66115401,0,www.dw.com,Ukraine Aktuell: Drohen am AKW Saporischschja Provokationen?,"Das Atomkraftwerk Saporischschja ist das größte in Europa. Russische Soldaten halten es seit März 2022 besetzt. Jetzt geht die Sorge um vor einem Anschlag. Der Überblick. Das Wichtigste in Kürze:


Sorge um Sicherheit von AKW Saporischschja
Biden und Scholz s…",https://static.dw.com/image/65984843_6.jpg,2023-07-04T22:02:00Z,,"Das Wichtigste in Kürze:
<ul><li>Sorge um Sicherheit von AKW Saporischschja</li><li>Biden und Scholz stimmen sich vor NATO-Gipfel ab</li><li>Selenskyj erfreut über Amtszeitverlängerung von Stoltenbe… [+4087 chars]",,de,'Olaf Scholz'
https://www.n-tv.de/politik/15-55-Tschetschenische-Journalistin-Milaschina-nach-Attacke-in-schwierigem-Zustand--article23143824.html,https://www.n-tv.de/politik/15-55-Tschetschenische-Journalistin-Milaschina-nach-Attacke-in-schwierigem-Zustand--article23143824.html,0,www.n-tv.de,"Ukraine-Krieg im Liveticker: +++ 15:55 Tschetschenische Journalistin Milaschina nach Attacke in ""schwierigem Zustand"" +++","Berlin, Washington, Br\u00fcssel - \u00fcberall. n-tv berichtet von allen wichtigen Schaupl\u00e4tzen der Innen- und Au\u00dfenpolitik.",https://bilder2.n-tv.de/img/incoming/crop23332537/9041326157-cImg_16_9-w1200/Liveticker1-grau-1-Kopie.jpg,2023-07-04T22:15:00Z,,"Nach dem Angriff auf die russische ""Nowaja Gaseta""-Journalistin Elena Milaschina in Tschetschenien ist ihr Zustand weiterhin besorgniserregend. ""Ihr Zustand ist, offen gesagt, schwierig"", sagt ""Nowaj… [+26357 chars]",,de,'Krieg'
https://www.n-tv.de/politik/15-34-Deutschland-lehnt-Bundeswehr-Stationierung-in-Rumaenien-ab--article23143824.html,https://www.n-tv.de/politik/15-34-Deutschland-lehnt-Bundeswehr-Stationierung-in-Rumaenien-ab--article23143824.html,0,www.n-tv.de,Ukraine-Krieg im Liveticker: +++ 15:34 Deutschland lehnt Bundeswehr-Stationierung in Rumänien ab +++,"Berlin, Washington, Br\u00fcssel - \u00fcberall. n-tv berichtet von allen wichtigen Schaupl\u00e4tzen der Innen- und Au\u00dfenpolitik.",https://bilder2.n-tv.de/img/incoming/crop23332537/9041326157-cImg_16_9-w1200/Liveticker1-grau-1-Kopie.jpg,2023-07-04T22:15:00Z,,"Die Bundesregierung plant keine Stationierung deutscher Soldaten in Rumänien. Deutschland sehe sich ""nicht verpflichtet"", eine feste Brigade in das Land zu entsenden, sagt ein Sprecher des Verteidigu… [+25475 chars]",,de,'Krieg'
https://www.n-tv.de/politik/16-13-Ausschuesse-bewilligen-Kauf-von-60-Chinook-Helikoptern--article23143824.html,https://www.n-tv.de/politik/16-13-Ausschuesse-bewilligen-Kauf-von-60-Chinook-Helikoptern--article23143824.html,0,www.n-tv.de,Ukraine-Krieg im Liveticker: +++ 16:13 Ausschüsse bewilligen Kauf von 60 Chinook-Helikoptern +++,"Berlin, Washington, Br\u00fcssel - \u00fcberall. n-tv berichtet von allen wichtigen Schaupl\u00e4tzen der Innen- und Au\u00dfenpolitik.",https://bilder2.n-tv.de/img/incoming/crop23332537/9041326157-cImg_16_9-w1200/Liveticker1-grau-1-Kopie.jpg,2023-07-04T22:15:00Z,,Der Verteidigungs- und der Haushaltsausschuss des Bundestages geben grünes Licht für den milliardenschweren Kauf von 60 schweren Transporthubschraubern für die Bundeswehr. Eine Mehrheit der Fachpolit… [+27153 chars],,de,'Ukraine'
https://www.n-tv.de/politik/16-38-Russischer-und-ungarischer-Minister-loben-Ausweitung-des-Handels-zwischen-beiden-Laendern--article23143824.html,https://www.n-tv.de/politik/16-38-Russischer-und-ungarischer-Minister-loben-Ausweitung-des-Handels-zwischen-beiden-Laendern--article23143824.html,0,www.n-tv.de,Ukraine-Krieg im Liveticker: +++ 16:38 Russischer und ungarischer Minister loben Ausweitung des Handels zwischen beiden Ländern +++,"Berlin, Washington, Br\u00fcssel - \u00fcberall. n-tv berichtet von allen wichtigen Schaupl\u00e4tzen der Innen- und Au\u00dfenpolitik.",https://bilder2.n-tv.de/img/incoming/crop23332537/9041326157-cImg_16_9-w1200/Liveticker1-grau-1-Kopie.jpg,2023-07-04T22:15:00Z,,"Der ungarische Außenminister Peter Szijjarto hat den russischen Gesundheitsminister Michail Muraschko zu einem Treffen in seinem Budapester Ministerium empfangen. ""Die Sanktionspolitik begrenzt ganz … [+27952 chars]",,de,'Ukraine'
https://www.n-tv.de/politik/17-10-Gericht-schickt-Sohn-von-belarussischem-Oppositionellen-Babariko-ins-Straflager--article23143824.html,https://www.n-tv.de/politik/17-10-Gericht-schickt-Sohn-von-belarussischem-Oppositionellen-Babariko-ins-Straflager--article23143824.html,0,www.n-tv.de,Ukraine-Krieg im Liveticker: +++ 17:10 Gericht schickt Sohn von belarussischem Oppositionellen Babariko ins Straflager +++,"Berlin, Washington, Br\u00fcssel - \u00fcberall. n-tv berichtet von allen wichtigen Schaupl\u00e4tzen der Innen- und Au\u00dfenpolitik.",https://bilder2.n-tv.de/img/incoming/crop23332537/9041326157-cImg_16_9-w1200/Liveticker1-grau-1-Kopie.jpg,2023-07-04T22:15:00Z,,Zwei Jahre nach der Verurteilung des belarussischen Oppositionspolitikers Viktor Babariko zu langer Lagerhaft hat ein Gericht in Minsk auch gegen dessen Sohn eine hohe Strafe verhängt. Eduard Babarik… [+28739 chars],,de,'Ukraine'
https://www.welt.de/vermischtes/article246225250/TV-Kritik-Maischberger-Soeder-wuerde-Heizungsgesetz-wieder-abschaffen.html,https://www.welt.de/vermischtes/article246225250/TV-Kritik-Maischberger-Soeder-wuerde-Heizungsgesetz-wieder-abschaffen.html,0,www.welt.de,"„Wir würden es wieder abschaffen“, sagt Söder über das Heizungsgesetz","Bei „Maischberger“ erklärt Bayerns Ministerpräsident Markus Söder, wie die Union im Falle eines Wahlsiegs mit dem Heizungsgesetz verfahren würde, wie er zur Unions-Kanzlerkandidatur steht und warum er sich von Kanzler Olaf Scholz ein „bisschen mehr John Wayne…",https://img.welt.de/img/vermischtes/mobile246225276/7111354017-ci16x9-w1200/maischberger762-047.jpg,2023-07-05T02:41:34Z,,"Markus Söder gab sich bescheiden. Auf Parteitagen und auf hoher See ist man in Gottes Hand. Da kann alles noch schiefgehen, sagte er in der ARD-Talksendung Maischberger. Dabei ist der bayerische Mini… [+3790 chars]",,de,'Olaf Scholz'
https://www.welt.de/vermischtes/article246225250/TV-Kritik-Maischberger-Soeder-findet-Diskussion-ueber-Kanzlerkandidaten-absolut-falsch.html,https://www.welt.de/vermischtes/article246225250/TV-Kritik-Maischberger-Soeder-findet-Diskussion-ueber-Kanzlerkandidaten-absolut-falsch.html,0,www.welt.de,"Diskussion über Kanzlerkandidaten? „Absolut falsch“ und verfrüht, sagt Söder","Bei „Maischberger“ erklärt Bayerns Ministerpräsident Markus Söder, wie die Union im Falle eines Wahlsiegs mit dem Heizungsgesetz verfahren würde, wie er zur Unions-Kanzlerkandidatur steht und warum er sich von Kanzler Olaf Scholz ein „bisschen mehr John Wayne…",https://img.welt.de/img/vermischtes/mobile246225276/7111354017-ci16x9-w1200/maischberger762-047.jpg,2023-07-05T02:41:34Z,,"Markus Söder gab sich bescheiden. Auf Parteitagen und auf hoher See ist man in Gottes Hand. Da kann alles noch schiefgehen, sagte er in der ARD-Talksendung Maischberger. Dabei ist der bayerische Mini… [+3790 chars]",,de,'Olaf Scholz'
https://www.welt.de/politik/deutschland/video246224910/Live-Scholz-stellt-sich-den-Fragen-der-Bundestagsabgeordneten.html,https://www.welt.de/politik/deutschland/video246224910/Live-Scholz-stellt-sich-den-Fragen-der-Bundestagsabgeordneten.html,0,www.welt.de,Scholz stellt sich den Fragen der Bundestagsabgeordneten,"Vor der Sommerpause des Bundestags stellt sich Kanzler Olaf Scholz noch einmal den Fragen der Abgeordneten. Zu Beginn der Befragung wird er eine Rede halten. Anschließend haben die Parlamentarier gut 60 Minuten Zeit, ihre Fragen zu stellen. Verfolgen Sie dies…",https://img.welt.de/img/politik/deutschland/mobile246232230/9811358137-ci16x9-w1200/tart-Scholz-JPG.jpg,2023-07-05T04:04:27Z,http://archive.md/20230705113501/https://www.welt.de/politik/deutschland/video246224910/Live-Scholz-stellt-sich-den-Fragen-der-Bundestagsabgeordneten.html,"Die WELT als ePaper: Die vollständige Ausgabe steht Ihnen bereits am Vorabend zur Verfügung so sind Sie immer hochaktuell informiert. Weitere Informationen: http://epaper.welt.de 
 Der Kurz-Link die… [+49 chars]",,de,'Olaf Scholz'
https://www.focus.de/politik/ausland/ukraine-update-am-morgen-auch-in-bachmut-russland-stationiert-180-000-soldaten-an-grossen-ostfronten_id_198245314.html,https://www.focus.de/politik/ausland/ukraine-update-am-morgen-auch-in-bachmut-russland-stationiert-180-000-soldaten-an-grossen-ostfronten_id_198245314.html,0,www.focus.de,Ukraine-Update am Morgen - Auch in Bachmut: Russland stationiert 180.000 Soldaten an großen Ostfronten,"Russland stationiert 180.000 Soldaten an den Ostfronten. Selenskyj bedankt sich für die von Deutschland gelieferten Flugabwehrsysteme, doch Kiew sieht weiteren Aufrüstungsbedarf. Was in der Nacht im Krieg gegen die Ukraine passiert ist.",https://p6.focus.de/img/fotos/id_180457155/russische-soldaten-im-krieg-in-der-ukraine..jpg?im=Crop%3D%280%2C120%2C1920%2C960%29%3BResize%3D%281200%2C627%29&impolicy=perceptual&quality=mediumHigh&hash=d265ba2dcfaad7c3439e5e997595c6471d7d499d2d7cb146f2c59b280946278c,2023-07-05T04:10:28Z,,"<ul><li>
Kommentare</li><li>
E-Mail</li><li>
Teilen</li><li>
Mehr</li><li>
Twitter</li><li>
Drucken</li><li>
Feedback</li><li>
Fehler meldenSie haben einen Fehler gefunden?
Bitte markieren S… [+6406 chars]",,de,'Olaf Scholz'
https://www.focus.de/politik/deutschland/im-liveticker-bundeskanzler-scholz-stellt-sich-den-fragen-des-bundestages_id_198246246.html,https://www.focus.de/politik/deutschland/im-liveticker-bundeskanzler-scholz-stellt-sich-den-fragen-des-bundestages_id_198246246.html,0,www.focus.de,Im Liveticker - Bundeskanzler Scholz stellt sich den Fragen des Bundestages,Bundeskanzler Olaf Scholz hält am Mittwoch eine achtminütige Rede im Bundestag. Anschließend können die Abgeordneten dem SPD-Politiker im Rahmen der Regierungsbefragung rund eine Stunde lang Fragen stellen. Thematische Vorgaben gibt es nicht. FOCUS online ber…,https://p6.focus.de/img/fotos/id_198246245/olaf-scholz-bei-einer-rede-im-bundestag-am-22.-juni-2023.-heute-stellt-sich-der-bundeskanzler-den-fragen-der-abgeordneten..jpg?im=Crop%3D%280%2C0%2C3463%2C1732%29%3BResize%3D%281200%2C627%29&impolicy=perceptual&quality=mediumHigh&hash=40b1eda480e11d15cab98dc95370bb0e5fbc30298a41144026cd0bc471661091,2023-07-05T04:46:30Z,,Bundeskanzler Olaf Scholz hält am Mittwoch eine achtminütige Rede im Bundestag. Anschließend können die Abgeordneten dem SPD-Politiker im Rahmen der Regierungsbefragung rund eine Stunde lang Fragen s… [+699 chars],,de,'Olaf Scholz'
