index,url,valid,domain,title,description,image,published,archive,content,quote,language,keyword
https://www.welt.de/politik/ausland/article247591500/New-York-Scholz-attackiert-Putin-ungewoehnlich-scharf-im-UN-Sicherheitsrat.html,https://www.welt.de/politik/ausland/article247591500/New-York-Scholz-attackiert-Putin-ungewoehnlich-scharf-im-UN-Sicherheitsrat.html,0,www.welt.de,Scholz attackiert Putin ungewöhnlich scharf im UN-Sicherheitsrat,Schlagabtausch vor dem UN-Sicherheitsrat. In seiner Rede attackierte Bundeskanzler Olaf Scholz den russischen Präsidenten Wladimir Putin ungewöhnlich scharf. Zuvor hatte aber auch der russische Außenminister Sergej Lawrow deutliche Worte in Richtung Westen ge…,https://img.welt.de/img/politik/ausland/mobile247591502/2321351477-ci16x9-w1200/UN-Sicherheitsrat.jpg,2023-09-20T19:00:02Z,,"Bundeskanzler Olaf Scholz (SPD) hat den russischen Präsidenten Wladimir Putin in seiner ersten Rede vor dem UN-Sicherheitsrat scharf attackiert. Der Grund dafür, dass das Leid in der Ukraine und über… [+3230 chars]",,de,'Sicherheit'
https://www.stern.de/politik/ausland/olaf-scholz--denkwuerdige-drei-minuten-im-un-sicherheitsrat-33845392.html,https://www.stern.de/politik/ausland/olaf-scholz--denkwuerdige-drei-minuten-im-un-sicherheitsrat-33845392.html,0,www.stern.de,Sitzung in New York: Der Kanzler knallhart: Olaf Scholz' denkwürdige drei Minuten im Sicherheitsrat,"Die Vereinten Nationen diskutieren den Krieg in der Ukraine. Es zeigt sich, dass Russland nur noch wenige Freunde hat. Und Deutschland gehört eindeutig nicht mehr dazu",https://image.stern.de/33845410/t/w8/v2/w1440/r1.7778/-/olaf-scholz-un-sicherheitsrat-ukraine.jpg,2023-09-20T19:20:00Z,,"Es ist 11.05 Uhr in New York, als Edi Rama eine denkwürdige Sitzung des UN-Sicherheitsrates eröffnet. Albanien hat in diesem Monat den Vorsitz, und Premierminister Rama mit seinem weißen Bart und sei… [+8751 chars]",,de,'Sicherheit'
https://www.zeit.de/politik/2023-09/olaf-scholz-un-generalversammlung-new-york-russland-verhandlungen,https://www.zeit.de/politik/2023-09/olaf-scholz-un-generalversammlung-new-york-russland-verhandlungen,0,www.zeit.de,"Olaf Scholz im UN-Sicherheitsrat: Der Gast, der deutlich wird",Olaf Scholz sieht in New York einen verärgerten russischen Botschafter und eine Attacke von Wolodymyr Selenskyj. Dann redet der sonst so unverbindliche Kanzler Klartext.,,2023-09-20T19:43:41Z,,"When browsing with ads:
We collect personal data and also transmit it to third-party providers
 that help us improve and finance our digital content. Some of the information stored on your device, … [+821 chars]",,de,'Gas'
https://www.n-tv.de/politik/Scholz-greift-Putin-vor-Sicherheitsrat-scharf-an-article24411703.html,https://www.n-tv.de/politik/Scholz-greift-Putin-vor-Sicherheitsrat-scharf-an-article24411703.html,0,www.n-tv.de,"Russlands Schweigen ""tönt laut"": Scholz greift Putin vor Sicherheitsrat scharf an","Als letzter Redner in der Sitzung des UN-Sicherheitsrats richtet Bundeskanzler Scholz eine eindeutige Botschaft in Richtung des russischen Präsidenten Putin. Er fordert eine schnelle Friedenslösung, aber nicht um jeden Preis.",https://bilder2.n-tv.de/img/incoming/crop24411705/1491325647-cImg_16_9-w1200/426553621.jpg,2023-09-20T19:59:33Z,,"Als letzter Redner in der Sitzung des UN-Sicherheitsrats richtet Bundeskanzler Scholz eine eindeutige Botschaft in Richtung des russischen Präsidenten Putin. Er fordert eine schnelle Friedenslösung, … [+2174 chars]",,de,'Wladimir Putin'
https://www.n-tv.de/wirtschaft/Bundesnetzagenturchef-empfiehlt-Blick-auf-Gastarif-article24411727.html,https://www.n-tv.de/wirtschaft/Bundesnetzagenturchef-empfiehlt-Blick-auf-Gastarif-article24411727.html,0,www.n-tv.de,Müller befürchtet Winter-Anstieg: Bundesnetzagenturchef empfiehlt Blick auf Gastarif,"Die Gaspreise sind zuletzt gesunken. Doch der Bundesnetzagenturchef geht davon aus, dass es im Winter wieder zu Kostensprüngen kommen könnte. Verbraucher sollten also die Tarife im Auge behalten. Insgesamt sieht Müller das Land gut gewappnet.",https://bilder2.n-tv.de/img/incoming/crop24411733/9611328479-cImg_16_9-w1200/425272135.jpg,2023-09-20T22:05:31Z,,"Die Gaspreise sind zuletzt gesunken. Doch der Bundesnetzagenturchef geht davon aus, dass es im Winter wieder zu Kostensprüngen kommen könnte. Verbraucher sollten also die Tarife im Auge behalten. Ins… [+2654 chars]",,de,'Gas'
https://www.faz.net/aktuell/politik/ukraine-liveticker-polen-liefert-keine-waffen-mehr-an-die-ukraine-faz-19030454.html,https://www.faz.net/aktuell/politik/ukraine-liveticker-polen-liefert-keine-waffen-mehr-an-die-ukraine-faz-19030454.html,0,www.faz.net,Ukraine-Liveblog: Polen liefert keine Waffen mehr an die Ukraine,Scholz attackiert Putin im UN-Sicherheitsrat +++ Ukraine greift russische Militärbasen auf der Krim an +++ London sieht taktische ukrainische Fortschritte bei Bachmut +++ alle Entwicklungen im Liveblog,https://media0.faz.net/ppmedia/aktuell/3631915494/1.9189330/facebook_teaser/der-polnische.jpg,2023-09-21T01:18:47Z,,Der brasilianische Präsident Luiz Inacio Lula da Silva und sein ukrainischer Amtskollege Wolodymyr Selenskyj haben Möglichkeiten für eine friedliche Beendigung des Krieges in der Ukraine erörtert. Wi… [+1001 chars],,de,'Sicherheit'
https://www.focus.de/panorama/welt/netzagentur-deutschland-bei-gasversorgung-in-besserer-situation-als-vor-einem-jahr_id_209750796.html,https://www.focus.de/panorama/welt/netzagentur-deutschland-bei-gasversorgung-in-besserer-situation-als-vor-einem-jahr_id_209750796.html,0,www.focus.de,Netzagentur - Deutschland bei Gasversorgung in besserer Situation als vor einem Jahr,"Der Präsident der Bundesnetzagentur, Klaus Müller, sieht Deutschland mit Blick auf den bevorstehenden Winter bei der Gasversorgung in einer günstigeren Situation als vor einem Jahr.",https://p6.focus.de/img/auto/elektroauto/news/id_209310868/mehrwertsteuer-auf-gas-geht-es-nach-lindner-drohen-bald-hoehere-heizkosten.jpg?im=Crop%3D%280%2C45%2C1440%2C720%29%3BResize%3D%281200%2C627%29&impolicy=perceptual&quality=mediumHigh&hash=89d5576fe6fb261449ffc852968d1993913502572410c25aa059b27bba7499d9,2023-09-21T01:57:46Z,,"Der Präsident der Bundesnetzagentur, Klaus Müller, sieht Deutschland mit Blick auf den bevorstehenden Winter bei der Gasversorgung in einer günstigeren Situation als vor einem Jahr. Wir sind schon op… [+1962 chars]",,de,'Winter'
https://www.faz.net/aktuell/politik/ausland/ukraine-krieg-selenskyj-will-in-washington-um-marschflugkoerper-werben-19189363.html,https://www.faz.net/aktuell/politik/ausland/ukraine-krieg-selenskyj-will-in-washington-um-marschflugkoerper-werben-19189363.html,0,www.faz.net,Krieg in der Ukraine: Selenskyj will in Washington Hilfe sichern,Bei den Vereinten Nationen in New York warnte der ukrainische Präsident eindringlich vor Russlands Machtstreben. Nun reist er weiter nach Washington. Die Lage im Kongress ist seit seinem letzten Besuch eine andere. Der Überblick.,https://media0.faz.net/ppmedia/aktuell/politik/265613306/1.9189352/facebook_teaser/der-ukrainische-praesident.jpg,2023-09-21T03:13:33Z,,Der ukrainische Präsident Wolodymyr Selenskyj legt nach der UN-Generaldebatte in New York einen Stopp bei seinem wichtigsten Verbündeten in Washington ein. In der US-Hauptstadt will er am Donnerstagn… [+4898 chars],,de,'Ukraine'
https://www.zeit.de/wirtschaft/2023-09/energie-bundesnetzagentur-gasversorgung-winter,https://www.zeit.de/wirtschaft/2023-09/energie-bundesnetzagentur-gasversorgung-winter,0,www.zeit.de,Energie: Gasversorgung laut Netzagentur besser als vor vergangenem Winter,"Der Präsident der Bundesnetzagentur zeigt sich optimistisch, bevor es in Deutschland kälter wird. Industrie wie Privathaushalte würden Energie sparsam nutzen.",,2023-09-21T04:49:15Z,,"When browsing with ads:
We collect personal data and also transmit it to third-party providers
 that help us improve and finance our digital content. Some of the information stored on your device, … [+821 chars]",,de,'Industrie'
https://www.tagesspiegel.de/wirtschaft/konnen-auch-einen-leicht-kalten-winter-bewaltigen-deutschland-laut-netzagentur-bei-gasversorgung-in-besserer-situation-als-vor-einem-jahr-10503223.html,https://www.tagesspiegel.de/wirtschaft/konnen-auch-einen-leicht-kalten-winter-bewaltigen-deutschland-laut-netzagentur-bei-gasversorgung-in-besserer-situation-als-vor-einem-jahr-10503223.html,0,www.tagesspiegel.de,„Können auch einen leicht kalten Winter bewältigen“: Deutschland laut Netzagentur bei Gasversorgung in besserer Situation als vor einem Jahr,"Insbesondere der gesunkene Industrieverbrauch entspanne die Situation, so der Präsident der Behörde. Dennoch müsste auch in diesem Jahr wieder bewusst geheizt werden.",https://www.tagesspiegel.de/images/heizkraftwerk-lichterfelde3/alternates/BASE_16_9_W1400/heizkraftwerk-lichterfelde.jpeg,2023-09-21T05:20:03Z,,"Der Präsident der Bundesnetzagentur, Klaus Müller, sieht Deutschland mit Blick auf den bevorstehenden Winter bei der Gasversorgung in einer günstigeren Situation als vor einem Jahr. Wir sind schon op… [+2401 chars]",,de,'frieren'
https://www.focus.de/finanzen/news/gipfel-mit-minister-habeck-waermepumpe-deswegen-scheitert-die-deutsche-heizungswende_id_209370327.html,https://www.focus.de/finanzen/news/gipfel-mit-minister-habeck-waermepumpe-deswegen-scheitert-die-deutsche-heizungswende_id_209370327.html,0,www.focus.de,Gipfel mit Minister Habeck - Aus drei Gründen scheitert die deutsche Wärmepumpen-Wende,"Mit der Wärmepumpe sollen die Deutschen klimafreundlich heizen können. Totz des Beschluss des Heizungsgesetzes scheint die Nachfrage aber nicht zu steigen. Verbände schlagen daher Alarm, denn die Klimawende in den deutschen Heizungskellern steht vor einigen H…",https://p6.focus.de/img/fotos/id_187760300/waermepumpe.jpg?im=Crop%3D%280%2C288%2C3464%2C1732%29%3BResize%3D%281200%2C627%29&impolicy=perceptual&quality=mediumHigh&hash=e00f87defea391200d2200c7c53a17f388679b95a7223cc645f0c92f2028480b,2023-09-21T05:42:21Z,,"Mit der Wärmepumpe sollen die Deutschen klimafreundlich heizen können. Totz des Beschluss des Heizungsgesetzes scheint die Nachfrage aber nicht zu steigen. Verbände schlagen daher Alarm, denn die Kli… [+2908 chars]",,de,'heizen'
https://www.stern.de/wirtschaft/sanieren-und-daemmen--das-muessen-sie-jetzt-zum-thema-wissen-33839704.html,https://www.stern.de/wirtschaft/sanieren-und-daemmen--das-muessen-sie-jetzt-zum-thema-wissen-33839704.html,0,www.stern.de,Pflichten und Förderungen: Wie hilft der Staat bei der Dämmung meiner Immobilie? Alle Tipps zum Thema Sanierung,"Die Bundesregierung will die private Energiewende der Bürger voranbringen – und sorgt damit für Unsicherheit. Alles, was Sie jetzt zum Thema Sanieren und Dämmen wissen müssen.",https://image.stern.de/33843942/t/3R/v2/w1440/r1.7778/-/daemmen-heizungsgesetz.jpg,2023-09-21T09:59:00Z,,"21.09.2023, 11:59
 2 Min.
Die Bundesregierung will die private Energiewende der Bürger voranbringen und sorgt damit für Unsicherheit. Alles, was Sie jetzt zum Thema Sanieren und Dämmen wissen müsse… [+375 chars]",,de,'Energie'
https://www.zeit.de/news/2023-09/21/lindner-fuer-verlaengerung-der-strompreisbremsen,https://www.zeit.de/news/2023-09/21/lindner-fuer-verlaengerung-der-strompreisbremsen,0,www.zeit.de,Energie: Lindner für Verlängerung der Strompreisbremsen,,,2023-09-21T10:12:46Z,,"When browsing with ads:
We collect personal data and also transmit it to third-party providers
 that help us improve and finance our digital content. Some of the information stored on your device, … [+821 chars]",,de,'Energie'
https://www.stern.de/news/bundesnetzagentur-probt-ernstfall-einer-gasmangellage-in-diesem-winter-33847208.html,https://www.stern.de/news/bundesnetzagentur-probt-ernstfall-einer-gasmangellage-in-diesem-winter-33847208.html,0,www.stern.de,Bundesnetzagentur probt Ernstfall einer Gasmangellage in diesem Winter,"Die Bundesnetzagentur probt den Ernstfall einer Gasmangellage in diesem Winter. Die Krisenübung zur Gasversorgung in Deutschland begann am Donnerstagmorgen, wie die Bonner Behörde mitteilte. Zwar sei Deutschland für diesen Winter ""deutlich besser vorbereitet …",https://image.stern.de/33847210/t/9G/v1/w1440/r1.7778/-/21--gasflamme---1f9e143dc111abd8.jpg,2023-09-21T10:27:41Z,,"Die Bundesnetzagentur probt den Ernstfall einer Gasmangellage in diesem Winter. Die Krisenübung zur Gasversorgung in Deutschland begann am Donnerstagmorgen, wie die Bonner Behörde mitteilte. Zwar sei… [+2817 chars]",,de,'Winter'
https://www.faz.net/aktuell/wirtschaft/klima-nachhaltigkeit/lindner-fuer-verlaengerung-der-strompreisbremsen-bis-fruehjahr-2024-19190093.html,https://www.faz.net/aktuell/wirtschaft/klima-nachhaltigkeit/lindner-fuer-verlaengerung-der-strompreisbremsen-bis-fruehjahr-2024-19190093.html,0,www.faz.net,Lindner für Verlängerung der Strompreisbremsen bis zum Frühjahr,"Die gedeckelten Preise für Strom und Gas laufen theoretisch Ende des Jahres aus, doch die Zeichen stehen auf Verlängerung. Trotzdem könnte Gas wieder teurer werden.",https://media1.faz.net/ppmedia/aktuell/wirtschaft/4185457758/1.9190119/facebook_teaser/finanzminister-christian.jpg,2023-09-21T10:40:44Z,,"Bundesfinanzminister Christian Lindner (FDP) hat sich für die Verlängerung der Strompreisbremsen bis Ende April 2024 ausgesprochen, zugleich aber die Wiederanhebung der Mehrwertsteuer auf Erdgas bere… [+2376 chars]",,de,'Gas'
https://stadt-bremerhaven.de/ikea-vappeby-neuer-bluetooth-lautsprecher-mit-spotify-anbindung/,https://stadt-bremerhaven.de/ikea-vappeby-neuer-bluetooth-lautsprecher-mit-spotify-anbindung/,0,stadt-bremerhaven.de,IKEA VAPPEBY: Neuer Bluetooth-Lautsprecher mit Spotify-Anbindung,"IKEA hat sein neues Launch Book für den Winter 2023 vorgestellt. Zahlreiche Produkte sind drin, darunter auch neue Bluetooth-Lautsprecher. Unter den Neuheiten findet sich auch der neue VAPPEBY. Unter dem Namen gibt es bereits eine Produktfamilie, der neue Lau…",https://stadt-bremerhaven.de/wp-content/uploads/2023/09/vappeby-ikea-2023-2.jpg,2023-09-21T10:46:20Z,,"IKEA hat sein neues Launch Book für den Winter 2023 vorgestellt. Zahlreiche Produkte sind drin, darunter auch neue Bluetooth-Lautsprecher. Unter den Neuheiten findet sich auch der neue VAPPEBY. Unter… [+1054 chars]",,de,'Winter'
https://www.zeit.de/video/2023-09/6337546798112/krieg-in-der-ukraine-offenbar-mehrere-menschen-durch-russische-luftangriffe-verletzt,https://www.zeit.de/video/2023-09/6337546798112/krieg-in-der-ukraine-offenbar-mehrere-menschen-durch-russische-luftangriffe-verletzt,0,www.zeit.de,Krieg in der Ukraine: Offenbar mehrere Menschen durch russische Luftangriffe verletzt,"Laut ukrainischen Angaben wurden mehrere Städte erneut von russischen Raketen getroffen. Mehrere Menschen sollen verletzt worden sein, darunter ein neunjähriges Mädchen.",,2023-09-21T11:02:29Z,,"When browsing with ads:
We collect personal data and also transmit it to third-party providers
 that help us improve and finance our digital content. Some of the information stored on your device, … [+821 chars]",,de,'Krieg'
https://www.tagesschau.de/wirtschaft/verbraucher/energiepreisbremsen-lindner-100.html,https://www.tagesschau.de/wirtschaft/verbraucher/energiepreisbremsen-lindner-100.html,0,www.tagesschau.de,Auch Lindner für verlängerte Strom- und Gaspreisbremse bis April 2024,"Finanzminister Christian Lindner hat sich für die Verlängerung der Energiepreisbremsen bis Ende April 2024 ausgesprochen. Zugleich fordert der FDP-Chef, dass die Mehrwertsteuer auf Erdgas wieder angehoben wird.",https://images.tagesschau.de/image/27490b5e-dbae-4084-b15f-70745391b222/AAABimRckMo/AAABibBxqrQ/16x9-1280/lindner-572.jpg,2023-09-21T11:35:02Z,,"Stand: 21.09.2023 13:35 Uhr
Finanzminister Christian Lindner hat sich für die Verlängerung der Energiepreisbremsen bis Ende April 2024 ausgesprochen. Zugleich fordert der FDP-Chef, dass die Mehrwert… [+2038 chars]",,de,'Gas'
https://www.zeit.de/politik/deutschland/2023-09/christian-lindner-energiepreisbremse-gas,https://www.zeit.de/politik/deutschland/2023-09/christian-lindner-energiepreisbremse-gas,0,www.zeit.de,Energiepreis: Christian Lindner für Verlängerung der Energiepreisbremse,Eine Fortsetzung der Energiepreisbremse scheint immer wahrscheinlicher: Auch der Bundesfinanzminister spricht sich dafür aus. Die Steuer auf Gas soll allerdings steigen.,,2023-09-21T11:58:25Z,,"When browsing with ads:
We collect personal data and also transmit it to third-party providers
 that help us improve and finance our digital content. Some of the information stored on your device, … [+821 chars]",,de,'Energie'
https://www.zeit.de/news/2023-09/21/umstrittenes-akw-temelin-verlaengert-brennelemente-zyklus,https://www.zeit.de/news/2023-09/21/umstrittenes-akw-temelin-verlaengert-brennelemente-zyklus,0,www.zeit.de,Energie: Umstrittenes AKW Temelin verlängert Brennelemente-Zyklus,,,2023-09-21T12:58:21Z,,"When browsing with ads:
We collect personal data and also transmit it to third-party providers
 that help us improve and finance our digital content. Some of the information stored on your device, … [+821 chars]",,de,'Energie'
https://www.focus.de/deals/shopping-deal-mit-focus-online-ist-ihr-auto-winterfit-batterie-ladegeraet-und-weitere-tools-fuer-ihr-sicheres-kfz_id_209488575.html,https://www.focus.de/deals/shopping-deal-mit-focus-online-ist-ihr-auto-winterfit-batterie-ladegeraet-und-weitere-tools-fuer-ihr-sicheres-kfz_id_209488575.html,0,www.focus.de,Shopping-Deal mit FOCUS online - Ist Ihr Auto winterfit? Batterie-Ladegerät und weitere Tools für Ihr sicheres Kfz,"Kaum wird es draußen kälter, springt das Auto nicht mehr an. Besonders im Winter sind Autopannen sehr ärgerlich und wären vermeidbar, denn oft hindert eine leere Autobatterie am Losfahren. Damit Sie im Ernstfall für alle Eventualitäten gerüstet sind, haben wi…",https://p6.focus.de/img/fotos/id_210097621/mannesmann-header-fol.jpg?im=Crop%3D%2886%2C0%2C1028%2C514%29%3BResize%3D%281200%2C627%29&impolicy=perceptual&quality=mediumHigh&hash=b3f12c16d53b92d6b0b581a963360645f75c663bbf47258046fc468d3be6a0db,2023-09-21T14:24:03Z,,"<ul><li>
Kommentare</li><li>
E-Mail</li><li>
Teilen</li><li>
Mehr</li><li>
Twitter</li><li>
Drucken</li><li>
Feedback</li><li>
Fehler meldenSie haben einen Fehler gefunden?
Bitte markieren S… [+7826 chars]",,de,'Winter'
https://www.morgenpost.de/ratgeber/article239592129/heizung-waermepumpe-oelheizung-heizoel-verbrauch-reduzieren.html,https://www.morgenpost.de/ratgeber/article239592129/heizung-waermepumpe-oelheizung-heizoel-verbrauch-reduzieren.html,0,www.morgenpost.de,Idee einer Hybridheizung : Heizung: Tüftler senkt Verbrauch von Heizöl drastisch,Im Altbau kann die Hybridheizung eine kostensparende Alternative sein. Doch wie geht man vor? Ein Tüftler legt seine Taktik offen.,https://img.morgenpost.de/img/frontpage/crop237315825/0662609979-w820-cv16_9-q85/OElheizung-erneuern-Diese-Teile-koennen-ausgetauscht-werden.jpg,2023-09-21T14:45:00Z,https://web.archive.org/web/20230921151841/https://www.morgenpost.de/ratgeber/article239592129/heizung-waermepumpe-oelheizung-heizoel-verbrauch-reduzieren.html,"Berlin. <ul><li>Deutschland befindet sich inmitten einer größeren Umstellung auf erneuerbare Energien</li><li>Ein Tüftler hat ein neues System entwickelt, um den Ölverbrauch seiner Ölheizung drastisc… [+7081 chars]",,de,'Dämmung'
https://www.zeit.de/news/2023-09/21/studie-empfiehlt-vier-neue-pumpspeicherkraftwerke-im-harz,https://www.zeit.de/news/2023-09/21/studie-empfiehlt-vier-neue-pumpspeicherkraftwerke-im-harz,0,www.zeit.de,Energie und Trinkwasser: Studie empfiehlt vier neue Pumpspeicherkraftwerke im Harz,,,2023-09-21T15:07:12Z,,"When browsing with ads:
We collect personal data and also transmit it to third-party providers
 that help us improve and finance our digital content. Some of the information stored on your device, … [+821 chars]",,de,'Energie'
https://www.zeit.de/politik/ausland/2023-09/bergkarabach-aserbaidschan-armenien-konflikt-verhandlungen,https://www.zeit.de/politik/ausland/2023-09/bergkarabach-aserbaidschan-armenien-konflikt-verhandlungen,0,www.zeit.de,Bergkarabach: Es ist nicht vorbei!,"In Bergkarabach hat die internationale Gemeinschaft noch eine letzte Chance, das Schlimmste zu verhindern – und die Ausweitung zu einem größeren Krieg.",,2023-09-21T18:01:18Z,,"When browsing with ads:
We collect personal data and also transmit it to third-party providers
 that help us improve and finance our digital content. Some of the information stored on your device, … [+821 chars]",,de,'Krieg'
https://www.dw.com/de/ukraine-selenskyj-wirbt-in-washington-um-weitere-waffenhilfe/a-66879724,https://www.dw.com/de/ukraine-selenskyj-wirbt-in-washington-um-weitere-waffenhilfe/a-66879724,0,www.dw.com,Ukraine: Selenskyj wirbt in Washington um weitere Waffenhilfe,"Unter den Republikanern im US-Kongress gibt es Widerstand gegen die Unterstützung der Ukraine. Der Frachter ""Resilient Africa"" bringt 3000 Tonnen Weizen aus der Ukraine in die Türkei. Ein Überblick. Das Wichtigste in Kürze:




Selenskyj wirbt in Washington u…",https://static.dw.com/image/66887139_6.jpg,2023-09-21T18:07:00Z,,"Das Wichtigste in Kürze:
<ul><li>Selenskyj wirbt in Washington um weitere Waffenhilfe</li><li>Getreideschiff aus der Ukraine erreicht Istanbul</li><li>Energieeinrichtungen wieder unter russischem Be… [+13991 chars]",,de,'Ukraine'
https://www.welt.de/politik/ausland/article247592154/Ukraine-News-Polen-Aussagen-ueber-Stopp-von-Waffenlieferungen-missverstanden.html,https://www.welt.de/politik/ausland/article247592154/Ukraine-News-Polen-Aussagen-ueber-Stopp-von-Waffenlieferungen-missverstanden.html,0,www.welt.de,Polens sieht Aufregung über Morawieckis Waffenhilfe-Aussage als Missverständnis,Polen ist eng mit der Ukraine verbündet. Eine Aussage von Polens Regierungschef Morawiecki zu einem möglichen Stopp der Waffenlieferungen sorgte für Verwirrung. Jetzt heißt es: Die Aussagen wurden missverstanden. Mehr im Live-Ticker.,https://img.welt.de/img/politik/ausland/mobile247608466/3791355757-ci16x9-w1200/United-Nations-Security-Council-on-the-crisis-in-Ukraine-at-U-N.jpg,2023-09-21T18:30:00Z,,Polens Präsident Andrzej Duda hat die Irritationen um einen möglichen Stopp polnischer Waffenlieferungen an die Ukraine als Missverständnis bezeichnet. Die Äußerungen von Regierungschef Mateusz Moraw… [+25412 chars],,de,'Ukraine'
https://www.morgenpost.de/politik/article239634747/ukraine-krieg-polen-wahlkampf-waffen-lieferungen-irritationen.html,https://www.morgenpost.de/politik/article239634747/ukraine-krieg-polen-wahlkampf-waffen-lieferungen-irritationen.html,0,www.morgenpost.de,Rüstungshilfe: Polen irritiert mit Äußerung zu Waffenlieferungen an Ukraine,"Im Verhältnis zwischen Polen und der Ukraine kriselt es gewaltig. Es geht um Getreide, Bauern-Interessen und eine bevorstehende Wahl.",https://img.morgenpost.de/img/incoming/crop239635461/6872607904-w820-cv16_9-q85/wolodymyr-selenskyj-mateusz-morawiecki.jpg,2023-09-21T19:17:00Z,,Berlin. Eigentlich hat der ukrainische Präsident Wolodymyr Selenskyj schon genug Kummer. Die Offensive seiner Truppen gegen die russischen Aggressoren im Osten des Landes kommt nur langsam voran. Imm… [+6048 chars],,de,'Ukraine'
https://www.morgenpost.de/politik/article239633509/polen-wahlkampf-ukraine-streit-putin-freude.html,https://www.morgenpost.de/politik/article239633509/polen-wahlkampf-ukraine-streit-putin-freude.html,0,www.morgenpost.de,Kommentar: Polen: Wladimir Putin dürfte vor Freude in die Luft springen,"Polens Premier Morawiecki zeigt, dass ihm die eigene Macht wichtiger ist als das Wohl des Landes. Er leistet sich Affront gegenüber der Ukraine und den westlichen Partnern.",https://img.morgenpost.de/img/politik/crop239633505/4092608005-w820-cv16_9-q85/61ea04f2-5874-11ee-95c9-f2de4e698504.jpg,2023-09-21T19:18:48Z,,"Berlin. Im Wahlkampf sind Politiker mitunter von allen guten Geistern verlassen. Um eines kurzfristigen Vorteils willen sagen sie dann Dinge, die auf mittlere Sicht einen enormen Schaden anrichten kö… [+1793 chars]",,de,'Wladimir Putin'
https://www.dw.com/de/ukraine-aktuell-selenskyj-dankt-f%C3%BCr-beistand-an-575-tagen/a-66892149,https://www.dw.com/de/ukraine-aktuell-selenskyj-dankt-f%C3%BCr-beistand-an-575-tagen/a-66892149,0,www.dw.com,"Ukraine aktuell: Selenskyj dankt für Beistand ""an 575 Tagen""",Der ukrainische Präsident unternimmt in Washington eine heikle Mission - während der Rückhalt für die US-Militärhilfen in den Reihen der Opposition bröckelt. Der Nachrichtenüberblick.,https://static.dw.com/image/66892232_6.jpg,2023-09-22T02:42:00Z,,"Das Wichtigste in Kürze:
<ul><li>Selenskyj dankt den USA für solidarische Hilfe</li><li>Polens Präsident fordert Deeskalation im Getreidestreit</li><li>Europäische Investitionsbank will keine Militä… [+6519 chars]",,de,'Ukraine'
