index,url,valid,domain,title,description,image,published,archive,content,quote,language,keyword
https://www.n-tv.de/politik/19-39-Selenskyj-USA-senden-20-000-fuer-Ukraine-bestimmte-Raketen-in-Nahen-Osten--article23143824.html,https://www.n-tv.de/politik/19-39-Selenskyj-USA-senden-20-000-fuer-Ukraine-bestimmte-Raketen-in-Nahen-Osten--article23143824.html,0,www.n-tv.de,Ukraine-Krieg im Liveticker: +++ 19:39 Selenskyj: USA senden 20.000 für Ukraine bestimmte Raketen in Nahen Osten +++,Lesen Sie alle aktuellen Entwicklungen und Nachrichten über den russischen Angriffskrieg auf die Ukraine im Liveticker von ntv.de.,https://www.n-tv.de/img/incoming/crop25117070/8311326854-cImg_16_9-w1200/Ukraine-Liveticker.jpg,2025-06-07T22:03:00Z,,Die Ukraine hat nach den Worten von Präsident Wolodymyr Selenskyj vergeblich auf 20.000 von den USA zugesagte Raketen gewartet. Die Raketen seien zur Bekämpfung von russischen Shahed-Drohnen vorgeseh… [+20770 chars],,de,'Wladimir Putin'
https://www.n-tv.de/politik/Kiew-beklagt-fehlende-Namensliste-vor-geplantem-Gefangenenaustausch--article23143824.html,https://www.n-tv.de/politik/Kiew-beklagt-fehlende-Namensliste-vor-geplantem-Gefangenenaustausch--article23143824.html,0,www.n-tv.de,Ukraine-Krieg im Liveticker: +++ Kiew beklagt fehlende Namensliste vor geplantem Gefangenenaustausch +++,Lesen Sie alle aktuellen Entwicklungen und Nachrichten über den russischen Angriffskrieg auf die Ukraine im Liveticker von ntv.de.,https://www.n-tv.de/img/incoming/crop25117070/8311326854-cImg_16_9-w1200/Ukraine-Liveticker.jpg,2025-06-07T22:03:00Z,,"Vor einem geplanten Gefangenenaustausch mit Russland beklagt die Ukraine das Fehlen einer Namensliste. Eine vollständige Liste von Russland mit mehr als Tausend Namen, wie bei den Verhandlungen in Is… [+23876 chars]",,de,'Wladimir Putin'
https://www.n-tv.de/politik/23-16-Kiew-vor-Gipfeln-von-G7-und-Nato-Viel-haengt-von-Entschlossenheit-Europas-ab--article25821813.html,https://www.n-tv.de/politik/23-16-Kiew-vor-Gipfeln-von-G7-und-Nato-Viel-haengt-von-Entschlossenheit-Europas-ab--article25821813.html,0,www.n-tv.de,"Ukraine-Krieg im Liveticker: +++ 23:16 Kiew vor Gipfeln von G7 und Nato: ""Viel hängt von Entschlossenheit Europas ab"" +++",Lesen Sie alle aktuellen Entwicklungen und Nachrichten über den russischen Angriffskrieg auf die Ukraine im Liveticker von ntv.de.,https://www.n-tv.de/img/incoming/crop25117070/8311326854-cImg_16_9-w1200/Ukraine-Liveticker.jpg,2025-06-07T22:07:00Z,,"Mit Blick auf die im Juni bevorstehenden Gipfeltreffen der G7 in Kanada und der Nato in den Niederlanden fordert der ukrainische Präsident Selenskyj mehr Entschlossenheit Europas. ""Wir müssen den Dru… [+24550 chars]",,de,'Krieg'
https://www.zeit.de/news/2025-06/08/demonstranten-in-israel-fordern-ende-des-gaza-kriegs,https://www.zeit.de/news/2025-06/08/demonstranten-in-israel-fordern-ende-des-gaza-kriegs,0,www.zeit.de,Gaza-Krieg: Demonstranten in Israel fordern Ende des Gaza-Kriegs,Hier finden Sie Informationen zu dem Thema „Gaza-Krieg“. Lesen Sie jetzt „Demonstranten in Israel fordern Ende des Gaza-Kriegs“.,https://img.zeit.de/news/2025-06/08/demonstranten-in-israel-fordern-ende-des-gaza-kriegs-image-group/wide__1300x731,2025-06-07T22:54:59Z,,Tausende Menschen haben am Abend in mehreren Städten Israels gegen die Regierung von Ministerpräsident Benjamin Netanjahu protestiert und die Freilassung der Geiseln in Gaza aus der Gewalt islamistis… [+1425 chars],,de,'Krieg'
https://www.zeit.de/news/2025-06/08/linnemann-bei-buergergeld-umbau-an-die-substanz-gehen,https://www.zeit.de/news/2025-06/08/linnemann-bei-buergergeld-umbau-an-die-substanz-gehen,0,www.zeit.de,"Soziales: Linnemann: Bei Bürgergeld-Umbau ""an die Substanz gehen""","Hier finden Sie Informationen zu dem Thema „Soziales“. Lesen Sie jetzt „Linnemann: Bei Bürgergeld-Umbau ""an die Substanz gehen""“.",https://img.zeit.de/news/2025-06/08/linnemann-bei-buergergeld-umbau-an-die-substanz-gehen-image-group/wide__1300x731,2025-06-08T02:00:45Z,,CDU-Generalsekretär Carsten Linnemann dringt auf tiefgreifende Veränderungen beim vereinbarten Umbau des Bürgergelds in der schwarz-roten Koalition. «Wir müssen wirklich an die Substanz des Systems g… [+1725 chars],,de,'Unterstützung'
https://www.tagesspiegel.de/politik/streit-um-reform-des-burgergelds-linnemann-will-beim-umbau-an-die-substanz-gehen--spd-blockt-13821157.html,https://www.tagesspiegel.de/politik/streit-um-reform-des-burgergelds-linnemann-will-beim-umbau-an-die-substanz-gehen--spd-blockt-13821157.html,0,www.tagesspiegel.de,Streit um Reform des Bürgergelds: Linnemann will beim Umbau „an die Substanz gehen“ – SPD blockt,"Das Unterstützungssystem des Staates soll umgestaltet werden, so hat es sich die Regierung vorgenommen. Kritik an neuen Aussagen des CDU-Generalsekretärs kommt aus den Reihen des Koalitionspartners.",https://www.tagesspiegel.de/images/13821160/alternates/BASE_16_9_W1400/1749397388000/cdu-generalsekretar-linnemann.jpeg,2025-06-08T02:02:00Z,,Dissens in der Koaltion: CDU-Generalsekretär Carsten Linnemann dringt auf tiefgreifende Veränderungen beim vereinbarten Umbau des Bürgergelds in der schwarz-roten Koalition. Wir müssen wirklich an di… [+5413 chars],,de,'Bürgergeld'
https://www.tagesspiegel.de/politik/reform-des-sozialsystems-linnemann-will-bei-burgergeld-umbau-an-die-substanz-gehen-13821157.html,https://www.tagesspiegel.de/politik/reform-des-sozialsystems-linnemann-will-bei-burgergeld-umbau-an-die-substanz-gehen-13821157.html,0,www.tagesspiegel.de,Geplante Reform des Sozialsystems: Linnemann will bei Bürgergeld-Umbau „an die Substanz gehen“,"Das umstrittene Unterstützungssystem des Bürgergelds soll umgestaltet werden, so hat es sich die neue Regierung vorgenommen. Kommt eine weitreichende Reform zustande?",https://www.tagesspiegel.de/images/13821160/alternates/BASE_16_9_W1400/1749348179000/cdu-generalsekretar-linnemann.jpeg,2025-06-08T02:02:00Z,,CDU-Generalsekretär Carsten Linnemann dringt auf tiefgreifende Veränderungen beim vereinbarten Umbau des Bürgergelds in der schwarz-roten Koalition. Wir müssen wirklich an die Substanz des Systems ge… [+2130 chars],,de,'Bürgergeld'
https://www.tagesschau.de/inland/innenpolitik/buergergeld-reform-debatte-100.html,https://www.tagesschau.de/inland/innenpolitik/buergergeld-reform-debatte-100.html,0,www.tagesschau.de,CDU-Generalsekretär Linnemann will tiefgreifende Bürgergeld-Reform,"Dass das Bürgergeld reformiert werden soll, ist beschlossene Sache. Doch die Umsetzung birgt Konfliktpotenzial zwischen Union und SPD. CDU-Generalsekretär Linnemann fordert eine umfassende Reform und sogar den Stopp von Zahlungen.",https://images.tagesschau.de/image/8606addd-a44d-4c29-957a-333ea1dfc4a6/AAABl048uYw/AAABkZLhkrw/16x9-1280/linnemann-148.jpg,2025-06-08T07:42:06Z,,"Stand: 08.06.2025 09:42 Uhr
Dass das Bürgergeld reformiert werden soll, ist beschlossene Sache. Doch die Umsetzung birgt Konfliktpotenzial zwischen Union und SPD. CDU-Generalsekretär Linnemann forde… [+3606 chars]",,de,'Bürgergeld'
https://www.tagesspiegel.de/politik/grosser-psychologischer-effekt-russen-sollen-jeden-zehnten-strategischen-bomber-verloren-haben-13821490.html,https://www.tagesspiegel.de/politik/grosser-psychologischer-effekt-russen-sollen-jeden-zehnten-strategischen-bomber-verloren-haben-13821490.html,0,www.tagesspiegel.de,„Großer psychologischer Effekt“: Russen sollen jeden zehnten strategischen Bomber verloren haben,Der Chef des Ukraine-Stabes der Bundeswehr beziffert die Verluste von Putins Luftwaffe durch die „Operation Spinnennetz“ niedriger als zunächst von Kiew angegeben. Dennoch sei es ein Erfolg.,https://www.tagesspiegel.de/images/12405734/alternates/BASE_16_9_W1400/1749371898000/generalmajor-freuding.jpeg,2025-06-08T09:09:49Z,,Mit einem massiven Drohnenangriff auf Luftwaffenstützpunkte in Russland hatte die Ukraine am vergangenen Wochenende weltweit Aufsehen erregt. Es war ein bisher beispielloser Schlag gegen die Armee vo… [+6196 chars],,de,'Ukraine'
https://www.zeit.de/news/2025-06/08/russland-wartet-auf-abnahme-von-1-212-toten-ukrainern,https://www.zeit.de/news/2025-06/08/russland-wartet-auf-abnahme-von-1-212-toten-ukrainern,0,www.zeit.de,Krieg in der Ukraine: Russland wartet auf Abnahme von 1.212 toten Ukrainern,Hier finden Sie Informationen zu dem Thema „Krieg in der Ukraine“. Lesen Sie jetzt „Russland wartet auf Abnahme von 1.212 toten Ukrainern“.,https://img.zeit.de/news/2025-06/08/russland-wartet-auf-abnahme-von-1-212-toten-ukrainern-image-group/wide__1300x731,2025-06-08T10:15:47Z,,Russische Vertreter warten nach eigenen Angaben weiter mit 1.212 gekühlten Überresten gefallener Soldaten in Lastwagen nahe der ukrainischen Grenze und fordern die Abnahme der Toten. Die russische Se… [+2403 chars],,de,'Ukraine'
https://www.zeit.de/politik/deutschland/2025-06/buergergeld-umbau-carsten-linnemann-sozialpolitik,https://www.zeit.de/politik/deutschland/2025-06/buergergeld-umbau-carsten-linnemann-sozialpolitik,0,www.zeit.de,"Bürgergeld-Umbau: Linnemann will ""wirklich an die Substanz"" des Bürgergeldsystems gehen","Der CDU-Generalsekretär Carsten Linnemann fordert einen Paradigmenwechsel beim Bürgergeld. Es sei eine ""Chiffre für Ungerechtigkeit in Deutschland"" geworden, sagt er.",https://img.zeit.de/politik/deutschland/2025-06/cdu-generalsekretaer-carsten-linnemann-buergergeld-reform-bild/wide__1300x731,2025-06-08T10:33:58Z,,"Der CDU-Generalsekretär Carsten Linnemann möchte das Bürgergeld tiefgreifend reformieren. ""Wir müssen wirklich an die Substanz des Systems gehen"", sagte er der Deutschen Presse-Agentur. ""Wir können n… [+1539 chars]",,de,'Bürgergeld'
https://www.faz.net/aktuell/wirtschaft/unternehmen/grillen-woher-kommt-die-kohle-110511119.html,https://www.faz.net/aktuell/wirtschaft/unternehmen/grillen-woher-kommt-die-kohle-110511119.html,0,www.faz.net,Nachhaltigkeit: Holzkohle im Schatten von Gas und Alternativen,"Nun werden sie wieder aus Kellern und Schuppen geholt: die Holzkohlegrills von Hobby-Würstchendrehern, Freizeit-Steakwendern und Halloumi-Grillern. Doch woher stammt die verwendete Kohle eigentlich?",https://media0.faz.net/ppmedia/aktuell/2567987975/1.10511118/facebook_teaser/noch-eine-bitte-thueringer.jpg,2025-06-08T12:10:06Z,,"Kaum ist es warm geworden, frönen die Deutschen wieder ihrer liebsten Freizeitbeschäftigung: Sie grillen. Die meisten Menschen setzen dabei noch auf Holzkohle, die dem Grillgut das holzig-rauchige Ar… [+5477 chars]",,de,'Import'
https://www.faz.net/aktuell/wirtschaft/nach-bas-interview-debatte-um-das-buergergeld-spitzt-sich-zu-110525279.html,https://www.faz.net/aktuell/wirtschaft/nach-bas-interview-debatte-um-das-buergergeld-spitzt-sich-zu-110525279.html,0,www.faz.net,Debatte um das Bürgergeld spitzt sich zu,In der SPD wird offen über eine Einwanderung in die Sozialsysteme gesprochen. Bundessozialministerin Bärbel Bas will sie eindämmen und erhält Unterstützung aus der Partei. Auch CDU-Generalsekretär sucht eine Annäherung.,https://www.faz.net/faz-share-logo.jpg,2025-06-08T13:44:44Z,,"Für die Bekämpfung von Bürgergeld-Missbrauch erhält Bundesarbeitsministerin Bärbel Bas (SPD) Unterstützung. Es gebe eine Einwanderung in die Sozialsysteme, sagte die Oberbürgermeisterin von Gelsenkir… [+4130 chars]",,de,'Bürgergeld'
https://www.bild.de/politik/ausland-und-internationales/ukraine-gewinnt-luftkampf-f-16-schiesst-putins-super-jet-ab-6845402deaf9b317dbcfcc59,https://www.bild.de/politik/ausland-und-internationales/ukraine-gewinnt-luftkampf-f-16-schiesst-putins-super-jet-ab-6845402deaf9b317dbcfcc59,0,www.bild.de,Schlacht gegen westlichen Flieger - Historisch! Putins Mega-Jet verliert Luftkampf,Historischer Luftkampf-Sieg für die Ukraine! Erstmals in der Geschichte hat ein westliches Kampfflugzeug vom Typ F-16 eine russische Su-35 abgeschossen.,"https://images.bild.de/6845402deaf9b317dbcfcc59/5df7974aa033bf183a38c60048a23218,b94bef2a?w=1280",2025-06-08T14:27:09Z,,Historischer Luftkampf: Erstmals hat ein westliches F-16-Jet einen russischen Su-35 Super-Flanker abgeschossen. Der Mega-Jet von Wladimir Putin hat verloren und beschert dem russischen Diktator eine … [+170 chars],,de,'Ukraine'
https://www.stern.de/politik/deutschland/grundsicherung--spd-kritisiert-linnemanns-harten-buergergeld-kurs-35793034.html,https://www.stern.de/politik/deutschland/grundsicherung--spd-kritisiert-linnemanns-harten-buergergeld-kurs-35793034.html,0,www.stern.de,Grundsicherung: SPD kritisiert Linnemanns harten Bürgergeld-Kurs,"In der Koalition wird immer deutlicher, bei welchen Themen es knirschen könnte: Zurückweisungen an den Grenzen, AfD-Verbot - und auch beim Thema Bürgergeld droht Ärger zwischen Union und SPD.",https://image.stern.de/35793036/t/2Y/v1/w1440/r1.7778/-/08--7fstjedi7ov6axs2048jpeg---7596d1941c8d4a9e.jpg,2025-06-08T15:02:01Z,,"Kopiere den aktuellen Link
Zur Merkliste hinzufügen
In der Koalition wird immer deutlicher, bei welchen Themen es knirschen könnte: Zurückweisungen an den Grenzen, AfD-Verbot - und auch beim Thema … [+3842 chars]",,de,'Bürgergeld'
https://www.tagesspiegel.de/politik/grundsicherung-spd-kritisiert-linnemanns-harten-burgergeld-kurs-13822567.html,https://www.tagesspiegel.de/politik/grundsicherung-spd-kritisiert-linnemanns-harten-burgergeld-kurs-13822567.html,0,www.tagesspiegel.de,Grundsicherung: SPD kritisiert Linnemanns harten Bürgergeld-Kurs,"In der Koalition wird immer deutlicher, bei welchen Themen es knirschen könnte: Zurückweisungen an den Grenzen, AfD-Verbot - und auch beim Thema Bürgergeld droht Ärger zwischen Union und SPD.",https://www.tagesspiegel.de/images/13822564/alternates/BASE_16_9_W1400/1749394995000/burgergeldantrag-im-jobcenter-auf-einem-tablet.jpeg,2025-06-08T15:03:15Z,,Das Drängen von CDU-Generalsekretär Carsten Linnemann auf einen harten Kurs beim vereinbarten Umbau des Bürgergelds stößt beim Koalitionspartner SPD auf deutliche Kritik. Die Attacken auf den Sozials… [+3681 chars],,de,'Bürgergeld'
https://www.zeit.de/politik/deutschland/2025-06/spd-kritik-buergergeld-linnemann-reform,https://www.zeit.de/politik/deutschland/2025-06/spd-kritik-buergergeld-linnemann-reform,0,www.zeit.de,Bürgergeld-Debatte: SPD kritisiert Linnemanns Forderungen zum Bürgergeld,"Der CDU-Generalsekretär fordert eine drastische Reform des Bürgergelds. Man könne den Sozialstaat aber ""nicht einfach nach Kassenlage"" zusammenstreichen, kontert die SPD.",https://img.zeit.de/politik/deutschland/2025-06/spd-kritisiert-linnemanns-harten-buergergeld-kurs-bild/wide__1300x731,2025-06-08T17:12:47Z,,Die SPD hat mit Kritik auf den angestrebten harten Kurs von CDU-Generalsekretär Carsten Linnemann beim Umbau des Bürgergelds reagiert.  Der Sozialstaat sei das Fundament des Zusammenhalts in der Gese… [+678 chars],,de,'Bürgergeld'
https://www.stern.de/politik/ausland/wladimir-putin--seine-vier-ewigen-weisheiten-der-geschichte-35789728.html,https://www.stern.de/politik/ausland/wladimir-putin--seine-vier-ewigen-weisheiten-der-geschichte-35789728.html,0,www.stern.de,Geschichtsbild : Die vier ewigen Weisheiten des Wladimir Putin,"Wer Wladimir Putin heute verstehen, der muss in die Vergangenheit schauen. In die von Russlands Präsident. Genauso wie auf dessen Sicht der Geschichte. Das ist das Destillat.",https://image.stern.de/35792958/t/Yq/v1/w1440/r1.7778/-/wladimir-putin-russland.jpg,2025-06-08T18:04:00Z,,"Zugang zu stern+statt 11,96 
 nur 1",,de,'Wladimir Putin'
https://www.zeit.de/news/2025-06/08/spd-kritisiert-linnemanns-harten-buergergeld-kurs,https://www.zeit.de/news/2025-06/08/spd-kritisiert-linnemanns-harten-buergergeld-kurs,0,www.zeit.de,Grundsicherung: SPD kritisiert Linnemanns harten Bürgergeld-Kurs,Hier finden Sie Informationen zu dem Thema „Grundsicherung“. Lesen Sie jetzt „SPD kritisiert Linnemanns harten Bürgergeld-Kurs“.,https://img.zeit.de/news/2025-06/08/spd-kritisiert-linnemanns-harten-buergergeld-kurs-image-group/wide__1300x731,2025-06-08T18:31:25Z,,Das Drängen von CDU-Generalsekretär Carsten Linnemann auf einen harten Kurs beim vereinbarten Umbau des Bürgergelds stößt beim Koalitionspartner SPD auf deutliche Kritik. «Die Attacken auf den Sozial… [+3823 chars],,de,'Bürgergeld'
https://www.stern.de/politik/deutschland/buergergeld--linnemann-fordert-streichung-fuer-job-verweigerer---spd-empoert-35793200.html,https://www.stern.de/politik/deutschland/buergergeld--linnemann-fordert-streichung-fuer-job-verweigerer---spd-empoert-35793200.html,0,www.stern.de,Ärger in der Koalition: Linnemann fordert Bürgergeld-Streichung für Job-Verweigerer – SPD empört,"Mit seinen Aussagen zum Bürgergeld bringt Carsten Linnemann einige SPD-Politiker zur Weißglut. Es wird immer deutlicher, an welchen Punkten es in der Koalition knirschen könnte.",https://image.stern.de/35793202/t/hN/v2/w1440/r1.7778/-/carsten-linnemann-buergergeld.jpg,2025-06-08T20:01:00Z,,"Kopiere den aktuellen Link
Zur Merkliste hinzufügen
Mit seinen Aussagen zum Bürgergeld bringt Carsten Linnemann einige SPD-Politiker zur Weißglut. Es wird immer deutlicher, an welchen Punkten es in… [+3755 chars]",,de,'Bürgergeld'
https://www.n-tv.de/politik/11-50-Nato-Chef-Rutte-Luft-und-Raketenabwehr-um-400-Prozent-verstaerken--article23143824.html,https://www.n-tv.de/politik/11-50-Nato-Chef-Rutte-Luft-und-Raketenabwehr-um-400-Prozent-verstaerken--article23143824.html,0,www.n-tv.de,Ukraine-Krieg im Liveticker: +++ 11:50 Nato-Chef Rutte: Luft- und Raketenabwehr um 400 Prozent verstärken +++,Lesen Sie alle aktuellen Entwicklungen und Nachrichten über den russischen Angriffskrieg auf die Ukraine im Liveticker von ntv.de.,https://www.n-tv.de/img/incoming/crop25117070/8311326854-cImg_16_9-w1200/Ukraine-Liveticker.jpg,2025-06-08T22:03:00Z,,"Nato-Generalsekretär Mark Rutte fordert eine drastische Verstärkung der Verteidigungsfähigkeiten der Allianz. In einer Rede, die er im Laufe des Tages in London halten will, plädiert er dafür, die Lu… [+10492 chars]",,de,'Krieg'
https://www.n-tv.de/politik/14-24-Munz-Russlands-Vormarsch-bei-Sumy-ist-schneller-geworden--article23143824.html,https://www.n-tv.de/politik/14-24-Munz-Russlands-Vormarsch-bei-Sumy-ist-schneller-geworden--article23143824.html,0,www.n-tv.de,"Ukraine-Krieg im Liveticker: +++ 14:24 Munz: ""Russlands Vormarsch bei Sumy ist schneller geworden"" +++",Lesen Sie alle aktuellen Entwicklungen und Nachrichten über den russischen Angriffskrieg auf die Ukraine im Liveticker von ntv.de.,https://www.n-tv.de/img/incoming/crop25117070/8311326854-cImg_16_9-w1200/Ukraine-Liveticker.jpg,2025-06-08T22:03:00Z,,"An der Nordfront, in der Region Sumy, gelingen den russischen Streitkräften schnellere Geländegewinne als in den vergangenen Monaten zu beobachten war. Derweil streiten Moskau und Kiew weiter über de… [+14308 chars]",,de,'Saporischschja'
https://www.n-tv.de/politik/14-48-Moskau-und-Kiew-tauschen-Gefangene-aus--article23143824.html,https://www.n-tv.de/politik/14-48-Moskau-und-Kiew-tauschen-Gefangene-aus--article23143824.html,0,www.n-tv.de,Ukraine-Krieg im Liveticker: +++ 14:48 Moskau und Kiew tauschen Gefangene aus +++,Lesen Sie alle aktuellen Entwicklungen und Nachrichten über den russischen Angriffskrieg auf die Ukraine im Liveticker von ntv.de.,https://www.n-tv.de/img/incoming/crop25117070/8311326854-cImg_16_9-w1200/Ukraine-Liveticker.jpg,2025-06-08T22:03:00Z,,Russland und die Ukraine beginnen mit einem weiteren Gefangenenaustausch. Er wurde Anfang des Monats in Istanbul bei direkten Verhandlungen von Vertretern Kiews und Moskaus vereinbart. Die erste Grup… [+15435 chars],,de,'Wladimir Putin'
https://www.n-tv.de/politik/16-30-Russische-Eisenbahn-kuendigt-Direktzuege-zwischen-Moskau-und-Pjoengjang-an--article23143824.html,https://www.n-tv.de/politik/16-30-Russische-Eisenbahn-kuendigt-Direktzuege-zwischen-Moskau-und-Pjoengjang-an--article23143824.html,0,www.n-tv.de,Ukraine-Krieg im Liveticker: +++ 16:30 Russische Eisenbahn kündigt Direktzüge zwischen Moskau und Pjöngjang an +++,Lesen Sie alle aktuellen Entwicklungen und Nachrichten über den russischen Angriffskrieg auf die Ukraine im Liveticker von ntv.de.,https://www.n-tv.de/img/incoming/crop25117070/8311326854-cImg_16_9-w1200/Ukraine-Liveticker.jpg,2025-06-08T22:03:00Z,,"Der direkte Zugverkehr zwischen Moskau und Pjöngjang soll am 17. Juni wieder aufgenommen werden, berichtet die Russische Eisenbahn in einer Mitteilung. Zwei Tage später soll zudem eine Direktverbindu… [+18729 chars]",,de,'Wladimir Putin'
https://www.n-tv.de/politik/17-29-Joschka-Fischer-Personalbestand-der-Bundeswehr-ist-verdammt-niedrig--article23143824.html,https://www.n-tv.de/politik/17-29-Joschka-Fischer-Personalbestand-der-Bundeswehr-ist-verdammt-niedrig--article23143824.html,0,www.n-tv.de,"Ukraine-Krieg im Liveticker: +++ 17:29 Joschka Fischer: ""Personalbestand der Bundeswehr ist verdammt niedrig"" +++",Lesen Sie alle aktuellen Entwicklungen und Nachrichten über den russischen Angriffskrieg auf die Ukraine im Liveticker von ntv.de.,https://www.n-tv.de/img/incoming/crop25117070/8311326854-cImg_16_9-w1200/Ukraine-Liveticker.jpg,2025-06-08T22:03:00Z,,"Der frühere Außenminister Joschka Fischer von den Grünen spricht sich für eine Rückkehr zur Wehrpflicht aus. ""Ich bin der Meinung, dass wir wieder eine Wehrpflicht brauchen. Der Personalbestand der B… [+20562 chars]",,de,'Saporischschja'
https://www.n-tv.de/politik/12-25-Videos-sollen-Angriff-auf-russische-Waffen-Fabrik-zeigen--article23143824.html,https://www.n-tv.de/politik/12-25-Videos-sollen-Angriff-auf-russische-Waffen-Fabrik-zeigen--article23143824.html,0,www.n-tv.de,Ukraine-Krieg im Liveticker: +++ 12:25 Videos sollen Angriff auf russische Waffen-Fabrik zeigen +++,Lesen Sie alle aktuellen Entwicklungen und Nachrichten über den russischen Angriffskrieg auf die Ukraine im Liveticker von ntv.de.,https://www.n-tv.de/img/incoming/crop25117070/8311326854-cImg_16_9-w1200/Ukraine-Liveticker.jpg,2025-06-08T22:03:00Z,,"Im russischen Tscheboksary, unweit der Grenze zur Ukraine, wird ein Elektronikwerk von Drohnen angegriffen (siehe Einträge 11:08 und 06:43). Aufnahmen sollen die Attacke und anschließende Explosionen… [+10891 chars]",,de,'Wladimir Putin'
https://www.n-tv.de/politik/23-39-Selenskyj-plant-Schlaege-auf-alles-was-fuer-einen-Angriff-auf-die-Ukraine-arbeitet--article23143824.html,https://www.n-tv.de/politik/23-39-Selenskyj-plant-Schlaege-auf-alles-was-fuer-einen-Angriff-auf-die-Ukraine-arbeitet--article23143824.html,0,www.n-tv.de,"Ukraine-Krieg im Liveticker: +++ 23:39 Selenskyj plant Schläge ""auf alles, was für einen Angriff auf die Ukraine arbeitet"" +++",Lesen Sie alle aktuellen Entwicklungen und Nachrichten über den russischen Angriffskrieg auf die Ukraine im Liveticker von ntv.de.,https://www.n-tv.de/img/incoming/crop25117070/8311326854-cImg_16_9-w1200/Ukraine-Liveticker.jpg,2025-06-08T22:03:00Z,,"Der ukrainische Präsident Wolodymyr Selenskyj bespricht den Verlauf der aktuellen Ereignisse an der Front, die Aufstellung und Entwicklung von Truppen sowie Angriffe auf russische Militäreinrichtunge… [+26514 chars]",,de,'Ukraine'
https://www.n-tv.de/politik/18-40-Litauischer-Aussenminister-Unser-Zug-fuhr-durch-Raketen-und-Drohnenhagel--article23143824.html,https://www.n-tv.de/politik/18-40-Litauischer-Aussenminister-Unser-Zug-fuhr-durch-Raketen-und-Drohnenhagel--article23143824.html,0,www.n-tv.de,"Ukraine-Krieg im Liveticker: +++ 18:40 Litauischer Außenminister: ""Unser Zug fuhr durch Raketen- und Drohnenhagel"" +++",Lesen Sie alle aktuellen Entwicklungen und Nachrichten über den russischen Angriffskrieg auf die Ukraine im Liveticker von ntv.de.,https://www.n-tv.de/img/incoming/crop25117070/8311326854-cImg_16_9-w1200/Ukraine-Liveticker.jpg,2025-06-08T22:03:00Z,,"Kestutis Budrys, Außenminister Litauens, ist nach Kiew gereist. ""Heute Morgen musste unser Zug durch den Raketen- und Drohnenhagel fahren, der die Städte Rivne und Dubne traf"", berichtet er auf X. ""E… [+22524 chars]",,de,'Wladimir Putin'
https://www.telepolis.de/features/Buergergeld-Hammer-CDU-will-Totalumbau-es-geht-um-die-finanzielle-Existenz-von-MIllionen-10437395.html,https://www.telepolis.de/features/Buergergeld-Hammer-CDU-will-Totalumbau-es-geht-um-die-finanzielle-Existenz-von-MIllionen-10437395.html,0,www.telepolis.de,Bürgergeld-Hammer: CDU will Totalumbau – es geht um die finanzielle Existenz von MIllionen,"Die CDU plant eine radikale Reform des Bürgergeldes. Wer Jobs ablehnt, soll künftig leer ausgehen. Warum die Grundstruktur des Bürgergelds für Debatten sorgt.",https://heise.cloudimg.io/bound/1200x1200/q85.png-lossy-85.webp-lossy-85.foil1/_www-heise-de_/imgs/18/4/8/7/2/0/1/3/shutterstock_2226527453-e4562cffe58b4042.jpeg,2025-06-08T23:00:00Z,,"Bild: DesignRage/ Shutterstock.com
Die CDU plant eine radikale Reform des Bürgergeldes. Wer Jobs ablehnt, soll künftig leer ausgehen. Warum die Grundstruktur des Bürgergelds für Debatten sorgt.
Ukr… [+3990 chars]",,de,'Bürgergeld'
https://www.zeit.de/news/2025-06/09/aktivistenschiff-auf-dem-weg-nach-gaza-von-israel-gestoppt,https://www.zeit.de/news/2025-06/09/aktivistenschiff-auf-dem-weg-nach-gaza-von-israel-gestoppt,0,www.zeit.de,Gaza-Krieg: Aktivistenschiff auf dem Weg nach Gaza von Israel gestoppt,Hier finden Sie Informationen zu dem Thema „Gaza-Krieg“. Lesen Sie jetzt „Aktivistenschiff auf dem Weg nach Gaza von Israel gestoppt“.,https://img.zeit.de/administratives/sharing/fallback-image/wide__1300x731,2025-06-09T01:21:58Z,,Nach tagelanger Fahrt auf einem Segelschiff mit Hilfsgütern für die Menschen im Gazastreifen sind Greta Thunberg und weitere Aktivisten kurz vor ihrem Ziel von den israelischen Behörden gestoppt word… [+231 chars],,de,'Krieg'
