index,url,valid,domain,title,description,image,published,archive,content,quote,language,keyword
https://www.stern.de/politik/deutschland/brennpunkte-berlin--diese-massnahmen-sollen-die-stadt-sicherer-machen-33808506.html,https://www.stern.de/politik/deutschland/brennpunkte-berlin--diese-massnahmen-sollen-die-stadt-sicherer-machen-33808506.html,0,www.stern.de,"Kampfansage an die Brennpunkte: Gegen ""Angsträume"" in Berlin: Mit diesen Maßnahmen will Bürgermeister Wegner die Kriminalität bekämpfen","Der Görlitzer Park in Berlin-Kreuzberg macht vor allem wegen vieler Drogendealer regelmäßig in den Schlagzeilen. Bei einem Sicherheitsgipfel wurde nun beschlossen, wie der Park und die ganze Stadt sicherer werden sollen.",https://image.stern.de/33808534/t/_W/v1/w1440/r1.7778/-/berlin-buergermeister-kai-wegner.jpg,2023-09-08T15:17:00Z,https://web.archive.org/web/20230909122335/https://www.stern.de/politik/deutschland/brennpunkte-berlin--diese-massnahmen-sollen-die-stadt-sicherer-machen-33808506.html,"Der Görlitzer Park in Berlin-Kreuzberg macht vor allem wegen vieler Drogendealer regelmäßig in den Schlagzeilen. Bei einem Sicherheitsgipfel wurde nun beschlossen, wie der Park und die ganze Stadt si… [+1778 chars]",,de,'Sicherheit'
https://www.tagesspiegel.de/berlin/kriminalitat-und-drogen-in-berlin-kreuzberg-gorlitzer-park-soll-nachts-abgeschlossen-werden-10440799.html,https://www.tagesspiegel.de/berlin/kriminalitat-und-drogen-in-berlin-kreuzberg-gorlitzer-park-soll-nachts-abgeschlossen-werden-10440799.html,0,www.tagesspiegel.de,Kriminalität und Drogen in Berlin-Kreuzberg: Görlitzer Park soll nachts abgeschlossen werden,Auf einem Sicherheitsgipfel einigen sich Senat und Bezirke auf zahlreiche Maßnahmen gegen Kriminalität und Gewalt. Offene Fragen bleiben.,https://www.tagesspiegel.de/images/gorlitzer-park5/alternates/BASE_16_9_W1400/goerlitzer-park.jpeg,2023-09-08T15:31:35Z,https://web.archive.org/web/20230909030225/https://www.tagesspiegel.de/berlin/kriminalitat-und-drogen-in-berlin-kreuzberg-gorlitzer-park-soll-nachts-abgeschlossen-werden-10440799.html,"Um Drogenhandel und Kriminalität zurückzudrängen, soll der Görlitzer Park in Berlin-Kreuzberg zeitweise geschlossen werden. Ziel einer temporären Schließung, insbesondere zur Nachtzeit sei es, Betäub… [+4152 chars]",,de,'Sicherheit'
https://www.zeit.de/politik/ausland/2023-09/ukraine-ueberblick-wahlen-besetzte-gebiete-elon-musk-starlink,https://www.zeit.de/politik/ausland/2023-09/ukraine-ueberblick-wahlen-besetzte-gebiete-elon-musk-starlink,0,www.zeit.de,"Ukraine-Überblick: Wahlen in besetzten Gebieten, Elon Musk will Angriff verhindert haben",Bis Sonntag sollen die Menschen in vier illegal annektierten ukrainischen Gebieten Parlamente wählen. Elon Musk hatte offenbar indirekten Einfluss auf den Krieg. Der Tag,,2023-09-08T16:23:42Z,,"When browsing with ads:
We collect personal data and also transmit it to third-party providers
 that help us improve and finance our digital content. Some of the information stored on your device, … [+821 chars]",,de,'Ukraine'
https://www.tagesspiegel.de/berlin/wegners-sicherheitspaket-das-30-punkte-programm-vom-berliner-senat-und-den-bezirken-10440616.html,https://www.tagesspiegel.de/berlin/wegners-sicherheitspaket-das-30-punkte-programm-vom-berliner-senat-und-den-bezirken-10440616.html,0,www.tagesspiegel.de,Wegners Sicherheitspaket: Das 30-Punkte-Programm vom Berliner Senat und den Bezirken,"Mehr Polizei, feste Staatsanwälte für kriminalitätsbelastete Orte, mehr Drogenkonsummobile – so will der Berliner Senat die Stadt sicherer machen.",https://www.tagesspiegel.de/images/sicherheitsgipfel-des-senats-und-feuerwehr-kongress-zu-gewalt/alternates/BASE_16_9_W1400/sicherheitsgipfel-des-senats-und-feuerwehr-kongress-zu-gewalt.jpeg,2023-09-08T16:36:48Z,https://web.archive.org/web/20230909002428/https://www.tagesspiegel.de/berlin/wegners-sicherheitspaket-das-30-punkte-programm-vom-berliner-senat-und-den-bezirken-10440616.html,"Der Berliner Senat, Polizei, Feuerwehr und die Bezirke Friedrichshain-Kreuzberg und Mitte haben sich am Freitag beim Sicherheitsgipfel auf ein zehnseitiges Maßnahmenpaket geeinigt. 
Die PNN-App Aktu… [+6685 chars]",,de,'Sicherheit'
https://www.zeit.de/news/2023-09/08/getreidedeal-bringt-ein-un-angebot-moskau-zum-umdenken,https://www.zeit.de/news/2023-09/08/getreidedeal-bringt-ein-un-angebot-moskau-zum-umdenken,0,www.zeit.de,Krieg in der Ukraine: Getreidedeal: Bringt ein UN-Angebot Moskau zum Umdenken?,,,2023-09-08T16:45:44Z,https://web.archive.org/web/20230909111947/https://www.zeit.de/news/2023-09/08/getreidedeal-bringt-ein-un-angebot-moskau-zum-umdenken,"When browsing with ads:
We collect personal data and also transmit it to third-party providers
 that help us improve and finance our digital content. Some of the information stored on your device, … [+821 chars]",,de,'Krieg'
https://www.welt.de/politik/ausland/plus247370582/UN-Guterres-bietet-Russland-Erleichterung-von-Sanktionen-an-Kiew-empoert.html,https://www.welt.de/politik/ausland/plus247370582/UN-Guterres-bietet-Russland-Erleichterung-von-Sanktionen-an-Kiew-empoert.html,0,www.welt.de,„Ein unfassbarer Affront“ – UN-Angebot an Russland empört Kiew,"UN-Generalsekretär António Guterres hat Moskau Erleichterungen von Sanktionen angeboten, um das vom Kreml gekündigte Getreideabkommen zu retten. Der Vorstoß offenbart, in welchem Dilemma die Vereinten Nationen seit Ausbruch des Ukraine-Kriegs stecken.",https://img.welt.de/img/politik/ausland/mobile247371586/4481354517-ci16x9-w1200-fnov-fpotl-fpi157750653/U-N-Secretary-General-Meets-With-Russian-Foreign-Minister-Sergei-Lavrov-At-3.jpg,2023-09-08T17:10:06Z,https://web.archive.org/web/20230908184104/https://www.welt.de/politik/ausland/plus247370582/UN-Guterres-bietet-Russland-Erleichterung-von-Sanktionen-an-Kiew-empoert.html,"Die WELT als ePaper: Die vollständige Ausgabe steht Ihnen bereits am Vorabend zur Verfügung so sind Sie immer hochaktuell informiert. Weitere Informationen: http://epaper.welt.de 
 Der Kurz-Link die… [+49 chars]",,de,'Kreml'
https://www.jungewelt.de/artikel/458637.law-and-order-in-berlin-autoritäres-hauruck.html,https://www.jungewelt.de/artikel/458637.law-and-order-in-berlin-autoritäres-hauruck.html,0,www.jungewelt.de,Law and Order in Berlin: Autoritäres Hauruck,"»Sicherheitsgipfel« des Berliner Senats: Behörden werden gestärkt, der Zugang zu Grünflächen begrenzt • Foto: Paul Zinken/dpa",https://www.jungewelt.de/img/1100/185209.jpg,2023-09-08T17:40:37Z,https://web.archive.org/web/20230909032800/https://www.jungewelt.de/artikel/458637.law-and-order-in-berlin-autorit%C3%A4res-hauruck.html,"Videoüberwachung, Schließzeiten, Polizeikontrollen, Umzäunung das alles soll ausgewählte Grünflächen der Hauptstadt in Zukunft »sicherer« machen. Diese und weitere Maßnahmen wurden am Freitag bei ein… [+3428 chars]",,de,'Sicherheit'
https://www.tagesschau.de/ausland/asien/guterres-getreideabkommen-kompromissvorschlag-100.html,https://www.tagesschau.de/ausland/asien/guterres-getreideabkommen-kompromissvorschlag-100.html,0,www.tagesschau.de,UN bieten Russland Erleichterungen bei Dünger-Export an,"Medienberichten zufolge will UN-Generalsekretär den sanktionierten Export russischen Düngers wieder erleichtern. Ziel ist, den Kreml zu einer Rückkehr zum Getreideabkommen mit der Ukraine zu bewegen.",https://images.tagesschau.de/image/a6f35317-da15-4286-bcec-207281b00c9b/AAABinYOdtY/AAABibBxqrQ/16x9-1280/guterres-delhi-100.jpg,2023-09-08T18:29:34Z,https://web.archive.org/web/20230909154408/https://www.tagesschau.de/ausland/asien/guterres-getreideabkommen-kompromissvorschlag-100.html,"Stand: 08.09.2023 20:29 Uhr
Medienberichten zufolge will UN-Generalsekretär den sanktionierten Export russischen Düngers wieder erleichtern. Ziel ist, den Kreml zu einer Rückkehr zum Getreideabkomme… [+4133 chars]",,de,'Kreml'
https://www.tagesschau.de/newsticker/liveblog-ukraine-mittwoch-256.html,https://www.tagesschau.de/newsticker/liveblog-ukraine-mittwoch-256.html,0,www.tagesschau.de,Liveblog: ++ Russland meldet erneute Angriffe auf Brjansk ++,Der russische Regionalgouverneur Bogomas wirft der Ukraine erneute Attacken auf die Grenzstadt Brjansk vor. Die Internationale Atomenergiebehörde fordert erweiterten Zugang zur Anlage des AKW Saporischschja. Alle Entwicklungen im Liveblog.,https://images.tagesschau.de/image/5b073b67-29bf-4703-b6b1-71469e4c25bb/AAABinEp3YU/AAABibBxqrQ/16x9-1280/flagge-ukraine-truemmer-101.jpg,2023-09-08T20:08:48Z,https://web.archive.org/web/20230721232814/https://www.tagesschau.de/newsticker/liveblog-ukraine-mittwoch-256.html,"Stand: 08.09.2023 22:08 Uhr
Der russische Regionalgouverneur Bogomas wirft der Ukraine erneute Attacken auf die Grenzstadt Brjansk vor. Die Internationale Atomenergiebehörde fordert erweiterten Zuga… [+23250 chars]",,de,'Ukraine'
https://taz.de/Sicherheitsgipfel-des-Berliner-Senats/!5959049/,https://taz.de/Sicherheitsgipfel-des-Berliner-Senats/!5959049/,0,taz.de,Sicherheitsgipfel des Berliner Senats: Die schwarz-roten Zaunkönige,Beim Berliner Sicherheitsgipfel einigt man sich auf einen bunten Strauß Maßnahmen. Im Görlitzer Park findet derweil ein Anti-Gipfel statt.,https://taz.de/picture/6509801/948/IMG-7215-1.jpeg,2023-09-08T20:36:00Z,https://web.archive.org/web/20230909143556/https://taz.de/Sicherheitsgipfel-des-Berliner-Senats/!5959049/,"Beim Berliner Sicherheitsgipfel einigt man sich auf einen bunten Strauß Maßnahmen. Im Görlitzer Park findet derweil ein Anti-Gipfel statt.
Gefühlt Lichtjahre entfernt vom Roten Rathaus: Teilnehmerin… [+7428 chars]",,de,'Sicherheit'
https://www.kicker.de/gezeigt-was-wir-sehen-wollen-erleichterter-di-salvo-gibt-sich-zufrieden-967741/artikel,https://www.kicker.de/gezeigt-was-wir-sehen-wollen-erleichterter-di-salvo-gibt-sich-zufrieden-967741/artikel,0,www.kicker.de,"""Gezeigt, was wir sehen wollen"": Erleichterter Di Salvo gibt sich zufrieden","Mit einem größtenteils neuen Kader inklusive neuem Kapitän und einer Premiere zwischen den Pfosten ist der deutschen U-21-Nationalmannschaft der Test gegen die Ukraine gelungen. Trainer Antonio Di Salvo ist ""erleichtert"".","https://derivates.kicker.de/image/upload/c_crop,x_0,y_0,w_3000,h_1687/w_1200,q_auto/v1/2023/09/08/c96a6a14-ba4e-4abd-83e4-7edc427873ee.jpeg",2023-09-08T21:14:13Z,https://web.archive.org/web/20230909033428/https://www.kicker.de/gezeigt-was-wir-sehen-wollen-erleichterter-di-salvo-gibt-sich-zufrieden-967741/artikel,Mit einem größtenteils neuen Kader inklusive neuem Kapitän und einer Premiere zwischen den Pfosten ist der deutschen U-21-Nationalmannschaft der Test gegen die Ukraine gelungen. Trainer Antonio Di Sa… [+2192 chars],,de,'Sicherheit'
https://www.telepolis.de/features/Das-Hochspannungsnetz-der-Ukraine-und-seine-Bedeutung-fuer-den-Krieg-9299833.html,https://www.telepolis.de/features/Das-Hochspannungsnetz-der-Ukraine-und-seine-Bedeutung-fuer-den-Krieg-9299833.html,0,www.telepolis.de,Das Hochspannungsnetz der Ukraine und seine Bedeutung für den Krieg,Stromnetze spielen eine wichtige strategische und machtpolitische Rolle. Das Netz der Ukraine ist für die EU und für Russland von Bedeutung. Warum Moskau es angreift.,https://heise.cloudimg.io/bound/1200x1200/q85.png-lossy-85.webp-lossy-85.foil1/_www-heise-de_/imgs/18/4/2/9/9/8/7/4/electricity-4666566_1280-0e8647c19ce929da.jpeg,2023-09-08T22:00:00Z,https://web.archive.org/web/20230909040940/https://www.telepolis.de/features/Das-Hochspannungsnetz-der-Ukraine-und-seine-Bedeutung-fuer-den-Krieg-9299833.html,"(Bild: Tom, Pixabay)
Stromnetze spielen eine wichtige strategische und machtpolitische Rolle. Das Netz der Ukraine ist für die EU und für Russland von Bedeutung. Warum Moskau es angreift.
In der Ge… [+5124 chars]",,de,'Krieg'
https://www.n-tv.de/politik/21-26-Pistorius-ruft-zu-fortgesetzter-Unterstuetzung-der-Ukraine-auf--article23143824.html,https://www.n-tv.de/politik/21-26-Pistorius-ruft-zu-fortgesetzter-Unterstuetzung-der-Ukraine-auf--article23143824.html,0,www.n-tv.de,Ukraine-Krieg im Liveticker: +++ 21:26 Pistorius ruft zu fortgesetzter Unterstützung der Ukraine auf +++,Lesen Sie alle aktuellen Entwicklungen und Nachrichten über den russischen Angriffskrieg auf die Ukraine im Liveticker von ntv.de.,https://bilder2.n-tv.de/img/incoming/crop23332537/9041326157-cImg_16_9-w1200/Liveticker1-grau-1-Kopie.jpg,2023-09-08T22:17:00Z,,"Bundesverteidigungsminister Boris Pistorius hat bei der Eröffnungszeremonie der Invictus Games in Düsseldorf zu fortgesetzter Unterstützung der Ukraine aufgerufen. ""Wir dürfen niemals aufhören, die U… [+25808 chars]",,de,'Krieg'
https://www.n-tv.de/politik/13-09-Erste-Verstoesse-bei-Regionalwahlen-in-Russland-aufgedeckt--article23143824.html,https://www.n-tv.de/politik/13-09-Erste-Verstoesse-bei-Regionalwahlen-in-Russland-aufgedeckt--article23143824.html,0,www.n-tv.de,Ukraine-Krieg im Liveticker: +++ 13:09 Erste Verstöße bei Regionalwahlen in Russland aufgedeckt +++,Lesen Sie alle aktuellen Entwicklungen und Nachrichten über den russischen Angriffskrieg auf die Ukraine im Liveticker von ntv.de.,https://bilder2.n-tv.de/img/incoming/crop23332537/9041326157-cImg_16_9-w1200/Liveticker1-grau-1-Kopie.jpg,2023-09-08T22:17:00Z,https://web.archive.org/web/20230910013217/https://www.n-tv.de/politik/13-09-Erste-Verstoesse-bei-Regionalwahlen-in-Russland-aufgedeckt--article23143824.html,"Bei den bis Sonntag angesetzten Regionalwahlen in Russland melden unabhängige Beobachter schon jetzt vielerorts Verstöße und Betrug. So berichtet etwa die Organisation Golos auf Telegram von Druck, d… [+16054 chars]",,de,'Ukraine'
https://www.n-tv.de/politik/20-57-Slawa-Ukraine-Scholz-spricht-zu-den-ukrainischen-Bruedern-und-Schwestern--article23143824.html,https://www.n-tv.de/politik/20-57-Slawa-Ukraine-Scholz-spricht-zu-den-ukrainischen-Bruedern-und-Schwestern--article23143824.html,0,www.n-tv.de,"Ukraine-Krieg im Liveticker: +++ 20:57 ""Slawa Ukraine"": Scholz spricht zu den ukrainischen Brüdern und Schwestern +++",Lesen Sie alle aktuellen Entwicklungen und Nachrichten über den russischen Angriffskrieg auf die Ukraine im Liveticker von ntv.de.,https://bilder2.n-tv.de/img/incoming/crop23332537/9041326157-cImg_16_9-w1200/Liveticker1-grau-1-Kopie.jpg,2023-09-08T22:17:00Z,,Bundeskanzler Olaf Scholz hat in einer Videobotschaft zur Eröffnung der Invictus Games für kriegsversehrte Soldatinnen und Soldaten einen besonders herzlichen Gruß an das Team aus der Ukraine gericht… [+24922 chars],,de,'Ukraine'
https://www.welt.de/wirtschaft/article247365218/Produktivitaet-Der-Rueckgang-wird-fuer-Deutschland-zum-Problem.html,https://www.welt.de/wirtschaft/article247365218/Produktivitaet-Der-Rueckgang-wird-fuer-Deutschland-zum-Problem.html,0,www.welt.de,Sinkende Produktivität wird für Deutschland zum Problem,Deutschlands Industrie leidet unter rückläufiger Produktivität. Das zeigen Daten des Statistischen Bundesamts. Ökonom Enzo Weber fordert Investitionsanreize für Digitalisierung. Bei Bosch hält man die Rahmenbedingungen derzeit für ungeeignet.,https://img.welt.de/img/wirtschaft/mobile247365216/2661354597-ci16x9-w1200/Volkswagen.jpg,2023-09-08T23:00:32Z,https://web.archive.org/web/20230909034620/https://www.welt.de/wirtschaft/article247365218/Produktivitaet-Der-Rueckgang-wird-fuer-Deutschland-zum-Problem.html,"Die deutsche Wirtschaft hat nach der Corona- und Chipkrise ein Produktivitätsproblem. Im Moment haben wir ein deftiges Minus bei der Produktivität, sagte Enzo Weber, Professor am Institut für Arbeits… [+1632 chars]",,de,'Industrie'
https://www.stern.de/politik/ausland/neu-delhi--von-der-leyen-nennt-bedingungen-fuer-gemeinsame-g20-erklaerung-33809372.html,https://www.stern.de/politik/ausland/neu-delhi--von-der-leyen-nennt-bedingungen-fuer-gemeinsame-g20-erklaerung-33809372.html,0,www.stern.de,Neu Delhi: Von der Leyen nennt Bedingungen für gemeinsame G20-Erklärung,"Ob es in Indien eine wie sonst übliche gemeinsame Abschlusserklärung geben wird, ist unklar. Wie der Kremlchef schickt auch Chinas Staatspräsident einen Vertreter. Darüber ist von der Leyen enttäuscht.",https://image.stern.de/33809374/t/QS/v1/w1440/r1.7778/-/09--urnnewsmldpacom2009010123090999128259v3w800h600l471t419r1749b1315jpeg---69d44c524858ae1d.jpg,2023-09-08T23:45:43Z,,"Ob es in Indien eine wie sonst übliche gemeinsame Abschlusserklärung geben wird, ist unklar. Wie der Kremlchef schickt auch Chinas Staatspräsident einen Vertreter. Darüber ist von der Leyen enttäusch… [+2503 chars]",,de,'Kreml'
https://www.tagesschau.de/newsticker/liveblog-ukraine-samstag-312.html,https://www.tagesschau.de/newsticker/liveblog-ukraine-samstag-312.html,0,www.tagesschau.de,Liveblog : ++ IAEA berichtet von Explosionen nahe AKW ++,LAut IAEA-Chef Grassi sind nahe des ukrainischen AKW Saporischschja vermehrt Explosionen zu hören. Präsident Selenskyj ruft zu weiteren Sanktionen gegen Russland auf. Alle Entwicklungen im Liveblog.,https://images.tagesschau.de/image/02ee5d5e-455f-40db-9c97-c0164be51e3f/AAABiDRXQfI/AAABibBxqrQ/16x9-1280/saporischschja-135.jpg,2023-09-09T01:36:10Z,https://web.archive.org/web/20230909020309/https://www.tagesschau.de/newsticker/liveblog-ukraine-samstag-312.html,"Stand: 09.09.2023 03:36 Uhr
LAut IAEA-Chef Grassi sind nahe des ukrainischen AKW Saporischschja vermehrt Explosionen zu hören. Präsident Selenskyj ruft zu weiteren Sanktionen gegen Russland auf. All… [+1921 chars]",,de,'Saporischschja'
https://www.faz.net/aktuell/politik/ausland/g20-gipfel-von-der-leyen-nennt-bedingungen-fuer-gemeinsame-erklaerung-19162106.html,https://www.faz.net/aktuell/politik/ausland/g20-gipfel-von-der-leyen-nennt-bedingungen-fuer-gemeinsame-erklaerung-19162106.html,0,www.faz.net,G20-Gipfel in Indien: Von der Leyen nennt Bedingungen für gemeinsame Erklärung,Beim Treffen der G20-Staaten in Neu Delhi will  EU-Kommissionschefin Ursula von der Leyen die Forderung nach Frieden für die Ukraine verteidigen. Doch Russland lehnt Kritik an seinem Angriffskrieg ab – und kann auf Unterstützung von China hoffen.,https://media1.faz.net/ppmedia/aktuell/239394493/1.9162119/facebook_teaser/eu-kommissionspraesidentin.jpg,2023-09-09T01:46:39Z,https://web.archive.org/web/20230909021553/https://www.faz.net/aktuell/politik/ausland/g20-gipfel-von-der-leyen-nennt-bedingungen-fuer-gemeinsame-erklaerung-19162106.html,"EU-Kommissionspräsidentin Ursula von der Leyen hat kurz vor dem Beginn des G20-Gipfels in Indien Bedingungen für die Zustimmung zu einer Abschlusserklärung gestellt. Wichtig ist, dass wir die Grundsä… [+2195 chars]",,de,'Unterstützung'
https://www.zeit.de/politik/ausland/2023-09/ukraine-ueberblick-sanktionen-kaempfe-akw-saporischschja,https://www.zeit.de/politik/ausland/2023-09/ukraine-ueberblick-sanktionen-kaempfe-akw-saporischschja,0,www.zeit.de,"Ukraine-Überblick: Selenskyj fordert offensivere Sanktionen, Kämpfe um AKW Saporischschja","Präsident Selenskyj wirft den Verbündeten vor, die Sanktionen gegen Russland gelockert zu haben. Russland meldet weitere Drohnenangriffe auf Brjansk. Das war die Nacht.",,2023-09-09T03:15:03Z,https://web.archive.org/web/20230909093608/https://www.zeit.de/politik/ausland/2023-09/ukraine-ueberblick-sanktionen-kaempfe-akw-saporischschja,"When browsing with ads:
We collect personal data and also transmit it to third-party providers
 that help us improve and finance our digital content. Some of the information stored on your device, … [+821 chars]",,de,'Saporischschja'
https://www.stern.de/politik/ausland/russische-invasion--krieg-gegen-die-ukraine--so-ist-die-lage-33809520.html,https://www.stern.de/politik/ausland/russische-invasion--krieg-gegen-die-ukraine--so-ist-die-lage-33809520.html,0,www.stern.de,Russische Invasion: Krieg gegen die Ukraine: So ist die Lage,Die ersten Leopard 1-Kampfpanzer aus Dänemark kommen in der Ukraine an. Präsident Selenskyj ruft indes zu mehr Sanktionen gegen Russland auf. Die News im Überblick.,https://image.stern.de/33809522/t/ie/v1/w1440/r1.7778/-/09--urnnewsmldpacom2009010123090999129546v3w800h600l494t328r1482b984jpeg---08f3ca39e39504f7.jpg,2023-09-09T03:17:31Z,,"Die ersten Leopard 1-Kampfpanzer aus Dänemark kommen in der Ukraine an. Präsident Selenskyj ruft indes zu mehr Sanktionen gegen Russland auf. Die News im Überblick.
Die ersten zehn Leopard 1-Kampfpa… [+5078 chars]",,de,'Ukraine'
https://www.nzz.ch/wissenschaft/kiewer-rus-gegruendet-von-wikingern-wichtig-fuer-ukraine-und-russland-ld.1753268,https://www.nzz.ch/wissenschaft/kiewer-rus-gegruendet-von-wikingern-wichtig-fuer-ukraine-und-russland-ld.1753268,0,www.nzz.ch,"Blutige Beerdigungen, Sklavenhandel, massenhafte Vergewaltigung: So war es im Grossreich der Kiewer Rus, auf das sich sowohl Ukrainer als auch Russen berufen","Die archäologischen Erkenntnisse werden politisch interpretiert, und es geht vergessen, wie gemischt die Bevölkerung dieses Staates war – und wer ihn gegründet hat: Wikinger.","https://img.nzz.ch/2023/09/07/d74ec656-5e6c-4836-8a4e-327543628ddc.jpeg?width=1200&height=674&fit=bound&quality=75&auto=webp&crop=4498,2527,x0,y487&wmark=nzz",2023-09-09T03:30:00Z,https://web.archive.org/web/20230909111434/https://www.nzz.ch/wissenschaft/kiewer-rus-gegruendet-von-wikingern-wichtig-fuer-ukraine-und-russland-ld.1753268,"Mitte des 8. Jahrhunderts bauten Skandinavier im heutigen Russland, Weissrussland und der Ukraine ein Netz von Handelsstützpunkten auf, aus denen ein Grossreich wurde: die Kiewer Rus. Der russische M… [+16347 chars]",,de,'Wladimir Putin'
https://www.nzz.ch/meinung/pharmaindustrie-billigere-medikamente-in-den-usa-sind-ueberfaellig-ld.1754590,https://www.nzz.ch/meinung/pharmaindustrie-billigere-medikamente-in-den-usa-sind-ueberfaellig-ld.1754590,0,www.nzz.ch,KOMMENTAR - Die Abschaffung des US-Privilegs der Pharmaindustrie ist überfällig,"Die USA beginnen, erstmals Preisverhandlungen über Medikamente zu führen. In anderen Industrieländern ist das längst Standard. Doch sollte auch die US-Regierung Augenmass walten lassen, um nicht die Innovation abzuwürgen.","https://img.nzz.ch/2023/09/07/657f81b3-691a-4134-af50-b653e40deec0.jpeg?width=1200&height=674&fit=bound&quality=75&auto=webp&crop=4550,2556,x0,y475&wmark=nzz",2023-09-09T03:30:00Z,https://web.archive.org/web/20230909110131/https://www.nzz.ch/meinung/pharmaindustrie-billigere-medikamente-in-den-usa-sind-ueberfaellig-ld.1754590,"Mithilfe von Preisverhandlungen will Präsident Joe Biden die Medikamentenkosten in den USA deutlich senken.
In der Schweiz legt das Bundesamt für Gesundheit (BAG) die Preise für neue Medikamente fes… [+3883 chars]",,de,'Industrie'
https://www.zeit.de/news/2023-09/09/heizungstausch-das-ist-zur-kuenftigen-foerderung-geplant,https://www.zeit.de/news/2023-09/09/heizungstausch-das-ist-zur-kuenftigen-foerderung-geplant,0,www.zeit.de,Energie: Heizungstausch: Das ist zur künftigen Förderung geplant,,,2023-09-09T03:31:39Z,,"When browsing with ads:
We collect personal data and also transmit it to third-party providers
 that help us improve and finance our digital content. Some of the information stored on your device, … [+821 chars]",,de,'Energie'
https://www.stern.de/wirtschaft/news/energie--heizungstausch--das-ist-zur-kuenftigen-foerderung-geplant-33809540.html,https://www.stern.de/wirtschaft/news/energie--heizungstausch--das-ist-zur-kuenftigen-foerderung-geplant-33809540.html,0,www.stern.de,Energie: Heizungstausch: Das ist zur künftigen Förderung geplant,Der Bundestag hat das Heizungsgesetz beschlossen. Die Blicke richten sich nun auf die milliardenschwere staatliche Förderung. Was ist genau geplant - und woran gibt es Kritik?,https://image.stern.de/33809542/t/oo/v1/w1440/r1.7778/-/09--urnnewsmldpacom2009010123090999127891v3w800h600l638t449r1918b1351jpeg---167fb8596a2281e8.jpg,2023-09-09T03:31:39Z,,"Der Bundestag hat das Heizungsgesetz beschlossen. Die Blicke richten sich nun auf die milliardenschwere staatliche Förderung. Was ist genau geplant - und woran gibt es Kritik?
Nach der Verabschiedun… [+7124 chars]",,de,'Dämmung'
https://www.welt.de/politik/ausland/article247377306/Ukraine-News-IAEA-sieht-Anzeichen-fuer-mehr-Kaempfe-rund-um-AKW-Saporischschja.html,https://www.welt.de/politik/ausland/article247377306/Ukraine-News-IAEA-sieht-Anzeichen-fuer-mehr-Kaempfe-rund-um-AKW-Saporischschja.html,0,www.welt.de,IAEA sieht Anzeichen für mehr Kämpfe rund um AKW Saporischschja,Rund um das von Russland besetzte ukrainische Kernkraftwerk Saporischschja kommt es laut der Internationalen Atomenergiebehörde vermehrt zu kämpferischen Auseinandersetzungen. In den vergangenen Wochen seien zahlreiche Explosionen zu hören gewesen. Mehr im Li…,https://img.welt.de/img/politik/ausland/mobile247377320/1661353127-ci16x9-w1200/FILE-PHOTO-FILE-PHOTO-IAEA-expert-mission-visits-Zaporizhzhia-N.jpg,2023-09-09T03:56:06Z,https://web.archive.org/web/20230909045653/https://www.welt.de/politik/ausland/article247377306/Ukraine-News-IAEA-sieht-Anzeichen-fuer-mehr-Kaempfe-rund-um-AKW-Saporischschja.html,Im von russischen Truppen besetzten ukrainischen Kernkraftwerk Saporischschja stationierte Experten der Internationalen Atomenergiebehörde (IAEA) haben in der vergangenen Woche zahlreiche Explosionen… [+8244 chars],,de,'Saporischschja'
