index,url,valid,domain,title,description,image,published,archive,content,quote,language,keyword
https://www.welt.de/regionales/hamburg/article244633556/Klitschko-in-Hamburg-Insofern-verteidigt-die-Ukraine-jeden-von-Euch-vor-Putin.html,https://www.welt.de/regionales/hamburg/article244633556/Klitschko-in-Hamburg-Insofern-verteidigt-die-Ukraine-jeden-von-Euch-vor-Putin.html,0,www.welt.de,„Insofern verteidigt die Ukraine jeden von Euch vor Putin“,"Seit einem Jahr hilft Hamburg ganz konkret den Menschen in der Ukraine. Jetzt kam Kiews Bürgermeister Vitali Klitschko ins Rathaus – und sendet einen Appell an die Deutschen. Putin wolle die Sowjetunion wiederherstellen, und dazu gehöre auch ein Teil Deutschl…",https://img.welt.de/img/regionales/hamburg/mobile244633554/5391357167-ci16x9-w1200/Klitschko-trifft-Tschentscher.jpg,2023-04-03T12:55:00Z,https://web.archive.org/web/20230403131848/https://www.welt.de/regionales/hamburg/article244633556/Klitschko-in-Hamburg-Insofern-verteidigt-die-Ukraine-jeden-von-Euch-vor-Putin.html,Der russische Angriff auf die Ukraine betrifft nach Ansicht von Kiews Bürgermeister Vitali Klitschko Deutschland direkt. Russlands Präsident Wladimir Putin wolle die ehemalige Sowjetunion wiederherst… [+3867 chars],,de,'Ukraine'
https://www.faz.net/aktuell/politik/ukraine-liveticker-nawalny-team-macht-fsb-fuer-tatarskij-anschlag-verantwortlich-faz-18495964.html,https://www.faz.net/aktuell/politik/ukraine-liveticker-nawalny-team-macht-fsb-fuer-tatarskij-anschlag-verantwortlich-faz-18495964.html,0,www.faz.net,Ukraine-Liveblog: Nawalnys Team weist Mordvorwürfe zurück,Oppositionelle weisen Mordvorwürfe des russischen Anti-Terror-Komitees zurück +++ Stoltenberg: Finnland soll Dienstag NATO-Mitglied werden +++ Selenskyj wird am Mittwoch in Polen erwartet +++ alle Entwicklungen im Liveblog,https://media1.faz.net/ppmedia/aktuell/politik/217551875/1.8797549/facebook_teaser/sieht-das-putin-regime-in-der.jpg,2023-04-03T13:40:27Z,https://web.archive.org/web/20230403173715/https://www.faz.net/aktuell/politik/ukraine-liveticker-nawalny-team-macht-fsb-fuer-tatarskij-anschlag-verantwortlich-faz-18495964.html,"Das russische Verteidigungsministerium führt offenbar eine gezielte Informationskampagne durch, um den Ruf der 155. Marine-Infanterie-Brigade wiederherzustellen, berichtet das britische Verteidigungs… [+984 chars]",,de,'Ukraine'
https://www.welt.de/politik/ausland/article244631896/Moldau-Mit-hoher-Wahrscheinlichkeit-waere-es-Putins-naechstes-Ziel.html,https://www.welt.de/politik/ausland/article244631896/Moldau-Mit-hoher-Wahrscheinlichkeit-waere-es-Putins-naechstes-Ziel.html,0,www.welt.de,Moldau wäre der zweite Domino-Stein in Putins Revanchismus-Strategie,"Bei seinem Treffen mit Präsidentin Sandu bekräftigte Kanzler Scholz die europäische Solidarität mit Moldau. Aber besonders die osteuropäischen Länder warnen, dass Putin nach einem Sieg in der Ukraine weitere Staaten angreifen würde – und mit hoher Wahrscheinl…",https://img.welt.de/img/politik/ausland/mobile244637364/7601357207-ci16x9-w1200/German-Chancellor-Olaf-Scholz-L-s-2.jpg,2023-04-03T15:47:00Z,https://web.archive.org/web/20230403163806/https://www.welt.de/politik/ausland/article244631896/Moldau-Mit-hoher-Wahrscheinlichkeit-waere-es-Putins-naechstes-Ziel.html,"Nieder mit Maia Sandu, rufen die Demonstranten auf den Straßen der Hauptstadt von Moldau. Seit Wochen organisieren Oppositionsparteien in Chisinau Proteste gegen ihre Präsidentin angeführt von prorus… [+7967 chars]",,de,'Pipeline'
https://www.zeit.de/video/2023-04/6323894574112/habeck-in-der-ukraine-selenskyj-und-habeck-besuchen-militaerkrankenhaus,https://www.zeit.de/video/2023-04/6323894574112/habeck-in-der-ukraine-selenskyj-und-habeck-besuchen-militaerkrankenhaus,0,www.zeit.de,Habeck in der Ukraine: Selenskyj und Habeck besuchen Militärkrankenhaus,Bundeswirtschaftsminister Robert Habeck ist mit einer Wirtschaftsdelegation in die Ukraine gereist. Gemeinsam mit Präsident Wolodymyr Selenskyj besuchte er mehrere Orte.,,2023-04-03T21:37:45Z,https://web.archive.org/web/20230404033547/https://www.zeit.de/video/2023-04/6323894574112/habeck-in-der-ukraine-selenskyj-und-habeck-besuchen-militaerkrankenhaus,"When browsing with ads:
We collect personal data and also transmit it to third-party providers
 that help us improve and finance our digital content. Some of the information stored on your device, … [+732 chars]",,de,'Ukraine'
https://www.zeit.de/wirtschaft/2023-04/energiekrise-stromverbrauch-privathaushalte-gesunken,https://www.zeit.de/wirtschaft/2023-04/energiekrise-stromverbrauch-privathaushalte-gesunken,0,www.zeit.de,Energie: Haushalte verbrauchen acht Prozent weniger Strom,"Hohe Energiepreise und Sparaufrufe haben 2022 offenbar viele Bürger bewogen, auf ihren Stromverbrauch zu achten. Laut Analysten gibt es noch viel mehr Einsparpotenzial.",,2023-04-04T06:32:15Z,https://web.archive.org/web/20230404131447/https://www.zeit.de/wirtschaft/2023-04/energiekrise-stromverbrauch-privathaushalte-gesunken,"When browsing with ads:
We collect personal data and also transmit it to third-party providers
 that help us improve and finance our digital content. Some of the information stored on your device, … [+732 chars]",,de,'Energie'
https://www.tagesspiegel.de/internationales/hafenstadt-am-schwarzen-meer-ukraine-meldet-russische-drohnenangriffe--odessa-besonders-betroffen-9610763.html,https://www.tagesspiegel.de/internationales/hafenstadt-am-schwarzen-meer-ukraine-meldet-russische-drohnenangriffe--odessa-besonders-betroffen-9610763.html,0,www.tagesspiegel.de,Hafenstadt am Schwarzen Meer: Ukraine meldet russische Drohnenangriffe – Odessa besonders betroffen,"Insgesamt soll es in der Nacht auf Dienstag 17 Angriffe mit Kamikaze-Drohnen gegeben haben, 14 seien nach ukrainischen Angaben abgeschossen worden. Verletzt wurde niemand.",https://www.tagesspiegel.de/images/kampfdrohne1/alternates/BASE_16_9_W1400/kampfdrohne.jpeg,2023-04-04T07:33:14Z,https://web.archive.org/web/20230404075517/https://www.tagesspiegel.de/internationales/hafenstadt-am-schwarzen-meer-ukraine-meldet-russische-drohnenangriffe--odessa-besonders-betroffen-9610763.html,Bei Luftangriffen mit russischen Drohnen ist nach ukrainischen Angaben in der Nacht auf Dienstag die strategisch wichtige ukrainische Hafenstadt Odessa am Schwarzen Meer getroffen worden. Der Feind h… [+2130 chars],,de,'Ukraine'
https://www.ifun.de/stromspeicher-solarflow-nennt-preise-ecoflow-mit-neuer-firmware-207369/,https://www.ifun.de/stromspeicher-solarflow-nennt-preise-ecoflow-mit-neuer-firmware-207369/,0,www.ifun.de,"Stromspeicher: SolarFlow nennt Preise, Ecoflow mit neuer Firmware","Wer einmal mit dem Ernten von Solarstrom begonnen hat, der wird sich früher oder später wünschen, die kostenlose Energie nicht nur tagsüber nutzen zu können, sondern die stets anliegende Grundlast auch in den Abendstunden weiter mit Sonnenenergie zu speisen. …",https://images.ifun.de/wp-content/uploads/2023/03/solarflow-feature.jpg,2023-04-04T09:07:05Z,https://web.archive.org/web/20230404140711/https://www.ifun.de/stromspeicher-solarflow-nennt-preise-ecoflow-mit-neuer-firmware-207369/,"Wer einmal mit dem Ernten von Solarstrom begonnen hat, der wird sich früher oder später wünschen, die kostenlose Energie nicht nur tagsüber nutzen zu können, sondern die stets anliegende Grundlast au… [+1787 chars]",,de,'Energie'
https://www.morgenpost.de/ratgeber/article238048805/heizung-oelheizung-gas-verbot-kosten-verbraucher.html,https://www.morgenpost.de/ratgeber/article238048805/heizung-oelheizung-gas-verbot-kosten-verbraucher.html,0,www.morgenpost.de,Heizungsgesetz: Verbot von Ölheizungen: Wer tief in die Tasche greifen muss,"Die Ampel hat sich auf ein Heizungsgesetz geeinigt. Es trifft Eigentümer mit einer Gas- oder Ölheizung. Lesen Sie hier, für wen es jetzt richtig teuer werden wird.",https://img.morgenpost.de/img/frontpage/crop238049221/4302601393-w820-cv16_9-q85/Ampel-einigt-sich-auf-umstrittenes-Heizungsgesetz-ab-2024.jpg,2023-04-04T09:15:00Z,https://web.archive.org/web/20230404212813/https://www.morgenpost.de/ratgeber/article238048805/heizung-oelheizung-gas-verbot-kosten-verbraucher.html,Berlin. Die von Wirtschaftsminister Robert Habeck und Bauministerin Klara Geywitz vorgestellten Heizungskonzepte für Gas- und Ölheizsysteme in Deutschland ab dem Jahr 2024 führen für zahlreiche Verbr… [+6533 chars],,de,'Gas'
https://www.n-tv.de/ratgeber/Verbrauchen-Sie-auch-zu-viel-Strom-article24032295.html,https://www.n-tv.de/ratgeber/Verbrauchen-Sie-auch-zu-viel-Strom-article24032295.html,0,www.n-tv.de,Stromspiegel 2023 ist da: Verbrauchen Sie auch zu viel Strom?,"Sich zu vergleichen, steht ja eigentlich auf der Liste zum Unglücklichsein ganz oben. Wenn's gut läuft, kann es aber auch den Ehrgeiz anstacheln - zum Beispiel beim Stromsparen. Das schmeichelt nicht nur dem Ego, sondern schont auch die Haushaltskasse. Wie vi…",https://bilder2.n-tv.de/img/incoming/crop22418217/4471324664-cImg_16_9-w1200/imago0052184833h.jpg,2023-04-04T09:20:57Z,https://web.archive.org/web/20230404140650/https://www.n-tv.de/ratgeber/Verbrauchen-Sie-auch-zu-viel-Strom-article24032295.html,"Sich zu vergleichen, steht ja eigentlich auf der Liste zum Unglücklichsein ganz oben. Wenn's gut läuft, kann es aber auch den Ehrgeiz anstacheln - zum Beispiel beim Stromsparen. Das schmeichelt nicht… [+2953 chars]",,de,'Energie'
https://www.faz.net/aktuell/politik/ukraine-liveticker-russland-belarus-hat-kampfjets-mit-atomwaffen-aufgeruestet-faz-18495964.html,https://www.faz.net/aktuell/politik/ukraine-liveticker-russland-belarus-hat-kampfjets-mit-atomwaffen-aufgeruestet-faz-18495964.html,0,www.faz.net,Ukraine-Liveblog: Russland bestätigt Aufrüstung belarussischer Kampfflugzeuge mit Atomwaffen,London: Russland will Wagner-Gruppe durch Alternative ersetzen  +++ Russische Drohnenangriffe auf Odessa +++ Putin zeichnet getöteten Militärblogger postum aus +++ alle Entwicklungen im Liveblog,https://media1.faz.net/ppmedia/aktuell/1449987738/1.8799699/facebook_teaser/das-raketensystem-iskander-bei.jpg,2023-04-04T12:05:35Z,https://web.archive.org/web/20230404130318/https://www.faz.net/aktuell/politik/ukraine-liveticker-russland-belarus-hat-kampfjets-mit-atomwaffen-aufgeruestet-faz-18495964.html,Laut Schoigu können die Raketen von Iskander-M sowohl konventionelle als auch atomare Sprengköpfe tragen. Die Aufrüstung des verbündeten Nachbarlandes bezeichnete der Minister als Reaktion auf die we… [+657 chars],,de,'Wladimir Putin'
