index,url,valid,domain,title,description,image,published,archive,content,quote,language,keyword
https://www.zeit.de/news/2025-06/16/krieg-im-nahen-osten-eu-will-mit-usa-energiemarkt-sichern,https://www.zeit.de/news/2025-06/16/krieg-im-nahen-osten-eu-will-mit-usa-energiemarkt-sichern,0,www.zeit.de,Steigende Preise: Krieg im Nahen Osten - EU will mit USA Energiemarkt sichern,Hier finden Sie Informationen zu dem Thema „Steigende Preise“. Lesen Sie jetzt „Krieg im Nahen Osten - EU will mit USA Energiemarkt sichern“.,https://img.zeit.de/news/2025-06/16/krieg-im-nahen-osten-eu-will-mit-usa-energiemarkt-sichern-image-group/wide__1300x731,2025-06-16T04:51:06Z,,Die EU will gemeinsam mit den USA einen starken Anstieg der Energiepreise wegen des Krieges zwischen Israel und dem Iran verhindern. Sie habe mit US-Präsident Donald Trump über das Thema gesprochen u… [+1403 chars],,de,'Krieg'
https://www.zeit.de/news/2025-06/16/ifw-europas-hilfe-fuer-die-ukraine-ist-deutlich-gestiegen,https://www.zeit.de/news/2025-06/16/ifw-europas-hilfe-fuer-die-ukraine-ist-deutlich-gestiegen,0,www.zeit.de,Krieg: IfW: Europas Hilfe für die Ukraine ist deutlich gestiegen,Hier finden Sie Informationen zu dem Thema „Krieg“. Lesen Sie jetzt „IfW: Europas Hilfe für die Ukraine ist deutlich gestiegen“.,https://img.zeit.de/news/2025-06/16/ifw-europas-hilfe-fuer-die-ukraine-ist-deutlich-gestiegen-image-group/wide__1300x731,2025-06-16T11:09:37Z,,Die von Russland angegriffene Ukraine hat zuletzt deutlich mehr Hilfe aus Europa erhalten als noch zu Jahresbeginn. Das geht aus einer aktuellen Analyse des Instituts für Weltwirtschaft (IfW) Kiel he… [+1710 chars],,de,'Ukraine'
https://www.zeit.de/news/2025-06/16/thueringer-industrie-mit-428-millionen-euro-umsatzplus,https://www.zeit.de/news/2025-06/16/thueringer-industrie-mit-428-millionen-euro-umsatzplus,0,www.zeit.de,Konjunktur: Thüringer Industrie mit 428 Millionen Euro Umsatzplus,Hier finden Sie Informationen zu dem Thema „Konjunktur“. Lesen Sie jetzt „Thüringer Industrie mit 428 Millionen Euro Umsatzplus“.,https://img.zeit.de/news/2025-06/16/thueringer-industrie-mit-428-millionen-euro-umsatzplus-image-group/wide__1300x731,2025-06-16T13:05:31Z,,"Thüringens Industriebetriebe haben in den ersten vier Monaten des Jahres mehr Umsatz erzielt. Mit 12,7 Milliarden Euro lagen die Erlöse um 428 Millionen Euro über dem Vorjahreszeitraum, wie das Lande… [+2326 chars]",,de,'Industrie'
https://www.zeit.de/politik/ausland/2025-06/gazastreifen-nahostkrieg-israel-westjordanland-aufmerksamkeit,https://www.zeit.de/politik/ausland/2025-06/gazastreifen-nahostkrieg-israel-westjordanland-aufmerksamkeit,0,www.zeit.de,Gazastreifen: Krieg darf nicht von Krieg ablenken,Israels Angriff auf den Iran zieht alle Aufmerksamkeit auf sich. Darüber sollte die Welt nicht die Lage in Gaza und im Westjordanland vergessen.,https://img.zeit.de/politik/ausland/2025-06/gazastreifen-nahostkrieg-israel-westjordanland-aufmerksamkeit-bild/wide__1300x731,2025-06-16T14:13:20Z,,"Den Erzfeind Iran hart getroffen. Das Atomprogramm womöglich stark beschädigt. Eine erhebliche Gefahr gebannt, zumindest deutlich verkleinert. Israels Angriff auf den Iran ist ein kriegshandwerklich … [+398 chars]",,de,'Krieg'
https://www.n-tv.de/politik/Berlin-dementiert-Unterstuetzung-israelischer-Kampfjets-article25837719.html,https://www.n-tv.de/politik/Berlin-dementiert-Unterstuetzung-israelischer-Kampfjets-article25837719.html,0,www.n-tv.de,Keine Luftbetankung: Berlin dementiert Unterstützung israelischer Kampfjets,Auch am vierten Tag des eskalierten Konflikts zwischen Israel und dem Iran setzen beide Länder ihre Luftangriffe fort. Doch leistet Deutschland Unterstützung für Israel? Das Verteidigungsministerium tritt Behauptungen entgegen.,https://www.n-tv.de/img/incoming/crop25837708/036132740-cImg_16_9-w1200/AFP-20250615-62FK3ZB-v1-HighRes-IsraelIranConflict.jpg,2025-06-16T14:23:03Z,,Auch am vierten Tag des eskalierten Konflikts zwischen Israel und dem Iran setzen beide Länder ihre Luftangriffe fort. Doch leistet Deutschland Unterstützung für Israel? Das Verteidigungsministerium … [+2278 chars],,de,'Unterstützung'
https://stadt-bremerhaven.de/google-forms-ki-assistent-gemini-hilft-beim-erstellen-neuer-formulare/,https://stadt-bremerhaven.de/google-forms-ki-assistent-gemini-hilft-beim-erstellen-neuer-formulare/,0,stadt-bremerhaven.de,Google Forms: KI-Assistent Gemini hilft beim Erstellen neuer Formulare,"Google erweitert die Funktionalität von Google Forms um eine KI-Unterstützung. Nach der jüngst eingeführten Möglichkeit, Formularantworten mit Gemini zusammenzufassen, kommt nun die nächste smarte Funktion. Die „Help me create“-Funktion ermöglicht es Nutzern,…",https://stadt-bremerhaven.de/wp-content/uploads/2025/06/google-formulare.jpg,2025-06-16T15:30:24Z,,"Google Formulare, Symbolbild
Google erweitert die Funktionalität von Google Forms um eine KI-Unterstützung. Nach der jüngst eingeführten Möglichkeit, Formularantworten mit Gemini zusammenzufassen, k… [+1652 chars]",,de,'Unterstützung'
https://www.zeit.de/news/2025-06/16/nordlaender-fordern-niedrigere-strompreise,https://www.zeit.de/news/2025-06/16/nordlaender-fordern-niedrigere-strompreise,0,www.zeit.de,Erneuerbare Energie: Nordländer fordern niedrigere Strompreise,Hier finden Sie Informationen zu dem Thema „Erneuerbare Energie“. Lesen Sie jetzt „Nordländer fordern niedrigere Strompreise“.,https://img.zeit.de/news/2025-06/16/nordlaender-fordern-niedrigere-strompreise-image-group/wide__1300x731,2025-06-16T15:59:16Z,,"Die norddeutschen Länder haben die Bundesregierung aufgefordert, die Stromkosten für Bürgerinnen und Bürger, Industrie und Mittelstand deutlich zu senken und die Energiewende konsequent voranzutreibe… [+1650 chars]",,de,'Energie'
https://www.zeit.de/politik/ausland/2025-06/nahost-donald-trump-israel-iran-minnesota-ok-america,https://www.zeit.de/politik/ausland/2025-06/nahost-donald-trump-israel-iran-minnesota-ok-america,0,www.zeit.de,Nahost: Donald Trumps Rolle im Israel-Iran-Krieg,"Ein neuer Krieg, ein grausamer Doppelmord: Im US-Podcast diskutieren wir, wo die USA im Konflikt zwischen Israel und dem Iran stehen. Und über die Tat in Minnesota.",https://img.zeit.de/politik/ausland/2025-06/nahost-donald-trump-israel-iran-minnesota-ok-america-bild/wide__1300x731,2025-06-16T17:14:00Z,,Schon in seiner ersten Amtszeit zeigte US-Präsident Donald Trump seine Verbundenheit mit Israels Premier Benjamin Netanjahu hier bei einem Treffen im Weißen Haus im September 2020. © Doug Mills/The N… [+1411 chars],,de,'Krieg'
https://www.zeit.de/news/2025-06/16/deutsch-israelische-literaturtage-abgesagt,https://www.zeit.de/news/2025-06/16/deutsch-israelische-literaturtage-abgesagt,0,www.zeit.de,Krieg im Nahen Osten: Deutsch-Israelische Literaturtage abgesagt,Hier finden Sie Informationen zu dem Thema „Krieg im Nahen Osten“. Lesen Sie jetzt „Deutsch-Israelische Literaturtage abgesagt“.,https://img.zeit.de/news/2025-06/16/deutsch-israelische-literaturtage-abgesagt-image-group/wide__1300x731,2025-06-16T17:49:58Z,,Die Deutsch-Israelischen Literaturtage in Berlin sind wegen der Eskalation im Nahen Osten abgesagt. «Angesichts der veränderten Sicherheitslage im Nahen Osten seit dem 13. Juni ist ein solches Zusamm… [+863 chars],,de,'Krieg'
https://www.zeit.de/news/2025-06/16/netanjahu-toetung-chameneis-koennte-konflikt-beenden,https://www.zeit.de/news/2025-06/16/netanjahu-toetung-chameneis-koennte-konflikt-beenden,0,www.zeit.de,Krieg zwischen Israel und Iran: Netanjahu: Tötung Chameneis könnte Konflikt beenden,Hier finden Sie Informationen zu dem Thema „Krieg zwischen Israel und Iran“. Lesen Sie jetzt „Netanjahu: Tötung Chameneis könnte Konflikt beenden“.,https://img.zeit.de/news/2025-06/16/netanjahu-toetung-chameneis-koennte-konflikt-beenden-image-group/wide__1300x731,2025-06-16T18:16:20Z,,"Der israelische Regierungschef Benjamin Netanjahu scheint eine gezielte Tötung von Irans Oberstem Führer Ajatollah Ali Chamenei nicht auszuschließen. «Das wird den Konflikt nicht eskalieren lassen, d… [+1738 chars]",,de,'Krieg'
https://www.zeit.de/news/2025-06/17/usa-verstaerken-militaerpraesenz-im-nahen-osten,https://www.zeit.de/news/2025-06/17/usa-verstaerken-militaerpraesenz-im-nahen-osten,0,www.zeit.de,Krieg zwischen Israel und Iran: USA verstärken Militärpräsenz im Nahen Osten,Hier finden Sie Informationen zu dem Thema „Krieg zwischen Israel und Iran“. Lesen Sie jetzt „USA verstärken Militärpräsenz im Nahen Osten“.,https://img.zeit.de/news/2025-06/17/usa-verstaerken-militaerpraesenz-im-nahen-osten-image-group/wide__1300x731,2025-06-16T22:32:11Z,,"Angesichts des Krieges zwischen Israel und dem Iran verstärken die USA ihre Militärpräsenz im Nahen Osten. Das habe er am Wochenende zum Schutz der eigenen Truppen in der Region angeordnet, schrieb U… [+1754 chars]",,de,'Krieg'
https://www.zeit.de/news/2025-06/17/trump-fordert-menschen-in-teheran-zur-evakuierung-auf,https://www.zeit.de/news/2025-06/17/trump-fordert-menschen-in-teheran-zur-evakuierung-auf,0,www.zeit.de,Krieg zwischen Israel und Iran: Trump fordert Menschen in Teheran zur Evakuierung auf,Hier finden Sie Informationen zu dem Thema „Krieg zwischen Israel und Iran“. Lesen Sie jetzt „Trump fordert Menschen in Teheran zur Evakuierung auf“.,https://img.zeit.de/news/2025-06/17/trump-fordert-menschen-in-teheran-zur-evakuierung-auf-image-group/wide__1300x731,2025-06-16T23:13:57Z,,"Angesichts des Krieges zwischen Israel und dem Iran hat US-Präsident Donald Trump die Einwohner der Millionenstadt Teheran zur Flucht aufgefordert. «Jeder sollte Teheran sofort verlassen», schrieb Tr… [+1330 chars]",,de,'Krieg'
https://www.tagesspiegel.de/internationales/international-g7-einigt-sich-uberraschend-auf-erklarung-zum-iran-krieg-13865317.html,https://www.tagesspiegel.de/internationales/international-g7-einigt-sich-uberraschend-auf-erklarung-zum-iran-krieg-13865317.html,0,www.tagesspiegel.de,International: G7 einigt sich überraschend auf Erklärung zum Iran-Krieg,"Beim G7-Gipfel sieht es zunächst so aus, als könnten sich die Teilnehmer bei wichtigen außenpolitischen Themen nicht auf eine gemeinsame Sprache verständigen. Nun gibt es doch eine Ausnahme.",https://www.tagesspiegel.de/images/13865461/alternates/BASE_16_9_W1400/1750131616000/g7-gipfel-in-kanada.jpeg,2025-06-16T23:38:18Z,,US-Präsident Donald Trump und die anderen G7-Chefs haben sich unerwartet auf eine gemeinsame Erklärung zum Krieg zwischen Israel und dem Iran verständigt. In dem von Gastgeber Kanada veröffentlichten… [+2971 chars],,de,'Krieg'
https://www.stern.de/politik/ausland/international--trump-verlaesst-g7-gipfel-vorzeitig-wegen-nahost-krise-35814422.html,https://www.stern.de/politik/ausland/international--trump-verlaesst-g7-gipfel-vorzeitig-wegen-nahost-krise-35814422.html,0,www.stern.de,International: Trump verlässt G7-Gipfel vorzeitig wegen Nahost-Krise,"Der G7-Gipfel wird überschattet von einem neuen Krieg. Trump entscheidet kurzerhand, vorzeitig abzureisen, um sich von daheim aus um die Nahost-Krise zu kümmern. Das sagt auch viel zum Zustand der G7.",https://image.stern.de/35814444/t/sa/v1/w1440/r1.7778/-/17--px4ybwdpkcv2axs2048jpeg---034ab893dead8d9f.jpg,2025-06-17T00:37:15Z,,"Kopiere den aktuellen Link
Zur Merkliste hinzufügen
Der G7-Gipfel wird überschattet von einem neuen Krieg. Trump entscheidet kurzerhand, vorzeitig abzureisen, um sich von daheim aus um die Nahost-K… [+6193 chars]",,de,'Ukraine'
https://www.sueddeutsche.de/politik/g7-gipfel-kanada-merz-trump-herausforderungen-li.3269914,https://www.sueddeutsche.de/politik/g7-gipfel-kanada-merz-trump-herausforderungen-li.3269914,0,www.sueddeutsche.de,G-7-Gipfel: Eine Herausforderung namens Donald Trump,"In Kanada treffen sich die Staats- und Regierungschefs der G7. Es geht um die Weltwirtschaft, um China und die aktuellen Krisen in der Ukraine und im Nahen Osten. Im Zentrum steht: Donald Trump - der früher abreist.",https://www.sueddeutsche.de/2025/06/16/3206334a-3ad6-4bce-8aab-5c3900c5b51e.jpeg?q=60&fm=webp&width=1200&rect=0%2C0%2C4000%2C2250,2025-06-17T01:33:52Z,,"17. Juni 2025, 3:33 Uhr|Lesezeit: 4 Min.
|
In Kanada treffen sich noch bis Dienstag die Staats- und Regierungschefs der G7. Es geht um die Weltwirtschaft, um China und die Krisen der Welt. Im Mitte… [+757 chars]",,de,'Ukraine'
https://www.stern.de/gesellschaft/regional/thueringen/sparen-noetig--sparzwang-schaerft-blick-auf-foerderprogramme-35814568.html,https://www.stern.de/gesellschaft/regional/thueringen/sparen-noetig--sparzwang-schaerft-blick-auf-foerderprogramme-35814568.html,0,www.stern.de,Sparen nötig: Sparzwang schärft Blick auf Förderprogramme,Das Land muss sparen und deshalb nach Ansicht der zuständigen Ministerin vielleicht sogar manche Förderprogramme einstellen - und von denen profitierten zuletzt vor allem Schulen und Unternehmen.,https://image.stern.de/35814570/t/PG/v1/w1440/r1.7778/-/17--os25t3sevpv14axs2048jpeg---f7d350b048cae1b7.jpg,2025-06-17T02:00:37Z,,"Kopiere den aktuellen Link
Zur Merkliste hinzufügen
Das Land muss sparen und deshalb nach Ansicht der zuständigen Ministerin vielleicht sogar manche Förderprogramme einstellen - und von denen profi… [+3145 chars]",,de,'sparen'
https://www.zeit.de/news/2025-06/17/eu-kommission-will-russische-gasimporte-komplett-verbieten,https://www.zeit.de/news/2025-06/17/eu-kommission-will-russische-gasimporte-komplett-verbieten,0,www.zeit.de,Energie: EU-Kommission will russische Gasimporte komplett verbieten,Hier finden Sie Informationen zu dem Thema „Energie“. Lesen Sie jetzt „EU-Kommission will russische Gasimporte komplett verbieten“.,https://img.zeit.de/news/2025-06/17/eu-kommission-will-russische-gasimporte-komplett-verbieten-image-group/wide__1300x731,2025-06-17T02:00:44Z,,Bis Ende 2027 soll nach dem Willen der EU-Kommission kein Gas aus Russland mehr in die Europäische Union importiert werden. Denn anders als für etwa Öl und Kohle gibt es wegen Abhängigkeiten bislang … [+4422 chars],,de,'Gas'
https://www.stern.de/wirtschaft/news/energie--eu-kommission-will-russische-gasimporte-komplett-verbieten-35814524.html,https://www.stern.de/wirtschaft/news/energie--eu-kommission-will-russische-gasimporte-komplett-verbieten-35814524.html,0,www.stern.de,Energie: EU-Kommission will russische Gasimporte komplett verbieten,"Gegen Kohle und Öl gelten in der EU weitgehende Einfuhrverbote, Moskaus Gas kommt aber weiter an. Nach Willen der EU-Kommission allerdings nicht mehr lange. Was hat sie vor?",https://image.stern.de/35814526/t/nZ/v1/w1440/r1.7778/-/17--hwijfqzkkkv8axs2048jpeg---15d4e3ce81b8e7e1.jpg,2025-06-17T02:00:44Z,,"Kopiere den aktuellen Link
Zur Merkliste hinzufügen
Gegen Kohle und Öl gelten in der EU weitgehende Einfuhrverbote, Moskaus Gas kommt aber weiter an. Nach Willen der EU-Kommission allerdings nicht … [+4611 chars]",,de,'Energie'
https://www.tagesspiegel.de/wirtschaft/energie-eu-kommission-will-russische-gasimporte-komplett-verbieten-13865395.html,https://www.tagesspiegel.de/wirtschaft/energie-eu-kommission-will-russische-gasimporte-komplett-verbieten-13865395.html,0,www.tagesspiegel.de,Energie: EU-Kommission will russische Gasimporte komplett verbieten,"Gegen Kohle und Öl gelten in der EU weitgehende Einfuhrverbote, Moskaus Gas kommt aber weiter an. Nach Willen der EU-Kommission allerdings nicht mehr lange. Was hat sie vor?",https://www.tagesspiegel.de/images/13865392/alternates/BASE_16_9_W1400/1750125765000/gasherd.jpeg,2025-06-17T02:02:46Z,,Bis Ende 2027 soll nach dem Willen der EU-Kommission kein Gas aus Russland mehr in die Europäische Union importiert werden. Denn anders als für etwa Öl und Kohle gibt es wegen Abhängigkeiten bislang … [+5153 chars],,de,'Gas'
https://www.stern.de/news/bundesgerichtshof-verhandelt-in-streit-zwischen-gas-de-und-bundesnetzagentur-35814548.html,https://www.stern.de/news/bundesgerichtshof-verhandelt-in-streit-zwischen-gas-de-und-bundesnetzagentur-35814548.html,0,www.stern.de,Bundesgerichtshof verhandelt in Streit zwischen Gas.de und Bundesnetzagentur,"Der Bundesgerichtshof (BGH) beschäftigt sich am Dienstag (10.00 Uhr) noch einmal mit der Energiekrise. Der Kartellsenat in Karlsruhe verhandelt über eine Beschwerde des ehemaligen Billiganbieters Gas.de. Es geht um die Frage, ob die Bundesnetzagentur die Öffe…",https://image.stern.de/35814550/t/uw/v1/w1440/r1.7778/-/17--bundesgerichtshof---8abec84aad2394d5.jpg,2025-06-17T02:06:21Z,,"Kopiere den aktuellen Link
Zur Merkliste hinzufügen
Der Bundesgerichtshof (BGH) beschäftigt sich am Dienstag (10.00 Uhr) noch einmal mit der Energiekrise. Der Kartellsenat in Karlsruhe verhandelt ü… [+693 chars]",,de,'Energie'
https://www.zeit.de/news/2025-06/17/g7-einigt-sich-ueberraschend-auf-erklaerung-zum-iran-krieg,https://www.zeit.de/news/2025-06/17/g7-einigt-sich-ueberraschend-auf-erklaerung-zum-iran-krieg,0,www.zeit.de,International: G7 einigt sich überraschend auf Erklärung zum Iran-Krieg,Hier finden Sie Informationen zu dem Thema „International“. Lesen Sie jetzt „G7 einigt sich überraschend auf Erklärung zum Iran-Krieg“.,https://img.zeit.de/administratives/sharing/fallback-image/wide__1300x731,2025-06-17T03:21:05Z,,US-Präsident Donald Trump und die anderen G7-Chefs haben sich nach Informationen der Deutschen Presse-Agentur unerwartet auf eine gemeinsame Erklärung zum Krieg zwischen Israel und dem Iran verständi… [+183 chars],,de,'Krieg'
https://www.nzz.ch/schweiz/das-stromabkommen-mit-der-eu-soll-die-versorgungssicherheit-der-schweiz-staerken-doch-der-publizierte-text-des-abkommens-laesst-fragen-offen-ld.1889191,https://www.nzz.ch/schweiz/das-stromabkommen-mit-der-eu-soll-die-versorgungssicherheit-der-schweiz-staerken-doch-der-publizierte-text-des-abkommens-laesst-fragen-offen-ld.1889191,0,www.nzz.ch,Das Stromabkommen mit der EU soll die Versorgungssicherheit der Schweiz stärken – doch der publizierte Text des Abkommens lässt Fragen offen,Trotz dem Versprechen einer sichereren Stromversorgung ist das Abkommen mit der EU im Inland umstritten. Auffällig im Vertragstext ist unter anderem die Integration einer Serie von EU-Rechtserlassen.,"https://img.nzz.ch/2025/06/16/fe5002d1-328a-433b-ab57-f17a429ce73c.jpeg?width=1200&height=674&fit=bounds&quality=75&auto=webp&crop=1850,1040,x87,y2506&wmark=nzz",2025-06-17T03:30:00Z,,"Die Schweiz soll künftig noch stärker in den europäischen Strommarkt integriert sein.
2022 war eine Selbstverständlichkeit in der Schweiz plötzlich infrage gestellt: dass Strom fliesst, wenn wir ihn… [+6034 chars]",,de,'Import'
https://www.zeit.de/news/2025-06/17/behoerden-mindestens-14-tote-bei-luftangriff-auf-kiew,https://www.zeit.de/news/2025-06/17/behoerden-mindestens-14-tote-bei-luftangriff-auf-kiew,0,www.zeit.de,Ukraine-Krieg: Behörden: Mindestens 14 Tote bei Luftangriff auf Kiew,Hier finden Sie Informationen zu dem Thema „Ukraine-Krieg“. Lesen Sie jetzt „Behörden: Mindestens 14 Tote bei Luftangriff auf Kiew“.,https://img.zeit.de/news/2025-06/17/behoerden-mindestens-14-tote-bei-luftangriff-auf-kiew-image-group/wide__1300x731,2025-06-17T04:52:47Z,,"Schließen
Hier können Sie interessante Artikel speichern, um sie später zu lesen und wiederzufinden.
Sie haben bereits ein Konto?
 Hier anmelden.",,de,'Krieg'
https://www.zeit.de/news/2025-06/17/russischer-angriff-auf-kiew-toetet-mindestens-14-menschen,https://www.zeit.de/news/2025-06/17/russischer-angriff-auf-kiew-toetet-mindestens-14-menschen,0,www.zeit.de,Ukraine-Krieg: Russischer Angriff auf Kiew tötet mindestens 14 Menschen,Hier finden Sie Informationen zu dem Thema „Ukraine-Krieg“. Lesen Sie jetzt „Russischer Angriff auf Kiew tötet mindestens 14 Menschen“.,https://img.zeit.de/news/2025-06/17/russischer-angriff-auf-kiew-toetet-mindestens-14-menschen-image-group/wide__1300x731,2025-06-17T05:19:56Z,,Bei einem folgenschweren russischen Luftangriff auf Kiew sind mindestens 14 Menschen getötet worden. Die Militärverwaltung der ukrainischen Hauptstadt machte diese vorläufigen Angaben. «Die Suche nac… [+1653 chars],,de,'Ukraine'
https://www.zeit.de/news/2025-06/17/pet-shop-boys-konzert-fuer-kreml-gegner-nawalny-abgesagt,https://www.zeit.de/news/2025-06/17/pet-shop-boys-konzert-fuer-kreml-gegner-nawalny-abgesagt,0,www.zeit.de,Musik: Pet Shop Boys: Konzert für Kreml-Gegner Nawalny abgesagt,Hier finden Sie Informationen zu dem Thema „Musik“. Lesen Sie jetzt „Pet Shop Boys: Konzert für Kreml-Gegner Nawalny abgesagt“.,https://img.zeit.de/news/2025-06/17/pet-shop-boys-konzert-fuer-kreml-gegner-nawalny-abgesagt-image-group/wide__1300x731,2025-06-17T06:50:29Z,,"Das Gedenkkonzert für den verstorbenen Kremlkritiker Alexej Nawalny am 28. Juni in Berlin ist abgesagt worden. Das teilte die britische Band Pet Shop Boys, die auftreten sollte, in ihren Internetkanä… [+1080 chars]",,de,'Kreml'
https://www.zeit.de/news/2025-06/17/palaestinenser-dutzende-tote-nahe-hilfszentrum-in-gaza,https://www.zeit.de/news/2025-06/17/palaestinenser-dutzende-tote-nahe-hilfszentrum-in-gaza,0,www.zeit.de,Gaza-Krieg: Palästinenser: Dutzende Tote nahe Hilfszentrum in Gaza,Hier finden Sie Informationen zu dem Thema „Gaza-Krieg“. Lesen Sie jetzt „Palästinenser: Dutzende Tote nahe Hilfszentrum in Gaza“.,https://img.zeit.de/news/2025-06/17/palaestinenser-dutzende-tote-nahe-hilfszentrum-in-gaza-image-group/wide__1300x731,2025-06-17T07:44:10Z,,Das israelische Militär soll nach palästinensischen Angaben erneut Wartende in der Nähe eines Verteilzentrums für humanitäre Hilfsgüter im Gazastreifen getötet haben. Die von der Hamas kontrollierte … [+1280 chars],,de,'Krieg'
https://www.zeit.de/news/2025-06/17/bas-kuendigt-verschaerfungen-bei-buergergeld-versaeumnissen-an,https://www.zeit.de/news/2025-06/17/bas-kuendigt-verschaerfungen-bei-buergergeld-versaeumnissen-an,0,www.zeit.de,Grundsicherung: Bas kündigt Verschärfungen bei Bürgergeld-Versäumnissen an,Hier finden Sie Informationen zu dem Thema „Grundsicherung“. Lesen Sie jetzt „Bas kündigt Verschärfungen bei Bürgergeld-Versäumnissen an“.,https://img.zeit.de/news/2025-06/17/bas-kuendigt-verschaerfungen-bei-buergergeld-versaeumnissen-an-image-group/wide__1300x731,2025-06-17T09:40:05Z,,Bundesarbeitsministerin Bärbel Bas (SPD) will Bürgergeld-Bezieherinnen und -Bezieher mit verschärften Regeln zu mehr Kooperation bewegen. Die Regierung wolle die im Koalitionsvertrag anvisierte Bürge… [+1219 chars],,de,'Bürgergeld'
https://www.stern.de/politik/deutschland/grundsicherung--bas-kuendigt-verschaerfungen-bei-buergergeld-versaeumnissen-an-35815638.html,https://www.stern.de/politik/deutschland/grundsicherung--bas-kuendigt-verschaerfungen-bei-buergergeld-versaeumnissen-an-35815638.html,0,www.stern.de,Grundsicherung: Bas kündigt Verschärfungen bei Bürgergeld-Versäumnissen an,Berlin - Bundesarbeitsministerin Bärbel Bas (SPD) will Bürgergeld-Bezieherinnen und -Bezieher mit verschärften Regeln zu mehr Kooperation bewegen. Die,https://image.stern.de/35815640/t/E3/v1/w1440/r1.7778/-/17--nrtx6kdqmxv6axs2048jpeg---08b0adf071f5a67a.jpg,2025-06-17T09:40:05Z,,"Kopiere den aktuellen Link
Zur Merkliste hinzufügen
Bereits in ihrem Koalitionsvertrag hatten Union und SPD eine härtere Gangart beim Bürgergeld angekündigt. Nun soll es schnell ein Gesetz geben.
… [+1406 chars]",,de,'Bürgergeld'
https://stadt-bremerhaven.de/chatgpt-ueber-whatsapp-bild-generierung-ab-sofort-moeglich/,https://stadt-bremerhaven.de/chatgpt-ueber-whatsapp-bild-generierung-ab-sofort-moeglich/,0,stadt-bremerhaven.de,ChatGPT über WhatsApp: Bild-Generierung ab sofort möglich,OpenAI hat die Integration von ChatGPT in WhatsApp weiter ausgebaut. Anfangs war der Dienst über WhatsApp auf eine reine textbasierte Kommunikation beschränkt. Diese hatte man mit der Unterstützung von Bildern und Sprachnachrichten weiterentwickelt. Für die N…,https://stadt-bremerhaven.de/wp-content/uploads/2025/06/Bild-14.jpg,2025-06-17T10:00:29Z,,OpenAI hat die Integration von ChatGPT in WhatsApp weiter ausgebaut. Anfangs war der Dienst über WhatsApp auf eine reine textbasierte Kommunikation beschränkt. Diese hatte man mit der Unterstützung v… [+1211 chars],,de,'Unterstützung'
https://orf.at/stories/3397009/,https://orf.at/stories/3397009/,0,orf.at,Gas aus Russland: Wien für Optionen nach Kriegsende,,https://orf.at/mojo/1_4_1/storyserver//news/common/images/og-fallback-news.png,2025-06-17T10:10:54Z,,"Staatssekretärin Elisabeth Zehetner (ÖVP) hat in Brüssel die seit Mai bekannte Position Österreichs deponiert, dass nach dem Ende des Angriffskriegs Russlands in der Ukraine alle Optionen für die Ene… [+1285 chars]",,de,'Krieg'
https://www.n-tv.de/politik/Bas-will-schwaenzende-Buergergeldempfaenger-haerter-bestrafen-article25839322.html,https://www.n-tv.de/politik/Bas-will-schwaenzende-Buergergeldempfaenger-haerter-bestrafen-article25839322.html,0,www.n-tv.de,Hohe Fehlquote in Jobcentern: Bas will schwänzende Bürgergeldempfänger härter bestrafen,"Arbeitsministerin Bas plant Reformen beim Bürgergeld. So sollen Empfänger staatlicher Hilfen, die ihren Verpflichtungen nicht nachkommen, künftig härter sanktioniert werden. Ein entsprechender Gesetzentwurf werde nun ""sehr zügig"" erarbeitet, sagt Bas.",https://www.n-tv.de/img/incoming/crop25839342/6031323028-cImg_16_9-w1200/00f2da0540897c2685a35d5f0e8885ef.jpg,2025-06-17T10:13:37Z,,"Arbeitsministerin Bas plant Reformen beim Bürgergeld. So sollen Empfänger staatlicher Hilfen, die ihren Verpflichtungen nicht nachkommen, künftig härter sanktioniert werden. Ein entsprechender Gesetz… [+1939 chars]",,de,'Bürgergeld'
