index,url,valid,domain,title,description,image,published,archive,content,quote,language,keyword
https://www.spiegel.de/ausland/ukraine-oel-preisdeckel-fuer-russland-zu-komfortabel-a-aba1d07e-9677-4e0c-857d-8c3caf35d620,https://www.spiegel.de/ausland/ukraine-oel-preisdeckel-fuer-russland-zu-komfortabel-a-aba1d07e-9677-4e0c-857d-8c3caf35d620,0,www.spiegel.de,Ukraine: Öl-Preisdeckel für Russland zu »komfortabel«,Keine »ernsthafte Entscheidung«: Kiew ist nicht zufrieden mit der von G7- und EU-Staaten auf den Weg gebrachten Preisobergrenze für russisches Öl. Die Ukraine will die russische Wirtschaft »zerstören«.,https://cdn.prod.www.spiegel.de/images/984e8043-a3c7-45ff-8c29-f4d0e9f12bce_w1280_r1.77_fpx56.74_fpy49.98.jpg,2022-12-03T21:34:01Z,https://web.archive.org/web/20221203230707/https://www.spiegel.de/ausland/ukraine-oel-preisdeckel-fuer-russland-zu-komfortabel-a-aba1d07e-9677-4e0c-857d-8c3caf35d620,"Derzeit stellen Unternehmen aus G7-Staaten rund 90 Prozent der Transportversicherungen weltweit und die EU ist ein wichtiger Akteur im Seefrachtgeschäft.
Kreml droht mit Lieferstopps
Der Kreml künd… [+562 chars]",,de,'Ukraine'
https://www.bild.de/politik/inland/politik-inland/ricarda-lang-ueber-die-ampel-haben-die-gruenen-ihre-ideale-verraten-82142004.bild.html,https://www.bild.de/politik/inland/politik-inland/ricarda-lang-ueber-die-ampel-haben-die-gruenen-ihre-ideale-verraten-82142004.bild.html,0,www.bild.de,"Kaum neue Windräder, aber Gas-Deal mit Katar - Haben die Grünen ihre Ideale verraten, Frau Lang?",Im Interview zieht Ricarda Lang Bilanz nach einem Jahr Ampel.Foto: ©Niels Starnick/Bild/BamS,"https://images.bild.de/638b721f005013569c2f101d/d659ab36f30d069e6e16b2ded7489caf,76fd6fab?w=1280",2022-12-03T21:37:26Z,https://web.archive.org/web/20221204053919/https://www.bild.de/politik/inland/politik-inland/ricarda-lang-ueber-die-ampel-haben-die-gruenen-ihre-ideale-verraten-82142004.bild.html,"Sie ist die mit Abstand jüngste Teilnehmerin bei den Spitzentreffen der Ampel-Koalition: Ricarda Lang (28) führt seit Februar zusammen mit Omid Nouripour (47) die Grünen, verhandelt regelmäßig mit Ka… [+5450 chars]",,de,'Katar'
https://www.bild.de/politik/inland/politik-inland/ein-jahr-an-der-regierung-der-ampel-absturz-82143358.bild.html,https://www.bild.de/politik/inland/politik-inland/ein-jahr-an-der-regierung-der-ampel-absturz-82143358.bild.html,0,www.bild.de,Ein Jahr an der Regierung - Der Ampel-Absturz,"Keine Mehrheit mehr für Rot-Gelb-Grün, zwei Drittel der Wähler sind unzufrieden. Bundeskanzler Olaf Scholz in Not.","https://images.bild.de/638b8c71943c031d82ced18a/c20ddbf8cb4df739b6ba6151247fd063,cb4c9884?w=1280",2022-12-03T22:16:04Z,https://web.archive.org/web/20221204074955/https://www.bild.de/politik/inland/politik-inland/ein-jahr-an-der-regierung-der-ampel-absturz-82143358.bild.html,"Geburtstag für die Ampel!
Am Donnerstag ist es ein Jahr her, dass Olaf Scholz (64, SPD) zum neunten Bundeskanzler der Bundes­republik vereidigt wurde. Doch statt Geschenken gibt es Noten für die Reg… [+1877 chars]",,de,'Olaf Scholz'
https://www.welt.de/politik/deutschland/article242474227/Sonntagstrend-Ampelkoalition-ohne-Mehrheit-ein-Jahr-nach-Amtsuebernahme.html,https://www.welt.de/politik/deutschland/article242474227/Sonntagstrend-Ampelkoalition-ohne-Mehrheit-ein-Jahr-nach-Amtsuebernahme.html,0,www.welt.de,Ampelkoalition ohne Mehrheit ein Jahr nach Amtsübernahme,"Chaos um Gasumlage und Impfpflicht, Streit um Atomkraft und Waffenlieferungen, Scheitern beim Wohnungsbau: Vom ersten Jahr der Ampelkoalition bleibt den Deutschen nicht nur Gutes in Erinnerung. In einer Umfrage hat das Bündnis die Mehrheit verloren.",https://img.welt.de/img/bildergalerien/mobile242474223/9361359297-ci16x9-w1200/Verleihung-des-Deutschen-Nachhaltigkeitspreises.jpg,2022-12-04T00:10:50Z,https://web.archive.org/web/20221204010500/https://www.welt.de/politik/deutschland/article242474227/Sonntagstrend-Ampelkoalition-ohne-Mehrheit-ein-Jahr-nach-Amtsuebernahme.html,"Ein Jahr nach ihrer Amtsübernahme hat die Ampel-Regierung in der Wählergunst deutlich an Zustimmung eingebüßt. Im Sonntagstrend des Meinungsforschungsinstituts INSA kommen SPD, Grüne und FDP gemeinsa… [+4802 chars]",,de,'Gas'
https://www.n-tv.de/politik/06-02-Microsoft-Russland-wird-Cyberangriffe-auf-Ukraine-und-Verbuendete-verstaerken--article23143824.html,https://www.n-tv.de/politik/06-02-Microsoft-Russland-wird-Cyberangriffe-auf-Ukraine-und-Verbuendete-verstaerken--article23143824.html,0,www.n-tv.de,Ukraine-Krieg im Liveticker: +++ 06:02 Microsoft: Russland wird Cyberangriffe auf Ukraine und Verbündete verstärken +++,"Berlin, Washington, Br\u00fcssel - \u00fcberall. n-tv berichtet von allen wichtigen Schaupl\u00e4tzen der Innen- und Au\u00dfenpolitik.",https://bilder2.n-tv.de/img/incoming/crop23332537/9041326157-cImg_16_9-w1200/Liveticker1-grau-1-Kopie.jpg,2022-12-04T00:22:00Z,,"Mit den zunehmenden Verlusten im Krieg gegen die Ukraine wird Russland seine Cyberangriffe auf die Ukraine und dessen Verbündete verstärken, schreibt Clint Watts, Leiter des Microsoft-Analysezentrums… [+5292 chars]",,de,'Krieg'
https://www.n-tv.de/politik/01-21-Macron-will-in-Kuerze-mit-Putin-sprechen--article23143824.html,https://www.n-tv.de/politik/01-21-Macron-will-in-Kuerze-mit-Putin-sprechen--article23143824.html,0,www.n-tv.de,"Ukraine-Krieg im Liveticker: +++ 01:21 Macron will ""in Kürze"" mit Putin sprechen +++","Berlin, Washington, Br\u00fcssel - \u00fcberall. n-tv berichtet von allen wichtigen Schaupl\u00e4tzen der Innen- und Au\u00dfenpolitik.",https://bilder2.n-tv.de/img/incoming/crop23332537/9041326157-cImg_16_9-w1200/Liveticker1-grau-1-Kopie.jpg,2022-12-04T00:22:00Z,,"Der französische Präsident Emmanuel Macron will heute mit dem Chef der Internationalen Atomenergiebehörde (IAEA), Rafael Grossi, und ""in Kürze"" auch mit Russlands Präsident Wladimir Putin über die Si… [+2434 chars]",,de,'Ukraine'
https://www.n-tv.de/politik/06-50-Finnischer-Aussenminister-Russlands-nukleare-Drohungen-Grund-NATO-Beitrittsbestrebungen--article23143824.html,https://www.n-tv.de/politik/06-50-Finnischer-Aussenminister-Russlands-nukleare-Drohungen-Grund-NATO-Beitrittsbestrebungen--article23143824.html,0,www.n-tv.de,"Ukraine-Krieg im Liveticker: +++ 06:50 Finnischer Außenminister: Russlands ""nukleare Drohungen"" Grund NATO-Beitrittsbestrebungen +++","Berlin, Washington, Br\u00fcssel - \u00fcberall. n-tv berichtet von allen wichtigen Schaupl\u00e4tzen der Innen- und Au\u00dfenpolitik.",https://bilder2.n-tv.de/img/incoming/crop23332537/9041326157-cImg_16_9-w1200/Liveticker1-grau-1-Kopie.jpg,2022-12-04T00:22:00Z,,"Der Hauptgrund für Finnlands Bestreben, der NATO beizutreten, seien die angeblichen nuklearen Drohungen Russlands nach dem Beginn der militärischen Sonderoperation in der Ukraine gewesen, sagt der fi… [+6096 chars]",,de,'Ukraine'
https://www.n-tv.de/politik/10-22-Schwere-Kaempfe-in-Bachmut-Vier-bekannte-ukrainische-Soldaten-innerhalb-weniger-Stunden-getoetet--article23143824.html,https://www.n-tv.de/politik/10-22-Schwere-Kaempfe-in-Bachmut-Vier-bekannte-ukrainische-Soldaten-innerhalb-weniger-Stunden-getoetet--article23143824.html,0,www.n-tv.de,"Ukraine-Krieg im Liveticker: +++ 10:22 Schwere Kämpfe in Bachmut: ""Vier bekannte ukrainische Soldaten innerhalb weniger Stunden getötet +++","Berlin, Washington, Br\u00fcssel - \u00fcberall. n-tv berichtet von allen wichtigen Schaupl\u00e4tzen der Innen- und Au\u00dfenpolitik.",https://bilder2.n-tv.de/img/incoming/crop23332537/9041326157-cImg_16_9-w1200/Liveticker1-grau-1-Kopie.jpg,2022-12-04T00:22:00Z,,"Die Kämpfe um Bachmut intensivieren sich zunehmend. Der britische Geheimdienst ist sicher, dass die russischen Streitkräfte die Stadt einkesseln wollen. Für beiden Seiten sind die Gefechte verlustrei… [+9141 chars]",,de,'Ukraine'
https://www.n-tv.de/politik/03-51-US-Geheimdienste-Kaempfe-werden-sich-weiter-verlangsamen--article23143824.html,https://www.n-tv.de/politik/03-51-US-Geheimdienste-Kaempfe-werden-sich-weiter-verlangsamen--article23143824.html,0,www.n-tv.de,Ukraine-Krieg im Liveticker: +++ 03:51 US-Geheimdienste: Kämpfe werden sich weiter verlangsamen +++,"Berlin, Washington, Br\u00fcssel - \u00fcberall. n-tv berichtet von allen wichtigen Schaupl\u00e4tzen der Innen- und Au\u00dfenpolitik.",https://bilder2.n-tv.de/img/incoming/crop23332537/9041326157-cImg_16_9-w1200/Liveticker1-grau-1-Kopie.jpg,2022-12-04T00:22:00Z,,"Die US-Geheimdienste gehen davon aus, dass sich das verlangsamte Kampfgeschehen in der Ukraine fortsetzen wird. ""Wir sehen bereits eine Art reduziertes Tempo des Konflikts und wir erwarten, dass sich… [+3958 chars]",,de,'Krieg'
https://www.n-tv.de/politik/02-40-Nasa-Russland-hat-Weizen-in-Milliardenwert-geraubt--article23143824.html,https://www.n-tv.de/politik/02-40-Nasa-Russland-hat-Weizen-in-Milliardenwert-geraubt--article23143824.html,0,www.n-tv.de,Ukraine-Krieg im Liveticker: +++ 02:40 Nasa: Russland hat Weizen in Milliardenwert geraubt +++,"Berlin, Washington, Br\u00fcssel - \u00fcberall. n-tv berichtet von allen wichtigen Schaupl\u00e4tzen der Innen- und Au\u00dfenpolitik.",https://bilder2.n-tv.de/img/incoming/crop23332537/9041326157-cImg_16_9-w1200/Liveticker1-grau-1-Kopie.jpg,2022-12-04T00:22:00Z,https://web.archive.org/web/20221204015524/https://www.n-tv.de/politik/02-40-Nasa-Russland-hat-Weizen-in-Milliardenwert-geraubt--article23143824.html,"Russland hat nach Angaben der US-Raumfahrtbehörde Nasa in diesem Jahr wohl Weizen im Wert von rund einer Milliarde Dollar, rund 950 Millionen Euro, von ukrainischen Feldern geerntet. Rund 5,8 Million… [+3225 chars]",,de,'Krieg'
https://www.n-tv.de/politik/11-13-USA-Russen-verbrauchen-Munition-schneller-als-sie-sie-ersetzen-koennen--article23143824.html,https://www.n-tv.de/politik/11-13-USA-Russen-verbrauchen-Munition-schneller-als-sie-sie-ersetzen-koennen--article23143824.html,0,www.n-tv.de,"Ukraine-Krieg im Liveticker: +++ 11:13 USA: Russen verbrauchen Munition schneller, als sie sie ersetzen können +++","Berlin, Washington, Br\u00fcssel - \u00fcberall. n-tv berichtet von allen wichtigen Schaupl\u00e4tzen der Innen- und Au\u00dfenpolitik.",https://bilder2.n-tv.de/img/incoming/crop23332537/9041326157-cImg_16_9-w1200/Liveticker1-grau-1-Kopie.jpg,2022-12-04T00:22:00Z,,"Die russischen Streitkräfte in der Ukraine verbrauchen ihre Munition schneller, als die Rüstungsindustrie des Landes sie ersetzen kann, sagt die Direktorin des US-Geheimdienstes Avril Haines dem Send… [+9823 chars]",,de,'Wladimir Putin'
https://www.n-tv.de/politik/09-41-US-Verteidigungsminister-Ein-Mann-hat-den-Krieg-gewaehlt--article23143824.html,https://www.n-tv.de/politik/09-41-US-Verteidigungsminister-Ein-Mann-hat-den-Krieg-gewaehlt--article23143824.html,0,www.n-tv.de,"Ukraine-Krieg im Liveticker: +++ 09:41 US-Verteidigungsminister: ""Ein Mann hat den Krieg gewählt"" +++","Berlin, Washington, Br\u00fcssel - \u00fcberall. n-tv berichtet von allen wichtigen Schaupl\u00e4tzen der Innen- und Au\u00dfenpolitik.",https://bilder2.n-tv.de/img/incoming/crop23332537/9041326157-cImg_16_9-w1200/Liveticker1-grau-1-Kopie.jpg,2022-12-04T00:22:00Z,,"Der vom russischen Präsidenten Wladimir Putin angezettelte Krieg in der Ukraine ist nicht das Ergebnis, sondern die Ursache der NATO-Erweiterung, sagt US-Verteidigungsminister Lloyd Austin auf dem Re… [+8770 chars]",,de,'Ukraine'
https://www.n-tv.de/politik/04-56-Wehrbeauftragte-will-festen-Fahrplan-fuer-Munitionsbeschaffung--article23143824.html,https://www.n-tv.de/politik/04-56-Wehrbeauftragte-will-festen-Fahrplan-fuer-Munitionsbeschaffung--article23143824.html,0,www.n-tv.de,Ukraine-Krieg im Liveticker: +++ 04:56 Wehrbeauftragte will festen Fahrplan für Munitionsbeschaffung +++,"Berlin, Washington, Br\u00fcssel - \u00fcberall. n-tv berichtet von allen wichtigen Schaupl\u00e4tzen der Innen- und Au\u00dfenpolitik.",https://bilder2.n-tv.de/img/incoming/crop23332537/9041326157-cImg_16_9-w1200/Liveticker1-grau-1-Kopie.jpg,2022-12-04T00:22:00Z,,"Die Wehrbeauftragte Eva Högl fordert einen jährlichen Fahrplan für die Neubeschaffung von Munition in einem zweistelligen Milliardenbetrag. Es sei nachvollziehbar, dass die Industrie feste Zusagen fü… [+4589 chars]",,de,'Krieg'
https://www.n-tv.de/politik/07-56-Ukrainische-Grenzsoldaten-schiessen-russischen-Kampfjet-bei-Bachmut-ab--article23143824.html,https://www.n-tv.de/politik/07-56-Ukrainische-Grenzsoldaten-schiessen-russischen-Kampfjet-bei-Bachmut-ab--article23143824.html,0,www.n-tv.de,Ukraine-Krieg im Liveticker: +++ 07:56 Ukrainische Grenzsoldaten schießen russischen Kampfjet bei Bachmut ab +++,"Berlin, Washington, Br\u00fcssel - \u00fcberall. n-tv berichtet von allen wichtigen Schaupl\u00e4tzen der Innen- und Au\u00dfenpolitik.",https://bilder2.n-tv.de/img/incoming/crop23332537/9041326157-cImg_16_9-w1200/Liveticker1-grau-1-Kopie.jpg,2022-12-04T00:22:00Z,,In der Nähe von Bachmut in der Region Donezk schießen ukrainische Grenzsoldaten ein feindliches Su-34-Kampfflugzeug ab. Das Schicksal der Piloten ist derzeit unbekannt. Es handele sich um einen der K… [+6683 chars],,de,'Wladimir Putin'
https://www.n-tv.de/politik/08-38-Litauen-wartet-weitere-deutsche-Panzerhaubitzen-fuer-die-Ukraine--article23143824.html,https://www.n-tv.de/politik/08-38-Litauen-wartet-weitere-deutsche-Panzerhaubitzen-fuer-die-Ukraine--article23143824.html,0,www.n-tv.de,Ukraine-Krieg im Liveticker: +++ 08:38 Litauen wartet weitere deutsche Panzerhaubitzen für die Ukraine +++,"Berlin, Washington, Br\u00fcssel - \u00fcberall. n-tv berichtet von allen wichtigen Schaupl\u00e4tzen der Innen- und Au\u00dfenpolitik.",https://bilder2.n-tv.de/img/incoming/crop23332537/9041326157-cImg_16_9-w1200/Liveticker1-grau-1-Kopie.jpg,2022-12-04T00:22:00Z,,Litauen schickt zwei weitere deutsche Panzerhaubitzen 2000 nach ihrer Instandsetzung in dem baltischen EU- und NATO-Land wieder in die Ukraine zurück. Zusammen mit Munition seien die beiden repariert… [+7618 chars],,de,'Krieg'
https://www.dw.com/de/ukraine-aktuell-%C3%B6l-preisdeckel-zu-komfortabel/a-63978250,https://www.dw.com/de/ukraine-aktuell-%C3%B6l-preisdeckel-zu-komfortabel/a-63978250,0,www.dw.com,"Ukraine aktuell: Öl-Preisdeckel zu ""komfortabel""","Der ukrainische Präsident Selenskyj ist enttäuscht über die von EU und G7 beschlossene Preisobergrenze für russisches Öl. Die USA glauben nicht, dass Kremlchef Putin an Friedensgesprächen interessiert ist. Der Überblick.",https://static.dw.com/image/63977451_6.jpg,2022-12-04T00:32:00Z,https://web.archive.org/web/20221204004850/https://www.dw.com/de/ukraine-aktuell-%C3%B6l-preisdeckel-zu-komfortabel/a-63978250,"Das Wichtigste in Kürze:
<ul><li>Selenskyj kritisiert Ölpreisdeckel als ineffektiv</li><li>Macron plädiert für Garantien an Russland</li><li>USA: Putin ist kein ""williger Partner""</li></ul>Der ukrai… [+6352 chars]",,de,'Kreml'
https://www.welt.de/politik/ausland/article242474299/Ukraine-News-Zustimmung-der-Russen-zum-Ukraine-Krieg-laut-britischen-Experten-stark-gesunken.html,https://www.welt.de/politik/ausland/article242474299/Ukraine-News-Zustimmung-der-Russen-zum-Ukraine-Krieg-laut-britischen-Experten-stark-gesunken.html,0,www.welt.de,Zustimmung der Russen zum Ukraine-Krieg laut britischen Experten stark gesunken,Inzwischen sollen laut Daten russischer Behörden nur noch ein Viertel der Russen den Ukraine-Krieg unterstützen. Zu Kriegsbeginn waren es 80 Prozent. Der US-Geheimdienst prognostiziert ein verlangsamtes Kampfgeschehen. Mehr im Liveticker.,https://img.welt.de/img/politik/ausland/mobile242474305/7571355287-ci16x9-w1200/The-Ukrainian-service-members-fight-and-stay-warm-in-the-Donetsk.jpg,2022-12-04T03:58:08Z,,"Dem Kreml dürfte es nach Einschätzung britischer Experten zunehmend schwerfallen, den Krieg in der Ukraine gegenüber der eigenen Bevölkerung zu rechtfertigen. Das geht aus dem täglichen Geheimdienst-… [+7405 chars]",,de,'Ukraine'
https://www.welt.de/politik/ausland/article242474299/Ukraine-News-Warum-die-Kriegsparteien-das-Kampfgeschehen-jetzt-verlangsamen.html,https://www.welt.de/politik/ausland/article242474299/Ukraine-News-Warum-die-Kriegsparteien-das-Kampfgeschehen-jetzt-verlangsamen.html,0,www.welt.de,Warum die Kriegsparteien das Kampfgeschehen jetzt verlangsamen,Trotz Kälte und Stromausfällen sei der Widerstandswillen in der Ukraine keineswegs verringert: Der US-Geheimdienst prognostiziert dennoch ein anhaltend verlangsamtes Kampfgeschehen. Und Frankreichs Präsident Macron stimmt den Westen auf Verhandlungen und Zuge…,https://img.welt.de/img/politik/ausland/mobile242474305/7571355287-ci16x9-w1200/The-Ukrainian-service-members-fight-and-stay-warm-in-the-Donetsk.jpg,2022-12-04T03:58:08Z,https://web.archive.org/web/20221204061044/https://www.welt.de/politik/ausland/article242474299/Ukraine-News-Warum-die-Kriegsparteien-das-Kampfgeschehen-jetzt-verlangsamen.html,"Der US-Geheimdienst geht davon aus, dass sich das verlangsamte Kampfgeschehen in der Ukraine fortsetzen wird. Wir sehen bereits eine Art reduziertes Tempo des Konflikts und wir erwarten, dass sich da… [+2905 chars]",,de,'Ukraine'
https://www.stern.de/wirtschaft/news/sanktionen--oel-embargo-und-preisdeckel-gegen-russland--was-bedeutet-das--32972758.html,https://www.stern.de/wirtschaft/news/sanktionen--oel-embargo-und-preisdeckel-gegen-russland--was-bedeutet-das--32972758.html,0,www.stern.de,Sanktionen: Öl-Embargo und Preisdeckel gegen Russland: Was bedeutet das?,"Die EU macht Druck. Ab heute greift das nach dem Ukraine-Krieg verhängte Öl-Embargo gegen Russland. Zugleich tritt ein Ölpreisdeckel in Kraft. Die Folgen sind komplex, auch für Deutschland.",https://image.stern.de/32972760/t/mj/v7/w1440/r1.7778/-/04--urnnewsmldpacom2009010122120399761910v3w800h600l657t568r1937b1421jpeg---a1e4ee6514120410.jpg,2022-12-04T05:42:06Z,https://web.archive.org/web/20221204060445/https://www.stern.de/wirtschaft/news/sanktionen--oel-embargo-und-preisdeckel-gegen-russland--was-bedeutet-das--32972758.html,"Die EU macht Druck. Ab heute greift das nach dem Ukraine-Krieg verhängte Öl-Embargo gegen Russland. Zugleich tritt ein Ölpreisdeckel in Kraft. Die Folgen sind komplex, auch für Deutschland.
Gut neun… [+6961 chars]",,de,'Ukraine'
https://www.zeit.de/2022/49/olaf-scholz-wirtschaftspolitik-entlastungen-schulden,https://www.zeit.de/2022/49/olaf-scholz-wirtschaftspolitik-entlastungen-schulden,0,www.zeit.de,"Olaf Scholz: Der Mann, der alles wusste","Olaf Scholz macht laute Wirtschaftspolitik und verteilt viel Geld, auch ineffizient. Steht dahinter eine größere Strategie und welche Folgen hat das für das Land?",,2022-12-04T05:45:44Z,https://web.archive.org/web/20221204060458/https://www.zeit.de/2022/49/olaf-scholz-wirtschaftspolitik-entlastungen-schulden,"When browsing with ads:
We collect personal data and also transmit it to third-party providers
 that help us improve and finance our digital content. Some of the information stored on your device, … [+732 chars]",,de,'Olaf Scholz'
https://www.spiegel.de/ausland/ukraine-krieg-selenskyj-findet-oelpreisdeckel-uneffektiv-russland-erntet-millionen-tonnen-ukrainischen-weizen-a-4fcc15a9-e6d9-43c9-9aa4-a5dafe14f09b,https://www.spiegel.de/ausland/ukraine-krieg-selenskyj-findet-oelpreisdeckel-uneffektiv-russland-erntet-millionen-tonnen-ukrainischen-weizen-a-4fcc15a9-e6d9-43c9-9aa4-a5dafe14f09b,0,www.spiegel.de,Ukraine-Krieg: Russland erntete Millionen Tonnen ukrainischen Weizen - Wolodymyr Selenskyj nennt Ölpreisdeckel uneffektiv,"Die Sanktionen gegen Öl aus Russland wirken nicht, sagt der ukrainische Präsident in einer Videobotschaft. US-Forscher weisen mit Satellitenbildern nach, wie viel Getreide Russland in besetzten Gebieten plünderte. Der Überblick.",https://cdn.prod.www.spiegel.de/images/27b5e23f-6efc-49bd-948c-978b97d045a0_w1280_r1.77_fpx55.98_fpy49.99.jpg,2022-12-04T06:14:23Z,https://web.archive.org/web/20221204103519/https://www.spiegel.de/ausland/ukraine-krieg-selenskyj-findet-oelpreisdeckel-uneffektiv-russland-erntet-millionen-tonnen-ukrainischen-weizen-a-4fcc15a9-e6d9-43c9-9aa4-a5dafe14f09b,"Russlands Verteidigungsminister Schoigu besucht Verbündeten Belarus
Russlands Verteidigungsminister Schoigu besuchte derweil das verbündete Nachbarland Belarus. Bei einem Treffen mit dem autoritären… [+1408 chars]",,de,'Ukraine'
https://www.focus.de/politik/ausland/das-ukraine-update-am-morgen-experten-analysieren-scholz-putin-telefonat-russland-will-westen-manipulieren_id_180427158.html,https://www.focus.de/politik/ausland/das-ukraine-update-am-morgen-experten-analysieren-scholz-putin-telefonat-russland-will-westen-manipulieren_id_180427158.html,0,www.focus.de,Das Ukraine-Update am Morgen - Experten analysieren Scholz-Putin-Telefonat: Russland will Westen manipulieren,"Experten analysieren Scholz-Putin-Telefonat: Russland will den Westen manipulieren. Selenskyj erklärt, dass die Ukraine alle Kriegsgefangenen retten und zurückhaben wolle. Derweil wollen die EU, G7 und Australien den Preis für russisches Öl deckeln. Was heute…",https://p6.focus.de/img/fotos/id_59167649/putin-lawrow.jpg?im=Crop%3D%280%2C28%2C900%2C450%29%3BResize%3D%281200%2C627%29&hash=54aa5438287206a0563c950686298e84a6c639de8c148b13ee9886ef7ebaa088,2022-12-04T06:18:34Z,,<ul><li>Experten analysieren Scholz-Putin-Telefonat: Russland will Westen manipulieren</li></ul>Das Telefonat zwischen dem Kreml-Chef Wladimir Putin und Bundeskanzler Olaf Scholz haben die Experten d… [+8972 chars],,de,'Krieg'
https://www.fr.de/politik/krieg-ukraine-russland-putin-selenskyj-kreml-atomwaffen-soldaten-panzer-invasion-militaer-news-ticker-zr-91952307.html,https://www.fr.de/politik/krieg-ukraine-russland-putin-selenskyj-kreml-atomwaffen-soldaten-panzer-invasion-militaer-news-ticker-zr-91952307.html,0,www.fr.de,+++ Russland erntet Millionen Tonnen Weizen von Feldern in der Ukraine - fr.de,"<ol><li>+++ Russland erntet Millionen Tonnen Weizen von Feldern in der Ukraine  fr.de
</li><li>UKRAINE KRIEG: Trotz harter Gefechte - Die Front friert ein - | WELT Newsstream  WELT Nachrichtensender
</li><li>Ukraine-Krieg im Newsblog | US-Geheimdienst sieht…",https://www.fr.de/bilder/2022/12/02/91952307/30426613-ein-ausgebrannter-maehdrescher-steht-auf-einem-von-feuer-zerstoerten-getreidefeld-in-der-region-saporischschja-in-der-ukraine-2jSAlf94infe.jpg,2022-12-04T07:40:00Z,https://web.archive.org/web/20221204061731/https://www.fr.de/politik/krieg-ukraine-russland-putin-selenskyj-kreml-atomwaffen-soldaten-panzer-invasion-militaer-news-ticker-zr-91952307.html,"<ol><li>Startseite</li><li>Politik</li></ol>Erstellt: 04.12.2022Aktualisiert: 04.12.2022, 08:42 Uhr
Von: Helena Gries, Sandra Kathe, Caspar Felix Hoffmann, Stefan Krieger, Andreas Apetz
KommentareT… [+10540 chars]",,de,'Krieg'
https://www.faz.net/aktuell/wirtschaft/bundeswirtschaftsminister-habeck-ueber-krieg-und-energiewende-18505516.html,https://www.faz.net/aktuell/wirtschaft/bundeswirtschaftsminister-habeck-ueber-krieg-und-energiewende-18505516.html,0,www.faz.net,"Robert Habeck im Gespräch: „Putin soll sehen, wie leistungsfähig diese Demokratie ist“","Laut dem Bundeswirtschaftsminister steht Deutschland trotz Kriegs und Energiekrise robust da. Im Gespräch erläutert Habeck, wie es mit der Energiewende weitergeht, und warum 2023 „anders schwierig“ wird.",https://media1.faz.net/ppmedia/aktuell/678023421/1.8505511/facebook_teaser/robert-habeck-53-ist.jpg,2022-12-04T07:47:47Z,https://web.archive.org/web/20221204082220/https://www.faz.net/aktuell/wirtschaft/bundeswirtschaftsminister-habeck-ueber-krieg-und-energiewende-18505516.html,"Herr Habeck, bei Ihnen im Wirtschaftsministerium ists aus Energiespargründen ziemlich kalt. Treffen wir uns deshalb nicht dort, sondern in Ih­rem mollig warmen Bundestagsbüro?
Wir treffen uns im Bun… [+3548 chars]",,de,'Krieg'
https://taz.de/Ukrainische-Weihnachten-im-Krieg/!5897205/,https://taz.de/Ukrainische-Weihnachten-im-Krieg/!5897205/,0,taz.de,Ukrainische Weihnachten im Krieg: Feiern oder trauern,"Darf man Bäume mit Lichterschmuck aufstellen, während der Strom knapp ist und an der Front Soldaten sterben? In der Ukraine wird heftig diskutiert.",https://taz.de/picture/5952465/948/31589988-1.jpeg,2022-12-04T07:57:00Z,,"Darf man Bäume mit Lichterschmuck aufstellen, während der Strom knapp ist und an der Front Soldaten sterben? In der Ukraine wird heftig diskutiert.
Blackoutmodus auch zu Weihnachten? Hier Kyjiw währ… [+3384 chars]",,de,'Krieg'
https://www.stern.de/politik/ukraine-krieg--fsb-soll-lukaschenko-nicht-mehr-als-vertrauenswuerdig-einstufen-32971316.html,https://www.stern.de/politik/ukraine-krieg--fsb-soll-lukaschenko-nicht-mehr-als-vertrauenswuerdig-einstufen-32971316.html,0,www.stern.de,Putins Verbündeter : FSB soll Lukaschenko nicht mehr als vertrauenswürdig einstufen – das Spiel des Diktators um sein Überleben,Alexander Lukaschenko ist der letzten Verbündeten Wladimir Putins. Doch die Koalition der Diktatoren beruht vor allem auf Zweckdienlichkeit. Wie lange wird diese jedoch noch halten?,https://image.stern.de/32971318/t/MY/v3/w1440/r1.7778/-/lukaschenko-putin-ukraine-krieg.jpg,2022-12-04T08:10:00Z,,"Alexander Lukaschenko ist der letzten Verbündeten Wladimir Putins. Doch die Koalition der Diktatoren beruht vor allem auf Zweckdienlichkeit. Wie lange wird diese jedoch noch halten? 
Dieser Beitrag … [+6283 chars]",,de,'Wladimir Putin'
