index,url,valid,domain,title,description,image,published,archive,content,quote,language,keyword
https://www.n-tv.de/politik/20-00-Trump-zu-Druck-auf-Russland-Phase-2-und-3-in-Hinterhand--article23143824.html,https://www.n-tv.de/politik/20-00-Trump-zu-Druck-auf-Russland-Phase-2-und-3-in-Hinterhand--article23143824.html,0,www.n-tv.de,Ukraine-Krieg im Liveticker: +++ 20:00 Trump zu Druck auf Russland: Phase 2 und 3 in Hinterhand +++,Lesen Sie alle aktuellen Entwicklungen und Nachrichten über den russischen Angriffskrieg auf die Ukraine im Liveticker von ntv.de.,https://www.n-tv.de/img/incoming/crop25117070/8311326854-cImg_16_9-w1200/Ukraine-Liveticker.jpg,2025-09-02T22:12:00Z,,"US-Präsident Donald Trump hat sich gegen den Eindruck gewehrt, er würde in den Bemühungen um ein Ende des russischen Angriffskrieges gegen die Ukraine Kremlchef Wladimir Putin nicht stark genug unter… [+30857 chars]",,de,'Ukraine'
https://www.n-tv.de/politik/13-35-China-protzt-mit-Waffenschau-Xi-im-Bund-mit-Putin-und-Kim--article23143824.html,https://www.n-tv.de/politik/13-35-China-protzt-mit-Waffenschau-Xi-im-Bund-mit-Putin-und-Kim--article23143824.html,0,www.n-tv.de,Ukraine-Krieg im Liveticker: +++ 13:35 China protzt mit Waffenschau - Xi im Bund mit Putin und Kim +++,Lesen Sie alle aktuellen Entwicklungen und Nachrichten über den russischen Angriffskrieg auf die Ukraine im Liveticker von ntv.de.,https://www.n-tv.de/img/incoming/crop25117070/8311326854-cImg_16_9-w1200/Ukraine-Liveticker.jpg,2025-09-02T22:12:00Z,https://web.archive.org/web/20250903115440/https://www.n-tv.de/politik/13-35-China-protzt-mit-Waffenschau-Xi-im-Bund-mit-Putin-und-Kim--article23143824.html,"Laserkanonen, Kampfroboter, Unterwasserdrohnen und dazu Tausende Soldaten im Gleichschritt: Mit einer machtvollen Militärparade feiert China in Peking den 80. Jahrestag des Endes des Zweiten Weltkrie… [+20368 chars]",,de,'Ukraine'
https://www.n-tv.de/politik/14-25-Trump-mischt-bei-Ukraine-Treffen-am-Donnerstag-womoeglich-direkt-mit--article23143824.html,https://www.n-tv.de/politik/14-25-Trump-mischt-bei-Ukraine-Treffen-am-Donnerstag-womoeglich-direkt-mit--article23143824.html,0,www.n-tv.de,Ukraine-Krieg im Liveticker: +++ 14:25 Trump mischt bei Ukraine-Treffen am Donnerstag womöglich direkt mit +++,Lesen Sie alle aktuellen Entwicklungen und Nachrichten über den russischen Angriffskrieg auf die Ukraine im Liveticker von ntv.de.,https://www.n-tv.de/img/incoming/crop25117070/8311326854-cImg_16_9-w1200/Ukraine-Liveticker.jpg,2025-09-02T22:12:00Z,https://web.archive.org/web/20250903123511/https://www.n-tv.de/politik/14-25-Trump-mischt-bei-Ukraine-Treffen-am-Donnerstag-womoeglich-direkt-mit--article23143824.html,"Bei der Ukraine-Konferenz am Donnerstag wird nach Angaben von Regierungssprecher Stefan Kornelius möglicherweise US-Präsident Donald Trump zugeschaltet. Es gebe entsprechende Überlegungen, sagt er. D… [+22110 chars]",,de,'Kreml'
https://www.n-tv.de/politik/15-36-Munz-Fuer-Putin-sind-die-Europaeer-schwach--article23143824.html,https://www.n-tv.de/politik/15-36-Munz-Fuer-Putin-sind-die-Europaeer-schwach--article23143824.html,0,www.n-tv.de,"Ukraine-Krieg im Liveticker: +++ 15:36 Munz: ""Für Putin sind die Europäer schwach"" +++",Lesen Sie alle aktuellen Entwicklungen und Nachrichten über den russischen Angriffskrieg auf die Ukraine im Liveticker von ntv.de.,https://www.n-tv.de/img/incoming/crop25117070/8311326854-cImg_16_9-w1200/Ukraine-Liveticker.jpg,2025-09-02T22:12:00Z,https://web.archive.org/web/20250903134902/https://www.n-tv.de/politik/15-36-Munz-Fuer-Putin-sind-die-Europaeer-schwach--article23143824.html,"Das Treffen in Shanghai ist nicht nur eine Zusicherung für Wladimir Putins Kriegsziele. Auch für China ist Russland ein wichtiger Partner für seine Taiwan-Pläne, wie ntv-Korrespondent Rainer Munz unt… [+23124 chars]",,de,'Krieg'
https://www.stern.de/news/xi-begruesst-putin-und-kim-vor-militaerparade-in-peking-36023590.html,https://www.stern.de/news/xi-begruesst-putin-und-kim-vor-militaerparade-in-peking-36023590.html,0,www.stern.de,Xi begrüßt Putin und Kim vor Militärparade in Peking,Chinas Präsident Xi Jinping hat Kreml-Chef Wladimir Putin und Nordkoreas Machthaber Kim Jong Un vor einer großen Militärparade in Peking zum 80. Jahrestag der Kapitulation Japans im Zweiten Weltkrieg begrüßt. Xi gab beiden am Mittwoch die Hand und unterhielt …,https://image.stern.de/36023592/t/pE/v1/w1440/r1.7778/-/03--putin-von-links-xi-und-kim-in-peking---b22f5d7f916bf551.jpg,2025-09-03T01:02:44Z,https://web.archive.org/web/20250903014944/https://www.stern.de/news/xi-begruesst-putin-und-kim-vor-militaerparade-in-peking-36023590.html,"Kopiere den aktuellen Link
Zur Merkliste hinzufügen
Chinas Präsident Xi Jinping hat Kreml-Chef Wladimir Putin und Nordkoreas Machthaber Kim Jong Un vor einer großen Militärparade in Peking zum 80. … [+963 chars]",,de,'Wladimir Putin'
https://www.sueddeutsche.de/politik/ukraine-krieg-newsblog-putin-merz-kriegsverbrecher-li.3306572,https://www.sueddeutsche.de/politik/ukraine-krieg-newsblog-putin-merz-kriegsverbrecher-li.3306572,0,www.sueddeutsche.de,Krieg in der Ukraine: Merz nennt Putin „den vielleicht schwersten Kriegsverbrecher unserer Zeit“,"Kanzler Friedrich Merz hat Russlands Präsident Wladimir Putin in einem Interview scharf kritisiert. Er fordert härtere wirtschaftliche Maßnahmen, um Russlands Kriegswirtschaft zu schwächen.",https://www.sueddeutsche.de/2025/08/17/6ef89b2f-6c68-4639-9ae0-15acd0facc51.jpg?q=60&fm=webp&width=1200&rect=0%2C182%2C3500%2C1969,2025-09-03T01:39:00Z,https://web.archive.org/web/20250903033445/https://www.sueddeutsche.de/politik/ukraine-krieg-newsblog-putin-merz-kriegsverbrecher-li.3306572,Russland hat der Darstellung von US-Präsident Donald Trump über Absprachen für ein geplantes Dreier-Gipfeltreffen mit dem ukrainischen Präsidenten Wolodimir Selenskij widersprochen. Kremlchef Wladimi… [+1262 chars],,de,'Wladimir Putin'
https://www.welt.de/politik/article68b79fd901ad191d1ad5d605/Xi-Jinping-feiert-mit-Putin-und-Kim-Jong-un-Die-Wiedergeburt-unserer-Nation-ist-unaufhaltsam-Trump-wittert-Verschwoerung.html,https://www.welt.de/politik/article68b79fd901ad191d1ad5d605/Xi-Jinping-feiert-mit-Putin-und-Kim-Jong-un-Die-Wiedergeburt-unserer-Nation-ist-unaufhaltsam-Trump-wittert-Verschwoerung.html,0,www.welt.de,"„Die Wiedergeburt Chinas ist unaufhaltsam“, sagt Xi vor Putin und Kim – Trump wittert Verschwörung","Es soll ein Zeichen der neuen Weltordnung sein. Wladimir Putin und Nordkoreas Machthaber Kim Jong-un besuchen mit Xi Jinping eine Militärparade, auf der China seine Stärke demonstrieren möchte. US-Präsident Trump reagiert empört aus der Ferne.",https://images.welt.de/68b79fd901ad191d1ad5d605/279b78c22104113877af13ee08a1d587/ci16x9-w1200/topshot-china-s-president-xi-jinp,2025-09-03T02:23:12Z,http://archive.md/20250903050938/https://www.welt.de/politik/article68b79fd901ad191d1ad5d605/Xi-Jinping-feiert-mit-Putin-und-Kim-Jong-un-Die-Wiedergeburt-unserer-Nation-ist-unaufhaltsam-Trump-wittert-Verschwoerung.html,"Es soll ein Zeichen der neuen Weltordnung sein. Wladimir Putin und Nordkoreas Machthaber Kim Jong-un besuchen mit Xi Jinping eine Militärparade, auf der China seine Stärke demonstrieren möchte. US-Pr… [+5193 chars]",,de,'Wladimir Putin'
https://www.tagesspiegel.de/sport/nationalmannschaft-hutte-ticket-titel-nagelsmann-zundet-nachste-wm-stufe-14267009.html,https://www.tagesspiegel.de/sport/nationalmannschaft-hutte-ticket-titel-nagelsmann-zundet-nachste-wm-stufe-14267009.html,0,www.tagesspiegel.de,"Nationalmannschaft: Hütte, Ticket, Titel: Nagelsmann zündet nächste WM-Stufe","Neue Taktik, neue Dominanz. Die DFB-Elf geht optimistisch in die Qualifikation für die Mega-WM 2026. Vor dem Auftakt in der Slowakei weckt eine Szene Erinnerungen an das missglückte Turnier in Katar.",https://www.tagesspiegel.de/images/14268923/alternates/BASE_16_9_W1400/1756894509000/abschlusstraining-nationalmannschaft.jpeg,2025-09-03T03:52:01Z,,Hochkonzentriert lauschte Julian Nagelsmann den Worten des wild gestikulierenden Rudi Völler. Dann schickte der Bundestrainer seinen Kapitän Joshua Kimmich als Anführer noch vor der Abreise in die Sl… [+5279 chars],,de,'Katar'
https://orf.at/stories/3404330/,https://orf.at/stories/3404330/,0,orf.at,"Xi, Kim und Putin bei Militärparade in Peking","Chinas Präsident Xi Jinping hat Kreml-Chef Wladimir Putin und Nordkoreas Machthaber Kim Jong-un zur bisher größten Militärparade in Peking begrüßt. Xi, Putin und Kim gingen über einen roten Teppich zum Tiananmen-Platz. Es war das erste Mal, dass die drei Staa…",https://ibs.orf.at/news?image=https%3A%2F%2Fassets.orf.at%2Fmims%2F2025%2F36%2F97%2Fcrops%2Fw%3D1200%2Ch%3D630%2Cq%3D75%2F2753504_master_1060997_china_putin_kim_militaerparade_r.jpg%3Fs%3D33b8db6b4767143309cb040ab3ca70174ff63036,2025-09-03T04:42:22Z,https://web.archive.org/web/20250903052159/https://orf.at/stories/3404330/,"Xi gab Putin und Kim am Mittwoch die Hand und unterhielt sich mit den Staatsgästen, wie auf Fernsehbildern zu sehen war. Anschließend wohnten die drei der gigantischen Militärparade zum 80. Jahrestag… [+4565 chars]",,de,'Kreml'
https://www.stern.de/news/staerke-demonstrieren-bei-militaerparade--xi-empfaengt-putin-und-kim---trump-wuetend-36023590.html,https://www.stern.de/news/staerke-demonstrieren-bei-militaerparade--xi-empfaengt-putin-und-kim---trump-wuetend-36023590.html,0,www.stern.de,Stärke demonstrieren bei Militärparade: Xi empfängt Putin und Kim - Trump wütend,Chinas Staatschef Xi Jinping hat den russischen Präsidenten Wladimir Putin und Nordkoreas Machthaber Kim Jong Un in Peking empfangen und mit einer großen Militärparade in Peking Stärke demonstriert. Zum Auftakt der Parade zum 80. Jahrestag der Kapitulation Ja…,https://image.stern.de/36023940/t/eR/v1/w1440/r1.7778/-/03--putin-von-links-xi-und-kim---2d02c1f463699a94.jpg,2025-09-03T05:07:58Z,https://web.archive.org/web/20250903053916/https://www.stern.de/news/staerke-demonstrieren-bei-militaerparade--xi-empfaengt-putin-und-kim---trump-wuetend-36023590.html,"Kopiere den aktuellen Link
Zur Merkliste hinzufügen
Chinas Staatschef Xi Jinping hat den russischen Präsidenten Wladimir Putin und Nordkoreas Machthaber Kim Jong Un in Peking empfangen und mit eine… [+3383 chars]",,de,'Wladimir Putin'
https://www.welt.de/politik/ausland/article68b1410cadc6ba5d53cb04da/Ukraine-Krieg-Lawrow-nennt-Bedingungen-fuer-neues-Treffen-Polen-aktiviert-Flugzeuge-nach-neuem-Kiew-Angriff-Liveticker.html,https://www.welt.de/politik/ausland/article68b1410cadc6ba5d53cb04da/Ukraine-Krieg-Lawrow-nennt-Bedingungen-fuer-neues-Treffen-Polen-aktiviert-Flugzeuge-nach-neuem-Kiew-Angriff-Liveticker.html,0,www.welt.de,Lawrow nennt Bedingungen für neues Treffen – Polen aktiviert Flugzeuge nach Luftangriff auf Kiew,"Eine gemeinsame Erklärung der 27 EU-Staaten zur Verurteilung der russischen Angriffe auf die Kiew scheitert an Ungarn. Die USA drohen im UN-Sicherheitsrat dem Kreml mit Sanktionen – und schicken Flugabwehr im Wert von 7,3 Milliarden über die dänischen Verbünd…",https://images.welt.de/68b1410cadc6ba5d53cb04da/6ad6492809adf70abf6e750a78b9915f/ci16x9-w1200/putin-und-vucic-treffen-in-peking-zusammen,2025-09-03T05:20:00Z,https://web.archive.org/web/20250903061456/https://www.welt.de/politik/ausland/article68b1410cadc6ba5d53cb04da/Ukraine-Krieg-Lawrow-nennt-Bedingungen-fuer-neues-Treffen-Polen-aktiviert-Flugzeuge-nach-neuem-Kiew-Angriff-Liveticker.html,Polen hat Flugzeuge zur Sicherung des eigenen Luftraums aktiviert. Kiew steht in der Nacht unter Beschuss. Unterdessen erwartet Russlands Außenminister Lawrow die Anerkennung territorialer Realitäten… [+10158 chars],,de,'Kreml'
https://www.tagesspiegel.de/internationales/niemand-hat-irgendetwas-ausgeheckt-moskau-widerspricht-trumps-spekulationen-zu-anti-us-verschworung-14267036.html,https://www.tagesspiegel.de/internationales/niemand-hat-irgendetwas-ausgeheckt-moskau-widerspricht-trumps-spekulationen-zu-anti-us-verschworung-14267036.html,0,www.tagesspiegel.de,„Niemand hat irgendetwas ausgeheckt“: Moskau widerspricht Trumps Spekulationen zu Anti-US-Verschwörung,"Nachdem China, Russland und Nordkorea ihre Freundschaft mit einer Militärparade feiern, wittert Trump eine Verschwörung. Der Kreml betont: „Keiner der drei Führer hat daran gedacht.“",https://www.tagesspiegel.de/images/14269160/alternates/BASE_16_9_W1400/1756895699000/russian-president-putin-on-official-visit-to-china.jpeg,2025-09-03T05:21:43Z,https://web.archive.org/web/20250903110938/https://www.tagesspiegel.de/internationales/niemand-hat-irgendetwas-ausgeheckt-moskau-widerspricht-trumps-spekulationen-zu-anti-us-verschworung-14267036.html,"China, Russland und Nordkorea planen nach Kreml-Angaben keine Verschwörung gegen die USA. Ich möchte sagen, dass niemand irgendwelche Verschwörungen angestiftet hat, niemand hat irgendetwas ausgeheck… [+5543 chars]",,de,'Kreml'
https://www.diepresse.com/20056960/xi-jinping-feiert-mit-kim-und-putin-militaerparade-in-peking-trump-richtet-gruesse-aus,https://www.diepresse.com/20056960/xi-jinping-feiert-mit-kim-und-putin-militaerparade-in-peking-trump-richtet-gruesse-aus,0,www.diepresse.com,Xi Jinping feiert mit Kim und Putin Militärparade in Peking – Trump richtet „Grüße“ aus,"In einer Militärparade demonstriert Chinas Präsident Xi Jinping Stärke, und beschwört Frieden. Erstmals tritt Xi gemeinsam mit Wladimir Putin und Kim Jong-un auf, das erzürnt US-Präsident Trump.",https://img.diepresse.com/public/incoming/x3nlx0-CHINA-DEFENCE-ANNIVERSARY-WWII-PARADE/alternates/DPR_SOCIAL_NACHRICHTEN/CHINA-DEFENCE-ANNIVERSARY-WWII-PARADE,2025-09-03T05:48:03Z,https://web.archive.org/web/20250903075127/https://www.diepresse.com/20056960/xi-jinping-feiert-mit-kim-und-putin-militaerparade-in-peking-trump-richtet-gruesse-aus,"In einer Militärparade demonstriert Chinas Präsident Xi Jinping Stärke, und beschwört Frieden. Erstmals tritt Xi gemeinsam mit Wladimir Putin und Kim Jong-un auf, das erzürnt US-Präsident Trump.
Chi… [+4612 chars]",,de,'Wladimir Putin'
https://www.sueddeutsche.de/politik/ukraine-krieg-newsblog-luftangriffe-500-drohnen-marschflugkoerper-li.3306572,https://www.sueddeutsche.de/politik/ukraine-krieg-newsblog-luftangriffe-500-drohnen-marschflugkoerper-li.3306572,0,www.sueddeutsche.de,Krieg in der Ukraine: Ukraine meldet Angriffe mit mehr als 500 Drohnen und Marschflugkörpern,"In weiten Teilen des Landes wird stundenlang Luftalarm ausgelöst. Die Attacken gelten nicht zuletzt Bahnanlagen, es gibt Einschläge an 14 Orten.",https://www.sueddeutsche.de/2025/09/03/3300a741-35e0-4ded-8491-dbe2e093fe70.jpg?q=60&fm=webp&width=1200&rect=0%2C145%2C1862%2C1047,2025-09-03T07:04:00Z,https://web.archive.org/web/20250903090601/https://www.sueddeutsche.de/politik/ukraine-krieg-newsblog-luftangriffe-500-drohnen-marschflugkoerper-li.3306572,Russland hat der Darstellung von US-Präsident Donald Trump über Absprachen für ein geplantes Dreier-Gipfeltreffen mit dem ukrainischen Präsidenten Wolodimir Selenskij widersprochen. Kremlchef Wladimi… [+1262 chars],,de,'Kreml'
https://www.tagesschau.de/ausland/europa/russland-folgen-kriegswirtschaft-100.html,https://www.tagesschau.de/ausland/europa/russland-folgen-kriegswirtschaft-100.html,0,www.tagesschau.de,"Krieg gegen die Ukraine: ""Russlands Wirtschaft verschlechtert sich rapide""",Von Peking reist Kremlchef Putin weiter zum Wirtschaftsforum in Wladiwostok. Doch Russlands wirtschaftliche Probleme dürften dort nicht angesprochen werden. Der Experte Andrey Gurkov sagt: Krieg und Sanktionen werden für Russland immer teurer.,https://images.tagesschau.de/image/6d2766fc-9711-4aa7-9353-b310d883d42e/AAABmQrr0WM/AAABmKJZ-0g/16x9-big/feuerwehr-russland-100.jpg?width=1280,2025-09-03T07:14:44Z,https://web.archive.org/web/20250903080315/https://www.tagesschau.de/ausland/europa/russland-folgen-kriegswirtschaft-100.html,"Stand: 03.09.2025 09:14 Uhr
Von Peking reist Kremlchef Putin weiter zum Wirtschaftsforum in Wladiwostok. Doch Russlands wirtschaftliche Probleme dürften dort nicht angesprochen werden. Der Experte A… [+8938 chars]",,de,'Ukraine'
https://www.stern.de/politik/ausland/china--xi-faehrt-riesige-militaerparade-vor-putin-und-kim-auf-36024184.html,https://www.stern.de/politik/ausland/china--xi-faehrt-riesige-militaerparade-vor-putin-und-kim-auf-36024184.html,0,www.stern.de,Signal in Richtung USA: Xi fährt riesige Militärparade vor Putin und Kim auf,Chinas Präsident Xi Jinping will der Welt die Stärke seines Landes zeigen. An seiner Seite: Nordkoreas Diktator Kim Jong Un und Kreml-Chef Putin.,https://image.stern.de/36024244/t/d4/v1/w1440/r1.7778/-/militaerparade-peking.jpg,2025-09-03T08:16:00Z,https://web.archive.org/web/20250903085250/https://www.stern.de/politik/ausland/china--xi-faehrt-riesige-militaerparade-vor-putin-und-kim-auf-36024184.html,"Zugang zu stern+statt 11,96 
 nur 1  
<ul><li>Alles von stern+ mit erstklassigen Inhalten von GEO und Capital</li><li>4 Wochen testen, dann 2,99  je Woche</li><li>jederzeit kündbar</li></ul>",,de,'Kreml'
https://www.stern.de/news/stromausfaelle-in-teilen-der-ukraine-nach-russischen-drohnen--und-raketenangriffen-36024322.html,https://www.stern.de/news/stromausfaelle-in-teilen-der-ukraine-nach-russischen-drohnen--und-raketenangriffen-36024322.html,0,www.stern.de,Stromausfälle in Teilen der Ukraine nach russischen Drohnen- und Raketenangriffen,"Mehr als 500 russische Drohnen- und Raketenangriffe haben in der Nacht zum Mittwoch in Teilen der Ukraine nach Angaben aus Kiew Stromausfälle verursacht. In der nordukrainischen Region Tschernihiw hätten 30.000 Menschen nach Angriffen auf ""zivile Infrastruktu…",https://image.stern.de/36024324/t/0x/v1/w1440/r1.7778/-/03--rettungskraefte-in-kiew-nach-russischen-luftangriffen---b301e584936fd94c.jpg,2025-09-03T08:23:17Z,,"Kopiere den aktuellen Link
Zur Merkliste hinzufügen
Mehr als 500 russische Drohnen- und Raketenangriffe haben in der Nacht zum Mittwoch in Teilen der Ukraine nach Angaben aus Kiew Stromausfälle ver… [+2082 chars]",,de,'Ukraine'
https://www.golem.de/sonstiges/zustimmung/auswahl.html?from=https://www.golem.de/news/ukrainekrieg-ukraine-laesst-drohnenschwaerme-autonom-fliegen-2509-199738.html&referer=https://t.co/a39a51ad59,https://www.golem.de/sonstiges/zustimmung/auswahl.html?from=https://www.golem.de/news/ukrainekrieg-ukraine-laesst-drohnenschwaerme-autonom-fliegen-2509-199738.html&referer=https://t.co/a39a51ad59,0,www.golem.de,Ukrainekrieg: Ukraine lässt Drohnenschwärme autonom fliegen,"Eine Gruppe von unterschiedlich ausgerüsteten Drohnen benötigt nur das Ziel, kann aber den Weg dahin und die Flugmanöver selbst bestimmen. (Drohne, Politik)",,2025-09-03T08:55:02Z,,"Besuchen Sie Golem.de wie gewohnt mit Werbung und Tracking,
 indem Sie der Nutzung aller Cookies zustimmen.
 Details zum Tracking finden Sie im Privacy Center.
Skript wurde nicht geladen. Informat… [+607 chars]",,de,'Ukraine'
https://www.dw.com/de/gladbachs-jens-castrop-vor-erstem-l%C3%A4nderspiel-f%C3%BCr-s%C3%BCdkorea/a-73854246,https://www.dw.com/de/gladbachs-jens-castrop-vor-erstem-l%C3%A4nderspiel-f%C3%BCr-s%C3%BCdkorea/a-73854246,0,www.dw.com,Gladbachs Jens Castrop vor erstem Länderspiel für Südkorea,Jens Castrop spielte bis zur U21 für Deutschland. Nun tritt der Bundesliga-Profi von Borussia Mönchengladbach als erster eingebürgerter Spieler für Südkorea an. Möglicherweise muss er dort sogar Militärdienst leisten. Bei der Weltmeisterschaft 2022 in Katar w…,https://static.dw.com/image/73848480_6.jpg,2025-09-03T09:47:00Z,,"Bei der Weltmeisterschaft 2022 in Katar war Südkorea neben Brasilien, Argentinien und Saudi-Arabien eines von nur vier Ländern, das keinen eingebürgerten Spieler in seinem Kader hatte. Für die südkor… [+8331 chars]",,de,'Katar'
https://www.stern.de/gesellschaft/regional/bayern/nationalmannschaft--huette--ticket--titel--nagelsmann-zuendet-naechste-wm-stufe-36023844.html,https://www.stern.de/gesellschaft/regional/bayern/nationalmannschaft--huette--ticket--titel--nagelsmann-zuendet-naechste-wm-stufe-36023844.html,0,www.stern.de,"Nationalmannschaft: Hütte, Ticket, Titel: Nagelsmann zündet nächste WM-Stufe","Neue Taktik, neue Dominanz. Die DFB-Elf geht optimistisch in die Qualifikation für die Mega-WM 2026. Vor dem Auftakt in der Slowakei weckt eine Szene Erinnerungen an das missglückte Turnier in Katar.",https://image.stern.de/36024958/t/xz/v1/w1440/r1.7778/-/03--dlq2qzvo3xv8axs2048jpeg---ae28431231b13a89.jpg,2025-09-03T10:13:49Z,,"Kopiere den aktuellen Link
Zur Merkliste hinzufügen
Neue Taktik, neue Dominanz. Die DFB-Elf geht optimistisch in die Qualifikation für die Mega-WM 2026. Vor dem Auftakt in der Slowakei weckt eine S… [+5711 chars]",,de,'Katar'
https://taz.de/Heizen-im-Winter/!6111114/,https://taz.de/Heizen-im-Winter/!6111114/,0,taz.de,Heizen im Winter: Die Gasspeicher sind zu 70 Prozent voll,"Reichen die Gasvorräte, um in einem kalten Winter die Wohnungen warm und die Industrie am Laufen zu halten? Darüber gibt es eine aufgeheizte Debatte.",https://taz.de/picture/7907881/1200/39145019-1.jpeg,2025-09-03T14:47:00Z,,"Reichen die Gasvorräte, um in einem kalten Winter die Wohnungen warm und die Industrie am Laufen zu halten? Darüber gibt es eine aufgeheizte Debatte. mehr...",,de,'Winter'
https://www.zeit.de/news/2025-09/03/putin-droht-ukraine-mit-fortsetzung-des-kriegs,https://www.zeit.de/news/2025-09/03/putin-droht-ukraine-mit-fortsetzung-des-kriegs,0,www.zeit.de,Krieg in der Ukraine: Putin droht Ukraine mit Fortsetzung des Kriegs,Hier finden Sie Informationen zu dem Thema „Krieg in der Ukraine“. Lesen Sie jetzt „Putin droht Ukraine mit Fortsetzung des Kriegs“.,https://img.zeit.de/news/2025-09/03/putin-droht-ukraine-mit-fortsetzung-des-kriegs-image-group/wide__1300x731,2025-09-03T18:25:16Z,,"Gibt es keine Einigung nach Moskaus Willen, wird Russland nach Angaben von Kremlchef Wladimir Putin seinen Krieg in der Ukraine weiter führen. «Wenn es nicht gelingt, sich über die Ukraine zu einigen… [+1671 chars]",,de,'Ukraine'
https://www.nzz.ch/mobilitaet/reichweite-im-e-auto-gewinnen-wie-elektroautos-effizienter-klimakomfort-schaffen-ld.1900372,https://www.nzz.ch/mobilitaet/reichweite-im-e-auto-gewinnen-wie-elektroautos-effizienter-klimakomfort-schaffen-ld.1900372,0,www.nzz.ch,ERKLÄRT - E-Autos heizen und kühlen frisst Energie und damit Reichweite. Das sind die Lösungen der Hersteller,Herkömmliche Motoren heizen das Auto mit. Die Passagiere von E-Autos müssen anders gewärmt werden. Zum Beispiel mit Wärmepumpen und Heizgurten.,"https://img.nzz.ch/2025/09/01/57f1b433-787d-417f-8f4e-a8f4ebef8efa.jpg?width=1200&height=675&fit=bounds&quality=75&auto=webp&crop=3404,1915,x0,y123&wmark=nzz",2025-09-04T03:30:00Z,,"Die Wärmepumpe arbeitet mit einem Kompressor, der die aufgenommene Luft verdichtet.
Die richtige Innentemperatur im Elektroauto lässt sich per Klimaanlage und Heizung einfach einstellen. Aber das ko… [+3422 chars]",,de,'Energie'
https://www.focus.de/finanzen/news/beim-buergergeld-lassen-sich-milliarden-sparen-aber-anders-als-merz-denkt_3385189e-593a-48a8-9dd7-a5dd15e0e4ac.html,https://www.focus.de/finanzen/news/beim-buergergeld-lassen-sich-milliarden-sparen-aber-anders-als-merz-denkt_3385189e-593a-48a8-9dd7-a5dd15e0e4ac.html,0,www.focus.de,"Beim Bürgergeld lassen sich Milliarden sparen - aber anders, als Merz denkt","Friedrich Merz (CDU) ist der Meinung, beim Bürgergeld ließen sich locker zehn Prozent der Kosten einsparen. Er rechnet, dass das fünf Milliarden Euro wären. Tatsächlich wäre das möglich – aber anders, als der Bundeskanzler denkt.",https://quadro.burda-forward.de/ctf/38b62f96-508e-4b3c-85a9-3abd98e9537c.0a1b9905-2273-49cc-97af-934f9f41ecb8.png?im=RegionOfInterestCrop%3D%281200%2C630%29%2CregionOfInterest%3D%281229%2C532%29&hash=8d9b406e43cd8f9b870e1e95dc9b7247b05fd25d099f7df10718c38cdd8a7053,2025-09-04T03:54:35Z,,"Rund um die Klausurtagung der Bundesregierung in Würzburg rumorte es öffentlich in der Koalition. Bundeskanzler Friedrich Merz hatte erklärt, Deutschland könne sich seinen Sozialstaat auf Dauer nicht… [+9972 chars]",,de,'heizen'
https://orf.at/stories/3404466/,https://orf.at/stories/3404466/,0,orf.at,Meinl-Reisinger dankt Katar für Vermittlung bei Geiselfreilassung,,https://orf.at/mojo/1_4_1/storyserver//news/common/images/og-fallback-news.png,2025-09-04T08:57:11Z,,"Außenministerin Beate Meinl-Reisinger (NEOS) hat dem katarischen Staatsminister Mohammed bin Abdulasis al-Chulaifi für die Vermittlungsaktivitäten seines Landes gedankt, besonders bei der Freilassung… [+1113 chars]",,de,'Katar'
https://www.zeit.de/politik/ausland/2025-09/ukraine-truppen-frieden-frankreich-macron,https://www.zeit.de/politik/ausland/2025-09/ukraine-truppen-frieden-frankreich-macron,0,www.zeit.de,Ukrainekrieg: 26 Staaten wollen sich laut Macron an Sicherungstruppe beteiligen,"Um die Ukraine nach einem Kriegsende zu schützen, sollen ausländische Truppen im Land stationiert werden. 26 Staaten hätten sich dazu verpflichtet, sagte Emmanuel Macron.",https://img.zeit.de/administratives/sharing/fallback-image-die-zeit/wide__1300x731,2025-09-04T15:03:52Z,,"26 Staaten sind nach Angaben des französischen Präsidenten Emmanuel Macron bereit dazu, Truppen zur Absicherung
eines möglichen Waffenstillstands oder Friedensschlusses in die Ukraine zu entsenden. … [+1070 chars]",,de,'Ukraine'
