index,url,valid,domain,title,description,image,published,archive,content,quote,language,keyword
https://www.freitag.de/autoren/janina-luett/kuerzungen-im-buergergeld-weiss-markus-soeder-eigentlich-wieviel-ein-doener-kostet,https://www.freitag.de/autoren/janina-luett/kuerzungen-im-buergergeld-weiss-markus-soeder-eigentlich-wieviel-ein-doener-kostet,0,www.freitag.de,"Kürzungen im Bürgergeld: Weiß Markus Söder eigentlich, wieviel ein Döner kostet?",Ein Döner ist für Menschen im Bürgergeld-Bezug inzwischen Luxus. Warum die Debatten über Kürzungen an der Lebensrealität vorbeigehen und warum Deutschland endlich über Armut statt über das Leben von Armutsbetroffenen sprechen muss Jüngst forderte Bayerns Mini…,https://www.freitag.de/autoren/janina-luett/kuerzungen-im-buergergeld-weiss-markus-soeder-eigentlich-wieviel-ein-doener-kostet/@@images/image/great,2026-07-03T16:02:00Z,,"Jüngst forderte Bayerns Ministerpräsident Markus Söder (CSU), das Bürgergeld müsse auf das „absolut verfassungsrechtliche Minimum reduziert werden“. Seine Worte vermitteln den Eindruck, als hätten wi… [+4361 chars]",,de,'Bürgergeld'
https://www.zeit.de/politik/ausland/2026-07/ukraine-lage-raketen-marschflugkoerper-fire-point-woche,https://www.zeit.de/politik/ausland/2026-07/ukraine-lage-raketen-marschflugkoerper-fire-point-woche,0,www.zeit.de,Lage in der Ukraine: Kommt die ukrainische Rakete?,Die Ukraine arbeitet an eigenen ballistischen Raketen. Eine russische Meldung legt nahe: Eine davon soll erstmals in Russland eingesetzt worden sein. Der Wochenrückblick,https://img.zeit.de/politik/ausland/2026-07/ukraine-lage-raketen-marschflugkoerper-fire-point-woche-bild-eurosatory/wide__1300x731,2026-07-03T16:36:11Z,,Die trockene Sprache der Lageberichte des russischen Verteidigungsministeriums lädt nur selten zum Aufhorchen ein. Dies gilt auf den ersten Blick auch für eine Mitteilung vom Mittwochvormittag verbre… [+14943 chars],,de,'Ukraine'
https://www.focus.de/kultur/kino-tv/buergergeld-empfaenger-pascal-will-influencer-werden-doch-erst-braucht-er-eine-auszeit_086f2ed9-e7ae-4656-a766-0c3369fcbd1a.html,https://www.focus.de/kultur/kino-tv/buergergeld-empfaenger-pascal-will-influencer-werden-doch-erst-braucht-er-eine-auszeit_086f2ed9-e7ae-4656-a766-0c3369fcbd1a.html,0,www.focus.de,Bürgergeld-Empfänger Pascal will Influencer werden – doch erst braucht er eine Auszeit,Nach dem Zerwürfnis mit seiner Mutter Petra blickt „Hartz und herzlich“-Star Pascal nach vorn. In den sozialen Netzwerken verrät der Bürgergeld-Empfänger nun seine Zukunftspläne.,"https://quadro.burda-forward.de/ctf/05544a88-63e4-4847-ae71-aed966d1f9d9.fd947eb4-fe55-4101-81f3-49d35ee8d700.jpeg?im=RegionOfInterestCrop=(1200,630),regionOfInterest=(800,450)&hash=d3bf3994999630e4fd79f57b12db1385742ffbd669cea011021ffe7bec455fbb",2026-07-03T18:47:00Z,,"Petra, Pascal und Selina, die wegen Sozialbetrugs vor Gericht standen, wurden mehrere Jahre lang für die RTLZWEI-Sozialdoku Hartz und herzlich von einem Kamerateam begleitet. Doch dann stieg die Fami… [+1803 chars]",,de,'Bürgergeld'
https://www.tagesspiegel.de/sport/wm-qualifikation-fur-2027-am-ort-des-em-triumphs-basketballer-besiegen-israel-15796036.html,https://www.tagesspiegel.de/sport/wm-qualifikation-fur-2027-am-ort-des-em-triumphs-basketballer-besiegen-israel-15796036.html,0,www.tagesspiegel.de,WM-Qualifikation für 2027: Am Ort des EM-Triumphs: Basketballer besiegen Israel,Die deutschen Basketballer machen einen wichtigen Schritt zur WM 2027 in Katar. Am Montag wartet im heimischen Bamberg eine Pflichtaufgabe in der Qualifikation.,https://www.tagesspiegel.de/images/15796035/alternates/BASE_16_9_W1400/1783105584000/israel-deutschland.jpeg,2026-07-03T19:06:24Z,,Die deutschen Basketballer haben in der WM-Qualifikation den nächsten Sieg gefeiert. Der von Kapitän Dennis Schröder angeführte Welt- und Europameister gewann in Riga gegen Israel mit 92:86 (45:37) u… [+1844 chars],,de,'Katar'
https://www.n-tv.de/sport/Voellig-veraendertes-DBB-Team-reuessiert-am-Ort-des-EM-Triumphs-id31046693.html,https://www.n-tv.de/sport/Voellig-veraendertes-DBB-Team-reuessiert-am-Ort-des-EM-Triumphs-id31046693.html,0,www.n-tv.de,Nur ein Weltmeister dabei: Völlig verändertes DBB-Team reüssiert am Ort des EM-Triumphs,"Für die deutschen Basketballer geht es um die WM 2027 in Katar. Dort wollen sie ihren WM-Titel verteidigen. Erst einmal müssen sie die Qualifikation überstehen - gegen Israel gelingt das souveräner als das Ergebnis klingt. Und das an dem Ort, an dem das Team …",https://www.n-tv.de/img/31046696/1783113997/Img_16_9/1200/Basketball-Maenner-WM-Qualifikation-Israel-Deutschland-Europa-1-Runde-Gruppe-E-5-Spieltag-Dennis-Schroeder-Deutschland-dribbelt.jpg,2026-07-03T19:49:40Z,,Für die deutschen Basketballer geht es um die WM 2027 in Katar. Dort wollen sie ihren WM-Titel verteidigen. Erst einmal müssen sie die Qualifikation überstehen - gegen Israel gelingt das souveräner a… [+2253 chars],,de,'Katar'
https://www.zeit.de/politik/ausland/2026-07/polen-ukraine-streit-upa-zweiter-weltkrieg,https://www.zeit.de/politik/ausland/2026-07/polen-ukraine-streit-upa-zweiter-weltkrieg,0,www.zeit.de,»Helden der UPA«: Außenminister Polens und der Ukraine versuchen Streit zu beruhigen,"Die Außenminister Polens und der Ukraine haben versucht, die Diplomatie zwischen den Ländern zu wahren. Zuvor war ein Streit zwischen den Präsidenten aufgeflammt.",https://img.zeit.de/administratives/sharing/fallback-image-die-zeit/wide__1300x731,2026-07-03T20:50:23Z,,Die Außenminister Polens und der Ukraine haben sich in Warschau um eine Deeskalation im Streit über die Geschichte ihrer Länder im Zweiten Weltkrieg bemüht. Der polnische Minister Radoslaw Sikorski u… [+1401 chars],,de,'Ukraine'
https://sport.orf.at/stories/3159267/,https://sport.orf.at/stories/3159267/,0,sport.orf.at,Canadi übernimmt Trainerjob in Katar,,https://sport.orf.at/mojo/1_4_1/storyserver//news/common/images/og-fallback-sport.png,2026-07-03T21:19:53Z,,"Damir Canadi, der in seiner Trainerkarriere u. a. den SCR Altach (zweimal) und Rapid (für 17 Spiele) gecoacht hat, hat einen neuen Job in Katar bekommen. Der 56-jährige Wiener übernimmt das Amt beim … [+183 chars]",,de,'Katar'
https://www.zeit.de/news/2026-07/04/lng-anteil-an-gasimporten-trotz-iran-konfliktes-gestiegen,https://www.zeit.de/news/2026-07/04/lng-anteil-an-gasimporten-trotz-iran-konfliktes-gestiegen,0,www.zeit.de,Flüssigerdgas: LNG-Anteil an Gasimporten trotz Iran-Konfliktes gestiegen,Hier finden Sie Informationen zu dem Thema „Flüssigerdgas“. Lesen Sie jetzt „LNG-Anteil an Gasimporten trotz Iran-Konfliktes gestiegen“.,https://img.zeit.de/news/2026-07/04/lng-anteil-an-gasimporten-trotz-iran-konfliktes-gestiegen-image-group/wide__1300x731,2026-07-04T02:30:05Z,,Trotz des Iran-Kriegs ist der Anteil des über die deutschen LNG-Terminals eingeführten Erdgases am Gesamtimport weiter gestiegen. Nach Zahlen der Bundesnetzagentur (BNetzA) kamen im ersten Halbjahr r… [+3222 chars],,de,'Iran'
https://www.tagesspiegel.de/wirtschaft/flussigerdgas-lng-anteil-an-gasimporten-trotz-iran-konfliktes-gestiegen-15796414.html,https://www.tagesspiegel.de/wirtschaft/flussigerdgas-lng-anteil-an-gasimporten-trotz-iran-konfliktes-gestiegen-15796414.html,0,www.tagesspiegel.de,Flüssigerdgas: LNG-Anteil an Gasimporten trotz Iran-Konfliktes gestiegen,"Der Anteil des Erdgases, das per Schiff an deutschen Küsten angeliefert wird, steigt weiter. Aber ganz ohne Auswirkungen bleibt der Iran-Konflikt nicht.",https://www.tagesspiegel.de/images/15796413/alternates/BASE_16_9_W1400/1783132285000/halbjahresbilanz-der-lng-terminals.jpeg,2026-07-04T02:31:25Z,,Trotz des Iran-Kriegs ist der Anteil des über die deutschen LNG-Terminals eingeführten Erdgases am Gesamtimport weiter gestiegen. Nach Zahlen der Bundesnetzagentur (BNetzA) kamen im ersten Halbjahr r… [+3274 chars],,de,'Gas'
https://www.focus.de/kultur/kino-tv/buergergeld-empfaenger-will-influencer-werden-doch-erst-braucht-er-eine-auszeit_086f2ed9-e7ae-4656-a766-0c3369fcbd1a.html,https://www.focus.de/kultur/kino-tv/buergergeld-empfaenger-will-influencer-werden-doch-erst-braucht-er-eine-auszeit_086f2ed9-e7ae-4656-a766-0c3369fcbd1a.html,0,www.focus.de,Bürgergeld-Empfänger will Influencer werden – doch erst braucht er eine Auszeit,Nach dem Zerwürfnis mit seiner Mutter Petra blickt „Hartz und herzlich“-Star Pascal nach vorn. In den sozialen Netzwerken verrät der Bürgergeld-Empfänger nun seine Zukunftspläne.,"https://quadro.burda-forward.de/ctf/05544a88-63e4-4847-ae71-aed966d1f9d9.fd947eb4-fe55-4101-81f3-49d35ee8d700.jpeg?im=RegionOfInterestCrop=(1200,630),regionOfInterest=(800,450)&hash=d3bf3994999630e4fd79f57b12db1385742ffbd669cea011021ffe7bec455fbb",2026-07-04T04:46:00Z,,"Petra, Pascal und Selina, die wegen Sozialbetrugs vor Gericht standen, wurden mehrere Jahre lang für die RTLZWEI-Sozialdoku Hartz und herzlich von einem Kamerateam begleitet. Doch dann stieg die Fami… [+1803 chars]",,de,'Bürgergeld'
https://www.zeit.de/news/2026-07/04/kant-klopse-krieg-80-jahre-kaliningrad-statt-koenigsberg,https://www.zeit.de/news/2026-07/04/kant-klopse-krieg-80-jahre-kaliningrad-statt-koenigsberg,0,www.zeit.de,"Geschichte einer Stadt: Kant, Klopse, Krieg: 80 Jahre Kaliningrad statt Königsberg","Hier finden Sie Informationen zu dem Thema „Geschichte einer Stadt“. Lesen Sie jetzt „Kant, Klopse, Krieg: 80 Jahre Kaliningrad statt Königsberg“.",https://img.zeit.de/news/2026-07/04/kant-klopse-krieg-80-jahre-kaliningrad-statt-koenigsberg-image-group/wide__1300x731,2026-07-04T06:00:06Z,,"Vom alten Königsberg zeugen nur noch wenige Inseln in Kaliningrad, der heute westlichsten Großstadt Russlands. Die wohl eindrucksvollste ist die Kant-Insel, der ehemalige Kneiphof. 
Majestätisch erh… [+5956 chars]",,de,'Krieg'
https://www.zeit.de/politik/ausland/2026-07/ukraine-russland-drohnenangriff-oelanlagen-ostsee-st-petersburg,https://www.zeit.de/politik/ausland/2026-07/ukraine-russland-drohnenangriff-oelanlagen-ostsee-st-petersburg,0,www.zeit.de,Ukraine-Russland-Krieg: Ukraine attackiert russische Ölanlagen bei St. Petersburg,Die Ukraine hat die Öl-Infrastruktur bei St. Petersburg erneut mit Drohnen beschossen. Im ukrainischen Sumy tötete ein russischer Bombenangriff mindestens vier Menschen.,https://img.zeit.de/politik/ausland/2026-07/ukraine-russland-drohnenangriff-oelanlagen-ostsee-st-petersburg-foto-1/wide__1300x731,2026-07-04T08:14:35Z,,"Die Ukraine hat erneut russische Ölanlagen an der Ostsee bei 
St. Petersburg mit Drohnen angegriffen. Der Gouverneur von Sankt
Petersburg, Alexander Beglow, bestätigte einen »großangelegten« Drohne… [+2541 chars]",,de,'Krieg'
https://www.zeit.de/2026/29/un-entwicklungsprogramm-budget-ebola-alexander-de-croo,https://www.zeit.de/2026/29/un-entwicklungsprogramm-budget-ebola-alexander-de-croo,0,www.zeit.de,UN-Entwicklungsprogramm: Mit Steuerbeamten gegen den Hunger,"Ein Krieg endet nicht, wenn keine Bomben mehr fallen, sagt der Chef des UN-Entwicklungsprogramms. Hier erklärt er, wie Steuerbeamte gegen Hunger helfen sollen.",https://img.zeit.de/2026/29/mit-steuerbeamten-gegen-den-hunger-bild-1/wide__1300x731,2026-07-04T12:23:02Z,,"Inhalt
Auf einer Seite lesen
 Inhalt
<ol><li>Seite 1Mit Steuerbeamten gegen den Hunger
</li><li>Seite 2»Ein Krieg endet nicht, wenn keine Bomben mehr fallen«</li><li>Seite 3»Wir müssten auch den … [+3852 chars]",,de,'Krieg'
https://www.zeit.de/politik/ausland/2026-07/trauerfeier-iran-ali-chamenei-staatschef-teheran,https://www.zeit.de/politik/ausland/2026-07/trauerfeier-iran-ali-chamenei-staatschef-teheran,0,www.zeit.de,Trauerfeier im Iran: Ein Toter soll Stärke zeigen,"Ab heute wird Ali Chamenei, der im Krieg getötete Staatschef, in Teheran aufgebahrt. Selbst Saudi-Arabien gibt sich die Ehre. Was das über den Zustand des Regimes sagt.",https://img.zeit.de/politik/ausland/2026-07/dsc07136-copy-bildtrauerfeier-iran-ali-chamenei-staatschef-teheran-bildneu-bild-07/wide__1300x731,2026-07-04T12:27:33Z,,"Die Bilder von diesem Wochenende sollen grandios werden. Im Iran beginnen die Trauerfeierlichkeiten für Ali Chamenei, ehemals Staatsoberhaupt und sogenannter Revolutionsführer, der bereits am ersten … [+421 chars]",,de,'Krieg'
https://www.bild.de/news/inland/irrwitzige-regelung-kein-buergergeld-mehr-fuer-menschen-mit-haftbefehl-6a4791820b14ed961bb50833,https://www.bild.de/news/inland/irrwitzige-regelung-kein-buergergeld-mehr-fuer-menschen-mit-haftbefehl-6a4791820b14ed961bb50833,0,www.bild.de,Regierung will es stoppen - Kein Bürgergeld mehr für Menschen mit Haftbefehl,Bislang konnten sogar gesuchte Mörder und Vergewaltiger Bürgergeld beziehen. Das soll jetzt ein Ende haben.,"https://images.bild.de/6a4791820b14ed961bb50833/0466b5b6b89cdb907749e786720ad09e,a315d30d?w=1280",2026-07-04T17:02:32Z,,"+++Souverän ins Achtelfinale von Wimbledon: Zverev unaufhaltsam
+++Souverän ins Achtelfinale von Wimbledon: Zverev unaufhaltsam
+++Souverän ins Achtelfinale von Wimbledon: Zverev unaufhaltsam
+++S… [+448 chars]",,de,'Bürgergeld'
https://www.zeit.de/politik/ausland/2026-07/trump-putin-selenskyj-ukraine-telefonat-nato-gipfel,https://www.zeit.de/politik/ausland/2026-07/trump-putin-selenskyj-ukraine-telefonat-nato-gipfel,0,www.zeit.de,Ukraine-Krieg: Trump bietet nach Gespräche mit Putin und Selenskyj Vermittlung an,"Der US-Präsident hat der Ukraine Hilfe bei der Beendigung des Krieges angeboten. Zu Wladimir Putin sagte Trump, er werde sich für ein rasches Ende der Kämpfe einsetzen.",https://img.zeit.de/politik/ausland/2026-07/trump-putin-selenskyj-ukraine-telefonat-nato-gipfel-foto-1/wide__1300x731,2026-07-05T00:55:48Z,,US-Präsident Donald Trump hat nach Gesprächen mit dem russischen Staatschef Wladimir Putin und dem ukrainischen Präsidenten Wolodymyr Selenskyj Hilfe bei der Beendigung des Ukraine-Kriegs angeboten. … [+1826 chars],,de,'Wladimir Putin'
https://www.zeit.de/news/2026-07/06/wer-hat-den-iran-krieg-gewonnen,https://www.zeit.de/news/2026-07/06/wer-hat-den-iran-krieg-gewonnen,0,www.zeit.de,Krieg in Nahost: Wer hat den Iran-Krieg gewonnen?,Hier finden Sie Informationen zu dem Thema „Krieg in Nahost“. Lesen Sie jetzt „Wer hat den Iran-Krieg gewonnen?“.,https://img.zeit.de/news/2026-07/06/wer-hat-den-iran-krieg-gewonnen-image-group/wide__1300x731,2026-07-06T02:57:05Z,,"Donald Trump spricht von einem Sieg der USA. Israels Ministerpräsident Benjamin Netanjahu feiert einen «historischen Erfolg», und auch Teheran reklamiert den Kriegsausgang für sich. Doch Experten zie… [+6214 chars]",,de,'Krieg'
https://www.zeit.de/politik/ausland/2026-07/kiew-russland-luftangriffe-raketen-drohnen-tote,https://www.zeit.de/politik/ausland/2026-07/kiew-russland-luftangriffe-raketen-drohnen-tote,0,www.zeit.de,Russische Luftangriffe: Schwere russische Angriffe auf die Ukraine vor Nato-Gipfel,Mindestens sieben Menschen sind bei russischen Angriffen auf die Ukraine getötet worden. Selenskyj hatte vor heftigen Attacken kurz vor dem Nato-Gipfel gewarnt.,https://img.zeit.de/politik/ausland/2026-07/rettungskraefte-ort-russischer-raketenangriff-beschaedigtes-gebaeude-kyjiw/wide__1300x731,2026-07-06T04:38:18Z,,"Am Tag vor dem Nato-Gipfel in der Türkei hat Russland die nächste schwere 
Angriffswelle auf ukrainische Städte durchgeführt. Kurz nach Mitternacht 
löste die Flugabwehr in fast allen Landesregione… [+1025 chars]",,de,'Ukraine'
https://www.focus.de/politik/deutschland/die-wahrheit-zum-start-der-neuen-grundsicherung-bei-fast-jedem-5-empfaenger-fehlt-arbeitswille-komplett_94fae66b-d8fc-47a9-b79e-f2c6d00c180d.html,https://www.focus.de/politik/deutschland/die-wahrheit-zum-start-der-neuen-grundsicherung-bei-fast-jedem-5-empfaenger-fehlt-arbeitswille-komplett_94fae66b-d8fc-47a9-b79e-f2c6d00c180d.html,0,www.focus.de,Die Wahrheit zum Start der neuen Grundsicherung: Bei fast jedem 5. Empfänger fehlt Arbeitswille komplett,Bürgergeld wird meist als Frage von Sanktionen diskutiert. Daten zeigen jedoch ein tieferes Problem: Für viele ist Arbeit kein Ziel mehr.,"https://quadro.burda-forward.de/ctf/91ce20d1-9567-4061-92e9-fd22a83ec6bd.f2eb3b67-35e9-4cc8-8878-c44aae880328.jpg?im=RegionOfInterestCrop=(1200,630),regionOfInterest=(2520,833)&hash=0b2891cfe2ee07a2d17855296dbea71e7548f1348e9f8acc69aa08951dc207e1",2026-07-06T06:42:00Z,,"Und sie beginnt stets von Neuem: Die Bürgergeld-Debatte kreist wieder um Förderung, Sanktionen, Hilfsbedürftige und Totalverweigerer. Viele Bürger fragen sich daher, ob der Staat seine Mittel in dies… [+5587 chars]",,de,'Bürgergeld'
https://www.zeit.de/politik/ausland/2026-07/krieg-ukraine-krim-drohnen-angriff-wladimir-putin,https://www.zeit.de/politik/ausland/2026-07/krieg-ukraine-krim-drohnen-angriff-wladimir-putin,0,www.zeit.de,Krieg in der Ukraine: Wolodymyr Selenskyj hat einen Plan für die Krim,Putin versprach den Krimbewohnern blühende Landschaften. Nun stürzen ukrainische Angriffe die Halbinsel in die Krise – und bringen die Besatzer in Bedrängnis.,https://img.zeit.de/politik/ausland/2026-07/krieg-ukraine-krim-drohnen-angriff-wladimir-putin-bild/wide__1300x731,2026-07-06T07:31:09Z,,"Beruhigende Worte für die Krimbewohner hat Sergej Aksjonow, der Chef der russischen Besatzungsverwaltung, in dieser Woche nicht mehr allzu viele. »Leider«, sagt Aksjonow in einer Videobotschaft, »wer… [+755 chars]",,de,'Krieg'
"https://www.gamestar.de/artikel/china-klimatechnik-verdunstungskaelte,3455848.html","https://www.gamestar.de/artikel/china-klimatechnik-verdunstungskaelte,3455848.html",0,www.gamestar.de,"Special: Energie - Regen, der nicht vom Himmel fällt: Wie China die Klimatisierung von Gebäuden neu denken und dabei weniger Strom verbrauchen will","Wasserschleier steigen zwischen Hochhäusern auf: Ein skurriles Projekt nutzt ein altbekanntes Prinzip, um ganze Wohnviertel abzukühlen.",https://images.cgames.de/images/gamestar/293/china-klimatisierung-verdunstungskälte-bildquelle-youtube-chinese-embassy-uk_6427464.jpg,2026-07-06T10:27:00Z,,"Von unten kaum von Nieselregen zu unterscheiden: Verdunstungskälte im großen Maßstab umgesetzt. (Bildquelle: YouTube, Chinese Embassy UK)
Über einer Wohnanlage in der chinesischen Metropole Yuncheng… [+4429 chars]",,de,'Energie'
https://www.focus.de/finanzen/gkv-entwurf-bund-will-2-milliarden-mehr-fuer-buergergeld-zahlen_e8f0f2dd-b574-486c-858a-30d5999d72ef.html,https://www.focus.de/finanzen/gkv-entwurf-bund-will-2-milliarden-mehr-fuer-buergergeld-zahlen_e8f0f2dd-b574-486c-858a-30d5999d72ef.html,0,www.focus.de,GKV-Entwurf: Bund will 2 Milliarden mehr für Bürgergeld zahlen,Interner GKV-Entwurf: Der Bund will ab 2027 rund zwei Milliarden Euro mehr für Bürgergeld-Bezieher zahlen. Hintergrund sind Klagen der Krankenkassen.,"https://quadro.burda-forward.de/ctf/1208c685-30ae-4d0c-adc6-80056f9b95a8.8f96f92a-8d11-45d6-a0c9-2977088eefe3.jpeg?im=RegionOfInterestCrop=(1200,630),regionOfInterest=(1082,439)&hash=fe0c53516767e76dde19af01d2451d5f3d0eee27f18cdcdfbb1cb8360fb4e647",2026-07-06T13:26:00Z,,"Die Bundesregierung will offenbar auf einen der größten Kritikpunkte der gesetzlichen Krankenkassen reagieren. Nach einer internen Änderungsfassung des GKV-Beitragssatzstabilisierungsgesetzes, die FO… [+2377 chars]",,de,'Bürgergeld'
https://www.zeit.de/politik/ausland/2026-07/ukraine-krieg-kyjiw-ballistische-raketen-patriot-flugabwehr-verhandlungen-nato-gipfel,https://www.zeit.de/politik/ausland/2026-07/ukraine-krieg-kyjiw-ballistische-raketen-patriot-flugabwehr-verhandlungen-nato-gipfel,0,www.zeit.de,Russische Raketenangriffe: Was das Flugabwehr-Problem der Ukraine für den Krieg bedeutet,"Russland greift Kyjiw mit 23 ballistischen Raketen an, keine davon wird abgewehrt. Damit setzt sich ein Trend fort, der Hoffnungen auf ein baldiges Kriegsende schmälert.",https://img.zeit.de/politik/ausland/2026-07/ukraine-krieg-kyjiw-ballistische-raketen-patriot-flugabwehr-verhandlungen-nato-gipfel-bild/wide__1300x731,2026-07-06T14:48:56Z,,Binnen weniger Tage hat Russland die ukrainische Hauptstadt zwei großen Luftangriffen unterzogen. Zwischen Donnerstag und dem heutigen Montag setzte das russische Militär bei Angriffen auf die Ukrain… [+9736 chars],,de,'Ukraine'
https://www.zeit.de/news/2026-07/07/was-laesst-sich-beim-tankstopp-abseits-der-autobahn-sparen,https://www.zeit.de/news/2026-07/07/was-laesst-sich-beim-tankstopp-abseits-der-autobahn-sparen,0,www.zeit.de,Spritpreise: Was lässt sich beim Tankstopp abseits der Autobahn sparen?,Hier finden Sie Informationen zu dem Thema „Spritpreise“. Lesen Sie jetzt „Was lässt sich beim Tankstopp abseits der Autobahn sparen?“.,https://img.zeit.de/news/2026-07/07/was-laesst-sich-beim-tankstopp-abseits-der-autobahn-sparen-image-group/wide__1300x731,2026-07-07T02:00:26Z,,"Wer zum Tanken die Autobahn verlässt, kann nach Angaben des ADAC kräftig Geld sparen. Im Landesdurchschnitt sind das nach einer Untersuchung des Verkehrsclubs rund 17 Cent in Brandenburg bei Super E1… [+1760 chars]",,de,'sparen'
https://www.zeit.de/news/2026-07/07/hessen-verstaerkt-spionageabwehr,https://www.zeit.de/news/2026-07/07/hessen-verstaerkt-spionageabwehr,0,www.zeit.de,Sicherheit: Hessen verstärkt Spionageabwehr,Hier finden Sie Informationen zu dem Thema „Sicherheit“. Lesen Sie jetzt „Hessen verstärkt Spionageabwehr“.,https://img.zeit.de/news/2026-07/07/hessen-verstaerkt-spionageabwehr-image-group/wide__1300x731,2026-07-07T02:00:44Z,,"Hessen baut seine Spionageabwehr aus. «Wir werden dafür in den kommenden Wochen einen neuen Schwerpunkt beim Landesamt für Verfassungsschutz setzen», sagte Innenminister Roman Poseck (CDU) in einem I… [+1359 chars]",,de,'Sicherheit'
https://www.tagesspiegel.de/gesellschaft/die-burgergeldregeln-zu-andern-war-richtig-weil-menschen-keine-engel-sind-15805576.html,https://www.tagesspiegel.de/gesellschaft/die-burgergeldregeln-zu-andern-war-richtig-weil-menschen-keine-engel-sind-15805576.html,0,www.tagesspiegel.de,"Die Bürgergeldregeln zu ändern, war richtig: Weil Menschen keine Engel sind","Die Verschärfungen bei den Sozialleistungen wurden auch im Tagesspiegel scharf kritisiert. Doch es gibt grundsätzliche Prioritäten, die ein Land haben und durchsetzen sollte.",https://www.tagesspiegel.de/images/15811986/alternates/BASE_16_9_W1400/1783427519000/2026-07-07-ges-buergergeld-bs.jpeg,2026-07-07T12:39:14Z,,"Beim Bürgergeld gelten jetzt härtere Regeln, und natürlich kann man das beklagen. Man führt dann die Drastik an, wenn ab jetzt Totalsanktionen verhängbar sind. Die besonderen Schicksale von psychisch… [+190 chars]",,de,'Bürgergeld'
https://www.focus.de/kultur/kino-tv/hartz-und-herzlich-buergergeld-empfaenger-pascal-entschuldigt-sich-bei-sender_cec73379-e750-4a15-b55d-b3257ae28dd8.html,https://www.focus.de/kultur/kino-tv/hartz-und-herzlich-buergergeld-empfaenger-pascal-entschuldigt-sich-bei-sender_cec73379-e750-4a15-b55d-b3257ae28dd8.html,0,www.focus.de,„Hartz und herzlich“: Bürgergeld-Empfänger Pascal entschuldigt sich bei Sender,Pascal wurde jahrelang für die RTLZWEI-Sozialdoku „Hartz und herzlich“ begleitet. Nach dem Bruch mit Familie und Produktion überrascht er nun mit einer Entschuldigung an den Sender.,"https://quadro.burda-forward.de/ctf/7de73d97-e7c6-437f-8d1a-d45e38a958c2.9ec0c51c-d77d-4963-9396-e40db63ba475.jpeg?im=RegionOfInterestCrop=(1200,630),regionOfInterest=(800,450)&hash=6e7f46c9f56c731f2acc0347b16cfa786a61aefeb318d4bcda9381807fc97604",2026-07-07T20:31:00Z,,Über Jahre hinweg waren Hartz und herzlich-Pascal und seine Mutter Petra ein Herz und eine Seele. Doch dann kam es zum Zerwürfnis und eine öffentliche Schlammschlacht begann. Nicht nur mit seiner Mut… [+1770 chars],,de,'Bürgergeld'
https://taz.de/Wie-Berliner-Kinder-mit-Buergergeld-leben/!6182777/,https://taz.de/Wie-Berliner-Kinder-mit-Buergergeld-leben/!6182777/,0,taz.de,Wie Berliner Kinder mit Bürgergeld leben: Freibad ist diesen Monat nicht drin,"Der Berlin Pass ist eine feine Sache. Er ermöglicht viele Vergünstigungen für alle, die Bürgergeld beziehen – wenn er ankommt. Ein Erfahrungsbericht.",https://taz.de/picture/8465974/1200/41614525.jpeg,2026-07-08T04:00:00Z,,"Der Berlin Pass ist eine feine Sache. Er ermöglicht viele Vergünstigungen für alle, die Bürgergeld beziehen – wenn er ankommt. Ein Erfahrungsbericht. mehr...",,de,'Bürgergeld'
