index,url,valid,domain,title,description,image,published,archive,content,quote,language,keyword
https://www.sueddeutsche.de/politik/getreideabkommen-ukraine-guterres-russland-1.5764634,https://www.sueddeutsche.de/politik/getreideabkommen-ukraine-guterres-russland-1.5764634,0,www.sueddeutsche.de,Krieg in Europa: Getreideabkommen läuft aus - das ist der aktuelle Stand,"Ab Ende der Woche will Russland keine Getreideausfuhr aus der Ukraine mehr erlauben. UN-Generalsekretär Guterres reist nach Kiew und versucht, zu vermitteln. Fragen und Antworten zu der Vereinbarung.",https://www.sueddeutsche.de/image/sz.1.5764635/1200x675?v=1678257853,2023-03-08T06:44:21Z,https://web.archive.org/web/20230308075219/https://www.sueddeutsche.de/politik/getreideabkommen-ukraine-guterres-russland-1.5764634,"Ab Ende der Woche will Russland keine Getreideausfuhr aus der Ukraine mehr erlauben. UN-Generalsekretär Guterres reist nach Kiew und versucht, zu vermitteln. Fragen und Antworten zu der Vereinbarung.… [+5776 chars]",,de,'Krieg'
https://www.morgenpost.de/ratgeber/article237827751/waermepumpe-altbau-heizoel-verbraucher-energiekrise-einbau-bwp.html,https://www.morgenpost.de/ratgeber/article237827751/waermepumpe-altbau-heizoel-verbraucher-energiekrise-einbau-bwp.html,0,www.morgenpost.de,Experten geben Tipps: Wärmepumpe im Altbau: Checkliste – worauf Sie achten sollten,Die Wärmepumpe kann auch im Altbau eine Alternative zur Gas- oder Ölheizung sein. Doch wann lohnt sich der Einbau? Ein simpler Test kann Klarheit schaffen.,https://img.morgenpost.de/img/frontpage/crop237828619/8042608896-w820-cv16_9-q85/Waermepumpen-auch-in-Altbauten-eine-Alternative-zu-Gas-und-OEl.jpg,2023-03-08T08:16:33Z,,Berlin. In der Energiekrise 2022 waren die Preise für viele Produkte massiv angestiegen. Brennstoffe wie Heizöl und Gas waren im Frühjahr 2022 teuer denn je mittlerweile hat sich der Energiemarkt wie… [+8211 chars],,de,'Dämmung'
https://www.sueddeutsche.de/politik/nord-stream-anschlag-taeter-1.5764644,https://www.sueddeutsche.de/politik/nord-stream-anschlag-taeter-1.5764644,0,www.sueddeutsche.de,Nord-Stream-Sabotage: Ukrainischer Präsidentenberater streitet Beteiligung ab,Wer ist für die Anschläge auf die Nord-Stream-Pipelines verantwortlich? Medienberichten zufolge führen Spuren in die Ukraine. Bundesverteidigungsminister Pistorius mahnt zur Vorsicht.,https://www.sueddeutsche.de/image/sz.1.5764645/1200x675?v=1678263486,2023-03-08T08:18:15Z,https://web.archive.org/web/20230308092735/https://www.sueddeutsche.de/politik/nord-stream-anschlag-taeter-1.5764644,Wer ist für die Anschläge auf die Nord-Stream-Pipelines verantwortlich? Medienberichten zufolge führen Spuren in die Ukraine. Bundesverteidigungsminister Pistorius mahnt zur Vorsicht.Nach den Recherc… [+4722 chars],,de,'Pipeline'
https://www.focus.de/immobilien/quasi-verbot-von-oel-und-gasheizungen-habecks-ministerium-beantwortet-user-fragen-und-macht-heizungs-versprechen_id_187760948.html,https://www.focus.de/immobilien/quasi-verbot-von-oel-und-gasheizungen-habecks-ministerium-beantwortet-user-fragen-und-macht-heizungs-versprechen_id_187760948.html,0,www.focus.de,Quasi-Verbot von Öl- und Gasheizungen - Habecks Ministerium beantwortet User-Fragen und macht Heizungs-Versprechen,"Wenn die Temperaturen zuhause auch bei Minusgraden behaglich sind, liegt das in Deutschland oft an Gas und Öl. Das soll sich ändern. Doch der Schwenk zu mehr erneuerbaren Energien im Heizungsbereich ist ein gewaltiges Projekt. Die Leser von FOCUS online haben…",https://p6.focus.de/img/fotos/id_187760626/habeck1.jpg?im=Crop%3D%280%2C563%2C3464%2C1732%29%3BResize%3D%281200%2C627%29&impolicy=perceptual&quality=medium&hash=0c87f11b77b2389f27f16765815216962e47594472d19596aa66cf7ddea92c83,2023-03-08T09:07:55Z,https://web.archive.org/web/20230308091924/https://www.focus.de/immobilien/quasi-verbot-von-oel-und-gasheizungen-habecks-ministerium-beantwortet-user-fragen-und-macht-heizungs-versprechen_id_187760948.html,"Wenn die Temperaturen zuhause auch bei Minusgraden behaglich sind, liegt das in Deutschland oft an Gas und Öl. Das soll sich ändern. Doch der Schwenk zu mehr erneuerbaren Energien im Heizungsbereich … [+9927 chars]",,de,'Gas'
https://www.n-tv.de/politik/Russland-heizt-Verschwoerungstheorien-um-Nord-Stream-an-article23968918.html,https://www.n-tv.de/politik/Russland-heizt-Verschwoerungstheorien-um-Nord-Stream-an-article23968918.html,0,www.n-tv.de,"Michael Roth im ""Frühstart"": ""Russland heizt Verschwörungstheorien um Nord Stream an""","Der Chef des Außen-Ausschusses im Bundestag glaubt nicht, dass die ukrainische Regierung hinter der Sabotage an den Nord-Stream-Pipelines steckt. Er fordert weitere Munition und Waffen für das angegriffene Land.",https://bilder4.n-tv.de/img/incoming/crop23968923/9571326582-cImg_16_9-w1200/michael-roth-fs.jpg,2023-03-08T09:12:42Z,https://web.archive.org/web/20230308103531/https://www.n-tv.de/politik/Russland-heizt-Verschwoerungstheorien-um-Nord-Stream-an-article23968918.html,"Der Chef des Außen-Ausschusses im Bundestag glaubt nicht, dass die ukrainische Regierung hinter der Sabotage an den Nord-Stream-Pipelines steckt. Er fordert weitere Munition und Waffen für das angegr… [+3161 chars]",,de,'Pipeline'
https://www.handelsblatt.com/politik/international/ukraine-krieg-warum-erneut-ein-stopp-der-getreideexporte-aus-der-ukraine-droht/29023920.html,https://www.handelsblatt.com/politik/international/ukraine-krieg-warum-erneut-ein-stopp-der-getreideexporte-aus-der-ukraine-droht/29023920.html,0,www.handelsblatt.com,Ukraine-Krieg: Warum erneut ein Stopp der Getreideexporte aus der Ukraine droht,Von der bislang geltenden Schwarzmeer-Getreide-Initiative profitiert auch Russland – und dennoch scheint der Kreml sie auslaufen lassen zu wollen. Die wichtigsten Fragen und Antworten.,https://www.handelsblatt.com/images/getreidefrachter-in-einem-hafen-in-der-westlichen-ukraine/29024020/2-format2003.jpg,2023-03-08T09:16:50Z,https://web.archive.org/web/20230308094130/https://www.handelsblatt.com/politik/international/ukraine-krieg-warum-erneut-ein-stopp-der-getreideexporte-aus-der-ukraine-droht/29023920.html,"Genf In vielen Ländern drohte eine Hungersnot, als Russland nach dem Überfall auf die Ukraine im Februar 2022 die Schwarzmeerhäfen des Nachbarlandes und damit Getreideexporte blockierte. Unter Vermit… [+5929 chars]",,de,'Krieg'
https://www.zeit.de/news/2023-03/08/resnikow-brauchen-eine-million-artilleriegeschosse,https://www.zeit.de/news/2023-03/08/resnikow-brauchen-eine-million-artilleriegeschosse,0,www.zeit.de,Ukraine-Krieg: Resnikow: Brauchen eine Million Artilleriegeschosse,,,2023-03-08T09:32:19Z,https://web.archive.org/web/20230309134049/https://www.zeit.de/news/2023-03/08/resnikow-brauchen-eine-million-artilleriegeschosse,"When browsing with ads:
We collect personal data and also transmit it to third-party providers
 that help us improve and finance our digital content. Some of the information stored on your device, … [+732 chars]",,de,'Ukraine'
https://www.sueddeutsche.de/politik/getreideabkommen-ukraine-russland-guterres-1.5764634,https://www.sueddeutsche.de/politik/getreideabkommen-ukraine-russland-guterres-1.5764634,0,www.sueddeutsche.de,Krieg in Europa: Getreideabkommen läuft aus - das ist der aktuelle Stand,UN-Generalsekretär Guterres trifft an diesem Mittwoch Präsident Selenskij. Fragen und Antworten zur UN- Schwarzmeer-Getreide-Initiative.,https://www.sueddeutsche.de/image/sz.1.5764635/1200x675?v=1678267976,2023-03-08T09:32:56Z,https://web.archive.org/web/20230308112126/https://www.sueddeutsche.de/politik/getreideabkommen-ukraine-russland-guterres-1.5764634,"UN-Generalsekretär Guterres trifft an diesem Mittwoch Präsident Selenskij. Fragen und Antworten zur UN- Schwarzmeer-Getreide-Initiative.In vielen Ländern drohte eine Hungersnot, als Russland nach dem… [+6012 chars]",,de,'Pipeline'
https://www.stern.de/politik/ausland/berichte-zu-pipeline-sabotage--nord-stream--pistorius-warnt-vor-voreiligen-schluessen-33262084.html,https://www.stern.de/politik/ausland/berichte-zu-pipeline-sabotage--nord-stream--pistorius-warnt-vor-voreiligen-schluessen-33262084.html,0,www.stern.de,Berichte zu Pipeline-Sabotage: Nord-Stream: Pistorius warnt vor voreiligen Schlüssen,Steckt eine pro-ukrainische Gruppe hinter der Sabotage an den Gaspipelines? Moskau sieht sich bestätigt. Pistorius reagiert zurückhaltend - und verweist auch auf die Möglichkeit einer False-Flag-Aktion.,https://image.stern.de/33262086/t/4D/v4/w1440/r1.7778/-/08--urnnewsmldpacom2009010123030899871394v2w800h600l1910t609r5641b3114jpeg---b474ce475dcc1f4d.jpg,2023-03-08T09:40:45Z,https://web.archive.org/web/20230308100823/https://www.stern.de/politik/ausland/berichte-zu-pipeline-sabotage--nord-stream--pistorius-warnt-vor-voreiligen-schluessen-33262084.html,Steckt eine pro-ukrainische Gruppe hinter der Sabotage an den Gaspipelines? Moskau sieht sich bestätigt. Pistorius reagiert zurückhaltend - und verweist auch auf die Möglichkeit einer False-Flag-Akti… [+5058 chars],,de,'Pipeline'
https://www.stern.de/politik/ausland/gaspipelines--ermittler--schiff-nach-nord-stream-explosionen-durchsucht-33262520.html,https://www.stern.de/politik/ausland/gaspipelines--ermittler--schiff-nach-nord-stream-explosionen-durchsucht-33262520.html,0,www.stern.de,Gaspipelines: Ermittler: Verdächtiges Schiff nach Nord-Stream-Explosionen,"Bei ihren Ermittlungen zu den Explosionen an den Gaspipelines Nord Stream 1 und 2 hat die Bundesanwaltschaft im Januar ein verdächtiges Schiff durchsuchen lassen. Es bestehe der Verdacht, dass es zum Transport von Sprengsätzen verwendet worden sein könnte, te…",https://image.stern.de/33262590/t/LX/v1/w1440/r1.7778/-/08--urnnewsmldpacom2009010123030899872779v3w800h600l704t320r1984b1173jpeg---f4032d10dcbdd79a.jpg,2023-03-08T09:52:07Z,,"Es bestehe der Verdacht, dass das Schiff zum Transport von Sprengsätzen verwendet worden sein könnte, so die Karlsruher Behörde.
Bei ihren Ermittlungen zu den Explosionen an den Gaspipelines Nord St… [+1188 chars]",,de,'Kreml'
https://www.handelsblatt.com/politik/international/liveblog-zum-ukraine-krieg-deutsche-ermittler-verdaechtiges-schiff-nach-nord-stream-explosionen-durchsucht/27982126.html,https://www.handelsblatt.com/politik/international/liveblog-zum-ukraine-krieg-deutsche-ermittler-verdaechtiges-schiff-nach-nord-stream-explosionen-durchsucht/27982126.html,0,www.handelsblatt.com,+++ Ukraine-Krieg +++: Deutsche Ermittler: Verdächtiges Schiff nach Nord-Stream-Explosionen durchsucht,Nord-Stream-Berichte: Pistorius warnt vor voreiligen Schlüssen +++ Prigoschin: Ostteil von Bachmut unter Kontrolle +++ Guterres berät in Kiew über Getreideabkommen +++ Der Newsblog.,https://www.handelsblatt.com/images/anlandestation-von-nord-stream-1-in-lubmin/29024180/2-format2003.jpg,2023-03-08T09:53:06Z,https://web.archive.org/web/20230308102521/https://www.handelsblatt.com/politik/international/liveblog-zum-ukraine-krieg-deutsche-ermittler-verdaechtiges-schiff-nach-nord-stream-explosionen-durchsucht/27982126.html,"<li>Herr Reinhard Siegmund08.03.2023, 09:16 Uhr
Herr Peters: ""Russische Freunde"" sehr witzig. Besonders wohl Medwedew und Solowjow ?
</li><li>Herr Andreas Felsch07.03.2023, 20:34 Uhr
Von Kreml-Trö… [+5190 chars]",,de,'Krieg'
https://www.handelsblatt.com/politik/international/liveblog-zum-ukraine-krieg-us-geheimdienste-putin-spielt-in-der-ukraine-auf-zeit-polens-praesident-duda-koennen-mig-29-abgeben/27982126.html,https://www.handelsblatt.com/politik/international/liveblog-zum-ukraine-krieg-us-geheimdienste-putin-spielt-in-der-ukraine-auf-zeit-polens-praesident-duda-koennen-mig-29-abgeben/27982126.html,0,www.handelsblatt.com,+++ Ukraine-Krieg +++: US-Geheimdienste: Putin spielt in der Ukraine auf Zeit – Polens Präsident Duda: Können MiG-29 abgeben,Ukraine: Strommangel wohl überwunden +++ Nord-Stream-Berichte: Pistorius warnt vor voreiligen Schlüssen +++ Prigoschin: Ostteil von Bachmut unter Kontrolle +++ Der Newsblog.,https://www.handelsblatt.com/images/russlands-praesident-wladimir-putin/29025654/2-format2003.jpg,2023-03-08T09:53:06Z,https://web.archive.org/web/20230308213735/https://www.handelsblatt.com/politik/international/liveblog-zum-ukraine-krieg-us-geheimdienste-putin-spielt-in-der-ukraine-auf-zeit-polens-praesident-duda-koennen-mig-29-abgeben/27982126.html,"<li>Herr Andreas Felsch08.03.2023, 19:29 Uhr
Anbei eine sehr schöne, knackige Einordnung der jüngsten Historie des Donbas durch Militärhistoriker Torsten Heinrich:
Was ist 2014 im Donbas passiert? … [+8358 chars]",,de,'Ukraine'
https://www.handelsblatt.com/politik/international/liveblog-zum-ukraine-krieg-us-geheimdienste-putin-spielt-in-der-ukraine-auf-zeit-deutsche-ermittler-durchsuchen-schiff-nach-nord-stream-explosionen/27982126.html,https://www.handelsblatt.com/politik/international/liveblog-zum-ukraine-krieg-us-geheimdienste-putin-spielt-in-der-ukraine-auf-zeit-deutsche-ermittler-durchsuchen-schiff-nach-nord-stream-explosionen/27982126.html,0,www.handelsblatt.com,+++ Ukraine-Krieg +++: US-Geheimdienste: Putin spielt in der Ukraine auf Zeit – Deutsche Ermittler durchsuchen Schiff nach Nord-Stream-Explosionen,Nord-Stream-Berichte: Pistorius warnt vor voreiligen Schlüssen +++ Prigoschin: Ostteil von Bachmut unter Kontrolle +++ Der Newsblog.,https://www.handelsblatt.com/images/russlands-praesident-wladimir-putin/29025646/1-format2003.jpg,2023-03-08T09:53:06Z,https://web.archive.org/web/20230308175347/https://www.handelsblatt.com/politik/international/liveblog-zum-ukraine-krieg-us-geheimdienste-putin-spielt-in-der-ukraine-auf-zeit-deutsche-ermittler-durchsuchen-schiff-nach-nord-stream-explosionen/27982126.html,"<li>Herr hartmut Lausitzer08.03.2023, 18:01 Uhr
Was soll das denn: Deutsche Ermittler untersuchen 4 Monate später ein Schiff, welches am Anschlag beteiligt sein könnte...Glaubt hier wirklich jemand,… [+8426 chars]",,de,'Krieg'
https://www.handelsblatt.com/politik/international/liveblog-zum-ukraine-krieg-praesident-von-us-repraesentantenhaus-lehnt-ukraine-reise-ab-polens-praesident-duda-koennen-mig-29-abgeben-/27982126.html,https://www.handelsblatt.com/politik/international/liveblog-zum-ukraine-krieg-praesident-von-us-repraesentantenhaus-lehnt-ukraine-reise-ab-polens-praesident-duda-koennen-mig-29-abgeben-/27982126.html,0,www.handelsblatt.com,+++ Ukraine-Krieg +++: Präsident von US-Repräsentantenhaus lehnt Ukraine-Reise ab – Polens Präsident Duda: Können MiG-29 abgeben,US-Geheimdienste: Putin spielt in der Ukraine auf Zeit +++ Ukraine: Strommangel wohl überwunden +++ Nord-Stream-Berichte: Pistorius warnt vor voreiligen Schlüssen +++ Der Newsblog.,https://www.handelsblatt.com/images/russlands-praesident-wladimir-putin/29025654/2-format2003.jpg,2023-03-08T09:53:06Z,https://web.archive.org/web/20230309033742/https://www.handelsblatt.com/politik/international/liveblog-zum-ukraine-krieg-praesident-von-us-repraesentantenhaus-lehnt-ukraine-reise-ab-polens-praesident-duda-koennen-mig-29-abgeben-/27982126.html,"<li>Herr Andreas Felsch08.03.2023, 19:29 Uhr
Anbei eine sehr schöne, knackige Einordnung der jüngsten Historie des Donbas durch Militärhistoriker Torsten Heinrich:
Was ist 2014 im Donbas passiert? … [+8358 chars]",,de,'Ukraine'
https://www.stern.de/politik/ausland/sabotage-an-gaspipelines--verdaechtiges-schiff-nach-nord-stream-explosionen-durchsucht-33262520.html,https://www.stern.de/politik/ausland/sabotage-an-gaspipelines--verdaechtiges-schiff-nach-nord-stream-explosionen-durchsucht-33262520.html,0,www.stern.de,Gaspipelines: Ermittler: Schiff nach Nord-Stream-Explosionen durchsucht,Karlsruhe - Bei ihren Ermittlungen zu den Explosionen an den Gaspipelines Nord Stream 1 und 2 hat die Bundesanwaltschaft im Januar ein verdächtiges,https://image.stern.de/33262590/t/wt/v2/w1440/r1.7778/-/08--urnnewsmldpacom2009010123030899872779v3w800h600l704t320r1984b1173jpeg---f4032d10dcbdd79a.jpg,2023-03-08T10:02:20Z,https://web.archive.org/web/20230308104050/https://www.stern.de/politik/ausland/sabotage-an-gaspipelines--verdaechtiges-schiff-nach-nord-stream-explosionen-durchsucht-33262520.html,"Ende September reißen Explosionen Löcher in Nord Stream 1 und 2. Die Bundesanwaltschaft hat ein Schiff im Visier, mit dem die Täter möglicherweise den Sprengstoff transportierten. Doch vieles ist noc… [+2965 chars]",,de,'Gas'
https://www.morgenpost.de/politik/ausland/article237837849/Ermittler-Verdaechtiges-Schiff-nach-Nord-Stream-Explosionen.html,https://www.morgenpost.de/politik/ausland/article237837849/Ermittler-Verdaechtiges-Schiff-nach-Nord-Stream-Explosionen.html,0,www.morgenpost.de,Gaspipelines: Ermittler: Schiff nach Nord-Stream-Explosionen durchsucht,"Es bestehe der Verdacht, dass das Schiff zum Transport von Sprengsätzen verwendet worden sein könnte, so die Karlsruher Behörde.",https://img.morgenpost.de/img/ausland/crop237837873/5562609683-w820-cv16_9-q85/Gasleck-an-Nord-Stream-1.jpg,2023-03-08T10:02:20Z,https://web.archive.org/web/20230308103500/https://www.morgenpost.de/politik/ausland/article237837849/Ermittler-Verdaechtiges-Schiff-nach-Nord-Stream-Explosionen.html,"Karlsruhe. Bei ihren Ermittlungen zu den Explosionen an den Gaspipelines Nord Stream 1 und 2 hat die Bundesanwaltschaft im Januar ein verdächtiges Schiff durchsuchen lassen. Es bestehe der Verdacht, … [+1189 chars]",,de,'Kreml'
https://www.tagesschau.de/inland/innenpolitik/nord-stream-schiff-durchsuchung-101.html,https://www.tagesschau.de/inland/innenpolitik/nord-stream-schiff-durchsuchung-101.html,0,www.tagesschau.de,Nord-Stream-Explosion: Bundesanwalt bestätigt Schiffs-Durchsuchung,"Die Bundesanwaltschaft hat ein Schiff durchsuchen lassen, dass im Verdacht steht, an den Explosionen an den Nord-Stream-Pipelines beteiligt gewesen zu sein. Das erfuhr das <em>ARD-Hauptstadtstudio</em>. Die Ermittlungen dauern demnach an.",https://www.tagesschau.de/multimedia/bilder/nordstream-leck-101~_v-original.jpg,2023-03-08T10:14:27Z,https://web.archive.org/web/20230308102405/http://www.tagesschau.de/inland/innenpolitik/nord-stream-schiff-durchsuchung-101.html,"Die Bundesanwaltschaft hat ein Schiff durchsuchen lassen, dass im Verdacht steht, an den Explosionen an den Nord-Stream-Pipelines beteiligt gewesen zu sein. Das erfuhr das ARD-Hauptstadtstudio. Die E… [+1296 chars]",,de,'Pipeline'
https://www.morgenpost.de/politik/article237838245/nord-stream-anschlag-ukraine-russland-gas.html,https://www.morgenpost.de/politik/article237838245/nord-stream-anschlag-ukraine-russland-gas.html,0,www.morgenpost.de,Pipeline-Anschlag: Neue Nord-Stream-Spur: Sprengstoff für die Ukraine-Koalition,Nord Stream: Der Anschlag auf die Ostseepeline sorgt für heftige Spekulationen. Steckt die Ukraine dahinter? Ein schwerwiegender und folgenschwerer Verdacht.,https://img.morgenpost.de/img/ausland/crop237836995/9082609140-w820-cv16_9-q85/Nord-Stream-Explosionen.jpg,2023-03-08T10:30:02Z,https://web.archive.org/web/20230308103421/https://www.morgenpost.de/politik/article237838245/nord-stream-anschlag-ukraine-russland-gas.html,"Berlin. Ein Terrorakt in dänischen und schwedischen Gewässern. Ein Anschlag auf kritische Infrastruktur der EU. Auf zwei Pipelines, die halb Europa mit Gas versorgen können. Noch dazu auf ein Firmenk… [+6137 chars]",,de,'Kreml'
https://www.wiwo.de/politik/ausland/sabotage-an-gaspipelines-verdaechtiges-schiff-nach-nord-stream-explosionen-durchsucht/29023124.html,https://www.wiwo.de/politik/ausland/sabotage-an-gaspipelines-verdaechtiges-schiff-nach-nord-stream-explosionen-durchsucht/29023124.html,0,www.wiwo.de,Sabotage an Gaspipelines: Verdächtiges Schiff nach Nord-Stream-Explosionen durchsucht,"Ende September reißen Explosionen Löcher in Nord Stream 1 und 2. Die Bundesanwaltschaft hat ein Schiff im Visier, mit dem die Täter möglicherweise den Sprengstoff transportierten. Doch vieles ist noch unklar.",https://www.wiwo.de/images/file-photo-gas-bubbles-from-the-nord-stream-2-leak-reaching-surface-of-the-baltic-sea-in-the-area-shows-disturbance-of-well-over-one-kilometre-diameter-near-bornholm/29023154/2-format11240.jpg,2023-03-08T10:47:17Z,https://web.archive.org/web/20230308120855/https://www.wiwo.de/politik/ausland/sabotage-an-gaspipelines-verdaechtiges-schiff-nach-nord-stream-explosionen-durchsucht/29023124.html,"Bei ihren Ermittlungen zu den Explosionen an den Gaspipelines Nord Stream 1 und 2 hat die Bundesanwaltschaft im Januar ein verdächtiges Schiff durchsuchen lassen. Es bestehe der Verdacht, dass es zum… [+3308 chars]",,de,'Gas'
https://www.tagesspiegel.de/internationales/schwere-kampfe-im-donbass-wie-russlands-offensive-lauft--und-was-noch-von-ihr-zu-erwarten-ist-9463220.html,https://www.tagesspiegel.de/internationales/schwere-kampfe-im-donbass-wie-russlands-offensive-lauft--und-was-noch-von-ihr-zu-erwarten-ist-9463220.html,0,www.tagesspiegel.de,Schwere Kämpfe im Donbass: Wie Russlands Offensive läuft – und was noch von ihr zu erwarten ist,"Mit der neuerlichen Verstärkung soll es den Kreml-Truppen endlich gelingen, Bachmut einzunehmen. Doch Experten stellen bereits die russische Gesamtstrategie infrage.",https://www.tagesspiegel.de/images/ein-jahr-krieg-in-der-ukraine-bachmut3/alternates/BASE_16_9_W1400/ein-jahr-krieg-in-der-ukraine---bachmut.jpeg,2023-03-08T11:24:02Z,https://web.archive.org/web/20230308115825/https://www.tagesspiegel.de/internationales/schwere-kampfe-im-donbass-wie-russlands-offensive-lauft--und-was-noch-von-ihr-zu-erwarten-ist-9463220.html,Vor einem Jahr nahm die erfolgreiche russische Anfangsoffensive in der Ukraine ihren Lauf. Am Ende des März 2022 hatten die Kreml-Truppen allein in diesem einen Monat rund ein Zehntel des Staatsgebie… [+12607 chars],,de,'Kreml'
https://www.sueddeutsche.de/politik/north-stream-2-explosionen-ukraine-bundesregierung-1.5764817,https://www.sueddeutsche.de/politik/north-stream-2-explosionen-ukraine-bundesregierung-1.5764817,0,www.sueddeutsche.de,Pipeline-Anschläge: Nord Stream: Abwarten ist Regierungspflicht,"Die Bundesregierung nimmt Berichte über eine angebliche ukrainische Verwicklung in die Pipeline-Explosionen ""mit großem Interesse"" zur Kenntnis. Noch sind die neuen Erkenntnisse offenkundig zu vage.",https://www.sueddeutsche.de/image/sz.1.5764818/1200x675?v=1678276150,2023-03-08T11:34:03Z,https://web.archive.org/web/20230308122141/https://www.sueddeutsche.de/politik/north-stream-2-explosionen-ukraine-bundesregierung-1.5764817,"Die Bundesregierung nimmt Berichte über eine angebliche ukrainische Verwicklung in die Pipeline-Explosionen ""mit großem Interesse"" zur Kenntnis. Noch sind die neuen Erkenntnisse offenkundig zu vage.A… [+3648 chars]",,de,'Pipeline'
https://www.faz.net/aktuell/wirtschaft/eu-kommission-will-den-abbau-wichtiger-rohstoffe-ausbauen-18732551.html,https://www.faz.net/aktuell/wirtschaft/eu-kommission-will-den-abbau-wichtiger-rohstoffe-ausbauen-18732551.html,0,www.faz.net,Rohstoffstrategie der EU: Brüssel will Abbau wichtiger Rohstoffe in Europa ausbauen,"Europa ist zu abhängig vom Import wichtiger Rohstoffe – allen voran aus China, warnt die Kommission. Sie will nun gegensteuern und ruft konkrete Ziele für mehr Bergbau und Recycling aus.",https://media1.faz.net/ppmedia/aktuell/wirtschaft/2445444598/1.8732557/facebook_teaser/seltene-erden-fuer-europa.jpg,2023-03-08T11:43:43Z,https://web.archive.org/web/20230308140739/https://www.faz.net/aktuell/wirtschaft/eu-kommission-will-den-abbau-wichtiger-rohstoffe-ausbauen-18732551.html,Anfang Januar erregte Schweden zum Auftakt seiner EU-Ratspräsidentschaft mit dem Fund seltener Erden im nordschwedischen Kiruna große Aufmerksamkeit. Der Fund passte perfekt zu dem von der EU ausgeru… [+5408 chars],,de,'Import'
https://www.zeit.de/news/2023-03/08/baerbock-sichert-irakischen-kurden-unterstuetzung-zu,https://www.zeit.de/news/2023-03/08/baerbock-sichert-irakischen-kurden-unterstuetzung-zu,0,www.zeit.de,Wiederaufbau: Baerbock sichert irakischen Kurden Unterstützung zu,,,2023-03-08T11:50:56Z,https://web.archive.org/web/20230308120802/https://www.zeit.de/news/2023-03/08/baerbock-sichert-irakischen-kurden-unterstuetzung-zu,"When browsing with ads:
We collect personal data and also transmit it to third-party providers
 that help us improve and finance our digital content. Some of the information stored on your device, … [+732 chars]",,de,'Unterstützung'
https://www.faz.net/aktuell/politik/ausland/nord-stream-neue-erkenntnisse-zur-sabotage-an-den-gaspipelines-18732646.html,https://www.faz.net/aktuell/politik/ausland/nord-stream-neue-erkenntnisse-zur-sabotage-an-den-gaspipelines-18732646.html,0,www.faz.net,Explosion von Nord Stream: Was geschah im September in der Ostsee?,Neue Erkenntnisse zur Sabotage an den Gaspipelines vor der dänischen Küste sollen zu einer proukrainischen Gruppe führen. Im Januar wurde ein verdächtiges Schiff untersucht. Die wichtigsten Fragen und Antworten im Überblick.,https://media1.faz.net/ppmedia/aktuell/politik/ausland/465759756/1.8732645/facebook_teaser/nach-der-explosion-am.jpg,2023-03-08T12:18:42Z,https://web.archive.org/web/20230308132408/https://www.faz.net/aktuell/politik/ausland/nord-stream-neue-erkenntnisse-zur-sabotage-an-den-gaspipelines-18732646.html,"Was war passiert?
Am 26. September 2022 wurden mutmaßlich Sprengstoffanschläge auf die beiden Nord-Stream-Pipelines verübt. Beide Stränge der Leitung Nord Stream 1, über die Russland Deutschland von… [+3114 chars]",,de,'Pipeline'
