index,url,valid,domain,title,description,image,published,archive,content,quote,language,keyword
https://www.zeit.de/news/2025-12/01/presse-zum-katar-rennen-beide-mclaren-mussten-ausbluten,https://www.zeit.de/news/2025-12/01/presse-zum-katar-rennen-beide-mclaren-mussten-ausbluten,0,www.zeit.de,Formel 1: Presse zum Katar-Rennen: Beide McLaren mussten ausbluten,Hier finden Sie Informationen zu dem Thema „Formel 1“. Lesen Sie jetzt „Presse zum Katar-Rennen: Beide McLaren mussten ausbluten“.,https://img.zeit.de/news/2025-12/01/presse-zum-katar-rennen-beide-mclaren-mussten-ausbluten-image-group/wide__1300x731,2025-12-01T04:15:07Z,,Die WM-Entscheidung fällt im letzten Rennen der Formel-1-Saison. Max Verstappen hat sich mit seinem Sieg in Katar auf den zweiten Platz der Gesamtwertung vorgeschoben und nur noch 12 Punkte weniger a… [+4205 chars],,de,'Katar'
https://www.zeit.de/news/2025-12/01/pipeline-vorfall-prozess-um-75-jaehrigen-aktivisten-platzt,https://www.zeit.de/news/2025-12/01/pipeline-vorfall-prozess-um-75-jaehrigen-aktivisten-platzt,0,www.zeit.de,Letzte Generation: Pipeline-Vorfall: Prozess um 75-jährigen Aktivisten platzt,Hier finden Sie Informationen zu dem Thema „Letzte Generation“. Lesen Sie jetzt „Pipeline-Vorfall: Prozess um 75-jährigen Aktivisten platzt“.,https://img.zeit.de/news/2025-12/01/pipeline-vorfall-prozess-um-75-jaehrigen-aktivisten-platzt-image-group/wide__1300x731,2025-12-01T11:09:39Z,,Der Berufungsprozess gegen einen 75-jährigen Klimaaktivisten aus Bayern wegen der Manipulation einer Erdölleitung von der Ostsee nach Brandenburg muss neu aufgerollt werden. Ein Sachverständiger müss… [+2608 chars],,de,'Pipeline'
https://www.tagesspiegel.de/berlin/letzte-generation-pipeline-vorfall-prozess-um-75-jahrigen-aktivisten-platzt-14997104.html,https://www.tagesspiegel.de/berlin/letzte-generation-pipeline-vorfall-prozess-um-75-jahrigen-aktivisten-platzt-14997104.html,0,www.tagesspiegel.de,Letzte Generation: Pipeline-Vorfall: Prozess um 75-jährigen Aktivisten platzt,Zwei Aktivisten drehen Stellräder an Pumpstationen einer Öl-Leitung zu und werden verurteilt. Das Berufungsverfahren gegen einen inzwischen 75-jährigen Beteiligten ist nun geplatzt.,https://www.tagesspiegel.de/images/14997101/alternates/BASE_16_9_W1400/1764587451000/berufungsverhandlung-um-mitglied-von-klimaschutzgruppe.jpeg,2025-12-01T11:10:51Z,,Der Berufungsprozess gegen einen 75-jährigen Klimaaktivisten aus Bayern wegen der Manipulation einer Erdölleitung von der Ostsee nach Brandenburg muss neu aufgerollt werden. Ein Sachverständiger müss… [+2662 chars],,de,'Pipeline'
https://www.welt.de/politik/ausland/article692698b1f60b758bebd57baf/ukraine-krieg-cdu-aussenpolitiker-hardt-haelt-ukrainischen-gebietsverlust-fuer-denkbar-liveticker.html,https://www.welt.de/politik/ausland/article692698b1f60b758bebd57baf/ukraine-krieg-cdu-aussenpolitiker-hardt-haelt-ukrainischen-gebietsverlust-fuer-denkbar-liveticker.html,0,www.welt.de,CDU-Außenpolitiker Hardt hält ukrainischen Gebietsverlust für denkbar,"Nach Gesprächen eines ukrainischen Teams mit US-Unterhändlern in Florida reist Trumps Berater Witkoff nach Moskau weiter. Am Dienstag soll er Putin treffen. CDU-Politiker Hardt hält es für möglich, dass die Ukraine notfalls Gebietsabtretungen an Russland akze…",https://images.welt.de/692698b1f60b758bebd57baf/63d6384384bac2a893f29f7b2ae05954/ci16x9-w1200/dpa-com-20090101-251008-911-020409-jpg,2025-12-01T12:15:00Z,,"Nach Gesprächen eines ukrainischen Teams mit US-Unterhändlern in Florida reist Trumps Berater Witkoff nach Moskau weiter. Am Dienstag soll er Putin treffen. CDU-Politiker Hardt hält es für möglich, d… [+20495 chars]",,de,'Ukraine'
https://www.welt.de/politik/ausland/article692698b1f60b758bebd57baf/ukraine-krieg-nato-prueft-praeventivschlag-russland-bezeichnet-aussage-von-nato-admiral-als-verantwortungslos-liveticker.html,https://www.welt.de/politik/ausland/article692698b1f60b758bebd57baf/ukraine-krieg-nato-prueft-praeventivschlag-russland-bezeichnet-aussage-von-nato-admiral-als-verantwortungslos-liveticker.html,0,www.welt.de,„Nato prüft Präventivschlag“ – Russland bezeichnet Aussage von Nato-Admiral als „verantwortungslos“,"Nach Gesprächen eines ukrainischen Teams mit US-Unterhändlern in Florida reist Trumps Berater Witkoff nach Moskau weiter. Am Dienstag soll er Putin treffen. CDU-Politiker Hardt hält es für möglich, dass die Ukraine notfalls Gebietsabtretungen an Russland akze…",https://images.welt.de/692698b1f60b758bebd57baf/9e4b2c4fb3479d6469071b7f2c73504b/ci16x9-w1200/afp-86nw7cq-jpg,2025-12-01T12:15:00Z,,"Nach Gesprächen eines ukrainischen Teams mit US-Unterhändlern in Florida reist Trumps Berater Witkoff nach Moskau. Am Dienstag soll er Putin treffen. CDU-Politiker Hardt hält es für möglich, dass die… [+20488 chars]",,de,'Pipeline'
https://www.tagesspiegel.de/internationales/nah-an-der-turkischen-kuste-ukraine-nimmt-russlands-schattenflotte-ins-visier--gibt-es-eine-neue-front-im-schwarzen-meer-14996198.html,https://www.tagesspiegel.de/internationales/nah-an-der-turkischen-kuste-ukraine-nimmt-russlands-schattenflotte-ins-visier--gibt-es-eine-neue-front-im-schwarzen-meer-14996198.html,0,www.tagesspiegel.de,Ukraine greift mit Drohnen an: Russlands Schattenflotte im Visier – gibt es eine neue Front im Schwarzen Meer?,Mit dem Drohnenangriff auf zwei Öltanker verschärft Kiew den Druck auf Russlands Schattenflotte. Das verändert womöglich die Machtverhältnisse im Schwarzen Meer.,https://www.tagesspiegel.de/images/14997041/alternates/BASE_16_9_W1400/1764587352000/russia-ukraine-conflict.jpeg,2025-12-01T13:02:05Z,,"Die Wasserdrohne vom Typ Sea Baby rast von hinten an einen Öltanker heran, die Sprengladung explodiert, ein Feuerball steigt auf. Videos der ukrainischen Streitkräfte aus dem Schwarzen Meer zeigen di… [+6390 chars]",,de,'Pipeline'
https://www.welt.de/politik/ausland/article692698b1f60b758bebd57baf/ukraine-krieg-besorgniserregende-eskalation-erdogan-verurteilt-angriffe-auf-tanker-im-schwarzen-meer-liveticker.html,https://www.welt.de/politik/ausland/article692698b1f60b758bebd57baf/ukraine-krieg-besorgniserregende-eskalation-erdogan-verurteilt-angriffe-auf-tanker-im-schwarzen-meer-liveticker.html,0,www.welt.de,„Besorgniserregende Eskalation“ – Erdogan verurteilt Angriffe auf Tanker im Schwarzen Meer,"Nach Gesprächen eines ukrainischen Teams mit US-Unterhändlern in Florida reist Trumps Berater Witkoff nach Moskau weiter. Am Dienstag soll er Putin treffen. CDU-Politiker Hardt hält es für möglich, dass die Ukraine notfalls Gebietsabtretungen an Russland akze…",https://images.welt.de/692698b1f60b758bebd57baf/553c96b1a623a6133fb165c0b7c2d3dd/ci16x9-w1200/561019682-jpg,2025-12-01T18:28:00Z,,"Der ukrainische Geheimdienst hat nach eigenen Angaben zwei Tanker der russischen Schattenflotte attackiert. Die Angriffe fanden vor der türkischen Küste statt, Präsident Erdogan protestiert. Mehr im … [+23293 chars]",,de,'Ukraine'
https://www.zeit.de/news/2025-12/02/usa-halten-rubios-teilnahme-an-nato-treffen-fuer-unnoetig,https://www.zeit.de/news/2025-12/02/usa-halten-rubios-teilnahme-an-nato-treffen-fuer-unnoetig,0,www.zeit.de,Ukraine-Krieg: USA halten Rubios Teilnahme an Nato-Treffen für unnötig,Hier finden Sie Informationen zu dem Thema „Ukraine-Krieg“. Lesen Sie jetzt „USA halten Rubios Teilnahme an Nato-Treffen für unnötig“.,https://img.zeit.de/news/2025-12/02/usa-halten-rubios-teilnahme-an-nato-treffen-fuer-unnoetig-image-group/wide__1300x731,2025-12-02T01:13:05Z,,Trotz der laufenden Verhandlungen über eine Friedenslösung im Ukraine-Krieg hält die US-Regierung eine Teilnahme von Außenminister Marco Rubio an einem lange geplanten Nato-Treffen nicht für nötig. «… [+2540 chars],,de,'Krieg'
https://www.stern.de/gesellschaft/regional/mecklenburg-vorpommern/nord-stream-2--warum-kommt-merkel-nicht-in-den-nord-stream-ausschuss--36917760.html,https://www.stern.de/gesellschaft/regional/mecklenburg-vorpommern/nord-stream-2--warum-kommt-merkel-nicht-in-den-nord-stream-ausschuss--36917760.html,0,www.stern.de,Nord Stream 2: Warum kommt Merkel nicht in den Nord Stream-Ausschuss?,"Ex-Kanzler Gerhard Schröder war als Zeuge im Schweriner Untersuchungsausschuss zum Bau der Nord Stream 2-Pipeline, auch Ex-Kanzler Olaf Scholz. Ex-Kanzlerin Angela Merkel nicht. Warum eigentlich?",https://image.stern.de/36917762/t/87/v1/w1440/r1.7778/-/02--k6y53j4bwov4axs2048jpeg---ff94281dd7fb3dfe.jpg,2025-12-02T04:30:15Z,,"Kopiere den aktuellen Link
Zur Merkliste hinzufügen
Ex-Kanzler Gerhard Schröder war als Zeuge im Schweriner Untersuchungsausschuss zum Bau der Nord Stream 2-Pipeline, auch Ex-Kanzler Olaf Scholz. E… [+4429 chars]",,de,'Pipeline'
https://www.stern.de/politik/deutschland/angela-merkel--warum-sagt-sie-nicht-im-nord-stream-ausschuss-aus--36917976.html,https://www.stern.de/politik/deutschland/angela-merkel--warum-sagt-sie-nicht-im-nord-stream-ausschuss-aus--36917976.html,0,www.stern.de,Schwerin: Nord-Stream-U-Ausschuss auf der Zielgerade – aber wo ist Merkel?,Der Bau der Nord Stream 2-Pipeline beschäftigt noch immer den Untersuchungsausschuss des Schweriner Landtags. Eine Zeugin aber wird nicht aussagen: Angela Merkel.,https://image.stern.de/36917984/t/dF/v1/w1440/r1.7778/-/angela-merkel.jpg,2025-12-02T06:28:00Z,,"Kopiere den aktuellen Link
Zur Merkliste hinzufügen
Der Bau der Nord Stream 2-Pipeline beschäftigt noch immer den Untersuchungsausschuss des Schweriner Landtags. Eine Zeugin aber wird nicht aussage… [+3900 chars]",,de,'Pipeline'
https://www.zeit.de/news/2025-12/03/kalte-kirchen-gemeinden-setzen-auf-decken-und-heizkissen,https://www.zeit.de/news/2025-12/03/kalte-kirchen-gemeinden-setzen-auf-decken-und-heizkissen,0,www.zeit.de,Gottesdienstbesuch im Winter: Kalte Kirchen – Gemeinden setzen auf Decken und Heizkissen,Hier finden Sie Informationen zu dem Thema „Gottesdienstbesuch im Winter“. Lesen Sie jetzt „Kalte Kirchen – Gemeinden setzen auf Decken und Heizkissen“.,https://img.zeit.de/news/2025-12/03/kalte-kirchen-gemeinden-setzen-auf-decken-und-heizkissen-image-group/wide__1300x731,2025-12-03T03:00:08Z,,"In vielen Kirchen stellt sich auch in diesem Winter die bange Frage: Wie warm wird es diesmal im Gottesdienst oder bleibt die Kirche sogar ganz geschlossen? Zwischen Energiekrise, Denkmalschutz und k… [+4680 chars]",,de,'Winter'
https://www.zeit.de/news/2025-12/03/heizen-ist-teurer-geworden-mal-wieder,https://www.zeit.de/news/2025-12/03/heizen-ist-teurer-geworden-mal-wieder,0,www.zeit.de,"Öl, Gas und Fernwärme: Heizen ist teurer geworden - mal wieder","Hier finden Sie Informationen zu dem Thema „Öl, Gas und Fernwärme“. Lesen Sie jetzt „Heizen ist teurer geworden - mal wieder“.",https://img.zeit.de/news/2025-12/03/heizen-ist-teurer-geworden-mal-wieder-image-group/wide__1300x731,2025-12-03T04:15:06Z,,"Die Heizkosten sind in Deutschland einer Studie zufolge zwar gestiegen, es geht aber längst nicht mehr so steil nach oben wie früher. Wie aus dem Wärmemonitor des Deutschen Instituts für Wirtschaftsf… [+4268 chars]",,de,'heizen'
https://www.faz.net/aktuell/rhein-main/wirtschaft/waermepumpe-was-hausbesitzer-jetzt-wissen-muessen-110794307.html,https://www.faz.net/aktuell/rhein-main/wirtschaft/waermepumpe-was-hausbesitzer-jetzt-wissen-muessen-110794307.html,0,www.faz.net,Gebäudeenergiegesetz: Was Hausbesitzer jetzt wissen müssen,"Beim Heizungsgesetz bleibt vorerst vieles unklar. Wer seine Heizung tauschen möchte oder muss, hat viele Fragen. Immerhin: Viele Grundversorger wollen im nächsten Jahr die Preise für Strom und Gas senken.",https://media0.faz.net/image/w1200h627/803ebea1a786/w3000h1567x0y293o/112025/1.10794306/winterblues-waermepumpen-sind.webp,2025-12-03T05:27:18Z,,"Was ist der aktuelle Stand des Gebäudeenergiegesetzes?
Das Gebäudeenergiegesetz (GEG), umgangssprachlich Heizungsgesetz, bleibt ein Streitpunkt in der schwarz-roten Koalition. Bisher schreibt das GE… [+7525 chars]",,de,'Gas'
