index,url,valid,domain,title,description,image,published,archive,content,quote,language,keyword
https://www.welt.de/finanzen/verbraucher/article6842d9a6a0777361fb5f9db8/6842d9a6a0777361fb5f9db8.html,https://www.welt.de/finanzen/verbraucher/article6842d9a6a0777361fb5f9db8/6842d9a6a0777361fb5f9db8.html,0,www.welt.de,"Russland fliegt als ""Reaktion"" massive Angriffe auf Ukraine - Tote in Kiew","Russland hat die Ukraine in der Nacht erneut mit massiven Luftangriffen überzogen und in der Hauptstadt Kiew nach ukrainischen Angaben mindestens drei Menschen getötet. Präsident Wolodymyr Selenskyj erklärte am Freitag, Moskau habe mit mehr als 400 Drohnen un…",https://img.welt.de/img/masters/mobile160492822/7651629427-ci16x9-w1200/welt-fallback-jpg.jpg,2026-04-07T10:40:28Z,,Russland hat die Ukraine in der Nacht erneut mit massiven Luftangriffen überzogen und in der Hauptstadt Kiew nach ukrainischen Angaben mindestens drei Menschen getötet. Präsident Wolodymyr Selenskyj … [+5209 chars],,de,'Kreml'
"https://www.gamestar.de/artikel/preiswertes-balkonkrafwerk-ohne-versandkosten-hoymiles-amazon,3450955.html","https://www.gamestar.de/artikel/preiswertes-balkonkrafwerk-ohne-versandkosten-hoymiles-amazon,3450955.html",0,www.gamestar.de,Deals: Strom? Mach ich selbst... - Dieses günstige Balkonkraftwerk kann sich in zwei Jahren selbst bezahlt haben [Anzeige],Die Energiepreise steigen aber das kann dir bald egal sein: Dieses Balkonkraftwerk kommt ohne Versandkosten und niedrigem Preis. Nebenbei hilft es beim Geld sparen.,https://images.cgames.de/images/gamestar/293/solarway-balkonkraftwerk-teaser_6411797.jpg,2026-04-07T12:30:00Z,,"Wenn die Katze die Solarpanele anschaut und sich dabei genüsslich über die Nase leckt: Ist das dieser Energiehunger, von dem alle reden?
Es gibt nur wenige private Anschaffungen, die sich selbst in … [+5129 chars]",,de,'Energie'
https://www.diepresse.com/20744945/dieser-energie-engpass-kostet-oesterreich-jedes-jahr-fast-eine-euro,https://www.diepresse.com/20744945/dieser-energie-engpass-kostet-oesterreich-jedes-jahr-fast-eine-euro,0,www.diepresse.com,Dieser Energie-Engpass kostet Österreich jedes Jahr fast eine Milliarde Euro [premium],"Die Straße von Hormus ist nur einer der Flaschenhälse im Energiesystem, die das Leben in Österreich unnötig teuer machen. Gerade für günstigere Strompreise müssen auch jede Menge Hürden im eigenen Land beseitigt werden.",https://img.diepresse.com/public/incoming/g34ih4-imago-images-0200606056/alternates/DPR_SOCIAL_NACHRICHTEN/imago%20images%200200606056,2026-04-07T12:44:14Z,,Kurz vor Ablauf von Donald Trumps Ultimatum an das iranische Regime kostete ein Fass Erdöl rund 110 US-Dollar. Das sind fast zwei Drittel mehr als vor dem Angriff Israels und der USA auf den Iran. Ga… [+5115 chars],,de,'Energie'
https://www.faz.net/aktuell/feuilleton/medien-und-film/kino/olivier-assayas-filmthriller-der-magier-im-kreml-200708049.html,https://www.faz.net/aktuell/feuilleton/medien-und-film/kino/olivier-assayas-filmthriller-der-magier-im-kreml-200708049.html,0,www.faz.net,"„Der Magier im Kreml“: Wehe, wer den Zaren im Urlaub stört",Mit einem Haifischlächeln überspielt er seine Panik: Jude Law glänzt als Russlands Machthaber Wladimir Putin in Olivier Assayas’ Filmthriller „Der Magier im Kreml“.,https://media0.faz.net/image/w1200h627/a97623a15e64/w2999h1566x1y60o/202604/ec8678fe-3277-11f1-bb17-0096ce342f8e/die-macht-und-ihr-schatten.webp,2026-04-07T13:30:28Z,,"Zwei Männer im Schnee. Sie laufen an einem gefrorenen Teich entlang, betreten eine zweistöckige Villa, lassen sich vor dem Kamin nieder, trinken Whisky und reden. Dann kommt das Mittagessen, und sie … [+6393 chars]",,de,'Wladimir Putin'
https://www.golem.de/sonstiges/zustimmung/auswahl.html?from=https://www.golem.de/news/schneller-brueter-indischer-brutreaktor-erreicht-erstmals-kritikalitaet-2604-207301.html&referer=https://t.co/3bed0ea01b,https://www.golem.de/sonstiges/zustimmung/auswahl.html?from=https://www.golem.de/news/schneller-brueter-indischer-brutreaktor-erreicht-erstmals-kritikalitaet-2604-207301.html&referer=https://t.co/3bed0ea01b,0,www.golem.de,Schneller Brüter: Indischer Brutreaktor erreicht erstmals Kritikalität,"Der seit 1980 geplante Brutreaktor im Südosten Indiens hat erstmal eine kontrollierte Kettenreaktion erreicht. Neues Spaltmaterial entsteht parallel. (Atomkraft, Energie & Klima)",,2026-04-07T13:49:02Z,,"Besuchen Sie Golem.de wie gewohnt mit Werbung und Tracking,
 indem Sie der Nutzung aller Cookies zustimmen.
 Details zum Tracking finden Sie im Privacy Center.
Skript wurde nicht geladen. Informat… [+607 chars]",,de,'Energie'
https://www.tagesspiegel.de/potsdam/landeshauptstadt/anpaddeln-in-potsdam-die-wassersportsaison-2026-beginnt-15441890.html,https://www.tagesspiegel.de/potsdam/landeshauptstadt/anpaddeln-in-potsdam-die-wassersportsaison-2026-beginnt-15441890.html,0,www.tagesspiegel.de,Anpaddeln in Potsdam: Die Wassersportsaison 2026 beginnt,Ab Sonntag verabschieden Ruder- und Kanuvereine den Winter. Sie begeben sich für eine gemeinsame Ausfahrt auf die Havel.,https://www.tagesspiegel.de/images/8284942/alternates/BASE_16_9_W1400/1658930676000/anpaddeln-13.jpeg,2026-04-07T14:07:23Z,,"Mittlerweile ist es eine feste Tradition: Der Landes-Kanu-Verband (LKV) und der Landesruderverband (LRV) leiten die Wassersportsaison mit einer gemeinsamen Ausfahrt in der Havel ein.
 Der Newsletter… [+1348 chars]",,de,'Winter'
https://tirol.orf.at/stories/3347443/,https://tirol.orf.at/stories/3347443/,0,tirol.orf.at,Zecken werden zum Ganzjahresproblem,"Von Zecken übertragene Infektionen, wie die Frühsommer-Meningoenzephalitis, werden durch die milden Temperaturen immer mehr zum Ganzjahresproblem. Eigentlich fallen Zecken im Winter in eine Ruhephase, das ist laut der Tiroler Gesundheitsdirektorin aber inzwis…",https://ibs.orf.at/tir?image=https%3A%2F%2Foekastatic.orf.at%2Fmims%2F2019%2F30%2F64%2Fcrops%2Fw%3D1200%2Ch%3D627%2Cq%3D75%2F237777_master_68564_zeckew_.jpg%3Fs%3D47bdbb3213a1a90a1fe2b04c68887f7386f5977b,2026-04-07T14:15:29Z,,"Im Vorjahr wurden in Tirol 23 Fälle von FSME gemeldet. FSME ist eine Infektionserkrankung, die meist durch Zecken übertragen wird und nicht unterschätzt werden dürfe, erklärt Theresa Geley, Gesundhei… [+1256 chars]",,de,'Winter'
"https://www.gamestar.de/artikel/jbl-party-box-club-sommer-bluetooth-lautsprecher,3450993.html","https://www.gamestar.de/artikel/jbl-party-box-club-sommer-bluetooth-lautsprecher,3450993.html",0,www.gamestar.de,Deals: JBL-Partybox - Bei so einem Preis ist der Musik-Sommer gerettet! [Anzeige],"Nach einem gefühlt ewigen Winter freue ich mich über jeden einzelnen Sonnenstrahl. Und wenn's jetzt wärmer wird, darf auch die Musik beim Draußenabhängen nicht fehlen!",https://images.cgames.de/images/gamestar/293/jbl-partybox-club-120-lautsprecher-bluetooth-box-teaser_6411920.jpg,2026-04-07T14:25:00Z,,"Sonnenbrille auf, Picknickdecke raus &amp; JBL-Box an: Für mich gibt's kaum einen besseren Zeitvertreib im Sommer.
Erst langsam fangen die Bäume an zu sprießen und dennoch ist das Sommer-Feeling näh… [+3405 chars]",,de,'Winter'
https://www.faz.net/podcasts/f-a-z-podcast-fuer-deutschland/spritpreis-auf-rekordhoch-man-kann-die-leute-nicht-in-watte-packen-200706644.html,https://www.faz.net/podcasts/f-a-z-podcast-fuer-deutschland/spritpreis-auf-rekordhoch-man-kann-die-leute-nicht-in-watte-packen-200706644.html,0,www.faz.net,F.A.Z. Podcast für Deutschland: Spritpreis auf Rekordhoch: „Man kann die Leute nicht in Watte packen“,"Der Iran-Krieg setzt die Bundesregierung unter Druck. Jetzt werden Forderungen laut, die Mehrwertsteuer zu senken.",https://media0.faz.net/image/w1200h627/a612dc261ade/w6144h3210x0y443o/202604/43601.0.1953250972/4360101953250972.webp,2026-04-07T14:48:17Z,,"Im F.A.Z. Podcast erklärt der Berlin-Korrespondent Manfred Schäfers die Tücken einer solchen Steuersenkung auf Grundnahrungsmittel: Die gigantischen Haushaltslöcher werden dadurch noch größer, weshal… [+346 chars]",,de,'Iran'
https://www.zeit.de/news/2026-04/07/tschechien-deckelt-spritpreise,https://www.zeit.de/news/2026-04/07/tschechien-deckelt-spritpreise,0,www.zeit.de,Folgen des Iran-Kriegs: Tschechien deckelt Spritpreise,Hier finden Sie Informationen zu dem Thema „Folgen des Iran-Kriegs“. Lesen Sie jetzt „Tschechien deckelt Spritpreise“.,https://img.zeit.de/news/2026-04/07/tschechien-deckelt-spritpreise-image-group/wide__1300x731,2026-04-07T14:49:13Z,,"Angesichts der aktuellen Energiekrise infolge des Iran-Kriegs deckelt Tschechien die Spritpreise an den Tankstellen. Das Finanzministerium in Prag veröffentlichte erstmals zulässige Höchstpreise, die… [+1243 chars]",,de,'Iran'
https://www.tagesspiegel.de/potsdam/landeshauptstadt/wochenlang-schnee-und-eis-in-potsdam-die-stadtentsorgung-zieht-bilanz-fur-ihren-winterdienst-15442786.html,https://www.tagesspiegel.de/potsdam/landeshauptstadt/wochenlang-schnee-und-eis-in-potsdam-die-stadtentsorgung-zieht-bilanz-fur-ihren-winterdienst-15442786.html,0,www.tagesspiegel.de,Wochenlang Schnee und Eis in Potsdam: Die Stadtentsorgung zieht Bilanz für ihren Winterdienst,Trotz Glatteis und wechselhafter Wetterlage kam Potsdam gut durch den Winter. Die STEP will in moderne Winterdiensttechnik weiter investieren.,https://www.tagesspiegel.de/images/15442782/alternates/BASE_16_9_W1400/1775569631000/winterdienst-in-potsdam.jpeg,2026-04-07T15:34:43Z,,"Frostperioden, wechselhafte Witterung und wiederkehrende Schneefälle hatten Potsdam in den Wintermonaten fest im Griff es war der schwerste Winter seit 2010. Dennoch zieht die Stadtentsorgung Potsdam… [+2241 chars]",,de,'Winter'
https://taz.de/Tischtennisspielerin-Sabine-Winter/!6168819/,https://taz.de/Tischtennisspielerin-Sabine-Winter/!6168819/,0,taz.de,Tischtennisspielerin Sabine Winter: Wintermärchen im Frühling,"Eigentlich wollte sie ihre internationale Karriere ausklingen lassen. Doch seitdem Sabine Winter mit Störbelag spielt, ist sie nicht zu stoppen.",https://taz.de/picture/8363773/1200/imago1075509234.jpeg,2026-04-07T16:01:00Z,,"Eigentlich wollte sie ihre internationale Karriere ausklingen lassen. Doch seitdem Sabine Winter mit Störbelag spielt, ist sie nicht zu stoppen. mehr...",,de,'Winter'
https://www.zeit.de/news/2026-04/08/oelpreise-brechen-nach-waffenruhe-ankuendigung-ein,https://www.zeit.de/news/2026-04/08/oelpreise-brechen-nach-waffenruhe-ankuendigung-ein,0,www.zeit.de,Iran-Krieg: Ölpreise brechen nach Waffenruhe-Ankündigung ein,Hier finden Sie Informationen zu dem Thema „Iran-Krieg“. Lesen Sie jetzt „Ölpreise brechen nach Waffenruhe-Ankündigung ein“.,https://img.zeit.de/news/2026-04/08/oelpreise-brechen-nach-waffenruhe-ankuendigung-ein-image-group/wide__1300x731,2026-04-08T00:59:43Z,,Nach der Verkündung einer zweiwöchigen Waffenruhe im Iran-Krieg haben die zuletzt stark gestiegenen Ölpreise deutlich nachgegeben. Der Preis für ein Fass (159 Liter) Öl der Nordseesorte Brent mit Lie… [+1110 chars],,de,'Krieg'
https://www.zeit.de/politik/ausland/2026-04/waffenruhe-irankrieg-usa-donald-trump-niederlage,https://www.zeit.de/politik/ausland/2026-04/waffenruhe-irankrieg-usa-donald-trump-niederlage,0,www.zeit.de,USA und Iran: Nah an der Niederlage,"Kurz vor Ablauf seines Ultimatums verkündet Donald Trump eine Waffenruhe im Iran. Das blindwütige Bombardement ist abgesagt, das Chaos aber könnte noch größer werden.",https://img.zeit.de/politik/ausland/2026-04/iran-usa-krieg-waffenruhe-donald-trump-abbas-araghtschi-bild/wide__1300x731,2026-04-08T05:08:45Z,,"Am Montag stand Donald Trump auf dem Balkon des Weißen Hauses, mit stahlhartem Blick und dem Osterhasen in seinem Rücken, und erklärte, viel sei vom Iran ja nicht mehr übrig. Am Dienstagmorgen dann d… [+541 chars]",,de,'Iran'
https://www.morgenpost.de/wirtschaft/article411650264/heizoelpreise-aktuell-heute-8-april-iran-krieg-nahost-heizoel-kaufen-heizung.html,https://www.morgenpost.de/wirtschaft/article411650264/heizoelpreise-aktuell-heute-8-april-iran-krieg-nahost-heizoel-kaufen-heizung.html,0,www.morgenpost.de,"Heizölpreise aktuell (Mittwoch, 8. April): Der Preis pro Liter heute",Angesichts des Iran-Kriegs sind die Heizölpreise spürbar angestiegen. Nun herrscht eine Waffenruhe. Was bedeutet das für Hausbesitzer?,https://img.sparknews.funkemedien.de/406858449/406858449_1728458201_v16_9_1600.jpeg,2026-04-08T07:57:32Z,,"Langsam, aber sicher, dürften die Heizungen in deutschen Haushalten eine Pause einlegen: Bis zu 18 Grad werden diese Woche in der Hauptstadt erwartet. Zudem herrscht seit gestern Abend eine Waffenruh… [+8269 chars]",,de,'Iran'
https://www.diepresse.com/20748751/stocker-zur-waffenruhe-fenster-fuer-diplomatie-oeffnet-sich-wieder,https://www.diepresse.com/20748751/stocker-zur-waffenruhe-fenster-fuer-diplomatie-oeffnet-sich-wieder,0,www.diepresse.com,Stocker zur Waffenruhe: „Fenster für Diplomatie öffnet sich wieder ein Stück“,Bundeskanzler Christian Stocker nennt die Waffenruhe zwischen den USA und dem Iran in einer ersten Reaktion einen wichtigen Schritt zur Deeskalation. Außenministerin Beate Meinl-Reisinger spricht von einer Verschnaufpause.,https://img.diepresse.com/public/incoming/b14kt1-kein-titel/alternates/DPR_SOCIAL_NACHRICHTEN/kein%20Titel,2026-04-08T08:29:31Z,,Bundeskanzler Christian Stocker nennt die Waffenruhe zwischen den USA und dem Iran in einer ersten Reaktion einen wichtigen Schritt zur Deeskalation. Außenministerin Beate Meinl-Reisinger spricht von… [+2723 chars],,de,'Energie'
https://www.zeit.de/news/2026-04/08/durchsuchung-nach-anti-gas-protest-karlsruhe-eingeschaltet,https://www.zeit.de/news/2026-04/08/durchsuchung-nach-anti-gas-protest-karlsruhe-eingeschaltet,0,www.zeit.de,Gas-Bohrung am Ammersee: Durchsuchung nach Anti-Gas-Protest - Karlsruhe eingeschaltet,Hier finden Sie Informationen zu dem Thema „Gas-Bohrung am Ammersee“. Lesen Sie jetzt „Durchsuchung nach Anti-Gas-Protest - Karlsruhe eingeschaltet“.,https://img.zeit.de/news/2026-04/08/durchsuchung-nach-anti-gas-protest-karlsruhe-eingeschaltet-image-group/wide__1300x731,2026-04-08T09:11:51Z,,Eine Hausdurchsuchung nach einer Protestaktion auf einem Gasbohrturm im oberbayerischen Reichling wird zum Fall für das Bundesverfassungsgericht. Nachdem das Landgericht Augsburg Beschwerden des Betr… [+2177 chars],,de,'Gas'
https://www.golem.de/sonstiges/zustimmung/auswahl.html?from=https://www.golem.de/news/energiespeicher-china-baut-energiesystem-pragmatisch-um-2604-207321.html&referer=https://t.co/c5a6f58982,https://www.golem.de/sonstiges/zustimmung/auswahl.html?from=https://www.golem.de/news/energiespeicher-china-baut-energiesystem-pragmatisch-um-2604-207321.html&referer=https://t.co/c5a6f58982,0,www.golem.de,Energiespeicher: China baut Energiesystem pragmatisch um,"Mit Druckluft, Pumpspeichern und Batterien soll Chinas Stromnetz auf den hohen Speicherbedarf durch immer mehr erneuerbare Energie vorbereitet werden. (Strom, Akku)",,2026-04-08T09:13:02Z,,"Besuchen Sie Golem.de wie gewohnt mit Werbung und Tracking,
 indem Sie der Nutzung aller Cookies zustimmen.
 Details zum Tracking finden Sie im Privacy Center.
Skript wurde nicht geladen. Informat… [+607 chars]",,de,'Energie'
https://www.stern.de/gesellschaft/regional/sachsen-anhalt/landtagswahlkampf--energie-und-schulklos---gruene-setzen-auf-buergernahe-themen-37290388.html,https://www.stern.de/gesellschaft/regional/sachsen-anhalt/landtagswahlkampf--energie-und-schulklos---gruene-setzen-auf-buergernahe-themen-37290388.html,0,www.stern.de,Landtagswahlkampf: Energie und Schulklos - Grüne setzen auf bürgernahe Themen,"Magdeburg (sa) - Sachsen-Anhalts Grüne wollen im Landtagswahlkampf stärker als bisher auf Ziele setzen, die unmittelbar zur Verbesserung der Lebenslage",https://image.stern.de/37290390/t/MD/v1/w1440/r1.7778/-/08--3gydnhe4yuv6axs2048jpeg---58d419fc78d5d048.jpg,2026-04-08T09:20:02Z,,"Kopiere den aktuellen Link
Zur Merkliste hinzufügen
Immer wieder kämpfen die Grünen bei Wahlen darum, über die Fünf-Prozent-Hürde zu kommen. Wie wollen sie nun den Wiedereinzug in den Landtag schaf… [+3470 chars]",,de,'Energie'
https://www.bild.de/leben-wissen/sparfochs/stromio-verliert-vor-olg-duesseldorf-millionen-schadenersatz-nach-massenkuendigungen-69d4b4488ba297d4b1231165,https://www.bild.de/leben-wissen/sparfochs/stromio-verliert-vor-olg-duesseldorf-millionen-schadenersatz-nach-massenkuendigungen-69d4b4488ba297d4b1231165,0,www.bild.de,Oberlandesgericht lehnt Berufung ab - Stromio muss Kunden Millionen Schadenersatz zahlen,Das OLG Düsseldorf will Berufungen abweisen: Stromio und Gas.de sollen Millionen zahlen.,"https://images.bild.de/69d4b4488ba297d4b1231165/8579e8f5bf3e3f6c762b8e51ab7e508d,fedc5d6?w=1280",2026-04-08T09:33:32Z,,"TTS-Player überspringenArtikel weiterlesenVor fast genau vier Jahren passierte das, was sich bis dahin noch kein Strom- und Gasversorger getraut hatte: Die Stromio GmbH kündigte sämtliche Verträge ih… [+3664 chars]",,de,'Energie'
https://www.zeit.de/news/2026-04/08/linke-wegen-trumps-politik-us-basis-ramstein-schliessen,https://www.zeit.de/news/2026-04/08/linke-wegen-trumps-politik-us-basis-ramstein-schliessen,0,www.zeit.de,Iran-Krieg: Linke: Wegen Trumps Politik US-Basis Ramstein schließen,Hier finden Sie Informationen zu dem Thema „Iran-Krieg“. Lesen Sie jetzt „Linke: Wegen Trumps Politik US-Basis Ramstein schließen“.,https://img.zeit.de/news/2026-04/08/linke-wegen-trumps-politik-us-basis-ramstein-schliessen-image-group/wide__1300x731,2026-04-08T09:58:53Z,,Nach den US-Drohungen gegen den Iran und der Schlichtung in letzter Minute fordert die Linke von Bundeskanzler Friedrich Merz (CDU) eine scharfe Abgrenzung gegen die Politik von US-Präsident Donald T… [+822 chars],,de,'Iran'
https://www.welt.de/wirtschaft/article69d6086e8b52f2de5d6b8868/sie-sind-zu-putins-geiseln-geworden-russlands-oligarchen-im-ueberlebensmodus.html,https://www.welt.de/wirtschaft/article69d6086e8b52f2de5d6b8868/sie-sind-zu-putins-geiseln-geworden-russlands-oligarchen-im-ueberlebensmodus.html,0,www.welt.de,„Sie sind zu Putins Geiseln geworden“ – Russlands Oligarchen im Überlebensmodus,"Das Verhältnis von Putin und den russischen Oligarchen war schon immer kompliziert, seit dem Ukraine-Krieg aber ist ihr Schicksal noch enger miteinander verknüpft. Schuld daran ist die „debile Politik Europas und der USA“, sagt ein Experte.",https://images.welt.de/69d6086e8b52f2de5d6b8868/f59bbcc82227cdd8699d0d8d228a1761-master/ci16x9-w1200/gettyimages-2250109757-jpg,2026-04-08T10:03:16Z,,"Das Verhältnis von Putin und den russischen Oligarchen war schon immer kompliziert, seit dem Ukraine-Krieg aber ist ihr Schicksal noch enger miteinander verknüpft. Schuld daran ist die debile Politik… [+7766 chars]",,de,'Krieg'
https://hallespektrum.de/aktuelles/fdp-sachsen-anhalt-fordert-entlastungen-bei-spritpreisen-kritik-an-bundeskanzler-merz/476372/,https://hallespektrum.de/aktuelles/fdp-sachsen-anhalt-fordert-entlastungen-bei-spritpreisen-kritik-an-bundeskanzler-merz/476372/,0,hallespektrum.de,FDP Sachsen-Anhalt fordert Entlastungen bei Spritpreisen – Kritik an Bundeskanzler Merz,"Der Vorsitzende der FDP-Landtagsfraktion Sachsen-Anhalt, Andreas Silbersack, hat angesichts gestiegener Kraftstoffpreise deutliche Kritik an der Bundesregierung geäußert und Bundeskanzler Friedrich Merz zu einer öffentlichen Ansprache an die Bevölkerung aufge…",https://hallespektrum.de/wp-content/uploads/2026/03/sprit.jpg,2026-04-08T10:18:18Z,,"Der Vorsitzende der FDP-Landtagsfraktion Sachsen-Anhalt, Andreas Silbersack, hat angesichts gestiegener Kraftstoffpreise deutliche Kritik an der Bundesregierung geäußert und Bundeskanzler Friedrich M… [+750 chars]",,de,'Friedrich Merz'
https://orf.at/stories/3426249/,https://orf.at/stories/3426249/,0,orf.at,Merkliches Aufatmen an den Börsen,"Nach der Einigung auf eine Waffenruhe im Iran-Krieg herrscht Erleichterung an den Aktien- und Rohstoffmärkten. Der Ölpreis sackte im zweistelligen Prozentbereich ab, während weltweit die Aktienkurse stiegen. Der deutsche Leitindex DAX legte zu Börsenbeginn um…",https://ibs.orf.at/news?image=https%3A%2F%2Fassets.orf.at%2Fmims%2F2026%2F15%2F80%2Fcrops%2Fw%3D1200%2Ch%3D630%2Cq%3D75%2F2995770_master_1158580_iran_krieg_waffenruhe_boersen_oelpreis2_afp.jpg%3Fs%3Dfc2193d9a0760185c54682d8a53d539db09d624d,2026-04-08T10:24:23Z,,"Wichtig für die globalen Märkte ist vor allem, dass der Iran die Straße von Hormus nun wieder für den Schiffsverkehr öffnen will. Die Meerenge ist einer der global wichtigsten Transportwege nicht nur… [+2565 chars]",,de,'Iran'
https://www.morgenpost.de/ratgeber-wissen/finanzen/article411655474/waermepumpe-energieberatung-kosten-heizung.html,https://www.morgenpost.de/ratgeber-wissen/finanzen/article411655474/waermepumpe-energieberatung-kosten-heizung.html,0,www.morgenpost.de,Wärmepumpe mit Energieberatung: Profi-Tipp gegen „unnötig hohe Kosten“,Eine ineffiziente Wärmepumpe kann hohe Kosten verursachen. Eine Energieberatung zahlt sich vor der Sanierung in mehrfacher Hinsicht aus. Doch ein Experte warnt.,https://img.sparknews.funkemedien.de/409008314/409008314_1747141743_v16_9_1600.jpeg,2026-04-08T10:37:41Z,,"Wer seine Immobilie energetisch saniert, spart langfristig nicht nur Energiekosten. Auch bei der Baufinanzierung kann sich der Aufwand lohnen: Energieeffiziente Gebäude führen oft zu günstigeren Kond… [+5994 chars]",,de,'Energie'
https://tirol.orf.at/stories/3349150/,https://tirol.orf.at/stories/3349150/,0,tirol.orf.at,Gerber fordert mehr Entlastung für Betriebe,Tirols Wirtschaftslandesrat Mario Gerber (ÖVP) hat am Mittwoch einen „großen Wurf“ bei Lohnstückkosten sowie leistbarer Energie durch die ÖVP/SPÖ/NEOS-Bundesregierung gefordert. Er stehe im Austausch mit dem Wirtschaftsministerium und mahne umfassende Entlast…,https://ibs.orf.at/tir?image=https%3A%2F%2Foekastatic.orf.at%2Fmims%2F2026%2F15%2F48%2Fcrops%2Fw%3D1200%2Ch%3D627%2Cq%3D75%2F2995982_master_1158648_bau1.jpg%3Fs%3Db6ea2ac9202e9efbc4f970d2dfa496570130c7bc,2026-04-08T11:11:56Z,,"Wir brauchen eine ganz klare Entlastung, betonte Gerber bei der Präsentation einer Studie zur Bauwirtschaft.
Österreich nicht mehr konkurrenzfähig
Österreich sei bei den Arbeitskosten im Vergleich … [+3606 chars]",,de,'Energie'
https://www.tagesschau.de/ausland/asien/iran-reaktionen-waffenruhe-100.html,https://www.tagesschau.de/ausland/asien/iran-reaktionen-waffenruhe-100.html,0,www.tagesschau.de,"Waffenruhe mit den USA: Iran spricht von ""großem Erfolg""","Nach der Einigung auf eine Waffenruhe mit den USA erklärt Iran, nahezu alle Kriegsziele seien erreicht. Unklar ist noch, wann die Durchfahrt durch die Straße von Hormus wieder für alle Schiffe möglich ist. Von Pia Masurczak.",https://images.tagesschau.de/image/d7b10817-cdc6-4f0e-add1-9676937a2bcb/AAABnWx8K3o/AAABnSSvrFg/16x9-big/teheran-264.jpg?width=1280,2026-04-08T11:20:29Z,,"Stand: 08.04.2026 13:20 Uhr
Nach der Einigung auf eine Waffenruhe mit den USA erklärt Iran, nahezu alle Kriegsziele seien erreicht. Unklar ist noch, wann die Durchfahrt durch die Straße von Hormus w… [+3597 chars]",,de,'Iran'
https://www.sueddeutsche.de/wirtschaft/oelpreis-einsturz-waffenruhe-iran-usa-strasse-von-hormus-spritpreis-li.3464731,https://www.sueddeutsche.de/wirtschaft/oelpreis-einsturz-waffenruhe-iran-usa-strasse-von-hormus-spritpreis-li.3464731,0,www.sueddeutsche.de,Iran-Krieg: Ölpreis bricht ein – Spritpreise weiter auf hohem Niveau,"Die Preise für Rohöl sind auf dem niedrigsten Stand seit Mitte März, doch die Entspannung an den Tankstellen bleibt aus. Die Bundesregierung und der Mineralölwirtschaftsverband hatten zuvor die Hoffnung auf sinkende Spritpreise bereits gedämpft.",https://www.sueddeutsche.de/2026/04/08/4d8eea7a-f1e1-4156-a50b-73d0351a0fe1.jpg?q=60&fm=webp&width=1200&rect=0%2C134%2C2574%2C1448,2026-04-08T11:27:36Z,,"Auf die Spritpreise in Deutschland zeigt der gesunkene Rohölpreis hingegen kaum Auswirkung, die allermeisten Tankstellen haben am Mittwochmittag ihre Preise sogar deutlich erhöht. Im bundesweiten Dur… [+4667 chars]",,de,'Iran'
https://www.zeit.de/news/2026-04/08/trump-50-prozent-zoelle-fuer-irans-waffenlieferanten,https://www.zeit.de/news/2026-04/08/trump-50-prozent-zoelle-fuer-irans-waffenlieferanten,0,www.zeit.de,Iran-Krieg: Trump: 50-Prozent-Zölle für Irans Waffenlieferanten,Hier finden Sie Informationen zu dem Thema „Iran-Krieg“. Lesen Sie jetzt „Trump: 50-Prozent-Zölle für Irans Waffenlieferanten“.,https://img.zeit.de/administratives/sharing/fallback-image-die-zeit/wide__1300x731,2026-04-08T12:04:06Z,,"US-Präsident Donald Trump droht Ländern, die den Iran mit Waffen beliefern, mit Strafzöllen von 50 Prozent. Ein entsprechender Zollsatz solle mit sofortiger Wirkung auf alle Waren gelten, die in die … [+103 chars]",,de,'Krieg'
