index,url,valid,domain,title,description,image,published,archive,content,quote,language,keyword
https://www.zeit.de/news/2026-03/02/pilotengewerkschaft-verzichtet-diese-woche-auf-streiks,https://www.zeit.de/news/2026-03/02/pilotengewerkschaft-verzichtet-diese-woche-auf-streiks,0,www.zeit.de,Iran-Krieg: Pilotengewerkschaft verzichtet diese Woche auf Streiks,Hier finden Sie Informationen zu dem Thema „Iran-Krieg“. Lesen Sie jetzt „Pilotengewerkschaft verzichtet diese Woche auf Streiks“.,https://img.zeit.de/news/2026-03/02/pilotengewerkschaft-verzichtet-diese-woche-auf-streiks-image-group/wide__1300x731,2026-03-02T13:18:30Z,,"Fluggästen drohen seitens der Pilotengewerkschaft VC Cockpit in dieser Woche keine Streiks. Man verzichte vorläufig auf Arbeitskampfmaßnahmen wegen des eskalierten Konflikts im Nahen Osten, teilte VC… [+1316 chars]",,de,'Krieg'
https://www.zeit.de/news/2026-03/02/lufthansa-meidet-luftraum-im-nahen-osten-weitgehend,https://www.zeit.de/news/2026-03/02/lufthansa-meidet-luftraum-im-nahen-osten-weitgehend,0,www.zeit.de,Iran-Krieg: Lufthansa meidet Luftraum im Nahen Osten weitgehend,Hier finden Sie Informationen zu dem Thema „Iran-Krieg“. Lesen Sie jetzt „Lufthansa meidet Luftraum im Nahen Osten weitgehend“.,https://img.zeit.de/news/2026-03/02/lufthansa-meidet-luftraum-im-nahen-osten-weitgehend-image-group/wide__1300x731,2026-03-02T13:57:33Z,,"Die Lufthansa meidet wegen des Iran-Kriegs den Nahen Osten weitgehend. Bis einschließlich 8. März werde der Luftraum über Israel, Libanon, Jordanien und Irak nicht von den Airlines der Lufthansa-Grup… [+1905 chars]",,de,'Krieg'
https://www.focus.de/politik/deutschland/koalition-einig-buergergeld-wird-donnerstag-abgeschafft_18472e49-b897-4ba6-b417-4677189be9df.html,https://www.focus.de/politik/deutschland/koalition-einig-buergergeld-wird-donnerstag-abgeschafft_18472e49-b897-4ba6-b417-4677189be9df.html,0,www.focus.de,Koalition einig: Bürgergeld wird Donnerstag abgeschafft,Koalition ist sich bei Bürgergeldreform einig – Gesetz soll am Donnerstagvormittag verabschiedet werden,https://quadro.burda-forward.de/ctf/ab778728-60e5-4b69-bddc-5d30ba25d903.0be28309-a48e-45f9-9574-52f1c18f0a1c.png?im=RegionOfInterestCrop%3D%281200%2C630%29%2CregionOfInterest%3D%28880%2C364%29&hash=efe96f334d53f38a372be1c4b742fe392adb54b4e432e19eb97ce7640638ee45,2026-03-02T14:33:00Z,,"Das Gesetz wird am Donnerstagvormittag im Bundestag verabschiedet. Dieser Zeitplan war bekannt. Damit wäre ein zentraler Konflikt der Koalition gelöst.
Im parlamentarischen Verfahren ging es nach In… [+1274 chars]",,de,'Bürgergeld'
https://www.zeit.de/news/2026-03/02/was-der-iran-krieg-fuer-schiffe-und-haefen-bedeutet,https://www.zeit.de/news/2026-03/02/was-der-iran-krieg-fuer-schiffe-und-haefen-bedeutet,0,www.zeit.de,Krieg in Nahost: Was der Iran-Krieg für Schiffe und Häfen bedeutet,Hier finden Sie Informationen zu dem Thema „Krieg in Nahost“. Lesen Sie jetzt „Was der Iran-Krieg für Schiffe und Häfen bedeutet“.,https://img.zeit.de/news/2026-03/02/was-der-iran-krieg-fuer-schiffe-und-haefen-bedeutet-image-group/wide__1300x731,2026-03-02T14:37:04Z,,"Der Iran-Krieg hat weltweite Folgen. Auch norddeutsche Schifffahrts- und Logistikunternehmen sind von Auswirkungen betroffen. Der Vorsitzende der Industrie- und Handelskammern Nord, André Grobien, sa… [+4735 chars]",,de,'Krieg'
https://kaernten.orf.at/stories/3344088/,https://kaernten.orf.at/stories/3344088/,0,kaernten.orf.at,Wasserstoff: Kärnten startet Kooperation,"Grüner Wasserstoff spielt in der Debatte um den Ausstieg aus fossiler Energie eine bedeutende Rolle. Gemeinsam mit Oberösterreich und der Steiermark bildet Kärnten das europaweit erste Wasserstoff-Valley. Ziel ist, die Produktion von umweltfreundlichem Wasser…",https://ibs.orf.at/ktn?image=https%3A%2F%2Foekastatic.orf.at%2Fmims%2F2026%2F10%2F63%2Fcrops%2Fw%3D1200%2Ch%3D627%2Cq%3D75%2F2955159_master_1142463_20260302_wasserstoffgipfel_00_02_04_05.jpg%3Fs%3Ddf7d0e8e9d1536f0afee8831df70929c77fedc6c,2026-03-02T16:30:55Z,,"Es ist schon mehr als drei Jahre her, dass in Kärnten der erste Wasserstoffbus präsentiert wurde. Wenige Monate danach hätten bereits fünf mit grünem Wasserstoff betriebene Busse in Betrieb gehen sol… [+2645 chars]",,de,'Energie'
https://www.teltarif.de/balkonkraftwerk-zendure-solarspeicher/news/102263.html,https://www.teltarif.de/balkonkraftwerk-zendure-solarspeicher/news/102263.html,0,www.teltarif.de,Zendure SolarFlow 800 Pro: Solarspeicher fürs Balkonkraftwerk,"Die maximale Nutzung solarer Energie im Haushalt scheitert oft an der zeitlichen Differenz zwischen Erzeugung und Verbrauch, weshalb ein integrierter Akku zur Pufferung während der Sonnenstunden erforderlich ist.",https://www.teltarif.de/img/arch/2026/kw10/balkonkraftwerk-zendure-solarspeicher-2og.jpg,2026-03-02T16:48:50Z,,Die maximale Ausnut­zung von solarer Energie im heimi­schen Umfeld schei­tert oftmals an der zeit­lichen Diskre­panz zwischen Strom­erzeu­gung und tatsäch­lichem Verbrauch. Für die Puffe­rung der Ert… [+4010 chars],,de,'Energie'
https://www.stern.de/gesellschaft/regional/niedersachsen-bremen/energiewende--hannover-schaltet-ersten-block-seines-kohlekraftwerks-ab-37185096.html,https://www.stern.de/gesellschaft/regional/niedersachsen-bremen/energiewende--hannover-schaltet-ersten-block-seines-kohlekraftwerks-ab-37185096.html,0,www.stern.de,Energiewende: Hannover schaltet ersten Block seines Kohlekraftwerks ab,"Hannover macht Ernst beim Kohleausstieg: Der erste Block des Kraftwerks Stöcken ging nun vom Netz, in zwei Jahren soll auch der zweite folgen. Was das für die Energieversorgung bedeutet.",https://image.stern.de/37185098/t/Gv/v1/w1440/r1.7778/-/02--a5rdsa5z3fv8axs2048jpeg---2cf8041f7c61a593.jpg,2026-03-02T18:00:04Z,,"Kopiere den aktuellen Link
Zur Merkliste hinzufügen
Hannover macht Ernst beim Kohleausstieg: Der erste Block des Kraftwerks Stöcken ging nun vom Netz, in zwei Jahren soll auch der zweite folgen. Wa… [+2068 chars]",,de,'Energie'
https://www.zeit.de/news/2026-03/02/hannover-schaltet-ersten-block-seines-kohlekraftwerks-ab,https://www.zeit.de/news/2026-03/02/hannover-schaltet-ersten-block-seines-kohlekraftwerks-ab,0,www.zeit.de,Energiewende: Hannover schaltet ersten Block seines Kohlekraftwerks ab,Hier finden Sie Informationen zu dem Thema „Energiewende“. Lesen Sie jetzt „Hannover schaltet ersten Block seines Kohlekraftwerks ab“.,https://img.zeit.de/news/2026-03/02/hannover-schaltet-ersten-block-seines-kohlekraftwerks-ab-image-group/wide__1300x731,2026-03-02T18:00:04Z,,"Hannover nimmt den ersten Block seines Kohlekraftwerks Stöcken vom Netz. Am Wochenende sei der 75 Meter hohe Block I des Kohlekraftwerks endgültig außer Betrieb genommen worden, teilte der kommunale … [+1866 chars]",,de,'Energie'
https://www.n-tv.de/politik/Der-Krieg-im-Iran-ist-ein-strategisches-Geschenk-fuer-Russland-und-China-id30423238.html,https://www.n-tv.de/politik/Der-Krieg-im-Iran-ist-ein-strategisches-Geschenk-fuer-Russland-und-China-id30423238.html,0,www.n-tv.de,"Reisners Blick auf die Front: ""Der Krieg im Iran ist ein strategisches Geschenk für Russland und China""","Mit sechs operativen Manövergruppen halten die Russen den Druck auf die Ukrainer aufrecht. Ergebnisse sehe der Kreml vor allem westlich von Siwersk und Huljajpole, sagt Oberst Reisner. Durch den Krieg im Nahen Osten würde der Druck erhöht - weil Ressourcen kn…",https://www.n-tv.de/img/30423290/1772480066/Img_16_9/1200/RUSSIA-JANUARY-19-2026-A-serviceman-takes-part-in-a-military-training-exercise-held-by-an-engineer-unit-of-the-Russian-Southern-Military-District-based-on-the-experience-gained-in-Russia-s-special-military-operation-Credit-Image-Erik-Romanenko-TASS-via-ZUMA-Press.jpg,2026-03-02T18:56:59Z,,"""Vier Jahre nach Beginn des Krieges kontrolliert die russische Armee derzeit 92.092 Quadratkilometer, was 15,25 Prozent der Ukraine entspricht"", sagt Reisner. (Foto: picture alliance / ZUMAPRESS.com)… [+9478 chars]",,de,'Ukraine'
https://www.welt.de/politik/ausland/article69a56f4ecc6f44c0f427a064/ukraine-krieg-ukraine-meldet-gelaendegewinne-im-sueden-elon-musk-soll-dabei-eine-rolle-spielen-liveticker.html,https://www.welt.de/politik/ausland/article69a56f4ecc6f44c0f427a064/ukraine-krieg-ukraine-meldet-gelaendegewinne-im-sueden-elon-musk-soll-dabei-eine-rolle-spielen-liveticker.html,0,www.welt.de,Ukraine meldet Geländegewinne im Süden – Elon Musk soll dabei eine Rolle spielen,"Bundeskanzler Friedrich Merz steht Gesprächen mit dem Kreml grundsätzlich offen gegenüber, sagt er. Derzeit seien solche Formate angesichts der russischen Kriegsführung aber sinnlos. Und: Rund um das Atomkraftwerk Saporischschja soll eine Waffenruhe gelten. M…",https://images.welt.de/69a56f4ecc6f44c0f427a064/b5d273f1ffad74b910f5c1ebadb2a25a/ci16x9-w1200/dpa-com-20090101-260126-99-293201-jpg,2026-03-02T19:21:00Z,,"Russland betont, die Gespräche zu einem Ende des Ukraine-Kriegs fortsetzen zu wollen. Der deutsche Verfassungsschutz weist auf die Gefährdung durch unzulässige ausländische Einflussnahme hin. Unterde… [+7560 chars]",,de,'Kreml'
https://www.faz.net/aktuell/politik/ukraine/ukraine-liveticker-ukraine-melden-gelaendegewinne-im-sueden-faz-110683325.html,https://www.faz.net/aktuell/politik/ukraine/ukraine-liveticker-ukraine-melden-gelaendegewinne-im-sueden-faz-110683325.html,0,www.faz.net,Krieg in der Ukraine: Ukraine melden Geländegewinne im Süden,Erstmals seit 2024 mehr Zurückeroberungen als russische Einnahmen +++ Selenskyj: Haben schwierigen Winter überstanden +++ Ukraine: Russland würde US-Sicherheitsgarantien akzeptieren +++ alle Neuigkeiten im Liveblog,https://media0.faz.net/image/w1200h627/b0ed13024d4f/w3000h1567x0y216o/202601/43601.0.1704611853/soldaten-im-gebiet.webp,2026-03-02T19:27:57Z,,Im Konflikt um Energielieferungen hat der ukrainische Präsident Wolodymyr Selenskyj am Freitag mit dem slowakischen Regierungschef Robert Fico telefoniert. Der Präsident der Ukraine lade Fico in die … [+846 chars],,de,'Ukraine'
https://orf.at/stories/3422099/,https://orf.at/stories/3422099/,0,orf.at,Ukraine spricht von Geländegewinnen im Süden,,https://orf.at/mojo/1_4_1/storyserver//news/common/images/og-fallback-news.png,2026-03-02T19:29:15Z,,"Die ukrainischen Streitkräfte haben nach eigenen Angaben im Gebiet Saporischschja seit Ende Jänner neun Siedlungen zurückerobert und setzen ihren Gegenangriff an der südöstlichen Front fort.
Erstmal… [+778 chars]",,de,'Ukraine'
https://www.faz.net/aktuell/politik/ausland/angriff-auf-iran-trump-wir-vernichten-die-bedrohung-durch-dieses-terrorregime-faz-200583539.html,https://www.faz.net/aktuell/politik/ausland/angriff-auf-iran-trump-wir-vernichten-die-bedrohung-durch-dieses-terrorregime-faz-200583539.html,0,www.faz.net,Liveblog Irankrieg: Trump: „Wir vernichten die Bedrohung durch dieses Terrorregime“,"US-Präsident: Führen Krieg so lange wie nötig +++ Hegseth: Amerika hat Krieg nicht begonnen +++ Bundesregierung will Flugzeuge entsenden, um Touristen aus Nahem Osten zu holen +++ alle Entwicklungen im Liveblog",https://media0.faz.net/image/w1200h627/412150765789/w8108h4236x0y162o/202603/43601.0.1839836103/donald-trump-bei-seiner-rede.webp,2026-03-02T19:52:43Z,,"Aus Sicht von US-Präsident Donald Trump hat Großbritannien die US-Nutzung britischer Stützpunkte für Angriffe auf Iran zu spät erlaubt. Er sei sehr enttäuscht gewesen, dass der britische Premierminis… [+851 chars]",,de,'Krieg'
https://www.n-tv.de/politik/21-13-Ukraine-meldet-Befreiung-von-neun-Siedlungen-id30423733.html,https://www.n-tv.de/politik/21-13-Ukraine-meldet-Befreiung-von-neun-Siedlungen-id30423733.html,0,www.n-tv.de,Ukraine-Krieg im Liveticker: +++ 21:13 Ukraine meldet Befreiung von neun Siedlungen +++,"Berlin, Washington, Brüssel - überall. ntv berichtet von allen wichtigen Schauplätzen der Innen- und Außenpolitik.",https://www.n-tv.de/img/2339153/1721988811/Img_16_9/1200/Ukraine-Liveticker.jpg,2026-03-02T21:00:00Z,,Die ukrainischen Streitkräfte haben nach eigenen Angaben im Südosten der Ukraine seit Ende Januar neun Siedlungen zurückerobert und setzen ihren Gegenangriff in Richtung Oleksandrivka fort. Die Befre… [+24845 chars],,de,'Ukraine'
https://www.faz.net/aktuell/politik/usa-unter-trump/liveblog-usa-unter-trump-melania-trump-haelt-rede-leitet-sitzung-im-un-sicherheitsrat-faz-19444916.html,https://www.faz.net/aktuell/politik/usa-unter-trump/liveblog-usa-unter-trump-melania-trump-haelt-rede-leitet-sitzung-im-un-sicherheitsrat-faz-19444916.html,0,www.faz.net,Liveblog USA unter Trump: Melania Trump eröffnet Sitzung des UN-Sicherheitsrats,Gremium erstmalig von einer First Lady geleitet +++ Open AI ersetzt offenbar Anthropic +++ US-Heimatschutz nach Tod eines Migranten aus Mynamar  unter Druck +++ alle Neuigkeiten im Liveblog,https://media0.faz.net/image/w1200h627/6aae05212d3d/w6658h3478x0y133o/202603/43601.0.1840220987/die-first-lady-melania-trump.webp,2026-03-02T21:17:50Z,,"Die SPD-Bundestagsfraktion warnt vor einem Flächenbrand in Nahost, sollten die Vereinigten Staaten Iran angreifen. Die Lage im Iran ist dramatisch: Das Regime unterdrückt und mordet die eigene Bevölk… [+1163 chars]",,de,'Energie'
https://www.zeit.de/wirtschaft/2026-03/strasse-von-hormus-iran-krieg-oelpreis,https://www.zeit.de/wirtschaft/2026-03/strasse-von-hormus-iran-krieg-oelpreis,0,www.zeit.de,Ölversorgung: Irans Revolutionsgarden prognostizieren Ölpreis von 200 US-Dollar,"Der Iran droht damit, jedes Schiff zu verbrennen, das die Straße von Hormus zu passieren versucht. Auch Pipelines würden attackiert. Kein Tropfen Öl solle durchkommen.",https://img.zeit.de/wirtschaft/2026-03/strasse-von-hormus-iran-krieg-oelpreis-bild/wide__1300x731,2026-03-03T01:39:07Z,,"Ein General der
iranischen Revolutionsgarde hat erneut gezielte Angriffe auf Tanker in der
Straße von Hormus verkündet, um den Rohstoffmarkt zu stören und die globalen Ölpreise
auf bis zu 200 US-D… [+3891 chars]",,de,'Energie'
https://www.zeit.de/news/2026-03/03/iran-krieg-laesst-oelpreise-weiter-steigen,https://www.zeit.de/news/2026-03/03/iran-krieg-laesst-oelpreise-weiter-steigen,0,www.zeit.de,Energie: Iran-Krieg lässt Ölpreise weiter steigen,Hier finden Sie Informationen zu dem Thema „Energie“. Lesen Sie jetzt „Iran-Krieg lässt Ölpreise weiter steigen“.,https://img.zeit.de/news/2026-03/03/iran-krieg-laesst-oelpreise-weiter-steigen-image-group/wide__1300x731,2026-03-03T08:01:03Z,,Die Ölpreise haben am Dienstag im frühen Handel weiter zugelegt. Nach einem kräftigen Anstieg am ersten Handelstag nach dem Beginn des Iran-Kriegs legten die Preise zunächst bis zu rund drei Prozent … [+1023 chars],,de,'Energie'
https://www.zeit.de/news/2026-03/03/erstes-flugzeug-von-dubai-unterwegs-nach-frankfurt,https://www.zeit.de/news/2026-03/03/erstes-flugzeug-von-dubai-unterwegs-nach-frankfurt,0,www.zeit.de,Krieg mit Iran: Erstes Flugzeug von Dubai unterwegs nach Frankfurt,Hier finden Sie Informationen zu dem Thema „Krieg mit Iran“. Lesen Sie jetzt „Erstes Flugzeug von Dubai unterwegs nach Frankfurt“.,https://img.zeit.de/news/2026-03/03/erstes-flugzeug-von-dubai-unterwegs-nach-frankfurt-image-group/wide__1300x731,2026-03-03T08:31:23Z,,"Ein erstes Flugzeug der emiratischen Airline Emirates ist nach den zahlreichen Flugausfällen wegen des Iran-Krieges nun von Dubai nach Frankfurt am Main unterwegs. Eine Sprecherin der Fraport, der Be… [+1111 chars]",,de,'Krieg'
https://www.zeit.de/news/2026-03/03/golfregion-wichtig-fuer-hessische-wirtschaft,https://www.zeit.de/news/2026-03/03/golfregion-wichtig-fuer-hessische-wirtschaft,0,www.zeit.de,Iran-Krieg: Golfregion wichtig für hessische Wirtschaft,Hier finden Sie Informationen zu dem Thema „Iran-Krieg“. Lesen Sie jetzt „Golfregion wichtig für hessische Wirtschaft“.,https://img.zeit.de/news/2026-03/03/golfregion-wichtig-fuer-hessische-wirtschaft-image-group/wide__1300x731,2026-03-03T09:47:25Z,,Für die hessische Wirtschaft spielt der Iran als Exportland wegen der langjährigen Sanktionen des Westens gegen das Land keine große Rolle. Nach Angaben des Hessischen Industrie- und Handelskammertag… [+1172 chars],,de,'Krieg'
https://www.faz.net/aktuell/politik/ukraine/ukraine-liveticker-selenskyj-sorgt-sich-um-nachschub-fuer-ukraine-faz-110683325.html,https://www.faz.net/aktuell/politik/ukraine/ukraine-liveticker-selenskyj-sorgt-sich-um-nachschub-fuer-ukraine-faz-110683325.html,0,www.faz.net,Krieg in der Ukraine: Selenskyj sorgt sich um Nachschub für Ukraine,Ukrainischer Präsident verweist auf Erfahrungen während der Angriffe auf Iran im Juni 2025 +++ Ukraine meldet Rückeroberungen im Gebiet Saporischschja +++ alle Neuigkeiten im Liveblog,https://media0.faz.net/image/w1200h627/c71663838a96/w4852h2535x0y97o/202603/43601.0.1841447635/fuerchtet-stockende.webp,2026-03-03T09:57:10Z,,Im Konflikt um Energielieferungen hat der ukrainische Präsident Wolodymyr Selenskyj am Freitag mit dem slowakischen Regierungschef Robert Fico telefoniert. Der Präsident der Ukraine lade Fico in die … [+846 chars],,de,'Saporischschja'
https://www.focus.de/politik/deutschland/berliner-behoerden-chef-1-35-millionen-mehrkosten-wegen-buergergeld-aus-fuer-ukrainer_240076c0-312e-419d-8aa2-9aa5f1a93e8e.html,https://www.focus.de/politik/deutschland/berliner-behoerden-chef-1-35-millionen-mehrkosten-wegen-buergergeld-aus-fuer-ukrainer_240076c0-312e-419d-8aa2-9aa5f1a93e8e.html,0,www.focus.de,"Berliner Behörden-Chef: 1,35 Millionen Mehrkosten wegen Bürgergeld-Aus für Ukrainer","Tim Richter, Chef des Sozialamts Steglitz-Zehlendorf, begrüßt das Bürgergeld-Aus für Ukrainer. Er warnt allerdings vor einer Überlastung seiner Behörde.",https://quadro.burda-forward.de/ctf/23bf5050-ecbd-4881-98ae-19498c830649.32475c8c-e3ba-433f-9996-2d9805e1cb74.jpg?im=RegionOfInterestCrop%3D%281200%2C630%29%2CregionOfInterest%3D%28300%2C99%29&hash=2f5a0f8321f75b035b0379657c289d6cb3c82c0ba1908537c4d36d4ad8caf600,2026-03-03T10:07:00Z,,"FOCUS online: Herr Richter, die schwarz-rote Koalition im Bund will, dass ukrainische Geflüchtete aus dem Bürgergeld fallen und stattdessen nach dem Asylbewerberleistungsgesetz versorgt werden. Das b… [+5280 chars]",,de,'Ukraine'
https://www.zeit.de/news/2026-03/03/wie-dubais-influencer-den-krieg-zeigen,https://www.zeit.de/news/2026-03/03/wie-dubais-influencer-den-krieg-zeigen,0,www.zeit.de,Eskalation in Nahost: Wie Dubais Influencer den Krieg zeigen,Hier finden Sie Informationen zu dem Thema „Eskalation in Nahost“. Lesen Sie jetzt „Wie Dubais Influencer den Krieg zeigen“.,https://img.zeit.de/news/2026-03/03/wie-dubais-influencer-den-krieg-zeigen-image-group/wide__1300x731,2026-03-03T13:00:14Z,,"Als Model und Influencer Hofit Golan die iranischen Geschosse am Nachthimmel von Dubai sieht, bricht sie in Panik aus. «Oh mein Gott», ruft sie immer wieder in einem Video, das sie in sozialen Medien… [+5750 chars]",,de,'Krieg'
https://www.zeit.de/news/2026-03/03/iran-krieg-verstaerkt-angst-in-juedischen-gemeinden,https://www.zeit.de/news/2026-03/03/iran-krieg-verstaerkt-angst-in-juedischen-gemeinden,0,www.zeit.de,Krieg im Nahen Osten: Iran-Krieg verstärkt Angst in jüdischen Gemeinden,Hier finden Sie Informationen zu dem Thema „Krieg im Nahen Osten“. Lesen Sie jetzt „Iran-Krieg verstärkt Angst in jüdischen Gemeinden“.,https://img.zeit.de/news/2026-03/03/iran-krieg-verstaerkt-angst-in-juedischen-gemeinden-image-group/wide__1300x731,2026-03-03T13:25:16Z,,Der Iran-Krieg hat das Unsicherheitsgefühl in jüdischen Gemeinden nach Ansicht des Beauftragten gegen Antisemitismus in Brandenburg noch einmal erhöht. Antisemitische Spannungen nähmen auch in Deutsc… [+1310 chars],,de,'Krieg'
https://www.zeit.de/news/2026-03/03/vermoegen-eingefroren-russlands-zentralbank-klagt-gegen-eu,https://www.zeit.de/news/2026-03/03/vermoegen-eingefroren-russlands-zentralbank-klagt-gegen-eu,0,www.zeit.de,Ukraine-Krieg: Vermögen eingefroren: Russlands Zentralbank klagt gegen EU,Hier finden Sie Informationen zu dem Thema „Ukraine-Krieg“. Lesen Sie jetzt „Vermögen eingefroren: Russlands Zentralbank klagt gegen EU“.,https://img.zeit.de/news/2026-03/03/vermoegen-eingefroren-russlands-zentralbank-klagt-gegen-eu-image-group/wide__1300x731,2026-03-03T14:24:48Z,,"Die russische Zentralbank verklagt die EU wegen der dauerhaften Festsetzung russischen Vermögens. Die EU habe mit dem Schritt gegen ihre eigenen Regularien verstoßen, argumentiert die russische Zentr… [+934 chars]",,de,'Ukraine'
https://www.zeit.de/news/2026-03/03/spd-fraktion-spricht-von-voelkerrechtsbruch-im-iran,https://www.zeit.de/news/2026-03/03/spd-fraktion-spricht-von-voelkerrechtsbruch-im-iran,0,www.zeit.de,Iran-Krieg: SPD-Fraktion spricht von Völkerrechtsbruch im Iran,Hier finden Sie Informationen zu dem Thema „Iran-Krieg“. Lesen Sie jetzt „SPD-Fraktion spricht von Völkerrechtsbruch im Iran“.,https://img.zeit.de/news/2026-03/03/spd-fraktion-spricht-von-voelkerrechtsbruch-im-iran-image-group/wide__1300x731,2026-03-03T14:27:38Z,,"Die SPD-Fraktion wirft den USA und Israel vor, mit ihrem Angriff auf den Iran das Völkerrecht gebrochen zu haben. «Für uns steht fest, dass nach allem, was wir wissen, augenblicklich das Völkerrecht … [+910 chars]",,de,'Krieg'
https://www.zeit.de/2026/10/heiner-mueller-notizbuch-1945-sinn-und-form,https://www.zeit.de/2026/10/heiner-mueller-notizbuch-1945-sinn-und-form,0,www.zeit.de,Heiner Müller: Der Krieg ist vorbei,Als käme der Dramatiker aus der Zukunft: In einem jetzt erst aufgetauchten Notizbuch aus dem Jahr 1945 funkeln uns die Gedanken seines 16-jährigen Ichs entgegen.,https://img.zeit.de/2026/10/der-krieg-ist-vorbei-bild-2/wide__1300x731,2026-03-03T14:57:08Z,,"Nachts, wenn wir in die Sterne schauen, dann verlassen unsere Augen die Gegenwart, denn das Licht, das uns da aus dem Universum entgegenstrahlt, hat Jahrzehnte gebraucht, um zu uns zu gelangen. Stern… [+558 chars]",,de,'Krieg'
https://www.zeit.de/wirtschaft/boerse/2026-03/iran-krieg-boerse-dax-gaspreis-oel,https://www.zeit.de/wirtschaft/boerse/2026-03/iran-krieg-boerse-dax-gaspreis-oel,0,www.zeit.de,Krieg im Iran: Dax sinkt wegen Iran-Krieg weiter,"Der Krieg im Iran und die infolgedessen steigenden Energiepreise sorgen am Markt für schlechte Stimmung. Der Dax verlor zum Handelsende 3,44 Prozent.",https://img.zeit.de/politik/deutschland/2026-03/dax-iran-krieg/wide__1300x731,2026-03-03T17:38:39Z,,"Der Iran-Krieg hat den Abwärtsdruck an den 
weltweiten Börsen verstärkt. So sank der deutsche Leitindex Dax ab und büßte zum Handelsende 
3,44 Prozent auf 23.790,65 Punkte 
ein. Mit dem deutlichen… [+787 chars]",,de,'Krieg'
https://www.zeit.de/news/2026-03/04/experten-iran-krieg-koennte-lebensmittelpreise-erhoehen,https://www.zeit.de/news/2026-03/04/experten-iran-krieg-koennte-lebensmittelpreise-erhoehen,0,www.zeit.de,Preise: Experten: Iran-Krieg könnte Lebensmittelpreise erhöhen,Hier finden Sie Informationen zu dem Thema „Preise“. Lesen Sie jetzt „Experten: Iran-Krieg könnte Lebensmittelpreise erhöhen“.,https://img.zeit.de/news/2026-03/04/experten-iran-krieg-koennte-lebensmittelpreise-erhoehen-image-group/wide__1300x731,2026-03-04T09:47:41Z,,Der Krieg im Iran könnte nach Einschätzung von Experten die Preise für Verbraucher in Deutschland nicht nur an der Zapfsäule steigen lassen. «Natürlich könnte der Krieg Kosteneffekte bei Lebensmittel… [+1680 chars],,de,'Krieg'
https://www.golem.de/sonstiges/zustimmung/auswahl.html?from=https://www.golem.de/news/flugabwehr-im-irankrieg-abnutzungskrieg-um-raketenbestaende-2603-206071.html&referer=https://t.co/d1195c363b,https://www.golem.de/sonstiges/zustimmung/auswahl.html?from=https://www.golem.de/news/flugabwehr-im-irankrieg-abnutzungskrieg-um-raketenbestaende-2603-206071.html&referer=https://t.co/d1195c363b,0,www.golem.de,Flugabwehr im Irankrieg: Abnutzungskrieg um Raketenbestände,"Der Iran-Krieg könnte eine unerwartete Wendung nehmen, angesichts der vielen verschossenen Flugabwehrraketen Israels und der USA. (Militär, Politik)",,2026-03-04T10:40:02Z,,"Besuchen Sie Golem.de wie gewohnt mit Werbung und Tracking,
 indem Sie der Nutzung aller Cookies zustimmen.
 Details zum Tracking finden Sie im Privacy Center.
Skript wurde nicht geladen. Informat… [+607 chars]",,de,'Krieg'
https://www.zeit.de/politik/ausland/2026-03/ukraine-russland-lng-tanker-angriff,https://www.zeit.de/politik/ausland/2026-03/ukraine-russland-lng-tanker-angriff,0,www.zeit.de,Ukraine: Russischer LNG-Tanker sinkt vor Libyen nach Explosion,Die Ukraine hat offenbar einen russischen Tanker mit einer Drohne angegriffen. Nach einer Explosion und einem Großbrand sank das Schiff zwischen Libyen und Malta.,https://img.zeit.de/administratives/sharing/fallback-image-die-zeit/wide__1300x731,2026-03-04T11:04:24Z,,"Vor der Küste von Libyen ist ein russischer Flüssigerdgastanker gesunken. Das russische Verkehrsministerium teilte mit, das Schiff sei mit einer Marinedrohne angegriffen worden, die von der libyschen… [+755 chars]",,de,'Ukraine'
https://www.zeit.de/news/2026-03/05/duerr-will-ergebnis-verbessern-unsicherheit-durch-krieg,https://www.zeit.de/news/2026-03/05/duerr-will-ergebnis-verbessern-unsicherheit-durch-krieg,0,www.zeit.de,Maschinenbauer: Dürr will Ergebnis verbessern - Unsicherheit durch Krieg,Hier finden Sie Informationen zu dem Thema „Maschinenbauer“. Lesen Sie jetzt „Dürr will Ergebnis verbessern - Unsicherheit durch Krieg“.,https://img.zeit.de/news/2026-03/05/duerr-will-ergebnis-verbessern-unsicherheit-durch-krieg-image-group/wide__1300x731,2026-03-05T08:03:20Z,,"Der Maschinenbauer Dürr setzt weiter auf Kostenoptimierungen und will sein Ergebnis in diesem Jahr weiter verbessern. Dies setze allerdings voraus, dass der Krieg im Nahen Osten die Weltwirtschaft nu… [+1148 chars]",,de,'Krieg'
