index,url,valid,domain,title,description,image,published,archive,content,quote,language,keyword
https://www.zeit.de/news/2026-03/01/iranische-staatsmedien-bestaetigen-tod-chameneis,https://www.zeit.de/news/2026-03/01/iranische-staatsmedien-bestaetigen-tod-chameneis,0,www.zeit.de,Krieg: Iranische Staatsmedien bestätigen Tod Chameneis,Hier finden Sie Informationen zu dem Thema „Krieg“. Lesen Sie jetzt „Iranische Staatsmedien bestätigen Tod Chameneis“.,https://img.zeit.de/administratives/sharing/fallback-image-die-zeit/wide__1300x731,2026-03-01T01:49:38Z,,"Iranische Staatsmedien haben den Tod von Staatsoberhaupt und Religionsführer Ajatollah Ali Chamenei bestätigt. Er sei als «Märtyrer» getötet worden, berichteten unter anderem die iranischen Nachricht… [+64 chars]",,de,'Krieg'
https://www.welt.de/politik/ausland/article699bef01ee35d0f0647c4345/ukraine-krieg-belgien-kapert-tanker-der-russischen-schattenflotte-liveticker.html,https://www.welt.de/politik/ausland/article699bef01ee35d0f0647c4345/ukraine-krieg-belgien-kapert-tanker-der-russischen-schattenflotte-liveticker.html,0,www.welt.de,Belgien kapert Tanker der russischen Schattenflotte,"Bundeskanzler Friedrich Merz steht Gesprächen mit dem Kreml grundsätzlich offen gegenüber, sagt er. Derzeit seien solche Formate angesichts der russischen Kriegsführung aber sinnlos. Und: Rund um das Atomkraftwerk Saporischschja soll eine Waffenruhe gelten. M…",https://images.welt.de/699bef01ee35d0f0647c4345/f70f4d7d153cd291194ca0718cd66a2d/ci16x9-w1200/260301-belgium-schattenflotte-jpeg,2026-03-01T05:12:00Z,,Belgien hat einen Tanker der russischen Schattenflotte gekapert. Das Schiff soll in den Hafen von Seebrügge geschleppt werden. Frankreich unterstützte die Operation. Mehr im Liveticker.Die Ukraine se… [+19007 chars],,de,'Pipeline'
https://www.zeit.de/news/2026-03/01/kein-flugverkehr-nach-nahost-vom-flughafen-ber,https://www.zeit.de/news/2026-03/01/kein-flugverkehr-nach-nahost-vom-flughafen-ber,0,www.zeit.de,Krieg in Nahost: Kein Flugverkehr nach Nahost vom Flughafen BER,Hier finden Sie Informationen zu dem Thema „Krieg in Nahost“. Lesen Sie jetzt „Kein Flugverkehr nach Nahost vom Flughafen BER“.,https://img.zeit.de/news/2026-03/01/kein-flugverkehr-nach-nahost-vom-flughafen-ber-image-group/wide__1300x731,2026-03-01T09:52:14Z,,"Wegen der militärischen Eskalation in Nahost gibt es derzeit weder Abflüge noch Ankünfte vom Flughafen BER in und aus Ländern der Region. Das betreffe die Ziele Tel Aviv, Dubai, Dschidda und Doha, sa… [+522 chars]",,de,'Krieg'
https://www.zeit.de/news/2026-03/01/demonstrationen-und-appelle-zum-iran-krieg-in-hessen,https://www.zeit.de/news/2026-03/01/demonstrationen-und-appelle-zum-iran-krieg-in-hessen,0,www.zeit.de,Krieg: Demonstrationen und Appelle zum Iran-Krieg in Hessen,Hier finden Sie Informationen zu dem Thema „Krieg“. Lesen Sie jetzt „Demonstrationen und Appelle zum Iran-Krieg in Hessen“.,https://img.zeit.de/news/2026-03/01/demonstrationen-und-appelle-zum-iran-krieg-in-hessen-image-group/wide__1300x731,2026-03-01T14:02:04Z,,Der Beginn des neuen Iran-Krieges hat auch bei den Menschen in Hessen Emotionen und Reaktionen ausgelöst. In Frankfurt versammelten sich am Samstag laut Polizei rund 2.000 Menschen zu einer Demonstra… [+3308 chars],,de,'Krieg'
https://www.zeit.de/news/2026-03/01/iran-krieg-gefahrenlage-in-berlin-unveraendert,https://www.zeit.de/news/2026-03/01/iran-krieg-gefahrenlage-in-berlin-unveraendert,0,www.zeit.de,Konflikte: Iran-Krieg: Gefahrenlage in Berlin unverändert,Hier finden Sie Informationen zu dem Thema „Konflikte“. Lesen Sie jetzt „Iran-Krieg: Gefahrenlage in Berlin unverändert“.,https://img.zeit.de/news/2026-03/01/iran-krieg-gefahrenlage-in-berlin-unveraendert-image-group/wide__1300x731,2026-03-01T14:41:40Z,,Die Berliner Innenverwaltung schätzt die Gefahrenlage in der Hauptstadt als unverändert hoch ein - auch nach Beginn des Kriegs gegen den Iran. «Wir sprechen hier von einer unverändert abstrakt hohen … [+874 chars],,de,'Krieg'
https://www.zeit.de/politik/ausland/2026-02/krieg-nahost-arabische-staaten-iran-israel,https://www.zeit.de/politik/ausland/2026-02/krieg-nahost-arabische-staaten-iran-israel,0,www.zeit.de,Krieg in Nahost: Bomben auf die Glitzerwelt,"Der Iran reagiert auf die Angriffe der USA und Israels mit Raketen auf die arabischen Nachbarn. Die Botschaft dahinter ist deutlich: Wenn wir fallen, reißen wir euch mit.",https://img.zeit.de/politik/ausland/2026-02/krieg-nahost-arabische-staaten-iran-israel-bild-05/wide__1300x731,2026-03-01T14:44:47Z,,"Der zweite Tag des Kriegs wird bestimmt von einem seltsamen Schwebezustand: Irans Staatschef ist getötet worden, samt eines Gutteils der
Führungsriege. Zugleich operiert das iranische System weiter.… [+935 chars]",,de,'Krieg'
https://www.faz.net/aktuell/politik/ukraine/ukraine-liveticker-selenskyj-haben-schwierigen-winter-ueberstanden-faz-110683325.html,https://www.faz.net/aktuell/politik/ukraine/ukraine-liveticker-selenskyj-haben-schwierigen-winter-ueberstanden-faz-110683325.html,0,www.faz.net,Krieg in der Ukraine: Selenskyj: Haben schwierigen Winter überstanden,Selenskyj: „Kein Volk hat solche Prüfungen durchgemacht“ +++ Ukraine: Russland würde US-Sicherheitsgarantien akzeptieren +++ Vier Tote nach russischen Angriffen in der Nordostukraine +++ alle Neuigkeiten im Liveblog,https://media0.faz.net/image/w1200h627/4b05ebe13643/w4852h2535x0y417o/202602/43601.0.1826357063/wolodymyr-selenskyj-in.webp,2026-03-01T19:32:58Z,,Im Konflikt um Energielieferungen hat der ukrainische Präsident Wolodymyr Selenskyj am Freitag mit dem slowakischen Regierungschef Robert Fico telefoniert. Der Präsident der Ukraine lade Fico in die … [+846 chars],,de,'Ukraine'
https://www.n-tv.de/politik/Ministerin-Reiche-erwartet-trotz-Nahost-Konflikt-keine-Gasknappheit-id30419258.html,https://www.n-tv.de/politik/Ministerin-Reiche-erwartet-trotz-Nahost-Konflikt-keine-Gasknappheit-id30419258.html,0,www.n-tv.de,Höhere Energiepreise drohen: Ministerin Reiche erwartet trotz Nahost-Konflikt keine Gasknappheit,"Nach den amerikanisch-israelischen Angriffen auf den Iran sorgt die Lage an der Straße von Hormus für Unruhe. Das Bundeswirtschaftsministerium rechnet zwar mit höheren Energiepreisen, aber nicht mit Engpässen.",https://www.n-tv.de/img/30419269/1772394718/Img_16_9/1200/Katherina-Reiche-CDU-Bundesministerin-fuer-Wirtschaft-und-Energie-stellt-in-der-Bundespressekonferenz-den-Jahreswirtschaftsbericht-2026-vor-Berlin-28-01-2026.jpg,2026-03-01T19:37:47Z,,"Katherina Reiche sieht Deutschland bei Gas- und Öl-Lieferanten breit aufgestellt. (Foto: picture alliance / photothek.de)
Nach den amerikanisch-israelischen Angriffen auf den Iran sorgt die Lage an … [+1304 chars]",,de,'Energie'
https://www.zeit.de/news/2026-03/02/deutschland-behaelt-sich-militaerische-defensivmassnahmen-vor,https://www.zeit.de/news/2026-03/02/deutschland-behaelt-sich-militaerische-defensivmassnahmen-vor,0,www.zeit.de,"Krieg im Nahen Osten: Deutschland behält sich ""militärische Defensivmaßnahmen"" vor","Hier finden Sie Informationen zu dem Thema „Krieg im Nahen Osten“. Lesen Sie jetzt „Deutschland behält sich ""militärische Defensivmaßnahmen"" vor“.",https://img.zeit.de/news/2026-03/02/deutschland-behaelt-sich-militaerische-defensivmassnahmen-vor-image-group/wide__1300x731,2026-03-01T23:01:04Z,,"Deutschland, Frankreich und Großbritannien haben den Iran zu einem Stopp von Raketenangriffen auf Länder im Nahen Osten aufgefordert und behalten sich auch militärische Abwehrmaßnahmen vor. Die Angri… [+3135 chars]",,de,'Krieg'
https://www.zeit.de/news/2026-03/02/israels-armee-bombardiert-ziele-im-libanon,https://www.zeit.de/news/2026-03/02/israels-armee-bombardiert-ziele-im-libanon,0,www.zeit.de,Krieg: Israels Armee bombardiert Ziele im Libanon,Hier finden Sie Informationen zu dem Thema „Krieg“. Lesen Sie jetzt „Israels Armee bombardiert Ziele im Libanon“.,https://img.zeit.de/administratives/sharing/fallback-image-die-zeit/wide__1300x731,2026-03-02T01:22:05Z,,"Israels Armee bombardiert nach eigenen Angaben in Reaktion auf einen Angriff durch die libanesische Hisbollah-Miliz Ziele im nördlichen Nachbarland. Man habe damit begonnen, Stellungen der mit dem Ir… [+216 chars]",,de,'Krieg'
https://www.zeit.de/news/2026-03/02/ukraine-attackiert-russischen-schwarzmeerhafen-noworossijsk,https://www.zeit.de/news/2026-03/02/ukraine-attackiert-russischen-schwarzmeerhafen-noworossijsk,0,www.zeit.de,Russisch-ukrainischer Krieg: Ukraine attackiert russischen Schwarzmeerhafen Noworossijsk,Hier finden Sie Informationen zu dem Thema „Russisch-ukrainischer Krieg“. Lesen Sie jetzt „Ukraine attackiert russischen Schwarzmeerhafen Noworossijsk“.,https://img.zeit.de/news/2026-03/02/ukraine-attackiert-russischen-schwarzmeerhafen-noworossijsk-image-group/wide__1300x731,2026-03-02T06:46:20Z,,Fünf Menschen wurden in der russischen Hafenstadt und Flottenbasis Noworossijsk offiziellen Angaben zufolge bei ukrainischen Drohnenangriffen verletzt. Acht Wohnblocks und neun private Wohnhäuser sei… [+991 chars],,de,'Krieg'
https://www.focus.de/politik/deutschland/behoerden-chef-1-35-millionen-mehrkosten-wegen-buergergeld-aus-fuer-ukrainer_240076c0-312e-419d-8aa2-9aa5f1a93e8e.html,https://www.focus.de/politik/deutschland/behoerden-chef-1-35-millionen-mehrkosten-wegen-buergergeld-aus-fuer-ukrainer_240076c0-312e-419d-8aa2-9aa5f1a93e8e.html,0,www.focus.de,"Behörden-Chef: 1,35 Millionen Mehrkosten wegen Bürgergeld-Aus für Ukrainer","Tim Richter, Chef des Sozialamts Steglitz-Zehlendorf, begrüßt das Bürgergeld-Aus für Ukrainer. Er warnt allerdings vor einer Überlastung seiner Behörde.",https://quadro.burda-forward.de/ctf/23bf5050-ecbd-4881-98ae-19498c830649.32475c8c-e3ba-433f-9996-2d9805e1cb74.jpg?im=RegionOfInterestCrop%3D%281200%2C630%29%2CregionOfInterest%3D%28300%2C99%29&hash=2f5a0f8321f75b035b0379657c289d6cb3c82c0ba1908537c4d36d4ad8caf600,2026-03-02T07:18:00Z,,"FOCUS online: Herr Richter, die schwarz-rote Koalition im Bund will, dass ukrainische Geflüchtete aus dem Bürgergeld fallen und stattdessen nach dem Asylbewerberleistungsgesetz versorgt werden. Das b… [+5280 chars]",,de,'Bürgergeld'
https://www.dwdl.de/zahlenzentrale/105706/ardbrennpunkt_mit_hoechster_reichweite_seit_vier_jahren/,https://www.dwdl.de/zahlenzentrale/105706/ardbrennpunkt_mit_hoechster_reichweite_seit_vier_jahren/,0,www.dwdl.de,"ARD-""Brennpunkt"" mit höchster Reichweite seit vier Jahren","Mit weit über acht Millionen Zuschauerinnen und Zuschauern hat der ARD-""Brennpunkt"" zum Krieg im Nahen Osten am Sonntag so viele Menschen erreicht wie zuletzt beim Ausbruch des Ukraine-Kriegs. Auch ""Caren Miosga"" verbuchte steigende Quoten.",https://www.dwdl.de/images/1772438071_brennpunkt-iran---krieg-im-nahen-o.jpg,2026-03-02T07:55:00Z,,"Der ARD-""Brennpunkt"" war am Sonntag die meistgesehene Sendung des Tages. Durchschnittlich 8,62 Millionen Menschen sahen um 20:15 Uhr die knapp 20-minütige Sondersendung im Ersten zum Iran-Krieg - deu… [+2369 chars]",,de,'Ukraine'
https://www.focus.de/politik/ausland/lange-iran-wird-versuchen-moeglichst-viele-hineinziehen_c9683289-333c-4d49-bddc-9652fa2aa68f.html,https://www.focus.de/politik/ausland/lange-iran-wird-versuchen-moeglichst-viele-hineinziehen_c9683289-333c-4d49-bddc-9652fa2aa68f.html,0,www.focus.de,"Lange: ""Iran wird versuchen, möglichst viele hineinziehen""","Der Sicherheitsexperte Nico Lange hat im ZDF-""Morgenmagazin"" am Montag über die strategischen Ziele des Iran gesprochen.",https://quadro.burda-forward.de/ctf/4d7aa365-f830-4369-9be2-6593707eb65c.46a71c1d-406d-4370-99b7-e0648fc09268.jpg?im=RegionOfInterestCrop%3D%281200%2C630%29%2CregionOfInterest%3D%28878%2C410%29&hash=ac4e48d1d45684018217e1f55fb1831060744377c36a886d177faf73866b185e,2026-03-02T08:08:00Z,,"Er äußerte sich auch zu den Gefahren für Europa. Moderator Philip Wortmann fragte den Experten, ob auch europäische Soldaten in den Krieg hineingezogen werden könnten. 
Dessen Antwort: ""Jetzt sieht … [+1562 chars]",,de,'Ukraine'
https://www.sueddeutsche.de/politik/ukraine-krieg-newsblog-selenskij-winter-li.3388192,https://www.sueddeutsche.de/politik/ukraine-krieg-newsblog-selenskij-winter-li.3388192,0,www.sueddeutsche.de,Krieg in der Ukraine: Selenskij: „Wir haben den Winter überstanden“,"Der vierte Winter seit der russischen Invasion sei der schwierigste gewesen, sagt der ukrainische Präsident in einer Videoansprache. Russland habe die Ukraine vernichten wollen, doch sein Land habe nicht nachgegeben.",https://www.sueddeutsche.de/2026/03/02/35e589fd-6d8a-4cad-b0a5-ffb1d7bd8301.jpg?q=60&fm=webp&width=1200&rect=0%2C409%2C4000%2C2250,2026-03-02T08:16:00Z,,Die russische Armee hat sehr lange und verlustreich um die Stadt Pokrowsk im Osten der Ukraine gekämpft nun hat sie ihr Ziel offenbar erreicht. In der jüngsten Analyse des Institute for the Study of … [+1855 chars],,de,'Krieg'
https://www.tagesspiegel.de/wirtschaft/energie-iran-krieg-lasst-erdgas-preis-nach-oben-schnellen-15306580.html,https://www.tagesspiegel.de/wirtschaft/energie-iran-krieg-lasst-erdgas-preis-nach-oben-schnellen-15306580.html,0,www.tagesspiegel.de,Energie: Iran-Krieg lässt Erdgas-Preis nach oben schnellen,"Nach dem Angriff auf den Iran steigt der Erdgaspreis so stark wie lange nicht. Analysten warnen vor weiteren Preissprüngen, sollte der Konflikt andauern.",https://www.tagesspiegel.de/images/15306692/alternates/BASE_16_9_W1400/1772443754000/gasspeicher.jpeg,2026-03-02T08:28:21Z,,Der Großhandelspreis für Erdgas ist nach dem Angriff Israels und der USA auf den Iran kräftig gestiegen. Zum Handelsauftakt am Montag sprang die Notierung für den richtungweisenden Terminkontrakt TTF… [+2170 chars],,de,'Krieg'
https://www.bild.de/politik/ausland-und-internationales/iran-krieg-wadephul-schliesst-bundeswehr-beteiligung-aus-69a546564b8f567f12fcf0cf,https://www.bild.de/politik/ausland-und-internationales/iran-krieg-wadephul-schliesst-bundeswehr-beteiligung-aus-69a546564b8f567f12fcf0cf,0,www.bild.de,Trotz Beschuss von Bundeswehrsoldaten - Wadephul: Werden uns nicht am Iran-Krieg beteiligen,Iranische Angriffe gefährden Bundeswehrsoldaten in Jordanien und Irak. Johann Wadephul sieht Europa in Gefahr.,"https://images.bild.de/69a546564b8f567f12fcf0cf/2dce8864370c6149fda5c233d79878f3,59de46ca?w=1280",2026-03-02T08:47:34Z,,"TTS-Player überspringenArtikel weiterlesenBerlin  Deutliche Sätze von Johann Wadephul (CDU): Deutschland werde nicht an militärischen Aktionen gegen den Iran beteiligen, erklärt der Außenminister im … [+2177 chars]",,de,'Ukraine'
https://www.focus.de/politik/ausland/ploetzlicher-optimismus-aus-finnland-russland-gewinnt-diesen-krieg-nicht_2352cc05-4c65-4b69-af3d-a2c6c769f427.html,https://www.focus.de/politik/ausland/ploetzlicher-optimismus-aus-finnland-russland-gewinnt-diesen-krieg-nicht_2352cc05-4c65-4b69-af3d-a2c6c769f427.html,0,www.focus.de,"Plötzlicher Optimismus aus Finnland: ""Russland gewinnt diesen Krieg nicht""","Finnlands Präsident Stubb fordert Europa auf, das US-Narrativ über den Ukraine-Krieg zu korrigieren. Damit vollzieht er einen auffälligen Schwenk in seiner eigenen Rhetorik.",https://quadro.burda-forward.de/ctf/f7ee8a37-11e6-4f39-9a84-e0c25f760dee.9d3164e0-0f73-44ec-b323-d15ea4f48772.jpg?im=RegionOfInterestCrop%3D%281200%2C630%29%2CregionOfInterest%3D%282407%2C1172%29&hash=c904f55cd107b3bc9d97f162b6e21b43bb4bba4057d3e0a4e445474759d38d73,2026-03-02T09:15:00Z,,"Finnlands Präsident Alexander Stubb hat Europa aufgefordert, aktiv gegen die von der Trump-Regierung verbreitete Erzählung vorzugehen, die Ukraine könne den Krieg gegen Russland nicht gewinnen.  
In… [+1588 chars]",,de,'Ukraine'
https://www.stern.de/news/energie--iran-krieg-laesst-erdgas-preis-nach-oben-schnellen-37182588.html,https://www.stern.de/news/energie--iran-krieg-laesst-erdgas-preis-nach-oben-schnellen-37182588.html,0,www.stern.de,Energie: Iran-Krieg lässt Erdgas-Preis nach oben schnellen,"Nach dem Angriff auf den Iran steigt der Erdgaspreis so stark wie lange nicht. Analysten warnen vor weiteren Preissprüngen, sollte der Konflikt andauern.",https://image.stern.de/37182864/t/mZ/v1/w1440/r1.7778/-/02--zxcojjl6jov2axs2048jpeg---e622a9cf1f4362f3.jpg,2026-03-02T09:28:04Z,,"Kopiere den aktuellen Link
Zur Merkliste hinzufügen
Nach dem Angriff auf den Iran steigt der Erdgaspreis so stark wie lange nicht. Analysten warnen vor weiteren Preissprüngen, sollte der Konflikt a… [+2281 chars]",,de,'Energie'
https://www.n-tv.de/politik/Trump-provoziert-seinen-America-First-Fluegel-id30420123.html,https://www.n-tv.de/politik/Trump-provoziert-seinen-America-First-Fluegel-id30420123.html,0,www.n-tv.de,"Frieden zugesagt, Krieg gebracht: Trump provoziert seinen ""America First""-Flügel",Im Präsidentschaftswahlkampf verspricht Donald Trump den US-Amerikanern ein Ende von Kriegen. Doch allein seit Jahresbeginn sind die USA bereits in mehreren Ländern militärisch vorgegangen. Wie kommt das an?,https://www.n-tv.de/img/30420276/1772442951/Img_16_9/1200/A-protester-holds-placards-reading-No-Iran-war-during-a-demonstration-against-the-war-in-Iran-in-Chicago-Illinois-on-February-28-2026-The-US-and-Israel-launch-an-attack-of-unprecedented-scale-against-Iran-on-February-28-reportedly-killing-more-than-200-people-with-Tehran-launching-a-retaliatory-missile-barrage-that-sends-people-running-for-cover-across-the-Middle-East-Donald-Trump-announces-on-Truth-Social-that-Iran-s-supreme-leader-Ayatollah-Ali-Khamenei-is-killed-today.jpg,2026-03-02T09:45:29Z,,"Frieden zugesagt, Krieg gebrachtTrump provoziert seinen ""America First""-Flügel
Viele US-Demokraten wollen keinen Krieg gegen den Iran. Viele Wählerinnen und Wähler von Donald Trump auch nicht. (Foto… [+5851 chars]",,de,'Ukraine'
https://www.stern.de/news/spd-aussenpolitiker-zu-iran-krieg--regierung-muss-voelkerrechtsbruch-benennen-37182904.html,https://www.stern.de/news/spd-aussenpolitiker-zu-iran-krieg--regierung-muss-voelkerrechtsbruch-benennen-37182904.html,0,www.stern.de,SPD-Außenpolitiker zu Iran-Krieg: Regierung muss Völkerrechtsbruch benennen,"Nach den Angriffen Israels und der USA auf den Iran hat der SPD-Außenpolitiker Adis Ahmetovic die Bundesregierung zu einer klaren Haltung zum Völkerrecht gedrängt. ""Wenn man Völkerrechtsbrüche nicht benennt, führt man Völkerrecht ad absurdum und man sieht der…",https://image.stern.de/37182906/t/8f/v1/w1440/r1.7778/-/02--trauer-in-teheran---a2a880ec6b317ed7.jpg,2026-03-02T09:46:14Z,,"Kopiere den aktuellen Link
Zur Merkliste hinzufügen
Nach den Angriffen Israels und der USA auf den Iran hat der SPD-Außenpolitiker Adis Ahmetovic die Bundesregierung zu einer klaren Haltung zum Völ… [+2261 chars]",,de,'Ukraine'
https://www.zeit.de/news/2026-03/02/iran-krieg-laesst-aktienmarkt-einknicken-gold-gefragt,https://www.zeit.de/news/2026-03/02/iran-krieg-laesst-aktienmarkt-einknicken-gold-gefragt,0,www.zeit.de,Börsen unter Druck: Iran-Krieg lässt Aktienmarkt einknicken - Gold gefragt,Hier finden Sie Informationen zu dem Thema „Börsen unter Druck“. Lesen Sie jetzt „Iran-Krieg lässt Aktienmarkt einknicken - Gold gefragt“.,https://img.zeit.de/news/2026-03/02/iran-krieg-laesst-aktienmarkt-einknicken-gold-gefragt-image-group/wide__1300x731,2026-03-02T09:54:38Z,,Die Eskalation des Iran-Konflikts sorgt für große Verunsicherung an den Finanzmärkten. Vor allem der Anstieg der Gas- und Ölpreise wegen der Einschränkung des Schiffsverkehrs durch die Straße von Hor… [+2133 chars],,de,'Krieg'
https://www.focus.de/politik/ausland/ukraine-verfuegt-ueber-know-how-gegen-iranische-drohnen-und-will-es-mit-westen-teilen_76bbe0cd-087c-4c26-8dd6-06ffd137ba77.html,https://www.focus.de/politik/ausland/ukraine-verfuegt-ueber-know-how-gegen-iranische-drohnen-und-will-es-mit-westen-teilen_76bbe0cd-087c-4c26-8dd6-06ffd137ba77.html,0,www.focus.de,Ukraine verfügt über Know-How gegen iranische Drohnen - und will es mit Westen teilen,"Die Ukraine will ihre Luftabwehr-Erfahrung mit Verbündeten teilen, um gegen iranische Drohnen vorzugehen. Angesichts des eskalierenden Nahost-Konflikts verstärken auch europäische Länder ihre Verteidigung.",https://quadro.burda-forward.de/ctf/7e49c8c8-6c59-4227-b4e3-096d2b2665a6.1794610a-7309-49fc-b58d-6e97df65a063.jpg?im=RegionOfInterestCrop%3D%281200%2C630%29%2CregionOfInterest%3D%283160%2C1420%29&hash=85de2d88bfc1e6425da59ac4b8669bdb0c7c7239b14c17f2b105337ce58a1544,2026-03-02T10:54:00Z,,Der ukrainische Präsident Wolodymyr Selenskyj hat die Bedeutung der ukrainischen Luftabwehr hervorgehoben. Angesichts des eskalierenden Konflikts im Nahen Osten sei die Erfahrung seines Landes im Umg… [+1791 chars],,de,'Ukraine'
https://www.zeit.de/news/2026-03/02/keine-verschaerften-sicherheitsvorkehrungen-wegen-iran-krieg,https://www.zeit.de/news/2026-03/02/keine-verschaerften-sicherheitsvorkehrungen-wegen-iran-krieg,0,www.zeit.de,Nach der Eskalation: Keine verschärften Sicherheitsvorkehrungen wegen Iran-Krieg,Hier finden Sie Informationen zu dem Thema „Nach der Eskalation“. Lesen Sie jetzt „Keine verschärften Sicherheitsvorkehrungen wegen Iran-Krieg“.,https://img.zeit.de/news/2026-03/02/keine-verschaerften-sicherheitsvorkehrungen-wegen-iran-krieg-image-group/wide__1300x731,2026-03-02T10:56:00Z,,"Nach dem Angriff Israels und der USA auf den Iran werden in Rheinland-Pfalz zunächst keine Sicherheitsvorkehrungen verschärft. Der Schutz jüdischer Einrichtungen sei auf einem hohen Niveau, sagte Inn… [+326 chars]",,de,'Krieg'
https://www.zeit.de/news/2026-03/02/russland-will-weiter-mit-usa-im-ukraine-krieg-verhandeln,https://www.zeit.de/news/2026-03/02/russland-will-weiter-mit-usa-im-ukraine-krieg-verhandeln,0,www.zeit.de,Krieg in der Ukraine: Russland will weiter mit USA im Ukraine-Krieg verhandeln,Hier finden Sie Informationen zu dem Thema „Krieg in der Ukraine“. Lesen Sie jetzt „Russland will weiter mit USA im Ukraine-Krieg verhandeln“.,https://img.zeit.de/news/2026-03/02/russland-will-weiter-mit-usa-im-ukraine-krieg-verhandeln-image-group/wide__1300x731,2026-03-02T11:12:24Z,,Moskau bleibt nach Kremlangaben ungeachtet seiner Kritik an den US-Angriffen auf den Iran offen für eine Vermittlerrolle Washingtons im russischen Angriffskrieg gegen die Ukraine. «Wir schätzen weite… [+1657 chars],,de,'Krieg'
https://www.welt.de/politik/ausland/article69a56f4ecc6f44c0f427a064/ukraine-krieg-verfassungsschutz-warnt-vor-russischen-einflussversuchen-auf-landtagswahlen-liveticker.html,https://www.welt.de/politik/ausland/article69a56f4ecc6f44c0f427a064/ukraine-krieg-verfassungsschutz-warnt-vor-russischen-einflussversuchen-auf-landtagswahlen-liveticker.html,0,www.welt.de,Verfassungsschutz warnt vor russischen Einflussversuchen auf Landtagswahlen,"Bundeskanzler Friedrich Merz steht Gesprächen mit dem Kreml grundsätzlich offen gegenüber, sagt er. Derzeit seien solche Formate angesichts der russischen Kriegsführung aber sinnlos. Und: Rund um das Atomkraftwerk Saporischschja soll eine Waffenruhe gelten. M…",https://images.welt.de/69a56f4ecc6f44c0f427a064/f54fbf97950a16477ce3a4c1f875cf89/ci16x9-w1200/dpa-com-20090101-260227-935-1181375-jpg,2026-03-02T11:18:00Z,,"Russland betont, die Gespräche zu einem Ende des Ukraine-Kriegs fortsetzen zu wollen. Der deutsche Verfassungsschutz weist auf die Gefährdung durch unzulässige ausländische Einflussnahme hin.
Alle E… [+4209 chars]",,de,'Saporischschja'
https://www.focus.de/politik/ausland/putin-wie-xerxes-hybris-treibt-krieg-gegen-ukraine_49e752c2-0ebb-4ca5-baa0-c8f6132bff52.html,https://www.focus.de/politik/ausland/putin-wie-xerxes-hybris-treibt-krieg-gegen-ukraine_49e752c2-0ebb-4ca5-baa0-c8f6132bff52.html,0,www.focus.de,Putin wie Xerxes: Hybris treibt Krieg gegen Ukraine,"Putins Krieg gegen die Ukraine gleicht Xerxes' Hybris – Strategische Fehler, menschliche Kosten und geopolitische Ambitionen zeigen Parallelen.",https://quadro.burda-forward.de/ctf/5ad720f3-29b1-48d4-93e8-6ba7265cf89d.f3ea8b12-1dda-47c6-afdd-6ebfcc723eac.jpg?im=RegionOfInterestCrop%3D%281200%2C630%29%2CregionOfInterest%3D%283008%2C622%29&hash=138aed608f846e64d1465733d61774a27c4e7a99805cc48da411cf3adb0bf053,2026-03-02T12:24:00Z,,"In seinem Werk Geschichte beschreibt Herodot, wie der persische Herrscher Xerxes die Niederlage seines Vaters bei Marathon rächte, indem er in Griechenland einfiel. Als ein Sturm seine Brücke über de… [+7276 chars]",,de,'Ukraine'
https://www.zeit.de/news/2026-03/02/ministerin-reiche-erwartet-preisaufschlaege-durch-iran-krieg,https://www.zeit.de/news/2026-03/02/ministerin-reiche-erwartet-preisaufschlaege-durch-iran-krieg,0,www.zeit.de,Krieg in Nahost: Ministerin Reiche erwartet Preisaufschläge durch Iran-Krieg,Hier finden Sie Informationen zu dem Thema „Krieg in Nahost“. Lesen Sie jetzt „Ministerin Reiche erwartet Preisaufschläge durch Iran-Krieg“.,https://img.zeit.de/news/2026-03/02/ministerin-reiche-erwartet-preisaufschlaege-durch-iran-krieg-image-group/wide__1300x731,2026-03-02T12:27:10Z,,"Der Iran-Krieg bringt aus Sicht von Bundeswirtschaftsministerin Katherina Reiche neue Unsicherheit für die deutsche Wirtschaft. Preisaufschläge auf den Märkten seien bereits sichtbar, die weitere Ent… [+1505 chars]",,de,'Krieg'
