index,url,valid,domain,title,description,image,published,archive,content,quote,language,keyword
https://www.faz.net/aktuell/politik/ukraine/cia-soll-nicht-an-angriff-auf-putins-residenz-glauben-accg-200400274.html,https://www.faz.net/aktuell/politik/ukraine/cia-soll-nicht-an-angriff-auf-putins-residenz-glauben-accg-200400274.html,0,www.faz.net,US-Medienberichte: Laut CIA hat die Ukraine nicht Putins Residenz angegriffen,"Der Geheimdienst CIA soll Donald Trump informiert haben, dass die Ukraine andere Ziele ins Visier nahm – nicht Putin persönlich, wie Russland beklagt hatte. Prompt verbreitet der US-Präsident Putin-Kritisches.",https://media0.faz.net/image/w1200h627/28f601673ac6/w7559h3949x0y385o/202612/43601.0.1622876156/wladimir-putin-haelt-seine.webp,2026-01-01T05:38:08Z,,"Der US-Geheimdienst CIA ist Berichten zufolge zu der Erkenntnis gelangt, dass die Ukraine weder den russischen Präsidenten Wladimir Putin ins Visier genommen noch eine seiner Residenzen angegriffen h… [+5681 chars]",,de,'Ukraine'
https://www.stern.de/sport/fussball--antonio-ruedigers-weihnachtsreise-nach-sierra-leone-37004044.html,https://www.stern.de/sport/fussball--antonio-ruedigers-weihnachtsreise-nach-sierra-leone-37004044.html,0,www.stern.de,Fußball: Antonio Rüdigers Weihnachtsreise nach Sierra Leone,Antonio Rüdiger engagiert sich schon länger für Menschen in Sierra Leone. Während der Winterpause reist der Fußballprofi erneut nach Westafrika - und zum ersten Mal in die Heimatregion seiner Mutter.,https://image.stern.de/37004046/t/gW/v1/w1440/r1.7778/-/01--yehorpvncwv12axs2048jpeg---f1d4cdac23b4e7dd.jpg,2026-01-01T18:20:04Z,,"Kopiere den aktuellen Link
Zur Merkliste hinzufügen
Antonio Rüdiger engagiert sich schon länger für Menschen in Sierra Leone. Während der Winterpause reist der Fußballprofi erneut nach Westafrika -… [+1441 chars]",,de,'Winter'
https://www.tagesspiegel.de/sport/fussball-antonio-rudigers-weihnachtsreise-nach-sierra-leone-15094347.html,https://www.tagesspiegel.de/sport/fussball-antonio-rudigers-weihnachtsreise-nach-sierra-leone-15094347.html,0,www.tagesspiegel.de,Fußball: Antonio Rüdigers Weihnachtsreise nach Sierra Leone,Antonio Rüdiger engagiert sich schon länger für Menschen in Sierra Leone. Während der Winterpause reist der Fußballprofi erneut nach Westafrika - und zum ersten Mal in die Heimatregion seiner Mutter.,https://www.tagesspiegel.de/images/15094346/alternates/BASE_16_9_W1400/1767291674000/antonio-rudiger-in-sierra-leone.jpeg,2026-01-01T18:21:14Z,,Fußball-Nationalspieler Antonio Rüdiger hat in der Weihnachtspause die afrikanische Heimat seiner Mutter besucht und dort soziale Projekte angeschoben. Reisen wie diese geben mir in der kurzen Winter… [+1278 chars],,de,'Winter'
https://www.jungewelt.de/artikel/514915.energiepolitik-uniper-und-die-opal-leitung.html,https://www.jungewelt.de/artikel/514915.energiepolitik-uniper-und-die-opal-leitung.html,0,www.jungewelt.de,Energiepolitik: Uniper und die OPAL-Leitung,EU-Auflage: Größter deutscher Gasversorger Uniper muss Geschäftsanteile an OPAL-Pipeline verkaufen – wegen Umstellung auf teuren Wasserstoff fehlen aber Kaufinteressenten.,https://www.jungewelt.de/img/1100/217369.jpg,2026-01-01T18:39:36Z,,"Das größte Gasversorgungsunternehmen in Deutschland, Uniper, hat am 16. Dezember den Verkauf des 20prozentigen Anteils angekündigt, den es über eine Tochterfirma an der OPAL-Pipeline hält. Die rund 4… [+3766 chars]",,de,'Gas'
https://www.jungewelt.de/artikel/514902.gesundheitspolitik-kliniken-in-agonie.html,https://www.jungewelt.de/artikel/514902.gesundheitspolitik-kliniken-in-agonie.html,0,www.jungewelt.de,Gesundheitspolitik: Kliniken in Agonie,Deutschlands Kliniken rutschen reihenweise in die Insolvenz – und eine Trendwende ist nicht in Sicht. Das Kliniksterben wird zur Gefahr für die medizinische Versorgung und Experten warnen vor einer »Wartelistenmedizin«.,https://www.jungewelt.de/img/1100/217341.jpg,2026-01-01T18:39:36Z,,"Diesig, trüb und feucht ist es. Windböen drücken feinen Nieselregen gegen die gläserne Eingangsfront des städtischen Klinikums. Im Foyer flackern Neonröhren müde von der Decke, Lichtkegel blitzen auf… [+3875 chars]",,de,'Versorgung'
https://www.stern.de/gesellschaft/regional/baden-wuerttemberg/branche-unter-druck--was-die-7-prozent-steuer-fuer-restaurants-und-gaeste-bedeutet-37004212.html,https://www.stern.de/gesellschaft/regional/baden-wuerttemberg/branche-unter-druck--was-die-7-prozent-steuer-fuer-restaurants-und-gaeste-bedeutet-37004212.html,0,www.stern.de,Branche unter Druck: Was die 7-Prozent-Steuer für Restaurants und Gäste bedeutet,Seit Anfang des Jahres gilt für Speisen in Restaurants wieder der ermäßigte Steuersatz. Warum das Gastgewerbe im Südwesten dadurch auf bessere Zeiten hofft – und was das für Gäste bedeutet.,https://image.stern.de/37004214/t/5f/v1/w1440/r1.7778/-/02--g73z67taggv4axs2048jpeg---cc4a57f703ef5f43.jpg,2026-01-02T03:00:32Z,,"Kopiere den aktuellen Link
Zur Merkliste hinzufügen
Seit Anfang des Jahres gilt für Speisen in Restaurants wieder der ermäßigte Steuersatz. Warum das Gastgewerbe im Südwesten dadurch auf bessere Ze… [+4108 chars]",,de,'Gas'
https://www.tagesschau.de/ausland/europa/russland-usa-uebergabe-drohne-100.html,https://www.tagesschau.de/ausland/europa/russland-usa-uebergabe-drohne-100.html,0,www.tagesschau.de,Angriff auf Putin-Residenz? Moskau übergibt angebliche Beweise an USA,"Die Ukraine streitet einen Angriff auf eine Putin-Residenz ab - auch der US-Geheimdienst hat offenbar Zweifel. Der Kreml bleibt bei dem Vorwurf und teilte mit, angebliche Beweise für die Attacke an die USA ausgehändigt zu haben.",https://images.tagesschau.de/image/2a777fd7-8c78-41a3-a787-f11a565801a9/AAABm32crTU/AAABmyZE0EA/16x9-big/drohne-uebergabe-russland-usa-100.jpg?width=1280,2026-01-02T07:53:20Z,,"Stand: 02.01.2026 08:53 Uhr
Die Ukraine streitet einen Angriff auf eine Putin-Residenz ab - auch der US-Geheimdienst hat offenbar Zweifel. Der Kreml bleibt bei dem Vorwurf und teilte mit, angebliche… [+1685 chars]",,de,'Kreml'
