index,url,valid,domain,title,description,image,published,archive,content,quote,language,keyword
https://www.welt.de/politik/deutschland/article253904764/Anne-Applebaum-Ziemlich-unverzeihlich-Kuenftige-Friedenspreistraegerin-kritisiert-Merkel.html,https://www.welt.de/politik/deutschland/article253904764/Anne-Applebaum-Ziemlich-unverzeihlich-Kuenftige-Friedenspreistraegerin-kritisiert-Merkel.html,0,www.welt.de,„Ziemlich unverzeihlich“ – Künftige Friedenspreisträgerin kritisiert Merkel,Historikerin Anne Applebaum erhält den diesjährigen Friedenspreis des Deutschen Buchhandels. Vorab kritisiert sie die frühere Kanzlerin Angela Merkel wegen ihres Umgangs mit Kremlchef Wladimir Putin.,https://img.welt.de/img/politik/deutschland/mobile253904898/1967930757-ci16x9-w1200/70-Geburtstag-der-frueheren-Bundeskanzlerin-Merkel.jpg,2024-10-08T13:36:28Z,https://web.archive.org/web/20241008135543/https://www.welt.de/politik/deutschland/article253904764/Anne-Applebaum-Ziemlich-unverzeihlich-Kuenftige-Friedenspreistraegerin-kritisiert-Merkel.html,Historikerin Anne Applebaum erhält den diesjährigen Friedenspreis des Deutschen Buchhandels. Vorab kritisiert sie die frühere Kanzlerin Angela Merkel wegen ihres Umgangs mit Kremlchef Wladimir Putin.… [+2448 chars],,de,'Pipeline'
https://www.zeit.de/news/2024-10/08/mehr-personal-und-mehr-befugnisse-fuer-die-sicherheit,https://www.zeit.de/news/2024-10/08/mehr-personal-und-mehr-befugnisse-fuer-die-sicherheit,0,www.zeit.de,Fünf-Punkte-Plan im Saarland: Mehr Personal und mehr Befugnisse für die Sicherheit,Hier finden Sie Informationen zu dem Thema „Fünf-Punkte-Plan im Saarland“. Lesen Sie jetzt „Mehr Personal und mehr Befugnisse für die Sicherheit“.,https://img.zeit.de/news/2024-10/08/mehr-personal-und-mehr-befugnisse-fuer-die-sicherheit-image-group/wide__1300x731,2024-10-08T13:43:23Z,,"Der saarländische Verfassungsschutz erhält zehn neue Stellen, um aktuellen Herausforderungen auch in der IT und der veränderten Sicherheitslage gerecht zu werden. Nach Aussagen von Innenminister Rein… [+2846 chars]",,de,'Sicherheit'
https://www.zeit.de/news/2024-10/08/ministerin-gendergerechte-toiletten-koennen-auch-geld-sparen,https://www.zeit.de/news/2024-10/08/ministerin-gendergerechte-toiletten-koennen-auch-geld-sparen,0,www.zeit.de,Gesellschaft: Ministerin: Gendergerechte Toiletten können auch Geld sparen,Hier finden Sie Informationen zu dem Thema „Gesellschaft“. Lesen Sie jetzt „Ministerin: Gendergerechte Toiletten können auch Geld sparen“.,https://img.zeit.de/news/2024-10/08/ministerin-gendergerechte-toiletten-koennen-auch-geld-sparen-image-group/wide__1300x731,2024-10-08T13:50:24Z,,Sogenannte gendergerechte Toiletten können laut Hessens Sozialministerin Heike Hofmann (SPD) auch Geld sparen. Auf eine entsprechende Frage des Grünen-Abgeordneten Felix Martin mit Blick auf Unisex-T… [+967 chars],,de,'sparen'
https://www.n-tv.de/wirtschaft/Wasserstoff-Pipeline-nach-Daenemark-verzoegert-sich-bis-2031-article25277648.html,https://www.n-tv.de/wirtschaft/Wasserstoff-Pipeline-nach-Daenemark-verzoegert-sich-bis-2031-article25277648.html,0,www.n-tv.de,Drei Jahre später als geplant: Wasserstoff-Pipeline nach Dänemark verzögert sich bis 2031,"Für die Klimawende braucht besonders die Industrie viel ""grünen"" Wasserstoff. Doch Deutschland selbst kann nicht annähernd die notwendigen Mengen produzieren. Pipelines aus dem Ausland sollen helfen - doch ein Projekt verzögert sich jetzt um mehrere Jahre.",https://bilder2.n-tv.de/img/incoming/crop25277641/7751328377-cImg_16_9-w1200/486773114.jpg,2024-10-08T13:59:32Z,https://web.archive.org/web/20241008140847/https://www.n-tv.de/wirtschaft/Wasserstoff-Pipeline-nach-Daenemark-verzoegert-sich-bis-2031-article25277648.html,"Für die Klimawende braucht besonders die Industrie viel ""grünen"" Wasserstoff. Doch Deutschland selbst kann nicht annähernd die notwendigen Mengen produzieren. Pipelines aus dem Ausland sollen helfen … [+1982 chars]",,de,'Pipeline'
https://www.n-tv.de/politik/Kreml-Kritikerin-verletzt-sich-vor-Gericht-selbst-article25277562.html,https://www.n-tv.de/politik/Kreml-Kritikerin-verletzt-sich-vor-Gericht-selbst-article25277562.html,0,www.n-tv.de,Aus Protest gegen ihre Strafe: Kreml-Kritikerin verletzt sich vor Gericht selbst,Eine russische Aktivistin muss eine Geldstrafe zahlen. Sie hat angeblich falsche Angaben zu einem schweren Verbrechen gemacht. Aus Protest gegen ihre Strafe verletzt sich die Oppositionelle noch im Gerichtssaal selbst am Arm.,https://bilder4.n-tv.de/img/incoming/crop25277631/0151322329-cImg_16_9-w1200/305297579.jpg,2024-10-08T14:06:50Z,https://web.archive.org/web/20241008145229/https://www.n-tv.de/politik/Kreml-Kritikerin-verletzt-sich-vor-Gericht-selbst-article25277562.html,Eine russische Aktivistin muss eine Geldstrafe zahlen. Sie hat angeblich falsche Angaben zu einem schweren Verbrechen gemacht. Aus Protest gegen ihre Strafe verletzt sich die Oppositionelle noch im G… [+1782 chars],,de,'Kreml'
https://www.faz.net/aktuell/rhein-main/wirtschaft/wie-der-ventilehersteller-samson-energie-sparen-will-110027448.html,https://www.faz.net/aktuell/rhein-main/wirtschaft/wie-der-ventilehersteller-samson-energie-sparen-will-110027448.html,0,www.faz.net,Wie der Ventilehersteller Samson Energie sparen will,"Das Industrieunternehmen will mit dem Bau seiner neuen Zentrale Platz für Wachstum schaffen, das möglichst nachhaltig sein soll. Ein Besuch auf der Baustelle.",https://media1.faz.net/ppmedia/aktuell/3064368112/1.10027447/facebook_teaser/aus-alt-mach-neu-samson.jpg,2024-10-08T14:54:40Z,https://web.archive.org/web/20241008163410/https://www.faz.net/aktuell/rhein-main/wirtschaft/wie-der-ventilehersteller-samson-energie-sparen-will-110027448.html,"Erst im Juni hat Samson mit der Errichtung des 22 Meter hohen Gebäudes begonnen. Jetzt ist ein Großteil der Fassade schon verkleidet, innen laufen die Trockenbauarbeiten. Und direkt nebenan streben d… [+5116 chars]",,de,'Energie'
https://www.zeit.de/news/2024-10/08/datenwerkstatt-zur-stromnetzplanung-geht-zu-ende,https://www.zeit.de/news/2024-10/08/datenwerkstatt-zur-stromnetzplanung-geht-zu-ende,0,www.zeit.de,Energie: Datenwerkstatt zur Stromnetzplanung geht zu Ende,Hier finden Sie Informationen zu dem Thema „Energie“. Lesen Sie jetzt „Datenwerkstatt zur Stromnetzplanung geht zu Ende“.,https://img.zeit.de/news/2024-10/08/datenwerkstatt-zur-stromnetzplanung-geht-zu-ende-image-group/wide__1300x731,2024-10-08T15:30:41Z,,"Wie muss das Stromnetz der Zukunft ausgestaltet sein angesichts von mehr Wärmepumpen, mehr E-Mobilität oder veränderten Industrieprozessen? Dieser Frage ging in Rheinland-Pfalz eine Datenwerkstatt mi… [+1180 chars]",,de,'Energie'
https://www.welt.de/politik/ausland/us-wahl/article253894402/US-Wahl-Trump-hielt-offenbar-nach-seinem-Ausscheiden-Kontakt-zu-Putin.html,https://www.welt.de/politik/ausland/us-wahl/article253894402/US-Wahl-Trump-hielt-offenbar-nach-seinem-Ausscheiden-Kontakt-zu-Putin.html,0,www.welt.de,Trump hielt offenbar nach seinem Ausscheiden Kontakt zu Putin,Laut Recherchen des US-Journalisten Bob Woodward hat Donald Trump nach seinem Auszug aus dem Weißen Haus mehrmals mit dem russischen Präsidenten Wladimir Putin telefoniert – und ihm Covid-Tests geschickt. In einer neuen Umfrage schmilzt derweil der Vorsprung …,https://img.welt.de/img/bildergalerien/mobile253908762/0427933327-ci16x9-w1200/2019-G20-Summit-in-Osaka-Japan.jpg,2024-10-08T15:43:00Z,https://web.archive.org/web/20241008155601/https://www.welt.de/politik/ausland/us-wahl/article253894402/US-Wahl-Trump-hielt-offenbar-nach-seinem-Ausscheiden-Kontakt-zu-Putin.html,Laut Recherchen des US-Journalisten Bob Woodward hat Donald Trump nach seinem Auszug aus dem Weißen Haus mehrmals mit dem russischen Präsidenten Wladimir Putin telefoniert und ihm Covid-Tests geschic… [+6643 chars],,de,'Wladimir Putin'
https://www.faz.net/aktuell/politik/krieg-in-nahost/libanon-israel-will-dass-unifil-sich-zurueckzieht-110033605.html,https://www.faz.net/aktuell/politik/krieg-in-nahost/libanon-israel-will-dass-unifil-sich-zurueckzieht-110033605.html,0,www.faz.net,UN-Friedenstruppe: Missstimmung zwischen Israel und der UNIFIL,"Israel will, dass sich die UN-Friedenstruppe in Libanon aus dem Kampfgebiet an der Grenze zurückzieht. Doch die UNIFIL will bleiben – und bezweifelt, dass es Jerusalem tatsächlich um die Sicherheit der UN-Soldaten geht.",https://media0.faz.net/ppmedia/aktuell/politik/2292442117/1.10033612/facebook_teaser_fplus/fahrzeuge-der-unifil.jpg,2024-10-08T16:50:03Z,https://web.archive.org/web/20241008171151/https://www.faz.net/aktuell/politik/krieg-in-nahost/libanon-israel-will-dass-unifil-sich-zurueckzieht-110033605.html,"Es herrscht Missstimmung zwischen Israel und der UN-Friedenstruppe UNIFIL in Libanon. Die United Nations Interim Force In Lebanon will israelischen Forderungen, sich von einigen Außenposten im Kampfg… [+147 chars]",,de,'Sicherheit'
https://www.zeit.de/wirtschaft/unternehmen/2024-09/ki-krieg-ukraine-autonome-waffen-ruestungsindustrie,https://www.zeit.de/wirtschaft/unternehmen/2024-09/ki-krieg-ukraine-autonome-waffen-ruestungsindustrie,0,www.zeit.de,KI im Krieg: Dürfen Roboter Menschen töten?,"Nie zuvor kamen in einem Krieg so viele von künstlicher Intelligenz gesteuerte Waffen zum Einsatz wie in der Ukraine. Was Forschern Angst macht, freut die Industrie.",https://img.zeit.de/politik/ausland/2024-09/ki-krieg-ukraine-autonome-waffen/wide__1300x731,2024-10-08T17:46:26Z,https://web.archive.org/web/20241008185744/https://www.zeit.de/wirtschaft/unternehmen/2024-09/ki-krieg-ukraine-autonome-waffen-ruestungsindustrie,"Auf einem Video der ukrainischen Streitkräfte aus dem
vergangenen Jahr lässt sich genau beobachten, was passiert, wenn ein Mensch
gegen eine Maschine kämpfen muss: Man sieht darauf einen russischen… [+636 chars]",,de,'Krieg'
https://www.focus.de/politik/deutschland/1000-euro-fuer-langzeitarbeitslose-scholz-ueber-job-praemie-aber-schaden-tut-es-auch-nicht-weiter_id_260377826.html,https://www.focus.de/politik/deutschland/1000-euro-fuer-langzeitarbeitslose-scholz-ueber-job-praemie-aber-schaden-tut-es-auch-nicht-weiter_id_260377826.html,0,www.focus.de,1000 Euro für Langzeitarbeitslose - Scholz über Job-Prämie: „Aber schaden tut es auch nicht weiter“,"Die geplante 1.000-Euro-Prämie für Langzeitarbeitslose, die einen Job annehmen, ist auch innerhalb der Ampel umstritten. Olaf Scholz ist skeptisch über die Wirkung der „Anschubprämie“. Der Bundeskanzler gibt auch zu, dass die Grenzkontrollen „gerade viel Ärge…",https://p6.focus.de/img/politik/deutschland/id_260377809/eigentlich-muesste-jeder-arbeiten-wollen-meint-der-kanzler..jpg?im=Crop%3D%280%2C0%2C2048%2C1025%29%3BResize%3D%281200%2C627%29&impolicy=perceptual&quality=mediumHigh&hash=6483656cf78f49d0578341a7cbd426e0d587a3579e2636ac6bcc6ff88d985750,2024-10-08T17:48:24Z,,"Die geplante 1.000-Euro-Prämie für Langzeitarbeitslose, die einen Job annehmen, ist auch innerhalb der Ampel umstritten. Olaf Scholz ist skeptisch über die Wirkung der Anschubprämie. Der Bundeskanzle… [+2445 chars]",,de,'Olaf Scholz'
https://www.tagesschau.de/ausland/asien/libanon-beschuss-100.html,https://www.tagesschau.de/ausland/asien/libanon-beschuss-100.html,0,www.tagesschau.de,Kriegsalltag im Libanon: Heimat unter Beschuss,"Viele Ortschaften liegen in Trümmern, Unterkünfte und Krankenhäuser sind überfüllt, Medikamente fehlen. Die Not der Menschen im Libanon wächst - und immer mehr sind auf der Flucht. Von Anna Osius.",https://images.tagesschau.de/image/15b9368c-4914-4232-b701-4566e657c667/AAABkm2OKy0/AAABkZLhkrw/16x9-1280/gefluechtete-libanon-100.jpg,2024-10-08T19:06:17Z,https://web.archive.org/web/20241008204640/https://www.tagesschau.de/ausland/asien/libanon-beschuss-100.html,"Stand: 08.10.2024 21:06 Uhr
Viele Ortschaften liegen in Trümmern, Unterkünfte und Krankenhäuser sind überfüllt, Medikamente fehlen. Die Not der Menschen im Libanon wächst - und immer mehr sind auf d… [+4162 chars]",,de,'Versorgung'
https://www.zeit.de/news/2024-10/08/biden-nicht-persoenlich-bei-ukraine-gipfel-in-ramstein,https://www.zeit.de/news/2024-10/08/biden-nicht-persoenlich-bei-ukraine-gipfel-in-ramstein,0,www.zeit.de,Staatsbesuch: Biden nicht persönlich bei Ukraine-Gipfel in Ramstein,Hier finden Sie Informationen zu dem Thema „Staatsbesuch“. Lesen Sie jetzt „Biden nicht persönlich bei Ukraine-Gipfel in Ramstein“.,https://img.zeit.de/news/2024-10/08/biden-nicht-persoenlich-bei-ukraine-gipfel-in-ramstein-image-group/wide__1300x731,2024-10-08T20:19:30Z,https://web.archive.org/web/20241008235038/https://www.zeit.de/news/2024-10/08/biden-nicht-persoenlich-bei-ukraine-gipfel-in-ramstein,"US-Präsident Joe Biden wird nicht persönlich am Ukraine-Gipfel in Ramstein teilnehmen. Das bestätigte Pentagon-Sprecherin Sabrina Singh in Washington und erklärte, es werde noch daran gearbeitet, was… [+1845 chars]",,de,'Ukraine'
https://www.zeit.de/news/2024-10/09/neubaur-koennen-kohle-ausstieg-2030-schaffen,https://www.zeit.de/news/2024-10/09/neubaur-koennen-kohle-ausstieg-2030-schaffen,0,www.zeit.de,Energie: Neubaur: Können Kohle-Ausstieg 2030 schaffen,Hier finden Sie Informationen zu dem Thema „Energie“. Lesen Sie jetzt „Neubaur: Können Kohle-Ausstieg 2030 schaffen“.,https://img.zeit.de/news/2024-10/09/neubaur-koennen-kohle-ausstieg-2030-schaffen-image-group/wide__1300x731,2024-10-08T22:05:42Z,,"Nordrhein-Westfalens Wirtschaftsministerin Mona Neubaur (Grüne) hat bekräftigt, dass der Ausstieg aus der Braunkohle-Verstromung im Jahr 2030 zu schaffen sei. «Dafür arbeite ich jeden Tag», sagte die… [+802 chars]",,de,'Energie'
https://www.tagesschau.de/inland/interview-tagesthemen-spd-100.html,https://www.tagesschau.de/inland/interview-tagesthemen-spd-100.html,0,www.tagesschau.de,"SPD-Generalsekretär Miersch im Interview: ""Sicherheit im Wandel schaffen""","Der neue Generalsekretär der SPD, Matthias Miersch, hat sich in den <em>tagesthemen</em> zuversichtlich gezeigt, dass seine Partei wieder aus dem Umfragetief herauskommt. Dabei wolle er auf ur-sozialdemokratische Themen setzen.",https://images.tagesschau.de/image/c4f765c4-2223-4330-98ce-69fdcf7214b8/AAABkm3cD6U/AAABkZLhkrw/16x9-1280/sendungsbild-1426594.jpg,2024-10-08T22:18:18Z,https://web.archive.org/web/20241008235225/https://www.tagesschau.de/inland/interview-tagesthemen-spd-100.html,"Stand: 09.10.2024 00:18 Uhr
Der neue Generalsekretär der SPD, Matthias Miersch, hat sich in den tagesthemen zuversichtlich gezeigt, dass seine Partei wieder aus dem Umfragetief herauskommt. Dabei wo… [+1912 chars]",,de,'Sicherheit'
https://www.n-tv.de/politik/13-55-Finnlands-Praesident-Erleben-jetzt-die-Entstehung-der-NATO-3-0--article23143824.html,https://www.n-tv.de/politik/13-55-Finnlands-Praesident-Erleben-jetzt-die-Entstehung-der-NATO-3-0--article23143824.html,0,www.n-tv.de,Ukraine-Krieg im Liveticker: +++ 13:55 Finnlands Präsident: Erleben jetzt die Entstehung der NATO 3.0 +++,Lesen Sie alle aktuellen Entwicklungen und Nachrichten über den russischen Angriffskrieg auf die Ukraine im Liveticker von ntv.de.,https://bilder3.n-tv.de/img/incoming/crop25117070/4231326595-cImg_16_9-w1200/Ukraine-Liveticker.jpg,2024-10-08T22:22:00Z,https://web.archive.org/web/20241009121219/https://www.n-tv.de/politik/13-55-Finnlands-Praesident-Erleben-jetzt-die-Entstehung-der-NATO-3-0--article23143824.html,"Laut dem finnischen Präsidenten Alexander Stubb entsteht derzeit ""Version 3.0"" der NATO. ""Ich bin fest davon überzeugt, dass wir jetzt die Entstehung der NATO 3.0 erleben"", sagte er auf einer Pressek… [+22067 chars]",,de,'Krieg'
https://www.n-tv.de/politik/14-29-Bundesregierung-Biden-Absage-kein-Nachteil-fuer-Ukraine--article23143824.html,https://www.n-tv.de/politik/14-29-Bundesregierung-Biden-Absage-kein-Nachteil-fuer-Ukraine--article23143824.html,0,www.n-tv.de,Ukraine-Krieg im Liveticker: +++ 14:29 Bundesregierung: Biden-Absage kein Nachteil für Ukraine +++,Lesen Sie alle aktuellen Entwicklungen und Nachrichten über den russischen Angriffskrieg auf die Ukraine im Liveticker von ntv.de.,https://bilder3.n-tv.de/img/incoming/crop25117070/4231326595-cImg_16_9-w1200/Ukraine-Liveticker.jpg,2024-10-08T22:22:00Z,,Wegen der Absage des Besuchs von US-Präsident Joe Biden in Deutschland werden nach Angaben der Bundesregierung auch alle weiteren geplanten multilateralen Treffen nicht stattfinden. So werde kein Tre… [+23189 chars],,de,'Saporischschja'
https://www.n-tv.de/politik/11-45-Von-der-Leyen-ueber-Orban-Lastet-Angriffskrieg-dem-Freiheitsdurst-der-Ukraine-an--article23143824.html,https://www.n-tv.de/politik/11-45-Von-der-Leyen-ueber-Orban-Lastet-Angriffskrieg-dem-Freiheitsdurst-der-Ukraine-an--article23143824.html,0,www.n-tv.de,"Ukraine-Krieg im Liveticker: +++ 11:30 Trubetskoy zu Biden-Absage: ""Für die Ukraine ist das keine gute Nachricht"" +++",Lesen Sie alle aktuellen Entwicklungen und Nachrichten über den russischen Angriffskrieg auf die Ukraine im Liveticker von ntv.de.,https://bilder3.n-tv.de/img/incoming/crop25117070/4231326595-cImg_16_9-w1200/Ukraine-Liveticker.jpg,2024-10-08T22:22:00Z,https://web.archive.org/web/20241009101826/https://www.n-tv.de/politik/11-45-Von-der-Leyen-ueber-Orban-Lastet-Angriffskrieg-dem-Freiheitsdurst-der-Ukraine-an--article23143824.html,EU-Kommissionschefin Ursula von der Leyen findet deutliche Worte für die jüngste Rede des ungarischen Regierungschefs Viktor Orban im Europaparlament in Straßburg. In einer sich an die Rede anschließ… [+17605 chars],,de,'Saporischschja'
https://www.n-tv.de/politik/19-48-Russland-meldet-Rueckeroberungen-in-Kursk--article23143824.html,https://www.n-tv.de/politik/19-48-Russland-meldet-Rueckeroberungen-in-Kursk--article23143824.html,0,www.n-tv.de,Ukraine-Krieg im Liveticker: +++ 19:48 Russland meldet Rückeroberungen in Kursk +++,Lesen Sie alle aktuellen Entwicklungen und Nachrichten über den russischen Angriffskrieg auf die Ukraine im Liveticker von ntv.de.,https://bilder3.n-tv.de/img/incoming/crop25117070/4231326595-cImg_16_9-w1200/Ukraine-Liveticker.jpg,2024-10-08T22:22:00Z,,"Die russische Armee hat nach eigenen Angaben zwei Dörfer in der russischen Grenzregion Kursk von der Ukraine zurückerobert. Die ""Offensivoperationen"" seien fortgesetzt und dabei ""die Orte Nowaja Soro… [+29652 chars]",,de,'Wladimir Putin'
https://www.n-tv.de/politik/17-37-Macron-besucht-ukrainische-Soldaten-bei-Ausbildung-in-Frankreich--article23143824.html,https://www.n-tv.de/politik/17-37-Macron-besucht-ukrainische-Soldaten-bei-Ausbildung-in-Frankreich--article23143824.html,0,www.n-tv.de,Ukraine-Krieg im Liveticker: +++ 17:37 Macron besucht ukrainische Soldaten bei Ausbildung in Frankreich +++,Lesen Sie alle aktuellen Entwicklungen und Nachrichten über den russischen Angriffskrieg auf die Ukraine im Liveticker von ntv.de.,https://bilder3.n-tv.de/img/incoming/crop25117070/4231326595-cImg_16_9-w1200/Ukraine-Liveticker.jpg,2024-10-08T22:22:00Z,,"Der französische Präsident Emmanuel Macron hat erstmals ukrainische Soldaten besucht, die in seinem Land ausgebildet werden. Macron inspizierte ein Militärlager in Ostfrankreich, um seine Unterstützu… [+26639 chars]",,de,'Wladimir Putin'
https://www.n-tv.de/politik/16-38-Russisches-Waffenarsenal-brennt-Region-ruft-Notstand-aus--article23143824.html,https://www.n-tv.de/politik/16-38-Russisches-Waffenarsenal-brennt-Region-ruft-Notstand-aus--article23143824.html,0,www.n-tv.de,Ukraine-Krieg im Liveticker: +++ 16:38 Russisches Waffenarsenal brennt: Region ruft Notstand aus +++,Lesen Sie alle aktuellen Entwicklungen und Nachrichten über den russischen Angriffskrieg auf die Ukraine im Liveticker von ntv.de.,https://bilder3.n-tv.de/img/incoming/crop25117070/4231326595-cImg_16_9-w1200/Ukraine-Liveticker.jpg,2024-10-08T22:22:00Z,,Die russischen Behörden haben in einer westlichen Region den Ausnahmezustand verhängt. Dort hatte die Ukraine eigenen Angaben zufolge über Nacht ein Waffenarsenal angegriffen. (Siehe Eintrag um 13 Uh… [+25281 chars],,de,'Ukraine'
https://www.n-tv.de/politik/06-10-Fuer-den-Fall-seines-Todes-Harris-soll-Selenskyj-zu-einem-Nachfolgeplan-aufgefordert-haben--article23143824.html,https://www.n-tv.de/politik/06-10-Fuer-den-Fall-seines-Todes-Harris-soll-Selenskyj-zu-einem-Nachfolgeplan-aufgefordert-haben--article23143824.html,0,www.n-tv.de,Ukraine-Krieg im Liveticker: +++ 06:10 Für den Fall seines Todes: Harris soll Selenskyj zu einem Nachfolgeplan aufgefordert haben +++,Lesen Sie alle aktuellen Entwicklungen und Nachrichten über den russischen Angriffskrieg auf die Ukraine im Liveticker von ntv.de.,https://bilder3.n-tv.de/img/incoming/crop25117070/4231326595-cImg_16_9-w1200/Ukraine-Liveticker.jpg,2024-10-08T22:22:00Z,,"US-Vizepräsidentin Kamala Harris soll den ukrainischen Präsidenten Wolodymyr Selenskyj kurz vor Beginn des russischen Angriffskrieges aufgefordert haben, einen Nachfolgeplan für den Fall aufzustellen… [+8768 chars]",,de,'Krieg'
https://www.n-tv.de/politik/04-56-Biden-kommt-nicht-zum-Ukraine-Gipfel-in-Ramstein--article23143824.html,https://www.n-tv.de/politik/04-56-Biden-kommt-nicht-zum-Ukraine-Gipfel-in-Ramstein--article23143824.html,0,www.n-tv.de,Ukraine-Krieg im Liveticker: +++ 04:56 Biden kommt nicht zum Ukraine-Gipfel in Ramstein +++,Lesen Sie alle aktuellen Entwicklungen und Nachrichten über den russischen Angriffskrieg auf die Ukraine im Liveticker von ntv.de.,https://bilder3.n-tv.de/img/incoming/crop25117070/4231326595-cImg_16_9-w1200/Ukraine-Liveticker.jpg,2024-10-08T22:22:00Z,,"US-Präsident Biden wird nicht persönlich am Ukraine-Gipfel am Samstag in Ramstein teilnehmen. Das bestätigt Pentagon-Sprecherin Sabrina Singh. Es werde noch daran gearbeitet, was das für den Zeitplan… [+7910 chars]",,de,'Ukraine'
https://www.n-tv.de/politik/10-02-Orban-Trump-wird-nicht-warten-um-Frieden-zu-schaffen--article23143824.html,https://www.n-tv.de/politik/10-02-Orban-Trump-wird-nicht-warten-um-Frieden-zu-schaffen--article23143824.html,0,www.n-tv.de,"Ukraine-Krieg im Liveticker: +++ 10:02 Orban: Trump wird nicht warten, um ""Frieden zu schaffen"" +++",Lesen Sie alle aktuellen Entwicklungen und Nachrichten über den russischen Angriffskrieg auf die Ukraine im Liveticker von ntv.de.,https://bilder3.n-tv.de/img/incoming/crop25117070/4231326595-cImg_16_9-w1200/Ukraine-Liveticker.jpg,2024-10-08T22:22:00Z,,"Der ungarische Ministerpräsident Viktor Orban zeigt sich wiederholt überzeugt davon, dass der republikanische Präsidentschaftskandidat Donald Trump geeignet ist, Frieden zwischen Russland und der Ukr… [+14718 chars]",,de,'Ukraine'
https://www.n-tv.de/politik/20-20-EU-Laender-bringen-35-Milliarden-Kredit-auf-den-Weg--article23143824.html,https://www.n-tv.de/politik/20-20-EU-Laender-bringen-35-Milliarden-Kredit-auf-den-Weg--article23143824.html,0,www.n-tv.de,Ukraine-Krieg im Liveticker: +++ 20:20 EU-Länder bringen 35-Milliarden-Kredit auf den Weg +++,Lesen Sie alle aktuellen Entwicklungen und Nachrichten über den russischen Angriffskrieg auf die Ukraine im Liveticker von ntv.de.,https://bilder3.n-tv.de/img/incoming/crop25117070/4231326595-cImg_16_9-w1200/Ukraine-Liveticker.jpg,2024-10-08T22:22:00Z,,"Vertreter von EU-Staaten haben den Weg für neue Finanzhilfen zugunsten der Ukraine geebnet. Eine in Brüssel erzielte Grundsatzeinigung sieht vor, für das von Russland angegriffene Land ein Darlehen v… [+30409 chars]",,de,'Wladimir Putin'
https://www.n-tv.de/politik/12-04-Umfrage-Fuer-Russen-ist-Deutschland-ein-feindliches-Land--article23143824.html,https://www.n-tv.de/politik/12-04-Umfrage-Fuer-Russen-ist-Deutschland-ein-feindliches-Land--article23143824.html,0,www.n-tv.de,Ukraine-Krieg im Liveticker: +++ 12:04 Umfrage: Für Russen ist Deutschland ein feindliches Land +++,Lesen Sie alle aktuellen Entwicklungen und Nachrichten über den russischen Angriffskrieg auf die Ukraine im Liveticker von ntv.de.,https://bilder3.n-tv.de/img/incoming/crop25117070/4231326595-cImg_16_9-w1200/Ukraine-Liveticker.jpg,2024-10-08T22:22:00Z,https://web.archive.org/web/20241009101931/https://www.n-tv.de/politik/12-04-Umfrage-Fuer-Russen-ist-Deutschland-ein-feindliches-Land--article23143824.html,Wegen der Unterstützung für die Ukraine sieht eine Mehrheit von Russen und Russinnen Deutschland als feindliches Land. Laut einer repräsentativen Umfragge des unabhängigen Lewada-Zentrums für Meinung… [+18427 chars],,de,'Saporischschja'
https://www.n-tv.de/politik/00-29-Blutiger-Protest-Russische-Menschenrechtlerin-verletzt-sich-vor-Gericht-selbst--article23143824.html,https://www.n-tv.de/politik/00-29-Blutiger-Protest-Russische-Menschenrechtlerin-verletzt-sich-vor-Gericht-selbst--article23143824.html,0,www.n-tv.de,Ukraine-Krieg im Liveticker: +++ 00:29 Blutiger Protest: Russische Menschenrechtlerin verletzt sich vor Gericht selbst +++,Lesen Sie alle aktuellen Entwicklungen und Nachrichten über den russischen Angriffskrieg auf die Ukraine im Liveticker von ntv.de.,https://bilder3.n-tv.de/img/incoming/crop25117070/4231326595-cImg_16_9-w1200/Ukraine-Liveticker.jpg,2024-10-08T22:22:00Z,https://web.archive.org/web/20241008230942/https://www.n-tv.de/politik/00-29-Blutiger-Protest-Russische-Menschenrechtlerin-verletzt-sich-vor-Gericht-selbst--article23143824.html,"Aus Protest gegen ihre Strafe hat sich eine russische Oppositionelle vor Gericht selbst verletzt. Die Aktivistin Olga Suworowa habe sich im Gerichtssaal im sibirischen Krasnojarsk die ""Adern aufgesch… [+4855 chars]",,de,'Saporischschja'
