index,url,valid,domain,title,description,image,published,archive,content,quote,language,keyword
https://www.zeit.de/news/2026-03/05/moskau-und-kiew-tauschen-hunderte-kriegsgefangene-aus,https://www.zeit.de/news/2026-03/05/moskau-und-kiew-tauschen-hunderte-kriegsgefangene-aus,0,www.zeit.de,Ukraine-Krieg: Moskau und Kiew tauschen Hunderte Kriegsgefangene aus,Hier finden Sie Informationen zu dem Thema „Ukraine-Krieg“. Lesen Sie jetzt „Moskau und Kiew tauschen Hunderte Kriegsgefangene aus“.,https://img.zeit.de/news/2026-03/05/moskau-und-kiew-tauschen-hunderte-kriegsgefangene-aus-image-group/wide__1300x731,2026-03-05T13:44:08Z,,Moskau und Kiew haben erneut Hunderte Gefangene ausgetauscht. 200 Soldaten kehrten dem russischen Außenministerium zufolge aus der Ukraine zurück in ihre Heimat. Vermittelt hatten den Austausch demna… [+837 chars],,de,'Ukraine'
https://www.zeit.de/news/2026-03/05/tschentscher-hofft-auf-machtwechsel-im-iran,https://www.zeit.de/news/2026-03/05/tschentscher-hofft-auf-machtwechsel-im-iran,0,www.zeit.de,Krieg im Nahen Osten: Tschentscher hofft auf Machtwechsel im Iran,Hier finden Sie Informationen zu dem Thema „Krieg im Nahen Osten“. Lesen Sie jetzt „Tschentscher hofft auf Machtwechsel im Iran“.,https://img.zeit.de/news/2026-03/05/tschentscher-hofft-auf-machtwechsel-im-iran-image-group/wide__1300x731,2026-03-05T17:43:46Z,,Hamburgs Erster Bürgermeister Peter Tschentscher (SPD) hat den Menschen im Iran sowie der iranischen Gemeinschaft in Hamburg seine Solidarität versichert. Mit über 12.000 Bürgerinnen und Bürgern mit … [+1647 chars],,de,'Krieg'
https://www.zeit.de/news/2026-03/05/irans-streitkraefte-melden-angriff-auf-us-flugzeugtraeger,https://www.zeit.de/news/2026-03/05/irans-streitkraefte-melden-angriff-auf-us-flugzeugtraeger,0,www.zeit.de,Iran-Krieg: Irans Streitkräfte melden Angriff auf US-Flugzeugträger,Hier finden Sie Informationen zu dem Thema „Iran-Krieg“. Lesen Sie jetzt „Irans Streitkräfte melden Angriff auf US-Flugzeugträger“.,https://img.zeit.de/news/2026-03/05/irans-streitkraefte-melden-angriff-auf-us-flugzeugtraeger-image-group/wide__1300x731,2026-03-05T18:22:02Z,,"Irans Streitkräfte haben nach eigenen Angaben einen US-Flugzeugträger attackiert. Der Flugzeugträger «USS Abraham Lincoln» sei von Kampfdrohnen der Marine der Revolutionsgarden getroffen worden, beri… [+397 chars]",,de,'Krieg'
https://www.faz.net/aktuell/politik/ukraine/ukraine-liveticker-wegen-iran-krieg-liegen-gespraeche-zwischen-kiew-und-moskau-auf-eis-faz-110683325.html,https://www.faz.net/aktuell/politik/ukraine/ukraine-liveticker-wegen-iran-krieg-liegen-gespraeche-zwischen-kiew-und-moskau-auf-eis-faz-110683325.html,0,www.faz.net,Liveblog UkraineKrieg: Selenskyj: Ukraine-Friedensgespräche liegen wegen Irankrieg auf Eis,Die Gespräche waren ursprünglich für diese Woche geplant +++ Selenskyj dankt Abu Dhabi und Washington für Vermittlung von Gefangenenaustausch +++ Putin spricht nach Versenkung von Tanker von „terroristischer Attacke“ +++ alle Neuigkeiten im Liveblog,https://media0.faz.net/image/w1200h627/5e5b805bd575/w6000h3135x0y433o/202603/43601.0.1847059529/kiews-verhandlungsfuehrer-bei.webp,2026-03-05T18:30:29Z,,In Polen erhalten ukrainische Flüchtlinge fortan weniger Sozialleistungen. Ein entsprechendes Gesetz trat am Donnerstag in Kraft. Unter anderem werden besondere Gesundheitsleistungen nur noch einem b… [+1657 chars],,de,'Ukraine'
https://www.faz.net/aktuell/politik/ungarn-und-ukraine-streiten-ueber-druschba-pipeline-110848208.html,https://www.faz.net/aktuell/politik/ungarn-und-ukraine-streiten-ueber-druschba-pipeline-110848208.html,0,www.faz.net,Streit über Pipeline: Orbán geht mit Satellitenbildern auf Stimmenfang,Ungarn und die Ukraine streiten über den Zustand der Druschba-Pipeline. Eine Erkundungsmission könnte Klarheit bringen. Doch Kiew hat bislang nicht zugestimmt.,https://media0.faz.net/image/w1200h627/d5297276c6d8/w3000h1567x0y306o/032026/1.10848207/die-fotos-sollen-seine-version.webp,2026-03-05T18:36:46Z,,"Am Mittwoch flog Péter Szijjártó mal wieder nach Moskau. Dort bekam der ungarische Außenminister, der für seine ausgezeichneten Beziehungen zum Kreml bekannt ist, von Präsident Wladimir Putin zwei Kr… [+6089 chars]",,de,'Pipeline'
https://www.welt.de/politik/ausland/article69a9c6a810f264d559775430/ukraine-krieg-selenskyj-droht-orban-mit-ukrainischen-soldaten-ungarn-reagiert-mit-entsetzen.html,https://www.welt.de/politik/ausland/article69a9c6a810f264d559775430/ukraine-krieg-selenskyj-droht-orban-mit-ukrainischen-soldaten-ungarn-reagiert-mit-entsetzen.html,0,www.welt.de,Selenskyj droht Orbán mit ukrainischen Soldaten – Ungarn reagiert mit Entsetzen,Der Streit um einen EU-Kredit und eine beschädigte Erdöl-Pipeline eskaliert: Selenskyj schickt eine drastische Warnung an Ungarns Premier Orbán. Budapest reagiert empört.,https://images.welt.de/69a9c6a810f264d559775430/198bf4579932ec797e882daaf0f9c4b9-master/ci16x9-w1200/dpa-com-20090101-260305-935-1196264-jpg,2026-03-05T18:38:26Z,,Der Streit um einen EU-Kredit und eine beschädigte Erdöl-Pipeline eskaliert: Selenskyj schickt eine drastische Warnung an Ungarns Premier Orbán. Budapest reagiert empört.Im Streit über einen von Unga… [+1582 chars],,de,'Ukraine'
https://sport.orf.at/stories/3153212/,https://sport.orf.at/stories/3153212/,0,sport.orf.at,Österreich bleibt Eröffnung fern,"In der Arena von Verona fällt Freitagabend (ab 19.55 Uhr, live in ORF Sport +) der Startschuss für die XIV. Paralympischen Winterspiele. Doch die Eröffnung ist von Verstimmungen über das Antreten von Aktiven aus Russland und Belarus und den Ablauf der Feier s…",https://ibs.orf.at/sport?image=https%3A%2F%2Fassets.orf.at%2Fmims%2F2026%2F10%2F95%2Fcrops%2Fw%3D1200%2Ch%3D630%2Cq%3D75%2F2958915_master_1143995_paralympics_2026_vorschau_eroeffnung_2_g.jpg%3Fs%3Dac69678e8111326bf066bf26bb6fcf52c79f31f9,2026-03-05T18:42:36Z,,Sechs russische und vier belarussische Aktive dürfen in Italien trotz des anhaltenden Angriffskrieges Russlands gegen die Ukraine in ihren Landesfarben samt Flagge und Hymne auftreten. Dieser Umstand… [+6102 chars],,de,'Ukraine'
https://noe.orf.at/stories/3344602/,https://noe.orf.at/stories/3344602/,0,noe.orf.at,Start für Medaillenjagd bei Paralympics,In Verona fällt am Freitagabend der Startschuss für die XIV. Paralympischen Winterspiele. Bis 15. März kämpfen rund 660 Athletinnen und Athleten um Edelmetall. Österreich ist mit einem 19-köpfigen Team rund um die Para-Ski-Asse Johannes und Veronika Aigner ve…,https://ibs.orf.at/noe?image=https%3A%2F%2Foekastatic.orf.at%2Fmims%2F2026%2F10%2F72%2Fcrops%2Fw%3D1200%2Ch%3D627%2Cq%3D75%2F2958852_master_1143972_gepa-20260303-101-156-0073.jpg%3Fs%3Dfb78c2974d9717df4b1bcc461f3b66b787ea37a8,2026-03-05T18:53:41Z,,"79 Entscheidungen im Para-Ski alpin, -Langlauf, -Biathlon, -Snowboard, -Eishockey und Rollstuhl-Curling stehen auf dem Programm. Die ersten Medaillen werden am Samstag vergeben, im Alpinski gehen die… [+3074 chars]",,de,'Winter'
https://www.welt.de/politik/ausland/video69a9c5784bddeaf9148d610a/krieg-gegen-den-iran-putin-ist-dadurch-in-den-windschatten-der-aufmerksamkeit-geraten.html,https://www.welt.de/politik/ausland/video69a9c5784bddeaf9148d610a/krieg-gegen-den-iran-putin-ist-dadurch-in-den-windschatten-der-aufmerksamkeit-geraten.html,0,www.welt.de,„Putin ist dadurch in den Windschatten der Aufmerksamkeit geraten“,"Marie-Agnes Strack-Zimmermann, Vorsitzende des EU-Verteidigungsausschusses, spricht über mögliche Marineeinsätze im Iran-Konflikt, die Auswirkungen auf Europas Energieversorgung und die Schwächung der Ukraine. „Wir müssen in Europa auf das schauen, was vor un…",https://images.welt.de/69a9c5784bddeaf9148d610a/9608ed45d533293e341d42660ae78f37-master/ci16x9-w1200/dpa-com-20090101-260103-935-1054161-jpg,2026-03-05T19:33:07Z,,"Marie-Agnes Strack-Zimmermann, Vorsitzende des EU-Verteidigungsausschusses, spricht über mögliche Marineeinsätze im Iran-Konflikt, die Auswirkungen auf Europas Energieversorgung und die Schwächung de… [+132 chars]",,de,'Ukraine'
https://www.jungewelt.de/artikel/518679.iran-krieg-gegenschläge-und-false-flags.html,https://www.jungewelt.de/artikel/518679.iran-krieg-gegenschläge-und-false-flags.html,0,www.jungewelt.de,Iran-Krieg: Gegenschläge und »False Flags«,Mutmaßlich iranische Drohnen treffen Ziele in der gesamten Golfregion. Doch Teheran weist die Verantwortung teils von sich. Eine Ausweitung des Krieges würde auch den USA und Israel in die Karten spielen.,https://www.jungewelt.de/img/1100/219921.jpg,2026-03-05T19:35:06Z,,"Auch am Donnerstag waren über Doha fortwährend Explosionen zu vernehmen sie kommen dem Stadtzentrum zu dem immer näher. Die katarische Luftverteidigung arbeitete auf Hochtouren, um die mutmaßlich ira… [+4592 chars]",,de,'Ukraine'
https://www.faz.net/aktuell/sport/sportpolitik/paralympische-spiele-in-kriegszeiten-feiern-mit-putin-und-trump-110847993.html,https://www.faz.net/aktuell/sport/sportpolitik/paralympische-spiele-in-kriegszeiten-feiern-mit-putin-und-trump-110847993.html,0,www.faz.net,Paralympics in Kriegszeiten: Feiern mit Putin und Trump,Die Paralympics sollen eine positive Botschaft in die Welt tragen. Sie droht unterzugehen – schuld daran ist nicht zuletzt das Internationale Paralympische Komitee.,https://media0.faz.net/image/w1200h627/1645c8c9017b/w6144h3210x0y444o/202603/43601.0.1848898804/eine-handvoll-laender-haben.webp,2026-03-05T19:42:00Z,,"Die Paralympics feiern Jubiläum: 50 Jahre Winterspiele. 50 Jahre, in denen auf Eis und Schnee Mut, Entschlossenheit, Inspiration und Gleichheit vermittelt werden sollen, Werte, für die das Internatio… [+3368 chars]",,de,'Ukraine'
https://www.stern.de/politik/ausland/krieg-in-der-ukraine--selenskyj-kuendigt-weitere-gefangenenaustausche-an-37195898.html,https://www.stern.de/politik/ausland/krieg-in-der-ukraine--selenskyj-kuendigt-weitere-gefangenenaustausche-an-37195898.html,0,www.stern.de,Krieg in der Ukraine: Selenskyj kündigt weitere Gefangenenaustausche an,"Im Schatten des Iran-Kriegs gibt es Entwicklungen im Konflikt zwischen Russland und der Ukraine. Der ukrainische Präsident Selenskyj nennt eine positive Tendenz, bleibt in einer Frage aber skeptisch.",https://image.stern.de/37195900/t/VA/v1/w1440/r1.7778/-/05--mnydgakalov5axs2048jpeg---bd262267ca196dc6.jpg,2026-03-05T19:51:27Z,,"Kopiere den aktuellen Link
Zur Merkliste hinzufügen
Im Schatten des Iran-Kriegs gibt es Entwicklungen im Konflikt zwischen Russland und der Ukraine. Der ukrainische Präsident Selenskyj nennt eine p… [+1849 chars]",,de,'Krieg'
https://www.zeit.de/news/2026-03/05/selenskyj-kuendigt-weitere-gefangenenaustausche-an,https://www.zeit.de/news/2026-03/05/selenskyj-kuendigt-weitere-gefangenenaustausche-an,0,www.zeit.de,Krieg in der Ukraine: Selenskyj kündigt weitere Gefangenenaustausche an,Hier finden Sie Informationen zu dem Thema „Krieg in der Ukraine“. Lesen Sie jetzt „Selenskyj kündigt weitere Gefangenenaustausche an“.,https://img.zeit.de/news/2026-03/05/selenskyj-kuendigt-weitere-gefangenenaustausche-an-image-group/wide__1300x731,2026-03-05T19:51:27Z,,Der ukrainische Präsident Wolodymyr Selenskyj hat die baldige Rückholung weiterer Soldaten aus russischer Kriegsgefangenschaft angekündigt. In seiner abendlichen Videobotschaft lobte er den am Tag vo… [+1634 chars],,de,'Ukraine'
https://www.tagesspiegel.de/internationales/krieg-in-der-ukraine-selenskyj-kundigt-weitere-gefangenenaustausche-an-15321987.html,https://www.tagesspiegel.de/internationales/krieg-in-der-ukraine-selenskyj-kundigt-weitere-gefangenenaustausche-an-15321987.html,0,www.tagesspiegel.de,Krieg in der Ukraine: Selenskyj kündigt weitere Gefangenenaustausche an,"Im Schatten des Iran-Kriegs gibt es Entwicklungen im Konflikt zwischen Russland und der Ukraine. Der ukrainische Präsident Selenskyj nennt eine positive Tendenz, bleibt in einer Frage aber skeptisch.",https://www.tagesspiegel.de/images/15321986/alternates/BASE_16_9_W1400/1772740352000/wolodymyr-selenskyj.jpeg,2026-03-05T19:52:32Z,,Der ukrainische Präsident Wolodymyr Selenskyj hat die baldige Rückholung weiterer Soldaten aus russischer Kriegsgefangenschaft angekündigt. In seiner abendlichen Videobotschaft lobte er den am Tag vo… [+1688 chars],,de,'Krieg'
https://www.n-tv.de/politik/21-41-Niederlande-warnen-bei-EU-Beitritt-der-Ukraine-vor-Stichtag-Nennung-id30437067.html,https://www.n-tv.de/politik/21-41-Niederlande-warnen-bei-EU-Beitritt-der-Ukraine-vor-Stichtag-Nennung-id30437067.html,0,www.n-tv.de,Ukraine-Krieg im Liveticker: +++ 21:41 Niederlande warnen bei EU-Beitritt der Ukraine vor Stichtag-Nennung +++,"Berlin, Washington, Brüssel - überall. ntv berichtet von allen wichtigen Schauplätzen der Innen- und Außenpolitik.",https://www.n-tv.de/img/2339153/1721988811/Img_16_9/1200/Ukraine-Liveticker.jpg,2026-03-05T21:00:00Z,,"Der niederländische Außenminister sieht die Ukraine ""in der europäischen Familie"", warnt aber vor der Festlegung eines starren Stichtages für den EU-Beitritt. ""Es muss ein realistisches Datum sein"", … [+28421 chars]",,de,'Krieg'
https://www.bild.de/politik/ausland-und-internationales/selenskyj-droht-orban-mit-seinen-soldaten-69aa043510f264d5597756c5,https://www.bild.de/politik/ausland-und-internationales/selenskyj-droht-orban-mit-seinen-soldaten-69aa043510f264d5597756c5,0,www.bild.de,Energie-Zoff eskaliert - Selenskyj droht Orbán mit seinen Soldaten!,"Jetzt eskaliert Selenskyj! Er werde seinen Soldaten, „seinen Jungs“, die Adresse des ungarischen Premiers geben.","https://images.bild.de/69aa043510f264d5597756c5/19fba4b67bc48f9ffd82f429d6866517,f5c198c9?w=1280",2026-03-05T23:25:53Z,,TTS-Player überspringenArtikel weiterlesenKiew/Budapest  Jetzt eskaliert Wolodymyr Selenskyj (48) den Nachbarschaftszoff zwischen der Ukraine und Ungarn! Der Ukraine-Präsident hat Ungarns Ministerprä… [+3083 chars],,de,'Ukraine'
https://www.stern.de/politik/ausland/ungarns-streit-mit-der-ukraine--kiew-wirft-budapest-geiselnahme-und-diebstahl-vor-37196056.html,https://www.stern.de/politik/ausland/ungarns-streit-mit-der-ukraine--kiew-wirft-budapest-geiselnahme-und-diebstahl-vor-37196056.html,0,www.stern.de,Ungarns Streit mit der Ukraine: Kiew wirft Budapest Geiselnahme und Diebstahl vor,Zwischen dem als prorussisch geltenden ungarischen Regierungschef Orban und dem ukrainischen Präsidenten Selenskyj gibt es seit langem Spannungen. Nun droht sich der Streit gefährlich hochzuschaukeln.,https://image.stern.de/37196058/t/rE/v1/w1440/r1.7778/-/06--6kbre52vhmv3axs2048jpeg---4b29daaa26487d12.jpg,2026-03-05T23:49:44Z,,"Kopiere den aktuellen Link
Zur Merkliste hinzufügen
Zwischen dem als prorussisch geltenden ungarischen Regierungschef Orban und dem ukrainischen Präsidenten Selenskyj gibt es seit langem Spannungen… [+2044 chars]",,de,'Ukraine'
https://www.zeit.de/news/2026-03/06/kiew-wirft-budapest-geiselnahme-und-diebstahl-vor,https://www.zeit.de/news/2026-03/06/kiew-wirft-budapest-geiselnahme-und-diebstahl-vor,0,www.zeit.de,Ungarns Streit mit der Ukraine: Kiew wirft Budapest Geiselnahme und Diebstahl vor,Hier finden Sie Informationen zu dem Thema „Ungarns Streit mit der Ukraine“. Lesen Sie jetzt „Kiew wirft Budapest Geiselnahme und Diebstahl vor“.,https://img.zeit.de/news/2026-03/06/kiew-wirft-budapest-geiselnahme-und-diebstahl-vor-image-group/wide__1300x731,2026-03-05T23:49:44Z,,Der Streit zwischen Ungarn und der Ukraine um den Transit von Öllieferungen aus Russland hat mit einem Geiselnahmevorwurf aus Kiew eine neue Eskalationsstufe erreicht. «Heute in Budapest haben die un… [+1828 chars],,de,'Ukraine'
https://www.tagesspiegel.de/internationales/ungarns-streit-mit-der-ukraine-kiew-wirft-budapest-geiselnahme-und-diebstahl-vor-15322186.html,https://www.tagesspiegel.de/internationales/ungarns-streit-mit-der-ukraine-kiew-wirft-budapest-geiselnahme-und-diebstahl-vor-15322186.html,0,www.tagesspiegel.de,Ungarns Streit mit der Ukraine: Kiew wirft Budapest Geiselnahme und Diebstahl vor,Zwischen dem als prorussisch geltenden ungarischen Regierungschef Orban und dem ukrainischen Präsidenten Selenskyj gibt es seit langem Spannungen. Nun droht sich der Streit gefährlich hochzuschaukeln.,https://www.tagesspiegel.de/images/15322185/alternates/BASE_16_9_W1400/1772754675000/andrij-sybiha.jpeg,2026-03-05T23:51:15Z,,Der Streit zwischen Ungarn und der Ukraine um den Transit von Öllieferungen aus Russland hat mit einem Geiselnahmevorwurf aus Kiew eine neue Eskalationsstufe erreicht. Heute in Budapest haben die ung… [+1880 chars],,de,'Ukraine'
https://www.tagesspiegel.de/internationales/nachbarstaaten-zank-ums-ol-darum-streiten-ungarn-und-die-ukraine-15322186.html,https://www.tagesspiegel.de/internationales/nachbarstaaten-zank-ums-ol-darum-streiten-ungarn-und-die-ukraine-15322186.html,0,www.tagesspiegel.de,Nachbarstaaten: Zank ums Öl: Darum streiten Ungarn und die Ukraine,"Hat der ukrainische Präsident Selenskyj dem ungarischen Regierungschef Orban mit der Armee gedroht? Im Westen sollte die Ukraine eigentlich Ruhe haben, doch es brodelt im Verhältnis zum Nachbarn.",https://www.tagesspiegel.de/images/15325537/alternates/BASE_16_9_W1400/1772802208000/viktor-orban-und-wolodymyr-selenskyj.jpeg,2026-03-05T23:51:15Z,,"Zwischen Ungarn und der Ukraine fliegen Drohungen und Beleidigungen hin und her. Es ist ein Konflikt mit vielen Facetten: Hier die von Russland mit Krieg überzogene Ukraine, dort Ungarns rechtspopuli… [+5905 chars]",,de,'Ukraine'
