index,url,valid,domain,title,description,image,published,archive,content,quote,language,keyword
https://www.morgenpost.de/wirtschaft/article240632756/Verbraucherzentrale-verklagt-Eon-und-Hansewerk-Natur.html,https://www.morgenpost.de/wirtschaft/article240632756/Verbraucherzentrale-verklagt-Eon-und-Hansewerk-Natur.html,0,www.morgenpost.de,Fernwärmepreise: Verbraucherzentrale verklagt Eon und Hansewerk Natur,Nicht nur Strom- und Gaspreise stiegen im vergangenen Jahr stark an - auch Fernwärmekunden mussten mitunter deutlich mehr zahlen. Bei zwei Anbietern hält die Verbraucherzentrale die Erhöhung für rechtswidrig und klagt.,https://img.morgenpost.de/img/wirtschaft/crop240632986/1162603959-w820-cv16_9-q85/Fernwaerme.jpg,2023-11-20T14:15:31Z,,Berlin. Die Verbraucherzentrale hat die Fernwärmeanbieter Eon und Hansewerk Natur wegen angeblich rechtswidriger Preiserhöhungen verklagt. Mit Sammelklagen wolle man Rückerstattungen für Kundinnen un… [+3120 chars],,de,'heizen'
https://www.faz.net/aktuell/wirtschaft/cdu-generalsekretaer-linnemann-bei-uns-werden-alle-steuerlich-entlastet-19327206.html,https://www.faz.net/aktuell/wirtschaft/cdu-generalsekretaer-linnemann-bei-uns-werden-alle-steuerlich-entlastet-19327206.html,0,www.faz.net,„Bei uns werden alle steuerlich entlastet“,"CDU-Generalsekretär Carsten Linnemann über die Haushaltspolitik der Regierung, die Steuerpläne der Union, was seine Partei gegen die steigenden Sozialausgaben tun will – und wieso er den Begriff „Bürgergeld“ für falsch hält.",https://media0.faz.net/ppmedia/aktuell/2874416646/1.9326850/facebook_teaser/cdu-generalsekretaer-carsten.jpg,2023-11-20T14:16:44Z,,"Herr Linnemann, mit Ihrer Klage gegen den Nachtragshaushalt haben Sie der Ampel einen Schlag versetzt. Haben bei Ihnen die Sektkorken geknallt? Haben Sie gar schon die Ministerposten verteilt? 
Nein… [+3136 chars]",,de,'heizen'
https://t3n.de/news/ios-17-2-beta-features-1590556/,https://t3n.de/news/ios-17-2-beta-features-1590556/,0,t3n.de,iOS 17.2: Diese neuen Features kommen bald aufs iPhone,"Das nächste größere Software-Update für iPhones ist in der Pipeline: Mit iOS 17.2 bringt Apple unter anderem die zur WWDC 2023 angekündigte Tagebuch-App Journal und mehr.
weiterlesen auf t3n.de",https://t3n.de/news/wp-content/uploads/2023/11/ios-17-2_beta_hero.jpg,2023-11-20T15:00:11Z,https://web.archive.org/web/20231121084200/https://t3n.de/news/ios-17-2-beta-features-1590556,"Nach dem Update auf iOS 17.1, das Ende Oktober veröffentlicht wurde und angekündigte Funktionen wie das aufgebohrte Airdrop an Bord hatte, werkelt Apple an iOS 17.2, das weitere versprochene Features… [+3529 chars]",,de,'Pipeline'
https://www.focus.de/earth/news/gastbeitrag-von-ruediger-bachmann-und-christian-bayer-das-unbeachtete-problem-des-klimageldes-und-wie-wir-es-loesen_id_249443323.html,https://www.focus.de/earth/news/gastbeitrag-von-ruediger-bachmann-und-christian-bayer-das-unbeachtete-problem-des-klimageldes-und-wie-wir-es-loesen_id_249443323.html,0,www.focus.de,Gastbeitrag von Rüdiger Bachmann und Christian Bayer - Das unbeachtete Problem des Klimageldes - und wie wir es lösen,"Ab 2027 gelten die CO2-Preis-Regeln der EU. Besonders für private Haushalte mit weniger Geld kann dies zur Belastung führen. Die Experten Rüdiger Bachmann und Christian Bayer erklären, wie übermäßige Belastung vermieden und horizontale Fairness geschaffen wer…",https://p6.focus.de/img/panorama/id_201539795/ausgleich-fuer-hoeheren-co2-preis-fehlt-ampel-streitet-ueber-versprochenes-klimageld.jpg?im=Crop%3D%280%2C250%2C1000%2C500%29%3BResize%3D%281200%2C627%29&impolicy=perceptual&quality=mediumHigh&hash=f84beb9f8afc37e0cb1264aff2de7b73ffaf37539b0385171191343f61ee258e,2023-11-20T15:55:43Z,,"Ab 2027 gelten die CO2-Preis-Regeln der EU. Besonders für private Haushalte mit weniger Geld kann dies zur Belastung führen. Die Experten Rüdiger Bachmann und Christian Bayer erklären, wie übermäßige… [+6936 chars]",,de,'heizen'
https://www.n-tv.de/politik/22-53-USA-setzen-Schlaechter-von-Butscha-auf-Sanktionsliste--article24544798.html,https://www.n-tv.de/politik/22-53-USA-setzen-Schlaechter-von-Butscha-auf-Sanktionsliste--article24544798.html,0,www.n-tv.de,"Ukraine-Krieg im Liveticker: +++ 22:53 USA setzen ""Schlächter von Butscha"" auf Sanktionsliste +++",Lesen Sie alle aktuellen Entwicklungen und Nachrichten über den russischen Angriffskrieg auf die Ukraine im Liveticker von ntv.de.,https://bilder2.n-tv.de/img/incoming/crop23332537/9041326157-cImg_16_9-w1200/Liveticker1-grau-1-Kopie.jpg,2023-11-20T19:20:00Z,,"Die US-Regierung verhängt Einreiseverbote gegen zwei russische Militärs wegen Beteiligung an ""schweren Menschenrechtsverletzungen"". Die Maßnahme betreffe zum einen Asatbek Omurbekow, der als ""Schläch… [+29030 chars]",,de,'Pipeline'
https://www.zeit.de/politik/ausland/2023-11/stoltenberg-bosnien-herzegowina-russland-einfluss-spaltung-kritik,https://www.zeit.de/politik/ausland/2023-11/stoltenberg-bosnien-herzegowina-russland-einfluss-spaltung-kritik,0,www.zeit.de,Nato: Stoltenberg kritisiert russischen Einfluss in Bosnien-Herzegowina,"Russland könnte die Abspaltung der Republika Srpska unterstützen, befürchtet der Nato-Generalsekretär. Die Sicherheit Bosnien-Herzegowinas sei aber bedeutend für Europa.",https://img.zeit.de/politik/ausland/2023-11/stoltenberg-bosnien-herzegowina-russland-einfluss-spaltung-kritik-bild/wide__1300x731,2023-11-20T19:28:19Z,,"Nato-Generalsekretär Jens Stoltenberg hat sich beunruhigt über einen möglichen russischen Einfluss in Bosnien-Herzegowina gezeigt. ""Wir sind besorgt wegen 
sezessionistischer und abspalterischer Rhe… [+2487 chars]",,de,'Sicherheit'
https://www.apfelpage.de/news/unter-ios-17-nicht-gefixt-bluetooth-attacke-laesst-iphones-immer-noch-abstuerzen/,https://www.apfelpage.de/news/unter-ios-17-nicht-gefixt-bluetooth-attacke-laesst-iphones-immer-noch-abstuerzen/,0,www.apfelpage.de,Unter iOS 17 nicht gefixt: Bluetooth-Attacke lässt iPhones immer noch abstürzen,Auch unter iOS 17 sind iPhones noch für Attacken durch modifizierte Flipper Zero-Geräte anfällig. Diese überfluten iPhones mit Unmengen an Bluetooth-Kopplungsanfragen. Dadurch frieren die iPhones ein. Apple hat offenbar noch immer nichts gegen die […],https://www.apfelpage.de/wp-content/uploads/2023/02/Bluetooth-Logo.jpg,2023-11-20T19:45:17Z,,Auch unter iOS 17 sind iPhones noch für Attacken durch modifizierte Flipper Zero-Geräte anfällig. Diese überfluten iPhones mit Unmengen an Bluetooth-Kopplungsanfragen. Dadurch frieren die iPhones ein… [+1571 chars],,de,'frieren'
https://www.zeit.de/news/2023-11/20/0-0-gegen-ukraine-italien-qualifiziert-sich-fuer-em,https://www.zeit.de/news/2023-11/20/0-0-gegen-ukraine-italien-qualifiziert-sich-fuer-em,0,www.zeit.de,Fußball: 0:0 gegen Ukraine: Italien qualifiziert sich für EM,Hier finden Sie Informationen zu dem Thema „Fußball“. Lesen Sie jetzt „0:0 gegen Ukraine: Italien qualifiziert sich für EM“.,https://img.zeit.de/news/2023-11/20/0-0-gegen-ukraine-italien-qualifiziert-sich-fuer-em-image-group/wide__1300x731,2023-11-20T21:48:23Z,https://web.archive.org/web/20231127192711/https://www.zeit.de/news/2023-11/20/0-0-gegen-ukraine-italien-qualifiziert-sich-fuer-em,"Titelverteidiger Italien hat mit etwas Zittern, aber ohne Nachsitzen das Ticket für die Fußball-EM im kommenden Sommer in Deutschland gelöst. Die Italiener holten beim 0:0 zum Abschluss der Qualifika… [+2195 chars]",,de,'Ukraine'
https://www.faz.net/aktuell/israel-krieg/liveticker-zum-krieg-in-nahost-hamas-stehen-kurz-vor-waffenstillstandsvereinbarung-mit-israel-19226976.html,https://www.faz.net/aktuell/israel-krieg/liveticker-zum-krieg-in-nahost-hamas-stehen-kurz-vor-waffenstillstandsvereinbarung-mit-israel-19226976.html,0,www.faz.net,Liveblog zum Krieg in Nahost: Hamas: Stehen kurz vor Waffenstillstandsvereinbarung mit Israel,"200 Patienten aus Indonesischem Krankenhaus im Gazastreifen evakuiert +++ 10.000 israelische Soldaten im Gazastreifen im Einsatz +++ Präsidentin des Roten Kreuz trifft in Katar Ismail Hanija, Chef der Hamas +++ alle Entwicklungen im Liveblog.",https://media1.faz.net/ppmedia/aktuell/1200795030/1.9328477/facebook_teaser/laut-hamas-chef-ismail-hanija.jpg,2023-11-21T03:30:17Z,https://web.archive.org/web/20231121034014/https://www.faz.net/aktuell/israel-krieg/liveticker-zum-krieg-in-nahost-hamas-stehen-kurz-vor-waffenstillstandsvereinbarung-mit-israel-19226976.html,Die Brics-Staaten beraten am Dienstag bei einem virtuellen Sondergipfel über den Krieg zwischen Israel und der islamistischen Hamas. An dem von Südafrikas Präsident Cyril Ramaphosa angesetzten Gipfel… [+506 chars],,de,'Krieg'
https://www.zeit.de/news/2023-11/21/gaza-krieg-bereitet-schmuck-und-uhrenbranche-sorgen,https://www.zeit.de/news/2023-11/21/gaza-krieg-bereitet-schmuck-und-uhrenbranche-sorgen,0,www.zeit.de,Konsumgüter: Gaza-Krieg bereitet Schmuck- und Uhrenbranche Sorgen,Hier finden Sie Informationen zu dem Thema „Konsumgüter“. Lesen Sie jetzt „Gaza-Krieg bereitet Schmuck- und Uhrenbranche Sorgen“.,https://img.zeit.de/news/2023-11/21/gaza-krieg-bereitet-schmuck-und-uhrenbranche-sorgen-image-group/wide__1300x731,2023-11-21T05:03:03Z,,"Der Krieg im Gazastreifen macht auch der deutschen Schmuck- und Uhrenindustrie zu schaffen. «Seit dem 7. Oktober ist in Middle East alles auf Hold gesetzt», sagte der Hauptgeschäftsführer des Bundesv… [+3600 chars]",,de,'Krieg'
https://www.zeit.de/news/2023-11/21/mehrheit-sieht-bei-buergergeld-anreiz-nicht-zu-arbeiten,https://www.zeit.de/news/2023-11/21/mehrheit-sieht-bei-buergergeld-anreiz-nicht-zu-arbeiten,0,www.zeit.de,Umfrage: Mehrheit sieht bei Bürgergeld Anreiz nicht zu arbeiten,Hier finden Sie Informationen zu dem Thema „Umfrage“. Lesen Sie jetzt „Mehrheit sieht bei Bürgergeld Anreiz nicht zu arbeiten“.,https://img.zeit.de/news/2023-11/21/mehrheit-sieht-bei-buergergeld-anreiz-nicht-zu-arbeiten-image-group/wide__1300x731,2023-11-21T05:49:47Z,https://web.archive.org/web/20231128145628/https://www.zeit.de/news/2023-11/21/mehrheit-sieht-bei-buergergeld-anreiz-nicht-zu-arbeiten,"64 Prozent der Bevölkerung fürchten, dass sich Menschen wegen der Erhöhung des Bürgergeldes zum 1. Januar gegen eine reguläre Beschäftigung entscheiden könnten. Das geht aus einer Umfrage des Meinung… [+1053 chars]",,de,'Bürgergeld'
https://www.voltairenet.org/article220038.html,https://www.voltairenet.org/article220038.html,0,www.voltairenet.org,"Die zwei Kriege des Westens, von Manlio Dinucci","Seit anderthalb Jahren betonen wir, dass der Krieg der Vereinigten Staaten in der Ukraine schwerwiegende Auswirkungen auf den Lebensstandard der Bürger der Europäischen Union hat. Auch der gegen die Zivilbevölkerung in Gaza. Letzterer wird jedoch auch der EU …",https://www.voltairenet.org/IMG/logo/400_-_1_4_-34-3.jpg?1700548033,2023-11-21T06:27:47Z,https://web.archive.org/web/20231122210316/https://www.voltairenet.org/article220038.html,"Wir befinden uns in zwei Kriegen, in Europa und im Nahen Osten, die immer schwerwiegendere Folgen für unsere Lebensbedingungen und unsere Sicherheit haben.
An der europäischen Front wurde im Septemb… [+2330 chars]",,de,'Krieg'
https://www.faz.net/aktuell/israel-krieg/liveticker-zum-krieg-in-nahost-guterres-nennt-un-protektorat-keine-loesung-fuer-gazastreifen-faz-19226976.html,https://www.faz.net/aktuell/israel-krieg/liveticker-zum-krieg-in-nahost-guterres-nennt-un-protektorat-keine-loesung-fuer-gazastreifen-faz-19226976.html,0,www.faz.net,Liveblog zum Krieg in Nahost: Guterres nennt UN-Protektorat keine Lösung für Gazastreifen,Hamas: Stehen kurz vor Waffenstillstandsvereinbarung mit Israel +++ Lager Nuseirat im Gazastreifen unter Beschuss +++ 200 Patienten aus Indonesischem Krankenhaus gerettet +++ Israelische Armee will weitere Waffenlager gefunden haben +++ alle Entwicklungen im …,https://media0.faz.net/ppmedia/aktuell/politik/1082443475/1.9328694/facebook_teaser/guterres-am-montag-in-new-york.jpg,2023-11-21T07:04:19Z,,Die Brics-Staaten beraten am Dienstag bei einem virtuellen Sondergipfel über den Krieg zwischen Israel und der islamistischen Hamas. An dem von Südafrikas Präsident Cyril Ramaphosa angesetzten Gipfel… [+506 chars],,de,'Wladimir Putin'
https://www.faz.net/aktuell/israel-krieg/liveticker-zum-krieg-in-nahost-rund-220-deutsche-koennen-offenbar-aus-gaza-ausreisen-faz-19226976.html,https://www.faz.net/aktuell/israel-krieg/liveticker-zum-krieg-in-nahost-rund-220-deutsche-koennen-offenbar-aus-gaza-ausreisen-faz-19226976.html,0,www.faz.net,Liveblog zum Krieg in Nahost: Rund 220 Deutsche können offenbar aus Gaza ausreisen,Guterres: UN-Protektorat keine Lösung für Gazastreifen +++ Hamas: Stehen kurz vor Waffenstillstandsvereinbarung mit Israel +++ Lager Nuseirat im Gazastreifen unter Beschuss +++ 200 Patienten aus Indonesischem Krankenhaus gerettet +++ alle Entwicklungen im Liv…,https://media1.faz.net/ppmedia/aktuell/politik/133644027/1.9329165/facebook_teaser/palaestinenser-inspizieren-die.jpg,2023-11-21T07:04:19Z,,Die BRICS-Staaten beraten am Dienstag bei einem virtuellen Sondergipfel über den Krieg zwischen Israel und der islamistischen Hamas. An dem von Südafrikas Präsident Cyril Ramaphosa angesetzten Gipfel… [+506 chars],,de,'Krieg'
https://www.welt.de/politik/deutschland/article248635912/Buergergeld-Mehrheit-befuerchtet-dass-Erhoehung-Anreize-setzt-nicht-arbeiten-zu-gehen-Umfrage.html,https://www.welt.de/politik/deutschland/article248635912/Buergergeld-Mehrheit-befuerchtet-dass-Erhoehung-Anreize-setzt-nicht-arbeiten-zu-gehen-Umfrage.html,0,www.welt.de,"Mehrheit befürchtet, dass die Bürgergeld-Erhöhung Anreize setzt, nicht arbeiten zu gehen","Zum Jahresanfang 2024 steigt das Bürgergeld für mehr als fünf Millionen Menschen im Schnitt um rund zwölf Prozent. Nun fürchten 64 Prozent der Bevölkerung, dass der Anreiz wächst, nicht arbeiten zu gehen. Die Parteizugehörigkeit weist in Bezug auf diese Sorge…",https://img.welt.de/img/politik/deutschland/mobile248581138/6601355437-ci16x9-w1200/Jobcenter.jpg,2023-11-21T07:11:35Z,,"64 Prozent der Bevölkerung fürchten, dass sich Menschen wegen der Erhöhung des Bürgergeldes zum 1. Januar gegen eine reguläre Beschäftigung entscheiden könnten. Das geht aus einer am Dienstag veröffe… [+1577 chars]",,de,'Bürgergeld'
https://taz.de/Demografische-Krise-in-Russland/!5971150/,https://taz.de/Demografische-Krise-in-Russland/!5971150/,0,taz.de,Demografische Krise in Russland: Dann sollen sie doch mehr gebären,"Demografieproblem? Darauf kennen Kreml und Kirche die Antwort: 20-jährige Frauen müssten eben das erste Kind bekommen, statt zu studieren.",https://taz.de/picture/6660914/948/33983422-1.jpeg,2023-11-21T09:41:00Z,,"Demografieproblem? Darauf kennen Kreml und Kirche die Antwort: 20-jährige Frauen müssten eben das erste Kind bekommen, statt zu studieren.
Präsident Putin mit Kindern der Jugendarmee am Tag der Einh… [+4290 chars]",,de,'Kreml'
https://www.tagesschau.de/wirtschaft/verbraucher/feuerwerk-importe-100.html,https://www.tagesschau.de/wirtschaft/verbraucher/feuerwerk-importe-100.html,0,www.tagesschau.de,Importe von Feuerwerkskörpern fast vervierfacht,Der Jahreswechsel dürfte wieder lauter werden: Nach der Pandemie-Flaute werden wieder deutlich mehr Feuerwerkskörper nach Deutschland importiert. Das Vor-Corona-Niveau ist aber noch nicht erreicht.,https://images.tagesschau.de/image/40d5264b-7023-4538-8a74-81206f3e3dbf/AAABi_F_6LY/AAABibBxqrQ/16x9-1280/feuerwerk-156.jpg,2023-11-21T10:49:34Z,,"Stand: 21.11.2023 11:49 Uhr
Der Jahreswechsel dürfte wieder lauter werden: Nach der Pandemie-Flaute werden wieder deutlich mehr Feuerwerkskörper nach Deutschland importiert. Das Vor-Corona-Niveau is… [+1727 chars]",,de,'Import'
https://www.stern.de/panorama/weltgeschehen/indien--hoffnung-fuer-eingeschlossene-tunnelarbeiter---retter-haben-video-kontakt-34218336.html,https://www.stern.de/panorama/weltgeschehen/indien--hoffnung-fuer-eingeschlossene-tunnelarbeiter---retter-haben-video-kontakt-34218336.html,0,www.stern.de,Himalaya: Hoffnung für eingeschlossene Tunnelarbeiter – Retter haben Video-Kontakt,Seit über einer Woche ist eine Gruppe Arbeiter in einem Tunnel im Norden Indiens eingeschlossen. Über eine Pipeline konnten Lebensmittel und Medikamente geschickt werden – nun wird ihre Bergung vorbereitet.,https://image.stern.de/34218338/t/Eo/v3/w1440/r1.7778/-/21-hoffnung-nach-tunneleinsturz---retter-haben-kontakt-zu-eingeschlossenen-6341536958112-1.jpg,2023-11-21T10:54:00Z,,Seit über einer Woche ist eine Gruppe Arbeiter in einem Tunnel im Norden Indiens eingeschlossen. Über eine Pipeline konnten Lebensmittel und Medikamente geschickt werden nun wird ihre Bergung vorbere… [+3127 chars],,de,'Pipeline'
https://www.perlentaucher.de/magazinrundschau/2023-11-21.html,https://www.perlentaucher.de/magazinrundschau/2023-11-21.html,0,www.perlentaucher.de,MAGAZINRUNDSCHAU: Während der Samtstuhl ihre Hosen warmhält,"Desk Russie zeichnet nach, wie Putin im Gaza-Krieg den Brandstifter spielt, um den Westen zu schwächen. Im Guardian erklärt der Ethnologe Andrew Kipnis, wie Urbanisierung und politische Repression dazu führen, dass in Chinas Städten der Geisterglaube so verbr…",https://www.perlentaucher.de/cdata/tfpic/14334.png,2023-11-21T10:54:46Z,,"Mit aggressiver Propaganda unterlegt das iranische Regime seine Unterstützung für die Hamas und den Kampf gegen Israel, aber in der iranischen Bevölkerung findet sich kaum noch Zustimmung, schreibt d… [+4109 chars]",,de,'Krieg'
https://www.zeit.de/news/2023-11/21/musikfest-hamburg-dreht-sich-um-krieg-und-frieden,https://www.zeit.de/news/2023-11/21/musikfest-hamburg-dreht-sich-um-krieg-und-frieden,0,www.zeit.de,Elbphilharmonie: Musikfest Hamburg dreht sich um Krieg und Frieden,Hier finden Sie Informationen zu dem Thema „Elbphilharmonie“. Lesen Sie jetzt „Musikfest Hamburg dreht sich um Krieg und Frieden“.,https://img.zeit.de/news/2023-11/21/musikfest-hamburg-dreht-sich-um-krieg-und-frieden-image-group/wide__1300x731,2023-11-21T11:53:16Z,,Die Hamburger Elbphilharmonie lädt auch 2024 wieder zu ihrem Internationalen Musikfest in das berühmte Konzerthaus und die Laeiszhalle ein. Zu den Klassik-Stars des gut fünfwöchigen Festivals gehören… [+1913 chars],,de,'Krieg'
https://www.welt.de/politik/ausland/plus248642468/Finnland-Cyberangriffe-Pipeline-Attacke-Fluechtlinge-Russlands-hybrider-Krieg-gegen-das-neue-Nato-Land.html,https://www.welt.de/politik/ausland/plus248642468/Finnland-Cyberangriffe-Pipeline-Attacke-Fluechtlinge-Russlands-hybrider-Krieg-gegen-das-neue-Nato-Land.html,0,www.welt.de,"Cyberangriffe, Pipeline-Attacke, Flüchtlinge – Russlands Rache für die Nato-Norderweiterung","Russische Beamte drängen Migranten über die Grenze nach Finnland, um die EU unter Druck zu setzen. Doch das ist nicht das einzige Gebiet, auf dem Moskau das neue Nato-Mitglied attackiert. Auch die Achilles-Ferse der finnischen Verteidigungsstrategie, die Inse…",https://img.welt.de/img/politik/ausland/mobile248645632/4641356647-ci16x9-w1200-fnov-fpotl-fpi157750653/Vier-finnisch-russische-Grenzuebergaenge-geschlossen-10.jpg,2023-11-21T12:56:07Z,https://web.archive.org/web/20231121131624/https://www.welt.de/politik/ausland/plus248642468/Finnland-Cyberangriffe-Pipeline-Attacke-Fluechtlinge-Russlands-hybrider-Krieg-gegen-das-neue-Nato-Land.html,"Die WELT als ePaper: Die vollständige Ausgabe steht Ihnen bereits am Vorabend zur Verfügung so sind Sie immer hochaktuell informiert. Weitere Informationen: http://epaper.welt.de 
 Der Kurz-Link die… [+49 chars]",,de,'Pipeline'
https://taz.de/Lkw-Proteste-in-Polen/!5974715/,https://taz.de/Lkw-Proteste-in-Polen/!5974715/,0,taz.de,Lkw-Proteste in Polen: Blockade an ukrainischer Grenze,Polnische Lkw-Fahrer protestieren seit Tagen gegen billige Konkurrenz aus der Ukraine. Spediteure fürchten nun die Pleite.,https://taz.de/picture/6661410/948/LKW-1.jpeg,2023-11-21T13:40:00Z,,"Polnische Lkw-Fahrer protestieren seit Tagen gegen billige Konkurrenz aus der Ukraine. Spediteure fürchten nun die Pleite.
Gegen Konkurrenz werden Grenzübergänge in die Ukraine blockiert, hier in Do… [+4488 chars]",,de,'frieren'
https://www.focus.de/panorama/gummersbach-messermann-bezog-buergergeld-und-lief-herum-wie-tickende-zeitbombe_id_250053966.html,https://www.focus.de/panorama/gummersbach-messermann-bezog-buergergeld-und-lief-herum-wie-tickende-zeitbombe_id_250053966.html,0,www.focus.de,Neue Details im Fall Gummersbach - Messer-Angreifer bezog Bürgergeld und lief herum „wie eine tickende Zeitbombe“,Eine Woche nach den Polizeischüssen auf einen 30-jährigen Ladendieb in Gummersbach (NRW) fördern FOCUS-online-Recherchen neue Details zu Tage. Der Deutsch-Marokkaner lebte demnach als Bürgergeld-Empfänger in einer Notunterkunft und soll bereits im Juni Polizi…,https://p6.focus.de/img/fotos/id_246106904/nach-schuessen-in-gu-80045553.jpg?im=Crop%3D%280%2C144%2C3453%2C1726%29%3BResize%3D%281200%2C627%29&impolicy=perceptual&quality=mediumHigh&hash=90c725efe4c494026bf36542d9ed94d4eb58e3ec16e644d748aba5a311a62aa1,2023-11-21T15:11:53Z,https://web.archive.org/web/20231121154041/https://www.focus.de/panorama/gummersbach-messermann-bezog-buergergeld-und-lief-herum-wie-tickende-zeitbombe_id_250053966.html,Eine Woche nach den Polizeischüssen auf einen 30-jährigen Ladendieb in Gummersbach (NRW) fördern FOCUS-online-Recherchen neue Details zu Tage. Der Deutsch-Marokkaner lebte demnach als Bürgergeld-Empf… [+4446 chars],,de,'Bürgergeld'
https://www.zeit.de/news/2023-11/21/sachsen-geht-kooperation-zur-cybersicherheit-ein,https://www.zeit.de/news/2023-11/21/sachsen-geht-kooperation-zur-cybersicherheit-ein,0,www.zeit.de,Innere Sicherheit: Sachsen geht Kooperation zur Cybersicherheit ein,Hier finden Sie Informationen zu dem Thema „Innere Sicherheit“. Lesen Sie jetzt „Sachsen geht Kooperation zur Cybersicherheit ein“.,https://img.zeit.de/news/2023-11/21/sachsen-geht-kooperation-zur-cybersicherheit-ein-image-group/wide__1300x731,2023-11-21T17:21:13Z,,"Sachsen will mit dem Bundesamt für Sicherheit in der Informationstechnik (BSI) stärker beim Thema Cyberabwehr zusammenarbeiten. Das sieht eine Kooperationsvereinbarung vor, die am Dienstag von BSI-Pr… [+832 chars]",,de,'Sicherheit'
https://www.zeit.de/wirtschaft/2023-11/verfassungsgericht-ampel-industrie-gruener-wasserstoff-ktf,https://www.zeit.de/wirtschaft/2023-11/verfassungsgericht-ampel-industrie-gruener-wasserstoff-ktf,0,www.zeit.de,Urteil des Verfassungsgerichts: Bestellt und nicht bezahlt,Batteriezellen und grüner Stahl – die Regierung hat Fördermittel in Milliardenhöhe für den Umbau der Industrie zugesagt. Jetzt fürchten die Unternehmen um ihre Projekte.,https://img.zeit.de/wirtschaft/2023-11/grossprojekte-ampel-finanzierung-industrie-gruener-bild/wide__1300x731,2023-11-21T17:36:04Z,https://web.archive.org/web/20231121180523/https://www.zeit.de/wirtschaft/2023-11/verfassungsgericht-ampel-industrie-gruener-wasserstoff-ktf,"In Rostock soll sie entstehen, ein Teil der
klimaneutralen Industriezukunft Deutschlands. Auf dem Gelände des
Steinkohlekraftwerks im Industriehafen wird ein Wasserstoff-Elektrolyseur
geplant, 100… [+360 chars]",,de,'Pipeline'
https://www.n-tv.de/politik/12-50-Arabische-Staaten-fordern-dauerhaften-Waffenstillstand--article24447017.html,https://www.n-tv.de/politik/12-50-Arabische-Staaten-fordern-dauerhaften-Waffenstillstand--article24447017.html,0,www.n-tv.de,Israel-Krieg im Liveticker: +++ 12:50 Arabische Staaten fordern dauerhaften Waffenstillstand +++,"Berlin, Washington, Brüssel - überall. ntv berichtet von allen wichtigen Schauplätzen der Innen- und Außenpolitik.",https://bilder2.n-tv.de/img/incoming/crop23332537/9041326157-cImg_16_9-w1200/Liveticker1-grau-1-Kopie.jpg,2023-11-21T23:25:00Z,,"Arabische Außenminister fordern, dass die zunächst auf vier Tage begrenzte Feuerpause ausgedehnt werden soll. Sie sollte der erste Schritt hin zu einem umfassenden Waffenstillstand sein, schlagen die… [+21557 chars]",,de,'Krieg'
https://www.n-tv.de/politik/11-56-IDF-Ungefaehr-400-Terrortunnelschaechte-freigelegt-und-zerstoert--article24447017.html,https://www.n-tv.de/politik/11-56-IDF-Ungefaehr-400-Terrortunnelschaechte-freigelegt-und-zerstoert--article24447017.html,0,www.n-tv.de,"Israel-Krieg im Liveticker: +++ 11:56 IDF: ""Ungefähr 400 Terrortunnelschächte freigelegt und zerstört"" +++","Berlin, Washington, Brüssel - überall. ntv berichtet von allen wichtigen Schauplätzen der Innen- und Außenpolitik.",https://bilder2.n-tv.de/img/incoming/crop23332537/9041326157-cImg_16_9-w1200/Liveticker1-grau-1-Kopie.jpg,2023-11-21T23:25:00Z,https://web.archive.org/web/20231123103938/https://www.n-tv.de/politik/11-56-IDF-Ungefaehr-400-Terrortunnelschaechte-freigelegt-und-zerstoert--article24447017.html,"Das israelische Militär behauptet, dass es während seiner Aktionen im Gazastreifen ""ungefähr 400 Terrortunnelschächte freigelegt und zerstört"" habe. In einer auf Telegram geposteten Nachricht heißt e… [+20402 chars]",,de,'Sicherheit'
