index,url,valid,domain,title,description,image,published,archive,content,quote,language,keyword
https://www.welt.de/politik/ausland/plus244210545/Ukraine-Hilfe-Wie-Deutschland-im-US-Wahlkampf-zum-Feindbild-wird.html,https://www.welt.de/politik/ausland/plus244210545/Ukraine-Hilfe-Wie-Deutschland-im-US-Wahlkampf-zum-Feindbild-wird.html,0,www.welt.de,Wie Deutschland im US-Wahlkampf zum Feindbild wird,"Die deutsche Botschafterin in den USA liefert sich ein spektakuläres Wortgefecht, im US-Senat wird Olaf Scholz attackiert. Es sind die Vorboten eines Wahlkampfs, in dem Deutschland-Sympathien Joe Biden gefährlich werden. Für die Bundesregierung könnten die Ze…",https://img.welt.de/img/politik/ausland/mobile244212149/3021350887-ci16x9-w1200-fnov-fpotl-fpi157750653/DWO-Teaser-Scholz-Biden-js.jpg,2023-03-10T11:13:45Z,http://archive.md/20230310114043/https://www.welt.de/politik/ausland/plus244210545/Ukraine-Hilfe-Wie-Deutschland-im-US-Wahlkampf-zum-Feindbild-wird.html,"Die WELT als ePaper: Die vollständige Ausgabe steht Ihnen bereits am Vorabend zur Verfügung so sind Sie immer hochaktuell informiert. Weitere Informationen: http://epaper.welt.de 
 Der Kurz-Link die… [+49 chars]",,de,'Olaf Scholz'
https://www.stern.de/wirtschaft/news/lage-in-deutschland--wirtschaftsverbaende--neue-strategie-fuer-globalen-erfolg-33269982.html,https://www.stern.de/wirtschaft/news/lage-in-deutschland--wirtschaftsverbaende--neue-strategie-fuer-globalen-erfolg-33269982.html,0,www.stern.de,Lage in Deutschland: Wirtschaftsverbände: Neue Strategie für globalen Erfolg,"Krieg, Energiepreise, Inflation, Bürokratie, Lieferketten, Fachkräfte, Klimawandel: Die Problemliste der deutschen Wirtschaft wird immer länger. Forderungen für die Zukunft werden lauter.",https://image.stern.de/33269984/t/Vv/v1/w1440/r1.7778/-/10--urnnewsmldpacom2009010123031099903162v3w800h600l706t130r1986b862jpeg---c2c2f406f3c72df7.jpg,2023-03-10T11:33:39Z,,"Krieg, Energiepreise, Inflation, Bürokratie, Lieferketten, Fachkräfte, Klimawandel: Die Problemliste der deutschen Wirtschaft wird immer länger. Forderungen für die Zukunft werden lauter.
Die Lage v… [+4093 chars]",,de,'Energie'
https://www.morgenpost.de/wirtschaft/article237857839/Wirtschaftsverbaende-Neue-Strategie-fuer-globalen-Erfolg.html,https://www.morgenpost.de/wirtschaft/article237857839/Wirtschaftsverbaende-Neue-Strategie-fuer-globalen-Erfolg.html,0,www.morgenpost.de,Lage in Deutschland: Wirtschaftsverbände: Neue Strategie für globalen Erfolg,"Krieg, Energiepreise, Inflation, Bürokratie, Lieferketten, Fachkräfte, Klimawandel: Die Problemliste der deutschen Wirtschaft wird immer länger. Forderungen für die Zukunft werden lauter.",https://img.morgenpost.de/img/wirtschaft/crop237857837/6512603070-w820-cv16_9-q85/Spitzengespraech-der-Deutschen-Wirtschaft.jpg,2023-03-10T11:33:39Z,,"München. Die Lage von Industrie, Handwerk und Wirtschaft ist wegen unnötiger Bürokratie, hohen Steuern und teurer Energie nach Ansicht der großen deutschen Wirtschaftsverbände überaus kritisch.
Derz… [+3870 chars]",,de,'Olaf Scholz'
https://www.welt.de/politik/deutschland/article244206273/Olaf-Scholz-verspricht-sich-Wachstum-wie-zur-Zeit-des-Wirtschaftswunders.html,https://www.welt.de/politik/deutschland/article244206273/Olaf-Scholz-verspricht-sich-Wachstum-wie-zur-Zeit-des-Wirtschaftswunders.html,0,www.welt.de,Scholz verspricht sich Wachstum wie zu Zeiten des „Wirtschaftswunders“,"Die hohen Investitionen in die Energiewende könnten Deutschland wirtschaftlichen Aufschwung bringen, glaubt Bundeskanzler Olaf Scholz. Dafür müsse jedoch schneller geplant, entschieden und genehmigt werden.",https://img.welt.de/img/politik/deutschland/mobile244164443/0161353507-ci16x9-w1200/Bundeskanzler-Scholz-besucht-Cottbus.jpg,2023-03-10T11:47:00Z,http://archive.md/20230310152844/https://www.welt.de/politik/deutschland/article244206273/Olaf-Scholz-verspricht-sich-Wachstum-wie-zur-Zeit-des-Wirtschaftswunders.html,"Bundeskanzler Olaf Scholz rechnet mit Wachstum wie zu Zeiten des Wirtschaftswunders. Wegen der hohen Investitionen in den Klimaschutz wird Deutschland für einige Zeit Wachstumsraten erzielen können, … [+2056 chars]",,de,'Energie'
https://www.stern.de/gesellschaft/regional/mecklenburg-vorpommern/kontrollgremium--information-zu-pipeline-explosionen--scholz-zufrieden-33268634.html,https://www.stern.de/gesellschaft/regional/mecklenburg-vorpommern/kontrollgremium--information-zu-pipeline-explosionen--scholz-zufrieden-33268634.html,0,www.stern.de,Kontrollgremium: Information zu Pipeline-Explosionen: Scholz zufrieden,Dem Parlamentarischen Kontrollgremium soll ein Bericht zu den Nord-Stream-Explosionen vorgestellt werden. Medienberichte hatten zuletzt für Aufregung gesorgt. Der Gremiumsvorsitzende warnt vor voreiligen Schlüssen.,https://image.stern.de/33268636/t/-O/v2/w1440/r1.7778/-/10--urnnewsmldpacom2009010123031099898576v3w800h600l640t425r1920b1278jpeg---b4cae6989e4537d2.jpg,2023-03-10T11:58:37Z,,Dem Parlamentarischen Kontrollgremium soll ein Bericht zu den Nord-Stream-Explosionen vorgestellt werden. Medienberichte hatten zuletzt für Aufregung gesorgt. Der Gremiumsvorsitzende warnt vor voreil… [+3810 chars],,de,'Olaf Scholz'
https://www.focus.de/finanzen/news/ab-2024-verbot-geplant-lohnt-es-sich-eine-neue-oel-heizung-zu-kaufen_id_187956517.html,https://www.focus.de/finanzen/news/ab-2024-verbot-geplant-lohnt-es-sich-eine-neue-oel-heizung-zu-kaufen_id_187956517.html,0,www.focus.de,"Ab 2024 Verbot geplant - Lohnt es sich, eine neue Öl-Heizung zu kaufen?","Die Bundesregierung will ab 2024 strengere Regeln für den Einbau neuer Heizungen durchsetzen. Nach einem ersten Entwurf dürfen Haushalte dann Gas- und Ölheizungen nur noch neu einbauen, wenn sie überwiegend (65 Prozent) mit erneuerbaren Energien betrieben wer…",https://p6.focus.de/img/fotos/id_121251615/oel-aufmacher-klein.jpg?im=Crop%3D%280%2C31%2C1000%2C500%29%3BResize%3D%281200%2C627%29&impolicy=perceptual&quality=medium&hash=1da8c930927c97ded998019dec41d4422b3895dafacb195023c4dcdbd7ff43a9,2023-03-10T12:36:54Z,https://web.archive.org/web/20230311093502/https://www.focus.de/finanzen/news/ab-2024-verbot-geplant-lohnt-es-sich-eine-neue-oel-heizung-zu-kaufen_id_187956517.html,"Die Bundesregierung will ab 2024 strengere Regeln für den Einbau neuer Heizungen durchsetzen. Nach einem ersten Entwurf dürfen Haushalte dann Gas- und Ölheizungen nur noch neu einbauen, wenn sie über… [+4509 chars]",,de,'Energie'
https://www.n-tv.de/politik/19-54-Litauen-Russische-Sanktionen-sind-Anerkennung-fuer-gute-Arbeit--article23143824.html,https://www.n-tv.de/politik/19-54-Litauen-Russische-Sanktionen-sind-Anerkennung-fuer-gute-Arbeit--article23143824.html,0,www.n-tv.de,Ukraine-Krieg im Liveticker: +++ 19:54 Litauen: Russische Sanktionen sind Anerkennung für gute Arbeit +++,"Berlin, Washington, Br\u00fcssel - \u00fcberall. n-tv berichtet von allen wichtigen Schaupl\u00e4tzen der Innen- und Au\u00dfenpolitik.",https://bilder2.n-tv.de/img/incoming/crop23332537/9041326157-cImg_16_9-w1200/Liveticker1-grau-1-Kopie.jpg,2023-03-10T12:45:00Z,,"Litauens Außenminister Gabrielius Landsbergis wertet die von Russland verhängten Sanktionen gegen Politiker, Personen des öffentlichen Lebens und Journalisten aus den drei baltischen Staaten als Ausz… [+25404 chars]",,de,'Olaf Scholz'
https://www.n-tv.de/politik/23-28-USA-und-EU-wollen-Unterstuetzer-Russlands-ins-Visier-nehmen--article23143824.html,https://www.n-tv.de/politik/23-28-USA-und-EU-wollen-Unterstuetzer-Russlands-ins-Visier-nehmen--article23143824.html,0,www.n-tv.de,Ukraine-Krieg im Liveticker: +++ 23:28 USA und EU wollen Unterstützer Russlands ins Visier nehmen +++,"Berlin, Washington, Br\u00fcssel - \u00fcberall. n-tv berichtet von allen wichtigen Schaupl\u00e4tzen der Innen- und Au\u00dfenpolitik.",https://bilder2.n-tv.de/img/incoming/crop23332537/9041326157-cImg_16_9-w1200/Liveticker1-grau-1-Kopie.jpg,2023-03-10T12:45:00Z,,"Die Europäische Union und die USA wollen verstärkt gegen Unterstützer des russischen Angriffskrieges vorgehen, nennen aber noch keine konkreten Maßnahmen. ""Wir unternehmen gemeinsam neue Schritte, um… [+29858 chars]",,de,'Olaf Scholz'
https://www.n-tv.de/politik/14-23-Finnische-Premierministerin-Marin-besucht-Selenskyj-in-Kiew--article23143824.html,https://www.n-tv.de/politik/14-23-Finnische-Premierministerin-Marin-besucht-Selenskyj-in-Kiew--article23143824.html,0,www.n-tv.de,Ukraine-Krieg im Liveticker: +++ 14:23 Finnische Premierministerin Marin besucht Selenskyj in Kiew +++,"Berlin, Washington, Br\u00fcssel - \u00fcberall. n-tv berichtet von allen wichtigen Schaupl\u00e4tzen der Innen- und Au\u00dfenpolitik.",https://bilder2.n-tv.de/img/incoming/crop23332537/9041326157-cImg_16_9-w1200/Liveticker1-grau-1-Kopie.jpg,2023-03-10T12:45:00Z,,Finnlands Premierministerin Sanna Marin trifft in Kiew den ukrainischen Präsidenten Wolodymyr Selenskyj. Zusammen nehmen sie an einem Gottesdienst in der St.-Michael-Kathedrale zum Gedenken an den So… [+16462 chars],,de,'Krieg'
https://www.n-tv.de/politik/19-00-USA-Russland-will-Republik-Moldau-destabilisieren--article23143824.html,https://www.n-tv.de/politik/19-00-USA-Russland-will-Republik-Moldau-destabilisieren--article23143824.html,0,www.n-tv.de,Ukraine-Krieg im Liveticker: +++ 19:00 USA: Russland will Republik Moldau destabilisieren +++,"Berlin, Washington, Br\u00fcssel - \u00fcberall. n-tv berichtet von allen wichtigen Schaupl\u00e4tzen der Innen- und Au\u00dfenpolitik.",https://bilder2.n-tv.de/img/incoming/crop23332537/9041326157-cImg_16_9-w1200/Liveticker1-grau-1-Kopie.jpg,2023-03-10T12:45:00Z,,"Russland versucht nach Erkenntnissen der US-Regierung, die Republik Moldau zu destabilisieren. ""Russland verfolgt Möglichkeiten, um die Regierung Moldaus zu schwächen, vermutlich mit dem Ziel einer r… [+23908 chars]",,de,'Ukraine'
https://www.n-tv.de/politik/21-42-Kanada-verbietet-Einfuhr-von-russischem-Aluminium-und-Stahl--article23143824.html,https://www.n-tv.de/politik/21-42-Kanada-verbietet-Einfuhr-von-russischem-Aluminium-und-Stahl--article23143824.html,0,www.n-tv.de,Ukraine-Krieg im Liveticker: +++ 21:42 Kanada verbietet Einfuhr von russischem Aluminium und Stahl +++,"Berlin, Washington, Br\u00fcssel - \u00fcberall. n-tv berichtet von allen wichtigen Schaupl\u00e4tzen der Innen- und Au\u00dfenpolitik.",https://bilder2.n-tv.de/img/incoming/crop23332537/9041326157-cImg_16_9-w1200/Liveticker1-grau-1-Kopie.jpg,2023-03-10T12:45:00Z,,"Kanada verbietet die Einfuhr aller russischen Aluminium- und Stahlprodukte, um Moskau die Möglichkeit zu nehmen, seinen Krieg gegen die Ukraine zu finanzieren. ""Die Ukraine kann und muss diesen Krieg… [+27683 chars]",,de,'Krieg'
https://www.n-tv.de/politik/21-59-Biden-und-von-der-Leyen-bekraeftigen-Unterstuetzung-fuer-die-Ukraine--article23143824.html,https://www.n-tv.de/politik/21-59-Biden-und-von-der-Leyen-bekraeftigen-Unterstuetzung-fuer-die-Ukraine--article23143824.html,0,www.n-tv.de,Ukraine-Krieg im Liveticker: +++ 21:59 Biden und von der Leyen bekräftigen Unterstützung für die Ukraine +++,"Berlin, Washington, Br\u00fcssel - \u00fcberall. n-tv berichtet von allen wichtigen Schaupl\u00e4tzen der Innen- und Au\u00dfenpolitik.",https://bilder2.n-tv.de/img/incoming/crop23332537/9041326157-cImg_16_9-w1200/Liveticker1-grau-1-Kopie.jpg,2023-03-10T12:45:00Z,,"US-Präsident Joe Biden und EU-Kommissionspräsidentin Ursula von der Leyen bekräftigen ihre Geschlossenheit bei der Unterstützung der Ukraine. ""Als Partner unterstützen wir zusammen die Ukraine, die f… [+28254 chars]",,de,'Unterstützung'
https://www.handelsblatt.com/unternehmen/energie/gasspeicher-in-deutschland-fuellstand-liegt-aktuell-bei-65-prozent/28819652.html,https://www.handelsblatt.com/unternehmen/energie/gasspeicher-in-deutschland-fuellstand-liegt-aktuell-bei-65-prozent/28819652.html,0,www.handelsblatt.com,Gasspeicher in Deutschland: Füllstand liegt aktuell bei 65 Prozent,Ein hoher Gasspeicher-Füllstand ist für Deutschlands Gasversorgung in der Energiekrise essenziell. Wie steht es aktuell um die Gasreserven? Ein Überblick.,https://www.handelsblatt.com/images/gasspeicher-in-sachsen-anhalt/28877480/2-format2003.jpg,2023-03-10T15:10:04Z,,"Gasspeicher in Sachsen-AnhaltDer Gasspeicher-Füllstand in Deutschland ist in der Energiekrise zum wichtigen Faktor geworden.
(Foto: dpa)
Düsseldorf Ein stabiler Füllstand der deutschen Gasspeicher … [+7390 chars]",,de,'Gasmangel'
https://www.zeit.de/news/2023-03/10/appell-der-landkreise-gesundheitsversorgung-bedroht,https://www.zeit.de/news/2023-03/10/appell-der-landkreise-gesundheitsversorgung-bedroht,0,www.zeit.de,Unterstützung: Appell der Landkreise: «Gesundheitsversorgung bedroht»,,,2023-03-10T15:47:23Z,https://web.archive.org/web/20230310160452/https://www.zeit.de/news/2023-03/10/appell-der-landkreise-gesundheitsversorgung-bedroht,"When browsing with ads:
We collect personal data and also transmit it to third-party providers
 that help us improve and finance our digital content. Some of the information stored on your device, … [+732 chars]",,de,'Unterstützung'
https://www.zeit.de/news/2023-03/10/woidke-sichert-tesla-chef-unterstuetzung-fuer-werksausbau-zu,https://www.zeit.de/news/2023-03/10/woidke-sichert-tesla-chef-unterstuetzung-fuer-werksausbau-zu,0,www.zeit.de,Gigafactory: Woidke sichert Tesla-Chef Unterstützung für Werksausbau zu,,,2023-03-10T16:28:22Z,https://web.archive.org/web/20230310165206/https://www.zeit.de/news/2023-03/10/woidke-sichert-tesla-chef-unterstuetzung-fuer-werksausbau-zu,"When browsing with ads:
We collect personal data and also transmit it to third-party providers
 that help us improve and finance our digital content. Some of the information stored on your device, … [+732 chars]",,de,'Unterstützung'
https://www.wiwo.de/technologie/umwelt/energiewende-scheitert-der-waermepumpen-ausbau-an-unklaren-regeln/29030688.html,https://www.wiwo.de/technologie/umwelt/energiewende-scheitert-der-waermepumpen-ausbau-an-unklaren-regeln/29030688.html,0,www.wiwo.de,Energiewende: Scheitert der Wärmepumpen-Ausbau an unklaren Regeln?,"Ob der Einbau einer Wärmepumpe klappt, hängt von zahlreichen Regeln ab. Die überfordern viele Hausbesitzer, weil jedes Bundesland eigene hat und Gerichtsurteile widersprüchlich sind. Killt die Bürokratie die Wärmewende?",https://www.wiwo.de/images/100-pro-imago-life-2-202243764-highres/29030856/1-format11240.jpg,2023-03-11T11:09:21Z,https://web.archive.org/web/20230311121803/https://www.wiwo.de/technologie/umwelt/energiewende-scheitert-der-waermepumpen-ausbau-an-unklaren-regeln/29030688.html,"Wann ist ein Gebäude ein Gebäude? Wenn es eine bestimmte Größe hat oder wenn man darin wohnen kann? Die Frage ist kein Beginn eines philosophischen Seminars, sondern entscheidend dafür, ob der Einbau… [+5613 chars]",,de,'Energie'
https://www.zeit.de/news/2023-03/11/senat-gedenkt-terroropfern-und-kuendigt-unterstuetzung-an,https://www.zeit.de/news/2023-03/11/senat-gedenkt-terroropfern-und-kuendigt-unterstuetzung-an,0,www.zeit.de,Nationaler Gedenktag: Senat gedenkt Terroropfern und kündigt Unterstützung an,,,2023-03-11T12:34:46Z,https://web.archive.org/web/20230311130934/https://www.zeit.de/news/2023-03/11/senat-gedenkt-terroropfern-und-kuendigt-unterstuetzung-an,"When browsing with ads:
We collect personal data and also transmit it to third-party providers
 that help us improve and finance our digital content. Some of the information stored on your device, … [+732 chars]",,de,'Unterstützung'
https://www.zeit.de/2023/11/schaedlingsbekaempfung-maeuse-ratten-beruf,https://www.zeit.de/2023/11/schaedlingsbekaempfung-maeuse-ratten-beruf,0,www.zeit.de,Schädlingsbekämpfung: Maus im Haus,Im Winter zieht es Ratten und Mäuse ins Warme. Wie bekämpft man sie am besten? Vier Kammerjäger sprechen über das Töten – und die Liebe zum Tier.,,2023-03-11T16:09:33Z,https://web.archive.org/web/20230311134534/http://www.zeit.de/2023/11/schaedlingsbekaempfung-maeuse-ratten-beruf,"When browsing with ads:
We collect personal data and also transmit it to third-party providers
 that help us improve and finance our digital content. Some of the information stored on your device, … [+732 chars]",,de,'Winter'
https://www.zeit.de/news/2023-03/12/krieg-gegen-die-ukraine-so-ist-die-lage,https://www.zeit.de/news/2023-03/12/krieg-gegen-die-ukraine-so-ist-die-lage,0,www.zeit.de,Russischer Angriffskrieg: Krieg gegen die Ukraine: So ist die Lage,,,2023-03-12T06:05:18Z,https://web.archive.org/web/20230312072003/https://www.zeit.de/news/2023-03/12/krieg-gegen-die-ukraine-so-ist-die-lage,"When browsing with ads:
We collect personal data and also transmit it to third-party providers
 that help us improve and finance our digital content. Some of the information stored on your device, … [+732 chars]",,de,'Krieg'
https://www.brigitte.de/mode/der-perfekte-rollkragenpullover--3-unerlaessliche-turtlenecks-13456182.html,https://www.brigitte.de/mode/der-perfekte-rollkragenpullover--3-unerlaessliche-turtlenecks-13456182.html,0,www.brigitte.de,"Der perfekte Rollkragenpullover : 3 Turtlenecks, die ihr jetzt braucht","Der Winter ist kalt, da braucht es den perfekten Rollkragenpullover, damit man nicht friert. Wir haben drei Turtlenecks, die jetzt unverzichtbar sind.",https://image.brigitte.de/13445198/t/49/v1/w1440/r1.7778/-/der-perfekte-rollkragenpullover-winter.jpg,2023-03-12T06:30:00Z,https://web.archive.org/web/20230312071109/https://www.brigitte.de/mode/der-perfekte-rollkragenpullover--3-unerlaessliche-turtlenecks-13456182.html,"Ob im Frühling, Herbst oder Winter, ein Rollkragenpullover ist immer eine gute Ergänzung zu eurer Garderobe. Er lässt nicht nur jedes Outfit stylischer wirken, sondern versprüht auch noch einen Hauch… [+2690 chars]",,de,'Winter'
https://www.welt.de/politik/deutschland/article244240325/Russischer-Einfluss-auf-Klimastiftung-CDU-will-Schwesigs-Ruecktritt.html,https://www.welt.de/politik/deutschland/article244240325/Russischer-Einfluss-auf-Klimastiftung-CDU-will-Schwesigs-Ruecktritt.html,0,www.welt.de,Russischer Einfluss – CDU fordert Rücktritt von „Gazprom-Trickserin“ Schwesig,Die Landesregierung von Mecklenburg-Vorpommern wollte mit der Klimastiftung den Bau der umstrittenen Gas-Pipeline Nord Stream 2 vorantreiben. Der Einfluss der Kreml auf die Satzung war womöglich größer als bisher angenommen,https://img.welt.de/img/politik/deutschland/mobile244229663/5601356017-ci16x9-w1200/Landesparteitag-zur-Wahl-der-des-neuen-Landesvorsitzenden-der-SPD-Mecklenburg-Vo.jpg,2023-03-12T06:51:34Z,https://web.archive.org/web/20230312070944/https://www.welt.de/politik/deutschland/article244240325/Russischer-Einfluss-auf-Klimastiftung-CDU-will-Schwesigs-Ruecktritt.html,In der Affäre um die Klimastiftung von Mecklenburg-Vorpommern zur Unterstützung der Gaspipeline Nord Stream 2 geraten Ministerpräsidentin Manuela Schwesig und Innenminister Christian Pegel (beide SPD… [+4006 chars],,de,'Gas'
https://www.zeit.de/news/2023-03/12/land-spart-fast-20-prozent-gas-in-seinen-gebaeuden,https://www.zeit.de/news/2023-03/12/land-spart-fast-20-prozent-gas-in-seinen-gebaeuden,0,www.zeit.de,Energie: Land spart fast 20 Prozent Gas in seinen Gebäuden,,,2023-03-12T09:02:17Z,https://web.archive.org/web/20230312093852/https://www.zeit.de/news/2023-03/12/land-spart-fast-20-prozent-gas-in-seinen-gebaeuden,"When browsing with ads:
We collect personal data and also transmit it to third-party providers
 that help us improve and finance our digital content. Some of the information stored on your device, … [+732 chars]",,de,'Gas'
https://www.faz.net/aktuell/politik/inland/warum-bundeskanzler-olaf-scholz-zu-viel-verspricht-18739414.html,https://www.faz.net/aktuell/politik/inland/warum-bundeskanzler-olaf-scholz-zu-viel-verspricht-18739414.html,0,www.faz.net,Kommentar zu Scholz: Die windigen Versprechen des Bundeskanzlers,"Die Ampelkoalition verbreitet frohe Botschaften: Eine Lösung der Energiekrise durch Windkraft, mit einem Wirtschaftswunder inklusive. In Wahrheit klemmt die Umsetzung an vielen Stellen.",https://media0.faz.net/ppmedia/aktuell/1377194064/1.8739410/facebook_teaser/bundeskanzler-olaf-scholz-bei.jpg,2023-03-12T10:33:23Z,http://archive.md/20230312104633/https://www.faz.net/aktuell/politik/inland/warum-bundeskanzler-olaf-scholz-zu-viel-verspricht-18739414.html,Eines kann man Olaf Scholz nicht vorwerfen: Angst vor großen Zahlen und großen Versprechen. Das jüngste Beispiel brachte der Bundeskanzler nach der Kabinettsklausur seiner Ampel in Meseberg unters Vo… [+4414 chars],,de,'frieren'
https://www.tagesspiegel.de/politik/droht-der-raucherkneipe-das-aus-initiative-fordert-bundesweites-rauchverbot-in-der-gastronomie-9487598.html,https://www.tagesspiegel.de/politik/droht-der-raucherkneipe-das-aus-initiative-fordert-bundesweites-rauchverbot-in-der-gastronomie-9487598.html,0,www.tagesspiegel.de,Droht der Raucherkneipe das Aus?: Initiative fordert bundesweites Rauchverbot in der Gastronomie,"Qualmen in der Kneipe? In Bayern undenkbar, in den meisten Bundesländern aber wegen Ausnahmeregelungen hier und da möglich. Kritiker sehen den Nichtraucherschutz unterwandert.",https://www.tagesspiegel.de/images/heegainsbourg05jpg/alternates/BASE_16_9_W1400/heegainsbourg05jpg.jpeg,2023-03-12T10:51:05Z,https://web.archive.org/web/20230312112203/https://www.tagesspiegel.de/politik/droht-der-raucherkneipe-das-aus-initiative-fordert-bundesweites-rauchverbot-in-der-gastronomie-9487598.html,"Wer eine Zigarette zum Bier möchte, kann dafür in zahlreichen deutschen Kneipen drinnen sitzenbleiben. Beim Rauchverbot in der Gastronomie gibt es in den meisten Bundesländern Ausnahmeregelungen. Nur… [+5830 chars]",,de,'Gas'
https://www.focus.de/panorama/welt/schlechte-wirtschaftliche-lage-kliniken-erwarten-einschraenkungen-fuer-patienten_id_188171702.html,https://www.focus.de/panorama/welt/schlechte-wirtschaftliche-lage-kliniken-erwarten-einschraenkungen-fuer-patienten_id_188171702.html,0,www.focus.de,Schlechte wirtschaftliche Lage - Kliniken erwarten Einschränkungen für Patienten,"Deutsche Kliniken glauben, dass sie wegen der wirtschaftlichen Situation in den kommenden sechs Monaten die medizinische Versorgung einschränken müssen.",https://p6.focus.de/img/fotos/id_188054658/gettyimages-493991213.jpg?im=Crop%3D%280%2C177%2C2119%2C1059%29%3BResize%3D%281200%2C627%29&impolicy=perceptual&quality=medium&hash=f6f7cb9cdfb486d05da30d576e24b2e01a4bca9170bb7adcaa9833fe9f60ca84,2023-03-13T00:06:15Z,https://web.archive.org/web/20230313025145/https://www.focus.de/panorama/welt/schlechte-wirtschaftliche-lage-kliniken-erwarten-einschraenkungen-fuer-patienten_id_188171702.html,"Deutsche Kliniken glauben, dass sie wegen der wirtschaftlichen Situation in den kommenden sechs Monaten die medizinische Versorgung einschränken müssen. Gut die Hälfte aller Krankenhäuser in Deutschl… [+1835 chars]",,de,'Versorgung'
https://www.tagesschau.de/inland/innenpolitik/lauterbach-long-covid-105.html,https://www.tagesschau.de/inland/innenpolitik/lauterbach-long-covid-105.html,0,www.tagesschau.de,Lauterbach verspricht Hilfe bei Corona-Langzeitfolgen,"Das Gesundheitsministerium werde ein Programm auflegen, um mögliche Langzeitfolgen nach einer Coronainfektion oder -impfung zu untersuchen, sagt Minister Lauterbach. Die Versorgung der Betroffenen müsse verbessert werden.",https://www.tagesschau.de/multimedia/bilder/lauterbach-349~_v-original.jpg,2023-03-13T03:04:39Z,https://web.archive.org/web/20230313032844/http://www.tagesschau.de/inland/innenpolitik/lauterbach-long-covid-105.html,"Das Gesundheitsministerium werde ein Programm auflegen, um mögliche Langzeitfolgen nach einer Coronainfektion oder -impfung zu untersuchen, sagt Minister Lauterbach. Die Versorgung der Betroffenen mü… [+1454 chars]",,de,'Versorgung'
https://www.welt.de/politik/deutschland/article244259769/Corona-Folgen-Lauterbach-verspricht-Hilfen-fuer-Impfgeschaedigte.html,https://www.welt.de/politik/deutschland/article244259769/Corona-Folgen-Lauterbach-verspricht-Hilfen-fuer-Impfgeschaedigte.html,0,www.welt.de,Lauterbach verspricht Hilfen für Impfgeschädigte,"Um die Versorgung von Impfgeschädigten und Long-Covid-Patienten zu verbessern, will das Gesundheitsministerium ein eigenes Programm auflegen. Experten sollen besser vernetzt werden, Langzeitfolgen schneller anerkannt werden, wie Minister Lauterbach ankündigt.",https://img.welt.de/img/politik/deutschland/mobile244259795/1151357387-ci16x9-w1200/Karl-Lauterbach.jpg,2023-03-13T03:42:59Z,https://web.archive.org/web/20230313053921/http://www.welt.de/politik/deutschland/article244259769/Corona-Folgen-Lauterbach-verspricht-Hilfen-fuer-Impfgeschaedigte.html,"Bundesgesundheitsminister Karl Lauterbach hat Hilfen für Menschen mit Langzeitschäden einer Corona-Infektion oder -Impfung zugesagt. Er werde mit dem Ministerium ein Programm auflegen, bei dem die Fo… [+1209 chars]",,de,'Versorgung'
https://www.stern.de/gesellschaft/regional/baden-wuerttemberg/industrie--heizungsboom-beschert-bosch-thermotechnik-rekordumsatz-33275672.html,https://www.stern.de/gesellschaft/regional/baden-wuerttemberg/industrie--heizungsboom-beschert-bosch-thermotechnik-rekordumsatz-33275672.html,0,www.stern.de,Industrie: Heizungsboom beschert Bosch Thermotechnik Rekordumsatz,Die Sorgen um die fossile Energieversorgung haben der Wärmepumpe vergangenes Jahr zu einem Boom verholfen. Davon profitiert auch der Hersteller Bosch Thermotechnik. Gas und Öl sind aber noch nicht abgeschrieben.,https://image.stern.de/33275674/t/II/v1/w1440/r1.7778/-/13--urnnewsmldpacom2009010123031399931441v3w800h600l317t194r1597b1000jpeg---0ca79a20714f0a00.jpg,2023-03-13T05:21:14Z,,Die Sorgen um die fossile Energieversorgung haben der Wärmepumpe vergangenes Jahr zu einem Boom verholfen. Davon profitiert auch der Hersteller Bosch Thermotechnik. Gas und Öl sind aber noch nicht ab… [+2139 chars],,de,'Industrie'
